logs/mace_models/vgg16.texture.float16.acc32.autotvm.log
{"input": ["opencl -keys=adreno,opencl,gpu -device=adreno -max_num_threads=256", "conv2d_nchwc_tpack_acc32.image2d", [["TENSOR", [1, 3, 224, 224], "float16"], ["TENSOR", [64, 3, 3, 3], "float16"], [1, 1], [1, 1, 1, 1], [1, 1], "float16"], {}], "config": {"index": 42857, "code_hash": null, "entity": [["tile_fc", "sp", [-1, 1, 16]], ["tile_y", "sp", [-1, 1, 4]], ["tile_x", "sp", [-1, 4, 8]], ["tile_rcc", "sp", [-1, 1]], ["tile_ry", "sp", [-1, 1]], ["tile_rx", "sp", [-1, 3]], ["auto_unroll_max_step", "ot", 512], ["unroll_explicit", "ot", 0]]}, "result": [[0.0013025833400000001], 0, 2.8762545585632324, 1643727716.3829408], "version": 0.2, "tvm_version": "0.8.dev0"}
{"input": ["opencl -keys=adreno,opencl,gpu -device=adreno -max_num_threads=256", "conv2d_nchwc_acc32.image2d", [["TENSOR", [1, 16, 224, 224, 4], "float16"], ["TENSOR", [16, 64, 3, 3, 4], "float16"], [1, 1], [1, 1, 1, 1], [1, 1], "float16"], {}], "config": {"index": 451583, "code_hash": null, "entity": [["tile_fc", "sp", [-1, 1, 16]], ["tile_y", "sp", [-1, 2, 4]], ["tile_x", "sp", [-1, 7, 2]], ["tile_rcc", "sp", [-1, 1]], ["tile_ry", "sp", [-1, 1]], ["tile_rx", "sp", [-1, 3]], ["auto_unroll_max_step", "ot", 0], ["unroll_explicit", "ot", 1]]}, "result": [[0.00919504166], 0, 5.752497434616089, 1643732024.27632], "version": 0.2, "tvm_version": "0.8.dev0"}
{"input": ["opencl -keys=adreno,opencl,gpu -device=adreno -max_num_threads=256", "conv2d_nchwc_acc32.image2d", [["TENSOR", [1, 16, 112, 112, 4], "float16"], ["TENSOR", [32, 64, 3, 3, 4], "float16"], [1, 1], [1, 1, 1, 1], [1, 1], "float16"], {}], "config": {"index": 22439, "code_hash": null, "entity": [["tile_fc", "sp", [-1, 1, 8]], ["tile_y", "sp", [-1, 4, 4]], ["tile_x", "sp", [-1, 1, 2]], ["tile_rcc", "sp", [-1, 8]], ["tile_ry", "sp", [-1, 1]], ["tile_rx", "sp", [-1, 1]], ["auto_unroll_max_step", "ot", 0], ["unroll_explicit", "ot", 0]]}, "result": [[0.00464012916], 0, 3.313321828842163, 1643736962.0117536], "version": 0.2, "tvm_version": "0.8.dev0"}
{"input": ["opencl -keys=adreno,opencl,gpu -device=adreno -max_num_threads=256", "conv2d_nchwc_acc32.image2d", [["TENSOR", [1, 32, 112, 112, 4], "float16"], ["TENSOR", [32, 128, 3, 3, 4], "float16"], [1, 1], [1, 1, 1, 1], [1, 1], "float16"], {}], "config": {"index": 560291, "code_hash": null, "entity": [["tile_fc", "sp", [-1, 1, 16]], ["tile_y", "sp", [-1, 2, 8]], ["tile_x", "sp", [-1, 2, 1]], ["tile_rcc", "sp", [-1, 1]], ["tile_ry", "sp", [-1, 3]], ["tile_rx", "sp", [-1, 1]], ["auto_unroll_max_step", "ot", 0], ["unroll_explicit", "ot", 1]]}, "result": [[0.009366433319999999], 0, 4.203978061676025, 1643740679.679288], "version": 0.2, "tvm_version": "0.8.dev0"}
{"input": ["opencl -keys=adreno,opencl,gpu -device=adreno -max_num_threads=256", "conv2d_nchwc_acc32.image2d", [["TENSOR", [1, 32, 56, 56, 4], "float16"], ["TENSOR", [64, 128, 3, 3, 4], "float16"], [1, 1], [1, 1, 1, 1], [1, 1], "float16"], {}], "config": {"index": 411311, "code_hash": null, "entity": [["tile_fc", "sp", [-1, 1, 16]], ["tile_y", "sp", [-1, 2, 2]], ["tile_x", "sp", [-1, 2, 4]], ["tile_rcc", "sp", [-1, 16]], ["tile_ry", "sp", [-1, 1]], ["tile_rx", "sp", [-1, 1]], ["auto_unroll_max_step", "ot", 0], ["unroll_explicit", "ot", 1]]}, "result": [[0.00464026042], 0, 3.134835720062256, 1643744764.6664565], "version": 0.2, "tvm_version": "0.8.dev0"}
{"input": ["opencl -keys=adreno,opencl,gpu -device=adreno -max_num_threads=256", "conv2d_nchwc_acc32.image2d", [["TENSOR", [1, 64, 56, 56, 4], "float16"], ["TENSOR", [64, 256, 3, 3, 4], "float16"], [1, 1], [1, 1, 1, 1], [1, 1], "float16"], {}], "config": {"index": 466017, "code_hash": null, "entity": [["tile_fc", "sp", [-1, 1, 32]], ["tile_y", "sp", [-1, 2, 2]], ["tile_x", "sp", [-1, 2, 7]], ["tile_rcc", "sp", [-1, 4]], ["tile_ry", "sp", [-1, 1]], ["tile_rx", "sp", [-1, 1]], ["auto_unroll_max_step", "ot", 0], ["unroll_explicit", "ot", 1]]}, "result": [[0.0095667698], 0, 49.12332820892334, 1643750766.464004], "version": 0.2, "tvm_version": "0.8.dev0"}
{"input": ["opencl -keys=adreno,opencl,gpu -device=adreno -max_num_threads=256", "conv2d_nchwc_acc32.image2d", [["TENSOR", [1, 64, 28, 28, 4], "float16"], ["TENSOR", [128, 256, 3, 3, 4], "float16"], [1, 1], [1, 1, 1, 1], [1, 1], "float16"], {}], "config": {"index": 21044, "code_hash": null, "entity": [["tile_fc", "sp", [-1, 1, 16]], ["tile_y", "sp", [-1, 1, 4]], ["tile_x", "sp", [-1, 4, 7]], ["tile_rcc", "sp", [-1, 1]], ["tile_ry", "sp", [-1, 3]], ["tile_rx", "sp", [-1, 1]], ["auto_unroll_max_step", "ot", 0], ["unroll_explicit", "ot", 0]]}, "result": [[0.005100875], 0, 5.028874158859253, 1643753892.2410963], "version": 0.2, "tvm_version": "0.8.dev0"}
{"input": ["opencl -keys=adreno,opencl,gpu -device=adreno -max_num_threads=256", "conv2d_nchwc_acc32.image2d", [["TENSOR", [1, 128, 28, 28, 4], "float16"], ["TENSOR", [128, 512, 3, 3, 4], "float16"], [1, 1], [1, 1, 1, 1], [1, 1], "float16"], {}], "config": {"index": 23688, "code_hash": null, "entity": [["tile_fc", "sp", [-1, 1, 32]], ["tile_y", "sp", [-1, 1, 2]], ["tile_x", "sp", [-1, 4, 7]], ["tile_rcc", "sp", [-1, 1]], ["tile_ry", "sp", [-1, 3]], ["tile_rx", "sp", [-1, 1]], ["auto_unroll_max_step", "ot", 0], ["unroll_explicit", "ot", 0]]}, "result": [[0.01026322604], 0, 7.67936372756958, 1643759100.949704], "version": 0.2, "tvm_version": "0.8.dev0"}
{"input": ["opencl -keys=adreno,opencl,gpu -device=adreno -max_num_threads=256", "conv2d_nchwc_acc32.image2d", [["TENSOR", [1, 128, 14, 14, 4], "float16"], ["TENSOR", [128, 512, 3, 3, 4], "float16"], [1, 1], [1, 1, 1, 1], [1, 1], "float16"], {}], "config": {"index": 300367, "code_hash": null, "entity": [["tile_fc", "sp", [-1, 1, 32]], ["tile_y", "sp", [-1, 1, 2]], ["tile_x", "sp", [-1, 8, 2]], ["tile_rcc", "sp", [-1, 1]], ["tile_ry", "sp", [-1, 1]], ["tile_rx", "sp", [-1, 3]], ["auto_unroll_max_step", "ot", 0], ["unroll_explicit", "ot", 1]]}, "result": [[0.0032618218799999998], 0, 6.046490669250488, 1643763177.1475983], "version": 0.2, "tvm_version": "0.8.dev0"}
{"input": ["opencl -keys=adreno,opencl,gpu -device=adreno -max_num_threads=256", "dense_small_batch.cuda", [["TENSOR", [1, 4096], "float16"], ["TENSOR", [4096, 4096], "float16"], null, "float16"], {}], "config": {"index": 7, "code_hash": null, "entity": [["tile_k", "sp", [-1, 128]]]}, "result": [[0.00150482708], 0, 15.004341125488281, 1643763944.8846536], "version": 0.2, "tvm_version": "0.8.dev0"}
{"input": ["opencl -keys=adreno,opencl,gpu -device=adreno -max_num_threads=256", "dense_small_batch.cuda", [["TENSOR", [1, 4096], "float16"], ["TENSOR", [1000, 4096], "float16"], null, "float16"], {}], "config": {"index": 6, "code_hash": null, "entity": [["tile_k", "sp", [-1, 64]]]}, "result": [[0.00040477708], 0, 2.2003135681152344, 1643764050.5612833], "version": 0.2, "tvm_version": "0.8.dev0"}
