logs_8gen2/mace_deeplabv3.texture.float16_acc32.autotvm.log.tmp
{"input": ["opencl -keys=adreno,opencl,gpu -device=adreno -max_function_args=128 -max_num_threads=256 -max_shared_memory_per_block=16384 -max_threads_per_block=256 -texture_spatial_limit=16384 -thread_warp_size=1", "conv2d_nhwc.image2d", [["TENSOR", [1, 65, 65, 256], "float16"], ["TENSOR", [1, 1, 256, 21], "float16"], [1, 1], [0, 0, 0, 0], [1, 1], "float32"], {}], "config": {"index": 5909, "code_hash": null, "entity": [["tile_fc", "sp", [-1, 1, 6]], ["tile_y", "sp", [-1, 1, 4]], ["tile_x", "sp", [-1, 2, 2]], ["tile_rcc", "sp", [-1, 16]], ["tile_ry", "sp", [-1, 1]], ["tile_rx", "sp", [-1, 1]], ["auto_unroll_max_step", "ot", 512], ["unroll_explicit", "ot", 1]]}, "result": [[0.03588562944], 0, 7.970972537994385, 1692839625.3524644], "version": 0.2, "tvm_version": "0.14.dev0"}
{"input": ["opencl -keys=adreno,opencl,gpu -device=adreno -max_function_args=128 -max_num_threads=256 -max_shared_memory_per_block=16384 -max_threads_per_block=256 -texture_spatial_limit=16384 -thread_warp_size=1", "conv2d_nhwc.image2d", [["TENSOR", [1, 65, 65, 256], "float16"], ["TENSOR", [1, 1, 256, 21], "float16"], [1, 1], [0, 0, 0, 0], [1, 1], "float32"], {}], "config": {"index": 6239, "code_hash": null, "entity": [["tile_fc", "sp", [-1, 1, 6]], ["tile_y", "sp", [-1, 1, 4]], ["tile_x", "sp", [-1, 1, 2]], ["tile_rcc", "sp", [-1, 64]], ["tile_ry", "sp", [-1, 1]], ["tile_rx", "sp", [-1, 1]], ["auto_unroll_max_step", "ot", 512], ["unroll_explicit", "ot", 1]]}, "result": [[0.00034041344], 0, 9.194949388504028, 1692839626.6332743], "version": 0.2, "tvm_version": "0.14.dev0"}
{"input": ["opencl -keys=adreno,opencl,gpu -device=adreno -max_function_args=128 -max_num_threads=256 -max_shared_memory_per_block=16384 -max_threads_per_block=256 -texture_spatial_limit=16384 -thread_warp_size=1", "conv2d_nhwc.image2d", [["TENSOR", [1, 65, 65, 256], "float16"], ["TENSOR", [1, 1, 256, 21], "float16"], [1, 1], [0, 0, 0, 0], [1, 1], "float32"], {}], "config": {"index": 536, "code_hash": null, "entity": [["tile_fc", "sp", [-1, 3, 2]], ["tile_y", "sp", [-1, 1, 4]], ["tile_x", "sp", [-1, 1, 4]], ["tile_rcc", "sp", [-1, 4]], ["tile_ry", "sp", [-1, 1]], ["tile_rx", "sp", [-1, 1]], ["auto_unroll_max_step", "ot", 0], ["unroll_explicit", "ot", 0]]}, "result": [[0.00042635264], 0, 0.9574601650238037, 1692839618.456647], "version": 0.2, "tvm_version": "0.14.dev0"}
{"input": ["opencl -keys=adreno,opencl,gpu -device=adreno -max_function_args=128 -max_num_threads=256 -max_shared_memory_per_block=16384 -max_threads_per_block=256 -texture_spatial_limit=16384 -thread_warp_size=1", "conv2d_nhwc.image2d", [["TENSOR", [1, 65, 65, 256], "float16"], ["TENSOR", [1, 1, 256, 21], "float16"], [1, 1], [0, 0, 0, 0], [1, 1], "float32"], {}], "config": {"index": 5579, "code_hash": null, "entity": [["tile_fc", "sp", [-1, 1, 6]], ["tile_y", "sp", [-1, 1, 4]], ["tile_x", "sp", [-1, 1, 4]], ["tile_rcc", "sp", [-1, 4]], ["tile_ry", "sp", [-1, 1]], ["tile_rx", "sp", [-1, 1]], ["auto_unroll_max_step", "ot", 512], ["unroll_explicit", "ot", 1]]}, "result": [[0.00035564543999999995], 0, 18.656994342803955, 1692839636.1222353], "version": 0.2, "tvm_version": "0.14.dev0"}
{"input": ["opencl -keys=adreno,opencl,gpu -device=adreno -max_function_args=128 -max_num_threads=256 -max_shared_memory_per_block=16384 -max_threads_per_block=256 -texture_spatial_limit=16384 -thread_warp_size=1", "conv2d_nhwc.image2d", [["TENSOR", [1, 65, 65, 256], "float16"], ["TENSOR", [1, 1, 256, 21], "float16"], [1, 1], [0, 0, 0, 0], [1, 1], "float32"], {}], "config": {"index": 3389, "code_hash": null, "entity": [["tile_fc", "sp", [-1, 1, 6]], ["tile_y", "sp", [-1, 1, 4]], ["tile_x", "sp", [-1, 2, 2]], ["tile_rcc", "sp", [-1, 16]], ["tile_ry", "sp", [-1, 1]], ["tile_rx", "sp", [-1, 1]], ["auto_unroll_max_step", "ot", 1500], ["unroll_explicit", "ot", 0]]}, "result": [[0.0005338367999999999], 0, 17.606122732162476, 1692839635.1340663], "version": 0.2, "tvm_version": "0.14.dev0"}
{"input": ["opencl -keys=adreno,opencl,gpu -device=adreno -max_function_args=128 -max_num_threads=256 -max_shared_memory_per_block=16384 -max_threads_per_block=256 -texture_spatial_limit=16384 -thread_warp_size=1", "conv2d_nhwc.image2d", [["TENSOR", [1, 65, 65, 256], "float16"], ["TENSOR", [1, 1, 256, 21], "float16"], [1, 1], [0, 0, 0, 0], [1, 1], "float32"], {}], "config": {"index": 6649, "code_hash": null, "entity": [["tile_fc", "sp", [-1, 1, 6]], ["tile_y", "sp", [-1, 1, 2]], ["tile_x", "sp", [-1, 1, 4]], ["tile_rcc", "sp", [-1, 2]], ["tile_ry", "sp", [-1, 1]], ["tile_rx", "sp", [-1, 1]], ["auto_unroll_max_step", "ot", 1500], ["unroll_explicit", "ot", 1]]}, "result": [[0.00033374208000000005], 0, 11.421980142593384, 1692839628.8920374], "version": 0.2, "tvm_version": "0.14.dev0"}
{"input": ["opencl -keys=adreno,opencl,gpu -device=adreno -max_function_args=128 -max_num_threads=256 -max_shared_memory_per_block=16384 -max_threads_per_block=256 -texture_spatial_limit=16384 -thread_warp_size=1", "conv2d_nhwc.image2d", [["TENSOR", [1, 65, 65, 256], "float16"], ["TENSOR", [1, 1, 256, 21], "float16"], [1, 1], [0, 0, 0, 0], [1, 1], "float32"], {}], "config": {"index": 6959, "code_hash": null, "entity": [["tile_fc", "sp", [-1, 1, 6]], ["tile_y", "sp", [-1, 1, 4]], ["tile_x", "sp", [-1, 1, 2]], ["tile_rcc", "sp", [-1, 8]], ["tile_ry", "sp", [-1, 1]], ["tile_rx", "sp", [-1, 1]], ["auto_unroll_max_step", "ot", 1500], ["unroll_explicit", "ot", 1]]}, "result": [[0.00033946624000000004], 0, 19.821279048919678, 1692839637.3127465], "version": 0.2, "tvm_version": "0.14.dev0"}
{"input": ["opencl -keys=adreno,opencl,gpu -device=adreno -max_function_args=128 -max_num_threads=256 -max_shared_memory_per_block=16384 -max_threads_per_block=256 -texture_spatial_limit=16384 -thread_warp_size=1", "conv2d_nhwc.image2d", [["TENSOR", [1, 65, 65, 256], "float16"], ["TENSOR", [1, 1, 256, 21], "float16"], [1, 1], [0, 0, 0, 0], [1, 1], "float32"], {}], "config": {"index": 4858, "code_hash": null, "entity": [["tile_fc", "sp", [-1, 2, 3]], ["tile_y", "sp", [-1, 1, 4]], ["tile_x", "sp", [-1, 1, 4]], ["tile_rcc", "sp", [-1, 32]], ["tile_ry", "sp", [-1, 1]], ["tile_rx", "sp", [-1, 1]], ["auto_unroll_max_step", "ot", 0], ["unroll_explicit", "ot", 1]]}, "result": [[0.0007131750400000001], 0, 10.278044700622559, 1692839627.79935], "version": 0.2, "tvm_version": "0.14.dev0"}
{"input": ["opencl -keys=adreno,opencl,gpu -device=adreno -max_function_args=128 -max_num_threads=256 -max_shared_memory_per_block=16384 -max_threads_per_block=256 -texture_spatial_limit=16384 -thread_warp_size=1", "conv2d_nhwc.image2d", [["TENSOR", [1, 65, 65, 256], "float16"], ["TENSOR", [1, 1, 256, 21], "float16"], [1, 1], [0, 0, 0, 0], [1, 1], "float32"], {}], "config": {"index": 7375, "code_hash": null, "entity": [["tile_fc", "sp", [-1, 1, 2]], ["tile_y", "sp", [-1, 1, 4]], ["tile_x", "sp", [-1, 1, 4]], ["tile_rcc", "sp", [-1, 32]], ["tile_ry", "sp", [-1, 1]], ["tile_rx", "sp", [-1, 1]], ["auto_unroll_max_step", "ot", 1500], ["unroll_explicit", "ot", 1]]}, "result": [[0.0006057113600000001], 0, 12.700342893600464, 1692839630.2082872], "version": 0.2, "tvm_version": "0.14.dev0"}
{"input": ["opencl -keys=adreno,opencl,gpu -device=adreno -max_function_args=128 -max_num_threads=256 -max_shared_memory_per_block=16384 -max_threads_per_block=256 -texture_spatial_limit=16384 -thread_warp_size=1", "conv2d_nhwc.image2d", [["TENSOR", [1, 65, 65, 256], "float16"], ["TENSOR", [1, 1, 256, 21], "float16"], [1, 1], [0, 0, 0, 0], [1, 1], "float32"], {}], "config": {"index": 6116, "code_hash": null, "entity": [["tile_fc", "sp", [-1, 3, 2]], ["tile_y", "sp", [-1, 1, 4]], ["tile_x", "sp", [-1, 1, 4]], ["tile_rcc", "sp", [-1, 32]], ["tile_ry", "sp", [-1, 1]], ["tile_rx", "sp", [-1, 1]], ["auto_unroll_max_step", "ot", 512], ["unroll_explicit", "ot", 1]]}, "result": [[0.01655550976], 0, 17.00158166885376, 1692839633.9688356], "version": 0.2, "tvm_version": "0.14.dev0"}
{"input": ["opencl -keys=adreno,opencl,gpu -device=adreno -max_function_args=128 -max_num_threads=256 -max_shared_memory_per_block=16384 -max_threads_per_block=256 -texture_spatial_limit=16384 -thread_warp_size=1", "conv2d_nhwc.image2d", [["TENSOR", [1, 65, 65, 256], "float16"], ["TENSOR", [1, 1, 256, 21], "float16"], [1, 1], [0, 0, 0, 0], [1, 1], "float32"], {}], "config": {"index": 6834, "code_hash": null, "entity": [["tile_fc", "sp", [-1, 1, 6]], ["tile_y", "sp", [-1, 2, 2]], ["tile_x", "sp", [-1, 1, 4]], ["tile_rcc", "sp", [-1, 4]], ["tile_ry", "sp", [-1, 1]], ["tile_rx", "sp", [-1, 1]], ["auto_unroll_max_step", "ot", 1500], ["unroll_explicit", "ot", 1]]}, "result": [[0.036220917760000006], 0, 32.388347864151, 1692839649.7943969], "version": 0.2, "tvm_version": "0.14.dev0"}
