logs/conv2d_NCHWc_KCRSk_tx_tune.texture.noshared.log
{"input": ["opencl -keys=opencl,gpu -max_num_threads=256", "conv2d_NCHWc_KCRSk_tx_tune", [[1, 32, 56, 56, 4], [32, 128, 1, 1, 4]], {}], "config": {"index": 1181242, "code_hash": null, "entity": [["tile_fc", "sp", [-1, 2, 8, 2]], ["tile_y", "sp", [-1, 7, 2, 4]], ["tile_x", "sp", [-1, 7, 8, 1]], ["tile_rcc", "sp", [-1, 8]], ["tile_ry", "sp", [-1, 1]], ["tile_rx", "sp", [-1, 1]], ["auto_unroll_max_step", "ot", 0], ["unroll_explicit", "ot", 0]]}, "result": [[0.15656218733333332], 0, 3.6806328296661377, 1611813457.662473], "version": 0.2, "tvm_version": "0.8.dev0"}
{"input": ["opencl -keys=opencl,gpu -max_num_threads=256", "conv2d_NCHWc_KCRSk_tx_tune", [[1, 32, 56, 56, 4], [32, 128, 1, 1, 4]], {}], "config": {"index": 12867140, "code_hash": null, "entity": [["tile_fc", "sp", [-1, 1, 32, 1]], ["tile_y", "sp", [-1, 4, 2, 1]], ["tile_x", "sp", [-1, 4, 1, 14]], ["tile_rcc", "sp", [-1, 32]], ["tile_ry", "sp", [-1, 1]], ["tile_rx", "sp", [-1, 1]], ["auto_unroll_max_step", "ot", 1500], ["unroll_explicit", "ot", 1]]}, "result": [[0.342970382], 0, 10.808431625366211, 1611813464.4837472], "version": 0.2, "tvm_version": "0.8.dev0"}
{"input": ["opencl -keys=opencl,gpu -max_num_threads=256", "conv2d_NCHWc_KCRSk_tx_tune", [[1, 32, 56, 56, 4], [32, 128, 1, 1, 4]], {}], "config": {"index": 12235719, "code_hash": null, "entity": [["tile_fc", "sp", [-1, 1, 1, 32]], ["tile_y", "sp", [-1, 1, 4, 1]], ["tile_x", "sp", [-1, 7, 2, 1]], ["tile_rcc", "sp", [-1, 16]], ["tile_ry", "sp", [-1, 1]], ["tile_rx", "sp", [-1, 1]], ["auto_unroll_max_step", "ot", 1500], ["unroll_explicit", "ot", 1]]}, "result": [[0.8046516836666666], 0, 22.256194829940796, 1611813475.6448338], "version": 0.2, "tvm_version": "0.8.dev0"}
{"input": ["opencl -keys=opencl,gpu -max_num_threads=256", "conv2d_NCHWc_KCRSk_tx_tune", [[1, 32, 56, 56, 4], [32, 128, 1, 1, 4]], {}], "config": {"index": 10078144, "code_hash": null, "entity": [["tile_fc", "sp", [-1, 4, 1, 8]], ["tile_y", "sp", [-1, 2, 14, 2]], ["tile_x", "sp", [-1, 2, 2, 1]], ["tile_rcc", "sp", [-1, 16]], ["tile_ry", "sp", [-1, 1]], ["tile_rx", "sp", [-1, 1]], ["auto_unroll_max_step", "ot", 512], ["unroll_explicit", "ot", 1]]}, "result": [[0.48133628466666667], 0, 30.87901473045349, 1611813484.1990814], "version": 0.2, "tvm_version": "0.8.dev0"}
{"input": ["opencl -keys=opencl,gpu -max_num_threads=256", "conv2d_NCHWc_KCRSk_tx_tune", [[1, 32, 56, 56, 4], [32, 128, 1, 1, 4]], {}], "config": {"index": 8122788, "code_hash": null, "entity": [["tile_fc", "sp", [-1, 2, 4, 4]], ["tile_y", "sp", [-1, 2, 2, 1]], ["tile_x", "sp", [-1, 7, 2, 4]], ["tile_rcc", "sp", [-1, 16]], ["tile_ry", "sp", [-1, 1]], ["tile_rx", "sp", [-1, 1]], ["auto_unroll_max_step", "ot", 0], ["unroll_explicit", "ot", 1]]}, "result": [[0.10377286466666667], 0, 44.21618127822876, 1611813498.2801812], "version": 0.2, "tvm_version": "0.8.dev0"}
{"input": ["opencl -keys=opencl,gpu -max_num_threads=256", "conv2d_NCHWc_KCRSk_tx_tune", [[1, 32, 56, 56, 4], [32, 128, 1, 1, 4]], {}], "config": {"index": 11043232, "code_hash": null, "entity": [["tile_fc", "sp", [-1, 4, 4, 2]], ["tile_y", "sp", [-1, 1, 1, 1]], ["tile_x", "sp", [-1, 2, 4, 7]], ["tile_rcc", "sp", [-1, 1]], ["tile_ry", "sp", [-1, 1]], ["tile_rx", "sp", [-1, 1]], ["auto_unroll_max_step", "ot", 1500], ["unroll_explicit", "ot", 1]]}, "result": [[0.3353235936666667], 0, 42.175830364227295, 1611813495.948197], "version": 0.2, "tvm_version": "0.8.dev0"}
{"input": ["opencl -keys=opencl,gpu -max_num_threads=256", "conv2d_NCHWc_KCRSk_tx_tune", [[1, 32, 56, 56, 4], [32, 128, 1, 1, 4]], {}], "config": {"index": 3550642, "code_hash": null, "entity": [["tile_fc", "sp", [-1, 1, 16, 1]], ["tile_y", "sp", [-1, 4, 7, 2]], ["tile_x", "sp", [-1, 4, 1, 14]], ["tile_rcc", "sp", [-1, 8]], ["tile_ry", "sp", [-1, 1]], ["tile_rx", "sp", [-1, 1]], ["auto_unroll_max_step", "ot", 512], ["unroll_explicit", "ot", 0]]}, "result": [[0.14615373266666667], 0, 46.63686227798462, 1611813500.9618435], "version": 0.2, "tvm_version": "0.8.dev0"}
{"input": ["opencl -keys=opencl,gpu -max_num_threads=256", "conv2d_NCHWc_KCRSk_tx_tune", [[1, 32, 56, 56, 4], [32, 128, 1, 1, 4]], {}], "config": {"index": 287886, "code_hash": null, "entity": [["tile_fc", "sp", [-1, 1, 1, 8]], ["tile_y", "sp", [-1, 4, 7, 1]], ["tile_x", "sp", [-1, 1, 4, 7]], ["tile_rcc", "sp", [-1, 1]], ["tile_ry", "sp", [-1, 1]], ["tile_rx", "sp", [-1, 1]], ["auto_unroll_max_step", "ot", 0], ["unroll_explicit", "ot", 0]]}, "result": [[0.06323342], 0, 48.52944016456604, 1611813502.8835692], "version": 0.2, "tvm_version": "0.8.dev0"}
{"input": ["opencl -keys=opencl,gpu -max_num_threads=256", "conv2d_NCHWc_KCRSk_tx_tune", [[1, 32, 56, 56, 4], [32, 128, 1, 1, 4]], {}], "config": {"index": 10788147, "code_hash": null, "entity": [["tile_fc", "sp", [-1, 2, 2, 2]], ["tile_y", "sp", [-1, 14, 1, 1]], ["tile_x", "sp", [-1, 1, 2, 1]], ["tile_rcc", "sp", [-1, 1]], ["tile_ry", "sp", [-1, 1]], ["tile_rx", "sp", [-1, 1]], ["auto_unroll_max_step", "ot", 1500], ["unroll_explicit", "ot", 1]]}, "result": [[0.13648314233333333], 0, 51.52659797668457, 1611813505.684291], "version": 0.2, "tvm_version": "0.8.dev0"}
{"input": ["opencl -keys=opencl,gpu -max_num_threads=256", "conv2d_NCHWc_KCRSk_tx_tune", [[1, 32, 56, 56, 4], [32, 128, 1, 1, 4]], {}], "config": {"index": 8943143, "code_hash": null, "entity": [["tile_fc", "sp", [-1, 1, 1, 32]], ["tile_y", "sp", [-1, 1, 7, 1]], ["tile_x", "sp", [-1, 1, 1, 28]], ["tile_rcc", "sp", [-1, 1]], ["tile_ry", "sp", [-1, 1]], ["tile_rx", "sp", [-1, 1]], ["auto_unroll_max_step", "ot", 512], ["unroll_explicit", "ot", 1]]}, "result": [[0.035482656], 0, 64.94272685050964, 1611813519.158414], "version": 0.2, "tvm_version": "0.8.dev0"}
{"input": ["opencl -keys=opencl,gpu -max_num_threads=256", "conv2d_NCHWc_KCRSk_tx_tune", [[1, 32, 56, 56, 4], [32, 128, 1, 1, 4]], {}], "config": {"index": 4767312, "code_hash": null, "entity": [["tile_fc", "sp", [-1, 4, 4, 2]], ["tile_y", "sp", [-1, 4, 2, 1]], ["tile_x", "sp", [-1, 1, 14, 1]], ["tile_rcc", "sp", [-1, 2]], ["tile_ry", "sp", [-1, 1]], ["tile_rx", "sp", [-1, 1]], ["auto_unroll_max_step", "ot", 1500], ["unroll_explicit", "ot", 0]]}, "result": [[0.0038639063333333334], 0, 95.00073671340942, 1611813549.334724], "version": 0.2, "tvm_version": "0.8.dev0"}
{"input": ["opencl -keys=opencl,gpu -max_num_threads=256", "conv2d_NCHWc_KCRSk_tx_tune", [[1, 32, 56, 56, 4], [32, 128, 1, 1, 4]], {}], "config": {"index": 3365092, "code_hash": null, "entity": [["tile_fc", "sp", [-1, 1, 1, 16]], ["tile_y", "sp", [-1, 4, 2, 1]], ["tile_x", "sp", [-1, 2, 1, 2]], ["tile_rcc", "sp", [-1, 8]], ["tile_ry", "sp", [-1, 1]], ["tile_rx", "sp", [-1, 1]], ["auto_unroll_max_step", "ot", 512], ["unroll_explicit", "ot", 0]]}, "result": [[0.099168941], 0, 93.73182845115662, 1611813548.0734472], "version": 0.2, "tvm_version": "0.8.dev0"}
{"input": ["opencl -keys=opencl,gpu -max_num_threads=256", "conv2d_NCHWc_KCRSk_tx_tune", [[1, 32, 56, 56, 4], [32, 128, 1, 1, 4]], {}], "config": {"index": 7705635, "code_hash": null, "entity": [["tile_fc", "sp", [-1, 1, 16, 2]], ["tile_y", "sp", [-1, 1, 1, 1]], ["tile_x", "sp", [-1, 1, 4, 2]], ["tile_rcc", "sp", [-1, 8]], ["tile_ry", "sp", [-1, 1]], ["tile_rx", "sp", [-1, 1]], ["auto_unroll_max_step", "ot", 0], ["unroll_explicit", "ot", 1]]}, "result": [[0.0019873263333333334], 0, 96.12468266487122, 1611813550.524549], "version": 0.2, "tvm_version": "0.8.dev0"}
{"input": ["opencl -keys=opencl,gpu -max_num_threads=256", "conv2d_NCHWc_KCRSk_tx_tune", [[1, 32, 56, 56, 4], [32, 128, 1, 1, 4]], {}], "config": {"index": 8141305, "code_hash": null, "entity": [["tile_fc", "sp", [-1, 16, 1, 2]], ["tile_y", "sp", [-1, 4, 7, 1]], ["tile_x", "sp", [-1, 1, 1, 7]], ["tile_rcc", "sp", [-1, 16]], ["tile_ry", "sp", [-1, 1]], ["tile_rx", "sp", [-1, 1]], ["auto_unroll_max_step", "ot", 0], ["unroll_explicit", "ot", 1]]}, "result": [[0.16137810733333333], 0, 99.26166892051697, 1611813553.6382387], "version": 0.2, "tvm_version": "0.8.dev0"}
{"input": ["opencl -keys=opencl,gpu -max_num_threads=256", "conv2d_NCHWc_KCRSk_tx_tune", [[1, 32, 56, 56, 4], [32, 128, 1, 1, 4]], {}], "config": {"index": 12787645, "code_hash": null, "entity": [["tile_fc", "sp", [-1, 1, 8, 4]], ["tile_y", "sp", [-1, 1, 1, 2]], ["tile_x", "sp", [-1, 1, 7, 4]], ["tile_rcc", "sp", [-1, 32]], ["tile_ry", "sp", [-1, 1]], ["tile_rx", "sp", [-1, 1]], ["auto_unroll_max_step", "ot", 1500], ["unroll_explicit", "ot", 1]]}, "result": [[0.014309826333333333], 0, 3.722414016723633, 1611813561.3142302], "version": 0.2, "tvm_version": "0.8.dev0"}
{"input": ["opencl -keys=opencl,gpu -max_num_threads=256", "conv2d_NCHWc_KCRSk_tx_tune", [[1, 32, 56, 56, 4], [32, 128, 1, 1, 4]], {}], "config": {"index": 2456273, "code_hash": null, "entity": [["tile_fc", "sp", [-1, 2, 1, 1]], ["tile_y", "sp", [-1, 1, 8, 1]], ["tile_x", "sp", [-1, 7, 1, 8]], ["tile_rcc", "sp", [-1, 1]], ["tile_ry", "sp", [-1, 1]], ["tile_rx", "sp", [-1, 1]], ["auto_unroll_max_step", "ot", 512], ["unroll_explicit", "ot", 0]]}, "result": [[0.11079755200000001], 0, 5.72008752822876, 1611813563.4350116], "version": 0.2, "tvm_version": "0.8.dev0"}
{"input": ["opencl -keys=opencl,gpu -max_num_threads=256", "conv2d_NCHWc_KCRSk_tx_tune", [[1, 32, 56, 56, 4], [32, 128, 1, 1, 4]], {}], "config": {"index": 723979, "code_hash": null, "entity": [["tile_fc", "sp", [-1, 1, 4, 1]], ["tile_y", "sp", [-1, 1, 1, 4]], ["tile_x", "sp", [-1, 2, 1, 1]], ["tile_rcc", "sp", [-1, 4]], ["tile_ry", "sp", [-1, 1]], ["tile_rx", "sp", [-1, 1]], ["auto_unroll_max_step", "ot", 0], ["unroll_explicit", "ot", 0]]}, "result": [[0.011467257], 0, 6.808121681213379, 1611813564.8208032], "version": 0.2, "tvm_version": "0.8.dev0"}
{"input": ["opencl -keys=opencl,gpu -max_num_threads=256", "conv2d_NCHWc_KCRSk_tx_tune", [[1, 32, 56, 56, 4], [32, 128, 1, 1, 4]], {}], "config": {"index": 9388067, "code_hash": null, "entity": [["tile_fc", "sp", [-1, 8, 1, 1]], ["tile_y", "sp", [-1, 4, 7, 2]], ["tile_x", "sp", [-1, 2, 4, 1]], ["tile_rcc", "sp", [-1, 4]], ["tile_ry", "sp", [-1, 1]], ["tile_rx", "sp", [-1, 1]], ["auto_unroll_max_step", "ot", 512], ["unroll_explicit", "ot", 1]]}, "result": [[0.36465531233333337], 0, 13.137212038040161, 1611813570.4384146], "version": 0.2, "tvm_version": "0.8.dev0"}
{"input": ["opencl -keys=opencl,gpu -max_num_threads=256", "conv2d_NCHWc_KCRSk_tx_tune", [[1, 32, 56, 56, 4], [32, 128, 1, 1, 4]], {}], "config": {"index": 2273568, "code_hash": null, "entity": [["tile_fc", "sp", [-1, 8, 1, 2]], ["tile_y", "sp", [-1, 14, 2, 2]], ["tile_x", "sp", [-1, 1, 28, 1]], ["tile_rcc", "sp", [-1, 1]], ["tile_ry", "sp", [-1, 1]], ["tile_rx", "sp", [-1, 1]], ["auto_unroll_max_step", "ot", 512], ["unroll_explicit", "ot", 0]]}, "result": [[0.142019948], 0, 15.99505877494812, 1611813573.3442469], "version": 0.2, "tvm_version": "0.8.dev0"}
{"input": ["opencl -keys=opencl,gpu -max_num_threads=256", "conv2d_NCHWc_KCRSk_tx_tune", [[1, 32, 56, 56, 4], [32, 128, 1, 1, 4]], {}], "config": {"index": 719550, "code_hash": null, "entity": [["tile_fc", "sp", [-1, 1, 2, 1]], ["tile_y", "sp", [-1, 2, 1, 4]], ["tile_x", "sp", [-1, 1, 1, 1]], ["tile_rcc", "sp", [-1, 4]], ["tile_ry", "sp", [-1, 1]], ["tile_rx", "sp", [-1, 1]], ["auto_unroll_max_step", "ot", 0], ["unroll_explicit", "ot", 0]]}, "result": [[0.02191821166666667], 0, 16.952985048294067, 1611813574.9437745], "version": 0.2, "tvm_version": "0.8.dev0"}
{"input": ["opencl -keys=opencl,gpu -max_num_threads=256", "conv2d_NCHWc_KCRSk_tx_tune", [[1, 32, 56, 56, 4], [32, 128, 1, 1, 4]], {}], "config": {"index": 7893771, "code_hash": null, "entity": [["tile_fc", "sp", [-1, 1, 4, 1]], ["tile_y", "sp", [-1, 1, 1, 1]], ["tile_x", "sp", [-1, 4, 1, 1]], ["tile_rcc", "sp", [-1, 16]], ["tile_ry", "sp", [-1, 1]], ["tile_rx", "sp", [-1, 1]], ["auto_unroll_max_step", "ot", 0], ["unroll_explicit", "ot", 1]]}, "result": [[0.010635625000000001], 0, 18.515594959259033, 1611813576.2610366], "version": 0.2, "tvm_version": "0.8.dev0"}
{"input": ["opencl -keys=opencl,gpu -max_num_threads=256", "conv2d_NCHWc_KCRSk_tx_tune", [[1, 32, 56, 56, 4], [32, 128, 1, 1, 4]], {}], "config": {"index": 3330330, "code_hash": null, "entity": [["tile_fc", "sp", [-1, 16, 2, 1]], ["tile_y", "sp", [-1, 1, 1, 2]], ["tile_x", "sp", [-1, 7, 8, 1]], ["tile_rcc", "sp", [-1, 8]], ["tile_ry", "sp", [-1, 1]], ["tile_rx", "sp", [-1, 1]], ["auto_unroll_max_step", "ot", 512], ["unroll_explicit", "ot", 0]]}, "result": [[0.09847980899999999], 0, 24.276549577713013, 1611813582.0408034], "version": 0.2, "tvm_version": "0.8.dev0"}
{"input": ["opencl -keys=opencl,gpu -max_num_threads=256", "conv2d_NCHWc_KCRSk_tx_tune", [[1, 32, 56, 56, 4], [32, 128, 1, 1, 4]], {}], "config": {"index": 4037834, "code_hash": null, "entity": [["tile_fc", "sp", [-1, 16, 2, 1]], ["tile_y", "sp", [-1, 1, 14, 1]], ["tile_x", "sp", [-1, 8, 7, 1]], ["tile_rcc", "sp", [-1, 32]], ["tile_ry", "sp", [-1, 1]], ["tile_rx", "sp", [-1, 1]], ["auto_unroll_max_step", "ot", 512], ["unroll_explicit", "ot", 0]]}, "result": [[0.096363698], 0, 26.49546527862549, 1611813584.2735057], "version": 0.2, "tvm_version": "0.8.dev0"}
{"input": ["opencl -keys=opencl,gpu -max_num_threads=256", "conv2d_NCHWc_KCRSk_tx_tune", [[1, 32, 56, 56, 4], [32, 128, 1, 1, 4]], {}], "config": {"index": 4895961, "code_hash": null, "entity": [["tile_fc", "sp", [-1, 1, 2, 8]], ["tile_y", "sp", [-1, 1, 1, 8]], ["tile_x", "sp", [-1, 1, 2, 4]], ["tile_rcc", "sp", [-1, 2]], ["tile_ry", "sp", [-1, 1]], ["tile_rx", "sp", [-1, 1]], ["auto_unroll_max_step", "ot", 1500], ["unroll_explicit", "ot", 0]]}, "result": [[0.086741823], 0, 28.557260274887085, 1611813586.3395038], "version": 0.2, "tvm_version": "0.8.dev0"}
{"input": ["opencl -keys=opencl,gpu -max_num_threads=256", "conv2d_NCHWc_KCRSk_tx_tune", [[1, 32, 56, 56, 4], [32, 128, 1, 1, 4]], {}], "config": {"index": 4558470, "code_hash": null, "entity": [["tile_fc", "sp", [-1, 8, 4, 1]], ["tile_y", "sp", [-1, 7, 4, 2]], ["tile_x", "sp", [-1, 1, 1, 7]], ["tile_rcc", "sp", [-1, 1]], ["tile_ry", "sp", [-1, 1]], ["tile_rx", "sp", [-1, 1]], ["auto_unroll_max_step", "ot", 1500], ["unroll_explicit", "ot", 0]]}, "result": [[0.11810576366666665], 0, 32.64011263847351, 1611813590.2828047], "version": 0.2, "tvm_version": "0.8.dev0"}
{"input": ["opencl -keys=opencl,gpu -max_num_threads=256", "conv2d_NCHWc_KCRSk_tx_tune", [[1, 32, 56, 56, 4], [32, 128, 1, 1, 4]], {}], "config": {"index": 12299154, "code_hash": null, "entity": [["tile_fc", "sp", [-1, 4, 2, 4]], ["tile_y", "sp", [-1, 1, 28, 1]], ["tile_x", "sp", [-1, 2, 14, 1]], ["tile_rcc", "sp", [-1, 16]], ["tile_ry", "sp", [-1, 1]], ["tile_rx", "sp", [-1, 1]], ["auto_unroll_max_step", "ot", 1500], ["unroll_explicit", "ot", 1]]}, "result": [[0.017207552333333334], 0, 34.142109870910645, 1611813591.795415], "version": 0.2, "tvm_version": "0.8.dev0"}
{"input": ["opencl -keys=opencl,gpu -max_num_threads=256", "conv2d_NCHWc_KCRSk_tx_tune", [[1, 32, 56, 56, 4], [32, 128, 1, 1, 4]], {}], "config": {"index": 8912787, "code_hash": null, "entity": [["tile_fc", "sp", [-1, 1, 4, 8]], ["tile_y", "sp", [-1, 1, 2, 2]], ["tile_x", "sp", [-1, 1, 7, 8]], ["tile_rcc", "sp", [-1, 1]], ["tile_ry", "sp", [-1, 1]], ["tile_rx", "sp", [-1, 1]], ["auto_unroll_max_step", "ot", 512], ["unroll_explicit", "ot", 1]]}, "result": [[0.389097795], 0, 42.37785220146179, 1611813599.7910903], "version": 0.2, "tvm_version": "0.8.dev0"}
{"input": ["opencl -keys=opencl,gpu -max_num_threads=256", "conv2d_NCHWc_KCRSk_tx_tune", [[1, 32, 56, 56, 4], [32, 128, 1, 1, 4]], {}], "config": {"index": 4173534, "code_hash": null, "entity": [["tile_fc", "sp", [-1, 2, 1, 2]], ["tile_y", "sp", [-1, 1, 28, 2]], ["tile_x", "sp", [-1, 14, 1, 4]], ["tile_rcc", "sp", [-1, 32]], ["tile_ry", "sp", [-1, 1]], ["tile_rx", "sp", [-1, 1]], ["auto_unroll_max_step", "ot", 512], ["unroll_explicit", "ot", 0]]}, "result": [[0.11106265633333333], 0, 44.64580464363098, 1611813602.3178854], "version": 0.2, "tvm_version": "0.8.dev0"}
{"input": ["opencl -keys=opencl,gpu -max_num_threads=256", "conv2d_NCHWc_KCRSk_tx_tune", [[1, 32, 56, 56, 4], [32, 128, 1, 1, 4]], {}], "config": {"index": 5871688, "code_hash": null, "entity": [["tile_fc", "sp", [-1, 4, 4, 2]], ["tile_y", "sp", [-1, 14, 1, 4]], ["tile_x", "sp", [-1, 1, 1, 2]], ["tile_rcc", "sp", [-1, 16]], ["tile_ry", "sp", [-1, 1]], ["tile_rx", "sp", [-1, 1]], ["auto_unroll_max_step", "ot", 1500], ["unroll_explicit", "ot", 0]]}, "result": [[0.14766315966666668], 0, 48.62354803085327, 1611813606.3071392], "version": 0.2, "tvm_version": "0.8.dev0"}
{"input": ["opencl -keys=opencl,gpu -max_num_threads=256", "conv2d_NCHWc_KCRSk_tx_tune", [[1, 32, 56, 56, 4], [32, 128, 1, 1, 4]], {}], "config": {"index": 7230175, "code_hash": null, "entity": [["tile_fc", "sp", [-1, 1, 8, 1]], ["tile_y", "sp", [-1, 1, 1, 14]], ["tile_x", "sp", [-1, 28, 2, 1]], ["tile_rcc", "sp", [-1, 4]], ["tile_ry", "sp", [-1, 1]], ["tile_rx", "sp", [-1, 1]], ["auto_unroll_max_step", "ot", 0], ["unroll_explicit", "ot", 1]]}, "result": [[0.11108533], 0, 50.89963388442993, 1611813608.721948], "version": 0.2, "tvm_version": "0.8.dev0"}
{"input": ["opencl -keys=opencl,gpu -max_num_threads=256", "conv2d_NCHWc_KCRSk_tx_tune", [[1, 32, 56, 56, 4], [32, 128, 1, 1, 4]], {}], "config": {"index": 7559302, "code_hash": null, "entity": [["tile_fc", "sp", [-1, 1, 4, 2]], ["tile_y", "sp", [-1, 1, 28, 1]], ["tile_x", "sp", [-1, 56, 1, 1]], ["tile_rcc", "sp", [-1, 8]], ["tile_ry", "sp", [-1, 1]], ["tile_rx", "sp", [-1, 1]], ["auto_unroll_max_step", "ot", 0], ["unroll_explicit", "ot", 1]]}, "result": [[0.07518875], 0, 52.82720422744751, 1611813610.678638], "version": 0.2, "tvm_version": "0.8.dev0"}
{"input": ["opencl -keys=opencl,gpu -max_num_threads=256", "conv2d_NCHWc_KCRSk_tx_tune", [[1, 32, 56, 56, 4], [32, 128, 1, 1, 4]], {}], "config": {"index": 9866793, "code_hash": null, "entity": [["tile_fc", "sp", [-1, 2, 2, 4]], ["tile_y", "sp", [-1, 4, 1, 2]], ["tile_x", "sp", [-1, 1, 7, 2]], ["tile_rcc", "sp", [-1, 8]], ["tile_ry", "sp", [-1, 1]], ["tile_rx", "sp", [-1, 1]], ["auto_unroll_max_step", "ot", 512], ["unroll_explicit", "ot", 1]]}, "result": [[0.378483524], 0, 7.230278730392456, 1611813620.175067], "version": 0.2, "tvm_version": "0.8.dev0"}
{"input": ["opencl -keys=opencl,gpu -max_num_threads=256", "conv2d_NCHWc_KCRSk_tx_tune", [[1, 32, 56, 56, 4], [32, 128, 1, 1, 4]], {}], "config": {"index": 5749527, "code_hash": null, "entity": [["tile_fc", "sp", [-1, 2, 2, 1]], ["tile_y", "sp", [-1, 1, 1, 2]], ["tile_x", "sp", [-1, 7, 1, 1]], ["tile_rcc", "sp", [-1, 16]], ["tile_ry", "sp", [-1, 1]], ["tile_rx", "sp", [-1, 1]], ["auto_unroll_max_step", "ot", 1500], ["unroll_explicit", "ot", 0]]}, "result": [[0.05832197933333333], 0, 42.76430010795593, 1611813656.2567408], "version": 0.2, "tvm_version": "0.8.dev0"}
{"input": ["opencl -keys=opencl,gpu -max_num_threads=256", "conv2d_NCHWc_KCRSk_tx_tune", [[1, 32, 56, 56, 4], [32, 128, 1, 1, 4]], {}], "config": {"index": 6677217, "code_hash": null, "entity": [["tile_fc", "sp", [-1, 2, 1, 1]], ["tile_y", "sp", [-1, 1, 2, 2]], ["tile_x", "sp", [-1, 7, 1, 4]], ["tile_rcc", "sp", [-1, 1]], ["tile_ry", "sp", [-1, 1]], ["tile_rx", "sp", [-1, 1]], ["auto_unroll_max_step", "ot", 0], ["unroll_explicit", "ot", 1]]}, "result": [[0.08575175333333333], 0, 51.07533288002014, 1611813664.5971804], "version": 0.2, "tvm_version": "0.8.dev0"}
{"input": ["opencl -keys=opencl,gpu -max_num_threads=256", "conv2d_NCHWc_KCRSk_tx_tune", [[1, 32, 56, 56, 4], [32, 128, 1, 1, 4]], {}], "config": {"index": 4393639, "code_hash": null, "entity": [["tile_fc", "sp", [-1, 2, 1, 8]], ["tile_y", "sp", [-1, 1, 1, 7]], ["tile_x", "sp", [-1, 4, 7, 1]], ["tile_rcc", "sp", [-1, 1]], ["tile_ry", "sp", [-1, 1]], ["tile_rx", "sp", [-1, 1]], ["auto_unroll_max_step", "ot", 1500], ["unroll_explicit", "ot", 0]]}, "result": [[0.08209013899999999], 0, 52.969733476638794, 1611813666.6739936], "version": 0.2, "tvm_version": "0.8.dev0"}
{"input": ["opencl -keys=opencl,gpu -max_num_threads=256", "conv2d_NCHWc_KCRSk_tx_tune", [[1, 32, 56, 56, 4], [32, 128, 1, 1, 4]], {}], "config": {"index": 3458826, "code_hash": null, "entity": [["tile_fc", "sp", [-1, 4, 2, 4]], ["tile_y", "sp", [-1, 8, 1, 1]], ["tile_x", "sp", [-1, 1, 2, 4]], ["tile_rcc", "sp", [-1, 8]], ["tile_ry", "sp", [-1, 1]], ["tile_rx", "sp", [-1, 1]], ["auto_unroll_max_step", "ot", 512], ["unroll_explicit", "ot", 0]]}, "result": [[0.092511632], 0, 55.45733857154846, 1611813668.9066718], "version": 0.2, "tvm_version": "0.8.dev0"}
{"input": ["opencl -keys=opencl,gpu -max_num_threads=256", "conv2d_NCHWc_KCRSk_tx_tune", [[1, 32, 56, 56, 4], [32, 128, 1, 1, 4]], {}], "config": {"index": 10076429, "code_hash": null, "entity": [["tile_fc", "sp", [-1, 4, 4, 1]], ["tile_y", "sp", [-1, 7, 4, 1]], ["tile_x", "sp", [-1, 2, 2, 1]], ["tile_rcc", "sp", [-1, 16]], ["tile_ry", "sp", [-1, 1]], ["tile_rx", "sp", [-1, 1]], ["auto_unroll_max_step", "ot", 512], ["unroll_explicit", "ot", 1]]}, "result": [[0.10539053799999999], 0, 59.153552293777466, 1611813672.5524342], "version": 0.2, "tvm_version": "0.8.dev0"}
{"input": ["opencl -keys=opencl,gpu -max_num_threads=256", "conv2d_NCHWc_KCRSk_tx_tune", [[1, 32, 56, 56, 4], [32, 128, 1, 1, 4]], {}], "config": {"index": 3846610, "code_hash": null, "entity": [["tile_fc", "sp", [-1, 1, 2, 2]], ["tile_y", "sp", [-1, 2, 1, 4]], ["tile_x", "sp", [-1, 2, 1, 7]], ["tile_rcc", "sp", [-1, 16]], ["tile_ry", "sp", [-1, 1]], ["tile_rx", "sp", [-1, 1]], ["auto_unroll_max_step", "ot", 512], ["unroll_explicit", "ot", 0]]}, "result": [[0.13769097233333333], 0, 61.585575580596924, 1611813675.1652665], "version": 0.2, "tvm_version": "0.8.dev0"}
{"input": ["opencl -keys=opencl,gpu -max_num_threads=256", "conv2d_NCHWc_KCRSk_tx_tune", [[1, 32, 56, 56, 4], [32, 128, 1, 1, 4]], {}], "config": {"index": 305906, "code_hash": null, "entity": [["tile_fc", "sp", [-1, 2, 8, 2]], ["tile_y", "sp", [-1, 1, 8, 1]], ["tile_x", "sp", [-1, 7, 1, 8]], ["tile_rcc", "sp", [-1, 1]], ["tile_ry", "sp", [-1, 1]], ["tile_rx", "sp", [-1, 1]], ["auto_unroll_max_step", "ot", 0], ["unroll_explicit", "ot", 0]]}, "result": [[0.11289498266666666], 0, 63.85818409919739, 1611813677.4450305], "version": 0.2, "tvm_version": "0.8.dev0"}
{"input": ["opencl -keys=opencl,gpu -max_num_threads=256", "conv2d_NCHWc_KCRSk_tx_tune", [[1, 32, 56, 56, 4], [32, 128, 1, 1, 4]], {}], "config": {"index": 11245288, "code_hash": null, "entity": [["tile_fc", "sp", [-1, 1, 2, 4]], ["tile_y", "sp", [-1, 1, 2, 1]], ["tile_x", "sp", [-1, 1, 1, 2]], ["tile_rcc", "sp", [-1, 2]], ["tile_ry", "sp", [-1, 1]], ["tile_rx", "sp", [-1, 1]], ["auto_unroll_max_step", "ot", 1500], ["unroll_explicit", "ot", 1]]}, "result": [[0.10620215266666666], 0, 67.1215147972107, 1611813680.0889733], "version": 0.2, "tvm_version": "0.8.dev0"}
{"input": ["opencl -keys=opencl,gpu -max_num_threads=256", "conv2d_NCHWc_KCRSk_tx_tune", [[1, 32, 56, 56, 4], [32, 128, 1, 1, 4]], {}], "config": {"index": 2298190, "code_hash": null, "entity": [["tile_fc", "sp", [-1, 1, 2, 1]], ["tile_y", "sp", [-1, 1, 1, 56]], ["tile_x", "sp", [-1, 4, 1, 2]], ["tile_rcc", "sp", [-1, 1]], ["tile_ry", "sp", [-1, 1]], ["tile_rx", "sp", [-1, 1]], ["auto_unroll_max_step", "ot", 512], ["unroll_explicit", "ot", 0]]}, "result": [[0.074183073], 0, 68.32056999206543, 1611813682.0766504], "version": 0.2, "tvm_version": "0.8.dev0"}
{"input": ["opencl -keys=opencl,gpu -max_num_threads=256", "conv2d_NCHWc_KCRSk_tx_tune", [[1, 32, 56, 56, 4], [32, 128, 1, 1, 4]], {}], "config": {"index": 5359839, "code_hash": null, "entity": [["tile_fc", "sp", [-1, 4, 1, 2]], ["tile_y", "sp", [-1, 2, 1, 2]], ["tile_x", "sp", [-1, 1, 1, 28]], ["tile_rcc", "sp", [-1, 4]], ["tile_ry", "sp", [-1, 1]], ["tile_rx", "sp", [-1, 1]], ["auto_unroll_max_step", "ot", 1500], ["unroll_explicit", "ot", 0]]}, "result": [[0.13327180566666666], 0, 71.04855275154114, 1611813684.625204], "version": 0.2, "tvm_version": "0.8.dev0"}
{"input": ["opencl -keys=opencl,gpu -max_num_threads=256", "conv2d_NCHWc_KCRSk_tx_tune", [[1, 32, 56, 56, 4], [32, 128, 1, 1, 4]], {}], "config": {"index": 6390419, "code_hash": null, "entity": [["tile_fc", "sp", [-1, 1, 16, 2]], ["tile_y", "sp", [-1, 14, 1, 2]], ["tile_x", "sp", [-1, 1, 8, 7]], ["tile_rcc", "sp", [-1, 32]], ["tile_ry", "sp", [-1, 1]], ["tile_rx", "sp", [-1, 1]], ["auto_unroll_max_step", "ot", 1500], ["unroll_explicit", "ot", 0]]}, "result": [[0.134400191], 0, 73.78523659706116, 1611813687.365887], "version": 0.2, "tvm_version": "0.8.dev0"}
{"input": ["opencl -keys=opencl,gpu -max_num_threads=256", "conv2d_NCHWc_KCRSk_tx_tune", [[1, 32, 56, 56, 4], [32, 128, 1, 1, 4]], {}], "config": {"index": 7071966, "code_hash": null, "entity": [["tile_fc", "sp", [-1, 1, 2, 1]], ["tile_y", "sp", [-1, 1, 14, 2]], ["tile_x", "sp", [-1, 2, 1, 7]], ["tile_rcc", "sp", [-1, 2]], ["tile_ry", "sp", [-1, 1]], ["tile_rx", "sp", [-1, 1]], ["auto_unroll_max_step", "ot", 0], ["unroll_explicit", "ot", 1]]}, "result": [[0.029505746333333333], 0, 75.34584355354309, 1611813689.0026722], "version": 0.2, "tvm_version": "0.8.dev0"}
{"input": ["opencl -keys=opencl,gpu -max_num_threads=256", "conv2d_NCHWc_KCRSk_tx_tune", [[1, 32, 56, 56, 4], [32, 128, 1, 1, 4]], {}], "config": {"index": 6985137, "code_hash": null, "entity": [["tile_fc", "sp", [-1, 1, 8, 2]], ["tile_y", "sp", [-1, 1, 4, 1]], ["tile_x", "sp", [-1, 14, 2, 2]], ["tile_rcc", "sp", [-1, 2]], ["tile_ry", "sp", [-1, 1]], ["tile_rx", "sp", [-1, 1]], ["auto_unroll_max_step", "ot", 0], ["unroll_explicit", "ot", 1]]}, "result": [[0.130132743], 0, 78.22048163414001, 1611813691.7102125], "version": 0.2, "tvm_version": "0.8.dev0"}
{"input": ["opencl -keys=opencl,gpu -max_num_threads=256", "conv2d_NCHWc_KCRSk_tx_tune", [[1, 32, 56, 56, 4], [32, 128, 1, 1, 4]], {}], "config": {"index": 4821800, "code_hash": null, "entity": [["tile_fc", "sp", [-1, 4, 4, 2]], ["tile_y", "sp", [-1, 7, 8, 1]], ["tile_x", "sp", [-1, 1, 2, 2]], ["tile_rcc", "sp", [-1, 2]], ["tile_ry", "sp", [-1, 1]], ["tile_rx", "sp", [-1, 1]], ["auto_unroll_max_step", "ot", 1500], ["unroll_explicit", "ot", 0]]}, "result": [[0.12164522533333333], 0, 99.12134981155396, 1611813712.7158794], "version": 0.2, "tvm_version": "0.8.dev0"}
{"input": ["opencl -keys=opencl,gpu -max_num_threads=256", "conv2d_NCHWc_KCRSk_tx_tune", [[1, 32, 56, 56, 4], [32, 128, 1, 1, 4]], {}], "config": {"index": 8007023, "code_hash": null, "entity": [["tile_fc", "sp", [-1, 2, 4, 2]], ["tile_y", "sp", [-1, 1, 8, 1]], ["tile_x", "sp", [-1, 1, 28, 1]], ["tile_rcc", "sp", [-1, 16]], ["tile_ry", "sp", [-1, 1]], ["tile_rx", "sp", [-1, 1]], ["auto_unroll_max_step", "ot", 0], ["unroll_explicit", "ot", 1]]}, "result": [[0.002520225666666667], 0, 79.33714747428894, 1611813692.971237], "version": 0.2, "tvm_version": "0.8.dev0"}
{"input": ["opencl -keys=opencl,gpu -max_num_threads=256", "conv2d_NCHWc_KCRSk_tx_tune", [[1, 32, 56, 56, 4], [32, 128, 1, 1, 4]], {}], "config": {"index": 64816, "code_hash": null, "entity": [["tile_fc", "sp", [-1, 8, 1, 2]], ["tile_y", "sp", [-1, 2, 2, 2]], ["tile_x", "sp", [-1, 1, 4, 1]], ["tile_rcc", "sp", [-1, 1]], ["tile_ry", "sp", [-1, 1]], ["tile_rx", "sp", [-1, 1]], ["auto_unroll_max_step", "ot", 0], ["unroll_explicit", "ot", 0]]}, "result": [[0.09699630199999999], 0, 96.58831477165222, 1611813710.178411], "version": 0.2, "tvm_version": "0.8.dev0"}
{"input": ["opencl -keys=opencl,gpu -max_num_threads=256", "conv2d_NCHWc_KCRSk_tx_tune", [[1, 32, 56, 56, 4], [32, 128, 1, 1, 4]], {}], "config": {"index": 11870731, "code_hash": null, "entity": [["tile_fc", "sp", [-1, 2, 16, 1]], ["tile_y", "sp", [-1, 1, 1, 7]], ["tile_x", "sp", [-1, 2, 2, 1]], ["tile_rcc", "sp", [-1, 8]], ["tile_ry", "sp", [-1, 1]], ["tile_rx", "sp", [-1, 1]], ["auto_unroll_max_step", "ot", 1500], ["unroll_explicit", "ot", 1]]}, "result": [[0.010581545], 0, 102.37230324745178, 1611813715.4074836], "version": 0.2, "tvm_version": "0.8.dev0"}
{"input": ["opencl -keys=opencl,gpu -max_num_threads=256", "conv2d_NCHWc_KCRSk_tx_tune", [[1, 32, 56, 56, 4], [32, 128, 1, 1, 4]], {}], "config": {"index": 1900330, "code_hash": null, "entity": [["tile_fc", "sp", [-1, 1, 2, 2]], ["tile_y", "sp", [-1, 1, 4, 1]], ["tile_x", "sp", [-1, 1, 14, 1]], ["tile_rcc", "sp", [-1, 32]], ["tile_ry", "sp", [-1, 1]], ["tile_rx", "sp", [-1, 1]], ["auto_unroll_max_step", "ot", 0], ["unroll_explicit", "ot", 0]]}, "result": [[0.0026331943333333333], 0, 2.1573171615600586, 1611813893.5045223], "version": 0.2, "tvm_version": "0.8.dev0"}
{"input": ["opencl -keys=opencl,gpu -max_num_threads=256", "conv2d_NCHWc_KCRSk_tx_tune", [[1, 32, 56, 56, 4], [32, 128, 1, 1, 4]], {}], "config": {"index": 1913770, "code_hash": null, "entity": [["tile_fc", "sp", [-1, 1, 2, 2]], ["tile_y", "sp", [-1, 1, 4, 1]], ["tile_x", "sp", [-1, 1, 28, 1]], ["tile_rcc", "sp", [-1, 32]], ["tile_ry", "sp", [-1, 1]], ["tile_rx", "sp", [-1, 1]], ["auto_unroll_max_step", "ot", 0], ["unroll_explicit", "ot", 0]]}, "result": [[0.0025192706666666664], 0, 3.363696575164795, 1611813894.73656], "version": 0.2, "tvm_version": "0.8.dev0"}
{"input": ["opencl -keys=opencl,gpu -max_num_threads=256", "conv2d_NCHWc_KCRSk_tx_tune", [[1, 32, 56, 56, 4], [32, 128, 1, 1, 4]], {}], "config": {"index": 1913434, "code_hash": null, "entity": [["tile_fc", "sp", [-1, 1, 2, 2]], ["tile_y", "sp", [-1, 1, 2, 1]], ["tile_x", "sp", [-1, 1, 28, 1]], ["tile_rcc", "sp", [-1, 32]], ["tile_ry", "sp", [-1, 1]], ["tile_rx", "sp", [-1, 1]], ["auto_unroll_max_step", "ot", 0], ["unroll_explicit", "ot", 0]]}, "result": [[0.002486528], 0, 4.516680717468262, 1611813895.9090672], "version": 0.2, "tvm_version": "0.8.dev0"}
{"input": ["opencl -keys=opencl,gpu -max_num_threads=256", "conv2d_NCHWc_KCRSk_tx_tune", [[1, 32, 56, 56, 4], [32, 128, 1, 1, 4]], {}], "config": {"index": 1891374, "code_hash": null, "entity": [["tile_fc", "sp", [-1, 1, 4, 2]], ["tile_y", "sp", [-1, 1, 4, 1]], ["tile_x", "sp", [-1, 1, 8, 1]], ["tile_rcc", "sp", [-1, 32]], ["tile_ry", "sp", [-1, 1]], ["tile_rx", "sp", [-1, 1]], ["auto_unroll_max_step", "ot", 0], ["unroll_explicit", "ot", 0]]}, "result": [[0.002085954666666667], 0, 5.837867498397827, 1611813897.1053584], "version": 0.2, "tvm_version": "0.8.dev0"}
{"input": ["opencl -keys=opencl,gpu -max_num_threads=256", "conv2d_NCHWc_KCRSk_tx_tune", [[1, 32, 56, 56, 4], [32, 128, 1, 1, 4]], {}], "config": {"index": 4050730, "code_hash": null, "entity": [["tile_fc", "sp", [-1, 1, 2, 2]], ["tile_y", "sp", [-1, 1, 4, 1]], ["tile_x", "sp", [-1, 1, 14, 1]], ["tile_rcc", "sp", [-1, 32]], ["tile_ry", "sp", [-1, 1]], ["tile_rx", "sp", [-1, 1]], ["auto_unroll_max_step", "ot", 512], ["unroll_explicit", "ot", 0]]}, "result": [[0.0024349476666666666], 0, 7.02977442741394, 1611813898.3171384], "version": 0.2, "tvm_version": "0.8.dev0"}
{"input": ["opencl -keys=opencl,gpu -max_num_threads=256", "conv2d_NCHWc_KCRSk_tx_tune", [[1, 32, 56, 56, 4], [32, 128, 1, 1, 4]], {}], "config": {"index": 4064170, "code_hash": null, "entity": [["tile_fc", "sp", [-1, 1, 2, 2]], ["tile_y", "sp", [-1, 1, 4, 1]], ["tile_x", "sp", [-1, 1, 28, 1]], ["tile_rcc", "sp", [-1, 32]], ["tile_ry", "sp", [-1, 1]], ["tile_rx", "sp", [-1, 1]], ["auto_unroll_max_step", "ot", 512], ["unroll_explicit", "ot", 0]]}, "result": [[0.002520538], 0, 8.204829931259155, 1611813899.5116518], "version": 0.2, "tvm_version": "0.8.dev0"}
{"input": ["opencl -keys=opencl,gpu -max_num_threads=256", "conv2d_NCHWc_KCRSk_tx_tune", [[1, 32, 56, 56, 4], [32, 128, 1, 1, 4]], {}], "config": {"index": 1891594, "code_hash": null, "entity": [["tile_fc", "sp", [-1, 1, 2, 2]], ["tile_y", "sp", [-1, 1, 7, 1]], ["tile_x", "sp", [-1, 1, 8, 1]], ["tile_rcc", "sp", [-1, 32]], ["tile_ry", "sp", [-1, 1]], ["tile_rx", "sp", [-1, 1]], ["auto_unroll_max_step", "ot", 0], ["unroll_explicit", "ot", 0]]}, "result": [[0.0023232813333333335], 0, 9.37326979637146, 1611813900.6972268], "version": 0.2, "tvm_version": "0.8.dev0"}
{"input": ["opencl -keys=opencl,gpu -max_num_threads=256", "conv2d_NCHWc_KCRSk_tx_tune", [[1, 32, 56, 56, 4], [32, 128, 1, 1, 4]], {}], "config": {"index": 4063834, "code_hash": null, "entity": [["tile_fc", "sp", [-1, 1, 2, 2]], ["tile_y", "sp", [-1, 1, 2, 1]], ["tile_x", "sp", [-1, 1, 28, 1]], ["tile_rcc", "sp", [-1, 32]], ["tile_ry", "sp", [-1, 1]], ["tile_rx", "sp", [-1, 1]], ["auto_unroll_max_step", "ot", 512], ["unroll_explicit", "ot", 0]]}, "result": [[0.0024921006666666664], 0, 10.627999067306519, 1611813901.9788408], "version": 0.2, "tvm_version": "0.8.dev0"}
{"input": ["opencl -keys=opencl,gpu -max_num_threads=256", "conv2d_NCHWc_KCRSk_tx_tune", [[1, 32, 56, 56, 4], [32, 128, 1, 1, 4]], {}], "config": {"index": 4041774, "code_hash": null, "entity": [["tile_fc", "sp", [-1, 1, 4, 2]], ["tile_y", "sp", [-1, 1, 4, 1]], ["tile_x", "sp", [-1, 1, 8, 1]], ["tile_rcc", "sp", [-1, 32]], ["tile_ry", "sp", [-1, 1]], ["tile_rx", "sp", [-1, 1]], ["auto_unroll_max_step", "ot", 512], ["unroll_explicit", "ot", 0]]}, "result": [[0.002214149333333333], 0, 11.80400013923645, 1611813903.1970074], "version": 0.2, "tvm_version": "0.8.dev0"}
{"input": ["opencl -keys=opencl,gpu -max_num_threads=256", "conv2d_NCHWc_KCRSk_tx_tune", [[1, 32, 56, 56, 4], [32, 128, 1, 1, 4]], {}], "config": {"index": 6201130, "code_hash": null, "entity": [["tile_fc", "sp", [-1, 1, 2, 2]], ["tile_y", "sp", [-1, 1, 4, 1]], ["tile_x", "sp", [-1, 1, 14, 1]], ["tile_rcc", "sp", [-1, 32]], ["tile_ry", "sp", [-1, 1]], ["tile_rx", "sp", [-1, 1]], ["auto_unroll_max_step", "ot", 1500], ["unroll_explicit", "ot", 0]]}, "result": [[0.0022760936666666666], 0, 12.994531154632568, 1611813904.4212086], "version": 0.2, "tvm_version": "0.8.dev0"}
{"input": ["opencl -keys=opencl,gpu -max_num_threads=256", "conv2d_NCHWc_KCRSk_tx_tune", [[1, 32, 56, 56, 4], [32, 128, 1, 1, 4]], {}], "config": {"index": 6214570, "code_hash": null, "entity": [["tile_fc", "sp", [-1, 1, 2, 2]], ["tile_y", "sp", [-1, 1, 4, 1]], ["tile_x", "sp", [-1, 1, 28, 1]], ["tile_rcc", "sp", [-1, 32]], ["tile_ry", "sp", [-1, 1]], ["tile_rx", "sp", [-1, 1]], ["auto_unroll_max_step", "ot", 1500], ["unroll_explicit", "ot", 0]]}, "result": [[0.0024671183333333335], 0, 14.181623458862305, 1611813905.6365688], "version": 0.2, "tvm_version": "0.8.dev0"}
{"input": ["opencl -keys=opencl,gpu -max_num_threads=256", "conv2d_NCHWc_KCRSk_tx_tune", [[1, 32, 56, 56, 4], [32, 128, 1, 1, 4]], {}], "config": {"index": 1912990, "code_hash": null, "entity": [["tile_fc", "sp", [-1, 1, 4, 2]], ["tile_y", "sp", [-1, 1, 1, 1]], ["tile_x", "sp", [-1, 1, 28, 1]], ["tile_rcc", "sp", [-1, 32]], ["tile_ry", "sp", [-1, 1]], ["tile_rx", "sp", [-1, 1]], ["auto_unroll_max_step", "ot", 0], ["unroll_explicit", "ot", 0]]}, "result": [[0.0021515276666666666], 0, 15.480530500411987, 1611813906.881873], "version": 0.2, "tvm_version": "0.8.dev0"}
{"input": ["opencl -keys=opencl,gpu -max_num_threads=256", "conv2d_NCHWc_KCRSk_tx_tune", [[1, 32, 56, 56, 4], [32, 128, 1, 1, 4]], {}], "config": {"index": 6214234, "code_hash": null, "entity": [["tile_fc", "sp", [-1, 1, 2, 2]], ["tile_y", "sp", [-1, 1, 2, 1]], ["tile_x", "sp", [-1, 1, 28, 1]], ["tile_rcc", "sp", [-1, 32]], ["tile_ry", "sp", [-1, 1]], ["tile_rx", "sp", [-1, 1]], ["auto_unroll_max_step", "ot", 1500], ["unroll_explicit", "ot", 0]]}, "result": [[0.002543073], 0, 16.570067405700684, 1611813908.05002], "version": 0.2, "tvm_version": "0.8.dev0"}
{"input": ["opencl -keys=opencl,gpu -max_num_threads=256", "conv2d_NCHWc_KCRSk_tx_tune", [[1, 32, 56, 56, 4], [32, 128, 1, 1, 4]], {}], "config": {"index": 1175475, "code_hash": null, "entity": [["tile_fc", "sp", [-1, 1, 16, 2]], ["tile_y", "sp", [-1, 1, 1, 2]], ["tile_x", "sp", [-1, 1, 8, 1]], ["tile_rcc", "sp", [-1, 8]], ["tile_ry", "sp", [-1, 1]], ["tile_rx", "sp", [-1, 1]], ["auto_unroll_max_step", "ot", 0], ["unroll_explicit", "ot", 0]]}, "result": [[0.0018276563333333334], 0, 17.78940510749817, 1611813909.2468963], "version": 0.2, "tvm_version": "0.8.dev0"}
{"input": ["opencl -keys=opencl,gpu -max_num_threads=256", "conv2d_NCHWc_KCRSk_tx_tune", [[1, 32, 56, 56, 4], [32, 128, 1, 1, 4]], {}], "config": {"index": 6192174, "code_hash": null, "entity": [["tile_fc", "sp", [-1, 1, 4, 2]], ["tile_y", "sp", [-1, 1, 4, 1]], ["tile_x", "sp", [-1, 1, 8, 1]], ["tile_rcc", "sp", [-1, 32]], ["tile_ry", "sp", [-1, 1]], ["tile_rx", "sp", [-1, 1]], ["auto_unroll_max_step", "ot", 1500], ["unroll_explicit", "ot", 0]]}, "result": [[0.002230781], 0, 19.251124620437622, 1611813910.5627027], "version": 0.2, "tvm_version": "0.8.dev0"}
{"input": ["opencl -keys=opencl,gpu -max_num_threads=256", "conv2d_NCHWc_KCRSk_tx_tune", [[1, 32, 56, 56, 4], [32, 128, 1, 1, 4]], {}], "config": {"index": 1900558, "code_hash": null, "entity": [["tile_fc", "sp", [-1, 1, 4, 2]], ["tile_y", "sp", [-1, 1, 7, 1]], ["tile_x", "sp", [-1, 1, 14, 1]], ["tile_rcc", "sp", [-1, 32]], ["tile_ry", "sp", [-1, 1]], ["tile_rx", "sp", [-1, 1]], ["auto_unroll_max_step", "ot", 0], ["unroll_explicit", "ot", 0]]}, "result": [[0.0024086806666666666], 0, 20.357295989990234, 1611813911.8024302], "version": 0.2, "tvm_version": "0.8.dev0"}
{"input": ["opencl -keys=opencl,gpu -max_num_threads=256", "conv2d_NCHWc_KCRSk_tx_tune", [[1, 32, 56, 56, 4], [32, 128, 1, 1, 4]], {}], "config": {"index": 1913994, "code_hash": null, "entity": [["tile_fc", "sp", [-1, 1, 2, 2]], ["tile_y", "sp", [-1, 1, 7, 1]], ["tile_x", "sp", [-1, 1, 28, 1]], ["tile_rcc", "sp", [-1, 32]], ["tile_ry", "sp", [-1, 1]], ["tile_rx", "sp", [-1, 1]], ["auto_unroll_max_step", "ot", 0], ["unroll_explicit", "ot", 0]]}, "result": [[0.0026525346666666665], 0, 21.696585416793823, 1611813913.0503893], "version": 0.2, "tvm_version": "0.8.dev0"}
{"input": ["opencl -keys=opencl,gpu -max_num_threads=256", "conv2d_NCHWc_KCRSk_tx_tune", [[1, 32, 56, 56, 4], [32, 128, 1, 1, 4]], {}], "config": {"index": 4041994, "code_hash": null, "entity": [["tile_fc", "sp", [-1, 1, 2, 2]], ["tile_y", "sp", [-1, 1, 7, 1]], ["tile_x", "sp", [-1, 1, 8, 1]], ["tile_rcc", "sp", [-1, 32]], ["tile_ry", "sp", [-1, 1]], ["tile_rx", "sp", [-1, 1]], ["auto_unroll_max_step", "ot", 512], ["unroll_explicit", "ot", 0]]}, "result": [[0.002236354], 0, 22.841242790222168, 1611813914.238151], "version": 0.2, "tvm_version": "0.8.dev0"}
{"input": ["opencl -keys=opencl,gpu -max_num_threads=256", "conv2d_NCHWc_KCRSk_tx_tune", [[1, 32, 56, 56, 4], [32, 128, 1, 1, 4]], {}], "config": {"index": 8342574, "code_hash": null, "entity": [["tile_fc", "sp", [-1, 1, 4, 2]], ["tile_y", "sp", [-1, 1, 4, 1]], ["tile_x", "sp", [-1, 1, 8, 1]], ["tile_rcc", "sp", [-1, 32]], ["tile_ry", "sp", [-1, 1]], ["tile_rx", "sp", [-1, 1]], ["auto_unroll_max_step", "ot", 0], ["unroll_explicit", "ot", 1]]}, "result": [[0.0022509376666666665], 0, 24.027139902114868, 1611813915.4323208], "version": 0.2, "tvm_version": "0.8.dev0"}
{"input": ["opencl -keys=opencl,gpu -max_num_threads=256", "conv2d_NCHWc_KCRSk_tx_tune", [[1, 32, 56, 56, 4], [32, 128, 1, 1, 4]], {}], "config": {"index": 1913774, "code_hash": null, "entity": [["tile_fc", "sp", [-1, 1, 4, 2]], ["tile_y", "sp", [-1, 1, 4, 1]], ["tile_x", "sp", [-1, 1, 28, 1]], ["tile_rcc", "sp", [-1, 32]], ["tile_ry", "sp", [-1, 1]], ["tile_rx", "sp", [-1, 1]], ["auto_unroll_max_step", "ot", 0], ["unroll_explicit", "ot", 0]]}, "result": [[0.0024977429999999998], 0, 25.358514547348022, 1611813916.7560368], "version": 0.2, "tvm_version": "0.8.dev0"}
{"input": ["opencl -keys=opencl,gpu -max_num_threads=256", "conv2d_NCHWc_KCRSk_tx_tune", [[1, 32, 56, 56, 4], [32, 128, 1, 1, 4]], {}], "config": {"index": 1891370, "code_hash": null, "entity": [["tile_fc", "sp", [-1, 1, 2, 2]], ["tile_y", "sp", [-1, 1, 4, 1]], ["tile_x", "sp", [-1, 1, 8, 1]], ["tile_rcc", "sp", [-1, 32]], ["tile_ry", "sp", [-1, 1]], ["tile_rx", "sp", [-1, 1]], ["auto_unroll_max_step", "ot", 0], ["unroll_explicit", "ot", 0]]}, "result": [[0.002775486], 0, 26.503222703933716, 1611813917.9301271], "version": 0.2, "tvm_version": "0.8.dev0"}
{"input": ["opencl -keys=opencl,gpu -max_num_threads=256", "conv2d_NCHWc_KCRSk_tx_tune", [[1, 32, 56, 56, 4], [32, 128, 1, 1, 4]], {}], "config": {"index": 4063390, "code_hash": null, "entity": [["tile_fc", "sp", [-1, 1, 4, 2]], ["tile_y", "sp", [-1, 1, 1, 1]], ["tile_x", "sp", [-1, 1, 28, 1]], ["tile_rcc", "sp", [-1, 32]], ["tile_ry", "sp", [-1, 1]], ["tile_rx", "sp", [-1, 1]], ["auto_unroll_max_step", "ot", 512], ["unroll_explicit", "ot", 0]]}, "result": [[0.0025282813333333334], 0, 27.657156705856323, 1611813919.0997891], "version": 0.2, "tvm_version": "0.8.dev0"}
{"input": ["opencl -keys=opencl,gpu -max_num_threads=256", "conv2d_NCHWc_KCRSk_tx_tune", [[1, 32, 56, 56, 4], [32, 128, 1, 1, 4]], {}], "config": {"index": 6192394, "code_hash": null, "entity": [["tile_fc", "sp", [-1, 1, 2, 2]], ["tile_y", "sp", [-1, 1, 7, 1]], ["tile_x", "sp", [-1, 1, 8, 1]], ["tile_rcc", "sp", [-1, 32]], ["tile_ry", "sp", [-1, 1]], ["tile_rx", "sp", [-1, 1]], ["auto_unroll_max_step", "ot", 1500], ["unroll_explicit", "ot", 0]]}, "result": [[0.002458455], 0, 28.931564807891846, 1611813920.4303071], "version": 0.2, "tvm_version": "0.8.dev0"}
{"input": ["opencl -keys=opencl,gpu -max_num_threads=256", "conv2d_NCHWc_KCRSk_tx_tune", [[1, 32, 56, 56, 4], [32, 128, 1, 1, 4]], {}], "config": {"index": 1533875, "code_hash": null, "entity": [["tile_fc", "sp", [-1, 1, 16, 2]], ["tile_y", "sp", [-1, 1, 1, 2]], ["tile_x", "sp", [-1, 1, 8, 1]], ["tile_rcc", "sp", [-1, 16]], ["tile_ry", "sp", [-1, 1]], ["tile_rx", "sp", [-1, 1]], ["auto_unroll_max_step", "ot", 0], ["unroll_explicit", "ot", 0]]}, "result": [[0.0016582813333333333], 0, 30.1417875289917, 1611813921.6188245], "version": 0.2, "tvm_version": "0.8.dev0"}
{"input": ["opencl -keys=opencl,gpu -max_num_threads=256", "conv2d_NCHWc_KCRSk_tx_tune", [[1, 32, 56, 56, 4], [32, 128, 1, 1, 4]], {}], "config": {"index": 4144790, "code_hash": null, "entity": [["tile_fc", "sp", [-1, 1, 2, 1]], ["tile_y", "sp", [-1, 1, 4, 1]], ["tile_x", "sp", [-1, 1, 14, 2]], ["tile_rcc", "sp", [-1, 32]], ["tile_ry", "sp", [-1, 1]], ["tile_rx", "sp", [-1, 1]], ["auto_unroll_max_step", "ot", 512], ["unroll_explicit", "ot", 0]]}, "result": [[0.002012864666666667], 0, 2.085444688796997, 1611813924.6196325], "version": 0.2, "tvm_version": "0.8.dev0"}
{"input": ["opencl -keys=opencl,gpu -max_num_threads=256", "conv2d_NCHWc_KCRSk_tx_tune", [[1, 32, 56, 56, 4], [32, 128, 1, 1, 4]], {}], "config": {"index": 4050958, "code_hash": null, "entity": [["tile_fc", "sp", [-1, 1, 4, 2]], ["tile_y", "sp", [-1, 1, 7, 1]], ["tile_x", "sp", [-1, 1, 14, 1]], ["tile_rcc", "sp", [-1, 32]], ["tile_ry", "sp", [-1, 1]], ["tile_rx", "sp", [-1, 1]], ["auto_unroll_max_step", "ot", 512], ["unroll_explicit", "ot", 0]]}, "result": [[0.0023769616666666667], 0, 3.297447681427002, 1611813925.8395898], "version": 0.2, "tvm_version": "0.8.dev0"}
{"input": ["opencl -keys=opencl,gpu -max_num_threads=256", "conv2d_NCHWc_KCRSk_tx_tune", [[1, 32, 56, 56, 4], [32, 128, 1, 1, 4]], {}], "config": {"index": 4064394, "code_hash": null, "entity": [["tile_fc", "sp", [-1, 1, 2, 2]], ["tile_y", "sp", [-1, 1, 7, 1]], ["tile_x", "sp", [-1, 1, 28, 1]], ["tile_rcc", "sp", [-1, 32]], ["tile_ry", "sp", [-1, 1]], ["tile_rx", "sp", [-1, 1]], ["auto_unroll_max_step", "ot", 512], ["unroll_explicit", "ot", 0]]}, "result": [[0.002816163333333333], 0, 4.618010759353638, 1611813927.0660279], "version": 0.2, "tvm_version": "0.8.dev0"}
{"input": ["opencl -keys=opencl,gpu -max_num_threads=256", "conv2d_NCHWc_KCRSk_tx_tune", [[1, 32, 56, 56, 4], [32, 128, 1, 1, 4]], {}], "config": {"index": 4064150, "code_hash": null, "entity": [["tile_fc", "sp", [-1, 1, 2, 1]], ["tile_y", "sp", [-1, 1, 4, 1]], ["tile_x", "sp", [-1, 1, 28, 1]], ["tile_rcc", "sp", [-1, 32]], ["tile_ry", "sp", [-1, 1]], ["tile_rx", "sp", [-1, 1]], ["auto_unroll_max_step", "ot", 512], ["unroll_explicit", "ot", 0]]}, "result": [[0.002501441], 0, 5.811146020889282, 1611813928.2441535], "version": 0.2, "tvm_version": "0.8.dev0"}
{"input": ["opencl -keys=opencl,gpu -max_num_threads=256", "conv2d_NCHWc_KCRSk_tx_tune", [[1, 32, 56, 56, 4], [32, 128, 1, 1, 4]], {}], "config": {"index": 4064167, "code_hash": null, "entity": [["tile_fc", "sp", [-1, 4, 1, 2]], ["tile_y", "sp", [-1, 1, 4, 1]], ["tile_x", "sp", [-1, 1, 28, 1]], ["tile_rcc", "sp", [-1, 32]], ["tile_ry", "sp", [-1, 1]], ["tile_rx", "sp", [-1, 1]], ["auto_unroll_max_step", "ot", 512], ["unroll_explicit", "ot", 0]]}, "result": [[0.0034628646666666663], 0, 7.129769563674927, 1611813929.5862062], "version": 0.2, "tvm_version": "0.8.dev0"}
{"input": ["opencl -keys=opencl,gpu -max_num_threads=256", "conv2d_NCHWc_KCRSk_tx_tune", [[1, 32, 56, 56, 4], [32, 128, 1, 1, 4]], {}], "config": {"index": 1994390, "code_hash": null, "entity": [["tile_fc", "sp", [-1, 1, 2, 1]], ["tile_y", "sp", [-1, 1, 4, 1]], ["tile_x", "sp", [-1, 1, 14, 2]], ["tile_rcc", "sp", [-1, 32]], ["tile_ry", "sp", [-1, 1]], ["tile_rx", "sp", [-1, 1]], ["auto_unroll_max_step", "ot", 0], ["unroll_explicit", "ot", 0]]}, "result": [[0.0020716840000000003], 0, 8.31565260887146, 1611813930.8084807], "version": 0.2, "tvm_version": "0.8.dev0"}
{"input": ["opencl -keys=opencl,gpu -max_num_threads=256", "conv2d_NCHWc_KCRSk_tx_tune", [[1, 32, 56, 56, 4], [32, 128, 1, 1, 4]], {}], "config": {"index": 1891822, "code_hash": null, "entity": [["tile_fc", "sp", [-1, 1, 4, 2]], ["tile_y", "sp", [-1, 1, 8, 1]], ["tile_x", "sp", [-1, 1, 8, 1]], ["tile_rcc", "sp", [-1, 32]], ["tile_ry", "sp", [-1, 1]], ["tile_rx", "sp", [-1, 1]], ["auto_unroll_max_step", "ot", 0], ["unroll_explicit", "ot", 0]]}, "result": [[0.0022681773333333333], 0, 9.505225658416748, 1611813932.015011], "version": 0.2, "tvm_version": "0.8.dev0"}
{"input": ["opencl -keys=opencl,gpu -max_num_threads=256", "conv2d_NCHWc_KCRSk_tx_tune", [[1, 32, 56, 56, 4], [32, 128, 1, 1, 4]], {}], "config": {"index": 8351530, "code_hash": null, "entity": [["tile_fc", "sp", [-1, 1, 2, 2]], ["tile_y", "sp", [-1, 1, 4, 1]], ["tile_x", "sp", [-1, 1, 14, 1]], ["tile_rcc", "sp", [-1, 32]], ["tile_ry", "sp", [-1, 1]], ["tile_rx", "sp", [-1, 1]], ["auto_unroll_max_step", "ot", 0], ["unroll_explicit", "ot", 1]]}, "result": [[0.002516527666666667], 0, 10.82980465888977, 1611813933.3717632], "version": 0.2, "tvm_version": "0.8.dev0"}
{"input": ["opencl -keys=opencl,gpu -max_num_threads=256", "conv2d_NCHWc_KCRSk_tx_tune", [[1, 32, 56, 56, 4], [32, 128, 1, 1, 4]], {}], "config": {"index": 10492974, "code_hash": null, "entity": [["tile_fc", "sp", [-1, 1, 4, 2]], ["tile_y", "sp", [-1, 1, 4, 1]], ["tile_x", "sp", [-1, 1, 8, 1]], ["tile_rcc", "sp", [-1, 32]], ["tile_ry", "sp", [-1, 1]], ["tile_rx", "sp", [-1, 1]], ["auto_unroll_max_step", "ot", 512], ["unroll_explicit", "ot", 1]]}, "result": [[0.0021204516666666665], 0, 12.291832447052002, 1611813934.607961], "version": 0.2, "tvm_version": "0.8.dev0"}
{"input": ["opencl -keys=opencl,gpu -max_num_threads=256", "conv2d_NCHWc_KCRSk_tx_tune", [[1, 32, 56, 56, 4], [32, 128, 1, 1, 4]], {}], "config": {"index": 8364970, "code_hash": null, "entity": [["tile_fc", "sp", [-1, 1, 2, 2]], ["tile_y", "sp", [-1, 1, 4, 1]], ["tile_x", "sp", [-1, 1, 28, 1]], ["tile_rcc", "sp", [-1, 32]], ["tile_ry", "sp", [-1, 1]], ["tile_rx", "sp", [-1, 1]], ["auto_unroll_max_step", "ot", 0], ["unroll_explicit", "ot", 1]]}, "result": [[0.0024969793333333335], 0, 13.21603798866272, 1611813935.8085935], "version": 0.2, "tvm_version": "0.8.dev0"}
{"input": ["opencl -keys=opencl,gpu -max_num_threads=256", "conv2d_NCHWc_KCRSk_tx_tune", [[1, 32, 56, 56, 4], [32, 128, 1, 1, 4]], {}], "config": {"index": 1892275, "code_hash": null, "entity": [["tile_fc", "sp", [-1, 1, 16, 2]], ["tile_y", "sp", [-1, 1, 1, 2]], ["tile_x", "sp", [-1, 1, 8, 1]], ["tile_rcc", "sp", [-1, 32]], ["tile_ry", "sp", [-1, 1]], ["tile_rx", "sp", [-1, 1]], ["auto_unroll_max_step", "ot", 0], ["unroll_explicit", "ot", 0]]}, "result": [[0.0019283333333333333], 0, 14.421370506286621, 1611813937.0363417], "version": 0.2, "tvm_version": "0.8.dev0"}
{"input": ["opencl -keys=opencl,gpu -max_num_threads=256", "conv2d_NCHWc_KCRSk_tx_tune", [[1, 32, 56, 56, 4], [32, 128, 1, 1, 4]], {}], "config": {"index": 6213790, "code_hash": null, "entity": [["tile_fc", "sp", [-1, 1, 4, 2]], ["tile_y", "sp", [-1, 1, 1, 1]], ["tile_x", "sp", [-1, 1, 28, 1]], ["tile_rcc", "sp", [-1, 32]], ["tile_ry", "sp", [-1, 1]], ["tile_rx", "sp", [-1, 1]], ["auto_unroll_max_step", "ot", 1500], ["unroll_explicit", "ot", 0]]}, "result": [[0.0025382116666666666], 0, 15.656928777694702, 1611813938.2246053], "version": 0.2, "tvm_version": "0.8.dev0"}
{"input": ["opencl -keys=opencl,gpu -max_num_threads=256", "conv2d_NCHWc_KCRSk_tx_tune", [[1, 32, 56, 56, 4], [32, 128, 1, 1, 4]], {}], "config": {"index": 4064174, "code_hash": null, "entity": [["tile_fc", "sp", [-1, 1, 4, 2]], ["tile_y", "sp", [-1, 1, 4, 1]], ["tile_x", "sp", [-1, 1, 28, 1]], ["tile_rcc", "sp", [-1, 32]], ["tile_ry", "sp", [-1, 1]], ["tile_rx", "sp", [-1, 1]], ["auto_unroll_max_step", "ot", 512], ["unroll_explicit", "ot", 0]]}, "result": [[0.0022380903333333335], 0, 16.83085322380066, 1611813939.4399], "version": 0.2, "tvm_version": "0.8.dev0"}
{"input": ["opencl -keys=opencl,gpu -max_num_threads=256", "conv2d_NCHWc_KCRSk_tx_tune", [[1, 32, 56, 56, 4], [32, 128, 1, 1, 4]], {}], "config": {"index": 1174574, "code_hash": null, "entity": [["tile_fc", "sp", [-1, 1, 4, 2]], ["tile_y", "sp", [-1, 1, 4, 1]], ["tile_x", "sp", [-1, 1, 8, 1]], ["tile_rcc", "sp", [-1, 8]], ["tile_ry", "sp", [-1, 1]], ["tile_rx", "sp", [-1, 1]], ["auto_unroll_max_step", "ot", 0], ["unroll_explicit", "ot", 0]]}, "result": [[0.0025865796666666666], 0, 18.1397442817688, 1611813940.7547576], "version": 0.2, "tvm_version": "0.8.dev0"}
{"input": ["opencl -keys=opencl,gpu -max_num_threads=256", "conv2d_NCHWc_KCRSk_tx_tune", [[1, 32, 56, 56, 4], [32, 128, 1, 1, 4]], {}], "config": {"index": 8364634, "code_hash": null, "entity": [["tile_fc", "sp", [-1, 1, 2, 2]], ["tile_y", "sp", [-1, 1, 2, 1]], ["tile_x", "sp", [-1, 1, 28, 1]], ["tile_rcc", "sp", [-1, 32]], ["tile_ry", "sp", [-1, 1]], ["tile_rx", "sp", [-1, 1]], ["auto_unroll_max_step", "ot", 0], ["unroll_explicit", "ot", 1]]}, "result": [[0.0025505036666666667], 0, 19.322911024093628, 1611813941.8934197], "version": 0.2, "tvm_version": "0.8.dev0"}
{"input": ["opencl -keys=opencl,gpu -max_num_threads=256", "conv2d_NCHWc_KCRSk_tx_tune", [[1, 32, 56, 56, 4], [32, 128, 1, 1, 4]], {}], "config": {"index": 6295190, "code_hash": null, "entity": [["tile_fc", "sp", [-1, 1, 2, 1]], ["tile_y", "sp", [-1, 1, 4, 1]], ["tile_x", "sp", [-1, 1, 14, 2]], ["tile_rcc", "sp", [-1, 32]], ["tile_ry", "sp", [-1, 1]], ["tile_rx", "sp", [-1, 1]], ["auto_unroll_max_step", "ot", 1500], ["unroll_explicit", "ot", 0]]}, "result": [[0.0021891146666666666], 0, 20.431228399276733, 1611813943.082827], "version": 0.2, "tvm_version": "0.8.dev0"}
{"input": ["opencl -keys=opencl,gpu -max_num_threads=256", "conv2d_NCHWc_KCRSk_tx_tune", [[1, 32, 56, 56, 4], [32, 128, 1, 1, 4]], {}], "config": {"index": 1174584, "code_hash": null, "entity": [["tile_fc", "sp", [-1, 1, 2, 4]], ["tile_y", "sp", [-1, 1, 4, 1]], ["tile_x", "sp", [-1, 1, 8, 1]], ["tile_rcc", "sp", [-1, 8]], ["tile_ry", "sp", [-1, 1]], ["tile_rx", "sp", [-1, 1]], ["auto_unroll_max_step", "ot", 0], ["unroll_explicit", "ot", 0]]}, "result": [[0.002488559], 0, 21.800602197647095, 1611813944.338413], "version": 0.2, "tvm_version": "0.8.dev0"}
{"input": ["opencl -keys=opencl,gpu -max_num_threads=256", "conv2d_NCHWc_KCRSk_tx_tune", [[1, 32, 56, 56, 4], [32, 128, 1, 1, 4]], {}], "config": {"index": 1913750, "code_hash": null, "entity": [["tile_fc", "sp", [-1, 1, 2, 1]], ["tile_y", "sp", [-1, 1, 4, 1]], ["tile_x", "sp", [-1, 1, 28, 1]], ["tile_rcc", "sp", [-1, 32]], ["tile_ry", "sp", [-1, 1]], ["tile_rx", "sp", [-1, 1]], ["auto_unroll_max_step", "ot", 0], ["unroll_explicit", "ot", 0]]}, "result": [[0.002166701333333333], 0, 22.969003438949585, 1611813945.538402], "version": 0.2, "tvm_version": "0.8.dev0"}
{"input": ["opencl -keys=opencl,gpu -max_num_threads=256", "conv2d_NCHWc_KCRSk_tx_tune", [[1, 32, 56, 56, 4], [32, 128, 1, 1, 4]], {}], "config": {"index": 1913767, "code_hash": null, "entity": [["tile_fc", "sp", [-1, 4, 1, 2]], ["tile_y", "sp", [-1, 1, 4, 1]], ["tile_x", "sp", [-1, 1, 28, 1]], ["tile_rcc", "sp", [-1, 32]], ["tile_ry", "sp", [-1, 1]], ["tile_rx", "sp", [-1, 1]], ["auto_unroll_max_step", "ot", 0], ["unroll_explicit", "ot", 0]]}, "result": [[0.003220486], 0, 24.323582887649536, 1611813946.923632], "version": 0.2, "tvm_version": "0.8.dev0"}
{"input": ["opencl -keys=opencl,gpu -max_num_threads=256", "conv2d_NCHWc_KCRSk_tx_tune", [[1, 32, 56, 56, 4], [32, 128, 1, 1, 4]], {}], "config": {"index": 8364190, "code_hash": null, "entity": [["tile_fc", "sp", [-1, 1, 4, 2]], ["tile_y", "sp", [-1, 1, 1, 1]], ["tile_x", "sp", [-1, 1, 28, 1]], ["tile_rcc", "sp", [-1, 32]], ["tile_ry", "sp", [-1, 1]], ["tile_rx", "sp", [-1, 1]], ["auto_unroll_max_step", "ot", 0], ["unroll_explicit", "ot", 1]]}, "result": [[0.0025447743333333332], 0, 25.58668804168701, 1611813948.1991863], "version": 0.2, "tvm_version": "0.8.dev0"}
{"input": ["opencl -keys=opencl,gpu -max_num_threads=256", "conv2d_NCHWc_KCRSk_tx_tune", [[1, 32, 56, 56, 4], [32, 128, 1, 1, 4]], {}], "config": {"index": 6201358, "code_hash": null, "entity": [["tile_fc", "sp", [-1, 1, 4, 2]], ["tile_y", "sp", [-1, 1, 7, 1]], ["tile_x", "sp", [-1, 1, 14, 1]], ["tile_rcc", "sp", [-1, 32]], ["tile_ry", "sp", [-1, 1]], ["tile_rx", "sp", [-1, 1]], ["auto_unroll_max_step", "ot", 1500], ["unroll_explicit", "ot", 0]]}, "result": [[0.002320052], 0, 26.733105421066284, 1611813949.3677752], "version": 0.2, "tvm_version": "0.8.dev0"}
{"input": ["opencl -keys=opencl,gpu -max_num_threads=256", "conv2d_NCHWc_KCRSk_tx_tune", [[1, 32, 56, 56, 4], [32, 128, 1, 1, 4]], {}], "config": {"index": 6214794, "code_hash": null, "entity": [["tile_fc", "sp", [-1, 1, 2, 2]], ["tile_y", "sp", [-1, 1, 7, 1]], ["tile_x", "sp", [-1, 1, 28, 1]], ["tile_rcc", "sp", [-1, 32]], ["tile_ry", "sp", [-1, 1]], ["tile_rx", "sp", [-1, 1]], ["auto_unroll_max_step", "ot", 1500], ["unroll_explicit", "ot", 0]]}, "result": [[0.0026810069999999996], 0, 27.996301412582397, 1611813950.652285], "version": 0.2, "tvm_version": "0.8.dev0"}
{"input": ["opencl -keys=opencl,gpu -max_num_threads=256", "conv2d_NCHWc_KCRSk_tx_tune", [[1, 32, 56, 56, 4], [32, 128, 1, 1, 4]], {}], "config": {"index": 6214550, "code_hash": null, "entity": [["tile_fc", "sp", [-1, 1, 2, 1]], ["tile_y", "sp", [-1, 1, 4, 1]], ["tile_x", "sp", [-1, 1, 28, 1]], ["tile_rcc", "sp", [-1, 32]], ["tile_ry", "sp", [-1, 1]], ["tile_rx", "sp", [-1, 1]], ["auto_unroll_max_step", "ot", 1500], ["unroll_explicit", "ot", 0]]}, "result": [[0.0025078646666666666], 0, 29.25272512435913, 1611813951.925389], "version": 0.2, "tvm_version": "0.8.dev0"}
{"input": ["opencl -keys=opencl,gpu -max_num_threads=256", "conv2d_NCHWc_KCRSk_tx_tune", [[1, 32, 56, 56, 4], [32, 128, 1, 1, 4]], {}], "config": {"index": 1532974, "code_hash": null, "entity": [["tile_fc", "sp", [-1, 1, 4, 2]], ["tile_y", "sp", [-1, 1, 4, 1]], ["tile_x", "sp", [-1, 1, 8, 1]], ["tile_rcc", "sp", [-1, 16]], ["tile_ry", "sp", [-1, 1]], ["tile_rx", "sp", [-1, 1]], ["auto_unroll_max_step", "ot", 0], ["unroll_explicit", "ot", 0]]}, "result": [[0.002441441], 0, 30.444358825683594, 1611813953.1229389], "version": 0.2, "tvm_version": "0.8.dev0"}
{"input": ["opencl -keys=opencl,gpu -max_num_threads=256", "conv2d_NCHWc_KCRSk_tx_tune", [[1, 32, 56, 56, 4], [32, 128, 1, 1, 4]], {}], "config": {"index": 6214567, "code_hash": null, "entity": [["tile_fc", "sp", [-1, 4, 1, 2]], ["tile_y", "sp", [-1, 1, 4, 1]], ["tile_x", "sp", [-1, 1, 28, 1]], ["tile_rcc", "sp", [-1, 32]], ["tile_ry", "sp", [-1, 1]], ["tile_rx", "sp", [-1, 1]], ["auto_unroll_max_step", "ot", 1500], ["unroll_explicit", "ot", 0]]}, "result": [[0.00348592], 0, 2.088817596435547, 1611813956.1376395], "version": 0.2, "tvm_version": "0.8.dev0"}
{"input": ["opencl -keys=opencl,gpu -max_num_threads=256", "conv2d_NCHWc_KCRSk_tx_tune", [[1, 32, 56, 56, 4], [32, 128, 1, 1, 4]], {}], "config": {"index": 12643374, "code_hash": null, "entity": [["tile_fc", "sp", [-1, 1, 4, 2]], ["tile_y", "sp", [-1, 1, 4, 1]], ["tile_x", "sp", [-1, 1, 8, 1]], ["tile_rcc", "sp", [-1, 32]], ["tile_ry", "sp", [-1, 1]], ["tile_rx", "sp", [-1, 1]], ["auto_unroll_max_step", "ot", 1500], ["unroll_explicit", "ot", 1]]}, "result": [[0.002085295], 0, 3.7005693912506104, 1611813957.481572], "version": 0.2, "tvm_version": "0.8.dev0"}
{"input": ["opencl -keys=opencl,gpu -max_num_threads=256", "conv2d_NCHWc_KCRSk_tx_tune", [[1, 32, 56, 56, 4], [32, 128, 1, 1, 4]], {}], "config": {"index": 8351758, "code_hash": null, "entity": [["tile_fc", "sp", [-1, 1, 4, 2]], ["tile_y", "sp", [-1, 1, 7, 1]], ["tile_x", "sp", [-1, 1, 14, 1]], ["tile_rcc", "sp", [-1, 32]], ["tile_ry", "sp", [-1, 1]], ["tile_rx", "sp", [-1, 1]], ["auto_unroll_max_step", "ot", 0], ["unroll_explicit", "ot", 1]]}, "result": [[0.0024744096666666666], 0, 4.588378190994263, 1611813958.7590406], "version": 0.2, "tvm_version": "0.8.dev0"}
{"input": ["opencl -keys=opencl,gpu -max_num_threads=256", "conv2d_NCHWc_KCRSk_tx_tune", [[1, 32, 56, 56, 4], [32, 128, 1, 1, 4]], {}], "config": {"index": 4064379, "code_hash": null, "entity": [["tile_fc", "sp", [-1, 1, 4, 1]], ["tile_y", "sp", [-1, 1, 7, 1]], ["tile_x", "sp", [-1, 1, 28, 1]], ["tile_rcc", "sp", [-1, 32]], ["tile_ry", "sp", [-1, 1]], ["tile_rx", "sp", [-1, 1]], ["auto_unroll_max_step", "ot", 512], ["unroll_explicit", "ot", 0]]}, "result": [[0.0024283856666666667], 0, 5.953507423400879, 1611813959.998367], "version": 0.2, "tvm_version": "0.8.dev0"}
{"input": ["opencl -keys=opencl,gpu -max_num_threads=256", "conv2d_NCHWc_KCRSk_tx_tune", [[1, 32, 56, 56, 4], [32, 128, 1, 1, 4]], {}], "config": {"index": 1900334, "code_hash": null, "entity": [["tile_fc", "sp", [-1, 1, 4, 2]], ["tile_y", "sp", [-1, 1, 4, 1]], ["tile_x", "sp", [-1, 1, 14, 1]], ["tile_rcc", "sp", [-1, 32]], ["tile_ry", "sp", [-1, 1]], ["tile_rx", "sp", [-1, 1]], ["auto_unroll_max_step", "ot", 0], ["unroll_explicit", "ot", 0]]}, "result": [[0.0022458856666666667], 0, 7.243695974349976, 1611813961.304402], "version": 0.2, "tvm_version": "0.8.dev0"}
{"input": ["opencl -keys=opencl,gpu -max_num_threads=256", "conv2d_NCHWc_KCRSk_tx_tune", [[1, 32, 56, 56, 4], [32, 128, 1, 1, 4]], {}], "config": {"index": 6214574, "code_hash": null, "entity": [["tile_fc", "sp", [-1, 1, 4, 2]], ["tile_y", "sp", [-1, 1, 4, 1]], ["tile_x", "sp", [-1, 1, 28, 1]], ["tile_rcc", "sp", [-1, 32]], ["tile_ry", "sp", [-1, 1]], ["tile_rx", "sp", [-1, 1]], ["auto_unroll_max_step", "ot", 1500], ["unroll_explicit", "ot", 0]]}, "result": [[0.002542621666666667], 0, 8.52053689956665, 1611813962.5212739], "version": 0.2, "tvm_version": "0.8.dev0"}
{"input": ["opencl -keys=opencl,gpu -max_num_threads=256", "conv2d_NCHWc_KCRSk_tx_tune", [[1, 32, 56, 56, 4], [32, 128, 1, 1, 4]], {}], "config": {"index": 1875171, "code_hash": null, "entity": [["tile_fc", "sp", [-1, 1, 4, 1]], ["tile_y", "sp", [-1, 1, 14, 2]], ["tile_x", "sp", [-1, 1, 7, 1]], ["tile_rcc", "sp", [-1, 32]], ["tile_ry", "sp", [-1, 1]], ["tile_rx", "sp", [-1, 1]], ["auto_unroll_max_step", "ot", 0], ["unroll_explicit", "ot", 0]]}, "result": [[0.0024236286666666665], 0, 9.71854829788208, 1611813963.738767], "version": 0.2, "tvm_version": "0.8.dev0"}
{"input": ["opencl -keys=opencl,gpu -max_num_threads=256", "conv2d_NCHWc_KCRSk_tx_tune", [[1, 32, 56, 56, 4], [32, 128, 1, 1, 4]], {}], "config": {"index": 4144795, "code_hash": null, "entity": [["tile_fc", "sp", [-1, 1, 4, 1]], ["tile_y", "sp", [-1, 1, 4, 1]], ["tile_x", "sp", [-1, 1, 14, 2]], ["tile_rcc", "sp", [-1, 32]], ["tile_ry", "sp", [-1, 1]], ["tile_rx", "sp", [-1, 1]], ["auto_unroll_max_step", "ot", 512], ["unroll_explicit", "ot", 0]]}, "result": [[0.0020548610000000003], 0, 10.973416805267334, 1611813965.0269597], "version": 0.2, "tvm_version": "0.8.dev0"}
{"input": ["opencl -keys=opencl,gpu -max_num_threads=256", "conv2d_NCHWc_KCRSk_tx_tune", [[1, 32, 56, 56, 4], [32, 128, 1, 1, 4]], {}], "config": {"index": 1891818, "code_hash": null, "entity": [["tile_fc", "sp", [-1, 1, 2, 2]], ["tile_y", "sp", [-1, 1, 8, 1]], ["tile_x", "sp", [-1, 1, 8, 1]], ["tile_rcc", "sp", [-1, 32]], ["tile_ry", "sp", [-1, 1]], ["tile_rx", "sp", [-1, 1]], ["auto_unroll_max_step", "ot", 0], ["unroll_explicit", "ot", 0]]}, "result": [[0.002378889], 0, 12.093003273010254, 1611813966.1679025], "version": 0.2, "tvm_version": "0.8.dev0"}
{"input": ["opencl -keys=opencl,gpu -max_num_threads=256", "conv2d_NCHWc_KCRSk_tx_tune", [[1, 32, 56, 56, 4], [32, 128, 1, 1, 4]], {}], "config": {"index": 8364974, "code_hash": null, "entity": [["tile_fc", "sp", [-1, 1, 4, 2]], ["tile_y", "sp", [-1, 1, 4, 1]], ["tile_x", "sp", [-1, 1, 28, 1]], ["tile_rcc", "sp", [-1, 32]], ["tile_ry", "sp", [-1, 1]], ["tile_rx", "sp", [-1, 1]], ["auto_unroll_max_step", "ot", 0], ["unroll_explicit", "ot", 1]]}, "result": [[0.002465816], 0, 13.250365495681763, 1611813967.3542893], "version": 0.2, "tvm_version": "0.8.dev0"}
{"input": ["opencl -keys=opencl,gpu -max_num_threads=256", "conv2d_NCHWc_KCRSk_tx_tune", [[1, 32, 56, 56, 4], [32, 128, 1, 1, 4]], {}], "config": {"index": 10515370, "code_hash": null, "entity": [["tile_fc", "sp", [-1, 1, 2, 2]], ["tile_y", "sp", [-1, 1, 4, 1]], ["tile_x", "sp", [-1, 1, 28, 1]], ["tile_rcc", "sp", [-1, 32]], ["tile_ry", "sp", [-1, 1]], ["tile_rx", "sp", [-1, 1]], ["auto_unroll_max_step", "ot", 512], ["unroll_explicit", "ot", 1]]}, "result": [[0.0021730729999999998], 0, 14.710449695587158, 1611813968.6267343], "version": 0.2, "tvm_version": "0.8.dev0"}
{"input": ["opencl -keys=opencl,gpu -max_num_threads=256", "conv2d_NCHWc_KCRSk_tx_tune", [[1, 32, 56, 56, 4], [32, 128, 1, 1, 4]], {}], "config": {"index": 4145019, "code_hash": null, "entity": [["tile_fc", "sp", [-1, 1, 4, 1]], ["tile_y", "sp", [-1, 1, 7, 1]], ["tile_x", "sp", [-1, 1, 14, 2]], ["tile_rcc", "sp", [-1, 32]], ["tile_ry", "sp", [-1, 1]], ["tile_rx", "sp", [-1, 1]], ["auto_unroll_max_step", "ot", 512], ["unroll_explicit", "ot", 0]]}, "result": [[0.0021886460000000003], 0, 15.671596050262451, 1611813969.8037183], "version": 0.2, "tvm_version": "0.8.dev0"}
{"input": ["opencl -keys=opencl,gpu -max_num_threads=256", "conv2d_NCHWc_KCRSk_tx_tune", [[1, 32, 56, 56, 4], [32, 128, 1, 1, 4]], {}], "config": {"index": 8342794, "code_hash": null, "entity": [["tile_fc", "sp", [-1, 1, 2, 2]], ["tile_y", "sp", [-1, 1, 7, 1]], ["tile_x", "sp", [-1, 1, 8, 1]], ["tile_rcc", "sp", [-1, 32]], ["tile_ry", "sp", [-1, 1]], ["tile_rx", "sp", [-1, 1]], ["auto_unroll_max_step", "ot", 0], ["unroll_explicit", "ot", 1]]}, "result": [[0.002252760333333333], 0, 16.83834481239319, 1611813971.007131], "version": 0.2, "tvm_version": "0.8.dev0"}
{"input": ["opencl -keys=opencl,gpu -max_num_threads=256", "conv2d_NCHWc_KCRSk_tx_tune", [[1, 32, 56, 56, 4], [32, 128, 1, 1, 4]], {}], "config": {"index": 2927546, "code_hash": null, "entity": [["tile_fc", "sp", [-1, 2, 8, 2]], ["tile_y", "sp", [-1, 2, 2, 2]], ["tile_x", "sp", [-1, 28, 2, 1]], ["tile_rcc", "sp", [-1, 4]], ["tile_ry", "sp", [-1, 1]], ["tile_rx", "sp", [-1, 1]], ["auto_unroll_max_step", "ot", 512], ["unroll_explicit", "ot", 0]]}, "result": [[0.120064375], 0, 19.240395307540894, 1611813973.3991342], "version": 0.2, "tvm_version": "0.8.dev0"}
{"input": ["opencl -keys=opencl,gpu -max_num_threads=256", "conv2d_NCHWc_KCRSk_tx_tune", [[1, 32, 56, 56, 4], [32, 128, 1, 1, 4]], {}], "config": {"index": 2959674, "code_hash": null, "entity": [["tile_fc", "sp", [-1, 1, 16, 1]], ["tile_y", "sp", [-1, 14, 1, 4]], ["tile_x", "sp", [-1, 4, 7, 1]], ["tile_rcc", "sp", [-1, 4]], ["tile_ry", "sp", [-1, 1]], ["tile_rx", "sp", [-1, 1]], ["auto_unroll_max_step", "ot", 512], ["unroll_explicit", "ot", 0]]}, "result": [[0.11753199666666668], 0, 21.794983625411987, 1611813975.8458476], "version": 0.2, "tvm_version": "0.8.dev0"}
