logs/conv2d_cuda_NCHWc_KCRSk_tune.log
{"input": ["opencl -keys=opencl,gpu -max_num_threads=256", "conv2d_cuda_NCHWc_KCRSk_tune", [[1, 32, 56, 56, 4], [32, 128, 1, 1, 4]], {}], "config": {"index": 457034, "code_hash": null, "entity": [["tile_n", "sp", [-1, 1, 1, 1]], ["tile_f", "sp", [-1, 1, 16, 1]], ["tile_y", "sp", [-1, 2, 1, 1]], ["tile_x", "sp", [-1, 1, 8, 1]], ["fuse_yx", "ot", 1], ["tile_rc", "sp", [-1, 1]], ["tile_ry", "sp", [-1, 1]], ["tile_rx", "sp", [-1, 1]]]}, "result": [[0.0029163438], 0, 4.413477659225464, 1610496779.8412113], "version": 0.2, "tvm_version": "0.8.dev0"}
