logs/conv2d_mali_NCHW_KCRS_tune_1024.log
{"input": ["opencl -keys=opencl,gpu -max_num_threads=256", "conv2d_mali_NCHW_KCRS_tune", [[1, 128, 56, 56], [128, 128, 1, 1]], {}], "config": {"index": 3476873, "code_hash": null, "entity": [["tile_co", "sp", [-1, 8, 16]], ["tile_oh", "sp", [-1, 2, 2]], ["tile_ow", "sp", [-1, 2, 2]], ["reorder_0", "re", [0, 1, 2, 3, 4, 5, 6, 9, 7, 8]], ["ann_reduce", "an", ["none", "unroll"]], ["ann_spatial", "an", ["unroll", "unroll", "vec"]]]}, "result": [[0.0031578540000000003], 0, 2.653921604156494, 1596002475.9144719], "version": 0.2, "tvm_version": "0.8.dev0"}
