logs/conv2d_1x1_WCHNc_CRSKk_no_sync_on_free_3072.log
{"input": ["opencl -keys=opencl,gpu -max_num_threads=256", "conv2d_1x1_WCHNc_CRSKk_tune", [[56, 32, 56, 1, 4], [128, 1, 1, 32, 4]], {}], "config": {"index": 2213949, "code_hash": null, "entity": [["tile_f", "sp", [-1, 1, 8, 4]], ["tile_w", "sp", [-1, 1, 4, 1]], ["tile_h", "sp", [-1, 1, 4, 1]], ["auto_unroll_max_step", "ot", 0], ["unroll_explicit", "ot", 0], ["tile_c", "sp", [-1, 2]], ["tile_kh", "sp", [-1, 1]], ["tile_kw", "sp", [-1, 1]]]}, "result": [[0.002540396], 0, 4.821569204330444, 1610158444.417228], "version": 0.2, "tvm_version": "0.8.dev0"}
