logs/conv2d_NCHWc_KCRSk_tx_tune_1024.log
{"input": ["opencl -keys=opencl,gpu -max_num_threads=256", "conv2d_NCHWc_KCRSk_tx_tune", [[1, 32, 56, 56, 4], [32, 128, 1, 1, 4]], {}], "config": {"index": 8722643, "code_hash": null, "entity": [["tile_fc", "sp", [-1, 2, 2, 2]], ["tile_y", "sp", [-1, 2, 1, 1]], ["tile_x", "sp", [-1, 1, 28, 1]], ["tile_rcc", "sp", [-1, 1]], ["tile_ry", "sp", [-1, 1]], ["tile_rx", "sp", [-1, 1]], ["auto_unroll_max_step", "ot", 512], ["unroll_explicit", "ot", 1]]}, "result": [[0.0012458126], 0, 14.799305438995361, 1610565198.2448192], "version": 0.2, "tvm_version": "0.8.dev0"}
