logs/conv2d_1x1_WCHNc_CRSKk_4096.log
{"input": ["opencl -keys=opencl,gpu -max_num_threads=256", "conv2d_1x1_WCHNc_CRSKk_tune", [[56, 32, 56, 1, 4], [128, 1, 1, 32, 4]], {}], "config": {"index": 5081122, "code_hash": null, "entity": [["tile_f", "sp", [-1, 1, 16, 1]], ["tile_w", "sp", [-1, 1, 4, 1]], ["tile_h", "sp", [-1, 1, 4, 1]], ["auto_unroll_max_step", "ot", 1500], ["unroll_explicit", "ot", 0], ["tile_c", "sp", [-1, 4]], ["tile_kh", "sp", [-1, 1]], ["tile_kw", "sp", [-1, 1]]]}, "result": [[0.0026139168000000003], 0, 13.162434577941895, 1610066825.670776], "version": 0.2, "tvm_version": "0.8.dev0"}
