logs/conv2d_cuda_NCHW_KCRS_1024.log
{"input": ["opencl -keys=opencl,gpu -max_num_threads=256", "conv2d_cuda_NCHW_KCRS_tune", [[1, 128, 56, 56], [128, 128, 1, 1]], {}], "config": {"index": 25030818, "code_hash": null, "entity": [["tile_f", "sp", [-1, 8, 4, 1]], ["tile_y", "sp", [-1, 1, 1, 2]], ["tile_x", "sp", [-1, 1, 28, 2]], ["tile_rc", "sp", [-1, 1]], ["tile_ry", "sp", [-1, 1]], ["tile_rx", "sp", [-1, 1]], ["auto_unroll_max_step", "ot", 512], ["unroll_explicit", "ot", 1]]}, "result": [[0.0016949168000000001], 0, 6.855984926223755, 1610397877.3289146], "version": 0.2, "tvm_version": "0.8.dev0"}
