logs/conv2d_NCHWc_KCRSk_tx_tune2.texture.autotvm_1500.log
{"input": ["opencl -keys=opencl,gpu -max_num_threads=256", "conv2d_NCHWc_KCRSk_tx_tune2", [[1, 32, 112, 112, 4], [32, 128, 3, 3, 4]], {}], "config": {"index": 31729331, "code_hash": null, "entity": [["tile_fc", "sp", [-1, 1, 4, 1]], ["tile_y", "sp", [-1, 10, 1, 1]], ["tile_x", "sp", [-1, 10, 11, 1]], ["tile_rcc", "sp", [-1, 1]], ["tile_ry", "sp", [-1, 3]], ["tile_rx", "sp", [-1, 3]], ["auto_unroll_max_step", "ot", 1500], ["unroll_explicit", "ot", 1]]}, "result": [[6.2096463690000006], 0, 70.89700436592102, 1611733025.3121176], "version": 0.2, "tvm_version": "0.8.dev0"}
{"input": ["opencl -keys=opencl,gpu -max_num_threads=256", "conv2d_NCHWc_KCRSk_tx_tune2", [[1, 32, 112, 112, 4], [32, 128, 3, 3, 4]], {}], "config": {"index": 16525728, "code_hash": null, "entity": [["tile_fc", "sp", [-1, 2, 8, 1]], ["tile_y", "sp", [-1, 1, 2, 55]], ["tile_x", "sp", [-1, 5, 1, 1]], ["tile_rcc", "sp", [-1, 1]], ["tile_ry", "sp", [-1, 1]], ["tile_rx", "sp", [-1, 1]], ["auto_unroll_max_step", "ot", 0], ["unroll_explicit", "ot", 1]]}, "result": [[2.592625485], 0, 97.98897099494934, 1611733053.4034467], "version": 0.2, "tvm_version": "0.8.dev0"}
{"input": ["opencl -keys=opencl,gpu -max_num_threads=256", "conv2d_NCHWc_KCRSk_tx_tune2", [[1, 32, 112, 112, 4], [32, 128, 3, 3, 4]], {}], "config": {"index": 22076147, "code_hash": null, "entity": [["tile_fc", "sp", [-1, 1, 4, 8]], ["tile_y", "sp", [-1, 1, 2, 5]], ["tile_x", "sp", [-1, 22, 5, 1]], ["tile_rcc", "sp", [-1, 1]], ["tile_ry", "sp", [-1, 1]], ["tile_rx", "sp", [-1, 1]], ["auto_unroll_max_step", "ot", 512], ["unroll_explicit", "ot", 1]]}, "result": [[4.255671005333333], 0, 47.74462628364563, 1611733107.78031], "version": 0.2, "tvm_version": "0.8.dev0"}
{"input": ["opencl -keys=opencl,gpu -max_num_threads=256", "conv2d_NCHWc_KCRSk_tx_tune2", [[1, 32, 112, 112, 4], [32, 128, 3, 3, 4]], {}], "config": {"index": 2914931, "code_hash": null, "entity": [["tile_fc", "sp", [-1, 2, 16, 1]], ["tile_y", "sp", [-1, 5, 11, 1]], ["tile_x", "sp", [-1, 1, 1, 10]], ["tile_rcc", "sp", [-1, 1]], ["tile_ry", "sp", [-1, 1]], ["tile_rx", "sp", [-1, 3]], ["auto_unroll_max_step", "ot", 0], ["unroll_explicit", "ot", 0]]}, "result": [[4.359237203], 0, 91.25558710098267, 1611733151.955308], "version": 0.2, "tvm_version": "0.8.dev0"}
{"input": ["opencl -keys=opencl,gpu -max_num_threads=256", "conv2d_NCHWc_KCRSk_tx_tune2", [[1, 32, 112, 112, 4], [32, 128, 3, 3, 4]], {}], "config": {"index": 17892520, "code_hash": null, "entity": [["tile_fc", "sp", [-1, 2, 8, 1]], ["tile_y", "sp", [-1, 10, 11, 1]], ["tile_x", "sp", [-1, 1, 1, 1]], ["tile_rcc", "sp", [-1, 1]], ["tile_ry", "sp", [-1, 3]], ["tile_rx", "sp", [-1, 1]], ["auto_unroll_max_step", "ot", 0], ["unroll_explicit", "ot", 1]]}, "result": [[0.057245868], 0, 95.1374523639679, 1611733155.80302], "version": 0.2, "tvm_version": "0.8.dev0"}
{"input": ["opencl -keys=opencl,gpu -max_num_threads=256", "conv2d_NCHWc_KCRSk_tx_tune2", [[1, 32, 112, 112, 4], [32, 128, 3, 3, 4]], {}], "config": {"index": 1593581, "code_hash": null, "entity": [["tile_fc", "sp", [-1, 1, 8, 4]], ["tile_y", "sp", [-1, 1, 2, 5]], ["tile_x", "sp", [-1, 1, 1, 55]], ["tile_rcc", "sp", [-1, 1]], ["tile_ry", "sp", [-1, 3]], ["tile_rx", "sp", [-1, 1]], ["auto_unroll_max_step", "ot", 0], ["unroll_explicit", "ot", 0]]}, "result": [[1.6288794956666666], 0, 19.74878454208374, 1611733176.5984309], "version": 0.2, "tvm_version": "0.8.dev0"}
{"input": ["opencl -keys=opencl,gpu -max_num_threads=256", "conv2d_NCHWc_KCRSk_tx_tune2", [[1, 32, 112, 112, 4], [32, 128, 3, 3, 4]], {}], "config": {"index": 4145487, "code_hash": null, "entity": [["tile_fc", "sp", [-1, 2, 4, 2]], ["tile_y", "sp", [-1, 1, 11, 5]], ["tile_x", "sp", [-1, 11, 1, 1]], ["tile_rcc", "sp", [-1, 1]], ["tile_ry", "sp", [-1, 3]], ["tile_rx", "sp", [-1, 3]], ["auto_unroll_max_step", "ot", 0], ["unroll_explicit", "ot", 0]]}, "result": [[3.594335068], 0, 57.03729295730591, 1611733213.7735271], "version": 0.2, "tvm_version": "0.8.dev0"}
{"input": ["opencl -keys=opencl,gpu -max_num_threads=256", "conv2d_NCHWc_KCRSk_tx_tune2", [[1, 32, 112, 112, 4], [32, 128, 3, 3, 4]], {}], "config": {"index": 29075776, "code_hash": null, "entity": [["tile_fc", "sp", [-1, 2, 8, 1]], ["tile_y", "sp", [-1, 1, 11, 5]], ["tile_x", "sp", [-1, 1, 1, 11]], ["tile_rcc", "sp", [-1, 1]], ["tile_ry", "sp", [-1, 3]], ["tile_rx", "sp", [-1, 1]], ["auto_unroll_max_step", "ot", 1500], ["unroll_explicit", "ot", 1]]}, "result": [[2.112789148666667], 0, 83.21187210083008, 1611733239.244368], "version": 0.2, "tvm_version": "0.8.dev0"}
{"input": ["opencl -keys=opencl,gpu -max_num_threads=256", "conv2d_NCHWc_KCRSk_tx_tune2", [[1, 32, 112, 112, 4], [32, 128, 3, 3, 4]], {}], "config": {"index": 1436655, "code_hash": null, "entity": [["tile_fc", "sp", [-1, 2, 4, 2]], ["tile_y", "sp", [-1, 1, 5, 11]], ["tile_x", "sp", [-1, 1, 10, 1]], ["tile_rcc", "sp", [-1, 1]], ["tile_ry", "sp", [-1, 3]], ["tile_rx", "sp", [-1, 1]], ["auto_unroll_max_step", "ot", 0], ["unroll_explicit", "ot", 0]]}, "result": [[4.059250380333333], 0, 44.18299150466919, 1611733602.6219075], "version": 0.2, "tvm_version": "0.8.dev0"}
{"input": ["opencl -keys=opencl,gpu -max_num_threads=256", "conv2d_NCHWc_KCRSk_tx_tune2", [[1, 32, 112, 112, 4], [32, 128, 3, 3, 4]], {}], "config": {"index": 2798613, "code_hash": null, "entity": [["tile_fc", "sp", [-1, 4, 4, 1]], ["tile_y", "sp", [-1, 2, 5, 11]], ["tile_x", "sp", [-1, 1, 5, 1]], ["tile_rcc", "sp", [-1, 1]], ["tile_ry", "sp", [-1, 1]], ["tile_rx", "sp", [-1, 3]], ["auto_unroll_max_step", "ot", 0], ["unroll_explicit", "ot", 0]]}, "result": [[3.5974964223333337], 0, 84.07633900642395, 1611733642.1652946], "version": 0.2, "tvm_version": "0.8.dev0"}
{"input": ["opencl -keys=opencl,gpu -max_num_threads=256", "conv2d_NCHWc_KCRSk_tx_tune2", [[1, 32, 112, 112, 4], [32, 128, 3, 3, 4]], {}], "config": {"index": 8328577, "code_hash": null, "entity": [["tile_fc", "sp", [-1, 1, 8, 2]], ["tile_y", "sp", [-1, 1, 2, 11]], ["tile_x", "sp", [-1, 2, 11, 1]], ["tile_rcc", "sp", [-1, 1]], ["tile_ry", "sp", [-1, 1]], ["tile_rx", "sp", [-1, 3]], ["auto_unroll_max_step", "ot", 512], ["unroll_explicit", "ot", 0]]}, "result": [[4.347212550333333], 0, 130.46310448646545, 1611733688.7447987], "version": 0.2, "tvm_version": "0.8.dev0"}
{"input": ["opencl -keys=opencl,gpu -max_num_threads=256", "conv2d_NCHWc_KCRSk_tx_tune2", [[1, 32, 112, 112, 4], [32, 128, 3, 3, 4]], {}], "config": {"index": 12446703, "code_hash": null, "entity": [["tile_fc", "sp", [-1, 2, 4, 2]], ["tile_y", "sp", [-1, 1, 5, 11]], ["tile_x", "sp", [-1, 1, 10, 1]], ["tile_rcc", "sp", [-1, 1]], ["tile_ry", "sp", [-1, 3]], ["tile_rx", "sp", [-1, 1]], ["auto_unroll_max_step", "ot", 1500], ["unroll_explicit", "ot", 0]]}, "result": [[4.2461105366666665], 0, 42.742347717285156, 1611733732.866348], "version": 0.2, "tvm_version": "0.8.dev0"}
{"input": ["opencl -keys=opencl,gpu -max_num_threads=256", "conv2d_NCHWc_KCRSk_tx_tune2", [[1, 32, 112, 112, 4], [32, 128, 3, 3, 4]], {}], "config": {"index": 8371680, "code_hash": null, "entity": [["tile_fc", "sp", [-1, 2, 8, 1]], ["tile_y", "sp", [-1, 1, 5, 11]], ["tile_x", "sp", [-1, 1, 5, 2]], ["tile_rcc", "sp", [-1, 1]], ["tile_ry", "sp", [-1, 1]], ["tile_rx", "sp", [-1, 3]], ["auto_unroll_max_step", "ot", 512], ["unroll_explicit", "ot", 0]]}, "result": [[3.8799026546666666], 0, 85.05291676521301, 1611733775.1647964], "version": 0.2, "tvm_version": "0.8.dev0"}
{"input": ["opencl -keys=opencl,gpu -max_num_threads=256", "conv2d_NCHWc_KCRSk_tx_tune2", [[1, 32, 112, 112, 4], [32, 128, 3, 3, 4]], {}], "config": {"index": 6941679, "code_hash": null, "entity": [["tile_fc", "sp", [-1, 2, 4, 2]], ["tile_y", "sp", [-1, 1, 5, 11]], ["tile_x", "sp", [-1, 1, 10, 1]], ["tile_rcc", "sp", [-1, 1]], ["tile_ry", "sp", [-1, 3]], ["tile_rx", "sp", [-1, 1]], ["auto_unroll_max_step", "ot", 512], ["unroll_explicit", "ot", 0]]}, "result": [[4.062384512333334], 0, 125.89552354812622, 1611733816.0119984], "version": 0.2, "tvm_version": "0.8.dev0"}
{"input": ["opencl -keys=opencl,gpu -max_num_threads=256", "conv2d_NCHWc_KCRSk_tx_tune2", [[1, 32, 112, 112, 4], [32, 128, 3, 3, 4]], {}], "config": {"index": 30391773, "code_hash": null, "entity": [["tile_fc", "sp", [-1, 4, 4, 1]], ["tile_y", "sp", [-1, 1, 5, 11]], ["tile_x", "sp", [-1, 1, 5, 2]], ["tile_rcc", "sp", [-1, 1]], ["tile_ry", "sp", [-1, 1]], ["tile_rx", "sp", [-1, 3]], ["auto_unroll_max_step", "ot", 1500], ["unroll_explicit", "ot", 1]]}, "result": [[6.0553788866666665], 0, 191.98448038101196, 1611733881.1663043], "version": 0.2, "tvm_version": "0.8.dev0"}
{"input": ["opencl -keys=opencl,gpu -max_num_threads=256", "conv2d_NCHWc_KCRSk_tx_tune2", [[1, 32, 112, 112, 4], [32, 128, 3, 3, 4]], {}], "config": {"index": 17951727, "code_hash": null, "entity": [["tile_fc", "sp", [-1, 2, 4, 2]], ["tile_y", "sp", [-1, 1, 5, 11]], ["tile_x", "sp", [-1, 1, 10, 1]], ["tile_rcc", "sp", [-1, 1]], ["tile_ry", "sp", [-1, 3]], ["tile_rx", "sp", [-1, 1]], ["auto_unroll_max_step", "ot", 0], ["unroll_explicit", "ot", 1]]}, "result": [[4.143460953333333], 0, 242.17145466804504, 1611733932.3683777], "version": 0.2, "tvm_version": "0.8.dev0"}
{"input": ["opencl -keys=opencl,gpu -max_num_threads=256", "conv2d_NCHWc_KCRSk_tx_tune2", [[1, 32, 112, 112, 4], [32, 128, 3, 3, 4]], {}], "config": {"index": 28951005, "code_hash": null, "entity": [["tile_fc", "sp", [-1, 4, 4, 1]], ["tile_y", "sp", [-1, 1, 5, 11]], ["tile_x", "sp", [-1, 2, 5, 1]], ["tile_rcc", "sp", [-1, 1]], ["tile_ry", "sp", [-1, 3]], ["tile_rx", "sp", [-1, 1]], ["auto_unroll_max_step", "ot", 1500], ["unroll_explicit", "ot", 1]]}, "result": [[8.129900778], 0, 326.502427816391, 1611734016.0566916], "version": 0.2, "tvm_version": "0.8.dev0"}
{"input": ["opencl -keys=opencl,gpu -max_num_threads=256", "conv2d_NCHWc_KCRSk_tx_tune2", [[1, 32, 112, 112, 4], [32, 128, 3, 3, 4]], {}], "config": {"index": 19381725, "code_hash": null, "entity": [["tile_fc", "sp", [-1, 4, 4, 1]], ["tile_y", "sp", [-1, 1, 5, 11]], ["tile_x", "sp", [-1, 1, 5, 2]], ["tile_rcc", "sp", [-1, 1]], ["tile_ry", "sp", [-1, 1]], ["tile_rx", "sp", [-1, 3]], ["auto_unroll_max_step", "ot", 0], ["unroll_explicit", "ot", 1]]}, "result": [[3.117697846], 0, 32.53599214553833, 1611734057.3837328], "version": 0.2, "tvm_version": "0.8.dev0"}
{"input": ["opencl -keys=opencl,gpu -max_num_threads=256", "conv2d_NCHWc_KCRSk_tx_tune2", [[1, 32, 112, 112, 4], [32, 128, 3, 3, 4]], {}], "config": {"index": 24886749, "code_hash": null, "entity": [["tile_fc", "sp", [-1, 4, 4, 1]], ["tile_y", "sp", [-1, 1, 5, 11]], ["tile_x", "sp", [-1, 1, 5, 2]], ["tile_rcc", "sp", [-1, 1]], ["tile_ry", "sp", [-1, 1]], ["tile_rx", "sp", [-1, 3]], ["auto_unroll_max_step", "ot", 512], ["unroll_explicit", "ot", 1]]}, "result": [[1.839117881], 0, 54.75269317626953, 1611734079.093685], "version": 0.2, "tvm_version": "0.8.dev0"}
{"input": ["opencl -keys=opencl,gpu -max_num_threads=256", "conv2d_NCHWc_KCRSk_tx_tune2", [[1, 32, 112, 112, 4], [32, 128, 3, 3, 4]], {}], "config": {"index": 30323733, "code_hash": null, "entity": [["tile_fc", "sp", [-1, 4, 4, 1]], ["tile_y", "sp", [-1, 2, 5, 11]], ["tile_x", "sp", [-1, 1, 5, 1]], ["tile_rcc", "sp", [-1, 1]], ["tile_ry", "sp", [-1, 1]], ["tile_rx", "sp", [-1, 3]], ["auto_unroll_max_step", "ot", 1500], ["unroll_explicit", "ot", 1]]}, "result": [[8.446524493333333], 0, 147.85315561294556, 1611734171.8801594], "version": 0.2, "tvm_version": "0.8.dev0"}
{"input": ["opencl -keys=opencl,gpu -max_num_threads=256", "conv2d_NCHWc_KCRSk_tx_tune2", [[1, 32, 112, 112, 4], [32, 128, 3, 3, 4]], {}], "config": {"index": 19317216, "code_hash": null, "entity": [["tile_fc", "sp", [-1, 2, 8, 1]], ["tile_y", "sp", [-1, 1, 5, 11]], ["tile_x", "sp", [-1, 2, 5, 1]], ["tile_rcc", "sp", [-1, 1]], ["tile_ry", "sp", [-1, 1]], ["tile_rx", "sp", [-1, 3]], ["auto_unroll_max_step", "ot", 0], ["unroll_explicit", "ot", 1]]}, "result": [[4.6234657100000005], 0, 193.00972747802734, 1611734217.8757398], "version": 0.2, "tvm_version": "0.8.dev0"}
{"input": ["opencl -keys=opencl,gpu -max_num_threads=256", "conv2d_NCHWc_KCRSk_tx_tune2", [[1, 32, 112, 112, 4], [32, 128, 3, 3, 4]], {}], "config": {"index": 23510493, "code_hash": null, "entity": [["tile_fc", "sp", [-1, 4, 4, 1]], ["tile_y", "sp", [-1, 1, 5, 11]], ["tile_x", "sp", [-1, 1, 5, 2]], ["tile_rcc", "sp", [-1, 1]], ["tile_ry", "sp", [-1, 3]], ["tile_rx", "sp", [-1, 1]], ["auto_unroll_max_step", "ot", 512], ["unroll_explicit", "ot", 1]]}, "result": [[1.85622493], 0, 215.41686964035034, 1611734239.8326678], "version": 0.2, "tvm_version": "0.8.dev0"}
{"input": ["opencl -keys=opencl,gpu -max_num_threads=256", "conv2d_NCHWc_KCRSk_tx_tune2", [[1, 32, 112, 112, 4], [32, 128, 3, 3, 4]], {}], "config": {"index": 28918077, "code_hash": null, "entity": [["tile_fc", "sp", [-1, 4, 4, 1]], ["tile_y", "sp", [-1, 1, 11, 5]], ["tile_x", "sp", [-1, 11, 1, 1]], ["tile_rcc", "sp", [-1, 1]], ["tile_ry", "sp", [-1, 3]], ["tile_rx", "sp", [-1, 1]], ["auto_unroll_max_step", "ot", 1500], ["unroll_explicit", "ot", 1]]}, "result": [[6.166407428333333], 0, 286.3228385448456, 1611734310.2713509], "version": 0.2, "tvm_version": "0.8.dev0"}
{"input": ["opencl -keys=opencl,gpu -max_num_threads=256", "conv2d_NCHWc_KCRSk_tx_tune2", [[1, 32, 112, 112, 4], [32, 128, 3, 3, 4]], {}], "config": {"index": 28918095, "code_hash": null, "entity": [["tile_fc", "sp", [-1, 2, 4, 2]], ["tile_y", "sp", [-1, 1, 11, 5]], ["tile_x", "sp", [-1, 11, 1, 1]], ["tile_rcc", "sp", [-1, 1]], ["tile_ry", "sp", [-1, 3]], ["tile_rx", "sp", [-1, 1]], ["auto_unroll_max_step", "ot", 1500], ["unroll_explicit", "ot", 1]]}, "result": [[7.579106021666667], 0, 367.5651361942291, 1611734391.3211026], "version": 0.2, "tvm_version": "0.8.dev0"}
{"input": ["opencl -keys=opencl,gpu -max_num_threads=256", "conv2d_NCHWc_KCRSk_tx_tune2", [[1, 32, 112, 112, 4], [32, 128, 3, 3, 4]], {}], "config": {"index": 30287837, "code_hash": null, "entity": [["tile_fc", "sp", [-1, 4, 4, 1]], ["tile_y", "sp", [-1, 1, 5, 11]], ["tile_x", "sp", [-1, 5, 1, 1]], ["tile_rcc", "sp", [-1, 1]], ["tile_ry", "sp", [-1, 1]], ["tile_rx", "sp", [-1, 3]], ["auto_unroll_max_step", "ot", 1500], ["unroll_explicit", "ot", 1]]}, "result": [[18.453886087], 0, 557.1639273166656, 1611734581.1388783], "version": 0.2, "tvm_version": "0.8.dev0"}
{"input": ["opencl -keys=opencl,gpu -max_num_threads=256", "conv2d_NCHWc_KCRSk_tx_tune2", [[1, 32, 112, 112, 4], [32, 128, 3, 3, 4]], {}], "config": {"index": 30283637, "code_hash": null, "entity": [["tile_fc", "sp", [-1, 4, 4, 1]], ["tile_y", "sp", [-1, 2, 11, 5]], ["tile_x", "sp", [-1, 2, 1, 1]], ["tile_rcc", "sp", [-1, 1]], ["tile_ry", "sp", [-1, 1]], ["tile_rx", "sp", [-1, 3]], ["auto_unroll_max_step", "ot", 1500], ["unroll_explicit", "ot", 1]]}, "result": [[9.417785829666666], 0, 653.3784370422363, 1611734677.790604], "version": 0.2, "tvm_version": "0.8.dev0"}
{"input": ["opencl -keys=opencl,gpu -max_num_threads=256", "conv2d_NCHWc_KCRSk_tx_tune2", [[1, 32, 112, 112, 4], [32, 128, 3, 3, 4]], {}], "config": {"index": 30376821, "code_hash": null, "entity": [["tile_fc", "sp", [-1, 4, 4, 1]], ["tile_y", "sp", [-1, 2, 11, 5]], ["tile_x", "sp", [-1, 1, 1, 2]], ["tile_rcc", "sp", [-1, 1]], ["tile_ry", "sp", [-1, 1]], ["tile_rx", "sp", [-1, 3]], ["auto_unroll_max_step", "ot", 1500], ["unroll_explicit", "ot", 1]]}, "result": [[9.485281472], 0, 751.4387049674988, 1611734775.6201832], "version": 0.2, "tvm_version": "0.8.dev0"}
{"input": ["opencl -keys=opencl,gpu -max_num_threads=256", "conv2d_NCHWc_KCRSk_tx_tune2", [[1, 32, 112, 112, 4], [32, 128, 3, 3, 4]], {}], "config": {"index": 9766258, "code_hash": null, "entity": [["tile_fc", "sp", [-1, 1, 2, 2]], ["tile_y", "sp", [-1, 2, 1, 55]], ["tile_x", "sp", [-1, 1, 1, 5]], ["tile_rcc", "sp", [-1, 1]], ["tile_ry", "sp", [-1, 3]], ["tile_rx", "sp", [-1, 3]], ["auto_unroll_max_step", "ot", 512], ["unroll_explicit", "ot", 0]]}, "result": [[4.0924221166666666], 0, 797.0871350765228, 1611734822.287866], "version": 0.2, "tvm_version": "0.8.dev0"}
{"input": ["opencl -keys=opencl,gpu -max_num_threads=256", "conv2d_NCHWc_KCRSk_tx_tune2", [[1, 32, 112, 112, 4], [32, 128, 3, 3, 4]], {}], "config": {"index": 16731150, "code_hash": null, "entity": [["tile_fc", "sp", [-1, 1, 4, 2]], ["tile_y", "sp", [-1, 1, 11, 1]], ["tile_x", "sp", [-1, 1, 1, 55]], ["tile_rcc", "sp", [-1, 1]], ["tile_ry", "sp", [-1, 1]], ["tile_rx", "sp", [-1, 1]], ["auto_unroll_max_step", "ot", 0], ["unroll_explicit", "ot", 1]]}, "result": [[0.9171817703333334], 0, 12.720960855484009, 1611735095.0029328], "version": 0.2, "tvm_version": "0.8.dev0"}
{"input": ["opencl -keys=opencl,gpu -max_num_threads=256", "conv2d_NCHWc_KCRSk_tx_tune2", [[1, 32, 112, 112, 4], [32, 128, 3, 3, 4]], {}], "config": {"index": 16731153, "code_hash": null, "entity": [["tile_fc", "sp", [-1, 1, 8, 2]], ["tile_y", "sp", [-1, 1, 11, 1]], ["tile_x", "sp", [-1, 1, 1, 55]], ["tile_rcc", "sp", [-1, 1]], ["tile_ry", "sp", [-1, 1]], ["tile_rx", "sp", [-1, 1]], ["auto_unroll_max_step", "ot", 0], ["unroll_explicit", "ot", 1]]}, "result": [[0.8397270136666667], 0, 24.28781270980835, 1611735106.5940099], "version": 0.2, "tvm_version": "0.8.dev0"}
{"input": ["opencl -keys=opencl,gpu -max_num_threads=256", "conv2d_NCHWc_KCRSk_tx_tune2", [[1, 32, 112, 112, 4], [32, 128, 3, 3, 4]], {}], "config": {"index": 19399256, "code_hash": null, "entity": [["tile_fc", "sp", [-1, 2, 8, 1]], ["tile_y", "sp", [-1, 1, 11, 10]], ["tile_x", "sp", [-1, 1, 1, 5]], ["tile_rcc", "sp", [-1, 1]], ["tile_ry", "sp", [-1, 1]], ["tile_rx", "sp", [-1, 3]], ["auto_unroll_max_step", "ot", 0], ["unroll_explicit", "ot", 1]]}, "result": [[1.0425798606666665], 0, 37.919594526290894, 1611735119.8222], "version": 0.2, "tvm_version": "0.8.dev0"}
{"input": ["opencl -keys=opencl,gpu -max_num_threads=256", "conv2d_NCHWc_KCRSk_tx_tune2", [[1, 32, 112, 112, 4], [32, 128, 3, 3, 4]], {}], "config": {"index": 16647265, "code_hash": null, "entity": [["tile_fc", "sp", [-1, 1, 8, 2]], ["tile_y", "sp", [-1, 1, 10, 11]], ["tile_x", "sp", [-1, 1, 1, 5]], ["tile_rcc", "sp", [-1, 1]], ["tile_ry", "sp", [-1, 1]], ["tile_rx", "sp", [-1, 1]], ["auto_unroll_max_step", "ot", 0], ["unroll_explicit", "ot", 1]]}, "result": [[1.0859663536666666], 0, 51.50132203102112, 1611735133.5187004], "version": 0.2, "tvm_version": "0.8.dev0"}
{"input": ["opencl -keys=opencl,gpu -max_num_threads=256", "conv2d_NCHWc_KCRSk_tx_tune2", [[1, 32, 112, 112, 4], [32, 128, 3, 3, 4]], {}], "config": {"index": 16646758, "code_hash": null, "entity": [["tile_fc", "sp", [-1, 1, 4, 2]], ["tile_y", "sp", [-1, 1, 11, 10]], ["tile_x", "sp", [-1, 1, 1, 5]], ["tile_rcc", "sp", [-1, 1]], ["tile_ry", "sp", [-1, 1]], ["tile_rx", "sp", [-1, 1]], ["auto_unroll_max_step", "ot", 0], ["unroll_explicit", "ot", 1]]}, "result": [[0.840645347], 0, 62.70679211616516, 1611735144.965947], "version": 0.2, "tvm_version": "0.8.dev0"}
{"input": ["opencl -keys=opencl,gpu -max_num_threads=256", "conv2d_NCHWc_KCRSk_tx_tune2", [[1, 32, 112, 112, 4], [32, 128, 3, 3, 4]], {}], "config": {"index": 19399928, "code_hash": null, "entity": [["tile_fc", "sp", [-1, 2, 8, 1]], ["tile_y", "sp", [-1, 1, 5, 22]], ["tile_x", "sp", [-1, 1, 1, 5]], ["tile_rcc", "sp", [-1, 1]], ["tile_ry", "sp", [-1, 1]], ["tile_rx", "sp", [-1, 3]], ["auto_unroll_max_step", "ot", 0], ["unroll_explicit", "ot", 1]]}, "result": [[0.9064865623333334], 0, 12.662357091903687, 1611735158.847801], "version": 0.2, "tvm_version": "0.8.dev0"}
{"input": ["opencl -keys=opencl,gpu -max_num_threads=256", "conv2d_NCHWc_KCRSk_tx_tune2", [[1, 32, 112, 112, 4], [32, 128, 3, 3, 4]], {}], "config": {"index": 16741552, "code_hash": null, "entity": [["tile_fc", "sp", [-1, 2, 8, 1]], ["tile_y", "sp", [-1, 1, 5, 1]], ["tile_x", "sp", [-1, 1, 1, 110]], ["tile_rcc", "sp", [-1, 1]], ["tile_ry", "sp", [-1, 1]], ["tile_rx", "sp", [-1, 1]], ["auto_unroll_max_step", "ot", 0], ["unroll_explicit", "ot", 1]]}, "result": [[1.053412951], 0, 26.48015069961548, 1611735172.589829], "version": 0.2, "tvm_version": "0.8.dev0"}
{"input": ["opencl -keys=opencl,gpu -max_num_threads=256", "conv2d_NCHWc_KCRSk_tx_tune2", [[1, 32, 112, 112, 4], [32, 128, 3, 3, 4]], {}], "config": {"index": 19441984, "code_hash": null, "entity": [["tile_fc", "sp", [-1, 2, 8, 1]], ["tile_y", "sp", [-1, 1, 11, 5]], ["tile_x", "sp", [-1, 1, 1, 11]], ["tile_rcc", "sp", [-1, 1]], ["tile_ry", "sp", [-1, 1]], ["tile_rx", "sp", [-1, 3]], ["auto_unroll_max_step", "ot", 0], ["unroll_explicit", "ot", 1]]}, "result": [[1.0031058503333334], 0, 39.47476625442505, 1611735185.3381984], "version": 0.2, "tvm_version": "0.8.dev0"}
{"input": ["opencl -keys=opencl,gpu -max_num_threads=256", "conv2d_NCHWc_KCRSk_tx_tune2", [[1, 32, 112, 112, 4], [32, 128, 3, 3, 4]], {}], "config": {"index": 19483536, "code_hash": null, "entity": [["tile_fc", "sp", [-1, 2, 8, 1]], ["tile_y", "sp", [-1, 1, 10, 1]], ["tile_x", "sp", [-1, 1, 1, 55]], ["tile_rcc", "sp", [-1, 1]], ["tile_ry", "sp", [-1, 1]], ["tile_rx", "sp", [-1, 3]], ["auto_unroll_max_step", "ot", 0], ["unroll_explicit", "ot", 1]]}, "result": [[1.0668348953333333], 0, 53.20279026031494, 1611735199.1102257], "version": 0.2, "tvm_version": "0.8.dev0"}
{"input": ["opencl -keys=opencl,gpu -max_num_threads=256", "conv2d_NCHWc_KCRSk_tx_tune2", [[1, 32, 112, 112, 4], [32, 128, 3, 3, 4]], {}], "config": {"index": 17896048, "code_hash": null, "entity": [["tile_fc", "sp", [-1, 2, 8, 1]], ["tile_y", "sp", [-1, 5, 11, 1]], ["tile_x", "sp", [-1, 2, 1, 1]], ["tile_rcc", "sp", [-1, 1]], ["tile_ry", "sp", [-1, 3]], ["tile_rx", "sp", [-1, 1]], ["auto_unroll_max_step", "ot", 0], ["unroll_explicit", "ot", 1]]}, "result": [[0.080105816], 0, 4.360793590545654, 1611735460.8643765], "version": 0.2, "tvm_version": "0.8.dev0"}
{"input": ["opencl -keys=opencl,gpu -max_num_threads=256", "conv2d_NCHWc_KCRSk_tx_tune2", [[1, 32, 112, 112, 4], [32, 128, 3, 3, 4]], {}], "config": {"index": 16662047, "code_hash": null, "entity": [["tile_fc", "sp", [-1, 2, 4, 2]], ["tile_y", "sp", [-1, 1, 1, 1]], ["tile_x", "sp", [-1, 11, 2, 5]], ["tile_rcc", "sp", [-1, 1]], ["tile_ry", "sp", [-1, 1]], ["tile_rx", "sp", [-1, 1]], ["auto_unroll_max_step", "ot", 0], ["unroll_explicit", "ot", 1]]}, "result": [[3.8167668213333332], 0, 43.52501559257507, 1611735499.7370186], "version": 0.2, "tvm_version": "0.8.dev0"}
{"input": ["opencl -keys=opencl,gpu -max_num_threads=256", "conv2d_NCHWc_KCRSk_tx_tune2", [[1, 32, 112, 112, 4], [32, 128, 3, 3, 4]], {}], "config": {"index": 19472899, "code_hash": null, "entity": [["tile_fc", "sp", [-1, 2, 16, 1]], ["tile_y", "sp", [-1, 1, 11, 1]], ["tile_x", "sp", [-1, 1, 1, 22]], ["tile_rcc", "sp", [-1, 1]], ["tile_ry", "sp", [-1, 1]], ["tile_rx", "sp", [-1, 3]], ["auto_unroll_max_step", "ot", 0], ["unroll_explicit", "ot", 1]]}, "result": [[3.925154877], 0, 85.65536236763, 1611735542.2757142], "version": 0.2, "tvm_version": "0.8.dev0"}
{"input": ["opencl -keys=opencl,gpu -max_num_threads=256", "conv2d_NCHWc_KCRSk_tx_tune2", [[1, 32, 112, 112, 4], [32, 128, 3, 3, 4]], {}], "config": {"index": 19272248, "code_hash": null, "entity": [["tile_fc", "sp", [-1, 2, 8, 1]], ["tile_y", "sp", [-1, 2, 11, 1]], ["tile_x", "sp", [-1, 2, 1, 1]], ["tile_rcc", "sp", [-1, 1]], ["tile_ry", "sp", [-1, 1]], ["tile_rx", "sp", [-1, 3]], ["auto_unroll_max_step", "ot", 0], ["unroll_explicit", "ot", 1]]}, "result": [[0.12110333333333334], 0, 90.16816520690918, 1611735546.7242079], "version": 0.2, "tvm_version": "0.8.dev0"}
{"input": ["opencl -keys=opencl,gpu -max_num_threads=256", "conv2d_NCHWc_KCRSk_tx_tune2", [[1, 32, 112, 112, 4], [32, 128, 3, 3, 4]], {}], "config": {"index": 18038288, "code_hash": null, "entity": [["tile_fc", "sp", [-1, 2, 8, 1]], ["tile_y", "sp", [-1, 1, 1, 1]], ["tile_x", "sp", [-1, 11, 2, 5]], ["tile_rcc", "sp", [-1, 1]], ["tile_ry", "sp", [-1, 3]], ["tile_rx", "sp", [-1, 1]], ["auto_unroll_max_step", "ot", 0], ["unroll_explicit", "ot", 1]]}, "result": [[3.610651127], 0, 127.00098204612732, 1611735583.6504881], "version": 0.2, "tvm_version": "0.8.dev0"}
{"input": ["opencl -keys=opencl,gpu -max_num_threads=256", "conv2d_NCHWc_KCRSk_tx_tune2", [[1, 32, 112, 112, 4], [32, 128, 3, 3, 4]], {}], "config": {"index": 22167127, "code_hash": null, "entity": [["tile_fc", "sp", [-1, 2, 4, 2]], ["tile_y", "sp", [-1, 2, 1, 1]], ["tile_x", "sp", [-1, 11, 2, 5]], ["tile_rcc", "sp", [-1, 1]], ["tile_ry", "sp", [-1, 1]], ["tile_rx", "sp", [-1, 1]], ["auto_unroll_max_step", "ot", 512], ["unroll_explicit", "ot", 1]]}, "result": [[14.73278963], 0, 153.05018949508667, 1611735737.0489132], "version": 0.2, "tvm_version": "0.8.dev0"}
{"input": ["opencl -keys=opencl,gpu -max_num_threads=256", "conv2d_NCHWc_KCRSk_tx_tune2", [[1, 32, 112, 112, 4], [32, 128, 3, 3, 4]], {}], "config": {"index": 20689723, "code_hash": null, "entity": [["tile_fc", "sp", [-1, 2, 16, 1]], ["tile_y", "sp", [-1, 10, 1, 11]], ["tile_x", "sp", [-1, 1, 5, 1]], ["tile_rcc", "sp", [-1, 1]], ["tile_ry", "sp", [-1, 3]], ["tile_rx", "sp", [-1, 3]], ["auto_unroll_max_step", "ot", 0], ["unroll_explicit", "ot", 1]]}, "result": [[4.0325793039999995], 0, 195.2408847808838, 1611735780.7476397], "version": 0.2, "tvm_version": "0.8.dev0"}
{"input": ["opencl -keys=opencl,gpu -max_num_threads=256", "conv2d_NCHWc_KCRSk_tx_tune2", [[1, 32, 112, 112, 4], [32, 128, 3, 3, 4]], {}], "config": {"index": 20776202, "code_hash": null, "entity": [["tile_fc", "sp", [-1, 2, 8, 2]], ["tile_y", "sp", [-1, 1, 5, 22]], ["tile_x", "sp", [-1, 1, 1, 5]], ["tile_rcc", "sp", [-1, 1]], ["tile_ry", "sp", [-1, 3]], ["tile_rx", "sp", [-1, 3]], ["auto_unroll_max_step", "ot", 0], ["unroll_explicit", "ot", 1]]}, "result": [[1.0664519266666665], 0, 208.98428869247437, 1611735794.6961691], "version": 0.2, "tvm_version": "0.8.dev0"}
{"input": ["opencl -keys=opencl,gpu -max_num_threads=256", "conv2d_NCHWc_KCRSk_tx_tune2", [[1, 32, 112, 112, 4], [32, 128, 3, 3, 4]], {}], "config": {"index": 18031120, "code_hash": null, "entity": [["tile_fc", "sp", [-1, 2, 8, 1]], ["tile_y", "sp", [-1, 1, 1, 1]], ["tile_x", "sp", [-1, 22, 1, 5]], ["tile_rcc", "sp", [-1, 1]], ["tile_ry", "sp", [-1, 3]], ["tile_rx", "sp", [-1, 1]], ["auto_unroll_max_step", "ot", 0], ["unroll_explicit", "ot", 1]]}, "result": [[3.8621783663333336], 0, 248.6716639995575, 1611735834.4453912], "version": 0.2, "tvm_version": "0.8.dev0"}
{"input": ["opencl -keys=opencl,gpu -max_num_threads=256", "conv2d_NCHWc_KCRSk_tx_tune2", [[1, 32, 112, 112, 4], [32, 128, 3, 3, 4]], {}], "config": {"index": 28906096, "code_hash": null, "entity": [["tile_fc", "sp", [-1, 2, 8, 1]], ["tile_y", "sp", [-1, 5, 11, 1]], ["tile_x", "sp", [-1, 2, 1, 1]], ["tile_rcc", "sp", [-1, 1]], ["tile_ry", "sp", [-1, 3]], ["tile_rx", "sp", [-1, 1]], ["auto_unroll_max_step", "ot", 1500], ["unroll_explicit", "ot", 1]]}, "result": [[0.077642691], 0, 254.05059623718262, 1611735838.8936524], "version": 0.2, "tvm_version": "0.8.dev0"}
{"input": ["opencl -keys=opencl,gpu -max_num_threads=256", "conv2d_NCHWc_KCRSk_tx_tune2", [[1, 32, 112, 112, 4], [32, 128, 3, 3, 4]], {}], "config": {"index": 4175114, "code_hash": null, "entity": [["tile_fc", "sp", [-1, 2, 8, 2]], ["tile_y", "sp", [-1, 1, 5, 22]], ["tile_x", "sp", [-1, 1, 5, 1]], ["tile_rcc", "sp", [-1, 1]], ["tile_ry", "sp", [-1, 3]], ["tile_rx", "sp", [-1, 3]], ["auto_unroll_max_step", "ot", 0], ["unroll_explicit", "ot", 0]]}, "result": [[2.954499634333333], 0, 283.88476514816284, 1611735869.5990663], "version": 0.2, "tvm_version": "0.8.dev0"}
{"input": ["opencl -keys=opencl,gpu -max_num_threads=256", "conv2d_NCHWc_KCRSk_tx_tune2", [[1, 32, 112, 112, 4], [32, 128, 3, 3, 4]], {}], "config": {"index": 1378176, "code_hash": null, "entity": [["tile_fc", "sp", [-1, 2, 8, 1]], ["tile_y", "sp", [-1, 5, 11, 2]], ["tile_x", "sp", [-1, 1, 1, 1]], ["tile_rcc", "sp", [-1, 1]], ["tile_ry", "sp", [-1, 3]], ["tile_rx", "sp", [-1, 1]], ["auto_unroll_max_step", "ot", 0], ["unroll_explicit", "ot", 0]]}, "result": [[0.068779045], 0, 288.01913380622864, 1611735873.560613], "version": 0.2, "tvm_version": "0.8.dev0"}
{"input": ["opencl -keys=opencl,gpu -max_num_threads=256", "conv2d_NCHWc_KCRSk_tx_tune2", [[1, 32, 112, 112, 4], [32, 128, 3, 3, 4]], {}], "config": {"index": 16705737, "code_hash": null, "entity": [["tile_fc", "sp", [-1, 2, 2, 4]], ["tile_y", "sp", [-1, 1, 5, 1]], ["tile_x", "sp", [-1, 5, 2, 11]], ["tile_rcc", "sp", [-1, 1]], ["tile_ry", "sp", [-1, 1]], ["tile_rx", "sp", [-1, 1]], ["auto_unroll_max_step", "ot", 0], ["unroll_explicit", "ot", 1]]}, "result": [[2.9471295299999998], 0, 319.4045126438141, 1611735904.9141495], "version": 0.2, "tvm_version": "0.8.dev0"}
{"input": ["opencl -keys=opencl,gpu -max_num_threads=256", "conv2d_NCHWc_KCRSk_tx_tune2", [[1, 32, 112, 112, 4], [32, 128, 3, 3, 4]], {}], "config": {"index": 20655171, "code_hash": null, "entity": [["tile_fc", "sp", [-1, 2, 16, 1]], ["tile_y", "sp", [-1, 11, 2, 1]], ["tile_x", "sp", [-1, 10, 1, 1]], ["tile_rcc", "sp", [-1, 1]], ["tile_ry", "sp", [-1, 3]], ["tile_rx", "sp", [-1, 3]], ["auto_unroll_max_step", "ot", 0], ["unroll_explicit", "ot", 1]]}, "result": [[5.134075345333334], 0, 376.2712609767914, 1611735961.0288267], "version": 0.2, "tvm_version": "0.8.dev0"}
{"input": ["opencl -keys=opencl,gpu -max_num_threads=256", "conv2d_NCHWc_KCRSk_tx_tune2", [[1, 32, 112, 112, 4], [32, 128, 3, 3, 4]], {}], "config": {"index": 23401072, "code_hash": null, "entity": [["tile_fc", "sp", [-1, 2, 8, 1]], ["tile_y", "sp", [-1, 5, 11, 1]], ["tile_x", "sp", [-1, 2, 1, 1]], ["tile_rcc", "sp", [-1, 1]], ["tile_ry", "sp", [-1, 3]], ["tile_rx", "sp", [-1, 1]], ["auto_unroll_max_step", "ot", 512], ["unroll_explicit", "ot", 1]]}, "result": [[0.077871146], 0, 379.64798879623413, 1611735965.150069], "version": 0.2, "tvm_version": "0.8.dev0"}
{"input": ["opencl -keys=opencl,gpu -max_num_threads=256", "conv2d_NCHWc_KCRSk_tx_tune2", [[1, 32, 112, 112, 4], [32, 128, 3, 3, 4]], {}], "config": {"index": 4261130, "code_hash": null, "entity": [["tile_fc", "sp", [-1, 2, 8, 2]], ["tile_y", "sp", [-1, 1, 5, 22]], ["tile_x", "sp", [-1, 1, 1, 5]], ["tile_rcc", "sp", [-1, 1]], ["tile_ry", "sp", [-1, 3]], ["tile_rx", "sp", [-1, 3]], ["auto_unroll_max_step", "ot", 0], ["unroll_explicit", "ot", 0]]}, "result": [[1.0396640273333333], 0, 13.819385528564453, 1611735980.9220452], "version": 0.2, "tvm_version": "0.8.dev0"}
{"input": ["opencl -keys=opencl,gpu -max_num_threads=256", "conv2d_NCHWc_KCRSk_tx_tune2", [[1, 32, 112, 112, 4], [32, 128, 3, 3, 4]], {}], "config": {"index": 17903175, "code_hash": null, "entity": [["tile_fc", "sp", [-1, 2, 4, 2]], ["tile_y", "sp", [-1, 2, 11, 1]], ["tile_x", "sp", [-1, 10, 1, 1]], ["tile_rcc", "sp", [-1, 1]], ["tile_ry", "sp", [-1, 3]], ["tile_rx", "sp", [-1, 1]], ["auto_unroll_max_step", "ot", 0], ["unroll_explicit", "ot", 1]]}, "result": [[3.3874309883333336], 0, 51.02732491493225, 1611736017.9208598], "version": 0.2, "tvm_version": "0.8.dev0"}
{"input": ["opencl -keys=opencl,gpu -max_num_threads=256", "conv2d_NCHWc_KCRSk_tx_tune2", [[1, 32, 112, 112, 4], [32, 128, 3, 3, 4]], {}], "config": {"index": 18107393, "code_hash": null, "entity": [["tile_fc", "sp", [-1, 4, 8, 1]], ["tile_y", "sp", [-1, 1, 11, 1]], ["tile_x", "sp", [-1, 1, 1, 55]], ["tile_rcc", "sp", [-1, 1]], ["tile_ry", "sp", [-1, 3]], ["tile_rx", "sp", [-1, 1]], ["auto_unroll_max_step", "ot", 0], ["unroll_explicit", "ot", 1]]}, "result": [[2.7678076553333333], 0, 81.61316466331482, 1611736048.6783612], "version": 0.2, "tvm_version": "0.8.dev0"}
{"input": ["opencl -keys=opencl,gpu -max_num_threads=256", "conv2d_NCHWc_KCRSk_tx_tune2", [[1, 32, 112, 112, 4], [32, 128, 3, 3, 4]], {}], "config": {"index": 4243192, "code_hash": null, "entity": [["tile_fc", "sp", [-1, 2, 8, 1]], ["tile_y", "sp", [-1, 1, 5, 22]], ["tile_x", "sp", [-1, 1, 5, 2]], ["tile_rcc", "sp", [-1, 1]], ["tile_ry", "sp", [-1, 3]], ["tile_rx", "sp", [-1, 3]], ["auto_unroll_max_step", "ot", 0], ["unroll_explicit", "ot", 0]]}, "result": [[3.409720467666667], 0, 116.5021665096283, 1611736083.6065428], "version": 0.2, "tvm_version": "0.8.dev0"}
{"input": ["opencl -keys=opencl,gpu -max_num_threads=256", "conv2d_NCHWc_KCRSk_tx_tune2", [[1, 32, 112, 112, 4], [32, 128, 3, 3, 4]], {}], "config": {"index": 27672151, "code_hash": null, "entity": [["tile_fc", "sp", [-1, 2, 4, 2]], ["tile_y", "sp", [-1, 2, 1, 1]], ["tile_x", "sp", [-1, 11, 2, 5]], ["tile_rcc", "sp", [-1, 1]], ["tile_ry", "sp", [-1, 1]], ["tile_rx", "sp", [-1, 1]], ["auto_unroll_max_step", "ot", 1500], ["unroll_explicit", "ot", 1]]}, "result": [[14.695846070666667], 0, 271.34970688819885, 1611736237.0326676], "version": 0.2, "tvm_version": "0.8.dev0"}
{"input": ["opencl -keys=opencl,gpu -max_num_threads=256", "conv2d_NCHWc_KCRSk_tx_tune2", [[1, 32, 112, 112, 4], [32, 128, 3, 3, 4]], {}], "config": {"index": 20649235, "code_hash": null, "entity": [["tile_fc", "sp", [-1, 2, 16, 1]], ["tile_y", "sp", [-1, 11, 5, 2]], ["tile_x", "sp", [-1, 2, 1, 1]], ["tile_rcc", "sp", [-1, 1]], ["tile_ry", "sp", [-1, 3]], ["tile_rx", "sp", [-1, 3]], ["auto_unroll_max_step", "ot", 0], ["unroll_explicit", "ot", 1]]}, "result": [[3.5804793736666665], 0, 307.02697110176086, 1611736273.852211], "version": 0.2, "tvm_version": "0.8.dev0"}
{"input": ["opencl -keys=opencl,gpu -max_num_threads=256", "conv2d_NCHWc_KCRSk_tx_tune2", [[1, 32, 112, 112, 4], [32, 128, 3, 3, 4]], {}], "config": {"index": 20659256, "code_hash": null, "entity": [["tile_fc", "sp", [-1, 2, 8, 1]], ["tile_y", "sp", [-1, 2, 11, 1]], ["tile_x", "sp", [-1, 11, 1, 1]], ["tile_rcc", "sp", [-1, 1]], ["tile_ry", "sp", [-1, 3]], ["tile_rx", "sp", [-1, 3]], ["auto_unroll_max_step", "ot", 0], ["unroll_explicit", "ot", 1]]}, "result": [[1.3799177599999999], 0, 327.58576941490173, 1611736294.5717258], "version": 0.2, "tvm_version": "0.8.dev0"}
{"input": ["opencl -keys=opencl,gpu -max_num_threads=256", "conv2d_NCHWc_KCRSk_tx_tune2", [[1, 32, 112, 112, 4], [32, 128, 3, 3, 4]], {}], "config": {"index": 31699491, "code_hash": null, "entity": [["tile_fc", "sp", [-1, 2, 16, 1]], ["tile_y", "sp", [-1, 11, 1, 10]], ["tile_x", "sp", [-1, 1, 5, 1]], ["tile_rcc", "sp", [-1, 1]], ["tile_ry", "sp", [-1, 3]], ["tile_rx", "sp", [-1, 3]], ["auto_unroll_max_step", "ot", 1500], ["unroll_explicit", "ot", 1]]}, "result": [[14.159420532666667], 0, 476.3839485645294, 1611736442.663012], "version": 0.2, "tvm_version": "0.8.dev0"}
{"input": ["opencl -keys=opencl,gpu -max_num_threads=256", "conv2d_NCHWc_KCRSk_tx_tune2", [[1, 32, 112, 112, 4], [32, 128, 3, 3, 4]], {}], "config": {"index": 22865941, "code_hash": null, "entity": [["tile_fc", "sp", [-1, 1, 1, 2]], ["tile_y", "sp", [-1, 1, 1, 1]], ["tile_x", "sp", [-1, 1, 22, 5]], ["tile_rcc", "sp", [-1, 8]], ["tile_ry", "sp", [-1, 1]], ["tile_rx", "sp", [-1, 1]], ["auto_unroll_max_step", "ot", 512], ["unroll_explicit", "ot", 1]]}, "result": [[1.4954817876666666], 0, 494.31338357925415, 1611736461.4953663], "version": 0.2, "tvm_version": "0.8.dev0"}
{"input": ["opencl -keys=opencl,gpu -max_num_threads=256", "conv2d_NCHWc_KCRSk_tx_tune2", [[1, 32, 112, 112, 4], [32, 128, 3, 3, 4]], {}], "config": {"index": 31690805, "code_hash": null, "entity": [["tile_fc", "sp", [-1, 4, 4, 1]], ["tile_y", "sp", [-1, 2, 11, 1]], ["tile_x", "sp", [-1, 11, 2, 1]], ["tile_rcc", "sp", [-1, 1]], ["tile_ry", "sp", [-1, 3]], ["tile_rx", "sp", [-1, 3]], ["auto_unroll_max_step", "ot", 1500], ["unroll_explicit", "ot", 1]]}, "result": [[6.147845587666667], 0, 66.25474858283997, 1611736825.436961], "version": 0.2, "tvm_version": "0.8.dev0"}
{"input": ["opencl -keys=opencl,gpu -max_num_threads=256", "conv2d_NCHWc_KCRSk_tx_tune2", [[1, 32, 112, 112, 4], [32, 128, 3, 3, 4]], {}], "config": {"index": 26185781, "code_hash": null, "entity": [["tile_fc", "sp", [-1, 4, 4, 1]], ["tile_y", "sp", [-1, 2, 11, 1]], ["tile_x", "sp", [-1, 11, 2, 1]], ["tile_rcc", "sp", [-1, 1]], ["tile_ry", "sp", [-1, 3]], ["tile_rx", "sp", [-1, 3]], ["auto_unroll_max_step", "ot", 512], ["unroll_explicit", "ot", 1]]}, "result": [[1.6181390096666668], 0, 85.05326771736145, 1611736845.304252], "version": 0.2, "tvm_version": "0.8.dev0"}
{"input": ["opencl -keys=opencl,gpu -max_num_threads=256", "conv2d_NCHWc_KCRSk_tx_tune2", [[1, 32, 112, 112, 4], [32, 128, 3, 3, 4]], {}], "config": {"index": 31758904, "code_hash": null, "entity": [["tile_fc", "sp", [-1, 2, 8, 1]], ["tile_y", "sp", [-1, 2, 11, 1]], ["tile_x", "sp", [-1, 11, 1, 2]], ["tile_rcc", "sp", [-1, 1]], ["tile_ry", "sp", [-1, 3]], ["tile_rx", "sp", [-1, 3]], ["auto_unroll_max_step", "ot", 1500], ["unroll_explicit", "ot", 1]]}, "result": [[9.228807826333332], 0, 182.82560753822327, 1611736942.3386989], "version": 0.2, "tvm_version": "0.8.dev0"}
{"input": ["opencl -keys=opencl,gpu -max_num_threads=256", "conv2d_NCHWc_KCRSk_tx_tune2", [[1, 32, 112, 112, 4], [32, 128, 3, 3, 4]], {}], "config": {"index": 26253880, "code_hash": null, "entity": [["tile_fc", "sp", [-1, 2, 8, 1]], ["tile_y", "sp", [-1, 2, 11, 1]], ["tile_x", "sp", [-1, 11, 1, 2]], ["tile_rcc", "sp", [-1, 1]], ["tile_ry", "sp", [-1, 3]], ["tile_rx", "sp", [-1, 3]], ["auto_unroll_max_step", "ot", 512], ["unroll_explicit", "ot", 1]]}, "result": [[3.581135241666667], 0, 221.63691568374634, 1611736982.0137684], "version": 0.2, "tvm_version": "0.8.dev0"}
{"input": ["opencl -keys=opencl,gpu -max_num_threads=256", "conv2d_NCHWc_KCRSk_tx_tune2", [[1, 32, 112, 112, 4], [32, 128, 3, 3, 4]], {}], "config": {"index": 20748856, "code_hash": null, "entity": [["tile_fc", "sp", [-1, 2, 8, 1]], ["tile_y", "sp", [-1, 2, 11, 1]], ["tile_x", "sp", [-1, 11, 1, 2]], ["tile_rcc", "sp", [-1, 1]], ["tile_ry", "sp", [-1, 3]], ["tile_rx", "sp", [-1, 3]], ["auto_unroll_max_step", "ot", 0], ["unroll_explicit", "ot", 1]]}, "result": [[3.1299466133333333], 0, 253.56903624534607, 1611737014.3200574], "version": 0.2, "tvm_version": "0.8.dev0"}
{"input": ["opencl -keys=opencl,gpu -max_num_threads=256", "conv2d_NCHWc_KCRSk_tx_tune2", [[1, 32, 112, 112, 4], [32, 128, 3, 3, 4]], {}], "config": {"index": 26185795, "code_hash": null, "entity": [["tile_fc", "sp", [-1, 2, 2, 2]], ["tile_y", "sp", [-1, 2, 11, 1]], ["tile_x", "sp", [-1, 11, 2, 1]], ["tile_rcc", "sp", [-1, 1]], ["tile_ry", "sp", [-1, 3]], ["tile_rx", "sp", [-1, 3]], ["auto_unroll_max_step", "ot", 512], ["unroll_explicit", "ot", 1]]}, "result": [[2.0197399296666667], 0, 277.67020416259766, 1611737037.7931123], "version": 0.2, "tvm_version": "0.8.dev0"}
{"input": ["opencl -keys=opencl,gpu -max_num_threads=256", "conv2d_NCHWc_KCRSk_tx_tune2", [[1, 32, 112, 112, 4], [32, 128, 3, 3, 4]], {}], "config": {"index": 26185721, "code_hash": null, "entity": [["tile_fc", "sp", [-1, 8, 2, 1]], ["tile_y", "sp", [-1, 1, 11, 1]], ["tile_x", "sp", [-1, 11, 2, 1]], ["tile_rcc", "sp", [-1, 1]], ["tile_ry", "sp", [-1, 3]], ["tile_rx", "sp", [-1, 3]], ["auto_unroll_max_step", "ot", 512], ["unroll_explicit", "ot", 1]]}, "result": [[3.760929529666667], 0, 318.8505733013153, 1611737079.037094], "version": 0.2, "tvm_version": "0.8.dev0"}
{"input": ["opencl -keys=opencl,gpu -max_num_threads=256", "conv2d_NCHWc_KCRSk_tx_tune2", [[1, 32, 112, 112, 4], [32, 128, 3, 3, 4]], {}], "config": {"index": 31690745, "code_hash": null, "entity": [["tile_fc", "sp", [-1, 8, 2, 1]], ["tile_y", "sp", [-1, 1, 11, 1]], ["tile_x", "sp", [-1, 11, 2, 1]], ["tile_rcc", "sp", [-1, 1]], ["tile_ry", "sp", [-1, 3]], ["tile_rx", "sp", [-1, 3]], ["auto_unroll_max_step", "ot", 1500], ["unroll_explicit", "ot", 1]]}, "result": [[7.584953886], 0, 397.74187874794006, 1611737157.0044074], "version": 0.2, "tvm_version": "0.8.dev0"}
{"input": ["opencl -keys=opencl,gpu -max_num_threads=256", "conv2d_NCHWc_KCRSk_tx_tune2", [[1, 32, 112, 112, 4], [32, 128, 3, 3, 4]], {}], "config": {"index": 20659271, "code_hash": null, "entity": [["tile_fc", "sp", [-1, 2, 4, 2]], ["tile_y", "sp", [-1, 2, 11, 1]], ["tile_x", "sp", [-1, 11, 1, 1]], ["tile_rcc", "sp", [-1, 1]], ["tile_ry", "sp", [-1, 3]], ["tile_rx", "sp", [-1, 3]], ["auto_unroll_max_step", "ot", 0], ["unroll_explicit", "ot", 1]]}, "result": [[3.1743584363333333], 0, 429.1436231136322, 1611737189.8102858], "version": 0.2, "tvm_version": "0.8.dev0"}
{"input": ["opencl -keys=opencl,gpu -max_num_threads=256", "conv2d_NCHWc_KCRSk_tx_tune2", [[1, 32, 112, 112, 4], [32, 128, 3, 3, 4]], {}], "config": {"index": 26185799, "code_hash": null, "entity": [["tile_fc", "sp", [-1, 2, 4, 2]], ["tile_y", "sp", [-1, 2, 11, 1]], ["tile_x", "sp", [-1, 11, 2, 1]], ["tile_rcc", "sp", [-1, 1]], ["tile_ry", "sp", [-1, 3]], ["tile_rx", "sp", [-1, 3]], ["auto_unroll_max_step", "ot", 512], ["unroll_explicit", "ot", 1]]}, "result": [[1.4543773433333334], 0, 447.53400111198425, 1611737207.8821805], "version": 0.2, "tvm_version": "0.8.dev0"}
{"input": ["opencl -keys=opencl,gpu -max_num_threads=256", "conv2d_NCHWc_KCRSk_tx_tune2", [[1, 32, 112, 112, 4], [32, 128, 3, 3, 4]], {}], "config": {"index": 31690833, "code_hash": null, "entity": [["tile_fc", "sp", [-1, 2, 2, 4]], ["tile_y", "sp", [-1, 2, 11, 1]], ["tile_x", "sp", [-1, 11, 2, 1]], ["tile_rcc", "sp", [-1, 1]], ["tile_ry", "sp", [-1, 3]], ["tile_rx", "sp", [-1, 3]], ["auto_unroll_max_step", "ot", 1500], ["unroll_explicit", "ot", 1]]}, "result": [[3.6100041826666662], 0, 488.6274025440216, 1611737247.949515], "version": 0.2, "tvm_version": "0.8.dev0"}
{"input": ["opencl -keys=opencl,gpu -max_num_threads=256", "conv2d_NCHWc_KCRSk_tx_tune2", [[1, 32, 112, 112, 4], [32, 128, 3, 3, 4]], {}], "config": {"index": 26167879, "code_hash": null, "entity": [["tile_fc", "sp", [-1, 2, 4, 2]], ["tile_y", "sp", [-1, 2, 11, 1]], ["tile_x", "sp", [-1, 22, 1, 1]], ["tile_rcc", "sp", [-1, 1]], ["tile_ry", "sp", [-1, 3]], ["tile_rx", "sp", [-1, 3]], ["auto_unroll_max_step", "ot", 512], ["unroll_explicit", "ot", 1]]}, "result": [[4.226820345666667], 0, 534.2438402175903, 1611737293.9608474], "version": 0.2, "tvm_version": "0.8.dev0"}
{"input": ["opencl -keys=opencl,gpu -max_num_threads=256", "conv2d_NCHWc_KCRSk_tx_tune2", [[1, 32, 112, 112, 4], [32, 128, 3, 3, 4]], {}], "config": {"index": 31690778, "code_hash": null, "entity": [["tile_fc", "sp", [-1, 4, 2, 4]], ["tile_y", "sp", [-1, 1, 11, 1]], ["tile_x", "sp", [-1, 11, 2, 1]], ["tile_rcc", "sp", [-1, 1]], ["tile_ry", "sp", [-1, 3]], ["tile_rx", "sp", [-1, 3]], ["auto_unroll_max_step", "ot", 1500], ["unroll_explicit", "ot", 1]]}, "result": [[7.903965639333333], 0, 619.0087900161743, 1611737378.5038548], "version": 0.2, "tvm_version": "0.8.dev0"}
{"input": ["opencl -keys=opencl,gpu -max_num_threads=256", "conv2d_NCHWc_KCRSk_tx_tune2", [[1, 32, 112, 112, 4], [32, 128, 3, 3, 4]], {}], "config": {"index": 26185754, "code_hash": null, "entity": [["tile_fc", "sp", [-1, 4, 2, 4]], ["tile_y", "sp", [-1, 1, 11, 1]], ["tile_x", "sp", [-1, 11, 2, 1]], ["tile_rcc", "sp", [-1, 1]], ["tile_ry", "sp", [-1, 3]], ["tile_rx", "sp", [-1, 3]], ["auto_unroll_max_step", "ot", 512], ["unroll_explicit", "ot", 1]]}, "result": [[8.132999233], 0, 702.6132063865662, 1611737462.2248945], "version": 0.2, "tvm_version": "0.8.dev0"}
{"input": ["opencl -keys=opencl,gpu -max_num_threads=256", "conv2d_NCHWc_KCRSk_tx_tune2", [[1, 32, 112, 112, 4], [32, 128, 3, 3, 4]], {}], "config": {"index": 20680757, "code_hash": null, "entity": [["tile_fc", "sp", [-1, 4, 4, 1]], ["tile_y", "sp", [-1, 2, 11, 1]], ["tile_x", "sp", [-1, 11, 2, 1]], ["tile_rcc", "sp", [-1, 1]], ["tile_ry", "sp", [-1, 3]], ["tile_rx", "sp", [-1, 3]], ["auto_unroll_max_step", "ot", 0], ["unroll_explicit", "ot", 1]]}, "result": [[1.4676148776666667], 0, 719.7575044631958, 1611737480.4098656], "version": 0.2, "tvm_version": "0.8.dev0"}
{"input": ["opencl -keys=opencl,gpu -max_num_threads=256", "conv2d_NCHWc_KCRSk_tx_tune2", [[1, 32, 112, 112, 4], [32, 128, 3, 3, 4]], {}], "config": {"index": 31758919, "code_hash": null, "entity": [["tile_fc", "sp", [-1, 2, 4, 2]], ["tile_y", "sp", [-1, 2, 11, 1]], ["tile_x", "sp", [-1, 11, 1, 2]], ["tile_rcc", "sp", [-1, 1]], ["tile_ry", "sp", [-1, 3]], ["tile_rx", "sp", [-1, 3]], ["auto_unroll_max_step", "ot", 1500], ["unroll_explicit", "ot", 1]]}, "result": [[4.4191828976666665], 0, 82.38450980186462, 1611737572.9087656], "version": 0.2, "tvm_version": "0.8.dev0"}
{"input": ["opencl -keys=opencl,gpu -max_num_threads=256", "conv2d_NCHWc_KCRSk_tx_tune2", [[1, 32, 112, 112, 4], [32, 128, 3, 3, 4]], {}], "config": {"index": 31691585, "code_hash": null, "entity": [["tile_fc", "sp", [-1, 8, 2, 1]], ["tile_y", "sp", [-1, 1, 11, 2]], ["tile_x", "sp", [-1, 11, 2, 1]], ["tile_rcc", "sp", [-1, 1]], ["tile_ry", "sp", [-1, 3]], ["tile_rx", "sp", [-1, 3]], ["auto_unroll_max_step", "ot", 1500], ["unroll_explicit", "ot", 1]]}, "result": [[3.5683921339999998], 0, 122.4125816822052, 1611737612.665849], "version": 0.2, "tvm_version": "0.8.dev0"}
{"input": ["opencl -keys=opencl,gpu -max_num_threads=256", "conv2d_NCHWc_KCRSk_tx_tune2", [[1, 32, 112, 112, 4], [32, 128, 3, 3, 4]], {}], "config": {"index": 26186561, "code_hash": null, "entity": [["tile_fc", "sp", [-1, 8, 2, 1]], ["tile_y", "sp", [-1, 1, 11, 2]], ["tile_x", "sp", [-1, 11, 2, 1]], ["tile_rcc", "sp", [-1, 1]], ["tile_ry", "sp", [-1, 3]], ["tile_rx", "sp", [-1, 3]], ["auto_unroll_max_step", "ot", 512], ["unroll_explicit", "ot", 1]]}, "result": [[3.7480611096666667], 0, 163.68078088760376, 1611737654.003572], "version": 0.2, "tvm_version": "0.8.dev0"}
{"input": ["opencl -keys=opencl,gpu -max_num_threads=256", "conv2d_NCHWc_KCRSk_tx_tune2", [[1, 32, 112, 112, 4], [32, 128, 3, 3, 4]], {}], "config": {"index": 31690765, "code_hash": null, "entity": [["tile_fc", "sp", [-1, 8, 2, 2]], ["tile_y", "sp", [-1, 1, 11, 1]], ["tile_x", "sp", [-1, 11, 2, 1]], ["tile_rcc", "sp", [-1, 1]], ["tile_ry", "sp", [-1, 3]], ["tile_rx", "sp", [-1, 3]], ["auto_unroll_max_step", "ot", 1500], ["unroll_explicit", "ot", 1]]}, "result": [[6.952654719333334], 0, 235.96230578422546, 1611737726.7318523], "version": 0.2, "tvm_version": "0.8.dev0"}
{"input": ["opencl -keys=opencl,gpu -max_num_threads=256", "conv2d_NCHWc_KCRSk_tx_tune2", [[1, 32, 112, 112, 4], [32, 128, 3, 3, 4]], {}], "config": {"index": 31690969, "code_hash": null, "entity": [["tile_fc", "sp", [-1, 8, 2, 1]], ["tile_y", "sp", [-1, 1, 22, 1]], ["tile_x", "sp", [-1, 11, 2, 1]], ["tile_rcc", "sp", [-1, 1]], ["tile_ry", "sp", [-1, 3]], ["tile_rx", "sp", [-1, 3]], ["auto_unroll_max_step", "ot", 1500], ["unroll_explicit", "ot", 1]]}, "result": [[9.409067965], 0, 332.5997865200043, 1611737823.0265706], "version": 0.2, "tvm_version": "0.8.dev0"}
{"input": ["opencl -keys=opencl,gpu -max_num_threads=256", "conv2d_NCHWc_KCRSk_tx_tune2", [[1, 32, 112, 112, 4], [32, 128, 3, 3, 4]], {}], "config": {"index": 26164461, "code_hash": null, "entity": [["tile_fc", "sp", [-1, 8, 2, 2]], ["tile_y", "sp", [-1, 1, 22, 1]], ["tile_x", "sp", [-1, 11, 1, 1]], ["tile_rcc", "sp", [-1, 1]], ["tile_ry", "sp", [-1, 3]], ["tile_rx", "sp", [-1, 3]], ["auto_unroll_max_step", "ot", 512], ["unroll_explicit", "ot", 1]]}, "result": [[6.858488365666666], 0, 406.08424067497253, 1611737896.9139736], "version": 0.2, "tvm_version": "0.8.dev0"}
{"input": ["opencl -keys=opencl,gpu -max_num_threads=256", "conv2d_NCHWc_KCRSk_tx_tune2", [[1, 32, 112, 112, 4], [32, 128, 3, 3, 4]], {}], "config": {"index": 26199575, "code_hash": null, "entity": [["tile_fc", "sp", [-1, 2, 4, 2]], ["tile_y", "sp", [-1, 5, 2, 1]], ["tile_x", "sp", [-1, 11, 5, 1]], ["tile_rcc", "sp", [-1, 1]], ["tile_ry", "sp", [-1, 3]], ["tile_rx", "sp", [-1, 3]], ["auto_unroll_max_step", "ot", 512], ["unroll_explicit", "ot", 1]]}, "result": [[6.921842428000001], 0, 497.8210117816925, 1611737988.1854205], "version": 0.2, "tvm_version": "0.8.dev0"}
{"input": ["opencl -keys=opencl,gpu -max_num_threads=256", "conv2d_NCHWc_KCRSk_tx_tune2", [[1, 32, 112, 112, 4], [32, 128, 3, 3, 4]], {}], "config": {"index": 31704599, "code_hash": null, "entity": [["tile_fc", "sp", [-1, 2, 4, 2]], ["tile_y", "sp", [-1, 5, 2, 1]], ["tile_x", "sp", [-1, 11, 5, 1]], ["tile_rcc", "sp", [-1, 1]], ["tile_ry", "sp", [-1, 3]], ["tile_rx", "sp", [-1, 3]], ["auto_unroll_max_step", "ot", 1500], ["unroll_explicit", "ot", 1]]}, "result": [[7.026552532], 0, 574.1981165409088, 1611738064.6479805], "version": 0.2, "tvm_version": "0.8.dev0"}
{"input": ["opencl -keys=opencl,gpu -max_num_threads=256", "conv2d_NCHWc_KCRSk_tx_tune2", [[1, 32, 112, 112, 4], [32, 128, 3, 3, 4]], {}], "config": {"index": 26164441, "code_hash": null, "entity": [["tile_fc", "sp", [-1, 8, 2, 1]], ["tile_y", "sp", [-1, 1, 22, 1]], ["tile_x", "sp", [-1, 11, 1, 1]], ["tile_rcc", "sp", [-1, 1]], ["tile_ry", "sp", [-1, 3]], ["tile_rx", "sp", [-1, 3]], ["auto_unroll_max_step", "ot", 512], ["unroll_explicit", "ot", 1]]}, "result": [[4.818531560666666], 0, 623.9758331775665, 1611738115.6190526], "version": 0.2, "tvm_version": "0.8.dev0"}
{"input": ["opencl -keys=opencl,gpu -max_num_threads=256", "conv2d_NCHWc_KCRSk_tx_tune2", [[1, 32, 112, 112, 4], [32, 128, 3, 3, 4]], {}], "config": {"index": 26167693, "code_hash": null, "entity": [["tile_fc", "sp", [-1, 4, 4, 1]], ["tile_y", "sp", [-1, 1, 10, 1]], ["tile_x", "sp", [-1, 22, 1, 1]], ["tile_rcc", "sp", [-1, 1]], ["tile_ry", "sp", [-1, 3]], ["tile_rx", "sp", [-1, 3]], ["auto_unroll_max_step", "ot", 512], ["unroll_explicit", "ot", 1]]}, "result": [[1.8773843916666666], 0, 646.6214187145233, 1611738138.4541197], "version": 0.2, "tvm_version": "0.8.dev0"}
{"input": ["opencl -keys=opencl,gpu -max_num_threads=256", "conv2d_NCHWc_KCRSk_tx_tune2", [[1, 32, 112, 112, 4], [32, 128, 3, 3, 4]], {}], "config": {"index": 31758899, "code_hash": null, "entity": [["tile_fc", "sp", [-1, 1, 4, 1]], ["tile_y", "sp", [-1, 2, 11, 1]], ["tile_x", "sp", [-1, 11, 1, 2]], ["tile_rcc", "sp", [-1, 1]], ["tile_ry", "sp", [-1, 3]], ["tile_rx", "sp", [-1, 3]], ["auto_unroll_max_step", "ot", 1500], ["unroll_explicit", "ot", 1]]}, "result": [[2.9459432106666665], 0, 679.423398733139, 1611738171.266971], "version": 0.2, "tvm_version": "0.8.dev0"}
{"input": ["opencl -keys=opencl,gpu -max_num_threads=256", "conv2d_NCHWc_KCRSk_tx_tune2", [[1, 32, 112, 112, 4], [32, 128, 3, 3, 4]], {}], "config": {"index": 1536000, "code_hash": null, "entity": [["tile_fc", "sp", [-1, 4, 4, 2]], ["tile_y", "sp", [-1, 1, 1, 5]], ["tile_x", "sp", [-1, 1, 22, 5]], ["tile_rcc", "sp", [-1, 1]], ["tile_ry", "sp", [-1, 3]], ["tile_rx", "sp", [-1, 1]], ["auto_unroll_max_step", "ot", 0], ["unroll_explicit", "ot", 0]]}, "result": [[2.629218245666667], 0, 708.049831867218, 1611738200.7749596], "version": 0.2, "tvm_version": "0.8.dev0"}
{"input": ["opencl -keys=opencl,gpu -max_num_threads=256", "conv2d_NCHWc_KCRSk_tx_tune2", [[1, 32, 112, 112, 4], [32, 128, 3, 3, 4]], {}], "config": {"index": 31691604, "code_hash": null, "entity": [["tile_fc", "sp", [-1, 4, 2, 2]], ["tile_y", "sp", [-1, 1, 11, 2]], ["tile_x", "sp", [-1, 11, 2, 1]], ["tile_rcc", "sp", [-1, 1]], ["tile_ry", "sp", [-1, 3]], ["tile_rx", "sp", [-1, 3]], ["auto_unroll_max_step", "ot", 1500], ["unroll_explicit", "ot", 1]]}, "result": [[3.2469700856666663], 0, 746.5334115028381, 1611738237.3835518], "version": 0.2, "tvm_version": "0.8.dev0"}
{"input": ["opencl -keys=opencl,gpu -max_num_threads=256", "conv2d_NCHWc_KCRSk_tx_tune2", [[1, 32, 112, 112, 4], [32, 128, 3, 3, 4]], {}], "config": {"index": 26186580, "code_hash": null, "entity": [["tile_fc", "sp", [-1, 4, 2, 2]], ["tile_y", "sp", [-1, 1, 11, 2]], ["tile_x", "sp", [-1, 11, 2, 1]], ["tile_rcc", "sp", [-1, 1]], ["tile_ry", "sp", [-1, 3]], ["tile_rx", "sp", [-1, 3]], ["auto_unroll_max_step", "ot", 512], ["unroll_explicit", "ot", 1]]}, "result": [[3.3010297036666665], 0, 38.54806184768677, 1611738279.1552129], "version": 0.2, "tvm_version": "0.8.dev0"}
{"input": ["opencl -keys=opencl,gpu -max_num_threads=256", "conv2d_NCHWc_KCRSk_tx_tune2", [[1, 32, 112, 112, 4], [32, 128, 3, 3, 4]], {}], "config": {"index": 26164463, "code_hash": null, "entity": [["tile_fc", "sp", [-1, 2, 4, 2]], ["tile_y", "sp", [-1, 1, 22, 1]], ["tile_x", "sp", [-1, 11, 1, 1]], ["tile_rcc", "sp", [-1, 1]], ["tile_ry", "sp", [-1, 3]], ["tile_rx", "sp", [-1, 3]], ["auto_unroll_max_step", "ot", 512], ["unroll_explicit", "ot", 1]]}, "result": [[1.1639294266666667], 0, 52.40612006187439, 1611738294.1162748], "version": 0.2, "tvm_version": "0.8.dev0"}
{"input": ["opencl -keys=opencl,gpu -max_num_threads=256", "conv2d_NCHWc_KCRSk_tx_tune2", [[1, 32, 112, 112, 4], [32, 128, 3, 3, 4]], {}], "config": {"index": 26168663, "code_hash": null, "entity": [["tile_fc", "sp", [-1, 2, 4, 2]], ["tile_y", "sp", [-1, 1, 11, 2]], ["tile_x", "sp", [-1, 22, 1, 1]], ["tile_rcc", "sp", [-1, 1]], ["tile_ry", "sp", [-1, 3]], ["tile_rx", "sp", [-1, 3]], ["auto_unroll_max_step", "ot", 512], ["unroll_explicit", "ot", 1]]}, "result": [[4.388744911666667], 0, 101.08864951133728, 1611738341.7824373], "version": 0.2, "tvm_version": "0.8.dev0"}
{"input": ["opencl -keys=opencl,gpu -max_num_threads=256", "conv2d_NCHWc_KCRSk_tx_tune2", [[1, 32, 112, 112, 4], [32, 128, 3, 3, 4]], {}], "config": {"index": 26167805, "code_hash": null, "entity": [["tile_fc", "sp", [-1, 4, 4, 1]], ["tile_y", "sp", [-1, 1, 11, 1]], ["tile_x", "sp", [-1, 22, 1, 1]], ["tile_rcc", "sp", [-1, 1]], ["tile_ry", "sp", [-1, 3]], ["tile_rx", "sp", [-1, 3]], ["auto_unroll_max_step", "ot", 512], ["unroll_explicit", "ot", 1]]}, "result": [[2.539189061666667], 0, 128.7481164932251, 1611738370.3047261], "version": 0.2, "tvm_version": "0.8.dev0"}
{"input": ["opencl -keys=opencl,gpu -max_num_threads=256", "conv2d_NCHWc_KCRSk_tx_tune2", [[1, 32, 112, 112, 4], [32, 128, 3, 3, 4]], {}], "config": {"index": 31672829, "code_hash": null, "entity": [["tile_fc", "sp", [-1, 4, 4, 1]], ["tile_y", "sp", [-1, 1, 11, 1]], ["tile_x", "sp", [-1, 22, 1, 1]], ["tile_rcc", "sp", [-1, 1]], ["tile_ry", "sp", [-1, 3]], ["tile_rx", "sp", [-1, 3]], ["auto_unroll_max_step", "ot", 1500], ["unroll_explicit", "ot", 1]]}, "result": [[6.510858973], 0, 199.31057977676392, 1611738439.927852], "version": 0.2, "tvm_version": "0.8.dev0"}
{"input": ["opencl -keys=opencl,gpu -max_num_threads=256", "conv2d_NCHWc_KCRSk_tx_tune2", [[1, 32, 112, 112, 4], [32, 128, 3, 3, 4]], {}], "config": {"index": 23500991, "code_hash": null, "entity": [["tile_fc", "sp", [-1, 2, 4, 2]], ["tile_y", "sp", [-1, 1, 5, 1]], ["tile_x", "sp", [-1, 11, 1, 2]], ["tile_rcc", "sp", [-1, 1]], ["tile_ry", "sp", [-1, 3]], ["tile_rx", "sp", [-1, 1]], ["auto_unroll_max_step", "ot", 512], ["unroll_explicit", "ot", 1]]}, "result": [[10.458059961333333], 0, 323.1513788700104, 1611738564.8088136], "version": 0.2, "tvm_version": "0.8.dev0"}
{"input": ["opencl -keys=opencl,gpu -max_num_threads=256", "conv2d_NCHWc_KCRSk_tx_tune2", [[1, 32, 112, 112, 4], [32, 128, 3, 3, 4]], {}], "config": {"index": 29006015, "code_hash": null, "entity": [["tile_fc", "sp", [-1, 2, 4, 2]], ["tile_y", "sp", [-1, 1, 5, 1]], ["tile_x", "sp", [-1, 11, 1, 2]], ["tile_rcc", "sp", [-1, 1]], ["tile_ry", "sp", [-1, 3]], ["tile_rx", "sp", [-1, 1]], ["auto_unroll_max_step", "ot", 1500], ["unroll_explicit", "ot", 1]]}, "result": [[8.990189666666668], 0, 417.0103962421417, 1611738658.357362], "version": 0.2, "tvm_version": "0.8.dev0"}
{"input": ["opencl -keys=opencl,gpu -max_num_threads=256", "conv2d_NCHWc_KCRSk_tx_tune2", [[1, 32, 112, 112, 4], [32, 128, 3, 3, 4]], {}], "config": {"index": 26160712, "code_hash": null, "entity": [["tile_fc", "sp", [-1, 4, 4, 2]], ["tile_y", "sp", [-1, 2, 11, 1]], ["tile_x", "sp", [-1, 10, 1, 1]], ["tile_rcc", "sp", [-1, 1]], ["tile_ry", "sp", [-1, 3]], ["tile_rx", "sp", [-1, 3]], ["auto_unroll_max_step", "ot", 512], ["unroll_explicit", "ot", 1]]}, "result": [[8.217463173666667], 0, 501.52131366729736, 1611738742.642284], "version": 0.2, "tvm_version": "0.8.dev0"}
{"input": ["opencl -keys=opencl,gpu -max_num_threads=256", "conv2d_NCHWc_KCRSk_tx_tune2", [[1, 32, 112, 112, 4], [32, 128, 3, 3, 4]], {}], "config": {"index": 6891414, "code_hash": null, "entity": [["tile_fc", "sp", [-1, 1, 2, 16]], ["tile_y", "sp", [-1, 1, 2, 11]], ["tile_x", "sp", [-1, 5, 1, 1]], ["tile_rcc", "sp", [-1, 1]], ["tile_ry", "sp", [-1, 3]], ["tile_rx", "sp", [-1, 1]], ["auto_unroll_max_step", "ot", 512], ["unroll_explicit", "ot", 0]]}, "result": [[4.2352650160000005], 0, 556.1670784950256, 1611738798.4881995], "version": 0.2, "tvm_version": "0.8.dev0"}
{"input": ["opencl -keys=opencl,gpu -max_num_threads=256", "conv2d_NCHWc_KCRSk_tx_tune2", [[1, 32, 112, 112, 4], [32, 128, 3, 3, 4]], {}], "config": {"index": 20690363, "code_hash": null, "entity": [["tile_fc", "sp", [-1, 1, 4, 4]], ["tile_y", "sp", [-1, 1, 2, 55]], ["tile_x", "sp", [-1, 1, 5, 1]], ["tile_rcc", "sp", [-1, 1]], ["tile_ry", "sp", [-1, 3]], ["tile_rx", "sp", [-1, 3]], ["auto_unroll_max_step", "ot", 0], ["unroll_explicit", "ot", 1]]}, "result": [[0.9635081766666667], 0, 13.216984748840332, 1611739087.7087047], "version": 0.2, "tvm_version": "0.8.dev0"}
{"input": ["opencl -keys=opencl,gpu -max_num_threads=256", "conv2d_NCHWc_KCRSk_tx_tune2", [[1, 32, 112, 112, 4], [32, 128, 3, 3, 4]], {}], "config": {"index": 4175291, "code_hash": null, "entity": [["tile_fc", "sp", [-1, 1, 4, 4]], ["tile_y", "sp", [-1, 1, 2, 55]], ["tile_x", "sp", [-1, 1, 5, 1]], ["tile_rcc", "sp", [-1, 1]], ["tile_ry", "sp", [-1, 3]], ["tile_rx", "sp", [-1, 3]], ["auto_unroll_max_step", "ot", 0], ["unroll_explicit", "ot", 0]]}, "result": [[0.9441266143333333], 0, 25.757797241210938, 1611739100.3091214], "version": 0.2, "tvm_version": "0.8.dev0"}
{"input": ["opencl -keys=opencl,gpu -max_num_threads=256", "conv2d_NCHWc_KCRSk_tx_tune2", [[1, 32, 112, 112, 4], [32, 128, 3, 3, 4]], {}], "config": {"index": 26195387, "code_hash": null, "entity": [["tile_fc", "sp", [-1, 1, 4, 4]], ["tile_y", "sp", [-1, 1, 2, 55]], ["tile_x", "sp", [-1, 1, 5, 1]], ["tile_rcc", "sp", [-1, 1]], ["tile_ry", "sp", [-1, 3]], ["tile_rx", "sp", [-1, 3]], ["auto_unroll_max_step", "ot", 512], ["unroll_explicit", "ot", 1]]}, "result": [[5.236954564], 0, 103.72897958755493, 1611739177.1884177], "version": 0.2, "tvm_version": "0.8.dev0"}
{"input": ["opencl -keys=opencl,gpu -max_num_threads=256", "conv2d_NCHWc_KCRSk_tx_tune2", [[1, 32, 112, 112, 4], [32, 128, 3, 3, 4]], {}], "config": {"index": 4178863, "code_hash": null, "entity": [["tile_fc", "sp", [-1, 2, 4, 2]], ["tile_y", "sp", [-1, 1, 2, 55]], ["tile_x", "sp", [-1, 2, 5, 1]], ["tile_rcc", "sp", [-1, 1]], ["tile_ry", "sp", [-1, 3]], ["tile_rx", "sp", [-1, 3]], ["auto_unroll_max_step", "ot", 0], ["unroll_explicit", "ot", 0]]}, "result": [[1.1428631593333334], 0, 117.25138187408447, 1611739191.7555366], "version": 0.2, "tvm_version": "0.8.dev0"}
{"input": ["opencl -keys=opencl,gpu -max_num_threads=256", "conv2d_NCHWc_KCRSk_tx_tune2", [[1, 32, 112, 112, 4], [32, 128, 3, 3, 4]], {}], "config": {"index": 20776211, "code_hash": null, "entity": [["tile_fc", "sp", [-1, 1, 4, 4]], ["tile_y", "sp", [-1, 1, 5, 22]], ["tile_x", "sp", [-1, 1, 1, 5]], ["tile_rcc", "sp", [-1, 1]], ["tile_ry", "sp", [-1, 3]], ["tile_rx", "sp", [-1, 3]], ["auto_unroll_max_step", "ot", 0], ["unroll_explicit", "ot", 1]]}, "result": [[1.3364149993333332], 0, 133.80891633033752, 1611739208.357365], "version": 0.2, "tvm_version": "0.8.dev0"}
{"input": ["opencl -keys=opencl,gpu -max_num_threads=256", "conv2d_NCHWc_KCRSk_tx_tune2", [[1, 32, 112, 112, 4], [32, 128, 3, 3, 4]], {}], "config": {"index": 31700411, "code_hash": null, "entity": [["tile_fc", "sp", [-1, 1, 4, 4]], ["tile_y", "sp", [-1, 1, 2, 55]], ["tile_x", "sp", [-1, 1, 5, 1]], ["tile_rcc", "sp", [-1, 1]], ["tile_ry", "sp", [-1, 3]], ["tile_rx", "sp", [-1, 3]], ["auto_unroll_max_step", "ot", 1500], ["unroll_explicit", "ot", 1]]}, "result": [[5.468215449333333], 0, 203.50883626937866, 1611739277.140723], "version": 0.2, "tvm_version": "0.8.dev0"}
{"input": ["opencl -keys=opencl,gpu -max_num_threads=256", "conv2d_NCHWc_KCRSk_tx_tune2", [[1, 32, 112, 112, 4], [32, 128, 3, 3, 4]], {}], "config": {"index": 31700174, "code_hash": null, "entity": [["tile_fc", "sp", [-1, 1, 4, 2]], ["tile_y", "sp", [-1, 5, 1, 22]], ["tile_x", "sp", [-1, 1, 5, 1]], ["tile_rcc", "sp", [-1, 1]], ["tile_ry", "sp", [-1, 3]], ["tile_rx", "sp", [-1, 3]], ["auto_unroll_max_step", "ot", 1500], ["unroll_explicit", "ot", 1]]}, "result": [[5.619376977000001], 0, 266.27590894699097, 1611739340.175056], "version": 0.2, "tvm_version": "0.8.dev0"}
{"input": ["opencl -keys=opencl,gpu -max_num_threads=256", "conv2d_NCHWc_KCRSk_tx_tune2", [[1, 32, 112, 112, 4], [32, 128, 3, 3, 4]], {}], "config": {"index": 26250257, "code_hash": null, "entity": [["tile_fc", "sp", [-1, 1, 8, 2]], ["tile_y", "sp", [-1, 1, 11, 1]], ["tile_x", "sp", [-1, 5, 1, 2]], ["tile_rcc", "sp", [-1, 1]], ["tile_ry", "sp", [-1, 3]], ["tile_rx", "sp", [-1, 3]], ["auto_unroll_max_step", "ot", 512], ["unroll_explicit", "ot", 1]]}, "result": [[0.057136875000000004], 0, 278.7066099643707, 1611739353.301819], "version": 0.2, "tvm_version": "0.8.dev0"}
{"input": ["opencl -keys=opencl,gpu -max_num_threads=256", "conv2d_NCHWc_KCRSk_tx_tune2", [[1, 32, 112, 112, 4], [32, 128, 3, 3, 4]], {}], "config": {"index": 19278087, "code_hash": null, "entity": [["tile_fc", "sp", [-1, 2, 4, 2]], ["tile_y", "sp", [-1, 1, 5, 22]], ["tile_x", "sp", [-1, 5, 1, 1]], ["tile_rcc", "sp", [-1, 1]], ["tile_ry", "sp", [-1, 1]], ["tile_rx", "sp", [-1, 3]], ["auto_unroll_max_step", "ot", 0], ["unroll_explicit", "ot", 1]]}, "result": [[1.5038856763333335], 0, 296.8379228115082, 1611739371.5642378], "version": 0.2, "tvm_version": "0.8.dev0"}
{"input": ["opencl -keys=opencl,gpu -max_num_threads=256", "conv2d_NCHWc_KCRSk_tx_tune2", [[1, 32, 112, 112, 4], [32, 128, 3, 3, 4]], {}], "config": {"index": 4175279, "code_hash": null, "entity": [["tile_fc", "sp", [-1, 2, 4, 2]], ["tile_y", "sp", [-1, 1, 2, 55]], ["tile_x", "sp", [-1, 1, 5, 1]], ["tile_rcc", "sp", [-1, 1]], ["tile_ry", "sp", [-1, 3]], ["tile_rx", "sp", [-1, 3]], ["auto_unroll_max_step", "ot", 0], ["unroll_explicit", "ot", 0]]}, "result": [[0.9439619266666667], 0, 12.91483187675476, 1611739387.9112687], "version": 0.2, "tvm_version": "0.8.dev0"}
{"input": ["opencl -keys=opencl,gpu -max_num_threads=256", "conv2d_NCHWc_KCRSk_tx_tune2", [[1, 32, 112, 112, 4], [32, 128, 3, 3, 4]], {}], "config": {"index": 20690409, "code_hash": null, "entity": [["tile_fc", "sp", [-1, 1, 8, 2]], ["tile_y", "sp", [-1, 1, 1, 110]], ["tile_x", "sp", [-1, 1, 5, 1]], ["tile_rcc", "sp", [-1, 1]], ["tile_ry", "sp", [-1, 3]], ["tile_rx", "sp", [-1, 3]], ["auto_unroll_max_step", "ot", 0], ["unroll_explicit", "ot", 1]]}, "result": [[0.927561458], 0, 25.28957748413086, 1611739400.3684752], "version": 0.2, "tvm_version": "0.8.dev0"}
{"input": ["opencl -keys=opencl,gpu -max_num_threads=256", "conv2d_NCHWc_KCRSk_tx_tune2", [[1, 32, 112, 112, 4], [32, 128, 3, 3, 4]], {}], "config": {"index": 15188911, "code_hash": null, "entity": [["tile_fc", "sp", [-1, 2, 4, 2]], ["tile_y", "sp", [-1, 1, 2, 55]], ["tile_x", "sp", [-1, 2, 5, 1]], ["tile_rcc", "sp", [-1, 1]], ["tile_ry", "sp", [-1, 3]], ["tile_rx", "sp", [-1, 3]], ["auto_unroll_max_step", "ot", 1500], ["unroll_explicit", "ot", 0]]}, "result": [[1.1583627773333334], 0, 40.477818965911865, 1611739415.255099], "version": 0.2, "tvm_version": "0.8.dev0"}
{"input": ["opencl -keys=opencl,gpu -max_num_threads=256", "conv2d_NCHWc_KCRSk_tx_tune2", [[1, 32, 112, 112, 4], [32, 128, 3, 3, 4]], {}], "config": {"index": 20690126, "code_hash": null, "entity": [["tile_fc", "sp", [-1, 1, 4, 2]], ["tile_y", "sp", [-1, 5, 1, 22]], ["tile_x", "sp", [-1, 1, 5, 1]], ["tile_rcc", "sp", [-1, 1]], ["tile_ry", "sp", [-1, 3]], ["tile_rx", "sp", [-1, 3]], ["auto_unroll_max_step", "ot", 0], ["unroll_explicit", "ot", 1]]}, "result": [[1.309581944], 0, 56.794413805007935, 1611739431.5304186], "version": 0.2, "tvm_version": "0.8.dev0"}
{"input": ["opencl -keys=opencl,gpu -max_num_threads=256", "conv2d_NCHWc_KCRSk_tx_tune2", [[1, 32, 112, 112, 4], [32, 128, 3, 3, 4]], {}], "config": {"index": 26195150, "code_hash": null, "entity": [["tile_fc", "sp", [-1, 1, 4, 2]], ["tile_y", "sp", [-1, 5, 1, 22]], ["tile_x", "sp", [-1, 1, 5, 1]], ["tile_rcc", "sp", [-1, 1]], ["tile_ry", "sp", [-1, 3]], ["tile_rx", "sp", [-1, 3]], ["auto_unroll_max_step", "ot", 512], ["unroll_explicit", "ot", 1]]}, "result": [[5.624506664666666], 0, 120.3268814086914, 1611739494.4149635], "version": 0.2, "tvm_version": "0.8.dev0"}
