logs/conv2d_NCHWc_KCRSk_tx_tune2.autotvm.shared.log
{"input": ["opencl -keys=opencl,gpu -max_num_threads=256", "conv2d_NCHWc_KCRSk_tx_tune2", [[1, 32, 112, 112, 4], [32, 128, 3, 3, 4]], {}], "config": {"index": 11269972, "code_hash": null, "entity": [["tile_fc", "sp", [-1, 4, 2, 2]], ["tile_y", "sp", [-1, 1, 11, 2]], ["tile_x", "sp", [-1, 1, 2, 1]], ["tile_rcc", "sp", [-1, 2]], ["tile_ry", "sp", [-1, 1]], ["tile_rx", "sp", [-1, 1]], ["auto_unroll_max_step", "ot", 1500], ["unroll_explicit", "ot", 0]]}, "result": [[0.050511423666666666], 0, 6.544091463088989, 1611792924.6937687], "version": 0.2, "tvm_version": "0.8.dev0"}
{"input": ["opencl -keys=opencl,gpu -max_num_threads=256", "conv2d_NCHWc_KCRSk_tx_tune2", [[1, 32, 112, 112, 4], [32, 128, 3, 3, 4]], {}], "config": {"index": 15351824, "code_hash": null, "entity": [["tile_fc", "sp", [-1, 1, 2, 4]], ["tile_y", "sp", [-1, 1, 1, 2]], ["tile_x", "sp", [-1, 1, 5, 22]], ["tile_rcc", "sp", [-1, 1]], ["tile_ry", "sp", [-1, 3]], ["tile_rx", "sp", [-1, 3]], ["auto_unroll_max_step", "ot", 1500], ["unroll_explicit", "ot", 0]]}, "result": [[1.240565607], 0, 37.350051403045654, 1611792955.6711552], "version": 0.2, "tvm_version": "0.8.dev0"}
{"input": ["opencl -keys=opencl,gpu -max_num_threads=256", "conv2d_NCHWc_KCRSk_tx_tune2", [[1, 32, 112, 112, 4], [32, 128, 3, 3, 4]], {}], "config": {"index": 29249920, "code_hash": null, "entity": [["tile_fc", "sp", [-1, 1, 1, 1]], ["tile_y", "sp", [-1, 1, 10, 1]], ["tile_x", "sp", [-1, 1, 11, 2]], ["tile_rcc", "sp", [-1, 2]], ["tile_ry", "sp", [-1, 3]], ["tile_rx", "sp", [-1, 1]], ["auto_unroll_max_step", "ot", 1500], ["unroll_explicit", "ot", 1]]}, "result": [[0.14986208333333334], 0, 30.32601523399353, 1611792986.2945461], "version": 0.2, "tvm_version": "0.8.dev0"}
{"input": ["opencl -keys=opencl,gpu -max_num_threads=256", "conv2d_NCHWc_KCRSk_tx_tune2", [[1, 32, 112, 112, 4], [32, 128, 3, 3, 4]], {}], "config": {"index": 26336763, "code_hash": null, "entity": [["tile_fc", "sp", [-1, 2, 16, 1]], ["tile_y", "sp", [-1, 1, 1, 2]], ["tile_x", "sp", [-1, 1, 2, 11]], ["tile_rcc", "sp", [-1, 1]], ["tile_ry", "sp", [-1, 3]], ["tile_rx", "sp", [-1, 3]], ["auto_unroll_max_step", "ot", 512], ["unroll_explicit", "ot", 1]]}, "result": [[0.24718152766666668], 0, 5.935230493545532, 1611792992.5203273], "version": 0.2, "tvm_version": "0.8.dev0"}
{"input": ["opencl -keys=opencl,gpu -max_num_threads=256", "conv2d_NCHWc_KCRSk_tx_tune2", [[1, 32, 112, 112, 4], [32, 128, 3, 3, 4]], {}], "config": {"index": 12499282, "code_hash": null, "entity": [["tile_fc", "sp", [-1, 1, 2, 2]], ["tile_y", "sp", [-1, 1, 11, 2]], ["tile_x", "sp", [-1, 1, 5, 2]], ["tile_rcc", "sp", [-1, 1]], ["tile_ry", "sp", [-1, 3]], ["tile_rx", "sp", [-1, 1]], ["auto_unroll_max_step", "ot", 1500], ["unroll_explicit", "ot", 0]]}, "result": [[0.05529626766666667], 0, 39.479506492614746, 1611793239.9863386], "version": 0.2, "tvm_version": "0.8.dev0"}
{"input": ["opencl -keys=opencl,gpu -max_num_threads=256", "conv2d_NCHWc_KCRSk_tx_tune2", [[1, 32, 112, 112, 4], [32, 128, 3, 3, 4]], {}], "config": {"index": 186388, "code_hash": null, "entity": [["tile_fc", "sp", [-1, 1, 32, 1]], ["tile_y", "sp", [-1, 1, 1, 1]], ["tile_x", "sp", [-1, 1, 2, 11]], ["tile_rcc", "sp", [-1, 1]], ["tile_ry", "sp", [-1, 1]], ["tile_rx", "sp", [-1, 1]], ["auto_unroll_max_step", "ot", 0], ["unroll_explicit", "ot", 0]]}, "result": [[0.05044142366666667], 0, 65.12119221687317, 1611793265.597777], "version": 0.2, "tvm_version": "0.8.dev0"}
{"input": ["opencl -keys=opencl,gpu -max_num_threads=256", "conv2d_NCHWc_KCRSk_tx_tune2", [[1, 32, 112, 112, 4], [32, 128, 3, 3, 4]], {}], "config": {"index": 11076116, "code_hash": null, "entity": [["tile_fc", "sp", [-1, 2, 4, 4]], ["tile_y", "sp", [-1, 1, 1, 2]], ["tile_x", "sp", [-1, 1, 11, 1]], ["tile_rcc", "sp", [-1, 1]], ["tile_ry", "sp", [-1, 1]], ["tile_rx", "sp", [-1, 1]], ["auto_unroll_max_step", "ot", 1500], ["unroll_explicit", "ot", 0]]}, "result": [[0.06638871533333333], 0, 4.429143667221069, 1611793271.265508], "version": 0.2, "tvm_version": "0.8.dev0"}
{"input": ["opencl -keys=opencl,gpu -max_num_threads=256", "conv2d_NCHWc_KCRSk_tx_tune2", [[1, 32, 112, 112, 4], [32, 128, 3, 3, 4]], {}], "config": {"index": 11139778, "code_hash": null, "entity": [["tile_fc", "sp", [-1, 2, 8, 2]], ["tile_y", "sp", [-1, 1, 5, 1]], ["tile_x", "sp", [-1, 1, 1, 5]], ["tile_rcc", "sp", [-1, 1]], ["tile_ry", "sp", [-1, 1]], ["tile_rx", "sp", [-1, 1]], ["auto_unroll_max_step", "ot", 1500], ["unroll_explicit", "ot", 0]]}, "result": [[0.07040798599999999], 0, 8.270369529724121, 1611793274.947293], "version": 0.2, "tvm_version": "0.8.dev0"}
{"input": ["opencl -keys=opencl,gpu -max_num_threads=256", "conv2d_NCHWc_KCRSk_tx_tune2", [[1, 32, 112, 112, 4], [32, 128, 3, 3, 4]], {}], "config": {"index": 16595475, "code_hash": null, "entity": [["tile_fc", "sp", [-1, 1, 4, 4]], ["tile_y", "sp", [-1, 1, 1, 2]], ["tile_x", "sp", [-1, 1, 22, 1]], ["tile_rcc", "sp", [-1, 1]], ["tile_ry", "sp", [-1, 1]], ["tile_rx", "sp", [-1, 1]], ["auto_unroll_max_step", "ot", 0], ["unroll_explicit", "ot", 1]]}, "result": [[0.04633515633333333], 0, 25.392345428466797, 1611793301.318017], "version": 0.2, "tvm_version": "0.8.dev0"}
{"input": ["opencl -keys=opencl,gpu -max_num_threads=256", "conv2d_NCHWc_KCRSk_tx_tune2", [[1, 32, 112, 112, 4], [32, 128, 3, 3, 4]], {}], "config": {"index": 30337227, "code_hash": null, "entity": [["tile_fc", "sp", [-1, 1, 4, 1]], ["tile_y", "sp", [-1, 1, 2, 5]], ["tile_x", "sp", [-1, 1, 10, 1]], ["tile_rcc", "sp", [-1, 1]], ["tile_ry", "sp", [-1, 1]], ["tile_rx", "sp", [-1, 3]], ["auto_unroll_max_step", "ot", 1500], ["unroll_explicit", "ot", 1]]}, "result": [[0.06315112833333333], 0, 29.317052841186523, 1611793304.8759441], "version": 0.2, "tvm_version": "0.8.dev0"}
{"input": ["opencl -keys=opencl,gpu -max_num_threads=256", "conv2d_NCHWc_KCRSk_tx_tune2", [[1, 32, 112, 112, 4], [32, 128, 3, 3, 4]], {}], "config": {"index": 26668544, "code_hash": null, "entity": [["tile_fc", "sp", [-1, 1, 1, 1]], ["tile_y", "sp", [-1, 1, 1, 1]], ["tile_x", "sp", [-1, 11, 10, 1]], ["tile_rcc", "sp", [-1, 4]], ["tile_ry", "sp", [-1, 3]], ["tile_rx", "sp", [-1, 3]], ["auto_unroll_max_step", "ot", 512], ["unroll_explicit", "ot", 1]]}, "result": [[1.0072586973333333], 0, 58.69743061065674, 1611793334.0967505], "version": 0.2, "tvm_version": "0.8.dev0"}
{"input": ["opencl -keys=opencl,gpu -max_num_threads=256", "conv2d_NCHWc_KCRSk_tx_tune2", [[1, 32, 112, 112, 4], [32, 128, 3, 3, 4]], {}], "config": {"index": 31701376, "code_hash": null, "entity": [["tile_fc", "sp", [-1, 1, 1, 1]], ["tile_y", "sp", [-1, 1, 10, 1]], ["tile_x", "sp", [-1, 2, 5, 1]], ["tile_rcc", "sp", [-1, 1]], ["tile_ry", "sp", [-1, 3]], ["tile_rx", "sp", [-1, 3]], ["auto_unroll_max_step", "ot", 1500], ["unroll_explicit", "ot", 1]]}, "result": [[0.08534510433333332], 0, 4.064068555831909, 1611793583.44584], "version": 0.2, "tvm_version": "0.8.dev0"}
{"input": ["opencl -keys=opencl,gpu -max_num_threads=256", "conv2d_NCHWc_KCRSk_tx_tune2", [[1, 32, 112, 112, 4], [32, 128, 3, 3, 4]], {}], "config": {"index": 31701488, "code_hash": null, "entity": [["tile_fc", "sp", [-1, 1, 1, 1]], ["tile_y", "sp", [-1, 1, 11, 1]], ["tile_x", "sp", [-1, 2, 5, 1]], ["tile_rcc", "sp", [-1, 1]], ["tile_ry", "sp", [-1, 3]], ["tile_rx", "sp", [-1, 3]], ["auto_unroll_max_step", "ot", 1500], ["unroll_explicit", "ot", 1]]}, "result": [[0.07826220466666667], 0, 8.030253410339355, 1611793587.4390519], "version": 0.2, "tvm_version": "0.8.dev0"}
{"input": ["opencl -keys=opencl,gpu -max_num_threads=256", "conv2d_NCHWc_KCRSk_tx_tune2", [[1, 32, 112, 112, 4], [32, 128, 3, 3, 4]], {}], "config": {"index": 31712240, "code_hash": null, "entity": [["tile_fc", "sp", [-1, 1, 1, 1]], ["tile_y", "sp", [-1, 1, 11, 1]], ["tile_x", "sp", [-1, 1, 10, 1]], ["tile_rcc", "sp", [-1, 1]], ["tile_ry", "sp", [-1, 3]], ["tile_rx", "sp", [-1, 3]], ["auto_unroll_max_step", "ot", 1500], ["unroll_explicit", "ot", 1]]}, "result": [[0.727772864], 0, 20.865172386169434, 1611793599.4234455], "version": 0.2, "tvm_version": "0.8.dev0"}
{"input": ["opencl -keys=opencl,gpu -max_num_threads=256", "conv2d_NCHWc_KCRSk_tx_tune2", [[1, 32, 112, 112, 4], [32, 128, 3, 3, 4]], {}], "config": {"index": 31655344, "code_hash": null, "entity": [["tile_fc", "sp", [-1, 1, 1, 1]], ["tile_y", "sp", [-1, 1, 110, 1]], ["tile_x", "sp", [-1, 1, 1, 1]], ["tile_rcc", "sp", [-1, 1]], ["tile_ry", "sp", [-1, 3]], ["tile_rx", "sp", [-1, 3]], ["auto_unroll_max_step", "ot", 1500], ["unroll_explicit", "ot", 1]]}, "result": [[0.62698467], 0, 31.555505752563477, 1611793610.1874948], "version": 0.2, "tvm_version": "0.8.dev0"}
{"input": ["opencl -keys=opencl,gpu -max_num_threads=256", "conv2d_NCHWc_KCRSk_tx_tune2", [[1, 32, 112, 112, 4], [32, 128, 3, 3, 4]], {}], "config": {"index": 31658816, "code_hash": null, "entity": [["tile_fc", "sp", [-1, 1, 1, 1]], ["tile_y", "sp", [-1, 1, 55, 1]], ["tile_x", "sp", [-1, 2, 1, 1]], ["tile_rcc", "sp", [-1, 1]], ["tile_ry", "sp", [-1, 3]], ["tile_rx", "sp", [-1, 3]], ["auto_unroll_max_step", "ot", 1500], ["unroll_explicit", "ot", 1]]}, "result": [[0.11866765633333333], 0, 34.92254829406738, 1611793614.409108], "version": 0.2, "tvm_version": "0.8.dev0"}
{"input": ["opencl -keys=opencl,gpu -max_num_threads=256", "conv2d_NCHWc_KCRSk_tx_tune2", [[1, 32, 112, 112, 4], [32, 128, 3, 3, 4]], {}], "config": {"index": 31701712, "code_hash": null, "entity": [["tile_fc", "sp", [-1, 1, 1, 1]], ["tile_y", "sp", [-1, 1, 22, 1]], ["tile_x", "sp", [-1, 2, 5, 1]], ["tile_rcc", "sp", [-1, 1]], ["tile_ry", "sp", [-1, 3]], ["tile_rx", "sp", [-1, 3]], ["auto_unroll_max_step", "ot", 1500], ["unroll_explicit", "ot", 1]]}, "result": [[0.07495782966666667], 0, 38.85584115982056, 1611793618.1302123], "version": 0.2, "tvm_version": "0.8.dev0"}
{"input": ["opencl -keys=opencl,gpu -max_num_threads=256", "conv2d_NCHWc_KCRSk_tx_tune2", [[1, 32, 112, 112, 4], [32, 128, 3, 3, 4]], {}], "config": {"index": 30551024, "code_hash": null, "entity": [["tile_fc", "sp", [-1, 1, 1, 1]], ["tile_y", "sp", [-1, 1, 11, 1]], ["tile_x", "sp", [-1, 1, 5, 1]], ["tile_rcc", "sp", [-1, 2]], ["tile_ry", "sp", [-1, 1]], ["tile_rx", "sp", [-1, 3]], ["auto_unroll_max_step", "ot", 1500], ["unroll_explicit", "ot", 1]]}, "result": [[0.657448906], 0, 52.27356815338135, 1611793630.6122918], "version": 0.2, "tvm_version": "0.8.dev0"}
{"input": ["opencl -keys=opencl,gpu -max_num_threads=256", "conv2d_NCHWc_KCRSk_tx_tune2", [[1, 32, 112, 112, 4], [32, 128, 3, 3, 4]], {}], "config": {"index": 20648768, "code_hash": null, "entity": [["tile_fc", "sp", [-1, 1, 1, 1]], ["tile_y", "sp", [-1, 1, 55, 1]], ["tile_x", "sp", [-1, 2, 1, 1]], ["tile_rcc", "sp", [-1, 1]], ["tile_ry", "sp", [-1, 3]], ["tile_rx", "sp", [-1, 3]], ["auto_unroll_max_step", "ot", 0], ["unroll_explicit", "ot", 1]]}, "result": [[0.13951717], 0, 55.61468458175659, 1611793635.0104897], "version": 0.2, "tvm_version": "0.8.dev0"}
{"input": ["opencl -keys=opencl,gpu -max_num_threads=256", "conv2d_NCHWc_KCRSk_tx_tune2", [[1, 32, 112, 112, 4], [32, 128, 3, 3, 4]], {}], "config": {"index": 20645184, "code_hash": null, "entity": [["tile_fc", "sp", [-1, 1, 1, 1]], ["tile_y", "sp", [-1, 1, 55, 1]], ["tile_x", "sp", [-1, 1, 1, 1]], ["tile_rcc", "sp", [-1, 1]], ["tile_ry", "sp", [-1, 3]], ["tile_rx", "sp", [-1, 3]], ["auto_unroll_max_step", "ot", 0], ["unroll_explicit", "ot", 1]]}, "result": [[0.128481389], 0, 59.85703182220459, 1611793639.2447076], "version": 0.2, "tvm_version": "0.8.dev0"}
{"input": ["opencl -keys=opencl,gpu -max_num_threads=256", "conv2d_NCHWc_KCRSk_tx_tune2", [[1, 32, 112, 112, 4], [32, 128, 3, 3, 4]], {}], "config": {"index": 31719296, "code_hash": null, "entity": [["tile_fc", "sp", [-1, 1, 1, 1]], ["tile_y", "sp", [-1, 1, 10, 1]], ["tile_x", "sp", [-1, 1, 11, 1]], ["tile_rcc", "sp", [-1, 1]], ["tile_ry", "sp", [-1, 3]], ["tile_rx", "sp", [-1, 3]], ["auto_unroll_max_step", "ot", 1500], ["unroll_explicit", "ot", 1]]}, "result": [[0.7028465970000001], 0, 90.55101084709167, 1611793669.4829283], "version": 0.2, "tvm_version": "0.8.dev0"}
{"input": ["opencl -keys=opencl,gpu -max_num_threads=256", "conv2d_NCHWc_KCRSk_tx_tune2", [[1, 32, 112, 112, 4], [32, 128, 3, 3, 4]], {}], "config": {"index": 31698128, "code_hash": null, "entity": [["tile_fc", "sp", [-1, 1, 1, 1]], ["tile_y", "sp", [-1, 1, 22, 1]], ["tile_x", "sp", [-1, 1, 5, 1]], ["tile_rcc", "sp", [-1, 1]], ["tile_ry", "sp", [-1, 3]], ["tile_rx", "sp", [-1, 3]], ["auto_unroll_max_step", "ot", 1500], ["unroll_explicit", "ot", 1]]}, "result": [[0.718119722], 0, 102.78886890411377, 1611793681.7509325], "version": 0.2, "tvm_version": "0.8.dev0"}
{"input": ["opencl -keys=opencl,gpu -max_num_threads=256", "conv2d_NCHWc_KCRSk_tx_tune2", [[1, 32, 112, 112, 4], [32, 128, 3, 3, 4]], {}], "config": {"index": 31697798, "code_hash": null, "entity": [["tile_fc", "sp", [-1, 1, 2, 1]], ["tile_y", "sp", [-1, 1, 10, 1]], ["tile_x", "sp", [-1, 1, 5, 1]], ["tile_rcc", "sp", [-1, 1]], ["tile_ry", "sp", [-1, 3]], ["tile_rx", "sp", [-1, 3]], ["auto_unroll_max_step", "ot", 1500], ["unroll_explicit", "ot", 1]]}, "result": [[0.4482795136666667], 0, 111.89919710159302, 1611793690.6347358], "version": 0.2, "tvm_version": "0.8.dev0"}
{"input": ["opencl -keys=opencl,gpu -max_num_threads=256", "conv2d_NCHWc_KCRSk_tx_tune2", [[1, 32, 112, 112, 4], [32, 128, 3, 3, 4]], {}], "config": {"index": 30578688, "code_hash": null, "entity": [["tile_fc", "sp", [-1, 1, 1, 1]], ["tile_y", "sp", [-1, 1, 1, 1]], ["tile_x", "sp", [-1, 5, 11, 1]], ["tile_rcc", "sp", [-1, 2]], ["tile_ry", "sp", [-1, 1]], ["tile_rx", "sp", [-1, 3]], ["auto_unroll_max_step", "ot", 1500], ["unroll_explicit", "ot", 1]]}, "result": [[0.24529166666666666], 0, 22.112069368362427, 1611793714.2490046], "version": 0.2, "tvm_version": "0.8.dev0"}
{"input": ["opencl -keys=opencl,gpu -max_num_threads=256", "conv2d_NCHWc_KCRSk_tx_tune2", [[1, 32, 112, 112, 4], [32, 128, 3, 3, 4]], {}], "config": {"index": 31662064, "code_hash": null, "entity": [["tile_fc", "sp", [-1, 1, 1, 1]], ["tile_y", "sp", [-1, 1, 11, 1]], ["tile_x", "sp", [-1, 5, 1, 1]], ["tile_rcc", "sp", [-1, 1]], ["tile_ry", "sp", [-1, 3]], ["tile_rx", "sp", [-1, 3]], ["auto_unroll_max_step", "ot", 1500], ["unroll_explicit", "ot", 1]]}, "result": [[0.132671111], 0, 26.28921604156494, 1611793718.648694], "version": 0.2, "tvm_version": "0.8.dev0"}
{"input": ["opencl -keys=opencl,gpu -max_num_threads=256", "conv2d_NCHWc_KCRSk_tx_tune2", [[1, 32, 112, 112, 4], [32, 128, 3, 3, 4]], {}], "config": {"index": 31665648, "code_hash": null, "entity": [["tile_fc", "sp", [-1, 1, 1, 1]], ["tile_y", "sp", [-1, 1, 11, 1]], ["tile_x", "sp", [-1, 10, 1, 1]], ["tile_rcc", "sp", [-1, 1]], ["tile_ry", "sp", [-1, 3]], ["tile_rx", "sp", [-1, 3]], ["auto_unroll_max_step", "ot", 1500], ["unroll_explicit", "ot", 1]]}, "result": [[0.177641979], 0, 31.43460488319397, 1611793723.39224], "version": 0.2, "tvm_version": "0.8.dev0"}
{"input": ["opencl -keys=opencl,gpu -max_num_threads=256", "conv2d_NCHWc_KCRSk_tx_tune2", [[1, 32, 112, 112, 4], [32, 128, 3, 3, 4]], {}], "config": {"index": 15140272, "code_hash": null, "entity": [["tile_fc", "sp", [-1, 1, 1, 1]], ["tile_y", "sp", [-1, 1, 110, 1]], ["tile_x", "sp", [-1, 1, 1, 1]], ["tile_rcc", "sp", [-1, 1]], ["tile_ry", "sp", [-1, 3]], ["tile_rx", "sp", [-1, 3]], ["auto_unroll_max_step", "ot", 1500], ["unroll_explicit", "ot", 0]]}, "result": [[0.122780243], 0, 35.067145586013794, 1611793727.6438816], "version": 0.2, "tvm_version": "0.8.dev0"}
{"input": ["opencl -keys=opencl,gpu -max_num_threads=256", "conv2d_NCHWc_KCRSk_tx_tune2", [[1, 32, 112, 112, 4], [32, 128, 3, 3, 4]], {}], "config": {"index": 31722656, "code_hash": null, "entity": [["tile_fc", "sp", [-1, 1, 1, 1]], ["tile_y", "sp", [-1, 1, 5, 1]], ["tile_x", "sp", [-1, 2, 11, 1]], ["tile_rcc", "sp", [-1, 1]], ["tile_ry", "sp", [-1, 3]], ["tile_rx", "sp", [-1, 3]], ["auto_unroll_max_step", "ot", 1500], ["unroll_explicit", "ot", 1]]}, "result": [[0.07235234366666667], 0, 39.23388934135437, 1611793731.517787], "version": 0.2, "tvm_version": "0.8.dev0"}
{"input": ["opencl -keys=opencl,gpu -max_num_threads=256", "conv2d_NCHWc_KCRSk_tx_tune2", [[1, 32, 112, 112, 4], [32, 128, 3, 3, 4]], {}], "config": {"index": 31686817, "code_hash": null, "entity": [["tile_fc", "sp", [-1, 2, 1, 1]], ["tile_y", "sp", [-1, 1, 5, 1]], ["tile_x", "sp", [-1, 5, 2, 1]], ["tile_rcc", "sp", [-1, 1]], ["tile_ry", "sp", [-1, 3]], ["tile_rx", "sp", [-1, 3]], ["auto_unroll_max_step", "ot", 1500], ["unroll_explicit", "ot", 1]]}, "result": [[0.18132305533333334], 0, 44.41804647445679, 1611793736.4163527], "version": 0.2, "tvm_version": "0.8.dev0"}
{"input": ["opencl -keys=opencl,gpu -max_num_threads=256", "conv2d_NCHWc_KCRSk_tx_tune2", [[1, 32, 112, 112, 4], [32, 128, 3, 3, 4]], {}], "config": {"index": 31697904, "code_hash": null, "entity": [["tile_fc", "sp", [-1, 1, 1, 1]], ["tile_y", "sp", [-1, 1, 11, 1]], ["tile_x", "sp", [-1, 1, 5, 1]], ["tile_rcc", "sp", [-1, 1]], ["tile_ry", "sp", [-1, 3]], ["tile_rx", "sp", [-1, 3]], ["auto_unroll_max_step", "ot", 1500], ["unroll_explicit", "ot", 1]]}, "result": [[0.534053142], 0, 54.899202823638916, 1611793746.69912], "version": 0.2, "tvm_version": "0.8.dev0"}
{"input": ["opencl -keys=opencl,gpu -max_num_threads=256", "conv2d_NCHWc_KCRSk_tx_tune2", [[1, 32, 112, 112, 4], [32, 128, 3, 3, 4]], {}], "config": {"index": 28949705, "code_hash": null, "entity": [["tile_fc", "sp", [-1, 2, 1, 1]], ["tile_y", "sp", [-1, 1, 5, 2]], ["tile_x", "sp", [-1, 2, 5, 1]], ["tile_rcc", "sp", [-1, 1]], ["tile_ry", "sp", [-1, 3]], ["tile_rx", "sp", [-1, 1]], ["auto_unroll_max_step", "ot", 1500], ["unroll_explicit", "ot", 1]]}, "result": [[0.05187300366666667], 0, 58.099584102630615, 1611793750.2996385], "version": 0.2, "tvm_version": "0.8.dev0"}
{"input": ["opencl -keys=opencl,gpu -max_num_threads=256", "conv2d_NCHWc_KCRSk_tx_tune2", [[1, 32, 112, 112, 4], [32, 128, 3, 3, 4]], {}], "config": {"index": 30783872, "code_hash": null, "entity": [["tile_fc", "sp", [-1, 1, 1, 1]], ["tile_y", "sp", [-1, 1, 10, 1]], ["tile_x", "sp", [-1, 2, 5, 1]], ["tile_rcc", "sp", [-1, 4]], ["tile_ry", "sp", [-1, 1]], ["tile_rx", "sp", [-1, 3]], ["auto_unroll_max_step", "ot", 1500], ["unroll_explicit", "ot", 1]]}, "result": [[0.14280050333333333], 0, 62.74958515167236, 1611793754.8871865], "version": 0.2, "tvm_version": "0.8.dev0"}
{"input": ["opencl -keys=opencl,gpu -max_num_threads=256", "conv2d_NCHWc_KCRSk_tx_tune2", [[1, 32, 112, 112, 4], [32, 128, 3, 3, 4]], {}], "config": {"index": 31941504, "code_hash": null, "entity": [["tile_fc", "sp", [-1, 1, 1, 1]], ["tile_y", "sp", [-1, 1, 10, 1]], ["tile_x", "sp", [-1, 1, 10, 1]], ["tile_rcc", "sp", [-1, 2]], ["tile_ry", "sp", [-1, 3]], ["tile_rx", "sp", [-1, 3]], ["auto_unroll_max_step", "ot", 1500], ["unroll_explicit", "ot", 1]]}, "result": [[0.4975921003333333], 0, 72.80525636672974, 1611793764.7431695], "version": 0.2, "tvm_version": "0.8.dev0"}
{"input": ["opencl -keys=opencl,gpu -max_num_threads=256", "conv2d_NCHWc_KCRSk_tx_tune2", [[1, 32, 112, 112, 4], [32, 128, 3, 3, 4]], {}], "config": {"index": 31697910, "code_hash": null, "entity": [["tile_fc", "sp", [-1, 1, 2, 1]], ["tile_y", "sp", [-1, 1, 11, 1]], ["tile_x", "sp", [-1, 1, 5, 1]], ["tile_rcc", "sp", [-1, 1]], ["tile_ry", "sp", [-1, 3]], ["tile_rx", "sp", [-1, 3]], ["auto_unroll_max_step", "ot", 1500], ["unroll_explicit", "ot", 1]]}, "result": [[0.43280539933333334], 0, 82.12879610061646, 1611793773.6001725], "version": 0.2, "tvm_version": "0.8.dev0"}
{"input": ["opencl -keys=opencl,gpu -max_num_threads=256", "conv2d_NCHWc_KCRSk_tx_tune2", [[1, 32, 112, 112, 4], [32, 128, 3, 3, 4]], {}], "config": {"index": 31941616, "code_hash": null, "entity": [["tile_fc", "sp", [-1, 1, 1, 1]], ["tile_y", "sp", [-1, 1, 11, 1]], ["tile_x", "sp", [-1, 1, 10, 1]], ["tile_rcc", "sp", [-1, 2]], ["tile_ry", "sp", [-1, 3]], ["tile_rx", "sp", [-1, 3]], ["auto_unroll_max_step", "ot", 1500], ["unroll_explicit", "ot", 1]]}, "result": [[0.49927847200000003], 0, 113.81122374534607, 1611793805.908545], "version": 0.2, "tvm_version": "0.8.dev0"}
{"input": ["opencl -keys=opencl,gpu -max_num_threads=256", "conv2d_NCHWc_KCRSk_tx_tune2", [[1, 32, 112, 112, 4], [32, 128, 3, 3, 4]], {}], "config": {"index": 29418368, "code_hash": null, "entity": [["tile_fc", "sp", [-1, 1, 1, 1]], ["tile_y", "sp", [-1, 1, 10, 1]], ["tile_x", "sp", [-1, 1, 10, 1]], ["tile_rcc", "sp", [-1, 4]], ["tile_ry", "sp", [-1, 3]], ["tile_rx", "sp", [-1, 1]], ["auto_unroll_max_step", "ot", 1500], ["unroll_explicit", "ot", 1]]}, "result": [[0.6393319616666667], 0, 125.44219827651978, 1611793817.3340685], "version": 0.2, "tvm_version": "0.8.dev0"}
{"input": ["opencl -keys=opencl,gpu -max_num_threads=256", "conv2d_NCHWc_KCRSk_tx_tune2", [[1, 32, 112, 112, 4], [32, 128, 3, 3, 4]], {}], "config": {"index": 15221696, "code_hash": null, "entity": [["tile_fc", "sp", [-1, 1, 1, 1]], ["tile_y", "sp", [-1, 1, 2, 1]], ["tile_x", "sp", [-1, 5, 22, 1]], ["tile_rcc", "sp", [-1, 1]], ["tile_ry", "sp", [-1, 3]], ["tile_rx", "sp", [-1, 3]], ["auto_unroll_max_step", "ot", 1500], ["unroll_explicit", "ot", 0]]}, "result": [[0.063850434], 0, 3.960444450378418, 1611794043.4042432], "version": 0.2, "tvm_version": "0.8.dev0"}
{"input": ["opencl -keys=opencl,gpu -max_num_threads=256", "conv2d_NCHWc_KCRSk_tx_tune2", [[1, 32, 112, 112, 4], [32, 128, 3, 3, 4]], {}], "config": {"index": 11108695, "code_hash": null, "entity": [["tile_fc", "sp", [-1, 2, 4, 2]], ["tile_y", "sp", [-1, 1, 11, 2]], ["tile_x", "sp", [-1, 1, 1, 2]], ["tile_rcc", "sp", [-1, 1]], ["tile_ry", "sp", [-1, 1]], ["tile_rx", "sp", [-1, 1]], ["auto_unroll_max_step", "ot", 1500], ["unroll_explicit", "ot", 0]]}, "result": [[0.069667743], 0, 7.516037940979004, 1611794047.0411735], "version": 0.2, "tvm_version": "0.8.dev0"}
{"input": ["opencl -keys=opencl,gpu -max_num_threads=256", "conv2d_NCHWc_KCRSk_tx_tune2", [[1, 32, 112, 112, 4], [32, 128, 3, 3, 4]], {}], "config": {"index": 31711904, "code_hash": null, "entity": [["tile_fc", "sp", [-1, 1, 1, 1]], ["tile_y", "sp", [-1, 1, 5, 1]], ["tile_x", "sp", [-1, 1, 10, 1]], ["tile_rcc", "sp", [-1, 1]], ["tile_ry", "sp", [-1, 3]], ["tile_rx", "sp", [-1, 3]], ["auto_unroll_max_step", "ot", 1500], ["unroll_explicit", "ot", 1]]}, "result": [[0.6532655726666666], 0, 20.175501585006714, 1611794058.3929517], "version": 0.2, "tvm_version": "0.8.dev0"}
{"input": ["opencl -keys=opencl,gpu -max_num_threads=256", "conv2d_NCHWc_KCRSk_tx_tune2", [[1, 32, 112, 112, 4], [32, 128, 3, 3, 4]], {}], "config": {"index": 15196832, "code_hash": null, "entity": [["tile_fc", "sp", [-1, 1, 1, 1]], ["tile_y", "sp", [-1, 1, 5, 1]], ["tile_x", "sp", [-1, 1, 10, 1]], ["tile_rcc", "sp", [-1, 1]], ["tile_ry", "sp", [-1, 3]], ["tile_rx", "sp", [-1, 3]], ["auto_unroll_max_step", "ot", 1500], ["unroll_explicit", "ot", 0]]}, "result": [[0.09612522566666666], 0, 22.893986463546753, 1611794062.4649117], "version": 0.2, "tvm_version": "0.8.dev0"}
{"input": ["opencl -keys=opencl,gpu -max_num_threads=256", "conv2d_NCHWc_KCRSk_tx_tune2", [[1, 32, 112, 112, 4], [32, 128, 3, 3, 4]], {}], "config": {"index": 11129862, "code_hash": null, "entity": [["tile_fc", "sp", [-1, 1, 4, 2]], ["tile_y", "sp", [-1, 1, 1, 2]], ["tile_x", "sp", [-1, 1, 11, 2]], ["tile_rcc", "sp", [-1, 1]], ["tile_ry", "sp", [-1, 1]], ["tile_rx", "sp", [-1, 1]], ["auto_unroll_max_step", "ot", 1500], ["unroll_explicit", "ot", 0]]}, "result": [[0.05395128466666666], 0, 26.77544355392456, 1611794066.0291338], "version": 0.2, "tvm_version": "0.8.dev0"}
{"input": ["opencl -keys=opencl,gpu -max_num_threads=256", "conv2d_NCHWc_KCRSk_tx_tune2", [[1, 32, 112, 112, 4], [32, 128, 3, 3, 4]], {}], "config": {"index": 11015510, "code_hash": null, "entity": [["tile_fc", "sp", [-1, 1, 4, 2]], ["tile_y", "sp", [-1, 1, 11, 2]], ["tile_x", "sp", [-1, 2, 1, 1]], ["tile_rcc", "sp", [-1, 1]], ["tile_ry", "sp", [-1, 1]], ["tile_rx", "sp", [-1, 1]], ["auto_unroll_max_step", "ot", 1500], ["unroll_explicit", "ot", 0]]}, "result": [[0.082541337], 0, 30.503831386566162, 1611794069.848826], "version": 0.2, "tvm_version": "0.8.dev0"}
{"input": ["opencl -keys=opencl,gpu -max_num_threads=256", "conv2d_NCHWc_KCRSk_tx_tune2", [[1, 32, 112, 112, 4], [32, 128, 3, 3, 4]], {}], "config": {"index": 4211648, "code_hash": null, "entity": [["tile_fc", "sp", [-1, 1, 1, 1]], ["tile_y", "sp", [-1, 1, 2, 1]], ["tile_x", "sp", [-1, 5, 22, 1]], ["tile_rcc", "sp", [-1, 1]], ["tile_ry", "sp", [-1, 3]], ["tile_rx", "sp", [-1, 3]], ["auto_unroll_max_step", "ot", 0], ["unroll_explicit", "ot", 0]]}, "result": [[0.06405239566666666], 0, 34.103280782699585, 1611794073.4097795], "version": 0.2, "tvm_version": "0.8.dev0"}
{"input": ["opencl -keys=opencl,gpu -max_num_threads=256", "conv2d_NCHWc_KCRSk_tx_tune2", [[1, 32, 112, 112, 4], [32, 128, 3, 3, 4]], {}], "config": {"index": 20648432, "code_hash": null, "entity": [["tile_fc", "sp", [-1, 1, 1, 1]], ["tile_y", "sp", [-1, 1, 11, 1]], ["tile_x", "sp", [-1, 2, 1, 1]], ["tile_rcc", "sp", [-1, 1]], ["tile_ry", "sp", [-1, 3]], ["tile_rx", "sp", [-1, 3]], ["auto_unroll_max_step", "ot", 0], ["unroll_explicit", "ot", 1]]}, "result": [[0.13693772566666665], 0, 38.27569842338562, 1611794077.7493827], "version": 0.2, "tvm_version": "0.8.dev0"}
{"input": ["opencl -keys=opencl,gpu -max_num_threads=256", "conv2d_NCHWc_KCRSk_tx_tune2", [[1, 32, 112, 112, 4], [32, 128, 3, 3, 4]], {}], "config": {"index": 13827784, "code_hash": null, "entity": [["tile_fc", "sp", [-1, 1, 2, 4]], ["tile_y", "sp", [-1, 1, 5, 1]], ["tile_x", "sp", [-1, 1, 11, 1]], ["tile_rcc", "sp", [-1, 1]], ["tile_ry", "sp", [-1, 1]], ["tile_rx", "sp", [-1, 3]], ["auto_unroll_max_step", "ot", 1500], ["unroll_explicit", "ot", 0]]}, "result": [[0.049036979], 0, 3.972825288772583, 1611794083.2768672], "version": 0.2, "tvm_version": "0.8.dev0"}
{"input": ["opencl -keys=opencl,gpu -max_num_threads=256", "conv2d_NCHWc_KCRSk_tx_tune2", [[1, 32, 112, 112, 4], [32, 128, 3, 3, 4]], {}], "config": {"index": 31658480, "code_hash": null, "entity": [["tile_fc", "sp", [-1, 1, 1, 1]], ["tile_y", "sp", [-1, 1, 11, 1]], ["tile_x", "sp", [-1, 2, 1, 1]], ["tile_rcc", "sp", [-1, 1]], ["tile_ry", "sp", [-1, 3]], ["tile_rx", "sp", [-1, 3]], ["auto_unroll_max_step", "ot", 1500], ["unroll_explicit", "ot", 1]]}, "result": [[0.13648828133333332], 0, 8.306993007659912, 1611794087.6180558], "version": 0.2, "tvm_version": "0.8.dev0"}
{"input": ["opencl -keys=opencl,gpu -max_num_threads=256", "conv2d_NCHWc_KCRSk_tx_tune2", [[1, 32, 112, 112, 4], [32, 128, 3, 3, 4]], {}], "config": {"index": 29428896, "code_hash": null, "entity": [["tile_fc", "sp", [-1, 1, 1, 1]], ["tile_y", "sp", [-1, 1, 5, 1]], ["tile_x", "sp", [-1, 2, 11, 1]], ["tile_rcc", "sp", [-1, 4]], ["tile_ry", "sp", [-1, 3]], ["tile_rx", "sp", [-1, 1]], ["auto_unroll_max_step", "ot", 1500], ["unroll_explicit", "ot", 1]]}, "result": [[0.8863778643333333], 0, 21.227946519851685, 1611794099.6436408], "version": 0.2, "tvm_version": "0.8.dev0"}
{"input": ["opencl -keys=opencl,gpu -max_num_threads=256", "conv2d_NCHWc_KCRSk_tx_tune2", [[1, 32, 112, 112, 4], [32, 128, 3, 3, 4]], {}], "config": {"index": 4133360, "code_hash": null, "entity": [["tile_fc", "sp", [-1, 1, 1, 1]], ["tile_y", "sp", [-1, 1, 11, 1]], ["tile_x", "sp", [-1, 2, 1, 1]], ["tile_rcc", "sp", [-1, 1]], ["tile_ry", "sp", [-1, 3]], ["tile_rx", "sp", [-1, 3]], ["auto_unroll_max_step", "ot", 0], ["unroll_explicit", "ot", 0]]}, "result": [[0.15712022566666667], 0, 25.12890338897705, 1611794104.2072904], "version": 0.2, "tvm_version": "0.8.dev0"}
{"input": ["opencl -keys=opencl,gpu -max_num_threads=256", "conv2d_NCHWc_KCRSk_tx_tune2", [[1, 32, 112, 112, 4], [32, 128, 3, 3, 4]], {}], "config": {"index": 9691808, "code_hash": null, "entity": [["tile_fc", "sp", [-1, 1, 1, 1]], ["tile_y", "sp", [-1, 1, 5, 1]], ["tile_x", "sp", [-1, 1, 10, 1]], ["tile_rcc", "sp", [-1, 1]], ["tile_ry", "sp", [-1, 3]], ["tile_rx", "sp", [-1, 3]], ["auto_unroll_max_step", "ot", 512], ["unroll_explicit", "ot", 0]]}, "result": [[0.09600782966666667], 0, 29.060575008392334, 1611794108.2376697], "version": 0.2, "tvm_version": "0.8.dev0"}
{"input": ["opencl -keys=opencl,gpu -max_num_threads=256", "conv2d_NCHWc_KCRSk_tx_tune2", [[1, 32, 112, 112, 4], [32, 128, 3, 3, 4]], {}], "config": {"index": 30409, "code_hash": null, "entity": [["tile_fc", "sp", [-1, 2, 1, 1]], ["tile_y", "sp", [-1, 1, 5, 2]], ["tile_x", "sp", [-1, 1, 2, 1]], ["tile_rcc", "sp", [-1, 1]], ["tile_ry", "sp", [-1, 1]], ["tile_rx", "sp", [-1, 1]], ["auto_unroll_max_step", "ot", 0], ["unroll_explicit", "ot", 0]]}, "result": [[0.10593067699999999], 0, 4.4739155769348145, 1611794114.1575634], "version": 0.2, "tvm_version": "0.8.dev0"}
{"input": ["opencl -keys=opencl,gpu -max_num_threads=256", "conv2d_NCHWc_KCRSk_tx_tune2", [[1, 32, 112, 112, 4], [32, 128, 3, 3, 4]], {}], "config": {"index": 11040457, "code_hash": null, "entity": [["tile_fc", "sp", [-1, 2, 1, 1]], ["tile_y", "sp", [-1, 1, 5, 2]], ["tile_x", "sp", [-1, 1, 2, 1]], ["tile_rcc", "sp", [-1, 1]], ["tile_ry", "sp", [-1, 1]], ["tile_rx", "sp", [-1, 1]], ["auto_unroll_max_step", "ot", 1500], ["unroll_explicit", "ot", 0]]}, "result": [[0.10603927066666667], 0, 8.529462575912476, 1611794118.3130586], "version": 0.2, "tvm_version": "0.8.dev0"}
{"input": ["opencl -keys=opencl,gpu -max_num_threads=256", "conv2d_NCHWc_KCRSk_tx_tune2", [[1, 32, 112, 112, 4], [32, 128, 3, 3, 4]], {}], "config": {"index": 13809901, "code_hash": null, "entity": [["tile_fc", "sp", [-1, 1, 1, 2]], ["tile_y", "sp", [-1, 2, 5, 1]], ["tile_x", "sp", [-1, 2, 5, 1]], ["tile_rcc", "sp", [-1, 1]], ["tile_ry", "sp", [-1, 1]], ["tile_rx", "sp", [-1, 3]], ["auto_unroll_max_step", "ot", 1500], ["unroll_explicit", "ot", 0]]}, "result": [[0.09701637166666667], 0, 12.65333867073059, 1611794122.1947775], "version": 0.2, "tvm_version": "0.8.dev0"}
{"input": ["opencl -keys=opencl,gpu -max_num_threads=256", "conv2d_NCHWc_KCRSk_tx_tune2", [[1, 32, 112, 112, 4], [32, 128, 3, 3, 4]], {}], "config": {"index": 16745344, "code_hash": null, "entity": [["tile_fc", "sp", [-1, 1, 1, 1]], ["tile_y", "sp", [-1, 1, 10, 1]], ["tile_x", "sp", [-1, 1, 1, 1]], ["tile_rcc", "sp", [-1, 2]], ["tile_ry", "sp", [-1, 1]], ["tile_rx", "sp", [-1, 1]], ["auto_unroll_max_step", "ot", 0], ["unroll_explicit", "ot", 1]]}, "result": [[0.18616590266666666], 0, 17.337166786193848, 1611794127.0298853], "version": 0.2, "tvm_version": "0.8.dev0"}
{"input": ["opencl -keys=opencl,gpu -max_num_threads=256", "conv2d_NCHWc_KCRSk_tx_tune2", [[1, 32, 112, 112, 4], [32, 128, 3, 3, 4]], {}], "config": {"index": 4130224, "code_hash": null, "entity": [["tile_fc", "sp", [-1, 1, 1, 1]], ["tile_y", "sp", [-1, 1, 110, 1]], ["tile_x", "sp", [-1, 1, 1, 1]], ["tile_rcc", "sp", [-1, 1]], ["tile_ry", "sp", [-1, 3]], ["tile_rx", "sp", [-1, 3]], ["auto_unroll_max_step", "ot", 0], ["unroll_explicit", "ot", 0]]}, "result": [[0.12278838533333335], 0, 4.56791090965271, 1611794439.966071], "version": 0.2, "tvm_version": "0.8.dev0"}
{"input": ["opencl -keys=opencl,gpu -max_num_threads=256", "conv2d_NCHWc_KCRSk_tx_tune2", [[1, 32, 112, 112, 4], [32, 128, 3, 3, 4]], {}], "config": {"index": 80403, "code_hash": null, "entity": [["tile_fc", "sp", [-1, 1, 4, 4]], ["tile_y", "sp", [-1, 1, 1, 2]], ["tile_x", "sp", [-1, 1, 22, 1]], ["tile_rcc", "sp", [-1, 1]], ["tile_ry", "sp", [-1, 1]], ["tile_rx", "sp", [-1, 1]], ["auto_unroll_max_step", "ot", 0], ["unroll_explicit", "ot", 0]]}, "result": [[0.040049062333333336], 0, 8.03749966621399, 1611794443.3952057], "version": 0.2, "tvm_version": "0.8.dev0"}
{"input": ["opencl -keys=opencl,gpu -max_num_threads=256", "conv2d_NCHWc_KCRSk_tx_tune2", [[1, 32, 112, 112, 4], [32, 128, 3, 3, 4]], {}], "config": {"index": 328005, "code_hash": null, "entity": [["tile_fc", "sp", [-1, 4, 4, 1]], ["tile_y", "sp", [-1, 1, 11, 2]], ["tile_x", "sp", [-1, 1, 1, 2]], ["tile_rcc", "sp", [-1, 2]], ["tile_ry", "sp", [-1, 1]], ["tile_rx", "sp", [-1, 1]], ["auto_unroll_max_step", "ot", 0], ["unroll_explicit", "ot", 0]]}, "result": [[0.061728211666666664], 0, 11.791994571685791, 1611794446.951008], "version": 0.2, "tvm_version": "0.8.dev0"}
{"input": ["opencl -keys=opencl,gpu -max_num_threads=256", "conv2d_NCHWc_KCRSk_tx_tune2", [[1, 32, 112, 112, 4], [32, 128, 3, 3, 4]], {}], "config": {"index": 4157460, "code_hash": null, "entity": [["tile_fc", "sp", [-1, 1, 32, 1]], ["tile_y", "sp", [-1, 1, 1, 1]], ["tile_x", "sp", [-1, 1, 2, 1]], ["tile_rcc", "sp", [-1, 1]], ["tile_ry", "sp", [-1, 3]], ["tile_rx", "sp", [-1, 3]], ["auto_unroll_max_step", "ot", 0], ["unroll_explicit", "ot", 0]]}, "result": [[0.5522282983333333], 0, 20.267531156539917, 1611794455.5389094], "version": 0.2, "tvm_version": "0.8.dev0"}
{"input": ["opencl -keys=opencl,gpu -max_num_threads=256", "conv2d_NCHWc_KCRSk_tx_tune2", [[1, 32, 112, 112, 4], [32, 128, 3, 3, 4]], {}], "config": {"index": 14268800, "code_hash": null, "entity": [["tile_fc", "sp", [-1, 1, 1, 1]], ["tile_y", "sp", [-1, 1, 10, 1]], ["tile_x", "sp", [-1, 2, 5, 1]], ["tile_rcc", "sp", [-1, 4]], ["tile_ry", "sp", [-1, 1]], ["tile_rx", "sp", [-1, 3]], ["auto_unroll_max_step", "ot", 1500], ["unroll_explicit", "ot", 0]]}, "result": [[0.134077361], 0, 24.439223527908325, 1611794459.8971899], "version": 0.2, "tvm_version": "0.8.dev0"}
{"input": ["opencl -keys=opencl,gpu -max_num_threads=256", "conv2d_NCHWc_KCRSk_tx_tune2", [[1, 32, 112, 112, 4], [32, 128, 3, 3, 4]], {}], "config": {"index": 4146704, "code_hash": null, "entity": [["tile_fc", "sp", [-1, 2, 8, 1]], ["tile_y", "sp", [-1, 1, 1, 1]], ["tile_x", "sp", [-1, 22, 1, 1]], ["tile_rcc", "sp", [-1, 1]], ["tile_ry", "sp", [-1, 3]], ["tile_rx", "sp", [-1, 3]], ["auto_unroll_max_step", "ot", 0], ["unroll_explicit", "ot", 0]]}, "result": [[1.0687526386666668], 0, 13.972785949707031, 1611794474.9410295], "version": 0.2, "tvm_version": "0.8.dev0"}
{"input": ["opencl -keys=opencl,gpu -max_num_threads=256", "conv2d_NCHWc_KCRSk_tx_tune2", [[1, 32, 112, 112, 4], [32, 128, 3, 3, 4]], {}], "config": {"index": 15182720, "code_hash": null, "entity": [["tile_fc", "sp", [-1, 1, 1, 1]], ["tile_y", "sp", [-1, 1, 10, 1]], ["tile_x", "sp", [-1, 1, 5, 1]], ["tile_rcc", "sp", [-1, 1]], ["tile_ry", "sp", [-1, 3]], ["tile_rx", "sp", [-1, 3]], ["auto_unroll_max_step", "ot", 1500], ["unroll_explicit", "ot", 0]]}, "result": [[0.10213652766666666], 0, 17.923946142196655, 1611794478.8538153], "version": 0.2, "tvm_version": "0.8.dev0"}
{"input": ["opencl -keys=opencl,gpu -max_num_threads=256", "conv2d_NCHWc_KCRSk_tx_tune2", [[1, 32, 112, 112, 4], [32, 128, 3, 3, 4]], {}], "config": {"index": 20729867, "code_hash": null, "entity": [["tile_fc", "sp", [-1, 1, 4, 1]], ["tile_y", "sp", [-1, 1, 1, 1]], ["tile_x", "sp", [-1, 1, 55, 1]], ["tile_rcc", "sp", [-1, 1]], ["tile_ry", "sp", [-1, 3]], ["tile_rx", "sp", [-1, 3]], ["auto_unroll_max_step", "ot", 0], ["unroll_explicit", "ot", 1]]}, "result": [[0.072477656], 0, 21.772008180618286, 1611794482.5407727], "version": 0.2, "tvm_version": "0.8.dev0"}
{"input": ["opencl -keys=opencl,gpu -max_num_threads=256", "conv2d_NCHWc_KCRSk_tx_tune2", [[1, 32, 112, 112, 4], [32, 128, 3, 3, 4]], {}], "config": {"index": 4136623, "code_hash": null, "entity": [["tile_fc", "sp", [-1, 1, 8, 1]], ["tile_y", "sp", [-1, 1, 5, 1]], ["tile_x", "sp", [-1, 5, 1, 1]], ["tile_rcc", "sp", [-1, 1]], ["tile_ry", "sp", [-1, 3]], ["tile_rx", "sp", [-1, 3]], ["auto_unroll_max_step", "ot", 0], ["unroll_explicit", "ot", 0]]}, "result": [[0.10130498266666667], 0, 25.79789900779724, 1611794486.5790808], "version": 0.2, "tvm_version": "0.8.dev0"}
{"input": ["opencl -keys=opencl,gpu -max_num_threads=256", "conv2d_NCHWc_KCRSk_tx_tune2", [[1, 32, 112, 112, 4], [32, 128, 3, 3, 4]], {}], "config": {"index": 1474885, "code_hash": null, "entity": [["tile_fc", "sp", [-1, 4, 4, 1]], ["tile_y", "sp", [-1, 1, 11, 2]], ["tile_x", "sp", [-1, 1, 1, 2]], ["tile_rcc", "sp", [-1, 1]], ["tile_ry", "sp", [-1, 3]], ["tile_rx", "sp", [-1, 1]], ["auto_unroll_max_step", "ot", 0], ["unroll_explicit", "ot", 0]]}, "result": [[0.05759220466666667], 0, 3.941511631011963, 1611794491.2592375], "version": 0.2, "tvm_version": "0.8.dev0"}
{"input": ["opencl -keys=opencl,gpu -max_num_threads=256", "conv2d_NCHWc_KCRSk_tx_tune2", [[1, 32, 112, 112, 4], [32, 128, 3, 3, 4]], {}], "config": {"index": 463568, "code_hash": null, "entity": [["tile_fc", "sp", [-1, 1, 1, 1]], ["tile_y", "sp", [-1, 1, 22, 1]], ["tile_x", "sp", [-1, 2, 1, 1]], ["tile_rcc", "sp", [-1, 4]], ["tile_ry", "sp", [-1, 1]], ["tile_rx", "sp", [-1, 1]], ["auto_unroll_max_step", "ot", 0], ["unroll_explicit", "ot", 0]]}, "result": [[0.166877014], 0, 8.418338775634766, 1611794495.8651967], "version": 0.2, "tvm_version": "0.8.dev0"}
{"input": ["opencl -keys=opencl,gpu -max_num_threads=256", "conv2d_NCHWc_KCRSk_tx_tune2", [[1, 32, 112, 112, 4], [32, 128, 3, 3, 4]], {}], "config": {"index": 1384683, "code_hash": null, "entity": [["tile_fc", "sp", [-1, 2, 2, 2]], ["tile_y", "sp", [-1, 1, 22, 1]], ["tile_x", "sp", [-1, 5, 1, 1]], ["tile_rcc", "sp", [-1, 1]], ["tile_ry", "sp", [-1, 3]], ["tile_rx", "sp", [-1, 1]], ["auto_unroll_max_step", "ot", 0], ["unroll_explicit", "ot", 0]]}, "result": [[0.058208403], 0, 12.196650743484497, 1611794499.4010673], "version": 0.2, "tvm_version": "0.8.dev0"}
{"input": ["opencl -keys=opencl,gpu -max_num_threads=256", "conv2d_NCHWc_KCRSk_tx_tune2", [[1, 32, 112, 112, 4], [32, 128, 3, 3, 4]], {}], "config": {"index": 1607090, "code_hash": null, "entity": [["tile_fc", "sp", [-1, 4, 1, 1]], ["tile_y", "sp", [-1, 1, 110, 1]], ["tile_x", "sp", [-1, 1, 1, 1]], ["tile_rcc", "sp", [-1, 2]], ["tile_ry", "sp", [-1, 3]], ["tile_rx", "sp", [-1, 1]], ["auto_unroll_max_step", "ot", 0], ["unroll_explicit", "ot", 0]]}, "result": [[0.047583923666666667], 0, 35.63359761238098, 1611794522.9449384], "version": 0.2, "tvm_version": "0.8.dev0"}
{"input": ["opencl -keys=opencl,gpu -max_num_threads=256", "conv2d_NCHWc_KCRSk_tx_tune2", [[1, 32, 112, 112, 4], [32, 128, 3, 3, 4]], {}], "config": {"index": 12617138, "code_hash": null, "entity": [["tile_fc", "sp", [-1, 4, 1, 1]], ["tile_y", "sp", [-1, 1, 110, 1]], ["tile_x", "sp", [-1, 1, 1, 1]], ["tile_rcc", "sp", [-1, 2]], ["tile_ry", "sp", [-1, 3]], ["tile_rx", "sp", [-1, 1]], ["auto_unroll_max_step", "ot", 1500], ["unroll_explicit", "ot", 0]]}, "result": [[0.04757406266666667], 0, 26.97024655342102, 1611794760.5381246], "version": 0.2, "tvm_version": "0.8.dev0"}
{"input": ["opencl -keys=opencl,gpu -max_num_threads=256", "conv2d_NCHWc_KCRSk_tx_tune2", [[1, 32, 112, 112, 4], [32, 128, 3, 3, 4]], {}], "config": {"index": 4135951, "code_hash": null, "entity": [["tile_fc", "sp", [-1, 1, 8, 1]], ["tile_y", "sp", [-1, 1, 1, 1]], ["tile_x", "sp", [-1, 5, 1, 1]], ["tile_rcc", "sp", [-1, 1]], ["tile_ry", "sp", [-1, 3]], ["tile_rx", "sp", [-1, 3]], ["auto_unroll_max_step", "ot", 0], ["unroll_explicit", "ot", 0]]}, "result": [[0.20231454866666665], 0, 32.17740440368652, 1611794765.4707286], "version": 0.2, "tvm_version": "0.8.dev0"}
{"input": ["opencl -keys=opencl,gpu -max_num_threads=256", "conv2d_NCHWc_KCRSk_tx_tune2", [[1, 32, 112, 112, 4], [32, 128, 3, 3, 4]], {}], "config": {"index": 34018, "code_hash": null, "entity": [["tile_fc", "sp", [-1, 1, 2, 2]], ["tile_y", "sp", [-1, 1, 5, 2]], ["tile_x", "sp", [-1, 5, 2, 1]], ["tile_rcc", "sp", [-1, 1]], ["tile_ry", "sp", [-1, 1]], ["tile_rx", "sp", [-1, 1]], ["auto_unroll_max_step", "ot", 0], ["unroll_explicit", "ot", 0]]}, "result": [[0.09959039933333334], 0, 4.360274314880371, 1611794788.367649], "version": 0.2, "tvm_version": "0.8.dev0"}
{"input": ["opencl -keys=opencl,gpu -max_num_threads=256", "conv2d_NCHWc_KCRSk_tx_tune2", [[1, 32, 112, 112, 4], [32, 128, 3, 3, 4]], {}], "config": {"index": 81375, "code_hash": null, "entity": [["tile_fc", "sp", [-1, 2, 2, 1]], ["tile_y", "sp", [-1, 1, 1, 10]], ["tile_x", "sp", [-1, 1, 22, 1]], ["tile_rcc", "sp", [-1, 1]], ["tile_ry", "sp", [-1, 1]], ["tile_rx", "sp", [-1, 1]], ["auto_unroll_max_step", "ot", 0], ["unroll_explicit", "ot", 0]]}, "result": [[0.055791770666666664], 0, 7.892153263092041, 1611794791.9748957], "version": 0.2, "tvm_version": "0.8.dev0"}
{"input": ["opencl -keys=opencl,gpu -max_num_threads=256", "conv2d_NCHWc_KCRSk_tx_tune2", [[1, 32, 112, 112, 4], [32, 128, 3, 3, 4]], {}], "config": {"index": 7112113, "code_hash": null, "entity": [["tile_fc", "sp", [-1, 2, 1, 1]], ["tile_y", "sp", [-1, 1, 110, 1]], ["tile_x", "sp", [-1, 1, 1, 1]], ["tile_rcc", "sp", [-1, 2]], ["tile_ry", "sp", [-1, 3]], ["tile_rx", "sp", [-1, 1]], ["auto_unroll_max_step", "ot", 512], ["unroll_explicit", "ot", 0]]}, "result": [[0.06006939233333333], 0, 11.74696946144104, 1611794795.5437255], "version": 0.2, "tvm_version": "0.8.dev0"}
{"input": ["opencl -keys=opencl,gpu -max_num_threads=256", "conv2d_NCHWc_KCRSk_tx_tune2", [[1, 32, 112, 112, 4], [32, 128, 3, 3, 4]], {}], "config": {"index": 1503208, "code_hash": null, "entity": [["tile_fc", "sp", [-1, 1, 1, 1]], ["tile_y", "sp", [-1, 1, 1, 2]], ["tile_x", "sp", [-1, 1, 55, 2]], ["tile_rcc", "sp", [-1, 1]], ["tile_ry", "sp", [-1, 3]], ["tile_rx", "sp", [-1, 1]], ["auto_unroll_max_step", "ot", 0], ["unroll_explicit", "ot", 0]]}, "result": [[0.12567559033333334], 0, 4.471248626708984, 1611795075.4871483], "version": 0.2, "tvm_version": "0.8.dev0"}
{"input": ["opencl -keys=opencl,gpu -max_num_threads=256", "conv2d_NCHWc_KCRSk_tx_tune2", [[1, 32, 112, 112, 4], [32, 128, 3, 3, 4]], {}], "config": {"index": 15225280, "code_hash": null, "entity": [["tile_fc", "sp", [-1, 1, 1, 1]], ["tile_y", "sp", [-1, 1, 2, 1]], ["tile_x", "sp", [-1, 1, 55, 1]], ["tile_rcc", "sp", [-1, 1]], ["tile_ry", "sp", [-1, 3]], ["tile_rx", "sp", [-1, 3]], ["auto_unroll_max_step", "ot", 1500], ["unroll_explicit", "ot", 0]]}, "result": [[0.08109715299999999], 0, 8.189390182495117, 1611795079.2279463], "version": 0.2, "tvm_version": "0.8.dev0"}
{"input": ["opencl -keys=opencl,gpu -max_num_threads=256", "conv2d_NCHWc_KCRSk_tx_tune2", [[1, 32, 112, 112, 4], [32, 128, 3, 3, 4]], {}], "config": {"index": 31733408, "code_hash": null, "entity": [["tile_fc", "sp", [-1, 1, 1, 1]], ["tile_y", "sp", [-1, 1, 5, 1]], ["tile_x", "sp", [-1, 1, 22, 1]], ["tile_rcc", "sp", [-1, 1]], ["tile_ry", "sp", [-1, 3]], ["tile_rx", "sp", [-1, 3]], ["auto_unroll_max_step", "ot", 1500], ["unroll_explicit", "ot", 1]]}, "result": [[0.7070276386666667], 0, 37.658894777297974, 1611795107.9118278], "version": 0.2, "tvm_version": "0.8.dev0"}
{"input": ["opencl -keys=opencl,gpu -max_num_threads=256", "conv2d_NCHWc_KCRSk_tx_tune2", [[1, 32, 112, 112, 4], [32, 128, 3, 3, 4]], {}], "config": {"index": 19588072, "code_hash": null, "entity": [["tile_fc", "sp", [-1, 1, 1, 1]], ["tile_y", "sp", [-1, 1, 1, 2]], ["tile_x", "sp", [-1, 2, 55, 1]], ["tile_rcc", "sp", [-1, 2]], ["tile_ry", "sp", [-1, 1]], ["tile_rx", "sp", [-1, 3]], ["auto_unroll_max_step", "ot", 0], ["unroll_explicit", "ot", 1]]}, "result": [[0.075161146], 0, 40.712607860565186, 1611795111.615936], "version": 0.2, "tvm_version": "0.8.dev0"}
{"input": ["opencl -keys=opencl,gpu -max_num_threads=256", "conv2d_NCHWc_KCRSk_tx_tune2", [[1, 32, 112, 112, 4], [32, 128, 3, 3, 4]], {}], "config": {"index": 4215232, "code_hash": null, "entity": [["tile_fc", "sp", [-1, 1, 1, 1]], ["tile_y", "sp", [-1, 1, 2, 1]], ["tile_x", "sp", [-1, 1, 55, 1]], ["tile_rcc", "sp", [-1, 1]], ["tile_ry", "sp", [-1, 3]], ["tile_rx", "sp", [-1, 3]], ["auto_unroll_max_step", "ot", 0], ["unroll_explicit", "ot", 0]]}, "result": [[0.081064184], 0, 44.57410669326782, 1611795115.432826], "version": 0.2, "tvm_version": "0.8.dev0"}
{"input": ["opencl -keys=opencl,gpu -max_num_threads=256", "conv2d_NCHWc_KCRSk_tx_tune2", [[1, 32, 112, 112, 4], [32, 128, 3, 3, 4]], {}], "config": {"index": 158144, "code_hash": null, "entity": [["tile_fc", "sp", [-1, 1, 1, 1]], ["tile_y", "sp", [-1, 1, 2, 1]], ["tile_x", "sp", [-1, 1, 22, 5]], ["tile_rcc", "sp", [-1, 1]], ["tile_ry", "sp", [-1, 1]], ["tile_rx", "sp", [-1, 1]], ["auto_unroll_max_step", "ot", 0], ["unroll_explicit", "ot", 0]]}, "result": [[0.20149678833333332], 0, 5.404557228088379, 1611795122.641013], "version": 0.2, "tvm_version": "0.8.dev0"}
{"input": ["opencl -keys=opencl,gpu -max_num_threads=256", "conv2d_NCHWc_KCRSk_tx_tune2", [[1, 32, 112, 112, 4], [32, 128, 3, 3, 4]], {}], "config": {"index": 14310912, "code_hash": null, "entity": [["tile_fc", "sp", [-1, 1, 1, 1]], ["tile_y", "sp", [-1, 1, 1, 1]], ["tile_x", "sp", [-1, 2, 55, 1]], ["tile_rcc", "sp", [-1, 4]], ["tile_ry", "sp", [-1, 1]], ["tile_rx", "sp", [-1, 3]], ["auto_unroll_max_step", "ot", 1500], ["unroll_explicit", "ot", 0]]}, "result": [[0.08128727433333334], 0, 9.122326135635376, 1611795126.3483841], "version": 0.2, "tvm_version": "0.8.dev0"}
{"input": ["opencl -keys=opencl,gpu -max_num_threads=256", "conv2d_NCHWc_KCRSk_tx_tune2", [[1, 32, 112, 112, 4], [32, 128, 3, 3, 4]], {}], "config": {"index": 30598120, "code_hash": null, "entity": [["tile_fc", "sp", [-1, 1, 1, 1]], ["tile_y", "sp", [-1, 1, 1, 2]], ["tile_x", "sp", [-1, 2, 55, 1]], ["tile_rcc", "sp", [-1, 2]], ["tile_ry", "sp", [-1, 1]], ["tile_rx", "sp", [-1, 3]], ["auto_unroll_max_step", "ot", 1500], ["unroll_explicit", "ot", 1]]}, "result": [[0.15457171866666666], 0, 14.181004524230957, 1611795130.87583], "version": 0.2, "tvm_version": "0.8.dev0"}
{"input": ["opencl -keys=opencl,gpu -max_num_threads=256", "conv2d_NCHWc_KCRSk_tx_tune2", [[1, 32, 112, 112, 4], [32, 128, 3, 3, 4]], {}], "config": {"index": 4208288, "code_hash": null, "entity": [["tile_fc", "sp", [-1, 1, 1, 1]], ["tile_y", "sp", [-1, 1, 5, 1]], ["tile_x", "sp", [-1, 1, 22, 1]], ["tile_rcc", "sp", [-1, 1]], ["tile_ry", "sp", [-1, 3]], ["tile_rx", "sp", [-1, 3]], ["auto_unroll_max_step", "ot", 0], ["unroll_explicit", "ot", 0]]}, "result": [[0.079134896], 0, 17.52950930595398, 1611795134.7404027], "version": 0.2, "tvm_version": "0.8.dev0"}
{"input": ["opencl -keys=opencl,gpu -max_num_threads=256", "conv2d_NCHWc_KCRSk_tx_tune2", [[1, 32, 112, 112, 4], [32, 128, 3, 3, 4]], {}], "config": {"index": 30593024, "code_hash": null, "entity": [["tile_fc", "sp", [-1, 1, 1, 1]], ["tile_y", "sp", [-1, 1, 1, 1]], ["tile_x", "sp", [-1, 1, 55, 1]], ["tile_rcc", "sp", [-1, 2]], ["tile_ry", "sp", [-1, 1]], ["tile_rx", "sp", [-1, 3]], ["auto_unroll_max_step", "ot", 1500], ["unroll_explicit", "ot", 1]]}, "result": [[0.7698974129999999], 0, 47.378737926483154, 1611795163.7858422], "version": 0.2, "tvm_version": "0.8.dev0"}
{"input": ["opencl -keys=opencl,gpu -max_num_threads=256", "conv2d_NCHWc_KCRSk_tx_tune2", [[1, 32, 112, 112, 4], [32, 128, 3, 3, 4]], {}], "config": {"index": 12741120, "code_hash": null, "entity": [["tile_fc", "sp", [-1, 1, 1, 1]], ["tile_y", "sp", [-1, 1, 1, 1]], ["tile_x", "sp", [-1, 1, 55, 2]], ["tile_rcc", "sp", [-1, 2]], ["tile_ry", "sp", [-1, 3]], ["tile_rx", "sp", [-1, 1]], ["auto_unroll_max_step", "ot", 1500], ["unroll_explicit", "ot", 0]]}, "result": [[0.268642882], 0, 6.004393577575684, 1611795170.804968], "version": 0.2, "tvm_version": "0.8.dev0"}
{"input": ["opencl -keys=opencl,gpu -max_num_threads=256", "conv2d_NCHWc_KCRSk_tx_tune2", [[1, 32, 112, 112, 4], [32, 128, 3, 3, 4]], {}], "config": {"index": 14063616, "code_hash": null, "entity": [["tile_fc", "sp", [-1, 1, 1, 1]], ["tile_y", "sp", [-1, 1, 1, 1]], ["tile_x", "sp", [-1, 5, 11, 1]], ["tile_rcc", "sp", [-1, 2]], ["tile_ry", "sp", [-1, 1]], ["tile_rx", "sp", [-1, 3]], ["auto_unroll_max_step", "ot", 1500], ["unroll_explicit", "ot", 0]]}, "result": [[0.11302635433333334], 0, 10.070776224136353, 1611795174.8943055], "version": 0.2, "tvm_version": "0.8.dev0"}
{"input": ["opencl -keys=opencl,gpu -max_num_threads=256", "conv2d_NCHWc_KCRSk_tx_tune2", [[1, 32, 112, 112, 4], [32, 128, 3, 3, 4]], {}], "config": {"index": 2850540, "code_hash": null, "entity": [["tile_fc", "sp", [-1, 4, 2, 2]], ["tile_y", "sp", [-1, 1, 22, 1]], ["tile_x", "sp", [-1, 1, 1, 2]], ["tile_rcc", "sp", [-1, 1]], ["tile_ry", "sp", [-1, 1]], ["tile_rx", "sp", [-1, 3]], ["auto_unroll_max_step", "ot", 0], ["unroll_explicit", "ot", 0]]}, "result": [[0.076128212], 0, 13.822739124298096, 1611795178.5504568], "version": 0.2, "tvm_version": "0.8.dev0"}
{"input": ["opencl -keys=opencl,gpu -max_num_threads=256", "conv2d_NCHWc_KCRSk_tx_tune2", [[1, 32, 112, 112, 4], [32, 128, 3, 3, 4]], {}], "config": {"index": 9720256, "code_hash": null, "entity": [["tile_fc", "sp", [-1, 1, 1, 1]], ["tile_y", "sp", [-1, 1, 2, 1]], ["tile_x", "sp", [-1, 1, 55, 1]], ["tile_rcc", "sp", [-1, 1]], ["tile_ry", "sp", [-1, 3]], ["tile_rx", "sp", [-1, 3]], ["auto_unroll_max_step", "ot", 512], ["unroll_explicit", "ot", 0]]}, "result": [[0.081133993], 0, 17.705740213394165, 1611795182.4742804], "version": 0.2, "tvm_version": "0.8.dev0"}
{"input": ["opencl -keys=opencl,gpu -max_num_threads=256", "conv2d_NCHWc_KCRSk_tx_tune2", [[1, 32, 112, 112, 4], [32, 128, 3, 3, 4]], {}], "config": {"index": 30360070, "code_hash": null, "entity": [["tile_fc", "sp", [-1, 1, 2, 1]], ["tile_y", "sp", [-1, 1, 1, 1]], ["tile_x", "sp", [-1, 5, 22, 1]], ["tile_rcc", "sp", [-1, 1]], ["tile_ry", "sp", [-1, 1]], ["tile_rx", "sp", [-1, 3]], ["auto_unroll_max_step", "ot", 1500], ["unroll_explicit", "ot", 1]]}, "result": [[0.05306498233333334], 0, 21.401344776153564, 1611795186.1005392], "version": 0.2, "tvm_version": "0.8.dev0"}
{"input": ["opencl -keys=opencl,gpu -max_num_threads=256", "conv2d_NCHWc_KCRSk_tx_tune2", [[1, 32, 112, 112, 4], [32, 128, 3, 3, 4]], {}], "config": {"index": 25320960, "code_hash": null, "entity": [["tile_fc", "sp", [-1, 1, 1, 1]], ["tile_y", "sp", [-1, 1, 1, 1]], ["tile_x", "sp", [-1, 2, 55, 1]], ["tile_rcc", "sp", [-1, 4]], ["tile_ry", "sp", [-1, 1]], ["tile_rx", "sp", [-1, 3]], ["auto_unroll_max_step", "ot", 512], ["unroll_explicit", "ot", 1]]}, "result": [[0.15693651033333333], 0, 26.124225854873657, 1611795190.8578243], "version": 0.2, "tvm_version": "0.8.dev0"}
{"input": ["opencl -keys=opencl,gpu -max_num_threads=256", "conv2d_NCHWc_KCRSk_tx_tune2", [[1, 32, 112, 112, 4], [32, 128, 3, 3, 4]], {}], "config": {"index": 14039200, "code_hash": null, "entity": [["tile_fc", "sp", [-1, 1, 1, 1]], ["tile_y", "sp", [-1, 1, 5, 1]], ["tile_x", "sp", [-1, 2, 5, 1]], ["tile_rcc", "sp", [-1, 2]], ["tile_ry", "sp", [-1, 1]], ["tile_rx", "sp", [-1, 3]], ["auto_unroll_max_step", "ot", 1500], ["unroll_explicit", "ot", 0]]}, "result": [[0.10957479166666667], 0, 4.39368462562561, 1611795331.06139], "version": 0.2, "tvm_version": "0.8.dev0"}
{"input": ["opencl -keys=opencl,gpu -max_num_threads=256", "conv2d_NCHWc_KCRSk_tx_tune2", [[1, 32, 112, 112, 4], [32, 128, 3, 3, 4]], {}], "config": {"index": 1384662, "code_hash": null, "entity": [["tile_fc", "sp", [-1, 1, 2, 1]], ["tile_y", "sp", [-1, 1, 22, 1]], ["tile_x", "sp", [-1, 5, 1, 1]], ["tile_rcc", "sp", [-1, 1]], ["tile_ry", "sp", [-1, 3]], ["tile_rx", "sp", [-1, 1]], ["auto_unroll_max_step", "ot", 0], ["unroll_explicit", "ot", 0]]}, "result": [[0.145375729], 0, 8.93772292137146, 1611795335.6370432], "version": 0.2, "tvm_version": "0.8.dev0"}
{"input": ["opencl -keys=opencl,gpu -max_num_threads=256", "conv2d_NCHWc_KCRSk_tx_tune2", [[1, 32, 112, 112, 4], [32, 128, 3, 3, 4]], {}], "config": {"index": 6889707, "code_hash": null, "entity": [["tile_fc", "sp", [-1, 2, 2, 2]], ["tile_y", "sp", [-1, 1, 22, 1]], ["tile_x", "sp", [-1, 5, 1, 1]], ["tile_rcc", "sp", [-1, 1]], ["tile_ry", "sp", [-1, 3]], ["tile_rx", "sp", [-1, 1]], ["auto_unroll_max_step", "ot", 512], ["unroll_explicit", "ot", 0]]}, "result": [[0.05832876733333334], 0, 12.877748012542725, 1611795339.2877114], "version": 0.2, "tvm_version": "0.8.dev0"}
{"input": ["opencl -keys=opencl,gpu -max_num_threads=256", "conv2d_NCHWc_KCRSk_tx_tune2", [[1, 32, 112, 112, 4], [32, 128, 3, 3, 4]], {}], "config": {"index": 8534176, "code_hash": null, "entity": [["tile_fc", "sp", [-1, 1, 1, 1]], ["tile_y", "sp", [-1, 1, 5, 1]], ["tile_x", "sp", [-1, 2, 5, 1]], ["tile_rcc", "sp", [-1, 2]], ["tile_ry", "sp", [-1, 1]], ["tile_rx", "sp", [-1, 3]], ["auto_unroll_max_step", "ot", 512], ["unroll_explicit", "ot", 0]]}, "result": [[0.10962093733333333], 0, 16.8921959400177, 1611795343.380266], "version": 0.2, "tvm_version": "0.8.dev0"}
{"input": ["opencl -keys=opencl,gpu -max_num_threads=256", "conv2d_NCHWc_KCRSk_tx_tune2", [[1, 32, 112, 112, 4], [32, 128, 3, 3, 4]], {}], "config": {"index": 12624708, "code_hash": null, "entity": [["tile_fc", "sp", [-1, 2, 4, 1]], ["tile_y", "sp", [-1, 1, 11, 2]], ["tile_x", "sp", [-1, 5, 1, 1]], ["tile_rcc", "sp", [-1, 2]], ["tile_ry", "sp", [-1, 3]], ["tile_rx", "sp", [-1, 1]], ["auto_unroll_max_step", "ot", 1500], ["unroll_explicit", "ot", 0]]}, "result": [[0.08285565966666666], 0, 21.053471326828003, 1611795347.2406209], "version": 0.2, "tvm_version": "0.8.dev0"}
{"input": ["opencl -keys=opencl,gpu -max_num_threads=256", "conv2d_NCHWc_KCRSk_tx_tune2", [[1, 32, 112, 112, 4], [32, 128, 3, 3, 4]], {}], "config": {"index": 30352902, "code_hash": null, "entity": [["tile_fc", "sp", [-1, 1, 2, 1]], ["tile_y", "sp", [-1, 1, 1, 1]], ["tile_x", "sp", [-1, 10, 11, 1]], ["tile_rcc", "sp", [-1, 1]], ["tile_ry", "sp", [-1, 1]], ["tile_rx", "sp", [-1, 3]], ["auto_unroll_max_step", "ot", 1500], ["unroll_explicit", "ot", 1]]}, "result": [[0.07251071166666666], 0, 24.830323457717896, 1611795351.1113553], "version": 0.2, "tvm_version": "0.8.dev0"}
{"input": ["opencl -keys=opencl,gpu -max_num_threads=256", "conv2d_NCHWc_KCRSk_tx_tune2", [[1, 32, 112, 112, 4], [32, 128, 3, 3, 4]], {}], "config": {"index": 13807330, "code_hash": null, "entity": [["tile_fc", "sp", [-1, 1, 2, 2]], ["tile_y", "sp", [-1, 1, 5, 2]], ["tile_x", "sp", [-1, 1, 5, 1]], ["tile_rcc", "sp", [-1, 1]], ["tile_ry", "sp", [-1, 1]], ["tile_rx", "sp", [-1, 3]], ["auto_unroll_max_step", "ot", 1500], ["unroll_explicit", "ot", 0]]}, "result": [[0.058234652666666664], 0, 28.12334179878235, 1611795354.6612034], "version": 0.2, "tvm_version": "0.8.dev0"}
{"input": ["opencl -keys=opencl,gpu -max_num_threads=256", "conv2d_NCHWc_KCRSk_tx_tune2", [[1, 32, 112, 112, 4], [32, 128, 3, 3, 4]], {}], "config": {"index": 30352922, "code_hash": null, "entity": [["tile_fc", "sp", [-1, 1, 2, 2]], ["tile_y", "sp", [-1, 1, 1, 1]], ["tile_x", "sp", [-1, 10, 11, 1]], ["tile_rcc", "sp", [-1, 1]], ["tile_ry", "sp", [-1, 1]], ["tile_rx", "sp", [-1, 3]], ["auto_unroll_max_step", "ot", 1500], ["unroll_explicit", "ot", 1]]}, "result": [[0.07586982633333333], 0, 32.472304582595825, 1611795358.7917254], "version": 0.2, "tvm_version": "0.8.dev0"}
{"input": ["opencl -keys=opencl,gpu -max_num_threads=256", "conv2d_NCHWc_KCRSk_tx_tune2", [[1, 32, 112, 112, 4], [32, 128, 3, 3, 4]], {}], "config": {"index": 8552947, "code_hash": null, "entity": [["tile_fc", "sp", [-1, 1, 4, 1]], ["tile_y", "sp", [-1, 1, 1, 2]], ["tile_x", "sp", [-1, 1, 11, 1]], ["tile_rcc", "sp", [-1, 2]], ["tile_ry", "sp", [-1, 1]], ["tile_rx", "sp", [-1, 3]], ["auto_unroll_max_step", "ot", 512], ["unroll_explicit", "ot", 0]]}, "result": [[0.07306170166666666], 0, 3.9222378730773926, 1611795364.5285199], "version": 0.2, "tvm_version": "0.8.dev0"}
{"input": ["opencl -keys=opencl,gpu -max_num_threads=256", "conv2d_NCHWc_KCRSk_tx_tune2", [[1, 32, 112, 112, 4], [32, 128, 3, 3, 4]], {}], "config": {"index": 14279328, "code_hash": null, "entity": [["tile_fc", "sp", [-1, 1, 1, 1]], ["tile_y", "sp", [-1, 1, 5, 1]], ["tile_x", "sp", [-1, 1, 10, 1]], ["tile_rcc", "sp", [-1, 4]], ["tile_ry", "sp", [-1, 1]], ["tile_rx", "sp", [-1, 3]], ["auto_unroll_max_step", "ot", 1500], ["unroll_explicit", "ot", 0]]}, "result": [[0.115825677], 0, 7.9647603034973145, 1611795368.6597798], "version": 0.2, "tvm_version": "0.8.dev0"}
{"input": ["opencl -keys=opencl,gpu -max_num_threads=256", "conv2d_NCHWc_KCRSk_tx_tune2", [[1, 32, 112, 112, 4], [32, 128, 3, 3, 4]], {}], "config": {"index": 19544224, "code_hash": null, "entity": [["tile_fc", "sp", [-1, 1, 1, 1]], ["tile_y", "sp", [-1, 1, 5, 1]], ["tile_x", "sp", [-1, 2, 5, 1]], ["tile_rcc", "sp", [-1, 2]], ["tile_ry", "sp", [-1, 1]], ["tile_rx", "sp", [-1, 3]], ["auto_unroll_max_step", "ot", 0], ["unroll_explicit", "ot", 1]]}, "result": [[0.10962310766666666], 0, 27.938860177993774, 1611795388.7043943], "version": 0.2, "tvm_version": "0.8.dev0"}
{"input": ["opencl -keys=opencl,gpu -max_num_threads=256", "conv2d_NCHWc_KCRSk_tx_tune2", [[1, 32, 112, 112, 4], [32, 128, 3, 3, 4]], {}], "config": {"index": 30794400, "code_hash": null, "entity": [["tile_fc", "sp", [-1, 1, 1, 1]], ["tile_y", "sp", [-1, 1, 5, 1]], ["tile_x", "sp", [-1, 1, 10, 1]], ["tile_rcc", "sp", [-1, 4]], ["tile_ry", "sp", [-1, 1]], ["tile_rx", "sp", [-1, 3]], ["auto_unroll_max_step", "ot", 1500], ["unroll_explicit", "ot", 1]]}, "result": [[0.4474566146666667], 0, 38.56311631202698, 1611795398.0830925], "version": 0.2, "tvm_version": "0.8.dev0"}
{"input": ["opencl -keys=opencl,gpu -max_num_threads=256", "conv2d_NCHWc_KCRSk_tx_tune2", [[1, 32, 112, 112, 4], [32, 128, 3, 3, 4]], {}], "config": {"index": 7119684, "code_hash": null, "entity": [["tile_fc", "sp", [-1, 2, 4, 1]], ["tile_y", "sp", [-1, 1, 11, 2]], ["tile_x", "sp", [-1, 5, 1, 1]], ["tile_rcc", "sp", [-1, 2]], ["tile_ry", "sp", [-1, 3]], ["tile_rx", "sp", [-1, 1]], ["auto_unroll_max_step", "ot", 512], ["unroll_explicit", "ot", 0]]}, "result": [[0.08358628466666666], 0, 41.35074424743652, 1611795401.8959475], "version": 0.2, "tvm_version": "0.8.dev0"}
{"input": ["opencl -keys=opencl,gpu -max_num_threads=256", "conv2d_NCHWc_KCRSk_tx_tune2", [[1, 32, 112, 112, 4], [32, 128, 3, 3, 4]], {}], "config": {"index": 13837850, "code_hash": null, "entity": [["tile_fc", "sp", [-1, 1, 2, 2]], ["tile_y", "sp", [-1, 1, 1, 1]], ["tile_x", "sp", [-1, 10, 11, 1]], ["tile_rcc", "sp", [-1, 1]], ["tile_ry", "sp", [-1, 1]], ["tile_rx", "sp", [-1, 3]], ["auto_unroll_max_step", "ot", 1500], ["unroll_explicit", "ot", 0]]}, "result": [[0.076248021], 0, 45.00536060333252, 1611795405.642347], "version": 0.2, "tvm_version": "0.8.dev0"}
{"input": ["opencl -keys=opencl,gpu -max_num_threads=256", "conv2d_NCHWc_KCRSk_tx_tune2", [[1, 32, 112, 112, 4], [32, 128, 3, 3, 4]], {}], "config": {"index": 13764416, "code_hash": null, "entity": [["tile_fc", "sp", [-1, 4, 2, 1]], ["tile_y", "sp", [-1, 1, 11, 2]], ["tile_x", "sp", [-1, 1, 1, 1]], ["tile_rcc", "sp", [-1, 1]], ["tile_ry", "sp", [-1, 1]], ["tile_rx", "sp", [-1, 3]], ["auto_unroll_max_step", "ot", 1500], ["unroll_explicit", "ot", 0]]}, "result": [[0.08580473966666667], 0, 66.43448162078857, 1611795426.8839095], "version": 0.2, "tvm_version": "0.8.dev0"}
{"input": ["opencl -keys=opencl,gpu -max_num_threads=256", "conv2d_NCHWc_KCRSk_tx_tune2", [[1, 32, 112, 112, 4], [32, 128, 3, 3, 4]], {}], "config": {"index": 13860588, "code_hash": null, "entity": [["tile_fc", "sp", [-1, 4, 2, 2]], ["tile_y", "sp", [-1, 1, 22, 1]], ["tile_x", "sp", [-1, 1, 1, 2]], ["tile_rcc", "sp", [-1, 1]], ["tile_ry", "sp", [-1, 1]], ["tile_rx", "sp", [-1, 3]], ["auto_unroll_max_step", "ot", 1500], ["unroll_explicit", "ot", 0]]}, "result": [[0.07626729166666667], 0, 70.12457990646362, 1611795430.6133654], "version": 0.2, "tvm_version": "0.8.dev0"}
{"input": ["opencl -keys=opencl,gpu -max_num_threads=256", "conv2d_NCHWc_KCRSk_tx_tune2", [[1, 32, 112, 112, 4], [32, 128, 3, 3, 4]], {}], "config": {"index": 30325986, "code_hash": null, "entity": [["tile_fc", "sp", [-1, 1, 2, 2]], ["tile_y", "sp", [-1, 1, 5, 2]], ["tile_x", "sp", [-1, 2, 5, 1]], ["tile_rcc", "sp", [-1, 1]], ["tile_ry", "sp", [-1, 1]], ["tile_rx", "sp", [-1, 3]], ["auto_unroll_max_step", "ot", 1500], ["unroll_explicit", "ot", 1]]}, "result": [[0.04622717033333334], 0, 4.296749830245972, 1611795436.231967], "version": 0.2, "tvm_version": "0.8.dev0"}
{"input": ["opencl -keys=opencl,gpu -max_num_threads=256", "conv2d_NCHWc_KCRSk_tx_tune2", [[1, 32, 112, 112, 4], [32, 128, 3, 3, 4]], {}], "config": {"index": 11044066, "code_hash": null, "entity": [["tile_fc", "sp", [-1, 1, 2, 2]], ["tile_y", "sp", [-1, 1, 5, 2]], ["tile_x", "sp", [-1, 5, 2, 1]], ["tile_rcc", "sp", [-1, 1]], ["tile_ry", "sp", [-1, 1]], ["tile_rx", "sp", [-1, 1]], ["auto_unroll_max_step", "ot", 1500], ["unroll_explicit", "ot", 0]]}, "result": [[0.09924217033333334], 0, 7.754610300064087, 1611795440.1676548], "version": 0.2, "tvm_version": "0.8.dev0"}
{"input": ["opencl -keys=opencl,gpu -max_num_threads=256", "conv2d_NCHWc_KCRSk_tx_tune2", [[1, 32, 112, 112, 4], [32, 128, 3, 3, 4]], {}], "config": {"index": 230272, "code_hash": null, "entity": [["tile_fc", "sp", [-1, 1, 1, 1]], ["tile_y", "sp", [-1, 1, 10, 1]], ["tile_x", "sp", [-1, 1, 1, 1]], ["tile_rcc", "sp", [-1, 2]], ["tile_ry", "sp", [-1, 1]], ["tile_rx", "sp", [-1, 1]], ["auto_unroll_max_step", "ot", 0], ["unroll_explicit", "ot", 0]]}, "result": [[0.18201283000000001], 0, 12.750608921051025, 1611795445.1341364], "version": 0.2, "tvm_version": "0.8.dev0"}
{"input": ["opencl -keys=opencl,gpu -max_num_threads=256", "conv2d_NCHWc_KCRSk_tx_tune2", [[1, 32, 112, 112, 4], [32, 128, 3, 3, 4]], {}], "config": {"index": 1384663, "code_hash": null, "entity": [["tile_fc", "sp", [-1, 2, 2, 1]], ["tile_y", "sp", [-1, 1, 22, 1]], ["tile_x", "sp", [-1, 5, 1, 1]], ["tile_rcc", "sp", [-1, 1]], ["tile_ry", "sp", [-1, 3]], ["tile_rx", "sp", [-1, 1]], ["auto_unroll_max_step", "ot", 0], ["unroll_explicit", "ot", 0]]}, "result": [[0.09390689233333332], 0, 32.1225380897522, 1611795464.4860468], "version": 0.2, "tvm_version": "0.8.dev0"}
{"input": ["opencl -keys=opencl,gpu -max_num_threads=256", "conv2d_NCHWc_KCRSk_tx_tune2", [[1, 32, 112, 112, 4], [32, 128, 3, 3, 4]], {}], "config": {"index": 24820962, "code_hash": null, "entity": [["tile_fc", "sp", [-1, 1, 2, 2]], ["tile_y", "sp", [-1, 1, 5, 2]], ["tile_x", "sp", [-1, 2, 5, 1]], ["tile_rcc", "sp", [-1, 1]], ["tile_ry", "sp", [-1, 1]], ["tile_rx", "sp", [-1, 3]], ["auto_unroll_max_step", "ot", 512], ["unroll_explicit", "ot", 1]]}, "result": [[0.04611651033333333], 0, 35.80779218673706, 1611795467.9641685], "version": 0.2, "tvm_version": "0.8.dev0"}
{"input": ["opencl -keys=opencl,gpu -max_num_threads=256", "conv2d_NCHWc_KCRSk_tx_tune2", [[1, 32, 112, 112, 4], [32, 128, 3, 3, 4]], {}], "config": {"index": 17974438, "code_hash": null, "entity": [["tile_fc", "sp", [-1, 1, 2, 1]], ["tile_y", "sp", [-1, 1, 5, 1]], ["tile_x", "sp", [-1, 5, 22, 1]], ["tile_rcc", "sp", [-1, 1]], ["tile_ry", "sp", [-1, 3]], ["tile_rx", "sp", [-1, 1]], ["auto_unroll_max_step", "ot", 0], ["unroll_explicit", "ot", 1]]}, "result": [[0.07399157966666667], 0, 42.81559920310974, 1611795475.538008], "version": 0.2, "tvm_version": "0.8.dev0"}
{"input": ["opencl -keys=opencl,gpu -max_num_threads=256", "conv2d_NCHWc_KCRSk_tx_tune2", [[1, 32, 112, 112, 4], [32, 128, 3, 3, 4]], {}], "config": {"index": 24855046, "code_hash": null, "entity": [["tile_fc", "sp", [-1, 1, 2, 1]], ["tile_y", "sp", [-1, 1, 1, 1]], ["tile_x", "sp", [-1, 5, 22, 1]], ["tile_rcc", "sp", [-1, 1]], ["tile_ry", "sp", [-1, 1]], ["tile_rx", "sp", [-1, 3]], ["auto_unroll_max_step", "ot", 512], ["unroll_explicit", "ot", 1]]}, "result": [[0.053055573], 0, 3.7796902656555176, 1611795728.5989318], "version": 0.2, "tvm_version": "0.8.dev0"}
{"input": ["opencl -keys=opencl,gpu -max_num_threads=256", "conv2d_NCHWc_KCRSk_tx_tune2", [[1, 32, 112, 112, 4], [32, 128, 3, 3, 4]], {}], "config": {"index": 19350022, "code_hash": null, "entity": [["tile_fc", "sp", [-1, 1, 2, 1]], ["tile_y", "sp", [-1, 1, 1, 1]], ["tile_x", "sp", [-1, 5, 22, 1]], ["tile_rcc", "sp", [-1, 1]], ["tile_ry", "sp", [-1, 1]], ["tile_rx", "sp", [-1, 3]], ["auto_unroll_max_step", "ot", 0], ["unroll_explicit", "ot", 1]]}, "result": [[0.053011736000000004], 0, 7.0851991176605225, 1611795732.0693057], "version": 0.2, "tvm_version": "0.8.dev0"}
