logs/conv2d_NCHWc_KCRSk_tx_tune2.fp16.texture.noshared.autotvm.log
{"input": ["opencl -keys=opencl,gpu -max_num_threads=256", "conv2d_NCHWc_KCRSk_tx_tune2", [[1, 32, 112, 112, 4], [32, 128, 3, 3, 4]], {}], "config": {"index": 13813204, "code_hash": null, "entity": [["tile_fc", "sp", [-1, 1, 32, 1]], ["tile_y", "sp", [-1, 1, 2, 1]], ["tile_x", "sp", [-1, 11, 5, 1]], ["tile_rcc", "sp", [-1, 1]], ["tile_ry", "sp", [-1, 1]], ["tile_rx", "sp", [-1, 3]], ["auto_unroll_max_step", "ot", 1500], ["unroll_explicit", "ot", 0]]}, "result": [[0.012388923333333334], 0, 16.63429307937622, 1612677390.0216322], "version": 0.2, "tvm_version": "0.8.dev0"}
