logs/conv2d_NCHWc_KCRSk_tx_fp32acc_tune2.texture.noshared.autotvm.log
{"input": ["opencl -keys=opencl,gpu -max_num_threads=256", "conv2d_NCHWc_KCRSk_tx_fp32acc_tune2", [[1, 32, 112, 112, 4], [32, 128, 3, 3, 4]], {}], "config": {"index": 18623753, "code_hash": null, "entity": [["tile_fc", "sp", [-1, 2, 1, 1]], ["tile_y", "sp", [-1, 5, 22, 1]], ["tile_x", "sp", [-1, 1, 5, 1]], ["tile_rcc", "sp", [-1, 8]], ["tile_ry", "sp", [-1, 3]], ["tile_rx", "sp", [-1, 1]], ["auto_unroll_max_step", "ot", 0], ["unroll_explicit", "ot", 1]]}, "result": [[0.015586666666666667], 0, 14.35527491569519, 1612655200.556868], "version": 0.2, "tvm_version": "0.8.dev0"}
