logs/depthwise_conv2d_NCHWc_KCRSk_tx_acc32_tune_fp16.texture.log
{"input": ["opencl -keys=opencl,gpu -max_num_threads=256", "depthwise_conv2d_NCHWc_KCRSk_tx_acc32_tune", [[1, 24, 257, 257, 4], [24, 1, 3, 3, 4]], {}], "config": {"index": 2376978, "code_hash": null, "entity": [["tile_fc", "sp", [-1, 1, 4, 1]], ["tile_y", "sp", [-1, 1, 15, 1]], ["tile_x", "sp", [-1, 1, 15, 1]], ["tile_ry", "sp", [-1, 3]], ["tile_rx", "sp", [-1, 3]], ["auto_unroll_max_step", "ot", 512], ["unroll_explicit", "ot", 0]]}, "result": [[0.003629288333333333], 0, 56.85837912559509, 1612837627.6002862], "version": 0.2, "tvm_version": "0.8.dev0"}
