logs/evaluate_conv2d.log
{"input": ["opencl -keys=adreno,opencl,gpu -device=adreno -max_num_threads=256", "conv2d_nchwc.opencl", [["TENSOR", [1, 32, 112, 112, 4], "float32"], ["TENSOR", [32, 128, 3, 3, 4], "float32"], [1, 1], [0, 0, 0, 0], [1, 1], "float32"], {}], "config": {"index": 29907180, "code_hash": null, "entity": [["tile_fc", "sp", [-1, 2, 4, 4]], ["tile_y", "sp", [-1, 1, 2, 5]], ["tile_x", "sp", [-1, 1, 55, 1]], ["tile_rcc", "sp", [-1, 16]], ["tile_ry", "sp", [-1, 3]], ["tile_rx", "sp", [-1, 1]], ["auto_unroll_max_step", "ot", 1500], ["unroll_explicit", "ot", 1]]}, "result": [[1.1198529163333333], 0, 90.26662921905518, 1611784603.6248655], "version": 0.2, "tvm_version": "0.8.dev0"}
{"input": ["opencl -keys=adreno,opencl,gpu -device=adreno -max_num_threads=256", "conv2d_nchwc.opencl", [["TENSOR", [1, 32, 112, 112, 4], "float32"], ["TENSOR", [32, 128, 3, 3, 4], "float32"], [1, 1], [0, 0, 0, 0], [1, 1], "float32"], {}], "config": {"index": 30147299, "code_hash": null, "entity": [["tile_fc", "sp", [-1, 1, 16, 2]], ["tile_y", "sp", [-1, 1, 2, 5]], ["tile_x", "sp", [-1, 1, 1, 2]], ["tile_rcc", "sp", [-1, 32]], ["tile_ry", "sp", [-1, 3]], ["tile_rx", "sp", [-1, 1]], ["auto_unroll_max_step", "ot", 1500], ["unroll_explicit", "ot", 1]]}, "result": [[0.050433159666666665], 0, 112.04032397270203, 1611784732.3720589], "version": 0.2, "tvm_version": "0.8.dev0"}
{"input": ["opencl -keys=adreno,opencl,gpu -device=adreno -max_num_threads=256", "conv2d_nchwc.opencl", [["TENSOR", [1, 32, 112, 112, 4], "float32"], ["TENSOR", [32, 128, 3, 3, 4], "float32"], [1, 1], [0, 0, 0, 0], [1, 1], "float32"], {}], "config": {"index": 21889763, "code_hash": null, "entity": [["tile_fc", "sp", [-1, 1, 16, 2]], ["tile_y", "sp", [-1, 1, 2, 5]], ["tile_x", "sp", [-1, 1, 1, 2]], ["tile_rcc", "sp", [-1, 32]], ["tile_ry", "sp", [-1, 3]], ["tile_rx", "sp", [-1, 3]], ["auto_unroll_max_step", "ot", 0], ["unroll_explicit", "ot", 1]]}, "result": [[0.048494930666666665], 0, 6.99757194519043, 1611785064.391057], "version": 0.2, "tvm_version": "0.8.dev0"}
{"input": ["opencl -keys=adreno,opencl,gpu -device=adreno -max_num_threads=256", "conv2d_nchwc.opencl", [["TENSOR", [1, 32, 112, 112, 4], "float32"], ["TENSOR", [32, 128, 3, 3, 4], "float32"], [1, 1], [0, 0, 0, 0], [1, 1], "float32"], {}], "config": {"index": 27298141, "code_hash": null, "entity": [["tile_fc", "sp", [-1, 1, 8, 4]], ["tile_y", "sp", [-1, 1, 11, 5]], ["tile_x", "sp", [-1, 1, 1, 1]], ["tile_rcc", "sp", [-1, 32]], ["tile_ry", "sp", [-1, 3]], ["tile_rx", "sp", [-1, 3]], ["auto_unroll_max_step", "ot", 512], ["unroll_explicit", "ot", 1]]}, "result": [[0.239326493], 0, 87.19898962974548, 1611785144.287506], "version": 0.2, "tvm_version": "0.8.dev0"}
{"input": ["opencl -keys=adreno,opencl,gpu -device=adreno -max_num_threads=256", "conv2d_nchwc.opencl", [["TENSOR", [1, 32, 112, 112, 4], "float32"], ["TENSOR", [32, 128, 3, 3, 4], "float32"], [1, 1], [0, 0, 0, 0], [1, 1], "float32"], {}], "config": {"index": 32803165, "code_hash": null, "entity": [["tile_fc", "sp", [-1, 1, 8, 4]], ["tile_y", "sp", [-1, 1, 11, 5]], ["tile_x", "sp", [-1, 1, 1, 1]], ["tile_rcc", "sp", [-1, 32]], ["tile_ry", "sp", [-1, 3]], ["tile_rx", "sp", [-1, 3]], ["auto_unroll_max_step", "ot", 1500], ["unroll_explicit", "ot", 1]]}, "result": [[0.1856551213333333], 0, 98.60828733444214, 1611785155.5398417], "version": 0.2, "tvm_version": "0.8.dev0"}
{"input": ["opencl -keys=adreno,opencl,gpu -device=adreno -max_num_threads=256", "conv2d_nchwc.opencl", [["TENSOR", [1, 32, 112, 112, 4], "float32"], ["TENSOR", [32, 128, 3, 3, 4], "float32"], [1, 1], [0, 0, 0, 0], [1, 1], "float32"], {}], "config": {"index": 32899811, "code_hash": null, "entity": [["tile_fc", "sp", [-1, 1, 16, 2]], ["tile_y", "sp", [-1, 1, 2, 5]], ["tile_x", "sp", [-1, 1, 1, 2]], ["tile_rcc", "sp", [-1, 32]], ["tile_ry", "sp", [-1, 3]], ["tile_rx", "sp", [-1, 3]], ["auto_unroll_max_step", "ot", 1500], ["unroll_explicit", "ot", 1]]}, "result": [[0.12497720466666667], 0, 21.045214891433716, 1611785227.596434], "version": 0.2, "tvm_version": "0.8.dev0"}
{"input": ["opencl -keys=adreno,opencl,gpu -device=adreno -max_num_threads=256", "conv2d_nchwc.opencl", [["TENSOR", [1, 32, 112, 112, 4], "float32"], ["TENSOR", [32, 128, 3, 3, 4], "float32"], [1, 1], [0, 0, 0, 0], [1, 1], "float32"], {}], "config": {"index": 6063266, "code_hash": null, "entity": [["tile_fc", "sp", [-1, 2, 8, 2]], ["tile_y", "sp", [-1, 1, 1, 11]], ["tile_x", "sp", [-1, 1, 1, 2]], ["tile_rcc", "sp", [-1, 4]], ["tile_ry", "sp", [-1, 1]], ["tile_rx", "sp", [-1, 1]], ["auto_unroll_max_step", "ot", 512], ["unroll_explicit", "ot", 0]]}, "result": [[0.9452547913333333], 0, 87.12987494468689, 1611785294.4761531], "version": 0.2, "tvm_version": "0.8.dev0"}
{"input": ["opencl -keys=adreno,opencl,gpu -device=adreno -max_num_threads=256", "conv2d_nchwc.opencl", [["TENSOR", [1, 32, 112, 112, 4], "float32"], ["TENSOR", [32, 128, 3, 3, 4], "float32"], [1, 1], [0, 0, 0, 0], [1, 1], "float32"], {}], "config": {"index": 32803323, "code_hash": null, "entity": [["tile_fc", "sp", [-1, 1, 16, 2]], ["tile_y", "sp", [-1, 1, 1, 10]], ["tile_x", "sp", [-1, 1, 1, 1]], ["tile_rcc", "sp", [-1, 32]], ["tile_ry", "sp", [-1, 3]], ["tile_rx", "sp", [-1, 3]], ["auto_unroll_max_step", "ot", 1500], ["unroll_explicit", "ot", 1]]}, "result": [[0.28873300333333335], 0, 6.87793755531311, 1611785490.5654874], "version": 0.2, "tvm_version": "0.8.dev0"}
{"input": ["opencl -keys=adreno,opencl,gpu -device=adreno -max_num_threads=256", "conv2d_nchwc.opencl", [["TENSOR", [1, 32, 112, 112, 4], "float32"], ["TENSOR", [32, 128, 3, 3, 4], "float32"], [1, 1], [0, 0, 0, 0], [1, 1], "float32"], {}], "config": {"index": 32831725, "code_hash": null, "entity": [["tile_fc", "sp", [-1, 1, 8, 4]], ["tile_y", "sp", [-1, 1, 2, 5]], ["tile_x", "sp", [-1, 1, 2, 1]], ["tile_rcc", "sp", [-1, 32]], ["tile_ry", "sp", [-1, 3]], ["tile_rx", "sp", [-1, 3]], ["auto_unroll_max_step", "ot", 1500], ["unroll_explicit", "ot", 1]]}, "result": [[0.17897678833333333], 0, 46.89349889755249, 1611785530.3387077], "version": 0.2, "tvm_version": "0.8.dev0"}
{"input": ["opencl -keys=adreno,opencl,gpu -device=adreno -max_num_threads=256", "conv2d_nchwc.opencl", [["TENSOR", [1, 32, 112, 112, 4], "float32"], ["TENSOR", [32, 128, 3, 3, 4], "float32"], [1, 1], [0, 0, 0, 0], [1, 1], "float32"], {}], "config": {"index": 16288251, "code_hash": null, "entity": [["tile_fc", "sp", [-1, 1, 16, 2]], ["tile_y", "sp", [-1, 1, 1, 10]], ["tile_x", "sp", [-1, 1, 1, 1]], ["tile_rcc", "sp", [-1, 32]], ["tile_ry", "sp", [-1, 3]], ["tile_rx", "sp", [-1, 3]], ["auto_unroll_max_step", "ot", 1500], ["unroll_explicit", "ot", 0]]}, "result": [[0.869475156], 0, 76.10967373847961, 1611785560.3628263], "version": 0.2, "tvm_version": "0.8.dev0"}
{"input": ["opencl -keys=adreno,opencl,gpu -device=adreno -max_num_threads=256", "conv2d_nchwc.opencl", [["TENSOR", [1, 32, 112, 112, 4], "float32"], ["TENSOR", [32, 128, 3, 3, 4], "float32"], [1, 1], [0, 0, 0, 0], [1, 1], "float32"], {}], "config": {"index": 16384571, "code_hash": null, "entity": [["tile_fc", "sp", [-1, 1, 16, 2]], ["tile_y", "sp", [-1, 2, 1, 5]], ["tile_x", "sp", [-1, 1, 1, 2]], ["tile_rcc", "sp", [-1, 32]], ["tile_ry", "sp", [-1, 3]], ["tile_rx", "sp", [-1, 3]], ["auto_unroll_max_step", "ot", 1500], ["unroll_explicit", "ot", 0]]}, "result": [[1.1957188713333333], 0, 90.18787837028503, 1611785574.551318], "version": 0.2, "tvm_version": "0.8.dev0"}
{"input": ["opencl -keys=adreno,opencl,gpu -device=adreno -max_num_threads=256", "conv2d_nchwc.opencl", [["TENSOR", [1, 32, 112, 112, 4], "float32"], ["TENSOR", [32, 128, 3, 3, 4], "float32"], [1, 1], [0, 0, 0, 0], [1, 1], "float32"], {}], "config": {"index": 27394787, "code_hash": null, "entity": [["tile_fc", "sp", [-1, 1, 16, 2]], ["tile_y", "sp", [-1, 1, 2, 5]], ["tile_x", "sp", [-1, 1, 1, 2]], ["tile_rcc", "sp", [-1, 32]], ["tile_ry", "sp", [-1, 3]], ["tile_rx", "sp", [-1, 3]], ["auto_unroll_max_step", "ot", 512], ["unroll_explicit", "ot", 1]]}, "result": [[0.09449597233333333], 0, 110.23273944854736, 1611785594.2364554], "version": 0.2, "tvm_version": "0.8.dev0"}
{"input": ["opencl -keys=adreno,opencl,gpu -device=adreno -max_num_threads=256", "conv2d_nchwc.opencl", [["TENSOR", [1, 32, 112, 112, 4], "float32"], ["TENSOR", [32, 128, 3, 3, 4], "float32"], [1, 1], [0, 0, 0, 0], [1, 1], "float32"], {}], "config": {"index": 27298299, "code_hash": null, "entity": [["tile_fc", "sp", [-1, 1, 16, 2]], ["tile_y", "sp", [-1, 1, 1, 10]], ["tile_x", "sp", [-1, 1, 1, 1]], ["tile_rcc", "sp", [-1, 32]], ["tile_ry", "sp", [-1, 3]], ["tile_rx", "sp", [-1, 3]], ["auto_unroll_max_step", "ot", 512], ["unroll_explicit", "ot", 1]]}, "result": [[0.17942085066666666], 0, 115.08044481277466, 1611785599.0913332], "version": 0.2, "tvm_version": "0.8.dev0"}
{"input": ["opencl -keys=adreno,opencl,gpu -device=adreno -max_num_threads=256", "conv2d_nchwc.opencl", [["TENSOR", [1, 32, 112, 112, 4], "float32"], ["TENSOR", [32, 128, 3, 3, 4], "float32"], [1, 1], [0, 0, 0, 0], [1, 1], "float32"], {}], "config": {"index": 32931563, "code_hash": null, "entity": [["tile_fc", "sp", [-1, 1, 16, 2]], ["tile_y", "sp", [-1, 1, 5, 2]], ["tile_x", "sp", [-1, 1, 1, 5]], ["tile_rcc", "sp", [-1, 32]], ["tile_ry", "sp", [-1, 3]], ["tile_rx", "sp", [-1, 3]], ["auto_unroll_max_step", "ot", 1500], ["unroll_explicit", "ot", 1]]}, "result": [[0.12100805533333332], 0, 21.097023248672485, 1611785784.4507523], "version": 0.2, "tvm_version": "0.8.dev0"}
{"input": ["opencl -keys=adreno,opencl,gpu -device=adreno -max_num_threads=256", "conv2d_nchwc.opencl", [["TENSOR", [1, 32, 112, 112, 4], "float32"], ["TENSOR", [32, 128, 3, 3, 4], "float32"], [1, 1], [0, 0, 0, 0], [1, 1], "float32"], {}], "config": {"index": 16384245, "code_hash": null, "entity": [["tile_fc", "sp", [-1, 1, 8, 4]], ["tile_y", "sp", [-1, 1, 5, 2]], ["tile_x", "sp", [-1, 1, 1, 2]], ["tile_rcc", "sp", [-1, 32]], ["tile_ry", "sp", [-1, 3]], ["tile_rx", "sp", [-1, 3]], ["auto_unroll_max_step", "ot", 1500], ["unroll_explicit", "ot", 0]]}, "result": [[0.07350232633333333], 0, 23.50821304321289, 1611785788.1884606], "version": 0.2, "tvm_version": "0.8.dev0"}
{"input": ["opencl -keys=adreno,opencl,gpu -device=adreno -max_num_threads=256", "conv2d_nchwc.opencl", [["TENSOR", [1, 32, 112, 112, 4], "float32"], ["TENSOR", [32, 128, 3, 3, 4], "float32"], [1, 1], [0, 0, 0, 0], [1, 1], "float32"], {}], "config": {"index": 27326701, "code_hash": null, "entity": [["tile_fc", "sp", [-1, 1, 8, 4]], ["tile_y", "sp", [-1, 1, 2, 5]], ["tile_x", "sp", [-1, 1, 2, 1]], ["tile_rcc", "sp", [-1, 32]], ["tile_ry", "sp", [-1, 3]], ["tile_rx", "sp", [-1, 3]], ["auto_unroll_max_step", "ot", 512], ["unroll_explicit", "ot", 1]]}, "result": [[0.33138036433333334], 0, 30.517263412475586, 1611785794.3332949], "version": 0.2, "tvm_version": "0.8.dev0"}
{"input": ["opencl -keys=adreno,opencl,gpu -device=adreno -max_num_threads=256", "conv2d_nchwc.opencl", [["TENSOR", [1, 32, 112, 112, 4], "float32"], ["TENSOR", [32, 128, 3, 3, 4], "float32"], [1, 1], [0, 0, 0, 0], [1, 1], "float32"], {}], "config": {"index": 16416491, "code_hash": null, "entity": [["tile_fc", "sp", [-1, 1, 16, 2]], ["tile_y", "sp", [-1, 1, 5, 2]], ["tile_x", "sp", [-1, 1, 1, 5]], ["tile_rcc", "sp", [-1, 32]], ["tile_ry", "sp", [-1, 3]], ["tile_rx", "sp", [-1, 3]], ["auto_unroll_max_step", "ot", 1500], ["unroll_explicit", "ot", 0]]}, "result": [[0.05585534733333333], 0, 49.676368951797485, 1611785814.0898845], "version": 0.2, "tvm_version": "0.8.dev0"}
{"input": ["opencl -keys=adreno,opencl,gpu -device=adreno -max_num_threads=256", "conv2d_nchwc.opencl", [["TENSOR", [1, 32, 112, 112, 4], "float32"], ["TENSOR", [32, 128, 3, 3, 4], "float32"], [1, 1], [0, 0, 0, 0], [1, 1], "float32"], {}], "config": {"index": 27426539, "code_hash": null, "entity": [["tile_fc", "sp", [-1, 1, 16, 2]], ["tile_y", "sp", [-1, 1, 5, 2]], ["tile_x", "sp", [-1, 1, 1, 5]], ["tile_rcc", "sp", [-1, 32]], ["tile_ry", "sp", [-1, 3]], ["tile_rx", "sp", [-1, 3]], ["auto_unroll_max_step", "ot", 512], ["unroll_explicit", "ot", 1]]}, "result": [[0.05854315966666667], 0, 53.60753893852234, 1611785817.661195], "version": 0.2, "tvm_version": "0.8.dev0"}
{"input": ["opencl -keys=adreno,opencl,gpu -device=adreno -max_num_threads=256", "conv2d_nchwc.opencl", [["TENSOR", [1, 32, 112, 112, 4], "float32"], ["TENSOR", [32, 128, 3, 3, 4], "float32"], [1, 1], [0, 0, 0, 0], [1, 1], "float32"], {}], "config": {"index": 32831995, "code_hash": null, "entity": [["tile_fc", "sp", [-1, 1, 16, 2]], ["tile_y", "sp", [-1, 1, 1, 10]], ["tile_x", "sp", [-1, 1, 2, 1]], ["tile_rcc", "sp", [-1, 32]], ["tile_ry", "sp", [-1, 3]], ["tile_rx", "sp", [-1, 3]], ["auto_unroll_max_step", "ot", 1500], ["unroll_explicit", "ot", 1]]}, "result": [[0.34519657966666667], 0, 8.145629167556763, 1611786045.712604], "version": 0.2, "tvm_version": "0.8.dev0"}
{"input": ["opencl -keys=adreno,opencl,gpu -device=adreno -max_num_threads=256", "conv2d_nchwc.opencl", [["TENSOR", [1, 32, 112, 112, 4], "float32"], ["TENSOR", [32, 128, 3, 3, 4], "float32"], [1, 1], [0, 0, 0, 0], [1, 1], "float32"], {}], "config": {"index": 32846331, "code_hash": null, "entity": [["tile_fc", "sp", [-1, 1, 16, 2]], ["tile_y", "sp", [-1, 1, 1, 10]], ["tile_x", "sp", [-1, 1, 5, 1]], ["tile_rcc", "sp", [-1, 32]], ["tile_ry", "sp", [-1, 3]], ["tile_rx", "sp", [-1, 3]], ["auto_unroll_max_step", "ot", 1500], ["unroll_explicit", "ot", 1]]}, "result": [[0.42481609366666667], 0, 106.18791556358337, 1611786144.6123807], "version": 0.2, "tvm_version": "0.8.dev0"}
{"input": ["opencl -keys=adreno,opencl,gpu -device=adreno -max_num_threads=256", "conv2d_nchwc.opencl", [["TENSOR", [1, 32, 112, 112, 4], "float32"], ["TENSOR", [32, 128, 3, 3, 4], "float32"], [1, 1], [0, 0, 0, 0], [1, 1], "float32"], {}], "config": {"index": 13861363, "code_hash": null, "entity": [["tile_fc", "sp", [-1, 2, 16, 1]], ["tile_y", "sp", [-1, 1, 1, 5]], ["tile_x", "sp", [-1, 1, 1, 2]], ["tile_rcc", "sp", [-1, 1]], ["tile_ry", "sp", [-1, 1]], ["tile_rx", "sp", [-1, 3]], ["auto_unroll_max_step", "ot", 1500], ["unroll_explicit", "ot", 0]]}, "result": [[0.11235805566666666], 0, 53.1851441860199, 1611786199.433836], "version": 0.2, "tvm_version": "0.8.dev0"}
{"input": ["opencl -keys=adreno,opencl,gpu -device=adreno -max_num_threads=256", "conv2d_nchwc.opencl", [["TENSOR", [1, 32, 112, 112, 4], "float32"], ["TENSOR", [32, 128, 3, 3, 4], "float32"], [1, 1], [0, 0, 0, 0], [1, 1], "float32"], {}], "config": {"index": 32889339, "code_hash": null, "entity": [["tile_fc", "sp", [-1, 1, 16, 2]], ["tile_y", "sp", [-1, 1, 1, 10]], ["tile_x", "sp", [-1, 1, 55, 1]], ["tile_rcc", "sp", [-1, 32]], ["tile_ry", "sp", [-1, 3]], ["tile_rx", "sp", [-1, 3]], ["auto_unroll_max_step", "ot", 1500], ["unroll_explicit", "ot", 1]]}, "result": [[0.6775287846666668], 0, 63.31554317474365, 1611786209.3123205], "version": 0.2, "tvm_version": "0.8.dev0"}
{"input": ["opencl -keys=adreno,opencl,gpu -device=adreno -max_num_threads=256", "conv2d_nchwc.opencl", [["TENSOR", [1, 32, 112, 112, 4], "float32"], ["TENSOR", [32, 128, 3, 3, 4], "float32"], [1, 1], [0, 0, 0, 0], [1, 1], "float32"], {}], "config": {"index": 32899796, "code_hash": null, "entity": [["tile_fc", "sp", [-1, 1, 32, 1]], ["tile_y", "sp", [-1, 1, 2, 5]], ["tile_x", "sp", [-1, 1, 1, 2]], ["tile_rcc", "sp", [-1, 32]], ["tile_ry", "sp", [-1, 3]], ["tile_rx", "sp", [-1, 3]], ["auto_unroll_max_step", "ot", 1500], ["unroll_explicit", "ot", 1]]}, "result": [[0.09013838533333333], 0, 4.929507255554199, 1611786254.1653376], "version": 0.2, "tvm_version": "0.8.dev0"}
{"input": ["opencl -keys=adreno,opencl,gpu -device=adreno -max_num_threads=256", "conv2d_nchwc.opencl", [["TENSOR", [1, 32, 112, 112, 4], "float32"], ["TENSOR", [32, 128, 3, 3, 4], "float32"], [1, 1], [0, 0, 0, 0], [1, 1], "float32"], {}], "config": {"index": 32913923, "code_hash": null, "entity": [["tile_fc", "sp", [-1, 1, 16, 2]], ["tile_y", "sp", [-1, 1, 1, 5]], ["tile_x", "sp", [-1, 1, 5, 2]], ["tile_rcc", "sp", [-1, 32]], ["tile_ry", "sp", [-1, 3]], ["tile_rx", "sp", [-1, 3]], ["auto_unroll_max_step", "ot", 1500], ["unroll_explicit", "ot", 1]]}, "result": [[0.14199362833333332], 0, 9.643033981323242, 1611786258.606901], "version": 0.2, "tvm_version": "0.8.dev0"}
{"input": ["opencl -keys=adreno,opencl,gpu -device=adreno -max_num_threads=256", "conv2d_nchwc.opencl", [["TENSOR", [1, 32, 112, 112, 4], "float32"], ["TENSOR", [32, 128, 3, 3, 4], "float32"], [1, 1], [0, 0, 0, 0], [1, 1], "float32"], {}], "config": {"index": 13403298, "code_hash": null, "entity": [["tile_fc", "sp", [-1, 2, 8, 2]], ["tile_y", "sp", [-1, 1, 1, 11]], ["tile_x", "sp", [-1, 1, 1, 2]], ["tile_rcc", "sp", [-1, 16]], ["tile_ry", "sp", [-1, 3]], ["tile_rx", "sp", [-1, 1]], ["auto_unroll_max_step", "ot", 1500], ["unroll_explicit", "ot", 0]]}, "result": [[1.0144384023333333], 0, 21.540191411972046, 1611786271.298789], "version": 0.2, "tvm_version": "0.8.dev0"}
{"input": ["opencl -keys=adreno,opencl,gpu -device=adreno -max_num_threads=256", "conv2d_nchwc.opencl", [["TENSOR", [1, 32, 112, 112, 4], "float32"], ["TENSOR", [32, 128, 3, 3, 4], "float32"], [1, 1], [0, 0, 0, 0], [1, 1], "float32"], {}], "config": {"index": 13173922, "code_hash": null, "entity": [["tile_fc", "sp", [-1, 2, 8, 2]], ["tile_y", "sp", [-1, 1, 1, 11]], ["tile_x", "sp", [-1, 1, 1, 2]], ["tile_rcc", "sp", [-1, 8]], ["tile_ry", "sp", [-1, 3]], ["tile_rx", "sp", [-1, 1]], ["auto_unroll_max_step", "ot", 1500], ["unroll_explicit", "ot", 0]]}, "result": [[0.9770023433333334], 0, 34.15032601356506, 1611786284.043699], "version": 0.2, "tvm_version": "0.8.dev0"}
{"input": ["opencl -keys=adreno,opencl,gpu -device=adreno -max_num_threads=256", "conv2d_nchwc.opencl", [["TENSOR", [1, 32, 112, 112, 4], "float32"], ["TENSOR", [32, 128, 3, 3, 4], "float32"], [1, 1], [0, 0, 0, 0], [1, 1], "float32"], {}], "config": {"index": 32831715, "code_hash": null, "entity": [["tile_fc", "sp", [-1, 1, 16, 2]], ["tile_y", "sp", [-1, 1, 2, 5]], ["tile_x", "sp", [-1, 1, 2, 1]], ["tile_rcc", "sp", [-1, 32]], ["tile_ry", "sp", [-1, 3]], ["tile_rx", "sp", [-1, 3]], ["auto_unroll_max_step", "ot", 1500], ["unroll_explicit", "ot", 1]]}, "result": [[0.174969948], 0, 5.316879749298096, 1611786577.7331686], "version": 0.2, "tvm_version": "0.8.dev0"}
{"input": ["opencl -keys=adreno,opencl,gpu -device=adreno -max_num_threads=256", "conv2d_nchwc.opencl", [["TENSOR", [1, 32, 112, 112, 4], "float32"], ["TENSOR", [32, 128, 3, 3, 4], "float32"], [1, 1], [0, 0, 0, 0], [1, 1], "float32"], {}], "config": {"index": 30079203, "code_hash": null, "entity": [["tile_fc", "sp", [-1, 1, 16, 2]], ["tile_y", "sp", [-1, 1, 2, 5]], ["tile_x", "sp", [-1, 1, 2, 1]], ["tile_rcc", "sp", [-1, 32]], ["tile_ry", "sp", [-1, 3]], ["tile_rx", "sp", [-1, 1]], ["auto_unroll_max_step", "ot", 1500], ["unroll_explicit", "ot", 1]]}, "result": [[0.026811336666666668], 0, 8.245362281799316, 1611786580.9705582], "version": 0.2, "tvm_version": "0.8.dev0"}
{"input": ["opencl -keys=adreno,opencl,gpu -device=adreno -max_num_threads=256", "conv2d_nchwc.opencl", [["TENSOR", [1, 32, 112, 112, 4], "float32"], ["TENSOR", [32, 128, 3, 3, 4], "float32"], [1, 1], [0, 0, 0, 0], [1, 1], "float32"], {}], "config": {"index": 24803820, "code_hash": null, "entity": [["tile_fc", "sp", [-1, 1, 32, 1]], ["tile_y", "sp", [-1, 1, 1, 10]], ["tile_x", "sp", [-1, 1, 2, 1]], ["tile_rcc", "sp", [-1, 1]], ["tile_ry", "sp", [-1, 1]], ["tile_rx", "sp", [-1, 3]], ["auto_unroll_max_step", "ot", 512], ["unroll_explicit", "ot", 1]]}, "result": [[0.41571815966666664], 0, 15.872878313064575, 1611786588.2357306], "version": 0.2, "tvm_version": "0.8.dev0"}
{"input": ["opencl -keys=adreno,opencl,gpu -device=adreno -max_num_threads=256", "conv2d_nchwc.opencl", [["TENSOR", [1, 32, 112, 112, 4], "float32"], ["TENSOR", [32, 128, 3, 3, 4], "float32"], [1, 1], [0, 0, 0, 0], [1, 1], "float32"], {}], "config": {"index": 31455459, "code_hash": null, "entity": [["tile_fc", "sp", [-1, 1, 16, 2]], ["tile_y", "sp", [-1, 1, 2, 5]], ["tile_x", "sp", [-1, 1, 2, 1]], ["tile_rcc", "sp", [-1, 32]], ["tile_ry", "sp", [-1, 1]], ["tile_rx", "sp", [-1, 3]], ["auto_unroll_max_step", "ot", 1500], ["unroll_explicit", "ot", 1]]}, "result": [[0.05557741333333333], 0, 19.064700603485107, 1611786591.790413], "version": 0.2, "tvm_version": "0.8.dev0"}
{"input": ["opencl -keys=adreno,opencl,gpu -device=adreno -max_num_threads=256", "conv2d_nchwc.opencl", [["TENSOR", [1, 32, 112, 112, 4], "float32"], ["TENSOR", [32, 128, 3, 3, 4], "float32"], [1, 1], [0, 0, 0, 0], [1, 1], "float32"], {}], "config": {"index": 30093819, "code_hash": null, "entity": [["tile_fc", "sp", [-1, 1, 16, 2]], ["tile_y", "sp", [-1, 1, 1, 10]], ["tile_x", "sp", [-1, 1, 5, 1]], ["tile_rcc", "sp", [-1, 32]], ["tile_ry", "sp", [-1, 3]], ["tile_rx", "sp", [-1, 1]], ["auto_unroll_max_step", "ot", 1500], ["unroll_explicit", "ot", 1]]}, "result": [[0.04334161466666667], 0, 62.62773680686951, 1611786634.907239], "version": 0.2, "tvm_version": "0.8.dev0"}
{"input": ["opencl -keys=adreno,opencl,gpu -device=adreno -max_num_threads=256", "conv2d_nchwc.opencl", [["TENSOR", [1, 32, 112, 112, 4], "float32"], ["TENSOR", [32, 128, 3, 3, 4], "float32"], [1, 1], [0, 0, 0, 0], [1, 1], "float32"], {}], "config": {"index": 28702947, "code_hash": null, "entity": [["tile_fc", "sp", [-1, 1, 16, 2]], ["tile_y", "sp", [-1, 1, 2, 5]], ["tile_x", "sp", [-1, 1, 2, 1]], ["tile_rcc", "sp", [-1, 32]], ["tile_ry", "sp", [-1, 1]], ["tile_rx", "sp", [-1, 1]], ["auto_unroll_max_step", "ot", 1500], ["unroll_explicit", "ot", 1]]}, "result": [[0.6578232636666667], 0, 73.59698104858398, 1611786645.2436512], "version": 0.2, "tvm_version": "0.8.dev0"}
{"input": ["opencl -keys=adreno,opencl,gpu -device=adreno -max_num_threads=256", "conv2d_nchwc.opencl", [["TENSOR", [1, 32, 112, 112, 4], "float32"], ["TENSOR", [32, 128, 3, 3, 4], "float32"], [1, 1], [0, 0, 0, 0], [1, 1], "float32"], {}], "config": {"index": 24861163, "code_hash": null, "entity": [["tile_fc", "sp", [-1, 2, 16, 1]], ["tile_y", "sp", [-1, 1, 1, 10]], ["tile_x", "sp", [-1, 1, 55, 1]], ["tile_rcc", "sp", [-1, 1]], ["tile_ry", "sp", [-1, 1]], ["tile_rx", "sp", [-1, 3]], ["auto_unroll_max_step", "ot", 512], ["unroll_explicit", "ot", 1]]}, "result": [[0.33584743033333336], 0, 79.18628168106079, 1611786651.4102008], "version": 0.2, "tvm_version": "0.8.dev0"}
{"input": ["opencl -keys=adreno,opencl,gpu -device=adreno -max_num_threads=256", "conv2d_nchwc.opencl", [["TENSOR", [1, 32, 112, 112, 4], "float32"], ["TENSOR", [32, 128, 3, 3, 4], "float32"], [1, 1], [0, 0, 0, 0], [1, 1], "float32"], {}], "config": {"index": 24893139, "code_hash": null, "entity": [["tile_fc", "sp", [-1, 2, 16, 1]], ["tile_y", "sp", [-1, 1, 2, 5]], ["tile_x", "sp", [-1, 1, 11, 2]], ["tile_rcc", "sp", [-1, 1]], ["tile_ry", "sp", [-1, 1]], ["tile_rx", "sp", [-1, 3]], ["auto_unroll_max_step", "ot", 512], ["unroll_explicit", "ot", 1]]}, "result": [[0.17179512133333333], 0, 5.292977333068848, 1611786715.0381413], "version": 0.2, "tvm_version": "0.8.dev0"}
{"input": ["opencl -keys=adreno,opencl,gpu -device=adreno -max_num_threads=256", "conv2d_nchwc.opencl", [["TENSOR", [1, 32, 112, 112, 4], "float32"], ["TENSOR", [32, 128, 3, 3, 4], "float32"], [1, 1], [0, 0, 0, 0], [1, 1], "float32"], {}], "config": {"index": 30147284, "code_hash": null, "entity": [["tile_fc", "sp", [-1, 1, 32, 1]], ["tile_y", "sp", [-1, 1, 2, 5]], ["tile_x", "sp", [-1, 1, 1, 2]], ["tile_rcc", "sp", [-1, 32]], ["tile_ry", "sp", [-1, 3]], ["tile_rx", "sp", [-1, 1]], ["auto_unroll_max_step", "ot", 1500], ["unroll_explicit", "ot", 1]]}, "result": [[0.027313697666666668], 0, 8.262487649917603, 1611786718.2615001], "version": 0.2, "tvm_version": "0.8.dev0"}
{"input": ["opencl -keys=adreno,opencl,gpu -device=adreno -max_num_threads=256", "conv2d_nchwc.opencl", [["TENSOR", [1, 32, 112, 112, 4], "float32"], ["TENSOR", [32, 128, 3, 3, 4], "float32"], [1, 1], [0, 0, 0, 0], [1, 1], "float32"], {}], "config": {"index": 29849827, "code_hash": null, "entity": [["tile_fc", "sp", [-1, 1, 16, 2]], ["tile_y", "sp", [-1, 1, 2, 5]], ["tile_x", "sp", [-1, 1, 2, 1]], ["tile_rcc", "sp", [-1, 16]], ["tile_ry", "sp", [-1, 3]], ["tile_rx", "sp", [-1, 1]], ["auto_unroll_max_step", "ot", 1500], ["unroll_explicit", "ot", 1]]}, "result": [[0.026574895666666667], 0, 11.571921348571777, 1611786721.534277], "version": 0.2, "tvm_version": "0.8.dev0"}
{"input": ["opencl -keys=adreno,opencl,gpu -device=adreno -max_num_threads=256", "conv2d_nchwc.opencl", [["TENSOR", [1, 32, 112, 112, 4], "float32"], ["TENSOR", [32, 128, 3, 3, 4], "float32"], [1, 1], [0, 0, 0, 0], [1, 1], "float32"], {}], "config": {"index": 30161411, "code_hash": null, "entity": [["tile_fc", "sp", [-1, 1, 16, 2]], ["tile_y", "sp", [-1, 1, 1, 5]], ["tile_x", "sp", [-1, 1, 5, 2]], ["tile_rcc", "sp", [-1, 32]], ["tile_ry", "sp", [-1, 3]], ["tile_rx", "sp", [-1, 1]], ["auto_unroll_max_step", "ot", 1500], ["unroll_explicit", "ot", 1]]}, "result": [[0.041584097], 0, 15.147932291030884, 1611786724.940907], "version": 0.2, "tvm_version": "0.8.dev0"}
{"input": ["opencl -keys=adreno,opencl,gpu -device=adreno -max_num_threads=256", "conv2d_nchwc.opencl", [["TENSOR", [1, 32, 112, 112, 4], "float32"], ["TENSOR", [32, 128, 3, 3, 4], "float32"], [1, 1], [0, 0, 0, 0], [1, 1], "float32"], {}], "config": {"index": 19366612, "code_hash": null, "entity": [["tile_fc", "sp", [-1, 1, 32, 1]], ["tile_y", "sp", [-1, 1, 2, 5]], ["tile_x", "sp", [-1, 1, 1, 2]], ["tile_rcc", "sp", [-1, 1]], ["tile_ry", "sp", [-1, 1]], ["tile_rx", "sp", [-1, 3]], ["auto_unroll_max_step", "ot", 0], ["unroll_explicit", "ot", 1]]}, "result": [[0.03516447933333333], 0, 18.08203148841858, 1611786728.3681433], "version": 0.2, "tvm_version": "0.8.dev0"}
{"input": ["opencl -keys=adreno,opencl,gpu -device=adreno -max_num_threads=256", "conv2d_nchwc.opencl", [["TENSOR", [1, 32, 112, 112, 4], "float32"], ["TENSOR", [32, 128, 3, 3, 4], "float32"], [1, 1], [0, 0, 0, 0], [1, 1], "float32"], {}], "config": {"index": 22051028, "code_hash": null, "entity": [["tile_fc", "sp", [-1, 1, 32, 1]], ["tile_y", "sp", [-1, 1, 2, 5]], ["tile_x", "sp", [-1, 1, 2, 1]], ["tile_rcc", "sp", [-1, 1]], ["tile_ry", "sp", [-1, 1]], ["tile_rx", "sp", [-1, 1]], ["auto_unroll_max_step", "ot", 512], ["unroll_explicit", "ot", 1]]}, "result": [[0.06175223933333333], 0, 22.13166308403015, 1611786731.9896796], "version": 0.2, "tvm_version": "0.8.dev0"}
{"input": ["opencl -keys=adreno,opencl,gpu -device=adreno -max_num_threads=256", "conv2d_nchwc.opencl", [["TENSOR", [1, 32, 112, 112, 4], "float32"], ["TENSOR", [32, 128, 3, 3, 4], "float32"], [1, 1], [0, 0, 0, 0], [1, 1], "float32"], {}], "config": {"index": 30308844, "code_hash": null, "entity": [["tile_fc", "sp", [-1, 1, 32, 1]], ["tile_y", "sp", [-1, 1, 1, 10]], ["tile_x", "sp", [-1, 1, 2, 1]], ["tile_rcc", "sp", [-1, 1]], ["tile_ry", "sp", [-1, 1]], ["tile_rx", "sp", [-1, 3]], ["auto_unroll_max_step", "ot", 1500], ["unroll_explicit", "ot", 1]]}, "result": [[0.39597637166666666], 0, 28.92215609550476, 1611786738.717483], "version": 0.2, "tvm_version": "0.8.dev0"}
{"input": ["opencl -keys=adreno,opencl,gpu -device=adreno -max_num_threads=256", "conv2d_nchwc.opencl", [["TENSOR", [1, 32, 112, 112, 4], "float32"], ["TENSOR", [32, 128, 3, 3, 4], "float32"], [1, 1], [0, 0, 0, 0], [1, 1], "float32"], {}], "config": {"index": 24818154, "code_hash": null, "entity": [["tile_fc", "sp", [-1, 1, 16, 1]], ["tile_y", "sp", [-1, 1, 1, 10]], ["tile_x", "sp", [-1, 1, 5, 1]], ["tile_rcc", "sp", [-1, 1]], ["tile_ry", "sp", [-1, 1]], ["tile_rx", "sp", [-1, 3]], ["auto_unroll_max_step", "ot", 512], ["unroll_explicit", "ot", 1]]}, "result": [[0.232476684], 0, 88.33874940872192, 1611786798.1896029], "version": 0.2, "tvm_version": "0.8.dev0"}
{"input": ["opencl -keys=adreno,opencl,gpu -device=adreno -max_num_threads=256", "conv2d_nchwc.opencl", [["TENSOR", [1, 32, 112, 112, 4], "float32"], ["TENSOR", [32, 128, 3, 3, 4], "float32"], [1, 1], [0, 0, 0, 0], [1, 1], "float32"], {}], "config": {"index": 24885970, "code_hash": null, "entity": [["tile_fc", "sp", [-1, 1, 16, 1]], ["tile_y", "sp", [-1, 1, 2, 5]], ["tile_x", "sp", [-1, 1, 5, 2]], ["tile_rcc", "sp", [-1, 1]], ["tile_ry", "sp", [-1, 1]], ["tile_rx", "sp", [-1, 3]], ["auto_unroll_max_step", "ot", 512], ["unroll_explicit", "ot", 1]]}, "result": [[0.08042534733333333], 0, 118.12811827659607, 1611786987.260235], "version": 0.2, "tvm_version": "0.8.dev0"}
{"input": ["opencl -keys=adreno,opencl,gpu -device=adreno -max_num_threads=256", "conv2d_nchwc.opencl", [["TENSOR", [1, 32, 112, 112, 4], "float32"], ["TENSOR", [32, 128, 3, 3, 4], "float32"], [1, 1], [0, 0, 0, 0], [1, 1], "float32"], {}], "config": {"index": 22605318, "code_hash": null, "entity": [["tile_fc", "sp", [-1, 2, 1, 2]], ["tile_y", "sp", [-1, 1, 11, 1]], ["tile_x", "sp", [-1, 1, 55, 2]], ["tile_rcc", "sp", [-1, 4]], ["tile_ry", "sp", [-1, 1]], ["tile_rx", "sp", [-1, 1]], ["auto_unroll_max_step", "ot", 512], ["unroll_explicit", "ot", 1]]}, "result": [[0.955374826], 0, 133.08254480361938, 1611787002.1565275], "version": 0.2, "tvm_version": "0.8.dev0"}
{"input": ["opencl -keys=adreno,opencl,gpu -device=adreno -max_num_threads=256", "conv2d_nchwc.opencl", [["TENSOR", [1, 32, 112, 112, 4], "float32"], ["TENSOR", [32, 128, 3, 3, 4], "float32"], [1, 1], [0, 0, 0, 0], [1, 1], "float32"], {}], "config": {"index": 30179051, "code_hash": null, "entity": [["tile_fc", "sp", [-1, 1, 16, 2]], ["tile_y", "sp", [-1, 1, 5, 2]], ["tile_x", "sp", [-1, 1, 1, 5]], ["tile_rcc", "sp", [-1, 32]], ["tile_ry", "sp", [-1, 3]], ["tile_rx", "sp", [-1, 1]], ["auto_unroll_max_step", "ot", 1500], ["unroll_explicit", "ot", 1]]}, "result": [[0.04355180533333333], 0, 4.398303985595703, 1611787253.3824565], "version": 0.2, "tvm_version": "0.8.dev0"}
{"input": ["opencl -keys=adreno,opencl,gpu -device=adreno -max_num_threads=256", "conv2d_nchwc.opencl", [["TENSOR", [1, 32, 112, 112, 4], "float32"], ["TENSOR", [32, 128, 3, 3, 4], "float32"], [1, 1], [0, 0, 0, 0], [1, 1], "float32"], {}], "config": {"index": 13663979, "code_hash": null, "entity": [["tile_fc", "sp", [-1, 1, 16, 2]], ["tile_y", "sp", [-1, 1, 5, 2]], ["tile_x", "sp", [-1, 1, 1, 5]], ["tile_rcc", "sp", [-1, 32]], ["tile_ry", "sp", [-1, 3]], ["tile_rx", "sp", [-1, 1]], ["auto_unroll_max_step", "ot", 1500], ["unroll_explicit", "ot", 0]]}, "result": [[0.060253073], 0, 7.247348070144653, 1611787257.0028255], "version": 0.2, "tvm_version": "0.8.dev0"}
{"input": ["opencl -keys=adreno,opencl,gpu -device=adreno -max_num_threads=256", "conv2d_nchwc.opencl", [["TENSOR", [1, 32, 112, 112, 4], "float32"], ["TENSOR", [32, 128, 3, 3, 4], "float32"], [1, 1], [0, 0, 0, 0], [1, 1], "float32"], {}], "config": {"index": 30079468, "code_hash": null, "entity": [["tile_fc", "sp", [-1, 1, 32, 1]], ["tile_y", "sp", [-1, 1, 1, 10]], ["tile_x", "sp", [-1, 1, 2, 1]], ["tile_rcc", "sp", [-1, 32]], ["tile_ry", "sp", [-1, 3]], ["tile_rx", "sp", [-1, 1]], ["auto_unroll_max_step", "ot", 1500], ["unroll_explicit", "ot", 1]]}, "result": [[0.024488333333333334], 0, 10.556238889694214, 1611787260.2012115], "version": 0.2, "tvm_version": "0.8.dev0"}
{"input": ["opencl -keys=adreno,opencl,gpu -device=adreno -max_num_threads=256", "conv2d_nchwc.opencl", [["TENSOR", [1, 32, 112, 112, 4], "float32"], ["TENSOR", [32, 128, 3, 3, 4], "float32"], [1, 1], [0, 0, 0, 0], [1, 1], "float32"], {}], "config": {"index": 30079188, "code_hash": null, "entity": [["tile_fc", "sp", [-1, 1, 32, 1]], ["tile_y", "sp", [-1, 1, 2, 5]], ["tile_x", "sp", [-1, 1, 2, 1]], ["tile_rcc", "sp", [-1, 32]], ["tile_ry", "sp", [-1, 3]], ["tile_rx", "sp", [-1, 1]], ["auto_unroll_max_step", "ot", 1500], ["unroll_explicit", "ot", 1]]}, "result": [[0.02464319433333333], 0, 32.5781946182251, 1611787282.2232702], "version": 0.2, "tvm_version": "0.8.dev0"}
{"input": ["opencl -keys=adreno,opencl,gpu -device=adreno -max_num_threads=256", "conv2d_nchwc.opencl", [["TENSOR", [1, 32, 112, 112, 4], "float32"], ["TENSOR", [32, 128, 3, 3, 4], "float32"], [1, 1], [0, 0, 0, 0], [1, 1], "float32"], {}], "config": {"index": 30136827, "code_hash": null, "entity": [["tile_fc", "sp", [-1, 1, 16, 2]], ["tile_y", "sp", [-1, 1, 1, 10]], ["tile_x", "sp", [-1, 1, 55, 1]], ["tile_rcc", "sp", [-1, 32]], ["tile_ry", "sp", [-1, 3]], ["tile_rx", "sp", [-1, 1]], ["auto_unroll_max_step", "ot", 1500], ["unroll_explicit", "ot", 1]]}, "result": [[0.03477609366666667], 0, 36.401867151260376, 1611787285.5490882], "version": 0.2, "tvm_version": "0.8.dev0"}
{"input": ["opencl -keys=adreno,opencl,gpu -device=adreno -max_num_threads=256", "conv2d_nchwc.opencl", [["TENSOR", [1, 32, 112, 112, 4], "float32"], ["TENSOR", [32, 128, 3, 3, 4], "float32"], [1, 1], [0, 0, 0, 0], [1, 1], "float32"], {}], "config": {"index": 29634785, "code_hash": null, "entity": [["tile_fc", "sp", [-1, 1, 8, 2]], ["tile_y", "sp", [-1, 1, 2, 5]], ["tile_x", "sp", [-1, 1, 5, 1]], ["tile_rcc", "sp", [-1, 8]], ["tile_ry", "sp", [-1, 3]], ["tile_rx", "sp", [-1, 1]], ["auto_unroll_max_step", "ot", 1500], ["unroll_explicit", "ot", 1]]}, "result": [[0.45518342], 0, 64.59286785125732, 1611787313.3657007], "version": 0.2, "tvm_version": "0.8.dev0"}
{"input": ["opencl -keys=adreno,opencl,gpu -device=adreno -max_num_threads=256", "conv2d_nchwc.opencl", [["TENSOR", [1, 32, 112, 112, 4], "float32"], ["TENSOR", [32, 128, 3, 3, 4], "float32"], [1, 1], [0, 0, 0, 0], [1, 1], "float32"], {}], "config": {"index": 29405409, "code_hash": null, "entity": [["tile_fc", "sp", [-1, 1, 8, 2]], ["tile_y", "sp", [-1, 1, 2, 5]], ["tile_x", "sp", [-1, 1, 5, 1]], ["tile_rcc", "sp", [-1, 4]], ["tile_ry", "sp", [-1, 3]], ["tile_rx", "sp", [-1, 1]], ["auto_unroll_max_step", "ot", 1500], ["unroll_explicit", "ot", 1]]}, "result": [[0.5463328989999999], 0, 74.02155590057373, 1611787322.5082393], "version": 0.2, "tvm_version": "0.8.dev0"}
{"input": ["opencl -keys=adreno,opencl,gpu -device=adreno -max_num_threads=256", "conv2d_nchwc.opencl", [["TENSOR", [1, 32, 112, 112, 4], "float32"], ["TENSOR", [32, 128, 3, 3, 4], "float32"], [1, 1], [0, 0, 0, 0], [1, 1], "float32"], {}], "config": {"index": 29932035, "code_hash": null, "entity": [["tile_fc", "sp", [-1, 1, 16, 2]], ["tile_y", "sp", [-1, 1, 1, 5]], ["tile_x", "sp", [-1, 1, 5, 2]], ["tile_rcc", "sp", [-1, 16]], ["tile_ry", "sp", [-1, 3]], ["tile_rx", "sp", [-1, 1]], ["auto_unroll_max_step", "ot", 1500], ["unroll_explicit", "ot", 1]]}, "result": [[0.042208871333333335], 0, 93.78784966468811, 1611787343.097726], "version": 0.2, "tvm_version": "0.8.dev0"}
{"input": ["opencl -keys=adreno,opencl,gpu -device=adreno -max_num_threads=256", "conv2d_nchwc.opencl", [["TENSOR", [1, 32, 112, 112, 4], "float32"], ["TENSOR", [32, 128, 3, 3, 4], "float32"], [1, 1], [0, 0, 0, 0], [1, 1], "float32"], {}], "config": {"index": 28473571, "code_hash": null, "entity": [["tile_fc", "sp", [-1, 1, 16, 2]], ["tile_y", "sp", [-1, 1, 2, 5]], ["tile_x", "sp", [-1, 1, 2, 1]], ["tile_rcc", "sp", [-1, 16]], ["tile_ry", "sp", [-1, 1]], ["tile_rx", "sp", [-1, 1]], ["auto_unroll_max_step", "ot", 1500], ["unroll_explicit", "ot", 1]]}, "result": [[0.371756406], 0, 100.74871468544006, 1611787349.9266872], "version": 0.2, "tvm_version": "0.8.dev0"}
{"input": ["opencl -keys=adreno,opencl,gpu -device=adreno -max_num_threads=256", "conv2d_nchwc.opencl", [["TENSOR", [1, 32, 112, 112, 4], "float32"], ["TENSOR", [32, 128, 3, 3, 4], "float32"], [1, 1], [0, 0, 0, 0], [1, 1], "float32"], {}], "config": {"index": 30136811, "code_hash": null, "entity": [["tile_fc", "sp", [-1, 2, 16, 1]], ["tile_y", "sp", [-1, 1, 1, 10]], ["tile_x", "sp", [-1, 1, 55, 1]], ["tile_rcc", "sp", [-1, 32]], ["tile_ry", "sp", [-1, 3]], ["tile_rx", "sp", [-1, 1]], ["auto_unroll_max_step", "ot", 1500], ["unroll_explicit", "ot", 1]]}, "result": [[0.041411736], 0, 104.00217390060425, 1611787353.4232008], "version": 0.2, "tvm_version": "0.8.dev0"}
{"input": ["opencl -keys=adreno,opencl,gpu -device=adreno -max_num_threads=256", "conv2d_nchwc.opencl", [["TENSOR", [1, 32, 112, 112, 4], "float32"], ["TENSOR", [32, 128, 3, 3, 4], "float32"], [1, 1], [0, 0, 0, 0], [1, 1], "float32"], {}], "config": {"index": 27556052, "code_hash": null, "entity": [["tile_fc", "sp", [-1, 1, 32, 1]], ["tile_y", "sp", [-1, 1, 2, 5]], ["tile_x", "sp", [-1, 1, 2, 1]], ["tile_rcc", "sp", [-1, 1]], ["tile_ry", "sp", [-1, 1]], ["tile_rx", "sp", [-1, 1]], ["auto_unroll_max_step", "ot", 1500], ["unroll_explicit", "ot", 1]]}, "result": [[0.063741389], 0, 3.8946900367736816, 1611787359.127511], "version": 0.2, "tvm_version": "0.8.dev0"}
{"input": ["opencl -keys=adreno,opencl,gpu -device=adreno -max_num_threads=256", "conv2d_nchwc.opencl", [["TENSOR", [1, 32, 112, 112, 4], "float32"], ["TENSOR", [32, 128, 3, 3, 4], "float32"], [1, 1], [0, 0, 0, 0], [1, 1], "float32"], {}], "config": {"index": 21564077, "code_hash": null, "entity": [["tile_fc", "sp", [-1, 1, 8, 4]], ["tile_y", "sp", [-1, 1, 1, 11]], ["tile_x", "sp", [-1, 1, 1, 1]], ["tile_rcc", "sp", [-1, 16]], ["tile_ry", "sp", [-1, 3]], ["tile_rx", "sp", [-1, 3]], ["auto_unroll_max_step", "ot", 0], ["unroll_explicit", "ot", 1]]}, "result": [[0.8268865446666666], 0, 14.617833375930786, 1611787369.9413755], "version": 0.2, "tvm_version": "0.8.dev0"}
{"input": ["opencl -keys=adreno,opencl,gpu -device=adreno -max_num_threads=256", "conv2d_nchwc.opencl", [["TENSOR", [1, 32, 112, 112, 4], "float32"], ["TENSOR", [32, 128, 3, 3, 4], "float32"], [1, 1], [0, 0, 0, 0], [1, 1], "float32"], {}], "config": {"index": 29932242, "code_hash": null, "entity": [["tile_fc", "sp", [-1, 1, 16, 1]], ["tile_y", "sp", [-1, 1, 2, 5]], ["tile_x", "sp", [-1, 1, 5, 2]], ["tile_rcc", "sp", [-1, 16]], ["tile_ry", "sp", [-1, 3]], ["tile_rx", "sp", [-1, 1]], ["auto_unroll_max_step", "ot", 1500], ["unroll_explicit", "ot", 1]]}, "result": [[0.031676753333333335], 0, 18.172260284423828, 1611787373.360439], "version": 0.2, "tvm_version": "0.8.dev0"}
{"input": ["opencl -keys=adreno,opencl,gpu -device=adreno -max_num_threads=256", "conv2d_nchwc.opencl", [["TENSOR", [1, 32, 112, 112, 4], "float32"], ["TENSOR", [32, 128, 3, 3, 4], "float32"], [1, 1], [0, 0, 0, 0], [1, 1], "float32"], {}], "config": {"index": 28487905, "code_hash": null, "entity": [["tile_fc", "sp", [-1, 1, 8, 2]], ["tile_y", "sp", [-1, 1, 2, 5]], ["tile_x", "sp", [-1, 1, 5, 1]], ["tile_rcc", "sp", [-1, 16]], ["tile_ry", "sp", [-1, 1]], ["tile_rx", "sp", [-1, 1]], ["auto_unroll_max_step", "ot", 1500], ["unroll_explicit", "ot", 1]]}, "result": [[0.34043822900000004], 0, 25.65166687965393, 1611787379.9623716], "version": 0.2, "tvm_version": "0.8.dev0"}
{"input": ["opencl -keys=adreno,opencl,gpu -device=adreno -max_num_threads=256", "conv2d_nchwc.opencl", [["TENSOR", [1, 32, 112, 112, 4], "float32"], ["TENSOR", [32, 128, 3, 3, 4], "float32"], [1, 1], [0, 0, 0, 0], [1, 1], "float32"], {}], "config": {"index": 31455724, "code_hash": null, "entity": [["tile_fc", "sp", [-1, 1, 32, 1]], ["tile_y", "sp", [-1, 1, 1, 10]], ["tile_x", "sp", [-1, 1, 2, 1]], ["tile_rcc", "sp", [-1, 32]], ["tile_ry", "sp", [-1, 1]], ["tile_rx", "sp", [-1, 3]], ["auto_unroll_max_step", "ot", 1500], ["unroll_explicit", "ot", 1]]}, "result": [[0.05812713533333333], 0, 28.322248935699463, 1611787383.5353634], "version": 0.2, "tvm_version": "0.8.dev0"}
{"input": ["opencl -keys=adreno,opencl,gpu -device=adreno -max_num_threads=256", "conv2d_nchwc.opencl", [["TENSOR", [1, 32, 112, 112, 4], "float32"], ["TENSOR", [32, 128, 3, 3, 4], "float32"], [1, 1], [0, 0, 0, 0], [1, 1], "float32"], {}], "config": {"index": 24656609, "code_hash": null, "entity": [["tile_fc", "sp", [-1, 1, 8, 2]], ["tile_y", "sp", [-1, 1, 2, 5]], ["tile_x", "sp", [-1, 1, 5, 2]], ["tile_rcc", "sp", [-1, 32]], ["tile_ry", "sp", [-1, 3]], ["tile_rx", "sp", [-1, 1]], ["auto_unroll_max_step", "ot", 512], ["unroll_explicit", "ot", 1]]}, "result": [[0.042327847], 0, 32.12526273727417, 1611787387.0503652], "version": 0.2, "tvm_version": "0.8.dev0"}
{"input": ["opencl -keys=adreno,opencl,gpu -device=adreno -max_num_threads=256", "conv2d_nchwc.opencl", [["TENSOR", [1, 32, 112, 112, 4], "float32"], ["TENSOR", [32, 128, 3, 3, 4], "float32"], [1, 1], [0, 0, 0, 0], [1, 1], "float32"], {}], "config": {"index": 28731602, "code_hash": null, "entity": [["tile_fc", "sp", [-1, 1, 16, 1]], ["tile_y", "sp", [-1, 1, 2, 5]], ["tile_x", "sp", [-1, 1, 10, 1]], ["tile_rcc", "sp", [-1, 32]], ["tile_ry", "sp", [-1, 1]], ["tile_rx", "sp", [-1, 1]], ["auto_unroll_max_step", "ot", 1500], ["unroll_explicit", "ot", 1]]}, "result": [[0.5297739406666667], 0, 59.6484854221344, 1611787414.299825], "version": 0.2, "tvm_version": "0.8.dev0"}
{"input": ["opencl -keys=adreno,opencl,gpu -device=adreno -max_num_threads=256", "conv2d_nchwc.opencl", [["TENSOR", [1, 32, 112, 112, 4], "float32"], ["TENSOR", [32, 128, 3, 3, 4], "float32"], [1, 1], [0, 0, 0, 0], [1, 1], "float32"], {}], "config": {"index": 19270122, "code_hash": null, "entity": [["tile_fc", "sp", [-1, 1, 16, 1]], ["tile_y", "sp", [-1, 1, 1, 10]], ["tile_x", "sp", [-1, 1, 1, 1]], ["tile_rcc", "sp", [-1, 1]], ["tile_ry", "sp", [-1, 1]], ["tile_rx", "sp", [-1, 3]], ["auto_unroll_max_step", "ot", 0], ["unroll_explicit", "ot", 1]]}, "result": [[0.11370626733333333], 0, 81.17087149620056, 1611787436.672949], "version": 0.2, "tvm_version": "0.8.dev0"}
{"input": ["opencl -keys=adreno,opencl,gpu -device=adreno -max_num_threads=256", "conv2d_nchwc.opencl", [["TENSOR", [1, 32, 112, 112, 4], "float32"], ["TENSOR", [32, 128, 3, 3, 4], "float32"], [1, 1], [0, 0, 0, 0], [1, 1], "float32"], {}], "config": {"index": 28784858, "code_hash": null, "entity": [["tile_fc", "sp", [-1, 1, 16, 1]], ["tile_y", "sp", [-1, 1, 5, 2]], ["tile_x", "sp", [-1, 1, 5, 2]], ["tile_rcc", "sp", [-1, 32]], ["tile_ry", "sp", [-1, 1]], ["tile_rx", "sp", [-1, 1]], ["auto_unroll_max_step", "ot", 1500], ["unroll_explicit", "ot", 1]]}, "result": [[0.223462309], 0, 87.16833877563477, 1611787442.011506], "version": 0.2, "tvm_version": "0.8.dev0"}
{"input": ["opencl -keys=adreno,opencl,gpu -device=adreno -max_num_threads=256", "conv2d_nchwc.opencl", [["TENSOR", [1, 32, 112, 112, 4], "float32"], ["TENSOR", [32, 128, 3, 3, 4], "float32"], [1, 1], [0, 0, 0, 0], [1, 1], "float32"], {}], "config": {"index": 28760571, "code_hash": null, "entity": [["tile_fc", "sp", [-1, 1, 16, 2]], ["tile_y", "sp", [-1, 1, 1, 10]], ["tile_x", "sp", [-1, 1, 55, 1]], ["tile_rcc", "sp", [-1, 32]], ["tile_ry", "sp", [-1, 1]], ["tile_rx", "sp", [-1, 1]], ["auto_unroll_max_step", "ot", 1500], ["unroll_explicit", "ot", 1]]}, "result": [[0.042397777666666664], 0, 3.670377254486084, 1611787657.959734], "version": 0.2, "tvm_version": "0.8.dev0"}
{"input": ["opencl -keys=adreno,opencl,gpu -device=adreno -max_num_threads=256", "conv2d_nchwc.opencl", [["TENSOR", [1, 32, 112, 112, 4], "float32"], ["TENSOR", [32, 128, 3, 3, 4], "float32"], [1, 1], [0, 0, 0, 0], [1, 1], "float32"], {}], "config": {"index": 30280170, "code_hash": null, "entity": [["tile_fc", "sp", [-1, 1, 16, 1]], ["tile_y", "sp", [-1, 1, 1, 10]], ["tile_x", "sp", [-1, 1, 1, 1]], ["tile_rcc", "sp", [-1, 1]], ["tile_ry", "sp", [-1, 1]], ["tile_rx", "sp", [-1, 3]], ["auto_unroll_max_step", "ot", 1500], ["unroll_explicit", "ot", 1]]}, "result": [[0.21520074633333333], 0, 25.045546770095825, 1611787678.9706092], "version": 0.2, "tvm_version": "0.8.dev0"}
{"input": ["opencl -keys=adreno,opencl,gpu -device=adreno -max_num_threads=256", "conv2d_nchwc.opencl", [["TENSOR", [1, 32, 112, 112, 4], "float32"], ["TENSOR", [32, 128, 3, 3, 4], "float32"], [1, 1], [0, 0, 0, 0], [1, 1], "float32"], {}], "config": {"index": 29620451, "code_hash": null, "entity": [["tile_fc", "sp", [-1, 1, 16, 2]], ["tile_y", "sp", [-1, 1, 2, 5]], ["tile_x", "sp", [-1, 1, 2, 1]], ["tile_rcc", "sp", [-1, 8]], ["tile_ry", "sp", [-1, 3]], ["tile_rx", "sp", [-1, 1]], ["auto_unroll_max_step", "ot", 1500], ["unroll_explicit", "ot", 1]]}, "result": [[0.5449955903333333], 0, 77.26864385604858, 1611787730.227731], "version": 0.2, "tvm_version": "0.8.dev0"}
{"input": ["opencl -keys=adreno,opencl,gpu -device=adreno -max_num_threads=256", "conv2d_nchwc.opencl", [["TENSOR", [1, 32, 112, 112, 4], "float32"], ["TENSOR", [32, 128, 3, 3, 4], "float32"], [1, 1], [0, 0, 0, 0], [1, 1], "float32"], {}], "config": {"index": 28717283, "code_hash": null, "entity": [["tile_fc", "sp", [-1, 1, 16, 2]], ["tile_y", "sp", [-1, 1, 2, 5]], ["tile_x", "sp", [-1, 1, 5, 1]], ["tile_rcc", "sp", [-1, 32]], ["tile_ry", "sp", [-1, 1]], ["tile_rx", "sp", [-1, 1]], ["auto_unroll_max_step", "ot", 1500], ["unroll_explicit", "ot", 1]]}, "result": [[0.6183615450000001], 0, 87.35170578956604, 1611787740.3137255], "version": 0.2, "tvm_version": "0.8.dev0"}
{"input": ["opencl -keys=adreno,opencl,gpu -device=adreno -max_num_threads=256", "conv2d_nchwc.opencl", [["TENSOR", [1, 32, 112, 112, 4], "float32"], ["TENSOR", [32, 128, 3, 3, 4], "float32"], [1, 1], [0, 0, 0, 0], [1, 1], "float32"], {}], "config": {"index": 31427052, "code_hash": null, "entity": [["tile_fc", "sp", [-1, 1, 32, 1]], ["tile_y", "sp", [-1, 1, 1, 10]], ["tile_x", "sp", [-1, 1, 1, 1]], ["tile_rcc", "sp", [-1, 32]], ["tile_ry", "sp", [-1, 1]], ["tile_rx", "sp", [-1, 3]], ["auto_unroll_max_step", "ot", 1500], ["unroll_explicit", "ot", 1]]}, "result": [[0.10866251733333333], 0, 90.21142864227295, 1611787744.4484777], "version": 0.2, "tvm_version": "0.8.dev0"}
{"input": ["opencl -keys=adreno,opencl,gpu -device=adreno -max_num_threads=256", "conv2d_nchwc.opencl", [["TENSOR", [1, 32, 112, 112, 4], "float32"], ["TENSOR", [32, 128, 3, 3, 4], "float32"], [1, 1], [0, 0, 0, 0], [1, 1], "float32"], {}], "config": {"index": 21889773, "code_hash": null, "entity": [["tile_fc", "sp", [-1, 1, 8, 4]], ["tile_y", "sp", [-1, 1, 2, 5]], ["tile_x", "sp", [-1, 1, 1, 2]], ["tile_rcc", "sp", [-1, 32]], ["tile_ry", "sp", [-1, 3]], ["tile_rx", "sp", [-1, 3]], ["auto_unroll_max_step", "ot", 0], ["unroll_explicit", "ot", 1]]}, "result": [[0.8778199476666666], 0, 100.97031474113464, 1611787755.558305], "version": 0.2, "tvm_version": "0.8.dev0"}
{"input": ["opencl -keys=adreno,opencl,gpu -device=adreno -max_num_threads=256", "conv2d_nchwc.opencl", [["TENSOR", [1, 32, 112, 112, 4], "float32"], ["TENSOR", [32, 128, 3, 3, 4], "float32"], [1, 1], [0, 0, 0, 0], [1, 1], "float32"], {}], "config": {"index": 19366610, "code_hash": null, "entity": [["tile_fc", "sp", [-1, 1, 16, 1]], ["tile_y", "sp", [-1, 1, 2, 5]], ["tile_x", "sp", [-1, 1, 1, 2]], ["tile_rcc", "sp", [-1, 1]], ["tile_ry", "sp", [-1, 1]], ["tile_rx", "sp", [-1, 3]], ["auto_unroll_max_step", "ot", 0], ["unroll_explicit", "ot", 1]]}, "result": [[0.06074074633333334], 0, 3.8108654022216797, 1611787761.152359], "version": 0.2, "tvm_version": "0.8.dev0"}
{"input": ["opencl -keys=adreno,opencl,gpu -device=adreno -max_num_threads=256", "conv2d_nchwc.opencl", [["TENSOR", [1, 32, 112, 112, 4], "float32"], ["TENSOR", [32, 128, 3, 3, 4], "float32"], [1, 1], [0, 0, 0, 0], [1, 1], "float32"], {}], "config": {"index": 28531195, "code_hash": null, "entity": [["tile_fc", "sp", [-1, 1, 16, 2]], ["tile_y", "sp", [-1, 1, 1, 10]], ["tile_x", "sp", [-1, 1, 55, 1]], ["tile_rcc", "sp", [-1, 16]], ["tile_ry", "sp", [-1, 1]], ["tile_rx", "sp", [-1, 1]], ["auto_unroll_max_step", "ot", 1500], ["unroll_explicit", "ot", 1]]}, "result": [[0.5545319443333333], 0, 14.604684114456177, 1611787770.528176], "version": 0.2, "tvm_version": "0.8.dev0"}
{"input": ["opencl -keys=adreno,opencl,gpu -device=adreno -max_num_threads=256", "conv2d_nchwc.opencl", [["TENSOR", [1, 32, 112, 112, 4], "float32"], ["TENSOR", [32, 128, 3, 3, 4], "float32"], [1, 1], [0, 0, 0, 0], [1, 1], "float32"], {}], "config": {"index": 23255545, "code_hash": null, "entity": [["tile_fc", "sp", [-1, 1, 8, 2]], ["tile_y", "sp", [-1, 1, 1, 10]], ["tile_x", "sp", [-1, 1, 55, 1]], ["tile_rcc", "sp", [-1, 32]], ["tile_ry", "sp", [-1, 1]], ["tile_rx", "sp", [-1, 1]], ["auto_unroll_max_step", "ot", 512], ["unroll_explicit", "ot", 1]]}, "result": [[0.042461544999999996], 0, 16.81201410293579, 1611787773.902021], "version": 0.2, "tvm_version": "0.8.dev0"}
{"input": ["opencl -keys=adreno,opencl,gpu -device=adreno -max_num_threads=256", "conv2d_nchwc.opencl", [["TENSOR", [1, 32, 112, 112, 4], "float32"], ["TENSOR", [32, 128, 3, 3, 4], "float32"], [1, 1], [0, 0, 0, 0], [1, 1], "float32"], {}], "config": {"index": 13564396, "code_hash": null, "entity": [["tile_fc", "sp", [-1, 1, 32, 1]], ["tile_y", "sp", [-1, 1, 1, 10]], ["tile_x", "sp", [-1, 1, 2, 1]], ["tile_rcc", "sp", [-1, 32]], ["tile_ry", "sp", [-1, 3]], ["tile_rx", "sp", [-1, 1]], ["auto_unroll_max_step", "ot", 1500], ["unroll_explicit", "ot", 0]]}, "result": [[0.037525364666666665], 0, 19.750587224960327, 1611787777.2291794], "version": 0.2, "tvm_version": "0.8.dev0"}
{"input": ["opencl -keys=adreno,opencl,gpu -device=adreno -max_num_threads=256", "conv2d_nchwc.opencl", [["TENSOR", [1, 32, 112, 112, 4], "float32"], ["TENSOR", [32, 128, 3, 3, 4], "float32"], [1, 1], [0, 0, 0, 0], [1, 1], "float32"], {}], "config": {"index": 22146544, "code_hash": null, "entity": [["tile_fc", "sp", [-1, 1, 1, 1]], ["tile_y", "sp", [-1, 1, 11, 1]], ["tile_x", "sp", [-1, 1, 55, 2]], ["tile_rcc", "sp", [-1, 1]], ["tile_ry", "sp", [-1, 1]], ["tile_rx", "sp", [-1, 1]], ["auto_unroll_max_step", "ot", 512], ["unroll_explicit", "ot", 1]]}, "result": [[0.09072034733333334], 0, 44.211180448532104, 1611787801.472809], "version": 0.2, "tvm_version": "0.8.dev0"}
{"input": ["opencl -keys=adreno,opencl,gpu -device=adreno -max_num_threads=256", "conv2d_nchwc.opencl", [["TENSOR", [1, 32, 112, 112, 4], "float32"], ["TENSOR", [32, 128, 3, 3, 4], "float32"], [1, 1], [0, 0, 0, 0], [1, 1], "float32"], {}], "config": {"index": 22605296, "code_hash": null, "entity": [["tile_fc", "sp", [-1, 1, 1, 1]], ["tile_y", "sp", [-1, 1, 11, 1]], ["tile_x", "sp", [-1, 1, 55, 2]], ["tile_rcc", "sp", [-1, 4]], ["tile_ry", "sp", [-1, 1]], ["tile_rx", "sp", [-1, 1]], ["auto_unroll_max_step", "ot", 512], ["unroll_explicit", "ot", 1]]}, "result": [[0.628984913], 0, 53.559786558151245, 1611787810.763633], "version": 0.2, "tvm_version": "0.8.dev0"}
{"input": ["opencl -keys=adreno,opencl,gpu -device=adreno -max_num_threads=256", "conv2d_nchwc.opencl", [["TENSOR", [1, 32, 112, 112, 4], "float32"], ["TENSOR", [32, 128, 3, 3, 4], "float32"], [1, 1], [0, 0, 0, 0], [1, 1], "float32"], {}], "config": {"index": 31523555, "code_hash": null, "entity": [["tile_fc", "sp", [-1, 1, 16, 2]], ["tile_y", "sp", [-1, 1, 2, 5]], ["tile_x", "sp", [-1, 1, 1, 2]], ["tile_rcc", "sp", [-1, 32]], ["tile_ry", "sp", [-1, 1]], ["tile_rx", "sp", [-1, 3]], ["auto_unroll_max_step", "ot", 1500], ["unroll_explicit", "ot", 1]]}, "result": [[0.113885625], 0, 62.88007593154907, 1611787819.800981], "version": 0.2, "tvm_version": "0.8.dev0"}
{"input": ["opencl -keys=adreno,opencl,gpu -device=adreno -max_num_threads=256", "conv2d_nchwc.opencl", [["TENSOR", [1, 32, 112, 112, 4], "float32"], ["TENSOR", [32, 128, 3, 3, 4], "float32"], [1, 1], [0, 0, 0, 0], [1, 1], "float32"], {}], "config": {"index": 8260074, "code_hash": null, "entity": [["tile_fc", "sp", [-1, 1, 16, 1]], ["tile_y", "sp", [-1, 1, 1, 10]], ["tile_x", "sp", [-1, 1, 1, 1]], ["tile_rcc", "sp", [-1, 1]], ["tile_ry", "sp", [-1, 1]], ["tile_rx", "sp", [-1, 3]], ["auto_unroll_max_step", "ot", 512], ["unroll_explicit", "ot", 0]]}, "result": [[0.19836967033333333], 0, 5.238161563873291, 1611787902.0145218], "version": 0.2, "tvm_version": "0.8.dev0"}
{"input": ["opencl -keys=adreno,opencl,gpu -device=adreno -max_num_threads=256", "conv2d_nchwc.opencl", [["TENSOR", [1, 32, 112, 112, 4], "float32"], ["TENSOR", [32, 128, 3, 3, 4], "float32"], [1, 1], [0, 0, 0, 0], [1, 1], "float32"], {}], "config": {"index": 29391075, "code_hash": null, "entity": [["tile_fc", "sp", [-1, 1, 16, 2]], ["tile_y", "sp", [-1, 1, 2, 5]], ["tile_x", "sp", [-1, 1, 2, 1]], ["tile_rcc", "sp", [-1, 4]], ["tile_ry", "sp", [-1, 3]], ["tile_rx", "sp", [-1, 1]], ["auto_unroll_max_step", "ot", 1500], ["unroll_explicit", "ot", 1]]}, "result": [[0.5115362843333333], 0, 34.72812294960022, 1611787930.2154171], "version": 0.2, "tvm_version": "0.8.dev0"}
{"input": ["opencl -keys=adreno,opencl,gpu -device=adreno -max_num_threads=256", "conv2d_nchwc.opencl", [["TENSOR", [1, 32, 112, 112, 4], "float32"], ["TENSOR", [32, 128, 3, 3, 4], "float32"], [1, 1], [0, 0, 0, 0], [1, 1], "float32"], {}], "config": {"index": 19270123, "code_hash": null, "entity": [["tile_fc", "sp", [-1, 2, 16, 1]], ["tile_y", "sp", [-1, 1, 1, 10]], ["tile_x", "sp", [-1, 1, 1, 1]], ["tile_rcc", "sp", [-1, 1]], ["tile_ry", "sp", [-1, 1]], ["tile_rx", "sp", [-1, 3]], ["auto_unroll_max_step", "ot", 0], ["unroll_explicit", "ot", 1]]}, "result": [[0.10234409733333333], 0, 37.43217921257019, 1611787934.2618232], "version": 0.2, "tvm_version": "0.8.dev0"}
{"input": ["opencl -keys=adreno,opencl,gpu -device=adreno -max_num_threads=256", "conv2d_nchwc.opencl", [["TENSOR", [1, 32, 112, 112, 4], "float32"], ["TENSOR", [32, 128, 3, 3, 4], "float32"], [1, 1], [0, 0, 0, 0], [1, 1], "float32"], {}], "config": {"index": 23254861, "code_hash": null, "entity": [["tile_fc", "sp", [-1, 1, 1, 2]], ["tile_y", "sp", [-1, 1, 11, 2]], ["tile_x", "sp", [-1, 1, 55, 1]], ["tile_rcc", "sp", [-1, 32]], ["tile_ry", "sp", [-1, 1]], ["tile_rx", "sp", [-1, 1]], ["auto_unroll_max_step", "ot", 512], ["unroll_explicit", "ot", 1]]}, "result": [[0.7881109373333333], 0, 49.21469736099243, 1611787945.027767], "version": 0.2, "tvm_version": "0.8.dev0"}
{"input": ["opencl -keys=adreno,opencl,gpu -device=adreno -max_num_threads=256", "conv2d_nchwc.opencl", [["TENSOR", [1, 32, 112, 112, 4], "float32"], ["TENSOR", [32, 128, 3, 3, 4], "float32"], [1, 1], [0, 0, 0, 0], [1, 1], "float32"], {}], "config": {"index": 12187875, "code_hash": null, "entity": [["tile_fc", "sp", [-1, 1, 16, 2]], ["tile_y", "sp", [-1, 1, 2, 5]], ["tile_x", "sp", [-1, 1, 2, 1]], ["tile_rcc", "sp", [-1, 32]], ["tile_ry", "sp", [-1, 1]], ["tile_rx", "sp", [-1, 1]], ["auto_unroll_max_step", "ot", 1500], ["unroll_explicit", "ot", 0]]}, "result": [[0.03234501733333333], 0, 51.45155572891235, 1611787948.3558156], "version": 0.2, "tvm_version": "0.8.dev0"}
{"input": ["opencl -keys=adreno,opencl,gpu -device=adreno -max_num_threads=256", "conv2d_nchwc.opencl", [["TENSOR", [1, 32, 112, 112, 4], "float32"], ["TENSOR", [32, 128, 3, 3, 4], "float32"], [1, 1], [0, 0, 0, 0], [1, 1], "float32"], {}], "config": {"index": 23197923, "code_hash": null, "entity": [["tile_fc", "sp", [-1, 1, 16, 2]], ["tile_y", "sp", [-1, 1, 2, 5]], ["tile_x", "sp", [-1, 1, 2, 1]], ["tile_rcc", "sp", [-1, 32]], ["tile_ry", "sp", [-1, 1]], ["tile_rx", "sp", [-1, 1]], ["auto_unroll_max_step", "ot", 512], ["unroll_explicit", "ot", 1]]}, "result": [[0.030592118], 0, 55.136780977249146, 1611787951.677518], "version": 0.2, "tvm_version": "0.8.dev0"}
{"input": ["opencl -keys=adreno,opencl,gpu -device=adreno -max_num_threads=256", "conv2d_nchwc.opencl", [["TENSOR", [1, 32, 112, 112, 4], "float32"], ["TENSOR", [32, 128, 3, 3, 4], "float32"], [1, 1], [0, 0, 0, 0], [1, 1], "float32"], {}], "config": {"index": 17788421, "code_hash": null, "entity": [["tile_fc", "sp", [-1, 1, 1, 2]], ["tile_y", "sp", [-1, 1, 11, 1]], ["tile_x", "sp", [-1, 1, 55, 2]], ["tile_rcc", "sp", [-1, 32]], ["tile_ry", "sp", [-1, 1]], ["tile_rx", "sp", [-1, 1]], ["auto_unroll_max_step", "ot", 0], ["unroll_explicit", "ot", 1]]}, "result": [[0.069682795], 0, 3.893143892288208, 1611788184.390881], "version": 0.2, "tvm_version": "0.8.dev0"}
{"input": ["opencl -keys=adreno,opencl,gpu -device=adreno -max_num_threads=256", "conv2d_nchwc.opencl", [["TENSOR", [1, 32, 112, 112, 4], "float32"], ["TENSOR", [32, 128, 3, 3, 4], "float32"], [1, 1], [0, 0, 0, 0], [1, 1], "float32"], {}], "config": {"index": 24669680, "code_hash": null, "entity": [["tile_fc", "sp", [-1, 1, 1, 1]], ["tile_y", "sp", [-1, 1, 11, 1]], ["tile_x", "sp", [-1, 1, 55, 2]], ["tile_rcc", "sp", [-1, 32]], ["tile_ry", "sp", [-1, 3]], ["tile_rx", "sp", [-1, 1]], ["auto_unroll_max_step", "ot", 512], ["unroll_explicit", "ot", 1]]}, "result": [[0.23417965266666665], 0, 9.182981491088867, 1611788189.6632943], "version": 0.2, "tvm_version": "0.8.dev0"}
{"input": ["opencl -keys=adreno,opencl,gpu -device=adreno -max_num_threads=256", "conv2d_nchwc.opencl", [["TENSOR", [1, 32, 112, 112, 4], "float32"], ["TENSOR", [32, 128, 3, 3, 4], "float32"], [1, 1], [0, 0, 0, 0], [1, 1], "float32"], {}], "config": {"index": 19164677, "code_hash": null, "entity": [["tile_fc", "sp", [-1, 1, 1, 2]], ["tile_y", "sp", [-1, 1, 11, 1]], ["tile_x", "sp", [-1, 1, 55, 2]], ["tile_rcc", "sp", [-1, 32]], ["tile_ry", "sp", [-1, 3]], ["tile_rx", "sp", [-1, 1]], ["auto_unroll_max_step", "ot", 0], ["unroll_explicit", "ot", 1]]}, "result": [[0.05341795133333333], 0, 12.968734741210938, 1611788193.156398], "version": 0.2, "tvm_version": "0.8.dev0"}
{"input": ["opencl -keys=adreno,opencl,gpu -device=adreno -max_num_threads=256", "conv2d_nchwc.opencl", [["TENSOR", [1, 32, 112, 112, 4], "float32"], ["TENSOR", [32, 128, 3, 3, 4], "float32"], [1, 1], [0, 0, 0, 0], [1, 1], "float32"], {}], "config": {"index": 6778373, "code_hash": null, "entity": [["tile_fc", "sp", [-1, 1, 1, 2]], ["tile_y", "sp", [-1, 1, 11, 1]], ["tile_x", "sp", [-1, 1, 55, 2]], ["tile_rcc", "sp", [-1, 32]], ["tile_ry", "sp", [-1, 1]], ["tile_rx", "sp", [-1, 1]], ["auto_unroll_max_step", "ot", 512], ["unroll_explicit", "ot", 0]]}, "result": [[0.07168618033333334], 0, 16.526514291763306, 1611788196.7607822], "version": 0.2, "tvm_version": "0.8.dev0"}
{"input": ["opencl -keys=adreno,opencl,gpu -device=adreno -max_num_threads=256", "conv2d_nchwc.opencl", [["TENSOR", [1, 32, 112, 112, 4], "float32"], ["TENSOR", [32, 128, 3, 3, 4], "float32"], [1, 1], [0, 0, 0, 0], [1, 1], "float32"], {}], "config": {"index": 22107981, "code_hash": null, "entity": [["tile_fc", "sp", [-1, 1, 1, 2]], ["tile_y", "sp", [-1, 1, 11, 2]], ["tile_x", "sp", [-1, 1, 55, 1]], ["tile_rcc", "sp", [-1, 1]], ["tile_ry", "sp", [-1, 1]], ["tile_rx", "sp", [-1, 1]], ["auto_unroll_max_step", "ot", 512], ["unroll_explicit", "ot", 1]]}, "result": [[0.11455180533333333], 0, 20.84617853164673, 1611788200.9431632], "version": 0.2, "tvm_version": "0.8.dev0"}
{"input": ["opencl -keys=adreno,opencl,gpu -device=adreno -max_num_threads=256", "conv2d_nchwc.opencl", [["TENSOR", [1, 32, 112, 112, 4], "float32"], ["TENSOR", [32, 128, 3, 3, 4], "float32"], [1, 1], [0, 0, 0, 0], [1, 1], "float32"], {}], "config": {"index": 5631472, "code_hash": null, "entity": [["tile_fc", "sp", [-1, 1, 1, 1]], ["tile_y", "sp", [-1, 1, 11, 1]], ["tile_x", "sp", [-1, 1, 55, 2]], ["tile_rcc", "sp", [-1, 1]], ["tile_ry", "sp", [-1, 1]], ["tile_rx", "sp", [-1, 1]], ["auto_unroll_max_step", "ot", 512], ["unroll_explicit", "ot", 0]]}, "result": [[0.071391736], 0, 4.140946626663208, 1611788206.4978201], "version": 0.2, "tvm_version": "0.8.dev0"}
{"input": ["opencl -keys=adreno,opencl,gpu -device=adreno -max_num_threads=256", "conv2d_nchwc.opencl", [["TENSOR", [1, 32, 112, 112, 4], "float32"], ["TENSOR", [32, 128, 3, 3, 4], "float32"], [1, 1], [0, 0, 0, 0], [1, 1], "float32"], {}], "config": {"index": 2649584, "code_hash": null, "entity": [["tile_fc", "sp", [-1, 1, 1, 1]], ["tile_y", "sp", [-1, 1, 11, 1]], ["tile_x", "sp", [-1, 1, 55, 2]], ["tile_rcc", "sp", [-1, 32]], ["tile_ry", "sp", [-1, 3]], ["tile_rx", "sp", [-1, 1]], ["auto_unroll_max_step", "ot", 0], ["unroll_explicit", "ot", 0]]}, "result": [[0.082904479], 0, 8.190096616744995, 1611788210.3349574], "version": 0.2, "tvm_version": "0.8.dev0"}
{"input": ["opencl -keys=adreno,opencl,gpu -device=adreno -max_num_threads=256", "conv2d_nchwc.opencl", [["TENSOR", [1, 32, 112, 112, 4], "float32"], ["TENSOR", [32, 128, 3, 3, 4], "float32"], [1, 1], [0, 0, 0, 0], [1, 1], "float32"], {}], "config": {"index": 19165496, "code_hash": null, "entity": [["tile_fc", "sp", [-1, 1, 1, 1]], ["tile_y", "sp", [-1, 1, 11, 2]], ["tile_x", "sp", [-1, 1, 55, 2]], ["tile_rcc", "sp", [-1, 32]], ["tile_ry", "sp", [-1, 3]], ["tile_rx", "sp", [-1, 1]], ["auto_unroll_max_step", "ot", 0], ["unroll_explicit", "ot", 1]]}, "result": [[0.097114045], 0, 12.080795764923096, 1611788214.263445], "version": 0.2, "tvm_version": "0.8.dev0"}
{"input": ["opencl -keys=adreno,opencl,gpu -device=adreno -max_num_threads=256", "conv2d_nchwc.opencl", [["TENSOR", [1, 32, 112, 112, 4], "float32"], ["TENSOR", [32, 128, 3, 3, 4], "float32"], [1, 1], [0, 0, 0, 0], [1, 1], "float32"], {}], "config": {"index": 16870896, "code_hash": null, "entity": [["tile_fc", "sp", [-1, 1, 1, 1]], ["tile_y", "sp", [-1, 1, 11, 1]], ["tile_x", "sp", [-1, 1, 55, 2]], ["tile_rcc", "sp", [-1, 2]], ["tile_ry", "sp", [-1, 1]], ["tile_rx", "sp", [-1, 1]], ["auto_unroll_max_step", "ot", 0], ["unroll_explicit", "ot", 1]]}, "result": [[0.096526059], 0, 15.883255243301392, 1611788218.1828592], "version": 0.2, "tvm_version": "0.8.dev0"}
{"input": ["opencl -keys=adreno,opencl,gpu -device=adreno -max_num_threads=256", "conv2d_nchwc.opencl", [["TENSOR", [1, 32, 112, 112, 4], "float32"], ["TENSOR", [32, 128, 3, 3, 4], "float32"], [1, 1], [0, 0, 0, 0], [1, 1], "float32"], {}], "config": {"index": 18476528, "code_hash": null, "entity": [["tile_fc", "sp", [-1, 1, 1, 1]], ["tile_y", "sp", [-1, 1, 11, 1]], ["tile_x", "sp", [-1, 1, 55, 2]], ["tile_rcc", "sp", [-1, 4]], ["tile_ry", "sp", [-1, 3]], ["tile_rx", "sp", [-1, 1]], ["auto_unroll_max_step", "ot", 0], ["unroll_explicit", "ot", 1]]}, "result": [[0.23117248233333332], 0, 5.567214250564575, 1611788232.8530898], "version": 0.2, "tvm_version": "0.8.dev0"}
{"input": ["opencl -keys=adreno,opencl,gpu -device=adreno -max_num_threads=256", "conv2d_nchwc.opencl", [["TENSOR", [1, 32, 112, 112, 4], "float32"], ["TENSOR", [32, 128, 3, 3, 4], "float32"], [1, 1], [0, 0, 0, 0], [1, 1], "float32"], {}], "config": {"index": 17100272, "code_hash": null, "entity": [["tile_fc", "sp", [-1, 1, 1, 1]], ["tile_y", "sp", [-1, 1, 11, 1]], ["tile_x", "sp", [-1, 1, 55, 2]], ["tile_rcc", "sp", [-1, 4]], ["tile_ry", "sp", [-1, 1]], ["tile_rx", "sp", [-1, 1]], ["auto_unroll_max_step", "ot", 0], ["unroll_explicit", "ot", 1]]}, "result": [[0.09198656233333334], 0, 9.357585668563843, 1611788236.7530668], "version": 0.2, "tvm_version": "0.8.dev0"}
{"input": ["opencl -keys=adreno,opencl,gpu -device=adreno -max_num_threads=256", "conv2d_nchwc.opencl", [["TENSOR", [1, 32, 112, 112, 4], "float32"], ["TENSOR", [32, 128, 3, 3, 4], "float32"], [1, 1], [0, 0, 0, 0], [1, 1], "float32"], {}], "config": {"index": 87885, "code_hash": null, "entity": [["tile_fc", "sp", [-1, 1, 1, 2]], ["tile_y", "sp", [-1, 1, 11, 2]], ["tile_x", "sp", [-1, 1, 55, 1]], ["tile_rcc", "sp", [-1, 1]], ["tile_ry", "sp", [-1, 1]], ["tile_rx", "sp", [-1, 1]], ["auto_unroll_max_step", "ot", 0], ["unroll_explicit", "ot", 0]]}, "result": [[0.04138197933333333], 0, 12.989742994308472, 1611788240.1048577], "version": 0.2, "tvm_version": "0.8.dev0"}
{"input": ["opencl -keys=adreno,opencl,gpu -device=adreno -max_num_threads=256", "conv2d_nchwc.opencl", [["TENSOR", [1, 32, 112, 112, 4], "float32"], ["TENSOR", [32, 128, 3, 3, 4], "float32"], [1, 1], [0, 0, 0, 0], [1, 1], "float32"], {}], "config": {"index": 5592909, "code_hash": null, "entity": [["tile_fc", "sp", [-1, 1, 1, 2]], ["tile_y", "sp", [-1, 1, 11, 2]], ["tile_x", "sp", [-1, 1, 55, 1]], ["tile_rcc", "sp", [-1, 1]], ["tile_ry", "sp", [-1, 1]], ["tile_rx", "sp", [-1, 1]], ["auto_unroll_max_step", "ot", 512], ["unroll_explicit", "ot", 0]]}, "result": [[0.04108876733333333], 0, 16.492865085601807, 1611788243.5059392], "version": 0.2, "tvm_version": "0.8.dev0"}
