logs/mace_resnet50_v2.texture.float16.acc32.autotvm.log
{"input": ["opencl -keys=adreno,opencl,gpu -device=adreno -max_num_threads=256 -texture_spatial_limit=16384 -thread_warp_size=1", "conv2d_nchwc.image2d", [["TENSOR", [1, 2048, 1, 1], "float16"], ["TENSOR", [1001, 2048, 1, 1], "float16"], [1, 1], [0, 0, 0, 0], [1, 1], "float32"], {}], "config": {"index": 3065, "code_hash": null, "entity": [["tile_fc", "sp", [-1, 1, 251]], ["tile_y", "sp", [-1, 4, 1]], ["tile_x", "sp", [-1, 1, 2]], ["tile_rcc", "sp", [-1, 4]], ["tile_ry", "sp", [-1, 1]], ["tile_rx", "sp", [-1, 1]], ["auto_unroll_max_step", "ot", 512], ["unroll_explicit", "ot", 1]]}, "result": [[0.00060000256], 0, 4.220957279205322, 1658424431.6979713], "version": 0.2, "tvm_version": "0.9.dev0"}
{"input": ["opencl -keys=adreno,opencl,gpu -device=adreno -max_num_threads=256 -texture_spatial_limit=16384 -thread_warp_size=1", "conv2d_nchwc.image2d", [["TENSOR", [1, 2048, 10, 10], "float16"], ["TENSOR", [512, 2048, 1, 1], "float16"], [1, 1], [0, 0, 0, 0], [1, 1], "float32"], {}], "config": {"index": 262630, "code_hash": null, "entity": [["tile_fc", "sp", [-1, 1, 32]], ["tile_y", "sp", [-1, 4, 1]], ["tile_x", "sp", [-1, 1, 2]], ["tile_rcc", "sp", [-1, 2]], ["tile_ry", "sp", [-1, 1]], ["tile_rx", "sp", [-1, 1]], ["auto_unroll_max_step", "ot", 512], ["unroll_explicit", "ot", 1]]}, "result": [[0.00081247232], 0, 6.942444086074829, 1658426100.3084853], "version": 0.2, "tvm_version": "0.9.dev0"}
{"input": ["opencl -keys=adreno,opencl,gpu -device=adreno -max_num_threads=256 -texture_spatial_limit=16384 -thread_warp_size=1", "conv2d_nchwc.image2d", [["TENSOR", [1, 1024, 10, 10], "float16"], ["TENSOR", [2048, 1024, 1, 1], "float16"], [1, 1], [0, 0, 0, 0], [1, 1], "float32"], {}], "config": {"index": 276932, "code_hash": null, "entity": [["tile_fc", "sp", [-1, 1, 64]], ["tile_y", "sp", [-1, 1, 2]], ["tile_x", "sp", [-1, 6, 2]], ["tile_rcc", "sp", [-1, 256]], ["tile_ry", "sp", [-1, 1]], ["tile_rx", "sp", [-1, 1]], ["auto_unroll_max_step", "ot", 0], ["unroll_explicit", "ot", 1]]}, "result": [[0.00132576768], 0, 5.726125717163086, 1658428807.445987], "version": 0.2, "tvm_version": "0.9.dev0"}
{"input": ["opencl -keys=adreno,opencl,gpu -device=adreno -max_num_threads=256 -texture_spatial_limit=16384 -thread_warp_size=1", "conv2d_nchwc.image2d", [["TENSOR", [1, 512, 10, 10], "float16"], ["TENSOR", [2048, 512, 1, 1], "float16"], [1, 1], [0, 0, 0, 0], [1, 1], "float32"], {}], "config": {"index": 370560, "code_hash": null, "entity": [["tile_fc", "sp", [-1, 1, 16]], ["tile_y", "sp", [-1, 1, 2]], ["tile_x", "sp", [-1, 6, 2]], ["tile_rcc", "sp", [-1, 128]], ["tile_ry", "sp", [-1, 1]], ["tile_rx", "sp", [-1, 1]], ["auto_unroll_max_step", "ot", 1500], ["unroll_explicit", "ot", 1]]}, "result": [[0.0006508953599999999], 0, 0.6805284023284912, 1658430035.965204], "version": 0.2, "tvm_version": "0.9.dev0"}
{"input": ["opencl -keys=adreno,opencl,gpu -device=adreno -max_num_threads=256 -texture_spatial_limit=16384 -thread_warp_size=1", "conv2d_nchwc.image2d", [["TENSOR", [1, 512, 10, 10], "float16"], ["TENSOR", [512, 512, 3, 3], "float16"], [1, 1], [1, 1, 1, 1], [1, 1], "float32"], {}], "config": {"index": 111974, "code_hash": null, "entity": [["tile_fc", "sp", [-1, 1, 32]], ["tile_y", "sp", [-1, 2, 2]], ["tile_x", "sp", [-1, 2, 3]], ["tile_rcc", "sp", [-1, 2]], ["tile_ry", "sp", [-1, 1]], ["tile_rx", "sp", [-1, 3]], ["auto_unroll_max_step", "ot", 0], ["unroll_explicit", "ot", 0]]}, "result": [[0.00210482176], 0, 2.462064504623413, 1658432092.151239], "version": 0.2, "tvm_version": "0.9.dev0"}
{"input": ["opencl -keys=adreno,opencl,gpu -device=adreno -max_num_threads=256 -texture_spatial_limit=16384 -thread_warp_size=1", "conv2d_nchw_winograd.image2d", [["TENSOR", [1, 512, 10, 10], "float16"], ["TENSOR", [512, 512, 3, 3], "float16"], [1, 1], [1, 1, 1, 1], [1, 1], "float32"], {}], "config": {"index": 2781, "code_hash": null, "entity": [["auto_unroll_max_step", "ot", 0], ["tile_y", "sp", [-1, 2, 64]], ["tile_x", "sp", [-1, 5, 1]], ["tile_rc", "sp", [-1, 64]]]}, "result": [[0.0018885632000000003], 0, 12.541802883148193, 1658432913.0072494], "version": 0.2, "tvm_version": "0.9.dev0"}
{"input": ["opencl -keys=adreno,opencl,gpu -device=adreno -max_num_threads=256 -texture_spatial_limit=16384 -thread_warp_size=1", "conv2d_nchwc.image2d", [["TENSOR", [1, 1024, 10, 10], "float16"], ["TENSOR", [512, 1024, 1, 1], "float16"], [1, 1], [0, 0, 0, 0], [1, 1], "float32"], {}], "config": {"index": 176679, "code_hash": null, "entity": [["tile_fc", "sp", [-1, 1, 64]], ["tile_y", "sp", [-1, 2, 2]], ["tile_x", "sp", [-1, 3, 4]], ["tile_rcc", "sp", [-1, 1]], ["tile_ry", "sp", [-1, 1]], ["tile_rx", "sp", [-1, 1]], ["auto_unroll_max_step", "ot", 0], ["unroll_explicit", "ot", 1]]}, "result": [[0.00045302272], 0, 4.054551124572754, 1658434468.7863128], "version": 0.2, "tvm_version": "0.9.dev0"}
{"input": ["opencl -keys=adreno,opencl,gpu -device=adreno -max_num_threads=256 -texture_spatial_limit=16384 -thread_warp_size=1", "conv2d_nchwc.image2d", [["TENSOR", [1, 256, 10, 10], "float16"], ["TENSOR", [1024, 256, 1, 1], "float16"], [1, 1], [0, 0, 0, 0], [1, 1], "float32"], {}], "config": {"index": 184041, "code_hash": null, "entity": [["tile_fc", "sp", [-1, 1, 32]], ["tile_y", "sp", [-1, 1, 1]], ["tile_x", "sp", [-1, 6, 2]], ["tile_rcc", "sp", [-1, 16]], ["tile_ry", "sp", [-1, 1]], ["tile_rx", "sp", [-1, 1]], ["auto_unroll_max_step", "ot", 0], ["unroll_explicit", "ot", 1]]}, "result": [[0.00016768000000000002], 0, 0.602790117263794, 1658435354.5564225], "version": 0.2, "tvm_version": "0.9.dev0"}
{"input": ["opencl -keys=adreno,opencl,gpu -device=adreno -max_num_threads=256 -texture_spatial_limit=16384 -thread_warp_size=1", "conv2d_nchwc.image2d", [["TENSOR", [1, 256, 19, 19], "float16"], ["TENSOR", [256, 256, 3, 3], "float16"], [2, 2], [1, 1, 1, 1], [1, 1], "float32"], {}], "config": {"index": 19077, "code_hash": null, "entity": [["tile_fc", "sp", [-1, 1, 32]], ["tile_y", "sp", [-1, 1, 2]], ["tile_x", "sp", [-1, 4, 3]], ["tile_rcc", "sp", [-1, 8]], ["tile_ry", "sp", [-1, 1]], ["tile_rx", "sp", [-1, 1]], ["auto_unroll_max_step", "ot", 0], ["unroll_explicit", "ot", 0]]}, "result": [[0.0005507584], 0, 3.210787057876587, 1658436823.8057208], "version": 0.2, "tvm_version": "0.9.dev0"}
{"input": ["opencl -keys=adreno,opencl,gpu -device=adreno -max_num_threads=256 -texture_spatial_limit=16384 -thread_warp_size=1", "conv2d_nchwc.image2d", [["TENSOR", [1, 1024, 19, 19], "float16"], ["TENSOR", [256, 1024, 1, 1], "float16"], [1, 1], [0, 0, 0, 0], [1, 1], "float32"], {}], "config": {"index": 97289, "code_hash": null, "entity": [["tile_fc", "sp", [-1, 1, 64]], ["tile_y", "sp", [-1, 1, 1]], ["tile_x", "sp", [-1, 5, 4]], ["tile_rcc", "sp", [-1, 1]], ["tile_ry", "sp", [-1, 1]], ["tile_rx", "sp", [-1, 1]], ["auto_unroll_max_step", "ot", 0], ["unroll_explicit", "ot", 1]]}, "result": [[0.00069249536], 0, 6.766960620880127, 1658437950.0828352], "version": 0.2, "tvm_version": "0.9.dev0"}
{"input": ["opencl -keys=adreno,opencl,gpu -device=adreno -max_num_threads=256 -texture_spatial_limit=16384 -thread_warp_size=1", "conv2d_nchwc.image2d", [["TENSOR", [1, 512, 19, 19], "float16"], ["TENSOR", [1024, 512, 1, 1], "float16"], [1, 1], [0, 0, 0, 0], [1, 1], "float32"], {}], "config": {"index": 119720, "code_hash": null, "entity": [["tile_fc", "sp", [-1, 1, 64]], ["tile_y", "sp", [-1, 1, 1]], ["tile_x", "sp", [-1, 5, 2]], ["tile_rcc", "sp", [-1, 1]], ["tile_ry", "sp", [-1, 1]], ["tile_rx", "sp", [-1, 1]], ["auto_unroll_max_step", "ot", 0], ["unroll_explicit", "ot", 1]]}, "result": [[0.00104815104], 0, 9.65761685371399, 1658438831.3095715], "version": 0.2, "tvm_version": "0.9.dev0"}
{"input": ["opencl -keys=adreno,opencl,gpu -device=adreno -max_num_threads=256 -texture_spatial_limit=16384 -thread_warp_size=1", "conv2d_nchwc.image2d", [["TENSOR", [1, 256, 19, 19], "float16"], ["TENSOR", [1024, 256, 1, 1], "float16"], [1, 1], [0, 0, 0, 0], [1, 1], "float32"], {}], "config": {"index": 139095, "code_hash": null, "entity": [["tile_fc", "sp", [-1, 1, 64]], ["tile_y", "sp", [-1, 2, 2]], ["tile_x", "sp", [-1, 2, 2]], ["tile_rcc", "sp", [-1, 1]], ["tile_ry", "sp", [-1, 1]], ["tile_rx", "sp", [-1, 1]], ["auto_unroll_max_step", "ot", 512], ["unroll_explicit", "ot", 1]]}, "result": [[0.00056454656], 0, 47.08548593521118, 1658440457.8724806], "version": 0.2, "tvm_version": "0.9.dev0"}
{"input": ["opencl -keys=adreno,opencl,gpu -device=adreno -max_num_threads=256 -texture_spatial_limit=16384 -thread_warp_size=1", "conv2d_nchwc.image2d", [["TENSOR", [1, 256, 19, 19], "float16"], ["TENSOR", [256, 256, 3, 3], "float16"], [1, 1], [1, 1, 1, 1], [1, 1], "float32"], {}], "config": {"index": 7554, "code_hash": null, "entity": [["tile_fc", "sp", [-1, 1, 16]], ["tile_y", "sp", [-1, 2, 10]], ["tile_x", "sp", [-1, 2, 1]], ["tile_rcc", "sp", [-1, 4]], ["tile_ry", "sp", [-1, 1]], ["tile_rx", "sp", [-1, 1]], ["auto_unroll_max_step", "ot", 0], ["unroll_explicit", "ot", 0]]}, "result": [[0.00155410944], 0, 47.1967294216156, 1658442533.0211475], "version": 0.2, "tvm_version": "0.9.dev0"}
{"input": ["opencl -keys=adreno,opencl,gpu -device=adreno -max_num_threads=256 -texture_spatial_limit=16384 -thread_warp_size=1", "conv2d_nchw_winograd.image2d", [["TENSOR", [1, 256, 19, 19], "float16"], ["TENSOR", [256, 256, 3, 3], "float16"], [1, 1], [1, 1, 1, 1], [1, 1], "float32"], {}], "config": {"index": 2022, "code_hash": null, "entity": [["auto_unroll_max_step", "ot", 0], ["tile_y", "sp", [-1, 1, 64]], ["tile_x", "sp", [-1, 4, 1]], ["tile_rc", "sp", [-1, 4]]]}, "result": [[0.0009338112], 0, 2.941831350326538, 1658443338.927822], "version": 0.2, "tvm_version": "0.9.dev0"}
{"input": ["opencl -keys=adreno,opencl,gpu -device=adreno -max_num_threads=256 -texture_spatial_limit=16384 -thread_warp_size=1", "conv2d_nchwc.image2d", [["TENSOR", [1, 512, 19, 19], "float16"], ["TENSOR", [256, 512, 1, 1], "float16"], [1, 1], [0, 0, 0, 0], [1, 1], "float32"], {}], "config": {"index": 114027, "code_hash": null, "entity": [["tile_fc", "sp", [-1, 1, 32]], ["tile_y", "sp", [-1, 5, 2]], ["tile_x", "sp", [-1, 1, 2]], ["tile_rcc", "sp", [-1, 1]], ["tile_ry", "sp", [-1, 1]], ["tile_rx", "sp", [-1, 1]], ["auto_unroll_max_step", "ot", 512], ["unroll_explicit", "ot", 1]]}, "result": [[0.00030493184], 0, 4.650712013244629, 1658444569.6938868], "version": 0.2, "tvm_version": "0.9.dev0"}
{"input": ["opencl -keys=adreno,opencl,gpu -device=adreno -max_num_threads=256 -texture_spatial_limit=16384 -thread_warp_size=1", "conv2d_nchwc.image2d", [["TENSOR", [1, 128, 19, 19], "float16"], ["TENSOR", [512, 128, 1, 1], "float16"], [1, 1], [0, 0, 0, 0], [1, 1], "float32"], {}], "config": {"index": 95052, "code_hash": null, "entity": [["tile_fc", "sp", [-1, 1, 16]], ["tile_y", "sp", [-1, 5, 4]], ["tile_x", "sp", [-1, 1, 1]], ["tile_rcc", "sp", [-1, 16]], ["tile_ry", "sp", [-1, 1]], ["tile_rx", "sp", [-1, 1]], ["auto_unroll_max_step", "ot", 0], ["unroll_explicit", "ot", 1]]}, "result": [[0.00013508608], 0, 2.846217393875122, 1658445353.4119358], "version": 0.2, "tvm_version": "0.9.dev0"}
{"input": ["opencl -keys=adreno,opencl,gpu -device=adreno -max_num_threads=256 -texture_spatial_limit=16384 -thread_warp_size=1", "conv2d_nchwc.image2d", [["TENSOR", [1, 128, 38, 38], "float16"], ["TENSOR", [128, 128, 3, 3], "float16"], [2, 2], [0, 0, 1, 1], [1, 1], "float32"], {}], "config": {"index": 149237, "code_hash": null, "entity": [["tile_fc", "sp", [-1, 1, 16]], ["tile_y", "sp", [-1, 2, 2]], ["tile_x", "sp", [-1, 2, 2]], ["tile_rcc", "sp", [-1, 1]], ["tile_ry", "sp", [-1, 3]], ["tile_rx", "sp", [-1, 1]], ["auto_unroll_max_step", "ot", 1500], ["unroll_explicit", "ot", 0]]}, "result": [[0.00048352768], 0, 1.7172560691833496, 1658446484.7294564], "version": 0.2, "tvm_version": "0.9.dev0"}
{"input": ["opencl -keys=adreno,opencl,gpu -device=adreno -max_num_threads=256 -texture_spatial_limit=16384 -thread_warp_size=1", "conv2d_nchwc.image2d", [["TENSOR", [1, 512, 38, 38], "float16"], ["TENSOR", [128, 512, 1, 1], "float16"], [1, 1], [0, 0, 0, 0], [1, 1], "float32"], {}], "config": {"index": 193029, "code_hash": null, "entity": [["tile_fc", "sp", [-1, 1, 16]], ["tile_y", "sp", [-1, 5, 4]], ["tile_x", "sp", [-1, 1, 2]], ["tile_rcc", "sp", [-1, 128]], ["tile_ry", "sp", [-1, 1]], ["tile_rx", "sp", [-1, 1]], ["auto_unroll_max_step", "ot", 0], ["unroll_explicit", "ot", 1]]}, "result": [[0.00058727936], 0, 5.607952356338501, 1658447908.2028794], "version": 0.2, "tvm_version": "0.9.dev0"}
{"input": ["opencl -keys=adreno,opencl,gpu -device=adreno -max_num_threads=256 -texture_spatial_limit=16384 -thread_warp_size=1", "conv2d_nchwc.image2d", [["TENSOR", [1, 256, 38, 38], "float16"], ["TENSOR", [512, 256, 1, 1], "float16"], [1, 1], [0, 0, 0, 0], [1, 1], "float32"], {}], "config": {"index": 208840, "code_hash": null, "entity": [["tile_fc", "sp", [-1, 1, 32]], ["tile_y", "sp", [-1, 1, 1]], ["tile_x", "sp", [-1, 5, 4]], ["tile_rcc", "sp", [-1, 1]], ["tile_ry", "sp", [-1, 1]], ["tile_rx", "sp", [-1, 1]], ["auto_unroll_max_step", "ot", 0], ["unroll_explicit", "ot", 1]]}, "result": [[0.0009801164799999999], 0, 49.62860417366028, 1658449537.1280441], "version": 0.2, "tvm_version": "0.9.dev0"}
{"input": ["opencl -keys=adreno,opencl,gpu -device=adreno -max_num_threads=256 -texture_spatial_limit=16384 -thread_warp_size=1", "conv2d_nchwc.image2d", [["TENSOR", [1, 128, 38, 38], "float16"], ["TENSOR", [512, 128, 1, 1], "float16"], [1, 1], [0, 0, 0, 0], [1, 1], "float32"], {}], "config": {"index": 283860, "code_hash": null, "entity": [["tile_fc", "sp", [-1, 1, 32]], ["tile_y", "sp", [-1, 5, 2]], ["tile_x", "sp", [-1, 1, 2]], ["tile_rcc", "sp", [-1, 32]], ["tile_ry", "sp", [-1, 1]], ["tile_rx", "sp", [-1, 1]], ["auto_unroll_max_step", "ot", 512], ["unroll_explicit", "ot", 1]]}, "result": [[0.00049880576], 0, 1.0321564674377441, 1658450750.479739], "version": 0.2, "tvm_version": "0.9.dev0"}
{"input": ["opencl -keys=adreno,opencl,gpu -device=adreno -max_num_threads=256 -texture_spatial_limit=16384 -thread_warp_size=1", "conv2d_nchwc.image2d", [["TENSOR", [1, 128, 38, 38], "float16"], ["TENSOR", [128, 128, 3, 3], "float16"], [1, 1], [1, 1, 1, 1], [1, 1], "float32"], {}], "config": {"index": 39183, "code_hash": null, "entity": [["tile_fc", "sp", [-1, 1, 16]], ["tile_y", "sp", [-1, 1, 2]], ["tile_x", "sp", [-1, 4, 2]], ["tile_rcc", "sp", [-1, 1]], ["tile_ry", "sp", [-1, 3]], ["tile_rx", "sp", [-1, 1]], ["auto_unroll_max_step", "ot", 0], ["unroll_explicit", "ot", 0]]}, "result": [[0.00127821824], 0, 3.8128433227539062, 1658453119.9830878], "version": 0.2, "tvm_version": "0.9.dev0"}
{"input": ["opencl -keys=adreno,opencl,gpu -device=adreno -max_num_threads=256 -texture_spatial_limit=16384 -thread_warp_size=1", "conv2d_nchw_winograd.image2d", [["TENSOR", [1, 128, 38, 38], "float16"], ["TENSOR", [128, 128, 3, 3], "float16"], [1, 1], [1, 1, 1, 1], [1, 1], "float32"], {}], "config": {"index": 230, "code_hash": null, "entity": [["auto_unroll_max_step", "ot", 16], ["tile_y", "sp", [-1, 4, 8]], ["tile_x", "sp", [-1, 1, 19]], ["tile_rc", "sp", [-1, 2]]]}, "result": [[0.00231355904], 0, 3.6290318965911865, 1658453709.8833277], "version": 0.2, "tvm_version": "0.9.dev0"}
{"input": ["opencl -keys=adreno,opencl,gpu -device=adreno -max_num_threads=256 -texture_spatial_limit=16384 -thread_warp_size=1", "conv2d_nchwc.image2d", [["TENSOR", [1, 256, 38, 38], "float16"], ["TENSOR", [128, 256, 1, 1], "float16"], [1, 1], [0, 0, 0, 0], [1, 1], "float32"], {}], "config": {"index": 214988, "code_hash": null, "entity": [["tile_fc", "sp", [-1, 1, 4]], ["tile_y", "sp", [-1, 1, 2]], ["tile_x", "sp", [-1, 5, 8]], ["tile_rcc", "sp", [-1, 64]], ["tile_ry", "sp", [-1, 1]], ["tile_rx", "sp", [-1, 1]], ["auto_unroll_max_step", "ot", 512], ["unroll_explicit", "ot", 1]]}, "result": [[0.00032505856], 0, 14.407306671142578, 1658455718.385473], "version": 0.2, "tvm_version": "0.9.dev0"}
{"input": ["opencl -keys=adreno,opencl,gpu -device=adreno -max_num_threads=256 -texture_spatial_limit=16384 -thread_warp_size=1", "conv2d_nchwc.image2d", [["TENSOR", [1, 64, 38, 38], "float16"], ["TENSOR", [256, 64, 1, 1], "float16"], [1, 1], [0, 0, 0, 0], [1, 1], "float32"], {}], "config": {"index": 149481, "code_hash": null, "entity": [["tile_fc", "sp", [-1, 2, 8]], ["tile_y", "sp", [-1, 1, 4]], ["tile_x", "sp", [-1, 5, 8]], ["tile_rcc", "sp", [-1, 8]], ["tile_ry", "sp", [-1, 1]], ["tile_rx", "sp", [-1, 1]], ["auto_unroll_max_step", "ot", 0], ["unroll_explicit", "ot", 1]]}, "result": [[0.00015977472], 0, 5.6566526889801025, 1658456408.825747], "version": 0.2, "tvm_version": "0.9.dev0"}
{"input": ["opencl -keys=adreno,opencl,gpu -device=adreno -max_num_threads=256 -texture_spatial_limit=16384 -thread_warp_size=1", "conv2d_nchwc.image2d", [["TENSOR", [1, 64, 75, 75], "float16"], ["TENSOR", [64, 64, 3, 3], "float16"], [2, 2], [1, 1, 1, 1], [1, 1], "float32"], {}], "config": {"index": 67519, "code_hash": null, "entity": [["tile_fc", "sp", [-1, 1, 16]], ["tile_y", "sp", [-1, 2, 4]], ["tile_x", "sp", [-1, 2, 2]], ["tile_rcc", "sp", [-1, 1]], ["tile_ry", "sp", [-1, 3]], ["tile_rx", "sp", [-1, 3]], ["auto_unroll_max_step", "ot", 0], ["unroll_explicit", "ot", 0]]}, "result": [[0.00042168832000000005], 0, 2.5558173656463623, 1658457971.3772073], "version": 0.2, "tvm_version": "0.9.dev0"}
{"input": ["opencl -keys=adreno,opencl,gpu -device=adreno -max_num_threads=256 -texture_spatial_limit=16384 -thread_warp_size=1", "conv2d_nchwc.image2d", [["TENSOR", [1, 256, 75, 75], "float16"], ["TENSOR", [64, 256, 1, 1], "float16"], [1, 1], [0, 0, 0, 0], [1, 1], "float32"], {}], "config": {"index": 7889, "code_hash": null, "entity": [["tile_fc", "sp", [-1, 1, 16]], ["tile_y", "sp", [-1, 4, 1]], ["tile_x", "sp", [-1, 1, 4]], ["tile_rcc", "sp", [-1, 1]], ["tile_ry", "sp", [-1, 1]], ["tile_rx", "sp", [-1, 1]], ["auto_unroll_max_step", "ot", 0], ["unroll_explicit", "ot", 1]]}, "result": [[0.00075944448], 0, 6.243840932846069, 1658458625.5614057], "version": 0.2, "tvm_version": "0.9.dev0"}
{"input": ["opencl -keys=adreno,opencl,gpu -device=adreno -max_num_threads=256 -texture_spatial_limit=16384 -thread_warp_size=1", "conv2d_nchwc.image2d", [["TENSOR", [1, 64, 75, 75], "float16"], ["TENSOR", [256, 64, 1, 1], "float16"], [1, 1], [0, 0, 0, 0], [1, 1], "float32"], {}], "config": {"index": 12903, "code_hash": null, "entity": [["tile_fc", "sp", [-1, 1, 32]], ["tile_y", "sp", [-1, 4, 1]], ["tile_x", "sp", [-1, 1, 4]], ["tile_rcc", "sp", [-1, 16]], ["tile_ry", "sp", [-1, 1]], ["tile_rx", "sp", [-1, 1]], ["auto_unroll_max_step", "ot", 0], ["unroll_explicit", "ot", 1]]}, "result": [[0.00065032704], 0, 4.038555145263672, 1658459352.1112068], "version": 0.2, "tvm_version": "0.9.dev0"}
{"input": ["opencl -keys=adreno,opencl,gpu -device=adreno -max_num_threads=256 -texture_spatial_limit=16384 -thread_warp_size=1", "conv2d_nchwc.image2d", [["TENSOR", [1, 64, 75, 75], "float16"], ["TENSOR", [64, 64, 3, 3], "float16"], [1, 1], [1, 1, 1, 1], [1, 1], "float32"], {}], "config": {"index": 15809, "code_hash": null, "entity": [["tile_fc", "sp", [-1, 1, 16]], ["tile_y", "sp", [-1, 4, 1]], ["tile_x", "sp", [-1, 1, 4]], ["tile_rcc", "sp", [-1, 8]], ["tile_ry", "sp", [-1, 1]], ["tile_rx", "sp", [-1, 1]], ["auto_unroll_max_step", "ot", 1500], ["unroll_explicit", "ot", 0]]}, "result": [[0.00118886912], 0, 7.846517562866211, 1658460892.1887732], "version": 0.2, "tvm_version": "0.9.dev0"}
{"input": ["opencl -keys=adreno,opencl,gpu -device=adreno -max_num_threads=256 -texture_spatial_limit=16384 -thread_warp_size=1", "conv2d_nchw_winograd.image2d", [["TENSOR", [1, 64, 75, 75], "float16"], ["TENSOR", [64, 64, 3, 3], "float16"], [1, 1], [1, 1, 1, 1], [1, 1], "float32"], {}], "config": {"index": 223, "code_hash": null, "entity": [["auto_unroll_max_step", "ot", 4], ["tile_y", "sp", [-1, 1, 16]], ["tile_x", "sp", [-1, 4, 1]], ["tile_rc", "sp", [-1, 4]]]}, "result": [[0.00282293248], 0, 2.144958972930908, 1658461445.5262082], "version": 0.2, "tvm_version": "0.9.dev0"}
{"input": ["opencl -keys=adreno,opencl,gpu -device=adreno -max_num_threads=256 -texture_spatial_limit=16384 -thread_warp_size=1", "conv2d_nchwc.image2d", [["TENSOR", [1, 64, 75, 75], "float16"], ["TENSOR", [64, 64, 1, 1], "float16"], [1, 1], [0, 0, 0, 0], [1, 1], "float32"], {}], "config": {"index": 1619, "code_hash": null, "entity": [["tile_fc", "sp", [-1, 1, 16]], ["tile_y", "sp", [-1, 1, 4]], ["tile_x", "sp", [-1, 4, 1]], ["tile_rcc", "sp", [-1, 16]], ["tile_ry", "sp", [-1, 1]], ["tile_rx", "sp", [-1, 1]], ["auto_unroll_max_step", "ot", 0], ["unroll_explicit", "ot", 0]]}, "result": [[0.00020639232], 0, 3.5779285430908203, 1658463188.8131123], "version": 0.2, "tvm_version": "0.9.dev0"}
{"input": ["opencl -keys=adreno,opencl,gpu -device=adreno -max_num_threads=256 -texture_spatial_limit=16384 -thread_warp_size=1", "conv2d_nchwc.image2d", [["TENSOR", [1, 3, 299, 299], "float16"], ["TENSOR", [64, 3, 7, 7], "float16"], [2, 2], [3, 3, 3, 3], [1, 1], "float32"], {}], "config": {"index": 13769, "code_hash": null, "entity": [["tile_fc", "sp", [-1, 1, 16]], ["tile_y", "sp", [-1, 4, 2]], ["tile_x", "sp", [-1, 1, 4]], ["tile_rcc", "sp", [-1, 1]], ["tile_ry", "sp", [-1, 7]], ["tile_rx", "sp", [-1, 1]], ["auto_unroll_max_step", "ot", 0], ["unroll_explicit", "ot", 1]]}, "result": [[0.00133142016], 0, 7.31989598274231, 1658464722.999527], "version": 0.2, "tvm_version": "0.9.dev0"}
