logs/mace_deeplabv3.texture.float16.acc32.autotvm.log
{"input": ["opencl -keys=adreno,opencl,gpu -device=adreno -max_num_threads=256", "conv2d_nhwc.image2d", [["TENSOR", [1, 65, 65, 320], "float16"], ["TENSOR", [1, 1, 320, 256], "float16"], [1, 1], [0, 0, 0, 0], [1, 1], "float32"], {}], "config": {"index": 2505, "code_hash": null, "entity": [["tile_fc", "sp", [-1, 2, 16]], ["tile_y", "sp", [-1, 1, 4]], ["tile_x", "sp", [-1, 2, 1]], ["tile_rcc", "sp", [-1, 80]], ["tile_ry", "sp", [-1, 1]], ["tile_rx", "sp", [-1, 1]], ["auto_unroll_max_step", "ot", 0], ["unroll_explicit", "ot", 0]]}, "result": [[0.0021100604], 0, 3.0791003704071045, 1648594195.0216427], "version": 0.2, "tvm_version": "0.8.dev0"}
{"input": ["opencl -keys=adreno,opencl,gpu -device=adreno -max_num_threads=256", "depthwise_conv2d_nhwc.image2d", [["TENSOR", [1, 257, 257, 32], "float16"], ["TENSOR", [3, 3, 32, 1], "float16"], [1, 1], [1, 1, 1, 1], [1, 1], "float32"], {}], "config": {"index": 623369, "code_hash": null, "entity": [["tile_fc", "sp", [-1, 1, 8]], ["tile_y", "sp", [-1, 1, 4]], ["tile_x", "sp", [-1, 1, 4]], ["tile_ry", "sp", [-1, 3]], ["tile_rx", "sp", [-1, 1]], ["auto_unroll_max_step", "ot", 1500], ["unroll_explicit", "ot", 1]]}, "result": [[0.00141872708], 0, 6.365419626235962, 1648598863.586425], "version": 0.2, "tvm_version": "0.8.dev0"}
{"input": ["opencl -keys=adreno,opencl,gpu -device=adreno -max_num_threads=256", "conv2d_nhwc.image2d", [["TENSOR", [1, 257, 257, 32], "float16"], ["TENSOR", [1, 1, 32, 16], "float16"], [1, 1], [0, 0, 0, 0], [1, 1], "float32"], {}], "config": {"index": 6043, "code_hash": null, "entity": [["tile_fc", "sp", [-1, 1, 4]], ["tile_y", "sp", [-1, 4, 13]], ["tile_x", "sp", [-1, 1, 1]], ["tile_rcc", "sp", [-1, 8]], ["tile_ry", "sp", [-1, 1]], ["tile_rx", "sp", [-1, 1]], ["auto_unroll_max_step", "ot", 1500], ["unroll_explicit", "ot", 0]]}, "result": [[0.00217338854], 0, 3.989616870880127, 1648599984.0810242], "version": 0.2, "tvm_version": "0.8.dev0"}
{"input": ["opencl -keys=adreno,opencl,gpu -device=adreno -max_num_threads=256", "conv2d_nhwc.image2d", [["TENSOR", [1, 257, 257, 16], "float16"], ["TENSOR", [1, 1, 16, 96], "float16"], [1, 1], [0, 0, 0, 0], [1, 1], "float32"], {}], "config": {"index": 10466, "code_hash": null, "entity": [["tile_fc", "sp", [-1, 1, 24]], ["tile_y", "sp", [-1, 2, 1]], ["tile_x", "sp", [-1, 1, 5]], ["tile_rcc", "sp", [-1, 4]], ["tile_ry", "sp", [-1, 1]], ["tile_rx", "sp", [-1, 1]], ["auto_unroll_max_step", "ot", 0], ["unroll_explicit", "ot", 0]]}, "result": [[0.00191041668], 0, 8.623396396636963, 1648600131.4334357], "version": 0.2, "tvm_version": "0.8.dev0"}
{"input": ["opencl -keys=adreno,opencl,gpu -device=adreno -max_num_threads=256", "depthwise_conv2d_nhwc.image2d", [["TENSOR", [1, 257, 257, 96], "float16"], ["TENSOR", [3, 3, 96, 1], "float16"], [2, 2], [1, 1, 1, 1], [1, 1], "float32"], {}], "config": {"index": 1870555, "code_hash": null, "entity": [["tile_fc", "sp", [-1, 1, 8]], ["tile_y", "sp", [-1, 2, 11]], ["tile_x", "sp", [-1, 1, 3]], ["tile_ry", "sp", [-1, 3]], ["tile_rx", "sp", [-1, 1]], ["auto_unroll_max_step", "ot", 1500], ["unroll_explicit", "ot", 1]]}, "result": [[0.0015884645800000002], 0, 4.4082653522491455, 1648603967.4522417], "version": 0.2, "tvm_version": "0.8.dev0"}
{"input": ["opencl -keys=adreno,opencl,gpu -device=adreno -max_num_threads=256", "conv2d_nhwc.image2d", [["TENSOR", [1, 129, 129, 96], "float16"], ["TENSOR", [1, 1, 96, 24], "float16"], [1, 1], [0, 0, 0, 0], [1, 1], "float32"], {}], "config": {"index": 23904, "code_hash": null, "entity": [["tile_fc", "sp", [-1, 1, 6]], ["tile_y", "sp", [-1, 4, 3]], ["tile_x", "sp", [-1, 1, 3]], ["tile_rcc", "sp", [-1, 3]], ["tile_ry", "sp", [-1, 1]], ["tile_rx", "sp", [-1, 1]], ["auto_unroll_max_step", "ot", 1500], ["unroll_explicit", "ot", 0]]}, "result": [[0.0008454104200000001], 0, 1.7694051265716553, 1648605352.4217737], "version": 0.2, "tvm_version": "0.8.dev0"}
{"input": ["opencl -keys=adreno,opencl,gpu -device=adreno -max_num_threads=256", "depthwise_conv2d_nhwc.image2d", [["TENSOR", [1, 129, 129, 144], "float16"], ["TENSOR", [3, 3, 144, 1], "float16"], [1, 1], [1, 1, 1, 1], [1, 1], "float32"], {}], "config": {"index": 1929199, "code_hash": null, "entity": [["tile_fc", "sp", [-1, 1, 12]], ["tile_y", "sp", [-1, 1, 3]], ["tile_x", "sp", [-1, 1, 3]], ["tile_ry", "sp", [-1, 1]], ["tile_rx", "sp", [-1, 3]], ["auto_unroll_max_step", "ot", 512], ["unroll_explicit", "ot", 1]]}, "result": [[0.00147538958], 0, 3.3792564868927, 1648606712.7519991], "version": 0.2, "tvm_version": "0.8.dev0"}
{"input": ["opencl -keys=adreno,opencl,gpu -device=adreno -max_num_threads=256", "conv2d_nhwc.image2d", [["TENSOR", [1, 129, 129, 144], "float16"], ["TENSOR", [1, 1, 144, 24], "float16"], [1, 1], [0, 0, 0, 0], [1, 1], "float32"], {}], "config": {"index": 12191, "code_hash": null, "entity": [["tile_fc", "sp", [-1, 1, 6]], ["tile_y", "sp", [-1, 1, 3]], ["tile_x", "sp", [-1, 4, 3]], ["tile_rcc", "sp", [-1, 1]], ["tile_ry", "sp", [-1, 1]], ["tile_rx", "sp", [-1, 1]], ["auto_unroll_max_step", "ot", 512], ["unroll_explicit", "ot", 0]]}, "result": [[0.00115242814], 0, 2.3915276527404785, 1648608163.917665], "version": 0.2, "tvm_version": "0.8.dev0"}
{"input": ["opencl -keys=adreno,opencl,gpu -device=adreno -max_num_threads=256", "conv2d_nhwc.image2d", [["TENSOR", [1, 129, 129, 24], "float16"], ["TENSOR", [1, 1, 24, 144], "float16"], [1, 1], [0, 0, 0, 0], [1, 1], "float32"], {}], "config": {"index": 51262, "code_hash": null, "entity": [["tile_fc", "sp", [-1, 1, 36]], ["tile_y", "sp", [-1, 1, 12]], ["tile_x", "sp", [-1, 4, 1]], ["tile_rcc", "sp", [-1, 6]], ["tile_ry", "sp", [-1, 1]], ["tile_rx", "sp", [-1, 1]], ["auto_unroll_max_step", "ot", 512], ["unroll_explicit", "ot", 0]]}, "result": [[0.0004131948], 0, 4.387995958328247, 1648609745.034979], "version": 0.2, "tvm_version": "0.8.dev0"}
{"input": ["opencl -keys=adreno,opencl,gpu -device=adreno -max_num_threads=256", "depthwise_conv2d_nhwc.image2d", [["TENSOR", [1, 129, 129, 144], "float16"], ["TENSOR", [3, 3, 144, 1], "float16"], [2, 2], [1, 1, 1, 1], [1, 1], "float32"], {}], "config": {"index": 228343, "code_hash": null, "entity": [["tile_fc", "sp", [-1, 1, 12]], ["tile_y", "sp", [-1, 1, 2]], ["tile_x", "sp", [-1, 1, 4]], ["tile_ry", "sp", [-1, 3]], ["tile_rx", "sp", [-1, 3]], ["auto_unroll_max_step", "ot", 512], ["unroll_explicit", "ot", 1]]}, "result": [[0.0006286927], 0, 2.1344175338745117, 1648610834.7433183], "version": 0.2, "tvm_version": "0.8.dev0"}
{"input": ["opencl -keys=adreno,opencl,gpu -device=adreno -max_num_threads=256", "conv2d_nhwc.image2d", [["TENSOR", [1, 65, 65, 144], "float16"], ["TENSOR", [1, 1, 144, 32], "float16"], [1, 1], [0, 0, 0, 0], [1, 1], "float32"], {}], "config": {"index": 805, "code_hash": null, "entity": [["tile_fc", "sp", [-1, 1, 8]], ["tile_y", "sp", [-1, 2, 2]], ["tile_x", "sp", [-1, 1, 4]], ["tile_rcc", "sp", [-1, 2]], ["tile_ry", "sp", [-1, 1]], ["tile_rx", "sp", [-1, 1]], ["auto_unroll_max_step", "ot", 0], ["unroll_explicit", "ot", 1]]}, "result": [[0.00025806874], 0, 1.0145514011383057, 1648611109.3840892], "version": 0.2, "tvm_version": "0.8.dev0"}
{"input": ["opencl -keys=adreno,opencl,gpu -device=adreno -max_num_threads=256", "conv2d_nhwc.image2d", [["TENSOR", [1, 65, 65, 192], "float16"], ["TENSOR", [1, 1, 192, 32], "float16"], [1, 1], [0, 0, 0, 0], [1, 1], "float32"], {}], "config": {"index": 42, "code_hash": null, "entity": [["tile_fc", "sp", [-1, 1, 8]], ["tile_y", "sp", [-1, 2, 1]], ["tile_x", "sp", [-1, 1, 4]], ["tile_rcc", "sp", [-1, 2]], ["tile_ry", "sp", [-1, 1]], ["tile_rx", "sp", [-1, 1]], ["auto_unroll_max_step", "ot", 0], ["unroll_explicit", "ot", 0]]}, "result": [[0.00039794166], 0, 1.2551507949829102, 1648611533.8322463], "version": 0.2, "tvm_version": "0.8.dev0"}
{"input": ["opencl -keys=adreno,opencl,gpu -device=adreno -max_num_threads=256", "conv2d_nhwc.image2d", [["TENSOR", [1, 65, 65, 32], "float16"], ["TENSOR", [1, 1, 32, 192], "float16"], [1, 1], [0, 0, 0, 0], [1, 1], "float32"], {}], "config": {"index": 3718, "code_hash": null, "entity": [["tile_fc", "sp", [-1, 1, 16]], ["tile_y", "sp", [-1, 1, 4]], ["tile_x", "sp", [-1, 4, 1]], ["tile_rcc", "sp", [-1, 1]], ["tile_ry", "sp", [-1, 1]], ["tile_rx", "sp", [-1, 1]], ["auto_unroll_max_step", "ot", 0], ["unroll_explicit", "ot", 1]]}, "result": [[0.00031802292], 0, 2.8151161670684814, 1648612710.5786211], "version": 0.2, "tvm_version": "0.8.dev0"}
{"input": ["opencl -keys=adreno,opencl,gpu -device=adreno -max_num_threads=256", "depthwise_conv2d_nhwc.image2d", [["TENSOR", [1, 65, 65, 192], "float16"], ["TENSOR", [3, 3, 192, 1], "float16"], [1, 1], [1, 1, 1, 1], [1, 1], "float32"], {}], "config": {"index": 245508, "code_hash": null, "entity": [["tile_fc", "sp", [-1, 1, 8]], ["tile_y", "sp", [-1, 2, 1]], ["tile_x", "sp", [-1, 1, 34]], ["tile_ry", "sp", [-1, 1]], ["tile_rx", "sp", [-1, 1]], ["auto_unroll_max_step", "ot", 512], ["unroll_explicit", "ot", 1]]}, "result": [[0.00029297396], 0, 1.5053017139434814, 1648613627.7091544], "version": 0.2, "tvm_version": "0.8.dev0"}
{"input": ["opencl -keys=adreno,opencl,gpu -device=adreno -max_num_threads=256", "conv2d_nhwc.image2d", [["TENSOR", [1, 65, 65, 192], "float16"], ["TENSOR", [1, 1, 192, 64], "float16"], [1, 1], [0, 0, 0, 0], [1, 1], "float32"], {}], "config": {"index": 3083, "code_hash": null, "entity": [["tile_fc", "sp", [-1, 2, 8]], ["tile_y", "sp", [-1, 1, 4]], ["tile_x", "sp", [-1, 2, 2]], ["tile_rcc", "sp", [-1, 1]], ["tile_ry", "sp", [-1, 1]], ["tile_rx", "sp", [-1, 1]], ["auto_unroll_max_step", "ot", 512], ["unroll_explicit", "ot", 1]]}, "result": [[0.00048468228], 0, 2.7037649154663086, 1648613790.9231453], "version": 0.2, "tvm_version": "0.8.dev0"}
{"input": ["opencl -keys=adreno,opencl,gpu -device=adreno -max_num_threads=256", "conv2d_nhwc.image2d", [["TENSOR", [1, 65, 65, 384], "float16"], ["TENSOR", [1, 1, 384, 64], "float16"], [1, 1], [0, 0, 0, 0], [1, 1], "float32"], {}], "config": {"index": 2789, "code_hash": null, "entity": [["tile_fc", "sp", [-1, 1, 16]], ["tile_y", "sp", [-1, 4, 1]], ["tile_x", "sp", [-1, 1, 4]], ["tile_rcc", "sp", [-1, 1]], ["tile_ry", "sp", [-1, 1]], ["tile_rx", "sp", [-1, 1]], ["auto_unroll_max_step", "ot", 0], ["unroll_explicit", "ot", 1]]}, "result": [[0.00134546876], 0, 3.896395444869995, 1648615553.272634], "version": 0.2, "tvm_version": "0.8.dev0"}
{"input": ["opencl -keys=adreno,opencl,gpu -device=adreno -max_num_threads=256", "conv2d_nhwc.image2d", [["TENSOR", [1, 65, 65, 64], "float16"], ["TENSOR", [1, 1, 64, 384], "float16"], [1, 1], [0, 0, 0, 0], [1, 1], "float32"], {}], "config": {"index": 8591, "code_hash": null, "entity": [["tile_fc", "sp", [-1, 1, 96]], ["tile_y", "sp", [-1, 1, 2]], ["tile_x", "sp", [-1, 4, 1]], ["tile_rcc", "sp", [-1, 1]], ["tile_ry", "sp", [-1, 1]], ["tile_rx", "sp", [-1, 1]], ["auto_unroll_max_step", "ot", 0], ["unroll_explicit", "ot", 1]]}, "result": [[0.00102327082], 0, 4.233806610107422, 1648616929.046171], "version": 0.2, "tvm_version": "0.8.dev0"}
{"input": ["opencl -keys=adreno,opencl,gpu -device=adreno -max_num_threads=256", "depthwise_conv2d_nhwc.image2d", [["TENSOR", [1, 65, 65, 384], "float16"], ["TENSOR", [3, 3, 384, 1], "float16"], [1, 1], [2, 2, 2, 2], [2, 2], "float32"], {}], "config": {"index": 374656, "code_hash": null, "entity": [["tile_fc", "sp", [-1, 1, 32]], ["tile_y", "sp", [-1, 1, 2]], ["tile_x", "sp", [-1, 1, 2]], ["tile_ry", "sp", [-1, 1]], ["tile_rx", "sp", [-1, 3]], ["auto_unroll_max_step", "ot", 512], ["unroll_explicit", "ot", 1]]}, "result": [[0.00096836668], 0, 2.3605830669403076, 1648618449.1503603], "version": 0.2, "tvm_version": "0.8.dev0"}
{"input": ["opencl -keys=adreno,opencl,gpu -device=adreno -max_num_threads=256", "conv2d_nhwc.image2d", [["TENSOR", [1, 65, 65, 384], "float16"], ["TENSOR", [1, 1, 384, 96], "float16"], [1, 1], [0, 0, 0, 0], [1, 1], "float32"], {}], "config": {"index": 20, "code_hash": null, "entity": [["tile_fc", "sp", [-1, 1, 24]], ["tile_y", "sp", [-1, 1, 4]], ["tile_x", "sp", [-1, 4, 1]], ["tile_rcc", "sp", [-1, 1]], ["tile_ry", "sp", [-1, 1]], ["tile_rx", "sp", [-1, 1]], ["auto_unroll_max_step", "ot", 0], ["unroll_explicit", "ot", 0]]}, "result": [[0.00211354374], 0, 4.980063199996948, 1648619048.8369448], "version": 0.2, "tvm_version": "0.8.dev0"}
{"input": ["opencl -keys=adreno,opencl,gpu -device=adreno -max_num_threads=256", "conv2d_nhwc.image2d", [["TENSOR", [1, 65, 65, 576], "float16"], ["TENSOR", [1, 1, 576, 96], "float16"], [1, 1], [0, 0, 0, 0], [1, 1], "float32"], {}], "config": {"index": 9845, "code_hash": null, "entity": [["tile_fc", "sp", [-1, 1, 24]], ["tile_y", "sp", [-1, 1, 4]], ["tile_x", "sp", [-1, 4, 1]], ["tile_rcc", "sp", [-1, 1]], ["tile_ry", "sp", [-1, 1]], ["tile_rx", "sp", [-1, 1]], ["auto_unroll_max_step", "ot", 1500], ["unroll_explicit", "ot", 1]]}, "result": [[0.0031610864600000003], 0, 2.5722784996032715, 1648621430.746954], "version": 0.2, "tvm_version": "0.8.dev0"}
{"input": ["opencl -keys=adreno,opencl,gpu -device=adreno -max_num_threads=256", "conv2d_nhwc.image2d", [["TENSOR", [1, 65, 65, 96], "float16"], ["TENSOR", [1, 1, 96, 576], "float16"], [1, 1], [0, 0, 0, 0], [1, 1], "float32"], {}], "config": {"index": 18971, "code_hash": null, "entity": [["tile_fc", "sp", [-1, 1, 144]], ["tile_y", "sp", [-1, 1, 4]], ["tile_x", "sp", [-1, 4, 1]], ["tile_rcc", "sp", [-1, 24]], ["tile_ry", "sp", [-1, 1]], ["tile_rx", "sp", [-1, 1]], ["auto_unroll_max_step", "ot", 1500], ["unroll_explicit", "ot", 0]]}, "result": [[0.00224728022], 0, 2.5195252895355225, 1648622908.1750824], "version": 0.2, "tvm_version": "0.8.dev0"}
{"input": ["opencl -keys=adreno,opencl,gpu -device=adreno -max_num_threads=256", "depthwise_conv2d_nhwc.image2d", [["TENSOR", [1, 65, 65, 576], "float16"], ["TENSOR", [3, 3, 576, 1], "float16"], [1, 1], [2, 2, 2, 2], [2, 2], "float32"], {}], "config": {"index": 680485, "code_hash": null, "entity": [["tile_fc", "sp", [-1, 1, 48]], ["tile_y", "sp", [-1, 1, 1]], ["tile_x", "sp", [-1, 1, 2]], ["tile_ry", "sp", [-1, 3]], ["tile_rx", "sp", [-1, 3]], ["auto_unroll_max_step", "ot", 1500], ["unroll_explicit", "ot", 1]]}, "result": [[0.0014347479200000001], 0, 6.59072470664978, 1648624761.8354967], "version": 0.2, "tvm_version": "0.8.dev0"}
{"input": ["opencl -keys=adreno,opencl,gpu -device=adreno -max_num_threads=256", "conv2d_nhwc.image2d", [["TENSOR", [1, 65, 65, 576], "float16"], ["TENSOR", [1, 1, 576, 160], "float16"], [1, 1], [0, 0, 0, 0], [1, 1], "float32"], {}], "config": {"index": 12290, "code_hash": null, "entity": [["tile_fc", "sp", [-1, 1, 40]], ["tile_y", "sp", [-1, 1, 4]], ["tile_x", "sp", [-1, 4, 1]], ["tile_rcc", "sp", [-1, 1]], ["tile_ry", "sp", [-1, 1]], ["tile_rx", "sp", [-1, 1]], ["auto_unroll_max_step", "ot", 512], ["unroll_explicit", "ot", 1]]}, "result": [[0.004484023940000001], 0, 6.800404071807861, 1648626070.521931], "version": 0.2, "tvm_version": "0.8.dev0"}
{"input": ["opencl -keys=adreno,opencl,gpu -device=adreno -max_num_threads=256", "conv2d_nhwc.image2d", [["TENSOR", [1, 65, 65, 960], "float16"], ["TENSOR", [1, 1, 960, 160], "float16"], [1, 1], [0, 0, 0, 0], [1, 1], "float32"], {}], "config": {"index": 20450, "code_hash": null, "entity": [["tile_fc", "sp", [-1, 1, 40]], ["tile_y", "sp", [-1, 1, 4]], ["tile_x", "sp", [-1, 4, 1]], ["tile_rcc", "sp", [-1, 1]], ["tile_ry", "sp", [-1, 1]], ["tile_rx", "sp", [-1, 1]], ["auto_unroll_max_step", "ot", 1500], ["unroll_explicit", "ot", 1]]}, "result": [[0.007463246880000001], 0, 4.025730133056641, 1648629206.8440828], "version": 0.2, "tvm_version": "0.8.dev0"}
{"input": ["opencl -keys=adreno,opencl,gpu -device=adreno -max_num_threads=256", "conv2d_nhwc.image2d", [["TENSOR", [1, 65, 65, 160], "float16"], ["TENSOR", [1, 1, 160, 960], "float16"], [1, 1], [0, 0, 0, 0], [1, 1], "float32"], {}], "config": {"index": 29920, "code_hash": null, "entity": [["tile_fc", "sp", [-1, 1, 48]], ["tile_y", "sp", [-1, 1, 4]], ["tile_x", "sp", [-1, 4, 1]], ["tile_rcc", "sp", [-1, 40]], ["tile_ry", "sp", [-1, 1]], ["tile_rx", "sp", [-1, 1]], ["auto_unroll_max_step", "ot", 1500], ["unroll_explicit", "ot", 0]]}, "result": [[0.005866973960000001], 0, 7.60110068321228, 1648632166.5096722], "version": 0.2, "tvm_version": "0.8.dev0"}
{"input": ["opencl -keys=adreno,opencl,gpu -device=adreno -max_num_threads=256", "depthwise_conv2d_nhwc.image2d", [["TENSOR", [1, 65, 65, 960], "float16"], ["TENSOR", [3, 3, 960, 1], "float16"], [1, 1], [4, 4, 4, 4], [4, 4], "float32"], {}], "config": {"index": 802027, "code_hash": null, "entity": [["tile_fc", "sp", [-1, 1, 60]], ["tile_y", "sp", [-1, 1, 1]], ["tile_x", "sp", [-1, 1, 2]], ["tile_ry", "sp", [-1, 1]], ["tile_rx", "sp", [-1, 3]], ["auto_unroll_max_step", "ot", 512], ["unroll_explicit", "ot", 1]]}, "result": [[0.00210897292], 0, 10.496171474456787, 1648634551.1455326], "version": 0.2, "tvm_version": "0.8.dev0"}
{"input": ["opencl -keys=adreno,opencl,gpu -device=adreno -max_num_threads=256", "conv2d_nhwc.image2d", [["TENSOR", [1, 65, 65, 960], "float16"], ["TENSOR", [1, 1, 960, 320], "float16"], [1, 1], [0, 0, 0, 0], [1, 1], "float32"], {}], "config": {"index": 23639, "code_hash": null, "entity": [["tile_fc", "sp", [-1, 1, 80]], ["tile_y", "sp", [-1, 1, 4]], ["tile_x", "sp", [-1, 4, 1]], ["tile_rcc", "sp", [-1, 1]], ["tile_ry", "sp", [-1, 1]], ["tile_rx", "sp", [-1, 1]], ["auto_unroll_max_step", "ot", 0], ["unroll_explicit", "ot", 1]]}, "result": [[0.012252186440000002], 0, 5.7484705448150635, 1648637066.487948], "version": 0.2, "tvm_version": "0.8.dev0"}
{"input": ["opencl -keys=adreno,opencl,gpu -device=adreno -max_num_threads=256", "conv2d_nhwc.image2d", [["TENSOR", [1, 1, 1, 320], "float16"], ["TENSOR", [1, 1, 320, 256], "float16"], [1, 1], [0, 0, 0, 0], [1, 1], "float32"], {}], "config": {"index": 15031, "code_hash": null, "entity": [["tile_fc", "sp", [-1, 1, 16]], ["tile_y", "sp", [-1, 1, 2]], ["tile_x", "sp", [-1, 4, 1]], ["tile_rcc", "sp", [-1, 10]], ["tile_ry", "sp", [-1, 1]], ["tile_rx", "sp", [-1, 1]], ["auto_unroll_max_step", "ot", 1500], ["unroll_explicit", "ot", 1]]}, "result": [[0.0001025177], 0, 1.3829617500305176, 1648638566.3031085], "version": 0.2, "tvm_version": "0.8.dev0"}
{"input": ["opencl -keys=adreno,opencl,gpu -device=adreno -max_num_threads=256", "conv2d_nhwc.image2d", [["TENSOR", [1, 65, 65, 512], "float16"], ["TENSOR", [1, 1, 512, 256], "float16"], [1, 1], [0, 0, 0, 0], [1, 1], "float32"], {}], "config": {"index": 10718, "code_hash": null, "entity": [["tile_fc", "sp", [-1, 1, 64]], ["tile_y", "sp", [-1, 4, 1]], ["tile_x", "sp", [-1, 1, 2]], ["tile_rcc", "sp", [-1, 128]], ["tile_ry", "sp", [-1, 1]], ["tile_rx", "sp", [-1, 1]], ["auto_unroll_max_step", "ot", 512], ["unroll_explicit", "ot", 1]]}, "result": [[0.00516688334], 0, 7.041647911071777, 1648640123.2179577], "version": 0.2, "tvm_version": "0.8.dev0"}
{"input": ["opencl -keys=adreno,opencl,gpu -device=adreno -max_num_threads=256", "conv2d_nhwc.image2d", [["TENSOR", [1, 65, 65, 256], "float16"], ["TENSOR", [1, 1, 256, 21], "float16"], [1, 1], [0, 0, 0, 0], [1, 1], "float32"], {}], "config": {"index": 138, "code_hash": null, "entity": [["tile_fc", "sp", [-1, 1, 6]], ["tile_y", "sp", [-1, 2, 2]], ["tile_x", "sp", [-1, 1, 4]], ["tile_rcc", "sp", [-1, 2]], ["tile_ry", "sp", [-1, 1]], ["tile_rx", "sp", [-1, 1]], ["auto_unroll_max_step", "ot", 1500], ["unroll_explicit", "ot", 0]]}, "result": [[0.00078802604], 0, 3.063723087310791, 1648640990.2506938], "version": 0.2, "tvm_version": "0.8.dev0"}
{"input": ["opencl -keys=adreno,opencl,gpu -device=adreno -max_num_threads=256 -texture_spatial_limit=16384 -thread_warp_size=1", "conv2d_nhwc.image2d", [["TENSOR", [1, 513, 513, 3], "float16"], ["TENSOR", [3, 3, 3, 32], "float16"], [2, 2], [1, 1, 1, 1], [1, 1], "float32"], {}], "config": {"index": 18973, "code_hash": null, "entity": [["tile_fc", "sp", [-1, 2, 2]], ["tile_y", "sp", [-1, 1, 10]], ["tile_x", "sp", [-1, 2, 10]], ["tile_rcc", "sp", [-1, 1]], ["tile_ry", "sp", [-1, 3]], ["tile_rx", "sp", [-1, 1]], ["auto_unroll_max_step", "ot", 1500], ["unroll_explicit", "ot", 0]]}, "result": [[0.0009062144000000002], 0, 14.17549204826355, 1660806871.8413656], "version": 0.2, "tvm_version": "0.10.dev0"}