logs/mace_deeplabv3.texture.float32.autotvm.log
{"input": ["opencl -keys=adreno,opencl,gpu -device=adreno -max_num_threads=256", "conv2d_nhwc.image2d", [["TENSOR", [1, 65, 65, 320], "float32"], ["TENSOR", [1, 1, 320, 256], "float32"], [1, 1], [0, 0, 0, 0], [1, 1], "float32"], {}], "config": {"index": 3068, "code_hash": null, "entity": [["tile_fc", "sp", [-1, 1, 64]], ["tile_y", "sp", [-1, 1, 2]], ["tile_x", "sp", [-1, 4, 1]], ["tile_rcc", "sp", [-1, 2]], ["tile_ry", "sp", [-1, 1]], ["tile_rx", "sp", [-1, 1]], ["auto_unroll_max_step", "ot", 512], ["unroll_explicit", "ot", 0]]}, "result": [[0.0028138739600000002], 0, 2.9922256469726562, 1648651454.1168728], "version": 0.2, "tvm_version": "0.8.dev0"}
{"input": ["opencl -keys=adreno,opencl,gpu -device=adreno -max_num_threads=256", "conv2d_nhwc.image2d", [["TENSOR", [1, 513, 513, 3], "float32"], ["TENSOR", [3, 3, 3, 32], "float32"], [2, 2], [1, 1, 1, 1], [1, 1], "float32"], {}], "config": {"index": 13462, "code_hash": null, "entity": [["tile_fc", "sp", [-1, 1, 8]], ["tile_y", "sp", [-1, 1, 2]], ["tile_x", "sp", [-1, 5, 4]], ["tile_rcc", "sp", [-1, 1]], ["tile_ry", "sp", [-1, 3]], ["tile_rx", "sp", [-1, 3]], ["auto_unroll_max_step", "ot", 1500], ["unroll_explicit", "ot", 0]]}, "result": [[0.0016744854200000001], 0, 3.6055397987365723, 1648653504.1280892], "version": 0.2, "tvm_version": "0.8.dev0"}
{"input": ["opencl -keys=adreno,opencl,gpu -device=adreno -max_num_threads=256", "depthwise_conv2d_nhwc.image2d", [["TENSOR", [1, 257, 257, 32], "float32"], ["TENSOR", [3, 3, 32, 1], "float32"], [1, 1], [1, 1, 1, 1], [1, 1], "float32"], {}], "config": {"index": 628597, "code_hash": null, "entity": [["tile_fc", "sp", [-1, 1, 4]], ["tile_y", "sp", [-1, 5, 1]], ["tile_x", "sp", [-1, 1, 10]], ["tile_ry", "sp", [-1, 3]], ["tile_rx", "sp", [-1, 1]], ["auto_unroll_max_step", "ot", 1500], ["unroll_explicit", "ot", 1]]}, "result": [[0.0012159458399999999], 0, 4.32068943977356, 1648656194.9561028], "version": 0.2, "tvm_version": "0.8.dev0"}
{"input": ["opencl -keys=adreno,opencl,gpu -device=adreno -max_num_threads=256", "conv2d_nhwc.image2d", [["TENSOR", [1, 257, 257, 32], "float32"], ["TENSOR", [1, 1, 32, 16], "float32"], [1, 1], [0, 0, 0, 0], [1, 1], "float32"], {}], "config": {"index": 376, "code_hash": null, "entity": [["tile_fc", "sp", [-1, 2, 2]], ["tile_y", "sp", [-1, 5, 2]], ["tile_x", "sp", [-1, 1, 13]], ["tile_rcc", "sp", [-1, 1]], ["tile_ry", "sp", [-1, 1]], ["tile_rx", "sp", [-1, 1]], ["auto_unroll_max_step", "ot", 0], ["unroll_explicit", "ot", 0]]}, "result": [[0.0016599770799999999], 0, 3.9672207832336426, 1648656364.8311136], "version": 0.2, "tvm_version": "0.8.dev0"}
{"input": ["opencl -keys=adreno,opencl,gpu -device=adreno -max_num_threads=256", "conv2d_nhwc.image2d", [["TENSOR", [1, 257, 257, 16], "float32"], ["TENSOR", [1, 1, 16, 96], "float32"], [1, 1], [0, 0, 0, 0], [1, 1], "float32"], {}], "config": {"index": 21399, "code_hash": null, "entity": [["tile_fc", "sp", [-1, 1, 24]], ["tile_y", "sp", [-1, 1, 1]], ["tile_x", "sp", [-1, 4, 13]], ["tile_rcc", "sp", [-1, 2]], ["tile_ry", "sp", [-1, 1]], ["tile_rx", "sp", [-1, 1]], ["auto_unroll_max_step", "ot", 512], ["unroll_explicit", "ot", 0]]}, "result": [[0.0033295437600000003], 0, 6.901713848114014, 1648659856.0688577], "version": 0.2, "tvm_version": "0.8.dev0"}
{"input": ["opencl -keys=adreno,opencl,gpu -device=adreno -max_num_threads=256", "depthwise_conv2d_nhwc.image2d", [["TENSOR", [1, 257, 257, 96], "float32"], ["TENSOR", [3, 3, 96, 1], "float32"], [2, 2], [1, 1, 1, 1], [1, 1], "float32"], {}], "config": {"index": 568068, "code_hash": null, "entity": [["tile_fc", "sp", [-1, 1, 4]], ["tile_y", "sp", [-1, 2, 11]], ["tile_x", "sp", [-1, 1, 4]], ["tile_ry", "sp", [-1, 1]], ["tile_rx", "sp", [-1, 3]], ["auto_unroll_max_step", "ot", 512], ["unroll_explicit", "ot", 0]]}, "result": [[0.00298323228], 0, 7.311632394790649, 1648661627.5917509], "version": 0.2, "tvm_version": "0.8.dev0"}
{"input": ["opencl -keys=adreno,opencl,gpu -device=adreno -max_num_threads=256", "conv2d_nhwc.image2d", [["TENSOR", [1, 129, 129, 96], "float32"], ["TENSOR", [1, 1, 96, 24], "float32"], [1, 1], [0, 0, 0, 0], [1, 1], "float32"], {}], "config": {"index": 2365, "code_hash": null, "entity": [["tile_fc", "sp", [-1, 1, 6]], ["tile_y", "sp", [-1, 1, 3]], ["tile_x", "sp", [-1, 4, 11]], ["tile_rcc", "sp", [-1, 2]], ["tile_ry", "sp", [-1, 1]], ["tile_rx", "sp", [-1, 1]], ["auto_unroll_max_step", "ot", 0], ["unroll_explicit", "ot", 0]]}, "result": [[0.0017589864600000003], 0, 5.776928424835205, 1648665074.9659507], "version": 0.2, "tvm_version": "0.8.dev0"}
{"input": ["opencl -keys=adreno,opencl,gpu -device=adreno -max_num_threads=256", "depthwise_conv2d_nhwc.image2d", [["TENSOR", [1, 129, 129, 144], "float32"], ["TENSOR", [3, 3, 144, 1], "float32"], [1, 1], [1, 1, 1, 1], [1, 1], "float32"], {}], "config": {"index": 2158294, "code_hash": null, "entity": [["tile_fc", "sp", [-1, 3, 4]], ["tile_y", "sp", [-1, 1, 2]], ["tile_x", "sp", [-1, 1, 6]], ["tile_ry", "sp", [-1, 1]], ["tile_rx", "sp", [-1, 1]], ["auto_unroll_max_step", "ot", 1500], ["unroll_explicit", "ot", 1]]}, "result": [[0.00157046458], 0, 9.563112735748291, 1648667515.9066617], "version": 0.2, "tvm_version": "0.8.dev0"}
{"input": ["opencl -keys=adreno,opencl,gpu -device=adreno -max_num_threads=256", "conv2d_nhwc.image2d", [["TENSOR", [1, 129, 129, 144], "float32"], ["TENSOR", [1, 1, 144, 24], "float32"], [1, 1], [0, 0, 0, 0], [1, 1], "float32"], {}], "config": {"index": 4313, "code_hash": null, "entity": [["tile_fc", "sp", [-1, 1, 6]], ["tile_y", "sp", [-1, 1, 3]], ["tile_x", "sp", [-1, 4, 3]], ["tile_rcc", "sp", [-1, 4]], ["tile_ry", "sp", [-1, 1]], ["tile_rx", "sp", [-1, 1]], ["auto_unroll_max_step", "ot", 0], ["unroll_explicit", "ot", 0]]}, "result": [[0.0013693604199999999], 0, 7.106023550033569, 1648667659.604015], "version": 0.2, "tvm_version": "0.8.dev0"}
{"input": ["opencl -keys=adreno,opencl,gpu -device=adreno -max_num_threads=256", "conv2d_nhwc.image2d", [["TENSOR", [1, 129, 129, 24], "float32"], ["TENSOR", [1, 1, 24, 144], "float32"], [1, 1], [0, 0, 0, 0], [1, 1], "float32"], {}], "config": {"index": 38911, "code_hash": null, "entity": [["tile_fc", "sp", [-1, 1, 36]], ["tile_y", "sp", [-1, 1, 3]], ["tile_x", "sp", [-1, 4, 3]], ["tile_rcc", "sp", [-1, 2]], ["tile_ry", "sp", [-1, 1]], ["tile_rx", "sp", [-1, 1]], ["auto_unroll_max_step", "ot", 512], ["unroll_explicit", "ot", 0]]}, "result": [[0.00109894582], 0, 6.343575954437256, 1648670072.9126196], "version": 0.2, "tvm_version": "0.8.dev0"}
{"input": ["opencl -keys=adreno,opencl,gpu -device=adreno -max_num_threads=256", "depthwise_conv2d_nhwc.image2d", [["TENSOR", [1, 129, 129, 144], "float32"], ["TENSOR", [3, 3, 144, 1], "float32"], [2, 2], [1, 1, 1, 1], [1, 1], "float32"], {}], "config": {"index": 167434, "code_hash": null, "entity": [["tile_fc", "sp", [-1, 2, 18]], ["tile_y", "sp", [-1, 1, 2]], ["tile_x", "sp", [-1, 1, 2]], ["tile_ry", "sp", [-1, 1]], ["tile_rx", "sp", [-1, 3]], ["auto_unroll_max_step", "ot", 0], ["unroll_explicit", "ot", 1]]}, "result": [[0.00102834062], 0, 6.458738088607788, 1648672130.1056657], "version": 0.2, "tvm_version": "0.8.dev0"}
{"input": ["opencl -keys=adreno,opencl,gpu -device=adreno -max_num_threads=256", "conv2d_nhwc.image2d", [["TENSOR", [1, 65, 65, 144], "float32"], ["TENSOR", [1, 1, 144, 32], "float32"], [1, 1], [0, 0, 0, 0], [1, 1], "float32"], {}], "config": {"index": 534, "code_hash": null, "entity": [["tile_fc", "sp", [-1, 1, 8]], ["tile_y", "sp", [-1, 1, 4]], ["tile_x", "sp", [-1, 4, 1]], ["tile_rcc", "sp", [-1, 2]], ["tile_ry", "sp", [-1, 1]], ["tile_rx", "sp", [-1, 1]], ["auto_unroll_max_step", "ot", 1500], ["unroll_explicit", "ot", 0]]}, "result": [[0.00039174168], 0, 1.373302698135376, 1648672847.162046], "version": 0.2, "tvm_version": "0.8.dev0"}
{"input": ["opencl -keys=adreno,opencl,gpu -device=adreno -max_num_threads=256", "conv2d_nhwc.image2d", [["TENSOR", [1, 65, 65, 192], "float32"], ["TENSOR", [1, 1, 192, 32], "float32"], [1, 1], [0, 0, 0, 0], [1, 1], "float32"], {}], "config": {"index": 590, "code_hash": null, "entity": [["tile_fc", "sp", [-1, 1, 8]], ["tile_y", "sp", [-1, 1, 4]], ["tile_x", "sp", [-1, 4, 1]], ["tile_rcc", "sp", [-1, 2]], ["tile_ry", "sp", [-1, 1]], ["tile_rx", "sp", [-1, 1]], ["auto_unroll_max_step", "ot", 1500], ["unroll_explicit", "ot", 0]]}, "result": [[0.00052967916], 0, 4.190536737442017, 1648673339.5648997], "version": 0.2, "tvm_version": "0.8.dev0"}
{"input": ["opencl -keys=adreno,opencl,gpu -device=adreno -max_num_threads=256", "conv2d_nhwc.image2d", [["TENSOR", [1, 65, 65, 32], "float32"], ["TENSOR", [1, 1, 32, 192], "float32"], [1, 1], [0, 0, 0, 0], [1, 1], "float32"], {}], "config": {"index": 2810, "code_hash": null, "entity": [["tile_fc", "sp", [-1, 1, 48]], ["tile_y", "sp", [-1, 1, 4]], ["tile_x", "sp", [-1, 4, 1]], ["tile_rcc", "sp", [-1, 2]], ["tile_ry", "sp", [-1, 1]], ["tile_rx", "sp", [-1, 1]], ["auto_unroll_max_step", "ot", 1500], ["unroll_explicit", "ot", 0]]}, "result": [[0.00028095832], 0, 2.283971071243286, 1648674206.8707101], "version": 0.2, "tvm_version": "0.8.dev0"}
{"input": ["opencl -keys=adreno,opencl,gpu -device=adreno -max_num_threads=256", "depthwise_conv2d_nhwc.image2d", [["TENSOR", [1, 65, 65, 192], "float32"], ["TENSOR", [3, 3, 192, 1], "float32"], [1, 1], [1, 1, 1, 1], [1, 1], "float32"], {}], "config": {"index": 241737, "code_hash": null, "entity": [["tile_fc", "sp", [-1, 1, 24]], ["tile_y", "sp", [-1, 2, 2]], ["tile_x", "sp", [-1, 1, 4]], ["tile_ry", "sp", [-1, 1]], ["tile_rx", "sp", [-1, 1]], ["auto_unroll_max_step", "ot", 512], ["unroll_explicit", "ot", 1]]}, "result": [[0.0005108427], 0, 2.334559440612793, 1648675544.4596496], "version": 0.2, "tvm_version": "0.8.dev0"}
{"input": ["opencl -keys=adreno,opencl,gpu -device=adreno -max_num_threads=256", "conv2d_nhwc.image2d", [["TENSOR", [1, 65, 65, 192], "float32"], ["TENSOR", [1, 1, 192, 64], "float32"], [1, 1], [0, 0, 0, 0], [1, 1], "float32"], {}], "config": {"index": 129, "code_hash": null, "entity": [["tile_fc", "sp", [-1, 1, 16]], ["tile_y", "sp", [-1, 4, 1]], ["tile_x", "sp", [-1, 1, 4]], ["tile_rcc", "sp", [-1, 2]], ["tile_ry", "sp", [-1, 1]], ["tile_rx", "sp", [-1, 1]], ["auto_unroll_max_step", "ot", 0], ["unroll_explicit", "ot", 0]]}, "result": [[0.0006511552000000001], 0, 3.6004974842071533, 1648676118.2065697], "version": 0.2, "tvm_version": "0.8.dev0"}
{"input": ["opencl -keys=adreno,opencl,gpu -device=adreno -max_num_threads=256", "conv2d_nhwc.image2d", [["TENSOR", [1, 65, 65, 384], "float32"], ["TENSOR", [1, 1, 384, 64], "float32"], [1, 1], [0, 0, 0, 0], [1, 1], "float32"], {}], "config": {"index": 272, "code_hash": null, "entity": [["tile_fc", "sp", [-1, 1, 16]], ["tile_y", "sp", [-1, 1, 4]], ["tile_x", "sp", [-1, 2, 2]], ["tile_rcc", "sp", [-1, 4]], ["tile_ry", "sp", [-1, 1]], ["tile_rx", "sp", [-1, 1]], ["auto_unroll_max_step", "ot", 0], ["unroll_explicit", "ot", 0]]}, "result": [[0.0031721822799999997], 0, 6.348290205001831, 1648677574.0542247], "version": 0.2, "tvm_version": "0.8.dev0"}
{"input": ["opencl -keys=adreno,opencl,gpu -device=adreno -max_num_threads=256", "conv2d_nhwc.image2d", [["TENSOR", [1, 65, 65, 64], "float32"], ["TENSOR", [1, 1, 64, 384], "float32"], [1, 1], [0, 0, 0, 0], [1, 1], "float32"], {}], "config": {"index": 3593, "code_hash": null, "entity": [["tile_fc", "sp", [-1, 1, 96]], ["tile_y", "sp", [-1, 4, 1]], ["tile_x", "sp", [-1, 1, 2]], ["tile_rcc", "sp", [-1, 2]], ["tile_ry", "sp", [-1, 1]], ["tile_rx", "sp", [-1, 1]], ["auto_unroll_max_step", "ot", 512], ["unroll_explicit", "ot", 0]]}, "result": [[0.0008924427], 0, 2.202962636947632, 1648678537.8580992], "version": 0.2, "tvm_version": "0.8.dev0"}
{"input": ["opencl -keys=adreno,opencl,gpu -device=adreno -max_num_threads=256", "depthwise_conv2d_nhwc.image2d", [["TENSOR", [1, 65, 65, 384], "float32"], ["TENSOR", [3, 3, 384, 1], "float32"], [1, 1], [2, 2, 2, 2], [2, 2], "float32"], {}], "config": {"index": 477844, "code_hash": null, "entity": [["tile_fc", "sp", [-1, 2, 16]], ["tile_y", "sp", [-1, 1, 2]], ["tile_x", "sp", [-1, 2, 2]], ["tile_ry", "sp", [-1, 3]], ["tile_rx", "sp", [-1, 3]], ["auto_unroll_max_step", "ot", 1500], ["unroll_explicit", "ot", 1]]}, "result": [[0.0009779749999999999], 0, 6.754948854446411, 1648680166.8719046], "version": 0.2, "tvm_version": "0.8.dev0"}
{"input": ["opencl -keys=adreno,opencl,gpu -device=adreno -max_num_threads=256", "conv2d_nhwc.image2d", [["TENSOR", [1, 65, 65, 384], "float32"], ["TENSOR", [1, 1, 384, 96], "float32"], [1, 1], [0, 0, 0, 0], [1, 1], "float32"], {}], "config": {"index": 216, "code_hash": null, "entity": [["tile_fc", "sp", [-1, 1, 24]], ["tile_y", "sp", [-1, 4, 1]], ["tile_x", "sp", [-1, 1, 4]], ["tile_rcc", "sp", [-1, 2]], ["tile_ry", "sp", [-1, 1]], ["tile_rx", "sp", [-1, 1]], ["auto_unroll_max_step", "ot", 0], ["unroll_explicit", "ot", 0]]}, "result": [[0.0029474270999999995], 0, 5.970347166061401, 1648681407.8809366], "version": 0.2, "tvm_version": "0.8.dev0"}
{"input": ["opencl -keys=adreno,opencl,gpu -device=adreno -max_num_threads=256", "conv2d_nhwc.image2d", [["TENSOR", [1, 65, 65, 576], "float32"], ["TENSOR", [1, 1, 576, 96], "float32"], [1, 1], [0, 0, 0, 0], [1, 1], "float32"], {}], "config": {"index": 2336, "code_hash": null, "entity": [["tile_fc", "sp", [-1, 1, 24]], ["tile_y", "sp", [-1, 2, 2]], ["tile_x", "sp", [-1, 1, 4]], ["tile_rcc", "sp", [-1, 3]], ["tile_ry", "sp", [-1, 1]], ["tile_rx", "sp", [-1, 1]], ["auto_unroll_max_step", "ot", 512], ["unroll_explicit", "ot", 0]]}, "result": [[0.00358113228], 0, 10.117865324020386, 1648682414.9040368], "version": 0.2, "tvm_version": "0.8.dev0"}
{"input": ["opencl -keys=adreno,opencl,gpu -device=adreno -max_num_threads=256", "conv2d_nhwc.image2d", [["TENSOR", [1, 65, 65, 96], "float32"], ["TENSOR", [1, 1, 96, 576], "float32"], [1, 1], [0, 0, 0, 0], [1, 1], "float32"], {}], "config": {"index": 7540, "code_hash": null, "entity": [["tile_fc", "sp", [-1, 1, 144]], ["tile_y", "sp", [-1, 1, 2]], ["tile_x", "sp", [-1, 4, 1]], ["tile_rcc", "sp", [-1, 2]], ["tile_ry", "sp", [-1, 1]], ["tile_rx", "sp", [-1, 1]], ["auto_unroll_max_step", "ot", 512], ["unroll_explicit", "ot", 0]]}, "result": [[0.0033510875], 0, 3.5336973667144775, 1648685612.3021657], "version": 0.2, "tvm_version": "0.8.dev0"}
{"input": ["opencl -keys=adreno,opencl,gpu -device=adreno -max_num_threads=256", "depthwise_conv2d_nhwc.image2d", [["TENSOR", [1, 65, 65, 576], "float32"], ["TENSOR", [3, 3, 576, 1], "float32"], [1, 1], [2, 2, 2, 2], [2, 2], "float32"], {}], "config": {"index": 380206, "code_hash": null, "entity": [["tile_fc", "sp", [-1, 1, 6]], ["tile_y", "sp", [-1, 1, 17]], ["tile_x", "sp", [-1, 1, 1]], ["tile_ry", "sp", [-1, 3]], ["tile_rx", "sp", [-1, 1]], ["auto_unroll_max_step", "ot", 0], ["unroll_explicit", "ot", 1]]}, "result": [[0.00204589688], 0, 9.3655264377594, 1648687185.48602], "version": 0.2, "tvm_version": "0.8.dev0"}
{"input": ["opencl -keys=adreno,opencl,gpu -device=adreno -max_num_threads=256", "conv2d_nhwc.image2d", [["TENSOR", [1, 65, 65, 576], "float32"], ["TENSOR", [1, 1, 576, 160], "float32"], [1, 1], [0, 0, 0, 0], [1, 1], "float32"], {}], "config": {"index": 358, "code_hash": null, "entity": [["tile_fc", "sp", [-1, 1, 40]], ["tile_y", "sp", [-1, 4, 1]], ["tile_x", "sp", [-1, 1, 4]], ["tile_rcc", "sp", [-1, 2]], ["tile_ry", "sp", [-1, 1]], ["tile_rx", "sp", [-1, 1]], ["auto_unroll_max_step", "ot", 0], ["unroll_explicit", "ot", 0]]}, "result": [[0.00645233438], 0, 8.727845668792725, 1648689441.8409078], "version": 0.2, "tvm_version": "0.8.dev0"}
{"input": ["opencl -keys=adreno,opencl,gpu -device=adreno -max_num_threads=256", "conv2d_nhwc.image2d", [["TENSOR", [1, 65, 65, 960], "float32"], ["TENSOR", [1, 1, 960, 160], "float32"], [1, 1], [0, 0, 0, 0], [1, 1], "float32"], {}], "config": {"index": 8403, "code_hash": null, "entity": [["tile_fc", "sp", [-1, 1, 40]], ["tile_y", "sp", [-1, 1, 2]], ["tile_x", "sp", [-1, 4, 1]], ["tile_rcc", "sp", [-1, 2]], ["tile_ry", "sp", [-1, 1]], ["tile_rx", "sp", [-1, 1]], ["auto_unroll_max_step", "ot", 1500], ["unroll_explicit", "ot", 0]]}, "result": [[0.01214369998], 0, 14.362280368804932, 1648693399.1887515], "version": 0.2, "tvm_version": "0.8.dev0"}
{"input": ["opencl -keys=adreno,opencl,gpu -device=adreno -max_num_threads=256", "conv2d_nhwc.image2d", [["TENSOR", [1, 65, 65, 160], "float32"], ["TENSOR", [1, 1, 160, 960], "float32"], [1, 1], [0, 0, 0, 0], [1, 1], "float32"], {}], "config": {"index": 1716, "code_hash": null, "entity": [["tile_fc", "sp", [-1, 1, 48]], ["tile_y", "sp", [-1, 1, 4]], ["tile_x", "sp", [-1, 4, 1]], ["tile_rcc", "sp", [-1, 2]], ["tile_ry", "sp", [-1, 1]], ["tile_rx", "sp", [-1, 1]], ["auto_unroll_max_step", "ot", 0], ["unroll_explicit", "ot", 0]]}, "result": [[0.0090737375], 0, 12.739280700683594, 1648696904.552916], "version": 0.2, "tvm_version": "0.8.dev0"}
{"input": ["opencl -keys=adreno,opencl,gpu -device=adreno -max_num_threads=256", "depthwise_conv2d_nhwc.image2d", [["TENSOR", [1, 65, 65, 960], "float32"], ["TENSOR", [3, 3, 960, 1], "float32"], [1, 1], [4, 4, 4, 4], [4, 4], "float32"], {}], "config": {"index": 802823, "code_hash": null, "entity": [["tile_fc", "sp", [-1, 1, 24]], ["tile_y", "sp", [-1, 1, 2]], ["tile_x", "sp", [-1, 1, 2]], ["tile_ry", "sp", [-1, 1]], ["tile_rx", "sp", [-1, 3]], ["auto_unroll_max_step", "ot", 512], ["unroll_explicit", "ot", 1]]}, "result": [[0.0036558125], 0, 14.542965412139893, 1648698375.4792662], "version": 0.2, "tvm_version": "0.8.dev0"}
{"input": ["opencl -keys=adreno,opencl,gpu -device=adreno -max_num_threads=256", "conv2d_nhwc.image2d", [["TENSOR", [1, 65, 65, 960], "float32"], ["TENSOR", [1, 1, 960, 320], "float32"], [1, 1], [0, 0, 0, 0], [1, 1], "float32"], {}], "config": {"index": 16136, "code_hash": null, "entity": [["tile_fc", "sp", [-1, 1, 80]], ["tile_y", "sp", [-1, 2, 2]], ["tile_x", "sp", [-1, 2, 1]], ["tile_rcc", "sp", [-1, 2]], ["tile_ry", "sp", [-1, 1]], ["tile_rx", "sp", [-1, 1]], ["auto_unroll_max_step", "ot", 1500], ["unroll_explicit", "ot", 0]]}, "result": [[0.0189401375], 0, 18.191443920135498, 1648702356.9749217], "version": 0.2, "tvm_version": "0.8.dev0"}
{"input": ["opencl -keys=adreno,opencl,gpu -device=adreno -max_num_threads=256", "conv2d_nhwc.image2d", [["TENSOR", [1, 1, 1, 320], "float32"], ["TENSOR", [1, 1, 320, 256], "float32"], [1, 1], [0, 0, 0, 0], [1, 1], "float32"], {}], "config": {"index": 2803, "code_hash": null, "entity": [["tile_fc", "sp", [-1, 1, 8]], ["tile_y", "sp", [-1, 1, 4]], ["tile_x", "sp", [-1, 4, 1]], ["tile_rcc", "sp", [-1, 1]], ["tile_ry", "sp", [-1, 1]], ["tile_rx", "sp", [-1, 1]], ["auto_unroll_max_step", "ot", 512], ["unroll_explicit", "ot", 0]]}, "result": [[0.000109725], 0, 1.2450675964355469, 1648704283.2360115], "version": 0.2, "tvm_version": "0.8.dev0"}
{"input": ["opencl -keys=adreno,opencl,gpu -device=adreno -max_num_threads=256", "conv2d_nhwc.image2d", [["TENSOR", [1, 65, 65, 512], "float32"], ["TENSOR", [1, 1, 512, 256], "float32"], [1, 1], [0, 0, 0, 0], [1, 1], "float32"], {}], "config": {"index": 2522, "code_hash": null, "entity": [["tile_fc", "sp", [-1, 1, 32]], ["tile_y", "sp", [-1, 1, 2]], ["tile_x", "sp", [-1, 4, 1]], ["tile_rcc", "sp", [-1, 2]], ["tile_ry", "sp", [-1, 1]], ["tile_rx", "sp", [-1, 1]], ["auto_unroll_max_step", "ot", 512], ["unroll_explicit", "ot", 0]]}, "result": [[0.00817948228], 0, 10.916419506072998, 1648706336.8776917], "version": 0.2, "tvm_version": "0.8.dev0"}
{"input": ["opencl -keys=adreno,opencl,gpu -device=adreno -max_num_threads=256", "conv2d_nhwc.image2d", [["TENSOR", [1, 65, 65, 256], "float32"], ["TENSOR", [1, 1, 256, 21], "float32"], [1, 1], [0, 0, 0, 0], [1, 1], "float32"], {}], "config": {"index": 305, "code_hash": null, "entity": [["tile_fc", "sp", [-1, 1, 6]], ["tile_y", "sp", [-1, 1, 4]], ["tile_x", "sp", [-1, 1, 4]], ["tile_rcc", "sp", [-1, 32]], ["tile_ry", "sp", [-1, 1]], ["tile_rx", "sp", [-1, 1]], ["auto_unroll_max_step", "ot", 512], ["unroll_explicit", "ot", 1]]}, "result": [[0.00149413124], 0, 5.2060019969940186, 1648707194.6572945], "version": 0.2, "tvm_version": "0.8.dev0"}
