logs/mace_deeplabv3.texture.float16.acc16.autotvm.log
{"input": ["opencl -keys=adreno,opencl,gpu -device=adreno -max_num_threads=256", "conv2d_nhwc.image2d", [["TENSOR", [1, 65, 65, 320], "float16"], ["TENSOR", [1, 1, 320, 256], "float16"], [1, 1], [0, 0, 0, 0], [1, 1], "float16"], {}], "config": {"index": 7970, "code_hash": null, "entity": [["tile_fc", "sp", [-1, 1, 64]], ["tile_y", "sp", [-1, 2, 2]], ["tile_x", "sp", [-1, 4, 1]], ["tile_rcc", "sp", [-1, 80]], ["tile_ry", "sp", [-1, 1]], ["tile_rx", "sp", [-1, 1]], ["auto_unroll_max_step", "ot", 1500], ["unroll_explicit", "ot", 0]]}, "result": [[0.00193092918], 0, 2.8746747970581055, 1648203918.488419], "version": 0.2, "tvm_version": "0.8.dev0"}
{"input": ["opencl -keys=adreno,opencl,gpu -device=adreno -max_num_threads=256", "conv2d_nhwc.image2d", [["TENSOR", [1, 513, 513, 3], "float16"], ["TENSOR", [3, 3, 3, 32], "float16"], [2, 2], [1, 1, 1, 1], [1, 1], "float16"], {}], "config": {"index": 9886, "code_hash": null, "entity": [["tile_fc", "sp", [-1, 1, 8]], ["tile_y", "sp", [-1, 2, 2]], ["tile_x", "sp", [-1, 5, 4]], ["tile_rcc", "sp", [-1, 1]], ["tile_ry", "sp", [-1, 1]], ["tile_rx", "sp", [-1, 1]], ["auto_unroll_max_step", "ot", 1500], ["unroll_explicit", "ot", 0]]}, "result": [[0.00058927292], 0, 2.1950106620788574, 1648205442.837185], "version": 0.2, "tvm_version": "0.8.dev0"}
{"input": ["opencl -keys=adreno,opencl,gpu -device=adreno -max_num_threads=256", "depthwise_conv2d_nhwc.image2d", [["TENSOR", [1, 257, 257, 32], "float16"], ["TENSOR", [3, 3, 32, 1], "float16"], [1, 1], [1, 1, 1, 1], [1, 1], "float16"], {}], "config": {"index": 689069, "code_hash": null, "entity": [["tile_fc", "sp", [-1, 1, 8]], ["tile_y", "sp", [-1, 4, 1]], ["tile_x", "sp", [-1, 1, 13]], ["tile_ry", "sp", [-1, 3]], ["tile_rx", "sp", [-1, 3]], ["auto_unroll_max_step", "ot", 1500], ["unroll_explicit", "ot", 1]]}, "result": [[0.0006445416600000001], 0, 6.300837278366089, 1648207156.5215988], "version": 0.2, "tvm_version": "0.8.dev0"}
{"input": ["opencl -keys=adreno,opencl,gpu -device=adreno -max_num_threads=256", "conv2d_nhwc.image2d", [["TENSOR", [1, 257, 257, 32], "float16"], ["TENSOR", [1, 1, 32, 16], "float16"], [1, 1], [0, 0, 0, 0], [1, 1], "float16"], {}], "config": {"index": 563, "code_hash": null, "entity": [["tile_fc", "sp", [-1, 1, 4]], ["tile_y", "sp", [-1, 1, 13]], ["tile_x", "sp", [-1, 4, 1]], ["tile_rcc", "sp", [-1, 2]], ["tile_ry", "sp", [-1, 1]], ["tile_rx", "sp", [-1, 1]], ["auto_unroll_max_step", "ot", 0], ["unroll_explicit", "ot", 0]]}, "result": [[0.00120527604], 0, 2.4554216861724854, 1648207911.1338272], "version": 0.2, "tvm_version": "0.8.dev0"}
{"input": ["opencl -keys=adreno,opencl,gpu -device=adreno -max_num_threads=256", "conv2d_nhwc.image2d", [["TENSOR", [1, 257, 257, 16], "float16"], ["TENSOR", [1, 1, 16, 96], "float16"], [1, 1], [0, 0, 0, 0], [1, 1], "float16"], {}], "config": {"index": 5140, "code_hash": null, "entity": [["tile_fc", "sp", [-1, 2, 12]], ["tile_y", "sp", [-1, 2, 5]], ["tile_x", "sp", [-1, 2, 2]], ["tile_rcc", "sp", [-1, 2]], ["tile_ry", "sp", [-1, 1]], ["tile_rx", "sp", [-1, 1]], ["auto_unroll_max_step", "ot", 0], ["unroll_explicit", "ot", 0]]}, "result": [[0.00167529896], 0, 8.626607656478882, 1648209678.4813542], "version": 0.2, "tvm_version": "0.8.dev0"}
{"input": ["opencl -keys=adreno,opencl,gpu -device=adreno -max_num_threads=256", "depthwise_conv2d_nhwc.image2d", [["TENSOR", [1, 257, 257, 96], "float16"], ["TENSOR", [3, 3, 96, 1], "float16"], [2, 2], [1, 1, 1, 1], [1, 1], "float16"], {}], "config": {"index": 654869, "code_hash": null, "entity": [["tile_fc", "sp", [-1, 1, 24]], ["tile_y", "sp", [-1, 1, 2]], ["tile_x", "sp", [-1, 1, 4]], ["tile_ry", "sp", [-1, 3]], ["tile_rx", "sp", [-1, 3]], ["auto_unroll_max_step", "ot", 512], ["unroll_explicit", "ot", 0]]}, "result": [[0.0012914125000000002], 0, 4.399378299713135, 1648211354.8074489], "version": 0.2, "tvm_version": "0.8.dev0"}
{"input": ["opencl -keys=adreno,opencl,gpu -device=adreno -max_num_threads=256", "conv2d_nhwc.image2d", [["TENSOR", [1, 129, 129, 96], "float16"], ["TENSOR", [1, 1, 96, 24], "float16"], [1, 1], [0, 0, 0, 0], [1, 1], "float16"], {}], "config": {"index": 1652, "code_hash": null, "entity": [["tile_fc", "sp", [-1, 1, 6]], ["tile_y", "sp", [-1, 2, 6]], ["tile_x", "sp", [-1, 2, 3]], ["tile_rcc", "sp", [-1, 2]], ["tile_ry", "sp", [-1, 1]], ["tile_rx", "sp", [-1, 1]], ["auto_unroll_max_step", "ot", 0], ["unroll_explicit", "ot", 0]]}, "result": [[0.00047219791999999995], 0, 3.4671273231506348, 1648212647.5473633], "version": 0.2, "tvm_version": "0.8.dev0"}
{"input": ["opencl -keys=adreno,opencl,gpu -device=adreno -max_num_threads=256", "depthwise_conv2d_nhwc.image2d", [["TENSOR", [1, 129, 129, 144], "float16"], ["TENSOR", [3, 3, 144, 1], "float16"], [1, 1], [1, 1, 1, 1], [1, 1], "float16"], {}], "config": {"index": 1738401, "code_hash": null, "entity": [["tile_fc", "sp", [-1, 1, 18]], ["tile_y", "sp", [-1, 1, 2]], ["tile_x", "sp", [-1, 1, 6]], ["tile_ry", "sp", [-1, 1]], ["tile_rx", "sp", [-1, 1]], ["auto_unroll_max_step", "ot", 512], ["unroll_explicit", "ot", 1]]}, "result": [[0.0008683875], 0, 3.1722447872161865, 1648214696.503808], "version": 0.2, "tvm_version": "0.8.dev0"}
{"input": ["opencl -keys=adreno,opencl,gpu -device=adreno -max_num_threads=256", "conv2d_nhwc.image2d", [["TENSOR", [1, 129, 129, 144], "float16"], ["TENSOR", [1, 1, 144, 24], "float16"], [1, 1], [0, 0, 0, 0], [1, 1], "float16"], {}], "config": {"index": 36774, "code_hash": null, "entity": [["tile_fc", "sp", [-1, 1, 6]], ["tile_y", "sp", [-1, 3, 11]], ["tile_x", "sp", [-1, 1, 1]], ["tile_rcc", "sp", [-1, 2]], ["tile_ry", "sp", [-1, 1]], ["tile_rx", "sp", [-1, 1]], ["auto_unroll_max_step", "ot", 0], ["unroll_explicit", "ot", 1]]}, "result": [[0.0009323489600000001], 0, 5.739629030227661, 1648215397.6511838], "version": 0.2, "tvm_version": "0.8.dev0"}
{"input": ["opencl -keys=adreno,opencl,gpu -device=adreno -max_num_threads=256", "conv2d_nhwc.image2d", [["TENSOR", [1, 129, 129, 24], "float16"], ["TENSOR", [1, 1, 24, 144], "float16"], [1, 1], [0, 0, 0, 0], [1, 1], "float16"], {}], "config": {"index": 36828, "code_hash": null, "entity": [["tile_fc", "sp", [-1, 1, 36]], ["tile_y", "sp", [-1, 1, 12]], ["tile_x", "sp", [-1, 4, 1]], ["tile_rcc", "sp", [-1, 2]], ["tile_ry", "sp", [-1, 1]], ["tile_rx", "sp", [-1, 1]], ["auto_unroll_max_step", "ot", 512], ["unroll_explicit", "ot", 0]]}, "result": [[0.00038191249999999994], 0, 4.9287004470825195, 1648217004.8568404], "version": 0.2, "tvm_version": "0.8.dev0"}
{"input": ["opencl -keys=adreno,opencl,gpu -device=adreno -max_num_threads=256", "depthwise_conv2d_nhwc.image2d", [["TENSOR", [1, 129, 129, 144], "float16"], ["TENSOR", [3, 3, 144, 1], "float16"], [2, 2], [1, 1, 1, 1], [1, 1], "float16"], {}], "config": {"index": 85571, "code_hash": null, "entity": [["tile_fc", "sp", [-1, 1, 36]], ["tile_y", "sp", [-1, 1, 1]], ["tile_x", "sp", [-1, 1, 2]], ["tile_ry", "sp", [-1, 3]], ["tile_rx", "sp", [-1, 3]], ["auto_unroll_max_step", "ot", 512], ["unroll_explicit", "ot", 0]]}, "result": [[0.000530325], 0, 4.51734471321106, 1648218074.5580795], "version": 0.2, "tvm_version": "0.8.dev0"}
{"input": ["opencl -keys=adreno,opencl,gpu -device=adreno -max_num_threads=256", "conv2d_nhwc.image2d", [["TENSOR", [1, 65, 65, 144], "float16"], ["TENSOR", [1, 1, 144, 32], "float16"], [1, 1], [0, 0, 0, 0], [1, 1], "float16"], {}], "config": {"index": 1244, "code_hash": null, "entity": [["tile_fc", "sp", [-1, 1, 8]], ["tile_y", "sp", [-1, 1, 4]], ["tile_x", "sp", [-1, 2, 2]], ["tile_rcc", "sp", [-1, 36]], ["tile_ry", "sp", [-1, 1]], ["tile_rx", "sp", [-1, 1]], ["auto_unroll_max_step", "ot", 512], ["unroll_explicit", "ot", 1]]}, "result": [[0.00024852812], 0, 1.338712453842163, 1648218693.1640027], "version": 0.2, "tvm_version": "0.8.dev0"}
{"input": ["opencl -keys=adreno,opencl,gpu -device=adreno -max_num_threads=256", "conv2d_nhwc.image2d", [["TENSOR", [1, 65, 65, 192], "float16"], ["TENSOR", [1, 1, 192, 32], "float16"], [1, 1], [0, 0, 0, 0], [1, 1], "float16"], {}], "config": {"index": 917, "code_hash": null, "entity": [["tile_fc", "sp", [-1, 1, 8]], ["tile_y", "sp", [-1, 2, 2]], ["tile_x", "sp", [-1, 1, 4]], ["tile_rcc", "sp", [-1, 3]], ["tile_ry", "sp", [-1, 1]], ["tile_rx", "sp", [-1, 1]], ["auto_unroll_max_step", "ot", 0], ["unroll_explicit", "ot", 1]]}, "result": [[0.00033953022], 0, 1.247035264968872, 1648219489.4658434], "version": 0.2, "tvm_version": "0.8.dev0"}
{"input": ["opencl -keys=adreno,opencl,gpu -device=adreno -max_num_threads=256", "conv2d_nhwc.image2d", [["TENSOR", [1, 65, 65, 32], "float16"], ["TENSOR", [1, 1, 32, 192], "float16"], [1, 1], [0, 0, 0, 0], [1, 1], "float16"], {}], "config": {"index": 1693, "code_hash": null, "entity": [["tile_fc", "sp", [-1, 1, 48]], ["tile_y", "sp", [-1, 2, 2]], ["tile_x", "sp", [-1, 2, 2]], ["tile_rcc", "sp", [-1, 2]], ["tile_ry", "sp", [-1, 1]], ["tile_rx", "sp", [-1, 1]], ["auto_unroll_max_step", "ot", 512], ["unroll_explicit", "ot", 0]]}, "result": [[0.00016992604000000002], 0, 1.1765425205230713, 1648219980.0435855], "version": 0.2, "tvm_version": "0.8.dev0"}
{"input": ["opencl -keys=adreno,opencl,gpu -device=adreno -max_num_threads=256", "depthwise_conv2d_nhwc.image2d", [["TENSOR", [1, 65, 65, 192], "float16"], ["TENSOR", [3, 3, 192, 1], "float16"], [1, 1], [1, 1, 1, 1], [1, 1], "float16"], {}], "config": {"index": 8414, "code_hash": null, "entity": [["tile_fc", "sp", [-1, 1, 48]], ["tile_y", "sp", [-1, 1, 2]], ["tile_x", "sp", [-1, 1, 4]], ["tile_ry", "sp", [-1, 1]], ["tile_rx", "sp", [-1, 1]], ["auto_unroll_max_step", "ot", 0], ["unroll_explicit", "ot", 0]]}, "result": [[0.00028197292], 0, 2.029294490814209, 1648220685.4810894], "version": 0.2, "tvm_version": "0.8.dev0"}
{"input": ["opencl -keys=adreno,opencl,gpu -device=adreno -max_num_threads=256", "conv2d_nhwc.image2d", [["TENSOR", [1, 65, 65, 192], "float16"], ["TENSOR", [1, 1, 192, 64], "float16"], [1, 1], [0, 0, 0, 0], [1, 1], "float16"], {}], "config": {"index": 4376, "code_hash": null, "entity": [["tile_fc", "sp", [-1, 1, 16]], ["tile_y", "sp", [-1, 1, 4]], ["tile_x", "sp", [-1, 2, 2]], ["tile_rcc", "sp", [-1, 16]], ["tile_ry", "sp", [-1, 1]], ["tile_rx", "sp", [-1, 1]], ["auto_unroll_max_step", "ot", 1500], ["unroll_explicit", "ot", 1]]}, "result": [[0.00048000312], 0, 1.796945571899414, 1648221470.9047542], "version": 0.2, "tvm_version": "0.8.dev0"}
{"input": ["opencl -keys=adreno,opencl,gpu -device=adreno -max_num_threads=256", "conv2d_nhwc.image2d", [["TENSOR", [1, 65, 65, 384], "float16"], ["TENSOR", [1, 1, 384, 64], "float16"], [1, 1], [0, 0, 0, 0], [1, 1], "float16"], {}], "config": {"index": 82, "code_hash": null, "entity": [["tile_fc", "sp", [-1, 1, 16]], ["tile_y", "sp", [-1, 2, 2]], ["tile_x", "sp", [-1, 2, 1]], ["tile_rcc", "sp", [-1, 2]], ["tile_ry", "sp", [-1, 1]], ["tile_rx", "sp", [-1, 1]], ["auto_unroll_max_step", "ot", 0], ["unroll_explicit", "ot", 0]]}, "result": [[0.0009459010399999999], 0, 4.583409547805786, 1648222016.70367], "version": 0.2, "tvm_version": "0.8.dev0"}
{"input": ["opencl -keys=adreno,opencl,gpu -device=adreno -max_num_threads=256", "conv2d_nhwc.image2d", [["TENSOR", [1, 65, 65, 64], "float16"], ["TENSOR", [1, 1, 64, 384], "float16"], [1, 1], [0, 0, 0, 0], [1, 1], "float16"], {}], "config": {"index": 6339, "code_hash": null, "entity": [["tile_fc", "sp", [-1, 1, 96]], ["tile_y", "sp", [-1, 1, 2]], ["tile_x", "sp", [-1, 4, 1]], ["tile_rcc", "sp", [-1, 2]], ["tile_ry", "sp", [-1, 1]], ["tile_rx", "sp", [-1, 1]], ["auto_unroll_max_step", "ot", 1500], ["unroll_explicit", "ot", 0]]}, "result": [[0.00050402084], 0, 2.557419776916504, 1648223178.1375926], "version": 0.2, "tvm_version": "0.8.dev0"}
{"input": ["opencl -keys=adreno,opencl,gpu -device=adreno -max_num_threads=256", "depthwise_conv2d_nhwc.image2d", [["TENSOR", [1, 65, 65, 384], "float16"], ["TENSOR", [3, 3, 384, 1], "float16"], [1, 1], [2, 2, 2, 2], [2, 2], "float16"], {}], "config": {"index": 395131, "code_hash": null, "entity": [["tile_fc", "sp", [-1, 1, 32]], ["tile_y", "sp", [-1, 2, 2]], ["tile_x", "sp", [-1, 1, 2]], ["tile_ry", "sp", [-1, 3]], ["tile_rx", "sp", [-1, 3]], ["auto_unroll_max_step", "ot", 512], ["unroll_explicit", "ot", 1]]}, "result": [[0.0005007760399999999], 0, 4.879568576812744, 1648224897.2846441], "version": 0.2, "tvm_version": "0.8.dev0"}
{"input": ["opencl -keys=adreno,opencl,gpu -device=adreno -max_num_threads=256", "conv2d_nhwc.image2d", [["TENSOR", [1, 65, 65, 384], "float16"], ["TENSOR", [1, 1, 384, 96], "float16"], [1, 1], [0, 0, 0, 0], [1, 1], "float16"], {}], "config": {"index": 216, "code_hash": null, "entity": [["tile_fc", "sp", [-1, 1, 24]], ["tile_y", "sp", [-1, 4, 1]], ["tile_x", "sp", [-1, 1, 4]], ["tile_rcc", "sp", [-1, 2]], ["tile_ry", "sp", [-1, 1]], ["tile_rx", "sp", [-1, 1]], ["auto_unroll_max_step", "ot", 0], ["unroll_explicit", "ot", 0]]}, "result": [[0.00102343958], 0, 2.840527296066284, 1648225684.2281113], "version": 0.2, "tvm_version": "0.8.dev0"}
{"input": ["opencl -keys=adreno,opencl,gpu -device=adreno -max_num_threads=256", "conv2d_nhwc.image2d", [["TENSOR", [1, 65, 65, 576], "float16"], ["TENSOR", [1, 1, 576, 96], "float16"], [1, 1], [0, 0, 0, 0], [1, 1], "float16"], {}], "config": {"index": 5805, "code_hash": null, "entity": [["tile_fc", "sp", [-1, 1, 8]], ["tile_y", "sp", [-1, 1, 4]], ["tile_x", "sp", [-1, 1, 2]], ["tile_rcc", "sp", [-1, 144]], ["tile_ry", "sp", [-1, 1]], ["tile_rx", "sp", [-1, 1]], ["auto_unroll_max_step", "ot", 1500], ["unroll_explicit", "ot", 0]]}, "result": [[0.00270374896], 0, 3.217658281326294, 1648226103.4442604], "version": 0.2, "tvm_version": "0.8.dev0"}
{"input": ["opencl -keys=adreno,opencl,gpu -device=adreno -max_num_threads=256", "conv2d_nhwc.image2d", [["TENSOR", [1, 65, 65, 96], "float16"], ["TENSOR", [1, 1, 96, 576], "float16"], [1, 1], [0, 0, 0, 0], [1, 1], "float16"], {}], "config": {"index": 7589, "code_hash": null, "entity": [["tile_fc", "sp", [-1, 1, 144]], ["tile_y", "sp", [-1, 1, 4]], ["tile_x", "sp", [-1, 4, 1]], ["tile_rcc", "sp", [-1, 2]], ["tile_ry", "sp", [-1, 1]], ["tile_rx", "sp", [-1, 1]], ["auto_unroll_max_step", "ot", 512], ["unroll_explicit", "ot", 0]]}, "result": [[0.0010867010399999999], 0, 5.100461721420288, 1648228164.6237411], "version": 0.2, "tvm_version": "0.8.dev0"}
{"input": ["opencl -keys=adreno,opencl,gpu -device=adreno -max_num_threads=256", "depthwise_conv2d_nhwc.image2d", [["TENSOR", [1, 65, 65, 576], "float16"], ["TENSOR", [3, 3, 576, 1], "float16"], [1, 1], [2, 2, 2, 2], [2, 2], "float16"], {}], "config": {"index": 483461, "code_hash": null, "entity": [["tile_fc", "sp", [-1, 1, 16]], ["tile_y", "sp", [-1, 2, 2]], ["tile_x", "sp", [-1, 1, 4]], ["tile_ry", "sp", [-1, 1]], ["tile_rx", "sp", [-1, 1]], ["auto_unroll_max_step", "ot", 512], ["unroll_explicit", "ot", 1]]}, "result": [[0.00076794374], 0, 3.2047412395477295, 1648229843.3200681], "version": 0.2, "tvm_version": "0.8.dev0"}
{"input": ["opencl -keys=adreno,opencl,gpu -device=adreno -max_num_threads=256", "conv2d_nhwc.image2d", [["TENSOR", [1, 65, 65, 576], "float16"], ["TENSOR", [1, 1, 576, 160], "float16"], [1, 1], [0, 0, 0, 0], [1, 1], "float16"], {}], "config": {"index": 3379, "code_hash": null, "entity": [["tile_fc", "sp", [-1, 1, 40]], ["tile_y", "sp", [-1, 2, 2]], ["tile_x", "sp", [-1, 2, 2]], ["tile_rcc", "sp", [-1, 2]], ["tile_ry", "sp", [-1, 1]], ["tile_rx", "sp", [-1, 1]], ["auto_unroll_max_step", "ot", 512], ["unroll_explicit", "ot", 0]]}, "result": [[0.00213475728], 0, 5.6810314655303955, 1648231577.0795343], "version": 0.2, "tvm_version": "0.8.dev0"}
{"input": ["opencl -keys=adreno,opencl,gpu -device=adreno -max_num_threads=256", "conv2d_nhwc.image2d", [["TENSOR", [1, 65, 65, 960], "float16"], ["TENSOR", [1, 1, 960, 160], "float16"], [1, 1], [0, 0, 0, 0], [1, 1], "float16"], {}], "config": {"index": 4380, "code_hash": null, "entity": [["tile_fc", "sp", [-1, 1, 40]], ["tile_y", "sp", [-1, 2, 1]], ["tile_x", "sp", [-1, 2, 2]], ["tile_rcc", "sp", [-1, 2]], ["tile_ry", "sp", [-1, 1]], ["tile_rx", "sp", [-1, 1]], ["auto_unroll_max_step", "ot", 512], ["unroll_explicit", "ot", 0]]}, "result": [[0.00422914272], 0, 8.667442083358765, 1648233559.9070358], "version": 0.2, "tvm_version": "0.8.dev0"}
{"input": ["opencl -keys=adreno,opencl,gpu -device=adreno -max_num_threads=256", "conv2d_nhwc.image2d", [["TENSOR", [1, 65, 65, 160], "float16"], ["TENSOR", [1, 1, 160, 960], "float16"], [1, 1], [0, 0, 0, 0], [1, 1], "float16"], {}], "config": {"index": 2148, "code_hash": null, "entity": [["tile_fc", "sp", [-1, 1, 60]], ["tile_y", "sp", [-1, 2, 2]], ["tile_x", "sp", [-1, 2, 2]], ["tile_rcc", "sp", [-1, 2]], ["tile_ry", "sp", [-1, 1]], ["tile_rx", "sp", [-1, 1]], ["auto_unroll_max_step", "ot", 0], ["unroll_explicit", "ot", 0]]}, "result": [[0.0030231989600000004], 0, 3.9222769737243652, 1648236561.208771], "version": 0.2, "tvm_version": "0.8.dev0"}
{"input": ["opencl -keys=adreno,opencl,gpu -device=adreno -max_num_threads=256", "depthwise_conv2d_nhwc.image2d", [["TENSOR", [1, 65, 65, 960], "float16"], ["TENSOR", [3, 3, 960, 1], "float16"], [1, 1], [4, 4, 4, 4], [4, 4], "float16"], {}], "config": {"index": 1022053, "code_hash": null, "entity": [["tile_fc", "sp", [-1, 1, 16]], ["tile_y", "sp", [-1, 1, 4]], ["tile_x", "sp", [-1, 1, 2]], ["tile_ry", "sp", [-1, 3]], ["tile_rx", "sp", [-1, 3]], ["auto_unroll_max_step", "ot", 1500], ["unroll_explicit", "ot", 1]]}, "result": [[0.00146910416], 0, 10.013351440429688, 1648237714.348657], "version": 0.2, "tvm_version": "0.8.dev0"}
{"input": ["opencl -keys=adreno,opencl,gpu -device=adreno -max_num_threads=256", "conv2d_nhwc.image2d", [["TENSOR", [1, 65, 65, 960], "float16"], ["TENSOR", [1, 1, 960, 320], "float16"], [1, 1], [0, 0, 0, 0], [1, 1], "float16"], {}], "config": {"index": 710, "code_hash": null, "entity": [["tile_fc", "sp", [-1, 1, 80]], ["tile_y", "sp", [-1, 4, 1]], ["tile_x", "sp", [-1, 1, 4]], ["tile_rcc", "sp", [-1, 2]], ["tile_ry", "sp", [-1, 1]], ["tile_rx", "sp", [-1, 1]], ["auto_unroll_max_step", "ot", 0], ["unroll_explicit", "ot", 0]]}, "result": [[0.00585615832], 0, 4.5447235107421875, 1648240438.3363717], "version": 0.2, "tvm_version": "0.8.dev0"}
{"input": ["opencl -keys=adreno,opencl,gpu -device=adreno -max_num_threads=256", "conv2d_nhwc.image2d", [["TENSOR", [1, 1, 1, 320], "float16"], ["TENSOR", [1, 1, 320, 256], "float16"], [1, 1], [0, 0, 0, 0], [1, 1], "float16"], {}], "config": {"index": 13906, "code_hash": null, "entity": [["tile_fc", "sp", [-1, 1, 32]], ["tile_y", "sp", [-1, 2, 1]], ["tile_x", "sp", [-1, 2, 1]], ["tile_rcc", "sp", [-1, 2]], ["tile_ry", "sp", [-1, 1]], ["tile_rx", "sp", [-1, 1]], ["auto_unroll_max_step", "ot", 1500], ["unroll_explicit", "ot", 1]]}, "result": [[9.158126e-05], 0, 2.1457014083862305, 1648242383.9031947], "version": 0.2, "tvm_version": "0.8.dev0"}
{"input": ["opencl -keys=adreno,opencl,gpu -device=adreno -max_num_threads=256", "conv2d_nhwc.image2d", [["TENSOR", [1, 65, 65, 512], "float16"], ["TENSOR", [1, 1, 512, 256], "float16"], [1, 1], [0, 0, 0, 0], [1, 1], "float16"], {}], "config": {"index": 3345, "code_hash": null, "entity": [["tile_fc", "sp", [-1, 2, 32]], ["tile_y", "sp", [-1, 2, 2]], ["tile_x", "sp", [-1, 4, 1]], ["tile_rcc", "sp", [-1, 16]], ["tile_ry", "sp", [-1, 1]], ["tile_rx", "sp", [-1, 1]], ["auto_unroll_max_step", "ot", 512], ["unroll_explicit", "ot", 0]]}, "result": [[0.0029897760400000003], 0, 6.866375923156738, 1648242988.4820986], "version": 0.2, "tvm_version": "0.8.dev0"}
{"input": ["opencl -keys=adreno,opencl,gpu -device=adreno -max_num_threads=256", "conv2d_nhwc.image2d", [["TENSOR", [1, 65, 65, 256], "float16"], ["TENSOR", [1, 1, 256, 21], "float16"], [1, 1], [0, 0, 0, 0], [1, 1], "float16"], {}], "config": {"index": 134, "code_hash": null, "entity": [["tile_fc", "sp", [-1, 1, 6]], ["tile_y", "sp", [-1, 1, 4]], ["tile_x", "sp", [-1, 1, 4]], ["tile_rcc", "sp", [-1, 1]], ["tile_ry", "sp", [-1, 1]], ["tile_rx", "sp", [-1, 1]], ["auto_unroll_max_step", "ot", 1500], ["unroll_explicit", "ot", 0]]}, "result": [[0.00043579374000000004], 0, 3.1154441833496094, 1648244297.9170778], "version": 0.2, "tvm_version": "0.8.dev0"}
