logs/mace_resnet50_v2.texture.float16.acc16.autotvm.log
{"input": ["opencl -keys=adreno,opencl,gpu -device=adreno -max_num_threads=256 -texture_spatial_limit=16384 -thread_warp_size=1", "conv2d_nchwc.image2d", [["TENSOR", [1, 2048, 1, 1], "float16"], ["TENSOR", [1001, 2048, 1, 1], "float16"], [1, 1], [0, 0, 0, 0], [1, 1], "float16"], {}], "config": {"index": 3569, "code_hash": null, "entity": [["tile_fc", "sp", [-1, 1, 251]], ["tile_y", "sp", [-1, 4, 1]], ["tile_x", "sp", [-1, 1, 2]], ["tile_rcc", "sp", [-1, 512]], ["tile_ry", "sp", [-1, 1]], ["tile_rx", "sp", [-1, 1]], ["auto_unroll_max_step", "ot", 512], ["unroll_explicit", "ot", 1]]}, "result": [[0.00060094464], 0, 2.5687360763549805, 1660259259.5889003], "version": 0.2, "tvm_version": "0.9.dev0"}
{"input": ["opencl -keys=adreno,opencl,gpu -device=adreno -max_num_threads=256 -texture_spatial_limit=16384 -thread_warp_size=1", "conv2d_nchwc.image2d", [["TENSOR", [1, 2048, 10, 10], "float16"], ["TENSOR", [512, 2048, 1, 1], "float16"], [1, 1], [0, 0, 0, 0], [1, 1], "float16"], {}], "config": {"index": 134243, "code_hash": null, "entity": [["tile_fc", "sp", [-1, 1, 128]], ["tile_y", "sp", [-1, 2, 6]], ["tile_x", "sp", [-1, 2, 1]], ["tile_rcc", "sp", [-1, 2]], ["tile_ry", "sp", [-1, 1]], ["tile_rx", "sp", [-1, 1]], ["auto_unroll_max_step", "ot", 1500], ["unroll_explicit", "ot", 0]]}, "result": [[0.0008162764799999999], 0, 3.904177665710449, 1660260281.2776647], "version": 0.2, "tvm_version": "0.9.dev0"}
{"input": ["opencl -keys=adreno,opencl,gpu -device=adreno -max_num_threads=256 -texture_spatial_limit=16384 -thread_warp_size=1", "conv2d_nchwc.image2d", [["TENSOR", [1, 1024, 10, 10], "float16"], ["TENSOR", [2048, 1024, 1, 1], "float16"], [1, 1], [0, 0, 0, 0], [1, 1], "float16"], {}], "config": {"index": 13007, "code_hash": null, "entity": [["tile_fc", "sp", [-1, 1, 64]], ["tile_y", "sp", [-1, 1, 2]], ["tile_x", "sp", [-1, 4, 3]], ["tile_rcc", "sp", [-1, 2]], ["tile_ry", "sp", [-1, 1]], ["tile_rx", "sp", [-1, 1]], ["auto_unroll_max_step", "ot", 0], ["unroll_explicit", "ot", 0]]}, "result": [[0.00129107968], 0, 2.4227259159088135, 1660261609.4737754], "version": 0.2, "tvm_version": "0.9.dev0"}
{"input": ["opencl -keys=adreno,opencl,gpu -device=adreno -max_num_threads=256 -texture_spatial_limit=16384 -thread_warp_size=1", "conv2d_nchwc.image2d", [["TENSOR", [1, 512, 10, 10], "float16"], ["TENSOR", [2048, 512, 1, 1], "float16"], [1, 1], [0, 0, 0, 0], [1, 1], "float16"], {}], "config": {"index": 49886, "code_hash": null, "entity": [["tile_fc", "sp", [-1, 2, 32]], ["tile_y", "sp", [-1, 4, 3]], ["tile_x", "sp", [-1, 2, 2]], ["tile_rcc", "sp", [-1, 64]], ["tile_ry", "sp", [-1, 1]], ["tile_rx", "sp", [-1, 1]], ["auto_unroll_max_step", "ot", 0], ["unroll_explicit", "ot", 0]]}, "result": [[0.0007321344000000001], 0, 3.264866590499878, 1660262577.9415069], "version": 0.2, "tvm_version": "0.9.dev0"}
{"input": ["opencl -keys=adreno,opencl,gpu -device=adreno -max_num_threads=256 -texture_spatial_limit=16384 -thread_warp_size=1", "conv2d_nchwc.image2d", [["TENSOR", [1, 512, 10, 10], "float16"], ["TENSOR", [512, 512, 3, 3], "float16"], [1, 1], [1, 1, 1, 1], [1, 1], "float16"], {}], "config": {"index": 163846, "code_hash": null, "entity": [["tile_fc", "sp", [-1, 1, 16]], ["tile_y", "sp", [-1, 2, 1]], ["tile_x", "sp", [-1, 3, 4]], ["tile_rcc", "sp", [-1, 2]], ["tile_ry", "sp", [-1, 3]], ["tile_rx", "sp", [-1, 3]], ["auto_unroll_max_step", "ot", 0], ["unroll_explicit", "ot", 0]]}, "result": [[0.0019303935999999999], 0, 2.9769744873046875, 1660263639.698667], "version": 0.2, "tvm_version": "0.9.dev0"}
{"input": ["opencl -keys=adreno,opencl,gpu -device=adreno -max_num_threads=256 -texture_spatial_limit=16384 -thread_warp_size=1", "conv2d_nchw_winograd.image2d", [["TENSOR", [1, 512, 10, 10], "float16"], ["TENSOR", [512, 512, 3, 3], "float16"], [1, 1], [1, 1, 1, 1], [1, 1], "float16"], {}], "config": {"index": 1477, "code_hash": null, "entity": [["auto_unroll_max_step", "ot", 4], ["tile_y", "sp", [-1, 2, 64]], ["tile_x", "sp", [-1, 5, 1]], ["tile_rc", "sp", [-1, 8]]]}, "result": [[0.0014979071999999998], 0, 11.929429054260254, 1660265191.7517557], "version": 0.2, "tvm_version": "0.9.dev0"}
{"input": ["opencl -keys=adreno,opencl,gpu -device=adreno -max_num_threads=256 -texture_spatial_limit=16384 -thread_warp_size=1", "conv2d_nchwc.image2d", [["TENSOR", [1, 1024, 10, 10], "float16"], ["TENSOR", [512, 1024, 1, 1], "float16"], [1, 1], [0, 0, 0, 0], [1, 1], "float16"], {}], "config": {"index": 10928, "code_hash": null, "entity": [["tile_fc", "sp", [-1, 1, 32]], ["tile_y", "sp", [-1, 4, 1]], ["tile_x", "sp", [-1, 1, 4]], ["tile_rcc", "sp", [-1, 2]], ["tile_ry", "sp", [-1, 1]], ["tile_rx", "sp", [-1, 1]], ["auto_unroll_max_step", "ot", 0], ["unroll_explicit", "ot", 0]]}, "result": [[0.00040777216000000005], 0, 2.1874337196350098, 1660265842.4894893], "version": 0.2, "tvm_version": "0.9.dev0"}
{"input": ["opencl -keys=adreno,opencl,gpu -device=adreno -max_num_threads=256 -texture_spatial_limit=16384 -thread_warp_size=1", "conv2d_nchwc.image2d", [["TENSOR", [1, 256, 10, 10], "float16"], ["TENSOR", [1024, 256, 1, 1], "float16"], [1, 1], [0, 0, 0, 0], [1, 1], "float16"], {}], "config": {"index": 125667, "code_hash": null, "entity": [["tile_fc", "sp", [-1, 2, 32]], ["tile_y", "sp", [-1, 4, 3]], ["tile_x", "sp", [-1, 2, 2]], ["tile_rcc", "sp", [-1, 8]], ["tile_ry", "sp", [-1, 1]], ["tile_rx", "sp", [-1, 1]], ["auto_unroll_max_step", "ot", 1500], ["unroll_explicit", "ot", 0]]}, "result": [[0.00019687423999999998], 0, 20.798149824142456, 1660266277.3515205], "version": 0.2, "tvm_version": "0.9.dev0"}
{"input": ["opencl -keys=adreno,opencl,gpu -device=adreno -max_num_threads=256 -texture_spatial_limit=16384 -thread_warp_size=1", "conv2d_nchwc.image2d", [["TENSOR", [1, 256, 19, 19], "float16"], ["TENSOR", [256, 256, 3, 3], "float16"], [2, 2], [1, 1, 1, 1], [1, 1], "float16"], {}], "config": {"index": 186279, "code_hash": null, "entity": [["tile_fc", "sp", [-1, 1, 32]], ["tile_y", "sp", [-1, 1, 4]], ["tile_x", "sp", [-1, 3, 4]], ["tile_rcc", "sp", [-1, 1]], ["tile_ry", "sp", [-1, 3]], ["tile_rx", "sp", [-1, 1]], ["auto_unroll_max_step", "ot", 512], ["unroll_explicit", "ot", 0]]}, "result": [[0.0005707622400000001], 0, 2.385784864425659, 1660268593.1849222], "version": 0.2, "tvm_version": "0.9.dev0"}
{"input": ["opencl -keys=adreno,opencl,gpu -device=adreno -max_num_threads=256 -texture_spatial_limit=16384 -thread_warp_size=1", "conv2d_nchwc.image2d", [["TENSOR", [1, 1024, 19, 19], "float16"], ["TENSOR", [256, 1024, 1, 1], "float16"], [1, 1], [0, 0, 0, 0], [1, 1], "float16"], {}], "config": {"index": 61864, "code_hash": null, "entity": [["tile_fc", "sp", [-1, 2, 32]], ["tile_y", "sp", [-1, 5, 2]], ["tile_x", "sp", [-1, 1, 4]], ["tile_rcc", "sp", [-1, 256]], ["tile_ry", "sp", [-1, 1]], ["tile_rx", "sp", [-1, 1]], ["auto_unroll_max_step", "ot", 512], ["unroll_explicit", "ot", 0]]}, "result": [[0.00060644864], 0, 5.875272750854492, 1660269160.865013], "version": 0.2, "tvm_version": "0.9.dev0"}
{"input": ["opencl -keys=adreno,opencl,gpu -device=adreno -max_num_threads=256 -texture_spatial_limit=16384 -thread_warp_size=1", "conv2d_nchwc.image2d", [["TENSOR", [1, 512, 19, 19], "float16"], ["TENSOR", [1024, 512, 1, 1], "float16"], [1, 1], [0, 0, 0, 0], [1, 1], "float16"], {}], "config": {"index": 44991, "code_hash": null, "entity": [["tile_fc", "sp", [-1, 1, 32]], ["tile_y", "sp", [-1, 1, 4]], ["tile_x", "sp", [-1, 4, 1]], ["tile_rcc", "sp", [-1, 2]], ["tile_ry", "sp", [-1, 1]], ["tile_rx", "sp", [-1, 1]], ["auto_unroll_max_step", "ot", 512], ["unroll_explicit", "ot", 0]]}, "result": [[0.0009184102400000001], 0, 2.912093162536621, 1660270220.5821888], "version": 0.2, "tvm_version": "0.9.dev0"}
{"input": ["opencl -keys=adreno,opencl,gpu -device=adreno -max_num_threads=256 -texture_spatial_limit=16384 -thread_warp_size=1", "conv2d_nchwc.image2d", [["TENSOR", [1, 256, 19, 19], "float16"], ["TENSOR", [1024, 256, 1, 1], "float16"], [1, 1], [0, 0, 0, 0], [1, 1], "float16"], {}], "config": {"index": 8941, "code_hash": null, "entity": [["tile_fc", "sp", [-1, 1, 32]], ["tile_y", "sp", [-1, 1, 4]], ["tile_x", "sp", [-1, 4, 5]], ["tile_rcc", "sp", [-1, 2]], ["tile_ry", "sp", [-1, 1]], ["tile_rx", "sp", [-1, 1]], ["auto_unroll_max_step", "ot", 0], ["unroll_explicit", "ot", 0]]}, "result": [[0.00045497855999999996], 0, 0.6015448570251465, 1660271659.3695033], "version": 0.2, "tvm_version": "0.9.dev0"}
{"input": ["opencl -keys=adreno,opencl,gpu -device=adreno -max_num_threads=256 -texture_spatial_limit=16384 -thread_warp_size=1", "conv2d_nchwc.image2d", [["TENSOR", [1, 256, 19, 19], "float16"], ["TENSOR", [256, 256, 3, 3], "float16"], [1, 1], [1, 1, 1, 1], [1, 1], "float16"], {}], "config": {"index": 97377, "code_hash": null, "entity": [["tile_fc", "sp", [-1, 1, 32]], ["tile_y", "sp", [-1, 2, 2]], ["tile_x", "sp", [-1, 5, 4]], ["tile_rcc", "sp", [-1, 64]], ["tile_ry", "sp", [-1, 3]], ["tile_rx", "sp", [-1, 3]], ["auto_unroll_max_step", "ot", 0], ["unroll_explicit", "ot", 0]]}, "result": [[0.00110707712], 0, 7.066317319869995, 1660272996.7374165], "version": 0.2, "tvm_version": "0.9.dev0"}
{"input": ["opencl -keys=adreno,opencl,gpu -device=adreno -max_num_threads=256 -texture_spatial_limit=16384 -thread_warp_size=1", "conv2d_nchw_winograd.image2d", [["TENSOR", [1, 256, 19, 19], "float16"], ["TENSOR", [256, 256, 3, 3], "float16"], [1, 1], [1, 1, 1, 1], [1, 1], "float16"], {}], "config": {"index": 2324, "code_hash": null, "entity": [["auto_unroll_max_step", "ot", 16], ["tile_y", "sp", [-1, 1, 64]], ["tile_x", "sp", [-1, 10, 2]], ["tile_rc", "sp", [-1, 4]]]}, "result": [[0.0008791603200000001], 0, 10.788563966751099, 1660274031.2284348], "version": 0.2, "tvm_version": "0.9.dev0"}
{"input": ["opencl -keys=adreno,opencl,gpu -device=adreno -max_num_threads=256 -texture_spatial_limit=16384 -thread_warp_size=1", "conv2d_nchwc.image2d", [["TENSOR", [1, 512, 19, 19], "float16"], ["TENSOR", [256, 512, 1, 1], "float16"], [1, 1], [0, 0, 0, 0], [1, 1], "float16"], {}], "config": {"index": 35126, "code_hash": null, "entity": [["tile_fc", "sp", [-1, 1, 8]], ["tile_y", "sp", [-1, 2, 2]], ["tile_x", "sp", [-1, 2, 10]], ["tile_rcc", "sp", [-1, 2]], ["tile_ry", "sp", [-1, 1]], ["tile_rx", "sp", [-1, 1]], ["auto_unroll_max_step", "ot", 512], ["unroll_explicit", "ot", 0]]}, "result": [[0.00027854848], 0, 1.158421277999878, 1660275075.7923727], "version": 0.2, "tvm_version": "0.9.dev0"}
{"input": ["opencl -keys=adreno,opencl,gpu -device=adreno -max_num_threads=256 -texture_spatial_limit=16384 -thread_warp_size=1", "conv2d_nchwc.image2d", [["TENSOR", [1, 128, 19, 19], "float16"], ["TENSOR", [512, 128, 1, 1], "float16"], [1, 1], [0, 0, 0, 0], [1, 1], "float16"], {}], "config": {"index": 7800, "code_hash": null, "entity": [["tile_fc", "sp", [-1, 1, 16]], ["tile_y", "sp", [-1, 1, 2]], ["tile_x", "sp", [-1, 4, 5]], ["tile_rcc", "sp", [-1, 2]], ["tile_ry", "sp", [-1, 1]], ["tile_rx", "sp", [-1, 1]], ["auto_unroll_max_step", "ot", 0], ["unroll_explicit", "ot", 0]]}, "result": [[0.00012823552], 0, 3.917492151260376, 1660275945.823237], "version": 0.2, "tvm_version": "0.9.dev0"}
{"input": ["opencl -keys=adreno,opencl,gpu -device=adreno -max_num_threads=256 -texture_spatial_limit=16384 -thread_warp_size=1", "conv2d_nchwc.image2d", [["TENSOR", [1, 128, 38, 38], "float16"], ["TENSOR", [128, 128, 3, 3], "float16"], [2, 2], [0, 0, 1, 1], [1, 1], "float16"], {}], "config": {"index": 218245, "code_hash": null, "entity": [["tile_fc", "sp", [-1, 1, 32]], ["tile_y", "sp", [-1, 5, 2]], ["tile_x", "sp", [-1, 1, 4]], ["tile_rcc", "sp", [-1, 2]], ["tile_ry", "sp", [-1, 3]], ["tile_rx", "sp", [-1, 1]], ["auto_unroll_max_step", "ot", 0], ["unroll_explicit", "ot", 1]]}, "result": [[0.00038358528000000005], 0, 7.66957688331604, 1660276693.348771], "version": 0.2, "tvm_version": "0.9.dev0"}
{"input": ["opencl -keys=adreno,opencl,gpu -device=adreno -max_num_threads=256 -texture_spatial_limit=16384 -thread_warp_size=1", "conv2d_nchwc.image2d", [["TENSOR", [1, 512, 38, 38], "float16"], ["TENSOR", [128, 512, 1, 1], "float16"], [1, 1], [0, 0, 0, 0], [1, 1], "float16"], {}], "config": {"index": 56013, "code_hash": null, "entity": [["tile_fc", "sp", [-1, 1, 32]], ["tile_y", "sp", [-1, 2, 4]], ["tile_x", "sp", [-1, 2, 1]], ["tile_rcc", "sp", [-1, 2]], ["tile_ry", "sp", [-1, 1]], ["tile_rx", "sp", [-1, 1]], ["auto_unroll_max_step", "ot", 512], ["unroll_explicit", "ot", 0]]}, "result": [[0.0005108326400000001], 0, 0.5175294876098633, 1660278114.1652672], "version": 0.2, "tvm_version": "0.9.dev0"}
{"input": ["opencl -keys=adreno,opencl,gpu -device=adreno -max_num_threads=256 -texture_spatial_limit=16384 -thread_warp_size=1", "conv2d_nchwc.image2d", [["TENSOR", [1, 256, 38, 38], "float16"], ["TENSOR", [512, 256, 1, 1], "float16"], [1, 1], [0, 0, 0, 0], [1, 1], "float16"], {}], "config": {"index": 63421, "code_hash": null, "entity": [["tile_fc", "sp", [-1, 2, 32]], ["tile_y", "sp", [-1, 1, 2]], ["tile_x", "sp", [-1, 5, 4]], ["tile_rcc", "sp", [-1, 64]], ["tile_ry", "sp", [-1, 1]], ["tile_rx", "sp", [-1, 1]], ["auto_unroll_max_step", "ot", 0], ["unroll_explicit", "ot", 0]]}, "result": [[0.0009605376], 0, 3.3719518184661865, 1660279399.178079], "version": 0.2, "tvm_version": "0.9.dev0"}
{"input": ["opencl -keys=adreno,opencl,gpu -device=adreno -max_num_threads=256 -texture_spatial_limit=16384 -thread_warp_size=1", "conv2d_nchwc.image2d", [["TENSOR", [1, 128, 38, 38], "float16"], ["TENSOR", [512, 128, 1, 1], "float16"], [1, 1], [0, 0, 0, 0], [1, 1], "float16"], {}], "config": {"index": 18624, "code_hash": null, "entity": [["tile_fc", "sp", [-1, 1, 16]], ["tile_y", "sp", [-1, 2, 2]], ["tile_x", "sp", [-1, 2, 10]], ["tile_rcc", "sp", [-1, 2]], ["tile_ry", "sp", [-1, 1]], ["tile_rx", "sp", [-1, 1]], ["auto_unroll_max_step", "ot", 0], ["unroll_explicit", "ot", 0]]}, "result": [[0.00044941824], 0, 19.621758460998535, 1660280723.8581862], "version": 0.2, "tvm_version": "0.9.dev0"}
{"input": ["opencl -keys=adreno,opencl,gpu -device=adreno -max_num_threads=256 -texture_spatial_limit=16384 -thread_warp_size=1", "conv2d_nchwc.image2d", [["TENSOR", [1, 128, 38, 38], "float16"], ["TENSOR", [128, 128, 3, 3], "float16"], [1, 1], [1, 1, 1, 1], [1, 1], "float16"], {}], "config": {"index": 11264, "code_hash": null, "entity": [["tile_fc", "sp", [-1, 1, 8]], ["tile_y", "sp", [-1, 2, 2]], ["tile_x", "sp", [-1, 5, 8]], ["tile_rcc", "sp", [-1, 2]], ["tile_ry", "sp", [-1, 1]], ["tile_rx", "sp", [-1, 1]], ["auto_unroll_max_step", "ot", 0], ["unroll_explicit", "ot", 0]]}, "result": [[0.0010753024000000001], 0, 1.469444751739502, 1660282655.1022956], "version": 0.2, "tvm_version": "0.9.dev0"}
{"input": ["opencl -keys=adreno,opencl,gpu -device=adreno -max_num_threads=256 -texture_spatial_limit=16384 -thread_warp_size=1", "conv2d_nchw_winograd.image2d", [["TENSOR", [1, 128, 38, 38], "float16"], ["TENSOR", [128, 128, 3, 3], "float16"], [1, 1], [1, 1, 1, 1], [1, 1], "float16"], {}], "config": {"index": 110, "code_hash": null, "entity": [["auto_unroll_max_step", "ot", 16], ["tile_y", "sp", [-1, 4, 8]], ["tile_x", "sp", [-1, 1, 19]], ["tile_rc", "sp", [-1, 1]]]}, "result": [[0.00158624256], 0, 3.1043524742126465, 1660283097.5109248], "version": 0.2, "tvm_version": "0.9.dev0"}
{"input": ["opencl -keys=adreno,opencl,gpu -device=adreno -max_num_threads=256 -texture_spatial_limit=16384 -thread_warp_size=1", "conv2d_nchwc.image2d", [["TENSOR", [1, 256, 38, 38], "float16"], ["TENSOR", [128, 256, 1, 1], "float16"], [1, 1], [0, 0, 0, 0], [1, 1], "float16"], {}], "config": {"index": 10147, "code_hash": null, "entity": [["tile_fc", "sp", [-1, 1, 16]], ["tile_y", "sp", [-1, 2, 4]], ["tile_x", "sp", [-1, 2, 5]], ["tile_rcc", "sp", [-1, 2]], ["tile_ry", "sp", [-1, 1]], ["tile_rx", "sp", [-1, 1]], ["auto_unroll_max_step", "ot", 0], ["unroll_explicit", "ot", 0]]}, "result": [[0.00031781376], 0, 3.6170413494110107, 1660284110.4559813], "version": 0.2, "tvm_version": "0.9.dev0"}
{"input": ["opencl -keys=adreno,opencl,gpu -device=adreno -max_num_threads=256 -texture_spatial_limit=16384 -thread_warp_size=1", "conv2d_nchwc.image2d", [["TENSOR", [1, 64, 38, 38], "float16"], ["TENSOR", [256, 64, 1, 1], "float16"], [1, 1], [0, 0, 0, 0], [1, 1], "float16"], {}], "config": {"index": 14116, "code_hash": null, "entity": [["tile_fc", "sp", [-1, 1, 4]], ["tile_y", "sp", [-1, 4, 2]], ["tile_x", "sp", [-1, 1, 8]], ["tile_rcc", "sp", [-1, 2]], ["tile_ry", "sp", [-1, 1]], ["tile_rx", "sp", [-1, 1]], ["auto_unroll_max_step", "ot", 0], ["unroll_explicit", "ot", 0]]}, "result": [[0.00012984832], 0, 11.87907600402832, 1660284962.5109456], "version": 0.2, "tvm_version": "0.9.dev0"}
{"input": ["opencl -keys=adreno,opencl,gpu -device=adreno -max_num_threads=256 -texture_spatial_limit=16384 -thread_warp_size=1", "conv2d_nchwc.image2d", [["TENSOR", [1, 64, 75, 75], "float16"], ["TENSOR", [64, 64, 3, 3], "float16"], [2, 2], [1, 1, 1, 1], [1, 1], "float16"], {}], "config": {"index": 100654, "code_hash": null, "entity": [["tile_fc", "sp", [-1, 1, 4]], ["tile_y", "sp", [-1, 2, 2]], ["tile_x", "sp", [-1, 5, 8]], ["tile_rcc", "sp", [-1, 4]], ["tile_ry", "sp", [-1, 1]], ["tile_rx", "sp", [-1, 1]], ["auto_unroll_max_step", "ot", 512], ["unroll_explicit", "ot", 0]]}, "result": [[0.00036206080000000004], 0, 4.715026140213013, 1660286572.2376645], "version": 0.2, "tvm_version": "0.9.dev0"}
{"input": ["opencl -keys=adreno,opencl,gpu -device=adreno -max_num_threads=256 -texture_spatial_limit=16384 -thread_warp_size=1", "conv2d_nchwc.image2d", [["TENSOR", [1, 256, 75, 75], "float16"], ["TENSOR", [64, 256, 1, 1], "float16"], [1, 1], [0, 0, 0, 0], [1, 1], "float16"], {}], "config": {"index": 689, "code_hash": null, "entity": [["tile_fc", "sp", [-1, 1, 16]], ["tile_y", "sp", [-1, 4, 1]], ["tile_x", "sp", [-1, 1, 4]], ["tile_rcc", "sp", [-1, 2]], ["tile_ry", "sp", [-1, 1]], ["tile_rx", "sp", [-1, 1]], ["auto_unroll_max_step", "ot", 0], ["unroll_explicit", "ot", 0]]}, "result": [[0.0006762752000000001], 0, 3.676732301712036, 1660287917.2355604], "version": 0.2, "tvm_version": "0.9.dev0"}
{"input": ["opencl -keys=adreno,opencl,gpu -device=adreno -max_num_threads=256 -texture_spatial_limit=16384 -thread_warp_size=1", "conv2d_nchwc.image2d", [["TENSOR", [1, 64, 75, 75], "float16"], ["TENSOR", [256, 64, 1, 1], "float16"], [1, 1], [0, 0, 0, 0], [1, 1], "float16"], {}], "config": {"index": 4479, "code_hash": null, "entity": [["tile_fc", "sp", [-1, 1, 32]], ["tile_y", "sp", [-1, 4, 1]], ["tile_x", "sp", [-1, 1, 4]], ["tile_rcc", "sp", [-1, 2]], ["tile_ry", "sp", [-1, 1]], ["tile_rx", "sp", [-1, 1]], ["auto_unroll_max_step", "ot", 512], ["unroll_explicit", "ot", 0]]}, "result": [[0.0005466163199999999], 0, 1.4228003025054932, 1660288583.3037763], "version": 0.2, "tvm_version": "0.9.dev0"}
{"input": ["opencl -keys=adreno,opencl,gpu -device=adreno -max_num_threads=256 -texture_spatial_limit=16384 -thread_warp_size=1", "conv2d_nchwc.image2d", [["TENSOR", [1, 64, 75, 75], "float16"], ["TENSOR", [64, 64, 3, 3], "float16"], [1, 1], [1, 1, 1, 1], [1, 1], "float16"], {}], "config": {"index": 17989, "code_hash": null, "entity": [["tile_fc", "sp", [-1, 1, 16]], ["tile_y", "sp", [-1, 2, 2]], ["tile_x", "sp", [-1, 1, 4]], ["tile_rcc", "sp", [-1, 16]], ["tile_ry", "sp", [-1, 3]], ["tile_rx", "sp", [-1, 1]], ["auto_unroll_max_step", "ot", 1500], ["unroll_explicit", "ot", 0]]}, "result": [[0.00117874176], 0, 3.1304590702056885, 1660289466.1434426], "version": 0.2, "tvm_version": "0.9.dev0"}
{"input": ["opencl -keys=adreno,opencl,gpu -device=adreno -max_num_threads=256 -texture_spatial_limit=16384 -thread_warp_size=1", "conv2d_nchw_winograd.image2d", [["TENSOR", [1, 64, 75, 75], "float16"], ["TENSOR", [64, 64, 3, 3], "float16"], [1, 1], [1, 1, 1, 1], [1, 1], "float16"], {}], "config": {"index": 160, "code_hash": null, "entity": [["auto_unroll_max_step", "ot", 4], ["tile_y", "sp", [-1, 8, 2]], ["tile_x", "sp", [-1, 4, 19]], ["tile_rc", "sp", [-1, 2]]]}, "result": [[0.0013643929600000001], 0, 9.15615177154541, 1660289918.8179607], "version": 0.2, "tvm_version": "0.9.dev0"}
{"input": ["opencl -keys=adreno,opencl,gpu -device=adreno -max_num_threads=256 -texture_spatial_limit=16384 -thread_warp_size=1", "conv2d_nchwc.image2d", [["TENSOR", [1, 64, 75, 75], "float16"], ["TENSOR", [64, 64, 1, 1], "float16"], [1, 1], [0, 0, 0, 0], [1, 1], "float16"], {}], "config": {"index": 2489, "code_hash": null, "entity": [["tile_fc", "sp", [-1, 1, 16]], ["tile_y", "sp", [-1, 4, 1]], ["tile_x", "sp", [-1, 1, 4]], ["tile_rcc", "sp", [-1, 2]], ["tile_ry", "sp", [-1, 1]], ["tile_rx", "sp", [-1, 1]], ["auto_unroll_max_step", "ot", 512], ["unroll_explicit", "ot", 0]]}, "result": [[0.000174848], 0, 2.2883427143096924, 1660291126.9944797], "version": 0.2, "tvm_version": "0.9.dev0"}
{"input": ["opencl -keys=adreno,opencl,gpu -device=adreno -max_num_threads=256 -texture_spatial_limit=16384 -thread_warp_size=1", "conv2d_nchwc.image2d", [["TENSOR", [1, 3, 299, 299], "float16"], ["TENSOR", [64, 3, 7, 7], "float16"], [2, 2], [3, 3, 3, 3], [1, 1], "float16"], {}], "config": {"index": 5868, "code_hash": null, "entity": [["tile_fc", "sp", [-1, 2, 8]], ["tile_y", "sp", [-1, 4, 2]], ["tile_x", "sp", [-1, 2, 4]], ["tile_rcc", "sp", [-1, 1]], ["tile_ry", "sp", [-1, 7]], ["tile_rx", "sp", [-1, 1]], ["auto_unroll_max_step", "ot", 512], ["unroll_explicit", "ot", 0]]}, "result": [[0.00094832128], 0, 7.009026527404785, 1660292028.5873275], "version": 0.2, "tvm_version": "0.9.dev0"}
