logs/mace_inceptionv3.texture.float16.acc16.autotvm.log
{"input": ["opencl -keys=adreno,opencl,gpu -device=adreno -max_num_threads=256", "conv2d_nchwc.image2d", [["TENSOR", [1, 2048, 8, 8], "float16"], ["TENSOR", [192, 2048, 1, 1], "float16"], [1, 1], [0, 0, 0, 0], [1, 1], "float16"], {}], "config": {"index": 30100, "code_hash": null, "entity": [["tile_fc", "sp", [-1, 1, 4]], ["tile_y", "sp", [-1, 1, 4]], ["tile_x", "sp", [-1, 1, 8]], ["tile_rcc", "sp", [-1, 4]], ["tile_ry", "sp", [-1, 1]], ["tile_rx", "sp", [-1, 1]], ["auto_unroll_max_step", "ot", 1500], ["unroll_explicit", "ot", 0]]}, "result": [[0.00033502604], 0, 1.9022269248962402, 1643059680.4998395], "version": 0.2, "tvm_version": "0.8.dev0"}
{"input": ["opencl -keys=adreno,opencl,gpu -device=adreno -max_num_threads=256", "conv2d_nchwc.image2d", [["TENSOR", [1, 2048, 8, 8], "float16"], ["TENSOR", [448, 2048, 1, 1], "float16"], [1, 1], [0, 0, 0, 0], [1, 1], "float16"], {}], "config": {"index": 17223, "code_hash": null, "entity": [["tile_fc", "sp", [-1, 1, 14]], ["tile_y", "sp", [-1, 2, 2]], ["tile_x", "sp", [-1, 2, 4]], ["tile_rcc", "sp", [-1, 2]], ["tile_ry", "sp", [-1, 1]], ["tile_rx", "sp", [-1, 1]], ["auto_unroll_max_step", "ot", 512], ["unroll_explicit", "ot", 0]]}, "result": [[0.00051696562], 0, 1.2233085632324219, 1643060670.5431967], "version": 0.2, "tvm_version": "0.8.dev0"}
{"input": ["opencl -keys=adreno,opencl,gpu -device=adreno -max_num_threads=256", "conv2d_nchwc.image2d", [["TENSOR", [1, 2048, 8, 8], "float16"], ["TENSOR", [384, 2048, 1, 1], "float16"], [1, 1], [0, 0, 0, 0], [1, 1], "float16"], {}], "config": {"index": 3085, "code_hash": null, "entity": [["tile_fc", "sp", [-1, 1, 16]], ["tile_y", "sp", [-1, 1, 2]], ["tile_x", "sp", [-1, 4, 2]], ["tile_rcc", "sp", [-1, 2]], ["tile_ry", "sp", [-1, 1]], ["tile_rx", "sp", [-1, 1]], ["auto_unroll_max_step", "ot", 0], ["unroll_explicit", "ot", 0]]}, "result": [[0.00044005728], 0, 1.8225953578948975, 1643061744.2082734], "version": 0.2, "tvm_version": "0.8.dev0"}
{"input": ["opencl -keys=adreno,opencl,gpu -device=adreno -max_num_threads=256", "conv2d_nchwc.image2d", [["TENSOR", [1, 1280, 8, 8], "float16"], ["TENSOR", [192, 1280, 1, 1], "float16"], [1, 1], [0, 0, 0, 0], [1, 1], "float16"], {}], "config": {"index": 3534, "code_hash": null, "entity": [["tile_fc", "sp", [-1, 1, 16]], ["tile_y", "sp", [-1, 1, 2]], ["tile_x", "sp", [-1, 2, 4]], ["tile_rcc", "sp", [-1, 4]], ["tile_ry", "sp", [-1, 1]], ["tile_rx", "sp", [-1, 1]], ["auto_unroll_max_step", "ot", 0], ["unroll_explicit", "ot", 0]]}, "result": [[0.00022006668], 0, 0.9396281242370605, 1643062482.2994955], "version": 0.2, "tvm_version": "0.8.dev0"}
{"input": ["opencl -keys=adreno,opencl,gpu -device=adreno -max_num_threads=256", "conv2d_nchwc.image2d", [["TENSOR", [1, 1280, 8, 8], "float16"], ["TENSOR", [448, 1280, 1, 1], "float16"], [1, 1], [0, 0, 0, 0], [1, 1], "float16"], {}], "config": {"index": 2506, "code_hash": null, "entity": [["tile_fc", "sp", [-1, 1, 56]], ["tile_y", "sp", [-1, 2, 1]], ["tile_x", "sp", [-1, 2, 4]], ["tile_rcc", "sp", [-1, 2]], ["tile_ry", "sp", [-1, 1]], ["tile_rx", "sp", [-1, 1]], ["auto_unroll_max_step", "ot", 0], ["unroll_explicit", "ot", 0]]}, "result": [[0.00035377396], 0, 1.2305805683135986, 1643063003.9842937], "version": 0.2, "tvm_version": "0.8.dev0"}
{"input": ["opencl -keys=adreno,opencl,gpu -device=adreno -max_num_threads=256", "conv2d_nchwc.image2d", [["TENSOR", [1, 448, 8, 8], "float16"], ["TENSOR", [384, 448, 3, 3], "float16"], [1, 1], [1, 1, 1, 1], [1, 1], "float16"], {}], "config": {"index": 68041, "code_hash": null, "entity": [["tile_fc", "sp", [-1, 1, 16]], ["tile_y", "sp", [-1, 2, 2]], ["tile_x", "sp", [-1, 1, 4]], ["tile_rcc", "sp", [-1, 4]], ["tile_ry", "sp", [-1, 3]], ["tile_rx", "sp", [-1, 3]], ["auto_unroll_max_step", "ot", 0], ["unroll_explicit", "ot", 0]]}, "result": [[0.00093296562], 0, 1.6495704650878906, 1643064113.6770074], "version": 0.2, "tvm_version": "0.8.dev0"}
{"input": ["opencl -keys=adreno,opencl,gpu -device=adreno -max_num_threads=256", "conv2d_nchwc.image2d", [["TENSOR", [1, 384, 8, 8], "float16"], ["TENSOR", [384, 384, 3, 1], "float16"], [1, 1], [1, 0, 1, 0], [1, 1], "float16"], {}], "config": {"index": 150031, "code_hash": null, "entity": [["tile_fc", "sp", [-1, 1, 8]], ["tile_y", "sp", [-1, 2, 2]], ["tile_x", "sp", [-1, 1, 8]], ["tile_rcc", "sp", [-1, 96]], ["tile_ry", "sp", [-1, 3]], ["tile_rx", "sp", [-1, 1]], ["auto_unroll_max_step", "ot", 1500], ["unroll_explicit", "ot", 0]]}, "result": [[0.00027981978], 0, 0.9858458042144775, 1643065414.3189688], "version": 0.2, "tvm_version": "0.8.dev0"}
{"input": ["opencl -keys=adreno,opencl,gpu -device=adreno -max_num_threads=256", "conv2d_nchwc.image2d", [["TENSOR", [1, 1280, 8, 8], "float16"], ["TENSOR", [384, 1280, 1, 1], "float16"], [1, 1], [0, 0, 0, 0], [1, 1], "float16"], {}], "config": {"index": 114285, "code_hash": null, "entity": [["tile_fc", "sp", [-1, 1, 6]], ["tile_y", "sp", [-1, 1, 4]], ["tile_x", "sp", [-1, 2, 4]], ["tile_rcc", "sp", [-1, 160]], ["tile_ry", "sp", [-1, 1]], ["tile_rx", "sp", [-1, 1]], ["auto_unroll_max_step", "ot", 0], ["unroll_explicit", "ot", 1]]}, "result": [[0.00037372916], 0, 1.5301916599273682, 1643066943.0725596], "version": 0.2, "tvm_version": "0.8.dev0"}
{"input": ["opencl -keys=adreno,opencl,gpu -device=adreno -max_num_threads=256", "conv2d_nchwc.image2d", [["TENSOR", [1, 384, 8, 8], "float16"], ["TENSOR", [384, 384, 1, 3], "float16"], [1, 1], [0, 1, 0, 1], [1, 1], "float16"], {}], "config": {"index": 107324, "code_hash": null, "entity": [["tile_fc", "sp", [-1, 1, 32]], ["tile_y", "sp", [-1, 1, 8]], ["tile_x", "sp", [-1, 2, 2]], ["tile_rcc", "sp", [-1, 4]], ["tile_ry", "sp", [-1, 1]], ["tile_rx", "sp", [-1, 1]], ["auto_unroll_max_step", "ot", 1500], ["unroll_explicit", "ot", 0]]}, "result": [[0.00027656772], 0, 1.0471620559692383, 1643067697.1719434], "version": 0.2, "tvm_version": "0.8.dev0"}
{"input": ["opencl -keys=adreno,opencl,gpu -device=adreno -max_num_threads=256", "conv2d_nchwc.image2d", [["TENSOR", [1, 192, 17, 17], "float16"], ["TENSOR", [192, 192, 3, 3], "float16"], [2, 2], [0, 0, 0, 0], [1, 1], "float16"], {}], "config": {"index": 151783, "code_hash": null, "entity": [["tile_fc", "sp", [-1, 1, 8]], ["tile_y", "sp", [-1, 1, 2]], ["tile_x", "sp", [-1, 2, 4]], ["tile_rcc", "sp", [-1, 8]], ["tile_ry", "sp", [-1, 3]], ["tile_rx", "sp", [-1, 3]], ["auto_unroll_max_step", "ot", 1500], ["unroll_explicit", "ot", 0]]}, "result": [[0.00028639688], 0, 1.0182223320007324, 1643068717.0593245], "version": 0.2, "tvm_version": "0.8.dev0"}
{"input": ["opencl -keys=adreno,opencl,gpu -device=adreno -max_num_threads=256", "conv2d_nchwc.image2d", [["TENSOR", [1, 192, 17, 17], "float16"], ["TENSOR", [192, 192, 1, 7], "float16"], [1, 1], [0, 3, 0, 3], [1, 1], "float16"], {}], "config": {"index": 110880, "code_hash": null, "entity": [["tile_fc", "sp", [-1, 1, 12]], ["tile_y", "sp", [-1, 1, 2]], ["tile_x", "sp", [-1, 4, 5]], ["tile_rcc", "sp", [-1, 2]], ["tile_ry", "sp", [-1, 1]], ["tile_rx", "sp", [-1, 7]], ["auto_unroll_max_step", "ot", 512], ["unroll_explicit", "ot", 0]]}, "result": [[0.00049634478], 0, 0.9004466533660889, 1643069081.890282], "version": 0.2, "tvm_version": "0.8.dev0"}
{"input": ["opencl -keys=adreno,opencl,gpu -device=adreno -max_num_threads=256", "conv2d_nchwc.image2d", [["TENSOR", [1, 192, 17, 17], "float16"], ["TENSOR", [192, 192, 7, 1], "float16"], [1, 1], [3, 0, 3, 0], [1, 1], "float16"], {}], "config": {"index": 3163, "code_hash": null, "entity": [["tile_fc", "sp", [-1, 1, 12]], ["tile_y", "sp", [-1, 2, 1]], ["tile_x", "sp", [-1, 2, 10]], ["tile_rcc", "sp", [-1, 1]], ["tile_ry", "sp", [-1, 1]], ["tile_rx", "sp", [-1, 1]], ["auto_unroll_max_step", "ot", 0], ["unroll_explicit", "ot", 0]]}, "result": [[0.00053728646], 0, 1.0287845134735107, 1643071061.022981], "version": 0.2, "tvm_version": "0.8.dev0"}
{"input": ["opencl -keys=adreno,opencl,gpu -device=adreno -max_num_threads=256", "conv2d_nchwc.image2d", [["TENSOR", [1, 160, 17, 17], "float16"], ["TENSOR", [160, 160, 7, 1], "float16"], [1, 1], [3, 0, 3, 0], [1, 1], "float16"], {}], "config": {"index": 79720, "code_hash": null, "entity": [["tile_fc", "sp", [-1, 2, 10]], ["tile_y", "sp", [-1, 2, 1]], ["tile_x", "sp", [-1, 4, 5]], ["tile_rcc", "sp", [-1, 4]], ["tile_ry", "sp", [-1, 1]], ["tile_rx", "sp", [-1, 1]], ["auto_unroll_max_step", "ot", 1500], ["unroll_explicit", "ot", 0]]}, "result": [[0.00042998438], 0, 1.4490392208099365, 1643073021.844773], "version": 0.2, "tvm_version": "0.8.dev0"}
{"input": ["opencl -keys=adreno,opencl,gpu -device=adreno -max_num_threads=256", "conv2d_nchwc.image2d", [["TENSOR", [1, 160, 17, 17], "float16"], ["TENSOR", [192, 160, 1, 7], "float16"], [1, 1], [0, 3, 0, 3], [1, 1], "float16"], {}], "config": {"index": 122402, "code_hash": null, "entity": [["tile_fc", "sp", [-1, 1, 48]], ["tile_y", "sp", [-1, 5, 4]], ["tile_x", "sp", [-1, 1, 1]], ["tile_rcc", "sp", [-1, 5]], ["tile_ry", "sp", [-1, 1]], ["tile_rx", "sp", [-1, 1]], ["auto_unroll_max_step", "ot", 1500], ["unroll_explicit", "ot", 0]]}, "result": [[0.00041169373999999995], 0, 0.7936625480651855, 1643074201.008436], "version": 0.2, "tvm_version": "0.8.dev0"}
{"input": ["opencl -keys=adreno,opencl,gpu -device=adreno -max_num_threads=256", "conv2d_nchwc.image2d", [["TENSOR", [1, 768, 17, 17], "float16"], ["TENSOR", [160, 768, 1, 1], "float16"], [1, 1], [0, 0, 0, 0], [1, 1], "float16"], {}], "config": {"index": 34580, "code_hash": null, "entity": [["tile_fc", "sp", [-1, 1, 20]], ["tile_y", "sp", [-1, 2, 5]], ["tile_x", "sp", [-1, 2, 1]], ["tile_rcc", "sp", [-1, 2]], ["tile_ry", "sp", [-1, 1]], ["tile_rx", "sp", [-1, 1]], ["auto_unroll_max_step", "ot", 512], ["unroll_explicit", "ot", 0]]}, "result": [[0.00030761146], 0, 1.105299472808838, 1643074851.11656], "version": 0.2, "tvm_version": "0.8.dev0"}
{"input": ["opencl -keys=adreno,opencl,gpu -device=adreno -max_num_threads=256", "conv2d_nchwc.image2d", [["TENSOR", [1, 160, 17, 17], "float16"], ["TENSOR", [160, 160, 1, 7], "float16"], [1, 1], [0, 3, 0, 3], [1, 1], "float16"], {}], "config": {"index": 77540, "code_hash": null, "entity": [["tile_fc", "sp", [-1, 1, 10]], ["tile_y", "sp", [-1, 1, 5]], ["tile_x", "sp", [-1, 4, 5]], ["tile_rcc", "sp", [-1, 2]], ["tile_ry", "sp", [-1, 1]], ["tile_rx", "sp", [-1, 1]], ["auto_unroll_max_step", "ot", 1500], ["unroll_explicit", "ot", 0]]}, "result": [[0.00038153019999999995], 0, 1.3074328899383545, 1643076240.6157775], "version": 0.2, "tvm_version": "0.8.dev0"}
{"input": ["opencl -keys=adreno,opencl,gpu -device=adreno -max_num_threads=256", "conv2d_nchwc.image2d", [["TENSOR", [1, 160, 17, 17], "float16"], ["TENSOR", [192, 160, 7, 1], "float16"], [1, 1], [3, 0, 3, 0], [1, 1], "float16"], {}], "config": {"index": 124891, "code_hash": null, "entity": [["tile_fc", "sp", [-1, 2, 24]], ["tile_y", "sp", [-1, 2, 2]], ["tile_x", "sp", [-1, 4, 5]], ["tile_rcc", "sp", [-1, 5]], ["tile_ry", "sp", [-1, 1]], ["tile_rx", "sp", [-1, 1]], ["auto_unroll_max_step", "ot", 1500], ["unroll_explicit", "ot", 0]]}, "result": [[0.00044908854], 0, 1.0297491550445557, 1643077133.6830983], "version": 0.2, "tvm_version": "0.8.dev0"}
{"input": ["opencl -keys=adreno,opencl,gpu -device=adreno -max_num_threads=256", "conv2d_nchwc.image2d", [["TENSOR", [1, 128, 17, 17], "float16"], ["TENSOR", [128, 128, 7, 1], "float16"], [1, 1], [3, 0, 3, 0], [1, 1], "float16"], {}], "config": {"index": 34037, "code_hash": null, "entity": [["tile_fc", "sp", [-1, 1, 16]], ["tile_y", "sp", [-1, 1, 2]], ["tile_x", "sp", [-1, 5, 4]], ["tile_rcc", "sp", [-1, 4]], ["tile_ry", "sp", [-1, 7]], ["tile_rx", "sp", [-1, 1]], ["auto_unroll_max_step", "ot", 512], ["unroll_explicit", "ot", 0]]}, "result": [[0.00028448438], 0, 0.8870370388031006, 1643077786.6605546], "version": 0.2, "tvm_version": "0.8.dev0"}
{"input": ["opencl -keys=adreno,opencl,gpu -device=adreno -max_num_threads=256", "conv2d_nchwc.image2d", [["TENSOR", [1, 128, 17, 17], "float16"], ["TENSOR", [192, 128, 1, 7], "float16"], [1, 1], [0, 3, 0, 3], [1, 1], "float16"], {}], "config": {"index": 67912, "code_hash": null, "entity": [["tile_fc", "sp", [-1, 1, 24]], ["tile_y", "sp", [-1, 1, 1]], ["tile_x", "sp", [-1, 5, 4]], ["tile_rcc", "sp", [-1, 2]], ["tile_ry", "sp", [-1, 1]], ["tile_rx", "sp", [-1, 7]], ["auto_unroll_max_step", "ot", 512], ["unroll_explicit", "ot", 0]]}, "result": [[0.00033737396], 0, 0.9499607086181641, 1643078822.7135339], "version": 0.2, "tvm_version": "0.8.dev0"}
{"input": ["opencl -keys=adreno,opencl,gpu -device=adreno -max_num_threads=256", "conv2d_nchwc.image2d", [["TENSOR", [1, 768, 17, 17], "float16"], ["TENSOR", [128, 768, 1, 1], "float16"], [1, 1], [0, 0, 0, 0], [1, 1], "float16"], {}], "config": {"index": 2871, "code_hash": null, "entity": [["tile_fc", "sp", [-1, 1, 16]], ["tile_y", "sp", [-1, 1, 2]], ["tile_x", "sp", [-1, 4, 5]], ["tile_rcc", "sp", [-1, 2]], ["tile_ry", "sp", [-1, 1]], ["tile_rx", "sp", [-1, 1]], ["auto_unroll_max_step", "ot", 0], ["unroll_explicit", "ot", 0]]}, "result": [[0.00028080522], 0, 0.9953751564025879, 1643079392.1690075], "version": 0.2, "tvm_version": "0.8.dev0"}
{"input": ["opencl -keys=adreno,opencl,gpu -device=adreno -max_num_threads=256", "conv2d_nchwc.image2d", [["TENSOR", [1, 128, 17, 17], "float16"], ["TENSOR", [128, 128, 1, 7], "float16"], [1, 1], [0, 3, 0, 3], [1, 1], "float16"], {}], "config": {"index": 26472, "code_hash": null, "entity": [["tile_fc", "sp", [-1, 1, 16]], ["tile_y", "sp", [-1, 2, 1]], ["tile_x", "sp", [-1, 2, 10]], ["tile_rcc", "sp", [-1, 8]], ["tile_ry", "sp", [-1, 1]], ["tile_rx", "sp", [-1, 1]], ["auto_unroll_max_step", "ot", 512], ["unroll_explicit", "ot", 0]]}, "result": [[0.0002843], 0, 0.8299384117126465, 1643080015.9955256], "version": 0.2, "tvm_version": "0.8.dev0"}
{"input": ["opencl -keys=adreno,opencl,gpu -device=adreno -max_num_threads=256", "conv2d_nchwc.image2d", [["TENSOR", [1, 128, 17, 17], "float16"], ["TENSOR", [192, 128, 7, 1], "float16"], [1, 1], [3, 0, 3, 0], [1, 1], "float16"], {}], "config": {"index": 65454, "code_hash": null, "entity": [["tile_fc", "sp", [-1, 2, 12]], ["tile_y", "sp", [-1, 2, 2]], ["tile_x", "sp", [-1, 4, 5]], ["tile_rcc", "sp", [-1, 1]], ["tile_ry", "sp", [-1, 7]], ["tile_rx", "sp", [-1, 1]], ["auto_unroll_max_step", "ot", 512], ["unroll_explicit", "ot", 0]]}, "result": [[0.00036108334], 0, 1.212430477142334, 1643080764.4762301], "version": 0.2, "tvm_version": "0.8.dev0"}
{"input": ["opencl -keys=adreno,opencl,gpu -device=adreno -max_num_threads=256", "conv2d_nchwc.image2d", [["TENSOR", [1, 96, 35, 35], "float16"], ["TENSOR", [96, 96, 3, 3], "float16"], [2, 2], [0, 0, 0, 0], [1, 1], "float16"], {}], "config": {"index": 107187, "code_hash": null, "entity": [["tile_fc", "sp", [-1, 1, 24]], ["tile_y", "sp", [-1, 1, 2]], ["tile_x", "sp", [-1, 2, 5]], ["tile_rcc", "sp", [-1, 4]], ["tile_ry", "sp", [-1, 1]], ["tile_rx", "sp", [-1, 3]], ["auto_unroll_max_step", "ot", 512], ["unroll_explicit", "ot", 0]]}, "result": [[0.00025553646], 0, 0.794788122177124, 1643081552.5451674], "version": 0.2, "tvm_version": "0.8.dev0"}
{"input": ["opencl -keys=adreno,opencl,gpu -device=adreno -max_num_threads=256", "conv2d_nchwc.image2d", [["TENSOR", [1, 288, 35, 35], "float16"], ["TENSOR", [48, 288, 1, 1], "float16"], [1, 1], [0, 0, 0, 0], [1, 1], "float16"], {}], "config": {"index": 70636, "code_hash": null, "entity": [["tile_fc", "sp", [-1, 1, 6]], ["tile_y", "sp", [-1, 2, 6]], ["tile_x", "sp", [-1, 3, 6]], ["tile_rcc", "sp", [-1, 6]], ["tile_ry", "sp", [-1, 1]], ["tile_rx", "sp", [-1, 1]], ["auto_unroll_max_step", "ot", 512], ["unroll_explicit", "ot", 0]]}, "result": [[0.00018641249999999998], 0, 0.8818857669830322, 1643082453.5062287], "version": 0.2, "tvm_version": "0.8.dev0"}
{"input": ["opencl -keys=adreno,opencl,gpu -device=adreno -max_num_threads=256", "conv2d_nchwc.image2d", [["TENSOR", [1, 256, 35, 35], "float16"], ["TENSOR", [48, 256, 1, 1], "float16"], [1, 1], [0, 0, 0, 0], [1, 1], "float16"], {}], "config": {"index": 7861, "code_hash": null, "entity": [["tile_fc", "sp", [-1, 1, 12]], ["tile_y", "sp", [-1, 1, 6]], ["tile_x", "sp", [-1, 4, 9]], ["tile_rcc", "sp", [-1, 2]], ["tile_ry", "sp", [-1, 1]], ["tile_rx", "sp", [-1, 1]], ["auto_unroll_max_step", "ot", 0], ["unroll_explicit", "ot", 0]]}, "result": [[0.00016029271999999997], 0, 2.174715518951416, 1643083322.9420187], "version": 0.2, "tvm_version": "0.8.dev0"}
{"input": ["opencl -keys=adreno,opencl,gpu -device=adreno -max_num_threads=256", "conv2d_nchwc.image2d", [["TENSOR", [1, 192, 35, 35], "float16"], ["TENSOR", [32, 192, 1, 1], "float16"], [1, 1], [0, 0, 0, 0], [1, 1], "float16"], {}], "config": {"index": 27819, "code_hash": null, "entity": [["tile_fc", "sp", [-1, 1, 8]], ["tile_y", "sp", [-1, 3, 4]], ["tile_x", "sp", [-1, 3, 6]], ["tile_rcc", "sp", [-1, 4]], ["tile_ry", "sp", [-1, 1]], ["tile_rx", "sp", [-1, 1]], ["auto_unroll_max_step", "ot", 512], ["unroll_explicit", "ot", 0]]}, "result": [[0.00011281563999999999], 0, 0.7940711975097656, 1643083533.759657], "version": 0.2, "tvm_version": "0.8.dev0"}
{"input": ["opencl -keys=adreno,opencl,gpu -device=adreno -max_num_threads=256", "conv2d_nchwc.image2d", [["TENSOR", [1, 64, 35, 35], "float16"], ["TENSOR", [96, 64, 3, 3], "float16"], [1, 1], [1, 1, 1, 1], [1, 1], "float16"], {}], "config": {"index": 167199, "code_hash": null, "entity": [["tile_fc", "sp", [-1, 1, 24]], ["tile_y", "sp", [-1, 3, 2]], ["tile_x", "sp", [-1, 3, 4]], ["tile_rcc", "sp", [-1, 1]], ["tile_ry", "sp", [-1, 1]], ["tile_rx", "sp", [-1, 1]], ["auto_unroll_max_step", "ot", 512], ["unroll_explicit", "ot", 0]]}, "result": [[0.00039058542], 0, 1.2439630031585693, 1643084865.270858], "version": 0.2, "tvm_version": "0.8.dev0"}
{"input": ["opencl -keys=adreno,opencl,gpu -device=adreno -max_num_threads=256", "conv2d_nchwc.image2d", [["TENSOR", [1, 96, 35, 35], "float16"], ["TENSOR", [96, 96, 3, 3], "float16"], [1, 1], [1, 1, 1, 1], [1, 1], "float16"], {}], "config": {"index": 276442, "code_hash": null, "entity": [["tile_fc", "sp", [-1, 1, 24]], ["tile_y", "sp", [-1, 1, 1]], ["tile_x", "sp", [-1, 4, 9]], ["tile_rcc", "sp", [-1, 2]], ["tile_ry", "sp", [-1, 1]], ["tile_rx", "sp", [-1, 1]], ["auto_unroll_max_step", "ot", 512], ["unroll_explicit", "ot", 0]]}, "result": [[0.00051019168], 0, 1.0039944648742676, 1643086004.2838655], "version": 0.2, "tvm_version": "0.8.dev0"}
{"input": ["opencl -keys=adreno,opencl,gpu -device=adreno -max_num_threads=256", "conv2d_nchwc.image2d", [["TENSOR", [1, 192, 35, 35], "float16"], ["TENSOR", [48, 192, 1, 1], "float16"], [1, 1], [0, 0, 0, 0], [1, 1], "float16"], {}], "config": {"index": 41573, "code_hash": null, "entity": [["tile_fc", "sp", [-1, 2, 6]], ["tile_y", "sp", [-1, 4, 3]], ["tile_x", "sp", [-1, 2, 9]], ["tile_rcc", "sp", [-1, 48]], ["tile_ry", "sp", [-1, 1]], ["tile_rx", "sp", [-1, 1]], ["auto_unroll_max_step", "ot", 0], ["unroll_explicit", "ot", 0]]}, "result": [[0.00013557188], 0, 0.9901552200317383, 1643086929.2733686], "version": 0.2, "tvm_version": "0.8.dev0"}
{"input": ["opencl -keys=adreno,opencl,gpu -device=adreno -max_num_threads=256", "conv2d_nchwc.image2d", [["TENSOR", [1, 48, 35, 35], "float16"], ["TENSOR", [64, 48, 5, 5], "float16"], [1, 1], [2, 2, 2, 2], [1, 1], "float16"], {}], "config": {"index": 116307, "code_hash": null, "entity": [["tile_fc", "sp", [-1, 1, 8]], ["tile_y", "sp", [-1, 3, 2]], ["tile_x", "sp", [-1, 3, 12]], ["tile_rcc", "sp", [-1, 1]], ["tile_ry", "sp", [-1, 5]], ["tile_rx", "sp", [-1, 1]], ["auto_unroll_max_step", "ot", 512], ["unroll_explicit", "ot", 0]]}, "result": [[0.00046505519999999993], 0, 0.9916446208953857, 1643087976.6845987], "version": 0.2, "tvm_version": "0.8.dev0"}
{"input": ["opencl -keys=adreno,opencl,gpu -device=adreno -max_num_threads=256", "conv2d_nchwc.image2d", [["TENSOR", [1, 3, 299, 299], "float16"], ["TENSOR", [32, 3, 3, 3], "float16"], [2, 2], [0, 0, 0, 0], [1, 1], "float16"], {}], "config": {"index": 458, "code_hash": null, "entity": [["tile_fc", "sp", [-1, 1, 8]], ["tile_y", "sp", [-1, 4, 2]], ["tile_x", "sp", [-1, 2, 4]], ["tile_rcc", "sp", [-1, 1]], ["tile_ry", "sp", [-1, 1]], ["tile_rx", "sp", [-1, 3]], ["auto_unroll_max_step", "ot", 0], ["unroll_explicit", "ot", 0]]}, "result": [[0.00022305831999999999], 0, 1.2143008708953857, 1643088578.3809493], "version": 0.2, "tvm_version": "0.8.dev0"}
{"input": ["opencl -keys=adreno,opencl,gpu -device=adreno -max_num_threads=256", "conv2d_nchwc.image2d", [["TENSOR", [1, 32, 149, 149], "float16"], ["TENSOR", [32, 32, 3, 3], "float16"], [1, 1], [0, 0, 0, 0], [1, 1], "float16"], {}], "config": {"index": 1253, "code_hash": null, "entity": [["tile_fc", "sp", [-1, 1, 8]], ["tile_y", "sp", [-1, 2, 2]], ["tile_x", "sp", [-1, 1, 4]], ["tile_rcc", "sp", [-1, 1]], ["tile_ry", "sp", [-1, 3]], ["tile_rx", "sp", [-1, 3]], ["auto_unroll_max_step", "ot", 1500], ["unroll_explicit", "ot", 0]]}, "result": [[0.00163109686], 0, 1.450864315032959, 1643088964.183833], "version": 0.2, "tvm_version": "0.8.dev0"}
{"input": ["opencl -keys=adreno,opencl,gpu -device=adreno -max_num_threads=256", "conv2d_nchwc.image2d", [["TENSOR", [1, 32, 147, 147], "float16"], ["TENSOR", [64, 32, 3, 3], "float16"], [1, 1], [1, 1, 1, 1], [1, 1], "float16"], {}], "config": {"index": 2522, "code_hash": null, "entity": [["tile_fc", "sp", [-1, 1, 16]], ["tile_y", "sp", [-1, 1, 4]], ["tile_x", "sp", [-1, 4, 1]], ["tile_rcc", "sp", [-1, 2]], ["tile_ry", "sp", [-1, 1]], ["tile_rx", "sp", [-1, 1]], ["auto_unroll_max_step", "ot", 1500], ["unroll_explicit", "ot", 0]]}, "result": [[0.00220063124], 0, 1.8009757995605469, 1643089967.054046], "version": 0.2, "tvm_version": "0.8.dev0"}
{"input": ["opencl -keys=adreno,opencl,gpu -device=adreno -max_num_threads=256", "conv2d_nchwc.image2d", [["TENSOR", [1, 64, 73, 73], "float16"], ["TENSOR", [80, 64, 1, 1], "float16"], [1, 1], [0, 0, 0, 0], [1, 1], "float16"], {}], "config": {"index": 992, "code_hash": null, "entity": [["tile_fc", "sp", [-1, 1, 20]], ["tile_y", "sp", [-1, 4, 1]], ["tile_x", "sp", [-1, 1, 4]], ["tile_rcc", "sp", [-1, 2]], ["tile_ry", "sp", [-1, 1]], ["tile_rx", "sp", [-1, 1]], ["auto_unroll_max_step", "ot", 1500], ["unroll_explicit", "ot", 0]]}, "result": [[0.00029010624], 0, 1.0677399635314941, 1643090223.5958242], "version": 0.2, "tvm_version": "0.8.dev0"}
{"input": ["opencl -keys=adreno,opencl,gpu -device=adreno -max_num_threads=256", "conv2d_nchwc.image2d", [["TENSOR", [1, 80, 73, 73], "float16"], ["TENSOR", [192, 80, 3, 3], "float16"], [1, 1], [0, 0, 0, 0], [1, 1], "float16"], {}], "config": {"index": 2064589, "code_hash": null, "entity": [["tile_fc", "sp", [-1, 1, 16]], ["tile_y", "sp", [-1, 2, 2]], ["tile_x", "sp", [-1, 4, 6]], ["tile_rcc", "sp", [-1, 20]], ["tile_ry", "sp", [-1, 3]], ["tile_rx", "sp", [-1, 3]], ["auto_unroll_max_step", "ot", 1500], ["unroll_explicit", "ot", 0]]}, "result": [[0.00300733126], 0, 1.7581851482391357, 1643092580.2528832], "version": 0.2, "tvm_version": "0.8.dev0"}
{"input": ["opencl -keys=adreno,opencl,gpu -device=adreno -max_num_threads=256", "conv2d_nchwc.image2d", [["TENSOR", [1, 192, 35, 35], "float16"], ["TENSOR", [64, 192, 1, 1], "float16"], [1, 1], [0, 0, 0, 0], [1, 1], "float16"], {}], "config": {"index": 40548, "code_hash": null, "entity": [["tile_fc", "sp", [-1, 2, 4]], ["tile_y", "sp", [-1, 4, 3]], ["tile_x", "sp", [-1, 2, 9]], ["tile_rcc", "sp", [-1, 1]], ["tile_ry", "sp", [-1, 1]], ["tile_rx", "sp", [-1, 1]], ["auto_unroll_max_step", "ot", 512], ["unroll_explicit", "ot", 0]]}, "result": [[0.00013945416], 0, 0.8910605907440186, 1643093457.5460784], "version": 0.2, "tvm_version": "0.8.dev0"}
{"input": ["opencl -keys=adreno,opencl,gpu -device=adreno -max_num_threads=256", "conv2d_nchwc.image2d", [["TENSOR", [1, 256, 35, 35], "float16"], ["TENSOR", [64, 256, 1, 1], "float16"], [1, 1], [0, 0, 0, 0], [1, 1], "float16"], {}], "config": {"index": 72496, "code_hash": null, "entity": [["tile_fc", "sp", [-1, 1, 16]], ["tile_y", "sp", [-1, 3, 4]], ["tile_x", "sp", [-1, 3, 3]], ["tile_rcc", "sp", [-1, 32]], ["tile_ry", "sp", [-1, 1]], ["tile_rx", "sp", [-1, 1]], ["auto_unroll_max_step", "ot", 1500], ["unroll_explicit", "ot", 0]]}, "result": [[0.00017598958000000003], 0, 1.1200990676879883, 1643094236.3306522], "version": 0.2, "tvm_version": "0.8.dev0"}
{"input": ["opencl -keys=adreno,opencl,gpu -device=adreno -max_num_threads=256", "conv2d_nchwc.image2d", [["TENSOR", [1, 288, 35, 35], "float16"], ["TENSOR", [64, 288, 1, 1], "float16"], [1, 1], [0, 0, 0, 0], [1, 1], "float16"], {}], "config": {"index": 6719, "code_hash": null, "entity": [["tile_fc", "sp", [-1, 1, 16]], ["tile_y", "sp", [-1, 2, 3]], ["tile_x", "sp", [-1, 2, 9]], ["tile_rcc", "sp", [-1, 2]], ["tile_ry", "sp", [-1, 1]], ["tile_rx", "sp", [-1, 1]], ["auto_unroll_max_step", "ot", 0], ["unroll_explicit", "ot", 0]]}, "result": [[0.00018638957999999998], 0, 1.0600628852844238, 1643094584.7450593], "version": 0.2, "tvm_version": "0.8.dev0"}
{"input": ["opencl -keys=adreno,opencl,gpu -device=adreno -max_num_threads=256", "conv2d_nchwc.image2d", [["TENSOR", [1, 288, 35, 35], "float16"], ["TENSOR", [384, 288, 3, 3], "float16"], [2, 2], [0, 0, 0, 0], [1, 1], "float16"], {}], "config": {"index": 240661, "code_hash": null, "entity": [["tile_fc", "sp", [-1, 1, 48]], ["tile_y", "sp", [-1, 2, 1]], ["tile_x", "sp", [-1, 5, 4]], ["tile_rcc", "sp", [-1, 72]], ["tile_ry", "sp", [-1, 3]], ["tile_rx", "sp", [-1, 3]], ["auto_unroll_max_step", "ot", 0], ["unroll_explicit", "ot", 0]]}, "result": [[0.00211016146], 0, 1.8707301616668701, 1643096591.2909074], "version": 0.2, "tvm_version": "0.8.dev0"}
{"input": ["opencl -keys=adreno,opencl,gpu -device=adreno -max_num_threads=256", "conv2d_nchwc.image2d", [["TENSOR", [1, 768, 17, 17], "float16"], ["TENSOR", [192, 768, 1, 1], "float16"], [1, 1], [0, 0, 0, 0], [1, 1], "float16"], {}], "config": {"index": 66780, "code_hash": null, "entity": [["tile_fc", "sp", [-1, 2, 12]], ["tile_y", "sp", [-1, 2, 10]], ["tile_x", "sp", [-1, 4, 1]], ["tile_rcc", "sp", [-1, 8]], ["tile_ry", "sp", [-1, 1]], ["tile_rx", "sp", [-1, 1]], ["auto_unroll_max_step", "ot", 512], ["unroll_explicit", "ot", 0]]}, "result": [[0.00033636980000000005], 0, 1.227062702178955, 1643097313.6193073], "version": 0.2, "tvm_version": "0.8.dev0"}
{"input": ["opencl -keys=adreno,opencl,gpu -device=adreno -max_num_threads=256", "conv2d_nchwc.image2d", [["TENSOR", [1, 192, 17, 17], "float16"], ["TENSOR", [320, 192, 3, 3], "float16"], [2, 2], [0, 0, 0, 0], [1, 1], "float16"], {}], "config": {"index": 153706, "code_hash": null, "entity": [["tile_fc", "sp", [-1, 1, 4]], ["tile_y", "sp", [-1, 2, 2]], ["tile_x", "sp", [-1, 1, 8]], ["tile_rcc", "sp", [-1, 6]], ["tile_ry", "sp", [-1, 1]], ["tile_rx", "sp", [-1, 3]], ["auto_unroll_max_step", "ot", 1500], ["unroll_explicit", "ot", 0]]}, "result": [[0.00038238332], 0, 0.9646642208099365, 1643098048.4569135], "version": 0.2, "tvm_version": "0.8.dev0"}
{"input": ["opencl -keys=adreno,opencl,gpu -device=adreno -max_num_threads=256", "conv2d_nchwc.image2d", [["TENSOR", [1, 1280, 8, 8], "float16"], ["TENSOR", [320, 1280, 1, 1], "float16"], [1, 1], [0, 0, 0, 0], [1, 1], "float16"], {}], "config": {"index": 2648, "code_hash": null, "entity": [["tile_fc", "sp", [-1, 1, 8]], ["tile_y", "sp", [-1, 2, 4]], ["tile_x", "sp", [-1, 2, 4]], ["tile_rcc", "sp", [-1, 2]], ["tile_ry", "sp", [-1, 1]], ["tile_rx", "sp", [-1, 1]], ["auto_unroll_max_step", "ot", 0], ["unroll_explicit", "ot", 0]]}, "result": [[0.00026428334000000003], 0, 0.9287943840026855, 1643098639.596683], "version": 0.2, "tvm_version": "0.8.dev0"}
{"input": ["opencl -keys=adreno,opencl,gpu -device=adreno -max_num_threads=256", "conv2d_nchwc.image2d", [["TENSOR", [1, 2048, 8, 8], "float16"], ["TENSOR", [320, 2048, 1, 1], "float16"], [1, 1], [0, 0, 0, 0], [1, 1], "float16"], {}], "config": {"index": 2648, "code_hash": null, "entity": [["tile_fc", "sp", [-1, 1, 8]], ["tile_y", "sp", [-1, 2, 4]], ["tile_x", "sp", [-1, 2, 4]], ["tile_rcc", "sp", [-1, 2]], ["tile_ry", "sp", [-1, 1]], ["tile_rx", "sp", [-1, 1]], ["auto_unroll_max_step", "ot", 0], ["unroll_explicit", "ot", 0]]}, "result": [[0.00041804896000000003], 0, 1.227113962173462, 1643099211.3644764], "version": 0.2, "tvm_version": "0.8.dev0"}
{"input": ["opencl -keys=adreno,opencl,gpu -device=adreno -max_num_threads=256", "conv2d_nchwc.image2d", [["TENSOR", [1, 2048, 1, 1], "float16"], ["TENSOR", [1001, 2048, 1, 1], "float16"], [1, 1], [0, 0, 0, 0], [1, 1], "float16"], {}], "config": {"index": 917, "code_hash": null, "entity": [["tile_fc", "sp", [-1, 1, 251]], ["tile_y", "sp", [-1, 1, 1]], ["tile_x", "sp", [-1, 1, 2]], ["tile_rcc", "sp", [-1, 512]], ["tile_ry", "sp", [-1, 1]], ["tile_rx", "sp", [-1, 1]], ["auto_unroll_max_step", "ot", 1500], ["unroll_explicit", "ot", 0]]}, "result": [[0.00065085208], 0, 1.8032703399658203, 1643099593.4966123], "version": 0.2, "tvm_version": "0.8.dev0"}
