logs/mobilenetv1_float16_autotvm_tuning.log
{"input": ["opencl -keys=mali,opencl,gpu -device=mali -max_num_threads=256", "conv2d_nchw_spatial_pack.mali", [["TENSOR", [1, 3, 224, 224], "float16"], ["TENSOR", [32, 3, 3, 3], "float16"], [2, 2], [1, 1, 1, 1], [1, 1], "float16"], {}], "config": {"index": 4726171, "code_hash": null, "entity": [["tile_co", "sp", [-1, 2, 8]], ["tile_oh", "sp", [-1, 1, 2]], ["tile_ow", "sp", [-1, 16, 1]], ["reorder_0", "re", [0, 1, 2, 3, 4, 5, 6, 9, 7, 8]], ["ann_reduce", "an", ["unroll", "unroll"]], ["ann_spatial", "an", ["unroll", "unroll", "vec"]]]}, "result": [[0.0019997396], 0, 1.81687593460083, 1596750179.9636428], "version": 0.2, "tvm_version": "0.7.dev1"}
{"input": ["opencl -keys=mali,opencl,gpu -device=mali -max_num_threads=256", "depthwise_conv2d_nchw.mali", [["TENSOR", [1, 32, 112, 112], "float16"], ["TENSOR", [32, 1, 3, 3], "float16"], [1, 1], [1, 1, 1, 1], [1, 1], "float16"], {}], "config": {"index": 568643, "code_hash": null, "entity": [["tile_c", "sp", [-1, 32, 1]], ["tile_y", "sp", [-1, 1, 14]], ["tile_x", "sp", [-1, 28, 2]], ["ann_spatial", "an", ["unroll", "unroll", "vec"]]]}, "result": [[0.0008009479999999999], 0, 2.095621347427368, 1596751491.2575512], "version": 0.2, "tvm_version": "0.7.dev1"}
{"input": ["opencl -keys=mali,opencl,gpu -device=mali -max_num_threads=256", "conv2d_nchw_spatial_pack.mali", [["TENSOR", [1, 32, 112, 112], "float16"], ["TENSOR", [64, 32, 1, 1], "float16"], [1, 1], [0, 0, 0, 0], [1, 1], "float16"], {}], "config": {"index": 5961755, "code_hash": null, "entity": [["tile_co", "sp", [-1, 2, 16]], ["tile_oh", "sp", [-1, 1, 7]], ["tile_ow", "sp", [-1, 16, 1]], ["reorder_0", "re", [0, 1, 2, 3, 4, 5, 6, 9, 7, 8]], ["ann_reduce", "an", ["none", "none"]], ["ann_spatial", "an", ["unroll", "unroll", "vec"]]]}, "result": [[0.0028260728], 0, 3.9192399978637695, 1596753376.7956018], "version": 0.2, "tvm_version": "0.7.dev1"}
{"input": ["opencl -keys=mali,opencl,gpu -device=mali -max_num_threads=256", "depthwise_conv2d_nchw.mali", [["TENSOR", [1, 64, 112, 112], "float16"], ["TENSOR", [64, 1, 3, 3], "float16"], [2, 2], [1, 1, 1, 1], [1, 1], "float16"], {}], "config": {"index": 104669, "code_hash": null, "entity": [["tile_c", "sp", [-1, 32, 1]], ["tile_y", "sp", [-1, 1, 7]], ["tile_x", "sp", [-1, 8, 1]], ["ann_spatial", "an", ["none", "unroll", "unroll"]]]}, "result": [[0.0010373854], 0, 3.5261528491973877, 1596755227.691861], "version": 0.2, "tvm_version": "0.7.dev1"}
{"input": ["opencl -keys=mali,opencl,gpu -device=mali -max_num_threads=256", "conv2d_nchw_spatial_pack.mali", [["TENSOR", [1, 64, 56, 56], "float16"], ["TENSOR", [128, 64, 1, 1], "float16"], [1, 1], [0, 0, 0, 0], [1, 1], "float16"], {}], "config": {"index": 3534580, "code_hash": null, "entity": [["tile_co", "sp", [-1, 4, 16]], ["tile_oh", "sp", [-1, 1, 8]], ["tile_ow", "sp", [-1, 4, 1]], ["reorder_0", "re", [0, 1, 2, 3, 4, 5, 6, 9, 7, 8]], ["ann_reduce", "an", ["unroll", "none"]], ["ann_spatial", "an", ["unroll", "unroll", "vec"]]]}, "result": [[0.0018914582], 0, 1.3065509796142578, 1596758771.706044], "version": 0.2, "tvm_version": "0.7.dev1"}
{"input": ["opencl -keys=mali,opencl,gpu -device=mali -max_num_threads=256", "depthwise_conv2d_nchw.mali", [["TENSOR", [1, 128, 56, 56], "float16"], ["TENSOR", [128, 1, 3, 3], "float16"], [1, 1], [1, 1, 1, 1], [1, 1], "float16"], {}], "config": {"index": 299057, "code_hash": null, "entity": [["tile_c", "sp", [-1, 32, 1]], ["tile_y", "sp", [-1, 1, 28]], ["tile_x", "sp", [-1, 28, 1]], ["ann_spatial", "an", ["unroll", "none", "unroll"]]]}, "result": [[0.0008210626], 0, 49.36659812927246, 1596759297.911158], "version": 0.2, "tvm_version": "0.7.dev1"}
{"input": ["opencl -keys=mali,opencl,gpu -device=mali -max_num_threads=256", "conv2d_nchw_spatial_pack.mali", [["TENSOR", [1, 128, 56, 56], "float16"], ["TENSOR", [128, 128, 1, 1], "float16"], [1, 1], [0, 0, 0, 0], [1, 1], "float16"], {}], "config": {"index": 3618029, "code_hash": null, "entity": [["tile_co", "sp", [-1, 8, 16]], ["tile_oh", "sp", [-1, 1, 1]], ["tile_ow", "sp", [-1, 4, 7]], ["reorder_0", "re", [0, 1, 2, 3, 4, 5, 6, 9, 7, 8]], ["ann_reduce", "an", ["unroll", "unroll"]], ["ann_spatial", "an", ["unroll", "unroll", "vec"]]]}, "result": [[0.0031442393999999998], 0, 22.55650019645691, 1596761478.556452], "version": 0.2, "tvm_version": "0.7.dev1"}
{"input": ["opencl -keys=mali,opencl,gpu -device=mali -max_num_threads=256", "depthwise_conv2d_nchw.mali", [["TENSOR", [1, 128, 56, 56], "float16"], ["TENSOR", [128, 1, 3, 3], "float16"], [2, 2], [1, 1, 1, 1], [1, 1], "float16"], {}], "config": {"index": 190309, "code_hash": null, "entity": [["tile_c", "sp", [-1, 32, 2]], ["tile_y", "sp", [-1, 1, 7]], ["tile_x", "sp", [-1, 28, 1]], ["ann_spatial", "an", ["vec", "none", "none"]]]}, "result": [[0.0006349584000000001], 0, 3.650279998779297, 1596764099.2434711], "version": 0.2, "tvm_version": "0.7.dev1"}
{"input": ["opencl -keys=mali,opencl,gpu -device=mali -max_num_threads=256", "conv2d_nchw_spatial_pack.mali", [["TENSOR", [1, 128, 28, 28], "float16"], ["TENSOR", [256, 128, 1, 1], "float16"], [1, 1], [0, 0, 0, 0], [1, 1], "float16"], {}], "config": {"index": 636739, "code_hash": null, "entity": [["tile_co", "sp", [-1, 16, 16]], ["tile_oh", "sp", [-1, 2, 1]], ["tile_ow", "sp", [-1, 1, 7]], ["reorder_0", "re", [0, 1, 2, 3, 4, 5, 6, 9, 7, 8]], ["ann_reduce", "an", ["none", "unroll"]], ["ann_spatial", "an", ["none", "unroll", "vec"]]]}, "result": [[0.0014276874], 0, 8.444190979003906, 1596764933.13793], "version": 0.2, "tvm_version": "0.7.dev1"}
{"input": ["opencl -keys=mali,opencl,gpu -device=mali -max_num_threads=256", "depthwise_conv2d_nchw.mali", [["TENSOR", [1, 256, 28, 28], "float16"], ["TENSOR", [256, 1, 3, 3], "float16"], [1, 1], [1, 1, 1, 1], [1, 1], "float16"], {}], "config": {"index": 194143, "code_hash": null, "entity": [["tile_c", "sp", [-1, 16, 2]], ["tile_y", "sp", [-1, 1, 7]], ["tile_x", "sp", [-1, 28, 1]], ["ann_spatial", "an", ["unroll", "unroll", "vec"]]]}, "result": [[0.00045192699999999997], 0, 2.3911924362182617, 1596767729.301248], "version": 0.2, "tvm_version": "0.7.dev1"}
{"input": ["opencl -keys=mali,opencl,gpu -device=mali -max_num_threads=256", "conv2d_nchw_spatial_pack.mali", [["TENSOR", [1, 256, 28, 28], "float16"], ["TENSOR", [256, 256, 1, 1], "float16"], [1, 1], [0, 0, 0, 0], [1, 1], "float16"], {}], "config": {"index": 1570624, "code_hash": null, "entity": [["tile_co", "sp", [-1, 16, 16]], ["tile_oh", "sp", [-1, 1, 1]], ["tile_ow", "sp", [-1, 2, 7]], ["reorder_0", "re", [0, 1, 2, 3, 4, 5, 6, 9, 7, 8]], ["ann_reduce", "an", ["none", "unroll"]], ["ann_spatial", "an", ["unroll", "unroll", "vec"]]]}, "result": [[0.0023916874], 0, 2.9688210487365723, 1596768833.4965172], "version": 0.2, "tvm_version": "0.7.dev1"}
{"input": ["opencl -keys=mali,opencl,gpu -device=mali -max_num_threads=256", "depthwise_conv2d_nchw.mali", [["TENSOR", [1, 256, 28, 28], "float16"], ["TENSOR", [256, 1, 3, 3], "float16"], [2, 2], [1, 1, 1, 1], [1, 1], "float16"], {}], "config": {"index": 12470, "code_hash": null, "entity": [["tile_c", "sp", [-1, 32, 1]], ["tile_y", "sp", [-1, 2, 7]], ["tile_x", "sp", [-1, 14, 1]], ["ann_spatial", "an", ["none", "unroll", "none"]]]}, "result": [[0.00039500000000000006], 0, 5.922688961029053, 1596771272.9659688], "version": 0.2, "tvm_version": "0.7.dev1"}
{"input": ["opencl -keys=mali,opencl,gpu -device=mali -max_num_threads=256", "conv2d_nchw_spatial_pack.mali", [["TENSOR", [1, 256, 14, 14], "float16"], ["TENSOR", [512, 256, 1, 1], "float16"], [1, 1], [0, 0, 0, 0], [1, 1], "float16"], {}], "config": {"index": 488650, "code_hash": null, "entity": [["tile_co", "sp", [-1, 8, 8]], ["tile_oh", "sp", [-1, 2, 1]], ["tile_ow", "sp", [-1, 1, 7]], ["reorder_0", "re", [0, 1, 2, 3, 4, 5, 6, 9, 7, 8]], ["ann_reduce", "an", ["unroll", "none"]], ["ann_spatial", "an", ["unroll", "unroll", "vec"]]]}, "result": [[0.0011586042], 0, 1.7419822216033936, 1596731818.176623], "version": 0.2, "tvm_version": "0.7.dev1"}
{"input": ["opencl -keys=mali,opencl,gpu -device=mali -max_num_threads=256", "depthwise_conv2d_nchw.mali", [["TENSOR", [1, 512, 14, 14], "float16"], ["TENSOR", [512, 1, 3, 3], "float16"], [1, 1], [1, 1, 1, 1], [1, 1], "float16"], {}], "config": {"index": 42034, "code_hash": null, "entity": [["tile_c", "sp", [-1, 16, 2]], ["tile_y", "sp", [-1, 1, 14]], ["tile_x", "sp", [-1, 14, 1]], ["ann_spatial", "an", ["unroll", "none", "unroll"]]]}, "result": [[0.0003443334], 0, 7.470959901809692, 1596732809.485651], "version": 0.2, "tvm_version": "0.7.dev1"}
{"input": ["opencl -keys=mali,opencl,gpu -device=mali -max_num_threads=256", "conv2d_nchw_spatial_pack.mali", [["TENSOR", [1, 512, 14, 14], "float16"], ["TENSOR", [512, 512, 1, 1], "float16"], [1, 1], [0, 0, 0, 0], [1, 1], "float16"], {}], "config": {"index": 194628, "code_hash": null, "entity": [["tile_co", "sp", [-1, 16, 16]], ["tile_oh", "sp", [-1, 2, 1]], ["tile_ow", "sp", [-1, 1, 7]], ["reorder_0", "re", [0, 1, 2, 3, 4, 5, 6, 9, 7, 8]], ["ann_reduce", "an", ["none", "unroll"]], ["ann_spatial", "an", ["none", "unroll", "vec"]]]}, "result": [[0.0020475626], 0, 0.7037487030029297, 1596733133.260372], "version": 0.2, "tvm_version": "0.7.dev1"}
{"input": ["opencl -keys=mali,opencl,gpu -device=mali -max_num_threads=256", "depthwise_conv2d_nchw.mali", [["TENSOR", [1, 512, 14, 14], "float16"], ["TENSOR", [512, 1, 3, 3], "float16"], [2, 2], [1, 1, 1, 1], [1, 1], "float16"], {}], "config": {"index": 4792, "code_hash": null, "entity": [["tile_c", "sp", [-1, 128, 1]], ["tile_y", "sp", [-1, 1, 1]], ["tile_x", "sp", [-1, 1, 7]], ["ann_spatial", "an", ["unroll", "none", "unroll"]]]}, "result": [[0.0003031354], 0, 6.259196043014526, 1596735247.00106], "version": 0.2, "tvm_version": "0.7.dev1"}
{"input": ["opencl -keys=mali,opencl,gpu -device=mali -max_num_threads=256", "conv2d_nchw_spatial_pack.mali", [["TENSOR", [1, 512, 7, 7], "float16"], ["TENSOR", [1024, 512, 1, 1], "float16"], [1, 1], [0, 0, 0, 0], [1, 1], "float16"], {}], "config": {"index": 65177, "code_hash": null, "entity": [["tile_co", "sp", [-1, 32, 8]], ["tile_oh", "sp", [-1, 1, 1]], ["tile_ow", "sp", [-1, 1, 7]], ["reorder_0", "re", [0, 1, 2, 3, 4, 5, 6, 9, 7, 8]], ["ann_reduce", "an", ["unroll", "none"]], ["ann_spatial", "an", ["unroll", "unroll", "vec"]]]}, "result": [[0.0015180104], 0, 2.10758113861084, 1596735351.209864], "version": 0.2, "tvm_version": "0.7.dev1"}
{"input": ["opencl -keys=mali,opencl,gpu -device=mali -max_num_threads=256", "depthwise_conv2d_nchw.mali", [["TENSOR", [1, 1024, 7, 7], "float16"], ["TENSOR", [1024, 1, 3, 3], "float16"], [1, 1], [1, 1, 1, 1], [1, 1], "float16"], {}], "config": {"index": 2711, "code_hash": null, "entity": [["tile_c", "sp", [-1, 32, 1]], ["tile_y", "sp", [-1, 1, 7]], ["tile_x", "sp", [-1, 7, 1]], ["ann_spatial", "an", ["none", "unroll", "unroll"]]]}, "result": [[0.0002617604], 0, 3.927006721496582, 1596736320.075789], "version": 0.2, "tvm_version": "0.7.dev1"}
{"input": ["opencl -keys=mali,opencl,gpu -device=mali -max_num_threads=256", "conv2d_nchw_spatial_pack.mali", [["TENSOR", [1, 1024, 7, 7], "float16"], ["TENSOR", [1024, 1024, 1, 1], "float16"], [1, 1], [0, 0, 0, 0], [1, 1], "float16"], {}], "config": {"index": 24785, "code_hash": null, "entity": [["tile_co", "sp", [-1, 32, 8]], ["tile_oh", "sp", [-1, 1, 1]], ["tile_ow", "sp", [-1, 1, 7]], ["reorder_0", "re", [0, 1, 2, 3, 4, 5, 6, 9, 7, 8]], ["ann_reduce", "an", ["none", "none"]], ["ann_spatial", "an", ["none", "unroll", "vec"]]]}, "result": [[0.0023934688], 0, 5.534005880355835, 1596736895.031174], "version": 0.2, "tvm_version": "0.7.dev1"}
{"input": ["opencl -keys=mali,opencl,gpu -device=mali -max_num_threads=256", "dense.mali", [["TENSOR", [1, 1024], "float16"], ["TENSOR", [1000, 1024], "float16"], null, "float16"], {}], "config": {"index": 309, "code_hash": null, "entity": [["tile_y", "sp", [-1, 1, 1]], ["tile_x", "sp", [-1, 50, 1]], ["c_unroll", "sp", [-1, 8]]]}, "result": [[0.0006960416], 0, 6.9248926639556885, 1596738050.791341], "version": 0.2, "tvm_version": "0.7.dev1"}
