logs/mobilenetv3-ssdlite.float32.autotvm.log
{"input": ["opencl -keys=mali,opencl,gpu -device=mali -max_num_threads=256", "conv2d_nchw_spatial_pack.mali", [["TENSOR", [1, 64, 1, 1], "float32"], ["TENSOR", [24, 64, 1, 1], "float32"], [1, 1], [0, 0, 0, 0], [1, 1], "float32"], {}], "config": {"index": 3512, "code_hash": null, "entity": [["tile_co", "sp", [-1, 3, 1]], ["tile_oh", "sp", [-1, 1, 1]], ["tile_ow", "sp", [-1, 1, 1]], ["reorder_0", "re", [0, 1, 2, 3, 4, 5, 6, 9, 7, 8]], ["ann_reduce", "an", ["unroll", "none"]], ["ann_spatial", "an", ["unroll", "vec", "none"]]]}, "result": [[0.000193198], 0, 1.9913179874420166, 1598847691.5673091], "version": 0.2, "tvm_version": "0.7.dev1"}
{"input": ["opencl -keys=mali,opencl,gpu -device=mali -max_num_threads=256", "conv2d_nchw_spatial_pack.mali", [["TENSOR", [1, 256, 2, 2], "float32"], ["TENSOR", [24, 256, 1, 1], "float32"], [1, 1], [0, 0, 0, 0], [1, 1], "float32"], {}], "config": {"index": 42728, "code_hash": null, "entity": [["tile_co", "sp", [-1, 1, 2]], ["tile_oh", "sp", [-1, 1, 2]], ["tile_ow", "sp", [-1, 1, 1]], ["reorder_0", "re", [0, 1, 2, 3, 4, 5, 6, 7, 8, 9]], ["ann_reduce", "an", ["unroll", "unroll"]], ["ann_spatial", "an", ["vec", "unroll", "unroll"]]]}, "result": [[0.00024678119999999997], 0, 1.9137721061706543, 1598848045.4749482], "version": 0.2, "tvm_version": "0.7.dev1"}
{"input": ["opencl -keys=mali,opencl,gpu -device=mali -max_num_threads=256", "conv2d_nchw_spatial_pack.mali", [["TENSOR", [1, 256, 3, 3], "float32"], ["TENSOR", [24, 256, 1, 1], "float32"], [1, 1], [0, 0, 0, 0], [1, 1], "float32"], {}], "config": {"index": 33330, "code_hash": null, "entity": [["tile_co", "sp", [-1, 1, 1]], ["tile_oh", "sp", [-1, 3, 1]], ["tile_ow", "sp", [-1, 3, 1]], ["reorder_0", "re", [0, 1, 2, 3, 4, 5, 6, 9, 7, 8]], ["ann_reduce", "an", ["none", "unroll"]], ["ann_spatial", "an", ["unroll", "vec", "unroll"]]]}, "result": [[0.0002352604], 0, 0.4436197280883789, 1598848831.875574], "version": 0.2, "tvm_version": "0.7.dev1"}
{"input": ["opencl -keys=mali,opencl,gpu -device=mali -max_num_threads=256", "conv2d_nchw_spatial_pack.mali", [["TENSOR", [1, 512, 5, 5], "float32"], ["TENSOR", [24, 512, 1, 1], "float32"], [1, 1], [0, 0, 0, 0], [1, 1], "float32"], {}], "config": {"index": 8107, "code_hash": null, "entity": [["tile_co", "sp", [-1, 24, 1]], ["tile_oh", "sp", [-1, 1, 1]], ["tile_ow", "sp", [-1, 1, 1]], ["reorder_0", "re", [0, 1, 2, 3, 4, 5, 6, 7, 8, 9]], ["ann_reduce", "an", ["unroll", "unroll"]], ["ann_spatial", "an", ["none", "unroll", "none"]]]}, "result": [[0.00043527080000000003], 0, 0.993187665939331, 1598849404.128093], "version": 0.2, "tvm_version": "0.7.dev1"}
{"input": ["opencl -keys=mali,opencl,gpu -device=mali -max_num_threads=256", "conv2d_nchw_spatial_pack.mali", [["TENSOR", [1, 1280, 10, 10], "float32"], ["TENSOR", [24, 1280, 1, 1], "float32"], [1, 1], [0, 0, 0, 0], [1, 1], "float32"], {}], "config": {"index": 254630, "code_hash": null, "entity": [["tile_co", "sp", [-1, 3, 4]], ["tile_oh", "sp", [-1, 1, 1]], ["tile_ow", "sp", [-1, 2, 5]], ["reorder_0", "re", [0, 1, 2, 3, 4, 5, 6, 7, 8, 9]], ["ann_reduce", "an", ["none", "none"]], ["ann_spatial", "an", ["unroll", "unroll", "vec"]]]}, "result": [[0.0012959582000000001], 0, 0.449354887008667, 1598850764.619071], "version": 0.2, "tvm_version": "0.7.dev1"}
{"input": ["opencl -keys=mali,opencl,gpu -device=mali -max_num_threads=256", "conv2d_nchw_spatial_pack.mali", [["TENSOR", [1, 288, 19, 19], "float32"], ["TENSOR", [24, 288, 1, 1], "float32"], [1, 1], [0, 0, 0, 0], [1, 1], "float32"], {}], "config": {"index": 11388, "code_hash": null, "entity": [["tile_co", "sp", [-1, 1, 4]], ["tile_oh", "sp", [-1, 19, 1]], ["tile_ow", "sp", [-1, 1, 1]], ["reorder_0", "re", [0, 1, 2, 3, 4, 5, 6, 7, 8, 9]], ["ann_reduce", "an", ["none", "unroll"]], ["ann_spatial", "an", ["none", "unroll", "vec"]]]}, "result": [[0.0017191562], 0, 3.1873509883880615, 1598851190.250249], "version": 0.2, "tvm_version": "0.7.dev1"}
{"input": ["opencl -keys=mali,opencl,gpu -device=mali -max_num_threads=256", "conv2d_nchw_spatial_pack.mali", [["TENSOR", [1, 256, 2, 2], "float32"], ["TENSOR", [64, 256, 1, 1], "float32"], [1, 1], [0, 0, 0, 0], [1, 1], "float32"], {}], "config": {"index": 8458, "code_hash": null, "entity": [["tile_co", "sp", [-1, 4, 1]], ["tile_oh", "sp", [-1, 1, 2]], ["tile_ow", "sp", [-1, 2, 1]], ["reorder_0", "re", [0, 1, 2, 3, 4, 5, 6, 9, 7, 8]], ["ann_reduce", "an", ["none", "none"]], ["ann_spatial", "an", ["none", "unroll", "unroll"]]]}, "result": [[0.0002641666], 0, 1.8052499294281006, 1598851786.125665], "version": 0.2, "tvm_version": "0.7.dev1"}
{"input": ["opencl -keys=mali,opencl,gpu -device=mali -max_num_threads=256", "depthwise_conv2d_nchw.mali", [["TENSOR", [1, 64, 2, 2], "float32"], ["TENSOR", [64, 1, 3, 3], "float32"], [2, 2], [1, 1, 1, 1], [1, 1], "float32"], {}], "config": {"index": 4, "code_hash": null, "entity": [["tile_c", "sp", [-1, 16, 1]], ["tile_y", "sp", [-1, 1, 1]], ["tile_x", "sp", [-1, 1, 1]], ["ann_spatial", "an", ["none", "none", "none"]]]}, "result": [[0.0001258126], 0, 3.9187448024749756, 1598852103.6874418], "version": 0.2, "tvm_version": "0.7.dev1"}
{"input": ["opencl -keys=mali,opencl,gpu -device=mali -max_num_threads=256", "conv2d_nchw_spatial_pack.mali", [["TENSOR", [1, 64, 1, 1], "float32"], ["TENSOR", [64, 64, 1, 1], "float32"], [1, 1], [0, 0, 0, 0], [1, 1], "float32"], {}], "config": {"index": 4383, "code_hash": null, "entity": [["tile_co", "sp", [-1, 4, 4]], ["tile_oh", "sp", [-1, 1, 1]], ["tile_ow", "sp", [-1, 1, 1]], ["reorder_0", "re", [0, 1, 2, 3, 4, 5, 6, 7, 8, 9]], ["ann_reduce", "an", ["unroll", "none"]], ["ann_spatial", "an", ["vec", "unroll", "unroll"]]]}, "result": [[0.000186302], 0, 4.132375717163086, 1598852463.962477], "version": 0.2, "tvm_version": "0.7.dev1"}
{"input": ["opencl -keys=mali,opencl,gpu -device=mali -max_num_threads=256", "conv2d_nchw_spatial_pack.mali", [["TENSOR", [1, 64, 1, 1], "float32"], ["TENSOR", [12, 64, 1, 1], "float32"], [1, 1], [0, 0, 0, 0], [1, 1], "float32"], {}], "config": {"index": 631, "code_hash": null, "entity": [["tile_co", "sp", [-1, 2, 1]], ["tile_oh", "sp", [-1, 1, 1]], ["tile_ow", "sp", [-1, 1, 1]], ["reorder_0", "re", [0, 1, 2, 3, 4, 5, 6, 9, 7, 8]], ["ann_reduce", "an", ["none", "unroll"]], ["ann_spatial", "an", ["none", "unroll", "unroll"]]]}, "result": [[0.0001991354], 0, 3.803534984588623, 1598852881.079568], "version": 0.2, "tvm_version": "0.7.dev1"}
{"input": ["opencl -keys=mali,opencl,gpu -device=mali -max_num_threads=256", "conv2d_nchw_spatial_pack.mali", [["TENSOR", [1, 256, 3, 3], "float32"], ["TENSOR", [128, 256, 1, 1], "float32"], [1, 1], [0, 0, 0, 0], [1, 1], "float32"], {}], "config": {"index": 33824, "code_hash": null, "entity": [["tile_co", "sp", [-1, 32, 4]], ["tile_oh", "sp", [-1, 1, 1]], ["tile_ow", "sp", [-1, 3, 1]], ["reorder_0", "re", [0, 1, 2, 3, 4, 5, 6, 7, 8, 9]], ["ann_reduce", "an", ["none", "none"]], ["ann_spatial", "an", ["unroll", "unroll", "vec"]]]}, "result": [[0.00028407279999999996], 0, 2.934155225753784, 1598853180.895421], "version": 0.2, "tvm_version": "0.7.dev1"}
{"input": ["opencl -keys=mali,opencl,gpu -device=mali -max_num_threads=256", "depthwise_conv2d_nchw.mali", [["TENSOR", [1, 128, 3, 3], "float32"], ["TENSOR", [128, 1, 3, 3], "float32"], [2, 2], [1, 1, 1, 1], [1, 1], "float32"], {}], "config": {"index": 4288, "code_hash": null, "entity": [["tile_c", "sp", [-1, 16, 1]], ["tile_y", "sp", [-1, 1, 2]], ["tile_x", "sp", [-1, 1, 1]], ["ann_spatial", "an", ["unroll", "unroll", "vec"]]]}, "result": [[0.0001196978], 0, 0.6401798725128174, 1598853798.8308852], "version": 0.2, "tvm_version": "0.7.dev1"}
{"input": ["opencl -keys=mali,opencl,gpu -device=mali -max_num_threads=256", "conv2d_nchw_spatial_pack.mali", [["TENSOR", [1, 128, 2, 2], "float32"], ["TENSOR", [256, 128, 1, 1], "float32"], [1, 1], [0, 0, 0, 0], [1, 1], "float32"], {}], "config": {"index": 13143, "code_hash": null, "entity": [["tile_co", "sp", [-1, 8, 1]], ["tile_oh", "sp", [-1, 2, 1]], ["tile_ow", "sp", [-1, 2, 1]], ["reorder_0", "re", [0, 1, 2, 3, 4, 5, 6, 7, 8, 9]], ["ann_reduce", "an", ["none", "none"]], ["ann_spatial", "an", ["none", "unroll", "unroll"]]]}, "result": [[0.00023087500000000001], 0, 4.218459129333496, 1598854220.166085], "version": 0.2, "tvm_version": "0.7.dev1"}
{"input": ["opencl -keys=mali,opencl,gpu -device=mali -max_num_threads=256", "depthwise_conv2d_nchw.mali", [["TENSOR", [1, 256, 2, 2], "float32"], ["TENSOR", [256, 1, 3, 3], "float32"], [1, 1], [1, 1, 1, 1], [1, 1], "float32"], {}], "config": {"index": 7272, "code_hash": null, "entity": [["tile_c", "sp", [-1, 8, 8]], ["tile_y", "sp", [-1, 1, 2]], ["tile_x", "sp", [-1, 1, 2]], ["ann_spatial", "an", ["vec", "none", "unroll"]]]}, "result": [[0.0001186666], 0, 0.5457897186279297, 1598854660.861436], "version": 0.2, "tvm_version": "0.7.dev1"}
{"input": ["opencl -keys=mali,opencl,gpu -device=mali -max_num_threads=256", "conv2d_nchw_spatial_pack.mali", [["TENSOR", [1, 256, 2, 2], "float32"], ["TENSOR", [12, 256, 1, 1], "float32"], [1, 1], [0, 0, 0, 0], [1, 1], "float32"], {}], "config": {"index": 21226, "code_hash": null, "entity": [["tile_co", "sp", [-1, 6, 1]], ["tile_oh", "sp", [-1, 1, 1]], ["tile_ow", "sp", [-1, 1, 1]], ["reorder_0", "re", [0, 1, 2, 3, 4, 5, 6, 9, 7, 8]], ["ann_reduce", "an", ["none", "unroll"]], ["ann_spatial", "an", ["vec", "none", "none"]]]}, "result": [[0.00023157299999999997], 0, 2.5816917419433594, 1598855339.3141499], "version": 0.2, "tvm_version": "0.7.dev1"}
{"input": ["opencl -keys=mali,opencl,gpu -device=mali -max_num_threads=256", "conv2d_nchw_spatial_pack.mali", [["TENSOR", [1, 512, 5, 5], "float32"], ["TENSOR", [128, 512, 1, 1], "float32"], [1, 1], [0, 0, 0, 0], [1, 1], "float32"], {}], "config": {"index": 35731, "code_hash": null, "entity": [["tile_co", "sp", [-1, 16, 4]], ["tile_oh", "sp", [-1, 1, 5]], ["tile_ow", "sp", [-1, 1, 1]], ["reorder_0", "re", [0, 1, 2, 3, 4, 5, 6, 7, 8, 9]], ["ann_reduce", "an", ["unroll", "unroll"]], ["ann_spatial", "an", ["unroll", "unroll", "vec"]]]}, "result": [[0.00037865619999999996], 0, 2.7050178050994873, 1598855978.50418], "version": 0.2, "tvm_version": "0.7.dev1"}
{"input": ["opencl -keys=mali,opencl,gpu -device=mali -max_num_threads=256", "depthwise_conv2d_nchw.mali", [["TENSOR", [1, 128, 5, 5], "float32"], ["TENSOR", [128, 1, 3, 3], "float32"], [2, 2], [1, 1, 1, 1], [1, 1], "float32"], {}], "config": {"index": 5873, "code_hash": null, "entity": [["tile_c", "sp", [-1, 32, 1]], ["tile_y", "sp", [-1, 3, 1]], ["tile_x", "sp", [-1, 1, 1]], ["ann_spatial", "an", ["vec", "unroll", "none"]]]}, "result": [[0.0001464688], 0, 0.6338491439819336, 1598856359.5756521], "version": 0.2, "tvm_version": "0.7.dev1"}
{"input": ["opencl -keys=mali,opencl,gpu -device=mali -max_num_threads=256", "conv2d_nchw_spatial_pack.mali", [["TENSOR", [1, 128, 3, 3], "float32"], ["TENSOR", [256, 128, 1, 1], "float32"], [1, 1], [0, 0, 0, 0], [1, 1], "float32"], {}], "config": {"index": 33268, "code_hash": null, "entity": [["tile_co", "sp", [-1, 16, 2]], ["tile_oh", "sp", [-1, 3, 1]], ["tile_ow", "sp", [-1, 1, 1]], ["reorder_0", "re", [0, 1, 2, 3, 4, 5, 6, 7, 8, 9]], ["ann_reduce", "an", ["none", "unroll"]], ["ann_spatial", "an", ["unroll", "none", "vec"]]]}, "result": [[0.0001906666], 0, 3.319232702255249, 1598857165.2404149], "version": 0.2, "tvm_version": "0.7.dev1"}
{"input": ["opencl -keys=mali,opencl,gpu -device=mali -max_num_threads=256", "depthwise_conv2d_nchw.mali", [["TENSOR", [1, 256, 3, 3], "float32"], ["TENSOR", [256, 1, 3, 3], "float32"], [1, 1], [1, 1, 1, 1], [1, 1], "float32"], {}], "config": {"index": 3982, "code_hash": null, "entity": [["tile_c", "sp", [-1, 32, 4]], ["tile_y", "sp", [-1, 3, 1]], ["tile_x", "sp", [-1, 1, 3]], ["ann_spatial", "an", ["unroll", "none", "unroll"]]]}, "result": [[9.9823e-05], 0, 0.9558520317077637, 1598857429.082658], "version": 0.2, "tvm_version": "0.7.dev1"}
{"input": ["opencl -keys=mali,opencl,gpu -device=mali -max_num_threads=256", "conv2d_nchw_spatial_pack.mali", [["TENSOR", [1, 256, 3, 3], "float32"], ["TENSOR", [12, 256, 1, 1], "float32"], [1, 1], [0, 0, 0, 0], [1, 1], "float32"], {}], "config": {"index": 4215, "code_hash": null, "entity": [["tile_co", "sp", [-1, 4, 1]], ["tile_oh", "sp", [-1, 1, 1]], ["tile_ow", "sp", [-1, 1, 1]], ["reorder_0", "re", [0, 1, 2, 3, 4, 5, 6, 7, 8, 9]], ["ann_reduce", "an", ["none", "unroll"]], ["ann_spatial", "an", ["none", "unroll", "none"]]]}, "result": [[0.0002775106], 0, 2.4237639904022217, 1598857755.167708], "version": 0.2, "tvm_version": "0.7.dev1"}
{"input": ["opencl -keys=mali,opencl,gpu -device=mali -max_num_threads=256", "conv2d_nchw_spatial_pack.mali", [["TENSOR", [1, 1280, 10, 10], "float32"], ["TENSOR", [256, 1280, 1, 1], "float32"], [1, 1], [0, 0, 0, 0], [1, 1], "float32"], {}], "config": {"index": 403862, "code_hash": null, "entity": [["tile_co", "sp", [-1, 4, 16]], ["tile_oh", "sp", [-1, 2, 1]], ["tile_ow", "sp", [-1, 2, 5]], ["reorder_0", "re", [0, 1, 2, 3, 4, 5, 6, 7, 8, 9]], ["ann_reduce", "an", ["unroll", "unroll"]], ["ann_spatial", "an", ["unroll", "unroll", "vec"]]]}, "result": [[0.0020048854000000002], 0, 4.869538307189941, 1598858780.7881532], "version": 0.2, "tvm_version": "0.7.dev1"}
{"input": ["opencl -keys=mali,opencl,gpu -device=mali -max_num_threads=256", "depthwise_conv2d_nchw.mali", [["TENSOR", [1, 256, 10, 10], "float32"], ["TENSOR", [256, 1, 3, 3], "float32"], [2, 2], [1, 1, 1, 1], [1, 1], "float32"], {}], "config": {"index": 7296, "code_hash": null, "entity": [["tile_c", "sp", [-1, 64, 1]], ["tile_y", "sp", [-1, 1, 1]], ["tile_x", "sp", [-1, 1, 1]], ["ann_spatial", "an", ["vec", "unroll", "none"]]]}, "result": [[0.0001665938], 0, 1.5037057399749756, 1598859601.42734], "version": 0.2, "tvm_version": "0.7.dev1"}
{"input": ["opencl -keys=mali,opencl,gpu -device=mali -max_num_threads=256", "conv2d_nchw_spatial_pack.mali", [["TENSOR", [1, 256, 5, 5], "float32"], ["TENSOR", [512, 256, 1, 1], "float32"], [1, 1], [0, 0, 0, 0], [1, 1], "float32"], {}], "config": {"index": 54865, "code_hash": null, "entity": [["tile_co", "sp", [-1, 8, 8]], ["tile_oh", "sp", [-1, 5, 1]], ["tile_ow", "sp", [-1, 1, 5]], ["reorder_0", "re", [0, 1, 2, 3, 4, 5, 6, 7, 8, 9]], ["ann_reduce", "an", ["unroll", "unroll"]], ["ann_spatial", "an", ["unroll", "unroll", "vec"]]]}, "result": [[0.0004626876], 0, 2.7332470417022705, 1598860045.897654], "version": 0.2, "tvm_version": "0.7.dev1"}
{"input": ["opencl -keys=mali,opencl,gpu -device=mali -max_num_threads=256", "depthwise_conv2d_nchw.mali", [["TENSOR", [1, 512, 5, 5], "float32"], ["TENSOR", [512, 1, 3, 3], "float32"], [1, 1], [1, 1, 1, 1], [1, 1], "float32"], {}], "config": {"index": 7102, "code_hash": null, "entity": [["tile_c", "sp", [-1, 128, 1]], ["tile_y", "sp", [-1, 1, 1]], ["tile_x", "sp", [-1, 5, 1]], ["ann_spatial", "an", ["unroll", "vec", "none"]]]}, "result": [[0.000172948], 0, 1.8410730361938477, 1598860660.70173], "version": 0.2, "tvm_version": "0.7.dev1"}
{"input": ["opencl -keys=mali,opencl,gpu -device=mali -max_num_threads=256", "conv2d_nchw_spatial_pack.mali", [["TENSOR", [1, 512, 5, 5], "float32"], ["TENSOR", [12, 512, 1, 1], "float32"], [1, 1], [0, 0, 0, 0], [1, 1], "float32"], {}], "config": {"index": 22699, "code_hash": null, "entity": [["tile_co", "sp", [-1, 2, 1]], ["tile_oh", "sp", [-1, 5, 1]], ["tile_ow", "sp", [-1, 1, 1]], ["reorder_0", "re", [0, 1, 2, 3, 4, 5, 6, 7, 8, 9]], ["ann_reduce", "an", ["unroll", "none"]], ["ann_spatial", "an", ["vec", "none", "unroll"]]]}, "result": [[0.0003771458], 0, 1.4266502857208252, 1598861367.2074199], "version": 0.2, "tvm_version": "0.7.dev1"}
{"input": ["opencl -keys=mali,opencl,gpu -device=mali -max_num_threads=256", "depthwise_conv2d_nchw.mali", [["TENSOR", [1, 576, 10, 10], "float32"], ["TENSOR", [576, 1, 5, 5], "float32"], [1, 1], [2, 2, 2, 2], [1, 1], "float32"], {}], "config": {"index": 60325, "code_hash": null, "entity": [["tile_c", "sp", [-1, 48, 1]], ["tile_y", "sp", [-1, 1, 10]], ["tile_x", "sp", [-1, 10, 1]], ["ann_spatial", "an", ["none", "unroll", "unroll"]]]}, "result": [[0.0002909062], 0, 2.5651638507843018, 1598862001.663862], "version": 0.2, "tvm_version": "0.7.dev1"}
{"input": ["opencl -keys=mali,opencl,gpu -device=mali -max_num_threads=256", "depthwise_conv2d_nchw.mali", [["TENSOR", [1, 288, 19, 19], "float32"], ["TENSOR", [288, 1, 5, 5], "float32"], [2, 2], [2, 2, 2, 2], [1, 1], "float32"], {}], "config": {"index": 136972, "code_hash": null, "entity": [["tile_c", "sp", [-1, 24, 1]], ["tile_y", "sp", [-1, 2, 5]], ["tile_x", "sp", [-1, 10, 1]], ["ann_spatial", "an", ["unroll", "unroll", "vec"]]]}, "result": [[0.0003900834], 0, 3.271907091140747, 1598863577.629921], "version": 0.2, "tvm_version": "0.7.dev1"}
{"input": ["opencl -keys=mali,opencl,gpu -device=mali -max_num_threads=256", "dense.mali", [["TENSOR", [1, 288], "float32"], ["TENSOR", [72, 288], "float32"], null, "float32"], {}], "config": {"index": 664, "code_hash": null, "entity": [["tile_y", "sp", [-1, 1, 1]], ["tile_x", "sp", [-1, 6, 1]], ["c_unroll", "sp", [-1, 32]]]}, "result": [[0.0001072812], 0, 3.808816909790039, 1598863894.935183], "version": 0.2, "tvm_version": "0.7.dev1"}
{"input": ["opencl -keys=mali,opencl,gpu -device=mali -max_num_threads=256", "dense.mali", [["TENSOR", [1, 72], "float32"], ["TENSOR", [288, 72], "float32"], null, "float32"], {}], "config": {"index": 921, "code_hash": null, "entity": [["tile_y", "sp", [-1, 1, 1]], ["tile_x", "sp", [-1, 12, 3]], ["c_unroll", "sp", [-1, 12]]]}, "result": [[8.08022e-05], 0, 2.884002923965454, 1598864092.822477], "version": 0.2, "tvm_version": "0.7.dev1"}
{"input": ["opencl -keys=mali,opencl,gpu -device=mali -max_num_threads=256", "conv2d_nchw_spatial_pack.mali", [["TENSOR", [1, 288, 10, 10], "float32"], ["TENSOR", [96, 288, 1, 1], "float32"], [1, 1], [0, 0, 0, 0], [1, 1], "float32"], {}], "config": {"index": 238311, "code_hash": null, "entity": [["tile_co", "sp", [-1, 6, 8]], ["tile_oh", "sp", [-1, 5, 1]], ["tile_ow", "sp", [-1, 1, 5]], ["reorder_0", "re", [0, 1, 2, 3, 4, 5, 6, 7, 8, 9]], ["ann_reduce", "an", ["unroll", "unroll"]], ["ann_spatial", "an", ["none", "unroll", "vec"]]]}, "result": [[0.00046593759999999997], 0, 1.6538605690002441, 1598866038.402336], "version": 0.2, "tvm_version": "0.7.dev1"}
{"input": ["opencl -keys=mali,opencl,gpu -device=mali -max_num_threads=256", "conv2d_nchw_spatial_pack.mali", [["TENSOR", [1, 576, 10, 10], "float32"], ["TENSOR", [96, 576, 1, 1], "float32"], [1, 1], [0, 0, 0, 0], [1, 1], "float32"], {}], "config": {"index": 218391, "code_hash": null, "entity": [["tile_co", "sp", [-1, 8, 4]], ["tile_oh", "sp", [-1, 2, 1]], ["tile_ow", "sp", [-1, 2, 5]], ["reorder_0", "re", [0, 1, 2, 3, 4, 5, 6, 7, 8, 9]], ["ann_reduce", "an", ["none", "unroll"]], ["ann_spatial", "an", ["none", "unroll", "vec"]]]}, "result": [[0.0008228542], 0, 2.5382070541381836, 1598867259.324065], "version": 0.2, "tvm_version": "0.7.dev1"}
{"input": ["opencl -keys=mali,opencl,gpu -device=mali -max_num_threads=256", "conv2d_nchw_spatial_pack.mali", [["TENSOR", [1, 96, 10, 10], "float32"], ["TENSOR", [576, 96, 1, 1], "float32"], [1, 1], [0, 0, 0, 0], [1, 1], "float32"], {}], "config": {"index": 1507581, "code_hash": null, "entity": [["tile_co", "sp", [-1, 36, 16]], ["tile_oh", "sp", [-1, 1, 1]], ["tile_ow", "sp", [-1, 2, 5]], ["reorder_0", "re", [0, 1, 2, 3, 4, 5, 6, 7, 8, 9]], ["ann_reduce", "an", ["unroll", "unroll"]], ["ann_spatial", "an", ["unroll", "unroll", "vec"]]]}, "result": [[0.00039391679999999996], 0, 3.6244518756866455, 1598869724.7082958], "version": 0.2, "tvm_version": "0.7.dev1"}
{"input": ["opencl -keys=mali,opencl,gpu -device=mali -max_num_threads=256", "dense.mali", [["TENSOR", [1, 576], "float32"], ["TENSOR", [144, 576], "float32"], null, "float32"], {}], "config": {"index": 905, "code_hash": null, "entity": [["tile_y", "sp", [-1, 1, 1]], ["tile_x", "sp", [-1, 8, 1]], ["c_unroll", "sp", [-1, 24]]]}, "result": [[0.000142698], 0, 2.9509239196777344, 1598870881.285692], "version": 0.2, "tvm_version": "0.7.dev1"}
{"input": ["opencl -keys=mali,opencl,gpu -device=mali -max_num_threads=256", "dense.mali", [["TENSOR", [1, 144], "float32"], ["TENSOR", [576, 144], "float32"], null, "float32"], {}], "config": {"index": 1206, "code_hash": null, "entity": [["tile_y", "sp", [-1, 1, 1]], ["tile_x", "sp", [-1, 18, 2]], ["c_unroll", "sp", [-1, 12]]]}, "result": [[0.0001009168], 0, 2.933880090713501, 1598871446.460557], "version": 0.2, "tvm_version": "0.7.dev1"}
{"input": ["opencl -keys=mali,opencl,gpu -device=mali -max_num_threads=256", "conv2d_nchw_spatial_pack.mali", [["TENSOR", [1, 576, 10, 10], "float32"], ["TENSOR", [1280, 576, 1, 1], "float32"], [1, 1], [0, 0, 0, 0], [1, 1], "float32"], {}], "config": {"index": 1145807, "code_hash": null, "entity": [["tile_co", "sp", [-1, 10, 8]], ["tile_oh", "sp", [-1, 1, 1]], ["tile_ow", "sp", [-1, 2, 5]], ["reorder_0", "re", [0, 1, 2, 3, 4, 5, 6, 7, 8, 9]], ["ann_reduce", "an", ["none", "none"]], ["ann_spatial", "an", ["unroll", "unroll", "vec"]]]}, "result": [[0.0029289375999999997], 0, 0.6508800983428955, 1598872224.267231], "version": 0.2, "tvm_version": "0.7.dev1"}
{"input": ["opencl -keys=mali,opencl,gpu -device=mali -max_num_threads=256", "depthwise_conv2d_nchw.mali", [["TENSOR", [1, 1280, 10, 10], "float32"], ["TENSOR", [1280, 1, 3, 3], "float32"], [1, 1], [1, 1, 1, 1], [1, 1], "float32"], {}], "config": {"index": 139736, "code_hash": null, "entity": [["tile_c", "sp", [-1, 80, 1]], ["tile_y", "sp", [-1, 1, 1]], ["tile_x", "sp", [-1, 2, 5]], ["ann_spatial", "an", ["unroll", "unroll", "unroll"]]]}, "result": [[0.00043013540000000003], 0, 2.7661566734313965, 1598873557.894799], "version": 0.2, "tvm_version": "0.7.dev1"}
{"input": ["opencl -keys=mali,opencl,gpu -device=mali -max_num_threads=256", "conv2d_nchw_spatial_pack.mali", [["TENSOR", [1, 1280, 10, 10], "float32"], ["TENSOR", [12, 1280, 1, 1], "float32"], [1, 1], [0, 0, 0, 0], [1, 1], "float32"], {}], "config": {"index": 185570, "code_hash": null, "entity": [["tile_co", "sp", [-1, 3, 2]], ["tile_oh", "sp", [-1, 1, 2]], ["tile_ow", "sp", [-1, 5, 1]], ["reorder_0", "re", [0, 1, 2, 3, 4, 5, 6, 9, 7, 8]], ["ann_reduce", "an", ["unroll", "unroll"]], ["ann_spatial", "an", ["unroll", "vec", "unroll"]]]}, "result": [[0.001327948], 0, 2.0256738662719727, 1598874924.936231], "version": 0.2, "tvm_version": "0.7.dev1"}
{"input": ["opencl -keys=mali,opencl,gpu -device=mali -max_num_threads=256", "conv2d_nchw_spatial_pack.mali", [["TENSOR", [1, 48, 19, 19], "float32"], ["TENSOR", [144, 48, 1, 1], "float32"], [1, 1], [0, 0, 0, 0], [1, 1], "float32"], {}], "config": {"index": 16346, "code_hash": null, "entity": [["tile_co", "sp", [-1, 3, 8]], ["tile_oh", "sp", [-1, 19, 1]], ["tile_ow", "sp", [-1, 1, 1]], ["reorder_0", "re", [0, 1, 2, 3, 4, 5, 6, 7, 8, 9]], ["ann_reduce", "an", ["unroll", "none"]], ["ann_spatial", "an", ["none", "none", "vec"]]]}, "result": [[0.0005955938], 0, 1.5444629192352295, 1598876405.37638], "version": 0.2, "tvm_version": "0.7.dev1"}
{"input": ["opencl -keys=mali,opencl,gpu -device=mali -max_num_threads=256", "depthwise_conv2d_nchw.mali", [["TENSOR", [1, 144, 19, 19], "float32"], ["TENSOR", [144, 1, 5, 5], "float32"], [1, 1], [2, 2, 2, 2], [1, 1], "float32"], {}], "config": {"index": 7747, "code_hash": null, "entity": [["tile_c", "sp", [-1, 12, 1]], ["tile_y", "sp", [-1, 1, 19]], ["tile_x", "sp", [-1, 19, 1]], ["ann_spatial", "an", ["unroll", "none", "unroll"]]]}, "result": [[0.0003278438], 0, 3.509242296218872, 1598876776.432715], "version": 0.2, "tvm_version": "0.7.dev1"}
{"input": ["opencl -keys=mali,opencl,gpu -device=mali -max_num_threads=256", "dense.mali", [["TENSOR", [1, 144], "float32"], ["TENSOR", [36, 144], "float32"], null, "float32"], {}], "config": {"index": 433, "code_hash": null, "entity": [["tile_y", "sp", [-1, 1, 1]], ["tile_x", "sp", [-1, 2, 1]], ["c_unroll", "sp", [-1, 48]]]}, "result": [[9.162499999999999e-05], 0, 4.357553958892822, 1598877241.905547], "version": 0.2, "tvm_version": "0.7.dev1"}
{"input": ["opencl -keys=mali,opencl,gpu -device=mali -max_num_threads=256", "dense.mali", [["TENSOR", [1, 36], "float32"], ["TENSOR", [144, 36], "float32"], null, "float32"], {}], "config": {"index": 461, "code_hash": null, "entity": [["tile_y", "sp", [-1, 1, 1]], ["tile_x", "sp", [-1, 36, 1]], ["c_unroll", "sp", [-1, 9]]]}, "result": [[5.39896e-05], 0, 3.010659694671631, 1598877304.637702], "version": 0.2, "tvm_version": "0.7.dev1"}
{"input": ["opencl -keys=mali,opencl,gpu -device=mali -max_num_threads=256", "conv2d_nchw_spatial_pack.mali", [["TENSOR", [1, 40, 19, 19], "float32"], ["TENSOR", [240, 40, 1, 1], "float32"], [1, 1], [0, 0, 0, 0], [1, 1], "float32"], {}], "config": {"index": 28430, "code_hash": null, "entity": [["tile_co", "sp", [-1, 6, 8]], ["tile_oh", "sp", [-1, 1, 1]], ["tile_ow", "sp", [-1, 19, 1]], ["reorder_0", "re", [0, 1, 2, 3, 4, 5, 6, 9, 7, 8]], ["ann_reduce", "an", ["unroll", "unroll"]], ["ann_spatial", "an", ["none", "none", "vec"]]]}, "result": [[0.0006439376], 0, 3.3013787269592285, 1598878178.026578], "version": 0.2, "tvm_version": "0.7.dev1"}
{"input": ["opencl -keys=mali,opencl,gpu -device=mali -max_num_threads=256", "depthwise_conv2d_nchw.mali", [["TENSOR", [1, 240, 19, 19], "float32"], ["TENSOR", [240, 1, 5, 5], "float32"], [1, 1], [2, 2, 2, 2], [1, 1], "float32"], {}], "config": {"index": 10425, "code_hash": null, "entity": [["tile_c", "sp", [-1, 20, 2]], ["tile_y", "sp", [-1, 1, 19]], ["tile_x", "sp", [-1, 19, 1]], ["ann_spatial", "an", ["unroll", "none", "none"]]]}, "result": [[0.0004616562], 0, 1.9832096099853516, 1598878727.877472], "version": 0.2, "tvm_version": "0.7.dev1"}
{"input": ["opencl -keys=mali,opencl,gpu -device=mali -max_num_threads=256", "dense.mali", [["TENSOR", [1, 240], "float32"], ["TENSOR", [60, 240], "float32"], null, "float32"], {}], "config": {"index": 816, "code_hash": null, "entity": [["tile_y", "sp", [-1, 1, 1]], ["tile_x", "sp", [-1, 10, 1]], ["c_unroll", "sp", [-1, 48]]]}, "result": [[9.300000000000001e-05], 0, 1.0068809986114502, 1598879114.836332], "version": 0.2, "tvm_version": "0.7.dev1"}
{"input": ["opencl -keys=mali,opencl,gpu -device=mali -max_num_threads=256", "dense.mali", [["TENSOR", [1, 60], "float32"], ["TENSOR", [240, 60], "float32"], null, "float32"], {}], "config": {"index": 816, "code_hash": null, "entity": [["tile_y", "sp", [-1, 1, 1]], ["tile_x", "sp", [-1, 8, 1]], ["c_unroll", "sp", [-1, 10]]]}, "result": [[7.2125e-05], 0, 2.3811957836151123, 1598879466.040768], "version": 0.2, "tvm_version": "0.7.dev1"}
{"input": ["opencl -keys=mali,opencl,gpu -device=mali -max_num_threads=256", "conv2d_nchw_spatial_pack.mali", [["TENSOR", [1, 24, 38, 38], "float32"], ["TENSOR", [88, 24, 1, 1], "float32"], [1, 1], [0, 0, 0, 0], [1, 1], "float32"], {}], "config": {"index": 204257, "code_hash": null, "entity": [["tile_co", "sp", [-1, 22, 4]], ["tile_oh", "sp", [-1, 1, 2]], ["tile_ow", "sp", [-1, 1, 1]], ["reorder_0", "re", [0, 1, 2, 3, 4, 5, 6, 7, 8, 9]], ["ann_reduce", "an", ["unroll", "none"]], ["ann_spatial", "an", ["unroll", "none", "vec"]]]}, "result": [[0.0005918124000000001], 0, 1.933441162109375, 1598880665.486491], "version": 0.2, "tvm_version": "0.7.dev1"}
{"input": ["opencl -keys=mali,opencl,gpu -device=mali -max_num_threads=256", "depthwise_conv2d_nchw.mali", [["TENSOR", [1, 88, 38, 38], "float32"], ["TENSOR", [88, 1, 3, 3], "float32"], [1, 1], [1, 1, 1, 1], [1, 1], "float32"], {}], "config": {"index": 11201, "code_hash": null, "entity": [["tile_c", "sp", [-1, 11, 2]], ["tile_y", "sp", [-1, 1, 2]], ["tile_x", "sp", [-1, 19, 2]], ["ann_spatial", "an", ["none", "unroll", "unroll"]]]}, "result": [[0.0004424584], 0, 3.0894200801849365, 1598881445.653763], "version": 0.2, "tvm_version": "0.7.dev1"}
{"input": ["opencl -keys=mali,opencl,gpu -device=mali -max_num_threads=256", "conv2d_nchw_spatial_pack.mali", [["TENSOR", [1, 3, 300, 300], "float32"], ["TENSOR", [16, 3, 3, 3], "float32"], [2, 2], [1, 1, 1, 1], [1, 1], "float32"], {}], "config": {"index": 1858993, "code_hash": null, "entity": [["tile_co", "sp", [-1, 2, 8]], ["tile_oh", "sp", [-1, 3, 1]], ["tile_ow", "sp", [-1, 5, 5]], ["reorder_0", "re", [0, 1, 2, 3, 4, 5, 6, 7, 8, 9]], ["ann_reduce", "an", ["none", "unroll"]], ["ann_spatial", "an", ["none", "unroll", "vec"]]]}, "result": [[0.0024706249999999997], 0, 4.087788820266724, 1598882393.590855], "version": 0.2, "tvm_version": "0.7.dev1"}
{"input": ["opencl -keys=mali,opencl,gpu -device=mali -max_num_threads=256", "conv2d_nchw_spatial_pack.mali", [["TENSOR", [1, 16, 150, 150], "float32"], ["TENSOR", [16, 16, 1, 1], "float32"], [1, 1], [0, 0, 0, 0], [1, 1], "float32"], {}], "config": {"index": 4845448, "code_hash": null, "entity": [["tile_co", "sp", [-1, 2, 8]], ["tile_oh", "sp", [-1, 2, 1]], ["tile_ow", "sp", [-1, 10, 15]], ["reorder_0", "re", [0, 1, 2, 3, 4, 5, 6, 7, 8, 9]], ["ann_reduce", "an", ["unroll", "unroll"]], ["ann_spatial", "an", ["unroll", "unroll", "vec"]]]}, "result": [[0.0021198646], 0, 2.6717519760131836, 1598885278.304353], "version": 0.2, "tvm_version": "0.7.dev1"}
{"input": ["opencl -keys=mali,opencl,gpu -device=mali -max_num_threads=256", "depthwise_conv2d_nchw.mali", [["TENSOR", [1, 16, 150, 150], "float32"], ["TENSOR", [16, 1, 3, 3], "float32"], [2, 2], [1, 1, 1, 1], [1, 1], "float32"], {}], "config": {"index": 83794, "code_hash": null, "entity": [["tile_c", "sp", [-1, 16, 1]], ["tile_y", "sp", [-1, 1, 3]], ["tile_x", "sp", [-1, 25, 1]], ["ann_spatial", "an", ["vec", "none", "unroll"]]]}, "result": [[0.0006246458], 0, 0.7646198272705078, 1598885961.922307], "version": 0.2, "tvm_version": "0.7.dev1"}
{"input": ["opencl -keys=mali,opencl,gpu -device=mali -max_num_threads=256", "dense.mali", [["TENSOR", [1, 16], "float32"], ["TENSOR", [4, 16], "float32"], null, "float32"], {}], "config": {"index": 28, "code_hash": null, "entity": [["tile_y", "sp", [-1, 1, 1]], ["tile_x", "sp", [-1, 2, 2]], ["c_unroll", "sp", [-1, 16]]]}, "result": [[8.75624e-05], 0, 1.480912685394287, 1598886287.2583869], "version": 0.2, "tvm_version": "0.7.dev1"}
{"input": ["opencl -keys=mali,opencl,gpu -device=mali -max_num_threads=256", "dense.mali", [["TENSOR", [1, 4], "float32"], ["TENSOR", [16, 4], "float32"], null, "float32"], {}], "config": {"index": 6, "code_hash": null, "entity": [["tile_y", "sp", [-1, 1, 1]], ["tile_x", "sp", [-1, 2, 2]], ["c_unroll", "sp", [-1, 1]]]}, "result": [[9.31458e-05], 0, 1.030709981918335, 1598886335.800709], "version": 0.2, "tvm_version": "0.7.dev1"}
{"input": ["opencl -keys=mali,opencl,gpu -device=mali -max_num_threads=256", "conv2d_nchw_spatial_pack.mali", [["TENSOR", [1, 16, 75, 75], "float32"], ["TENSOR", [16, 16, 1, 1], "float32"], [1, 1], [0, 0, 0, 0], [1, 1], "float32"], {}], "config": {"index": 535558, "code_hash": null, "entity": [["tile_co", "sp", [-1, 2, 8]], ["tile_oh", "sp", [-1, 1, 5]], ["tile_ow", "sp", [-1, 15, 1]], ["reorder_0", "re", [0, 1, 2, 3, 4, 5, 6, 7, 8, 9]], ["ann_reduce", "an", ["unroll", "unroll"]], ["ann_spatial", "an", ["unroll", "unroll", "vec"]]]}, "result": [[0.000689552], 0, 1.5075111389160156, 1598887932.9442859], "version": 0.2, "tvm_version": "0.7.dev1"}
{"input": ["opencl -keys=mali,opencl,gpu -device=mali -max_num_threads=256", "conv2d_nchw_spatial_pack.mali", [["TENSOR", [1, 16, 75, 75], "float32"], ["TENSOR", [72, 16, 1, 1], "float32"], [1, 1], [0, 0, 0, 0], [1, 1], "float32"], {}], "config": {"index": 2106103, "code_hash": null, "entity": [["tile_co", "sp", [-1, 9, 8]], ["tile_oh", "sp", [-1, 3, 1]], ["tile_ow", "sp", [-1, 1, 3]], ["reorder_0", "re", [0, 1, 2, 3, 4, 5, 6, 7, 8, 9]], ["ann_reduce", "an", ["unroll", "none"]], ["ann_spatial", "an", ["unroll", "unroll", "vec"]]]}, "result": [[0.0011135728], 0, 2.855816602706909, 1598888465.519219], "version": 0.2, "tvm_version": "0.7.dev1"}
{"input": ["opencl -keys=mali,opencl,gpu -device=mali -max_num_threads=256", "depthwise_conv2d_nchw.mali", [["TENSOR", [1, 72, 75, 75], "float32"], ["TENSOR", [72, 1, 3, 3], "float32"], [2, 2], [1, 1, 1, 1], [1, 1], "float32"], {}], "config": {"index": 93680, "code_hash": null, "entity": [["tile_c", "sp", [-1, 36, 2]], ["tile_y", "sp", [-1, 1, 2]], ["tile_x", "sp", [-1, 19, 1]], ["ann_spatial", "an", ["vec", "unroll", "unroll"]]]}, "result": [[0.0006696146], 0, 3.9659738540649414, 1598891008.281466], "version": 0.2, "tvm_version": "0.7.dev1"}
{"input": ["opencl -keys=mali,opencl,gpu -device=mali -max_num_threads=256", "conv2d_nchw_spatial_pack.mali", [["TENSOR", [1, 72, 38, 38], "float32"], ["TENSOR", [24, 72, 1, 1], "float32"], [1, 1], [0, 0, 0, 0], [1, 1], "float32"], {}], "config": {"index": 302813, "code_hash": null, "entity": [["tile_co", "sp", [-1, 2, 6]], ["tile_oh", "sp", [-1, 1, 2]], ["tile_ow", "sp", [-1, 19, 2]], ["reorder_0", "re", [0, 1, 2, 3, 4, 5, 6, 7, 8, 9]], ["ann_reduce", "an", ["unroll", "none"]], ["ann_spatial", "an", ["unroll", "vec", "unroll"]]]}, "result": [[0.0008399166], 0, 2.5500669479370117, 1598891709.6554828], "version": 0.2, "tvm_version": "0.7.dev1"}
{"input": ["opencl -keys=mali,opencl,gpu -device=mali -max_num_threads=256", "conv2d_nchw_spatial_pack.mali", [["TENSOR", [1, 88, 38, 38], "float32"], ["TENSOR", [24, 88, 1, 1], "float32"], [1, 1], [0, 0, 0, 0], [1, 1], "float32"], {}], "config": {"index": 300146, "code_hash": null, "entity": [["tile_co", "sp", [-1, 3, 8]], ["tile_oh", "sp", [-1, 19, 2]], ["tile_ow", "sp", [-1, 1, 2]], ["reorder_0", "re", [0, 1, 2, 3, 4, 5, 6, 9, 7, 8]], ["ann_reduce", "an", ["none", "unroll"]], ["ann_spatial", "an", ["unroll", "vec", "unroll"]]]}, "result": [[0.00100325], 0, 1.5289690494537354, 1598893586.540641], "version": 0.2, "tvm_version": "0.7.dev1"}
{"input": ["opencl -keys=mali,opencl,gpu -device=mali -max_num_threads=256", "conv2d_nchw_spatial_pack.mali", [["TENSOR", [1, 24, 38, 38], "float32"], ["TENSOR", [96, 24, 1, 1], "float32"], [1, 1], [0, 0, 0, 0], [1, 1], "float32"], {}], "config": {"index": 538180, "code_hash": null, "entity": [["tile_co", "sp", [-1, 12, 4]], ["tile_oh", "sp", [-1, 2, 1]], ["tile_ow", "sp", [-1, 1, 2]], ["reorder_0", "re", [0, 1, 2, 3, 4, 5, 6, 9, 7, 8]], ["ann_reduce", "an", ["none", "none"]], ["ann_spatial", "an", ["unroll", "unroll", "vec"]]]}, "result": [[0.0006571354], 0, 1.1566529273986816, 1598896225.678333], "version": 0.2, "tvm_version": "0.7.dev1"}
{"input": ["opencl -keys=mali,opencl,gpu -device=mali -max_num_threads=256", "depthwise_conv2d_nchw.mali", [["TENSOR", [1, 96, 38, 38], "float32"], ["TENSOR", [96, 1, 5, 5], "float32"], [2, 2], [2, 2, 2, 2], [1, 1], "float32"], {}], "config": {"index": 2483, "code_hash": null, "entity": [["tile_c", "sp", [-1, 16, 3]], ["tile_y", "sp", [-1, 1, 1]], ["tile_x", "sp", [-1, 19, 1]], ["ann_spatial", "an", ["none", "unroll", "unroll"]]]}, "result": [[0.0004158542], 0, 1.9024419784545898, 1598897039.536924], "version": 0.2, "tvm_version": "0.7.dev1"}
{"input": ["opencl -keys=mali,opencl,gpu -device=mali -max_num_threads=256", "dense.mali", [["TENSOR", [1, 96], "float32"], ["TENSOR", [24, 96], "float32"], null, "float32"], {}], "config": {"index": 277, "code_hash": null, "entity": [["tile_y", "sp", [-1, 1, 1]], ["tile_x", "sp", [-1, 24, 1]], ["c_unroll", "sp", [-1, 32]]]}, "result": [[6.612500000000001e-05], 0, 1.9818508625030518, 1598897407.064204], "version": 0.2, "tvm_version": "0.7.dev1"}
{"input": ["opencl -keys=mali,opencl,gpu -device=mali -max_num_threads=256", "dense.mali", [["TENSOR", [1, 24], "float32"], ["TENSOR", [96, 24], "float32"], null, "float32"], {}], "config": {"index": 320, "code_hash": null, "entity": [["tile_y", "sp", [-1, 1, 1]], ["tile_x", "sp", [-1, 8, 1]], ["c_unroll", "sp", [-1, 8]]]}, "result": [[5.66668e-05], 0, 1.0042860507965088, 1598897561.146089], "version": 0.2, "tvm_version": "0.7.dev1"}
{"input": ["opencl -keys=mali,opencl,gpu -device=mali -max_num_threads=256", "conv2d_nchw_spatial_pack.mali", [["TENSOR", [1, 96, 19, 19], "float32"], ["TENSOR", [40, 96, 1, 1], "float32"], [1, 1], [0, 0, 0, 0], [1, 1], "float32"], {}], "config": {"index": 5002, "code_hash": null, "entity": [["tile_co", "sp", [-1, 1, 8]], ["tile_oh", "sp", [-1, 19, 1]], ["tile_ow", "sp", [-1, 19, 1]], ["reorder_0", "re", [0, 1, 2, 3, 4, 5, 6, 7, 8, 9]], ["ann_reduce", "an", ["none", "unroll"]], ["ann_spatial", "an", ["none", "none", "vec"]]]}, "result": [[0.0006992395999999999], 0, 1.808359146118164, 1598898042.2113202], "version": 0.2, "tvm_version": "0.7.dev1"}
{"input": ["opencl -keys=mali,opencl,gpu -device=mali -max_num_threads=256", "conv2d_nchw_spatial_pack.mali", [["TENSOR", [1, 240, 19, 19], "float32"], ["TENSOR", [40, 240, 1, 1], "float32"], [1, 1], [0, 0, 0, 0], [1, 1], "float32"], {}], "config": {"index": 6053, "code_hash": null, "entity": [["tile_co", "sp", [-1, 5, 8]], ["tile_oh", "sp", [-1, 1, 1]], ["tile_ow", "sp", [-1, 19, 1]], ["reorder_0", "re", [0, 1, 2, 3, 4, 5, 6, 7, 8, 9]], ["ann_reduce", "an", ["unroll", "unroll"]], ["ann_spatial", "an", ["none", "none", "vec"]]]}, "result": [[0.001464375], 0, 1.9615917205810547, 1598899200.1553469], "version": 0.2, "tvm_version": "0.7.dev1"}
{"input": ["opencl -keys=mali,opencl,gpu -device=mali -max_num_threads=256", "conv2d_nchw_spatial_pack.mali", [["TENSOR", [1, 40, 19, 19], "float32"], ["TENSOR", [120, 40, 1, 1], "float32"], [1, 1], [0, 0, 0, 0], [1, 1], "float32"], {}], "config": {"index": 13110, "code_hash": null, "entity": [["tile_co", "sp", [-1, 5, 8]], ["tile_oh", "sp", [-1, 19, 1]], ["tile_ow", "sp", [-1, 1, 1]], ["reorder_0", "re", [0, 1, 2, 3, 4, 5, 6, 7, 8, 9]], ["ann_reduce", "an", ["none", "none"]], ["ann_spatial", "an", ["none", "none", "vec"]]]}, "result": [[0.000497177], 0, 0.9846720695495605, 1598900166.236268], "version": 0.2, "tvm_version": "0.7.dev1"}
{"input": ["opencl -keys=mali,opencl,gpu -device=mali -max_num_threads=256", "depthwise_conv2d_nchw.mali", [["TENSOR", [1, 120, 19, 19], "float32"], ["TENSOR", [120, 1, 5, 5], "float32"], [1, 1], [2, 2, 2, 2], [1, 1], "float32"], {}], "config": {"index": 13419, "code_hash": null, "entity": [["tile_c", "sp", [-1, 15, 1]], ["tile_y", "sp", [-1, 1, 19]], ["tile_x", "sp", [-1, 19, 1]], ["ann_spatial", "an", ["vec", "none", "none"]]]}, "result": [[0.0003149062], 0, 3.5184779167175293, 1598900621.095021], "version": 0.2, "tvm_version": "0.7.dev1"}
{"input": ["opencl -keys=mali,opencl,gpu -device=mali -max_num_threads=256", "dense.mali", [["TENSOR", [1, 120], "float32"], ["TENSOR", [30, 120], "float32"], null, "float32"], {}], "config": {"index": 219, "code_hash": null, "entity": [["tile_y", "sp", [-1, 1, 1]], ["tile_x", "sp", [-1, 5, 1]], ["c_unroll", "sp", [-1, 12]]]}, "result": [[7.3021e-05], 0, 2.941880226135254, 1598901036.120254], "version": 0.2, "tvm_version": "0.7.dev1"}
{"input": ["opencl -keys=mali,opencl,gpu -device=mali -max_num_threads=256", "dense.mali", [["TENSOR", [1, 30], "float32"], ["TENSOR", [120, 30], "float32"], null, "float32"], {}], "config": {"index": 95, "code_hash": null, "entity": [["tile_y", "sp", [-1, 1, 1]], ["tile_x", "sp", [-1, 6, 1]], ["c_unroll", "sp", [-1, 2]]]}, "result": [[5.07188e-05], 0, 0.5719330310821533, 1598901251.111776], "version": 0.2, "tvm_version": "0.7.dev1"}
{"input": ["opencl -keys=mali,opencl,gpu -device=mali -max_num_threads=256", "conv2d_nchw_spatial_pack.mali", [["TENSOR", [1, 120, 19, 19], "float32"], ["TENSOR", [48, 120, 1, 1], "float32"], [1, 1], [0, 0, 0, 0], [1, 1], "float32"], {}], "config": {"index": 9080, "code_hash": null, "entity": [["tile_co", "sp", [-1, 3, 8]], ["tile_oh", "sp", [-1, 1, 1]], ["tile_ow", "sp", [-1, 19, 1]], ["reorder_0", "re", [0, 1, 2, 3, 4, 5, 6, 7, 8, 9]], ["ann_reduce", "an", ["unroll", "unroll"]], ["ann_spatial", "an", ["none", "none", "vec"]]]}, "result": [[0.0007721146], 0, 1.373568058013916, 1598901903.418412], "version": 0.2, "tvm_version": "0.7.dev1"}
{"input": ["opencl -keys=mali,opencl,gpu -device=mali -max_num_threads=256", "conv2d_nchw_spatial_pack.mali", [["TENSOR", [1, 144, 19, 19], "float32"], ["TENSOR", [48, 144, 1, 1], "float32"], [1, 1], [0, 0, 0, 0], [1, 1], "float32"], {}], "config": {"index": 33385, "code_hash": null, "entity": [["tile_co", "sp", [-1, 1, 16]], ["tile_oh", "sp", [-1, 1, 1]], ["tile_ow", "sp", [-1, 19, 1]], ["reorder_0", "re", [0, 1, 2, 3, 4, 5, 6, 7, 8, 9]], ["ann_reduce", "an", ["none", "unroll"]], ["ann_spatial", "an", ["unroll", "none", "vec"]]]}, "result": [[0.0009639688], 0, 1.3981118202209473, 1598902824.336262], "version": 0.2, "tvm_version": "0.7.dev1"}
{"input": ["opencl -keys=mali,opencl,gpu -device=mali -max_num_threads=256", "conv2d_nchw_spatial_pack.mali", [["TENSOR", [1, 48, 19, 19], "float32"], ["TENSOR", [288, 48, 1, 1], "float32"], [1, 1], [0, 0, 0, 0], [1, 1], "float32"], {}], "config": {"index": 52384, "code_hash": null, "entity": [["tile_co", "sp", [-1, 9, 16]], ["tile_oh", "sp", [-1, 19, 1]], ["tile_ow", "sp", [-1, 1, 1]], ["reorder_0", "re", [0, 1, 2, 3, 4, 5, 6, 7, 8, 9]], ["ann_reduce", "an", ["unroll", "unroll"]], ["ann_spatial", "an", ["none", "unroll", "vec"]]]}, "result": [[0.0007260834], 0, 1.9494426250457764, 1598904051.603617], "version": 0.2, "tvm_version": "0.7.dev1"}
{"input": ["opencl -keys=mali,opencl,gpu -device=mali -max_num_threads=256", "depthwise_conv2d_nchw.mali", [["TENSOR", [1, 288, 19, 19], "float32"], ["TENSOR", [288, 1, 3, 3], "float32"], [1, 1], [1, 1, 1, 1], [1, 1], "float32"], {}], "config": {"index": 9712, "code_hash": null, "entity": [["tile_c", "sp", [-1, 24, 1]], ["tile_y", "sp", [-1, 1, 19]], ["tile_x", "sp", [-1, 19, 1]], ["ann_spatial", "an", ["unroll", "none", "none"]]]}, "result": [[0.0004093958], 0, 3.6188321113586426, 1598904686.150141], "version": 0.2, "tvm_version": "0.7.dev1"}
{"input": ["opencl -keys=mali,opencl,gpu -device=mali -max_num_threads=256", "conv2d_nchw_spatial_pack.mali", [["TENSOR", [1, 288, 19, 19], "float32"], ["TENSOR", [12, 288, 1, 1], "float32"], [1, 1], [0, 0, 0, 0], [1, 1], "float32"], {}], "config": {"index": 6548, "code_hash": null, "entity": [["tile_co", "sp", [-1, 3, 4]], ["tile_oh", "sp", [-1, 1, 1]], ["tile_ow", "sp", [-1, 19, 1]], ["reorder_0", "re", [0, 1, 2, 3, 4, 5, 6, 7, 8, 9]], ["ann_reduce", "an", ["none", "none"]], ["ann_spatial", "an", ["none", "unroll", "vec"]]]}, "result": [[0.0015428438], 0, 2.52604603767395, 1598905628.434771], "version": 0.2, "tvm_version": "0.7.dev1"}
