logs/mobilenetv3-ssdlite.fp16.autotvm.log
{"input": ["opencl -keys=mali,opencl,gpu -device=mali -max_num_threads=256", "conv2d_nchw_spatial_pack.mali", [["TENSOR", [1, 64, 1, 1], "float16"], ["TENSOR", [24, 64, 1, 1], "float16"], [1, 1], [0, 0, 0, 0], [1, 1], "float16"], {}], "config": {"index": 3799, "code_hash": null, "entity": [["tile_co", "sp", [-1, 2, 4]], ["tile_oh", "sp", [-1, 1, 1]], ["tile_ow", "sp", [-1, 1, 1]], ["reorder_0", "re", [0, 1, 2, 3, 4, 5, 6, 7, 8, 9]], ["ann_reduce", "an", ["unroll", "unroll"]], ["ann_spatial", "an", ["unroll", "vec", "unroll"]]]}, "result": [[0.0001881146], 0, 1.2329871654510498, 1599366880.474324], "version": 0.2, "tvm_version": "0.7.dev1"}
{"input": ["opencl -keys=mali,opencl,gpu -device=mali -max_num_threads=256", "conv2d_nchw_spatial_pack.mali", [["TENSOR", [1, 256, 2, 2], "float16"], ["TENSOR", [24, 256, 1, 1], "float16"], [1, 1], [0, 0, 0, 0], [1, 1], "float16"], {}], "config": {"index": 24127, "code_hash": null, "entity": [["tile_co", "sp", [-1, 24, 1]], ["tile_oh", "sp", [-1, 1, 1]], ["tile_ow", "sp", [-1, 2, 1]], ["reorder_0", "re", [0, 1, 2, 3, 4, 5, 6, 9, 7, 8]], ["ann_reduce", "an", ["none", "none"]], ["ann_spatial", "an", ["unroll", "unroll", "none"]]]}, "result": [[0.0002495104], 0, 1.8018531799316406, 1599367460.939946], "version": 0.2, "tvm_version": "0.7.dev1"}
{"input": ["opencl -keys=mali,opencl,gpu -device=mali -max_num_threads=256", "conv2d_nchw_spatial_pack.mali", [["TENSOR", [1, 256, 3, 3], "float16"], ["TENSOR", [24, 256, 1, 1], "float16"], [1, 1], [0, 0, 0, 0], [1, 1], "float16"], {}], "config": {"index": 20553, "code_hash": null, "entity": [["tile_co", "sp", [-1, 4, 1]], ["tile_oh", "sp", [-1, 3, 1]], ["tile_ow", "sp", [-1, 1, 1]], ["reorder_0", "re", [0, 1, 2, 3, 4, 5, 6, 7, 8, 9]], ["ann_reduce", "an", ["unroll", "none"]], ["ann_spatial", "an", ["unroll", "none", "unroll"]]]}, "result": [[0.0002688958], 0, 2.900341033935547, 1599368090.452995], "version": 0.2, "tvm_version": "0.7.dev1"}
{"input": ["opencl -keys=mali,opencl,gpu -device=mali -max_num_threads=256", "conv2d_nchw_spatial_pack.mali", [["TENSOR", [1, 512, 5, 5], "float16"], ["TENSOR", [24, 512, 1, 1], "float16"], [1, 1], [0, 0, 0, 0], [1, 1], "float16"], {}], "config": {"index": 4900, "code_hash": null, "entity": [["tile_co", "sp", [-1, 3, 2]], ["tile_oh", "sp", [-1, 5, 1]], ["tile_ow", "sp", [-1, 1, 1]], ["reorder_0", "re", [0, 1, 2, 3, 4, 5, 6, 7, 8, 9]], ["ann_reduce", "an", ["none", "unroll"]], ["ann_spatial", "an", ["none", "none", "vec"]]]}, "result": [[0.00041141679999999995], 0, 3.6756198406219482, 1599368482.4784708], "version": 0.2, "tvm_version": "0.7.dev1"}
{"input": ["opencl -keys=mali,opencl,gpu -device=mali -max_num_threads=256", "conv2d_nchw_spatial_pack.mali", [["TENSOR", [1, 1280, 10, 10], "float16"], ["TENSOR", [24, 1280, 1, 1], "float16"], [1, 1], [0, 0, 0, 0], [1, 1], "float16"], {}], "config": {"index": 264370, "code_hash": null, "entity": [["tile_co", "sp", [-1, 3, 2]], ["tile_oh", "sp", [-1, 2, 1]], ["tile_ow", "sp", [-1, 2, 5]], ["reorder_0", "re", [0, 1, 2, 3, 4, 5, 6, 7, 8, 9]], ["ann_reduce", "an", ["unroll", "none"]], ["ann_spatial", "an", ["unroll", "unroll", "vec"]]]}, "result": [[0.0012183438], 0, 3.4138848781585693, 1599370033.250496], "version": 0.2, "tvm_version": "0.7.dev1"}
{"input": ["opencl -keys=mali,opencl,gpu -device=mali -max_num_threads=256", "conv2d_nchw_spatial_pack.mali", [["TENSOR", [1, 288, 19, 19], "float16"], ["TENSOR", [24, 288, 1, 1], "float16"], [1, 1], [0, 0, 0, 0], [1, 1], "float16"], {}], "config": {"index": 28189, "code_hash": null, "entity": [["tile_co", "sp", [-1, 2, 4]], ["tile_oh", "sp", [-1, 1, 1]], ["tile_ow", "sp", [-1, 19, 1]], ["reorder_0", "re", [0, 1, 2, 3, 4, 5, 6, 7, 8, 9]], ["ann_reduce", "an", ["none", "none"]], ["ann_spatial", "an", ["unroll", "unroll", "vec"]]]}, "result": [[0.0015969480000000002], 0, 4.530014991760254, 1599370580.815676], "version": 0.2, "tvm_version": "0.7.dev1"}
{"input": ["opencl -keys=mali,opencl,gpu -device=mali -max_num_threads=256", "conv2d_nchw_spatial_pack.mali", [["TENSOR", [1, 256, 2, 2], "float16"], ["TENSOR", [64, 256, 1, 1], "float16"], [1, 1], [0, 0, 0, 0], [1, 1], "float16"], {}], "config": {"index": 11235, "code_hash": null, "entity": [["tile_co", "sp", [-1, 1, 2]], ["tile_oh", "sp", [-1, 1, 2]], ["tile_ow", "sp", [-1, 2, 1]], ["reorder_0", "re", [0, 1, 2, 3, 4, 5, 6, 7, 8, 9]], ["ann_reduce", "an", ["unroll", "none"]], ["ann_spatial", "an", ["none", "unroll", "vec"]]]}, "result": [[0.0002852396], 0, 5.062833309173584, 1599371166.27681], "version": 0.2, "tvm_version": "0.7.dev1"}
{"input": ["opencl -keys=mali,opencl,gpu -device=mali -max_num_threads=256", "depthwise_conv2d_nchw.mali", [["TENSOR", [1, 64, 2, 2], "float16"], ["TENSOR", [64, 1, 3, 3], "float16"], [2, 2], [1, 1, 1, 1], [1, 1], "float16"], {}], "config": {"index": 235, "code_hash": null, "entity": [["tile_c", "sp", [-1, 16, 2]], ["tile_y", "sp", [-1, 1, 1]], ["tile_x", "sp", [-1, 1, 1]], ["ann_spatial", "an", ["unroll", "none", "none"]]]}, "result": [[0.0001060416], 0, 2.0280344486236572, 1599372012.6165981], "version": 0.2, "tvm_version": "0.7.dev1"}
{"input": ["opencl -keys=mali,opencl,gpu -device=mali -max_num_threads=256", "conv2d_nchw_spatial_pack.mali", [["TENSOR", [1, 64, 1, 1], "float16"], ["TENSOR", [64, 64, 1, 1], "float16"], [1, 1], [0, 0, 0, 0], [1, 1], "float16"], {}], "config": {"index": 2840, "code_hash": null, "entity": [["tile_co", "sp", [-1, 32, 2]], ["tile_oh", "sp", [-1, 1, 1]], ["tile_ow", "sp", [-1, 1, 1]], ["reorder_0", "re", [0, 1, 2, 3, 4, 5, 6, 9, 7, 8]], ["ann_reduce", "an", ["unroll", "none"]], ["ann_spatial", "an", ["unroll", "unroll", "unroll"]]]}, "result": [[0.0001430832], 0, 3.335110664367676, 1599372326.322077], "version": 0.2, "tvm_version": "0.7.dev1"}
{"input": ["opencl -keys=mali,opencl,gpu -device=mali -max_num_threads=256", "conv2d_nchw_spatial_pack.mali", [["TENSOR", [1, 64, 1, 1], "float16"], ["TENSOR", [12, 64, 1, 1], "float16"], [1, 1], [0, 0, 0, 0], [1, 1], "float16"], {}], "config": {"index": 1445, "code_hash": null, "entity": [["tile_co", "sp", [-1, 12, 1]], ["tile_oh", "sp", [-1, 1, 1]], ["tile_ow", "sp", [-1, 1, 1]], ["reorder_0", "re", [0, 1, 2, 3, 4, 5, 6, 7, 8, 9]], ["ann_reduce", "an", ["none", "none"]], ["ann_spatial", "an", ["unroll", "none", "vec"]]]}, "result": [[0.0001945936], 0, 1.9001336097717285, 1599372781.54241], "version": 0.2, "tvm_version": "0.7.dev1"}
{"input": ["opencl -keys=mali,opencl,gpu -device=mali -max_num_threads=256", "conv2d_nchw_spatial_pack.mali", [["TENSOR", [1, 256, 3, 3], "float16"], ["TENSOR", [128, 256, 1, 1], "float16"], [1, 1], [0, 0, 0, 0], [1, 1], "float16"], {}], "config": {"index": 45804, "code_hash": null, "entity": [["tile_co", "sp", [-1, 16, 2]], ["tile_oh", "sp", [-1, 1, 1]], ["tile_ow", "sp", [-1, 3, 1]], ["reorder_0", "re", [0, 1, 2, 3, 4, 5, 6, 9, 7, 8]], ["ann_reduce", "an", ["unroll", "none"]], ["ann_spatial", "an", ["vec", "none", "unroll"]]]}, "result": [[0.0002760312], 0, 1.9248552322387695, 1599373248.331567], "version": 0.2, "tvm_version": "0.7.dev1"}
{"input": ["opencl -keys=mali,opencl,gpu -device=mali -max_num_threads=256", "depthwise_conv2d_nchw.mali", [["TENSOR", [1, 128, 3, 3], "float16"], ["TENSOR", [128, 1, 3, 3], "float16"], [2, 2], [1, 1, 1, 1], [1, 1], "float16"], {}], "config": {"index": 941, "code_hash": null, "entity": [["tile_c", "sp", [-1, 32, 1]], ["tile_y", "sp", [-1, 1, 2]], ["tile_x", "sp", [-1, 1, 2]], ["ann_spatial", "an", ["none", "none", "vec"]]]}, "result": [[0.0001334584], 0, 0.6478400230407715, 1599373545.76349], "version": 0.2, "tvm_version": "0.7.dev1"}
{"input": ["opencl -keys=mali,opencl,gpu -device=mali -max_num_threads=256", "conv2d_nchw_spatial_pack.mali", [["TENSOR", [1, 128, 2, 2], "float16"], ["TENSOR", [256, 128, 1, 1], "float16"], [1, 1], [0, 0, 0, 0], [1, 1], "float16"], {}], "config": {"index": 32467, "code_hash": null, "entity": [["tile_co", "sp", [-1, 32, 4]], ["tile_oh", "sp", [-1, 2, 1]], ["tile_ow", "sp", [-1, 1, 1]], ["reorder_0", "re", [0, 1, 2, 3, 4, 5, 6, 7, 8, 9]], ["ann_reduce", "an", ["none", "none"]], ["ann_spatial", "an", ["unroll", "none", "vec"]]]}, "result": [[0.000250896], 0, 3.131110191345215, 1599375374.4081001], "version": 0.2, "tvm_version": "0.7.dev1"}
{"input": ["opencl -keys=mali,opencl,gpu -device=mali -max_num_threads=256", "depthwise_conv2d_nchw.mali", [["TENSOR", [1, 256, 2, 2], "float16"], ["TENSOR", [256, 1, 3, 3], "float16"], [1, 1], [1, 1, 1, 1], [1, 1], "float16"], {}], "config": {"index": 3290, "code_hash": null, "entity": [["tile_c", "sp", [-1, 32, 1]], ["tile_y", "sp", [-1, 2, 1]], ["tile_x", "sp", [-1, 1, 1]], ["ann_spatial", "an", ["unroll", "none", "none"]]]}, "result": [[0.0001243332], 0, 0.5798659324645996, 1599375820.99045], "version": 0.2, "tvm_version": "0.7.dev1"}
{"input": ["opencl -keys=mali,opencl,gpu -device=mali -max_num_threads=256", "conv2d_nchw_spatial_pack.mali", [["TENSOR", [1, 256, 2, 2], "float16"], ["TENSOR", [12, 256, 1, 1], "float16"], [1, 1], [0, 0, 0, 0], [1, 1], "float16"], {}], "config": {"index": 21550, "code_hash": null, "entity": [["tile_co", "sp", [-1, 6, 1]], ["tile_oh", "sp", [-1, 1, 1]], ["tile_ow", "sp", [-1, 1, 1]], ["reorder_0", "re", [0, 1, 2, 3, 4, 5, 6, 9, 7, 8]], ["ann_reduce", "an", ["unroll", "none"]], ["ann_spatial", "an", ["vec", "none", "none"]]]}, "result": [[0.0002515834], 0, 4.299208164215088, 1599376281.120846], "version": 0.2, "tvm_version": "0.7.dev1"}
{"input": ["opencl -keys=mali,opencl,gpu -device=mali -max_num_threads=256", "conv2d_nchw_spatial_pack.mali", [["TENSOR", [1, 512, 5, 5], "float16"], ["TENSOR", [128, 512, 1, 1], "float16"], [1, 1], [0, 0, 0, 0], [1, 1], "float16"], {}], "config": {"index": 13092, "code_hash": null, "entity": [["tile_co", "sp", [-1, 8, 8]], ["tile_oh", "sp", [-1, 1, 1]], ["tile_ow", "sp", [-1, 5, 1]], ["reorder_0", "re", [0, 1, 2, 3, 4, 5, 6, 7, 8, 9]], ["ann_reduce", "an", ["none", "none"]], ["ann_spatial", "an", ["none", "unroll", "vec"]]]}, "result": [[0.0005042811999999999], 0, 4.282969236373901, 1599376940.324826], "version": 0.2, "tvm_version": "0.7.dev1"}
{"input": ["opencl -keys=mali,opencl,gpu -device=mali -max_num_threads=256", "depthwise_conv2d_nchw.mali", [["TENSOR", [1, 128, 5, 5], "float16"], ["TENSOR", [128, 1, 3, 3], "float16"], [2, 2], [1, 1, 1, 1], [1, 1], "float16"], {}], "config": {"index": 3137, "code_hash": null, "entity": [["tile_c", "sp", [-1, 32, 1]], ["tile_y", "sp", [-1, 1, 1]], ["tile_x", "sp", [-1, 1, 3]], ["ann_spatial", "an", ["unroll", "none", "unroll"]]]}, "result": [[0.0001365626], 0, 2.51339054107666, 1599377042.039489], "version": 0.2, "tvm_version": "0.7.dev1"}
{"input": ["opencl -keys=mali,opencl,gpu -device=mali -max_num_threads=256", "conv2d_nchw_spatial_pack.mali", [["TENSOR", [1, 128, 3, 3], "float16"], ["TENSOR", [256, 128, 1, 1], "float16"], [1, 1], [0, 0, 0, 0], [1, 1], "float16"], {}], "config": {"index": 43887, "code_hash": null, "entity": [["tile_co", "sp", [-1, 8, 2]], ["tile_oh", "sp", [-1, 1, 1]], ["tile_ow", "sp", [-1, 3, 1]], ["reorder_0", "re", [0, 1, 2, 3, 4, 5, 6, 7, 8, 9]], ["ann_reduce", "an", ["unroll", "none"]], ["ann_spatial", "an", ["unroll", "unroll", "vec"]]]}, "result": [[0.0002571146], 0, 3.3000588417053223, 1599378009.1269739], "version": 0.2, "tvm_version": "0.7.dev1"}
{"input": ["opencl -keys=mali,opencl,gpu -device=mali -max_num_threads=256", "depthwise_conv2d_nchw.mali", [["TENSOR", [1, 256, 3, 3], "float16"], ["TENSOR", [256, 1, 3, 3], "float16"], [1, 1], [1, 1, 1, 1], [1, 1], "float16"], {}], "config": {"index": 2210, "code_hash": null, "entity": [["tile_c", "sp", [-1, 32, 1]], ["tile_y", "sp", [-1, 3, 1]], ["tile_x", "sp", [-1, 3, 1]], ["ann_spatial", "an", ["none", "unroll", "vec"]]]}, "result": [[0.0001100938], 0, 3.8794219493865967, 1599378200.219245], "version": 0.2, "tvm_version": "0.7.dev1"}
{"input": ["opencl -keys=mali,opencl,gpu -device=mali -max_num_threads=256", "conv2d_nchw_spatial_pack.mali", [["TENSOR", [1, 256, 3, 3], "float16"], ["TENSOR", [12, 256, 1, 1], "float16"], [1, 1], [0, 0, 0, 0], [1, 1], "float16"], {}], "config": {"index": 16368, "code_hash": null, "entity": [["tile_co", "sp", [-1, 1, 2]], ["tile_oh", "sp", [-1, 1, 1]], ["tile_ow", "sp", [-1, 1, 1]], ["reorder_0", "re", [0, 1, 2, 3, 4, 5, 6, 9, 7, 8]], ["ann_reduce", "an", ["unroll", "none"]], ["ann_spatial", "an", ["unroll", "unroll", "unroll"]]]}, "result": [[0.0002846978], 0, 2.979896306991577, 1599378726.121794], "version": 0.2, "tvm_version": "0.7.dev1"}
{"input": ["opencl -keys=mali,opencl,gpu -device=mali -max_num_threads=256", "conv2d_nchw_spatial_pack.mali", [["TENSOR", [1, 1280, 10, 10], "float16"], ["TENSOR", [256, 1280, 1, 1], "float16"], [1, 1], [0, 0, 0, 0], [1, 1], "float16"], {}], "config": {"index": 396572, "code_hash": null, "entity": [["tile_co", "sp", [-1, 4, 16]], ["tile_oh", "sp", [-1, 2, 1]], ["tile_ow", "sp", [-1, 2, 5]], ["reorder_0", "re", [0, 1, 2, 3, 4, 5, 6, 7, 8, 9]], ["ann_reduce", "an", ["unroll", "none"]], ["ann_spatial", "an", ["unroll", "unroll", "vec"]]]}, "result": [[0.0017895623999999999], 0, 1.335916519165039, 1599379558.1829948], "version": 0.2, "tvm_version": "0.7.dev1"}
{"input": ["opencl -keys=mali,opencl,gpu -device=mali -max_num_threads=256", "depthwise_conv2d_nchw.mali", [["TENSOR", [1, 256, 10, 10], "float16"], ["TENSOR", [256, 1, 3, 3], "float16"], [2, 2], [1, 1, 1, 1], [1, 1], "float16"], {}], "config": {"index": 1769, "code_hash": null, "entity": [["tile_c", "sp", [-1, 32, 2]], ["tile_y", "sp", [-1, 1, 1]], ["tile_x", "sp", [-1, 5, 1]], ["ann_spatial", "an", ["none", "unroll", "unroll"]]]}, "result": [[0.0001652084], 0, 3.084289312362671, 1599381141.299608], "version": 0.2, "tvm_version": "0.7.dev1"}
{"input": ["opencl -keys=mali,opencl,gpu -device=mali -max_num_threads=256", "conv2d_nchw_spatial_pack.mali", [["TENSOR", [1, 256, 5, 5], "float16"], ["TENSOR", [512, 256, 1, 1], "float16"], [1, 1], [0, 0, 0, 0], [1, 1], "float16"], {}], "config": {"index": 42713, "code_hash": null, "entity": [["tile_co", "sp", [-1, 64, 8]], ["tile_oh", "sp", [-1, 1, 5]], ["tile_ow", "sp", [-1, 1, 1]], ["reorder_0", "re", [0, 1, 2, 3, 4, 5, 6, 7, 8, 9]], ["ann_reduce", "an", ["unroll", "unroll"]], ["ann_spatial", "an", ["unroll", "none", "vec"]]]}, "result": [[0.00043075], 0, 2.0259039402008057, 1599381741.480835], "version": 0.2, "tvm_version": "0.7.dev1"}
{"input": ["opencl -keys=mali,opencl,gpu -device=mali -max_num_threads=256", "depthwise_conv2d_nchw.mali", [["TENSOR", [1, 512, 5, 5], "float16"], ["TENSOR", [512, 1, 3, 3], "float16"], [1, 1], [1, 1, 1, 1], [1, 1], "float16"], {}], "config": {"index": 885, "code_hash": null, "entity": [["tile_c", "sp", [-1, 32, 1]], ["tile_y", "sp", [-1, 5, 1]], ["tile_x", "sp", [-1, 1, 5]], ["ann_spatial", "an", ["none", "none", "unroll"]]]}, "result": [[0.00016377080000000001], 0, 1.1004788875579834, 1599383128.186313], "version": 0.2, "tvm_version": "0.7.dev1"}
{"input": ["opencl -keys=mali,opencl,gpu -device=mali -max_num_threads=256", "conv2d_nchw_spatial_pack.mali", [["TENSOR", [1, 512, 5, 5], "float16"], ["TENSOR", [12, 512, 1, 1], "float16"], [1, 1], [0, 0, 0, 0], [1, 1], "float16"], {}], "config": {"index": 8156, "code_hash": null, "entity": [["tile_co", "sp", [-1, 3, 1]], ["tile_oh", "sp", [-1, 1, 1]], ["tile_ow", "sp", [-1, 5, 1]], ["reorder_0", "re", [0, 1, 2, 3, 4, 5, 6, 7, 8, 9]], ["ann_reduce", "an", ["none", "unroll"]], ["ann_spatial", "an", ["none", "vec", "none"]]]}, "result": [[0.0003094272], 0, 0.4748969078063965, 1599383598.0659761], "version": 0.2, "tvm_version": "0.7.dev1"}
{"input": ["opencl -keys=mali,opencl,gpu -device=mali -max_num_threads=256", "depthwise_conv2d_nchw.mali", [["TENSOR", [1, 576, 10, 10], "float16"], ["TENSOR", [576, 1, 5, 5], "float16"], [1, 1], [2, 2, 2, 2], [1, 1], "float16"], {}], "config": {"index": 172211, "code_hash": null, "entity": [["tile_c", "sp", [-1, 32, 1]], ["tile_y", "sp", [-1, 1, 10]], ["tile_x", "sp", [-1, 5, 2]], ["ann_spatial", "an", ["unroll", "unroll", "unroll"]]]}, "result": [[0.0002720416], 0, 1.1748578548431396, 1599384062.660136], "version": 0.2, "tvm_version": "0.7.dev1"}
{"input": ["opencl -keys=mali,opencl,gpu -device=mali -max_num_threads=256", "depthwise_conv2d_nchw.mali", [["TENSOR", [1, 288, 19, 19], "float16"], ["TENSOR", [288, 1, 5, 5], "float16"], [2, 2], [2, 2, 2, 2], [1, 1], "float16"], {}], "config": {"index": 84685, "code_hash": null, "entity": [["tile_c", "sp", [-1, 48, 1]], ["tile_y", "sp", [-1, 1, 5]], ["tile_x", "sp", [-1, 5, 1]], ["ann_spatial", "an", ["unroll", "none", "none"]]]}, "result": [[0.0003218228], 0, 0.5578148365020752, 1599385594.862972], "version": 0.2, "tvm_version": "0.7.dev1"}
{"input": ["opencl -keys=mali,opencl,gpu -device=mali -max_num_threads=256", "dense.mali", [["TENSOR", [1, 288], "float16"], ["TENSOR", [72, 288], "float16"], null, "float16"], {}], "config": {"index": 276, "code_hash": null, "entity": [["tile_y", "sp", [-1, 1, 1]], ["tile_x", "sp", [-1, 2, 6]], ["c_unroll", "sp", [-1, 6]]]}, "result": [[0.0001241666], 0, 3.8653738498687744, 1599386976.2919738], "version": 0.2, "tvm_version": "0.7.dev1"}
{"input": ["opencl -keys=mali,opencl,gpu -device=mali -max_num_threads=256", "dense.mali", [["TENSOR", [1, 72], "float16"], ["TENSOR", [288, 72], "float16"], null, "float16"], {}], "config": {"index": 1173, "code_hash": null, "entity": [["tile_y", "sp", [-1, 1, 1]], ["tile_x", "sp", [-1, 12, 3]], ["c_unroll", "sp", [-1, 24]]]}, "result": [[8.92188e-05], 0, 3.349048614501953, 1599387057.747007], "version": 0.2, "tvm_version": "0.7.dev1"}
{"input": ["opencl -keys=mali,opencl,gpu -device=mali -max_num_threads=256", "conv2d_nchw_spatial_pack.mali", [["TENSOR", [1, 288, 10, 10], "float16"], ["TENSOR", [96, 288, 1, 1], "float16"], [1, 1], [0, 0, 0, 0], [1, 1], "float16"], {}], "config": {"index": 228105, "code_hash": null, "entity": [["tile_co", "sp", [-1, 6, 8]], ["tile_oh", "sp", [-1, 5, 1]], ["tile_ow", "sp", [-1, 1, 5]], ["reorder_0", "re", [0, 1, 2, 3, 4, 5, 6, 7, 8, 9]], ["ann_reduce", "an", ["unroll", "none"]], ["ann_spatial", "an", ["none", "unroll", "vec"]]]}, "result": [[0.0004070626], 0, 2.0121965408325195, 1599388368.4602208], "version": 0.2, "tvm_version": "0.7.dev1"}
{"input": ["opencl -keys=mali,opencl,gpu -device=mali -max_num_threads=256", "conv2d_nchw_spatial_pack.mali", [["TENSOR", [1, 576, 10, 10], "float16"], ["TENSOR", [96, 576, 1, 1], "float16"], [1, 1], [0, 0, 0, 0], [1, 1], "float16"], {}], "config": {"index": 555187, "code_hash": null, "entity": [["tile_co", "sp", [-1, 4, 4]], ["tile_oh", "sp", [-1, 2, 1]], ["tile_ow", "sp", [-1, 2, 5]], ["reorder_0", "re", [0, 1, 2, 3, 4, 5, 6, 7, 8, 9]], ["ann_reduce", "an", ["unroll", "none"]], ["ann_spatial", "an", ["unroll", "unroll", "vec"]]]}, "result": [[0.0007228436], 0, 6.006427049636841, 1599390346.861533], "version": 0.2, "tvm_version": "0.7.dev1"}
{"input": ["opencl -keys=mali,opencl,gpu -device=mali -max_num_threads=256", "conv2d_nchw_spatial_pack.mali", [["TENSOR", [1, 96, 10, 10], "float16"], ["TENSOR", [576, 96, 1, 1], "float16"], [1, 1], [0, 0, 0, 0], [1, 1], "float16"], {}], "config": {"index": 1424561, "code_hash": null, "entity": [["tile_co", "sp", [-1, 24, 8]], ["tile_oh", "sp", [-1, 2, 1]], ["tile_ow", "sp", [-1, 1, 5]], ["reorder_0", "re", [0, 1, 2, 3, 4, 5, 6, 7, 8, 9]], ["ann_reduce", "an", ["none", "none"]], ["ann_spatial", "an", ["unroll", "unroll", "vec"]]]}, "result": [[0.0003805], 0, 3.5071911811828613, 1599393238.609858], "version": 0.2, "tvm_version": "0.7.dev1"}
{"input": ["opencl -keys=mali,opencl,gpu -device=mali -max_num_threads=256", "dense.mali", [["TENSOR", [1, 576], "float16"], ["TENSOR", [144, 576], "float16"], null, "float16"], {}], "config": {"index": 1009, "code_hash": null, "entity": [["tile_y", "sp", [-1, 1, 1]], ["tile_x", "sp", [-1, 6, 2]], ["c_unroll", "sp", [-1, 32]]]}, "result": [[0.0001514582], 0, 3.9961822032928467, 1599396602.284637], "version": 0.2, "tvm_version": "0.7.dev1"}
{"input": ["opencl -keys=mali,opencl,gpu -device=mali -max_num_threads=256", "dense.mali", [["TENSOR", [1, 144], "float16"], ["TENSOR", [576, 144], "float16"], null, "float16"], {}], "config": {"index": 1906, "code_hash": null, "entity": [["tile_y", "sp", [-1, 1, 1]], ["tile_x", "sp", [-1, 8, 4]], ["c_unroll", "sp", [-1, 36]]]}, "result": [[0.00012936460000000002], 0, 4.050262212753296, 1599397024.745745], "version": 0.2, "tvm_version": "0.7.dev1"}
{"input": ["opencl -keys=mali,opencl,gpu -device=mali -max_num_threads=256", "conv2d_nchw_spatial_pack.mali", [["TENSOR", [1, 576, 10, 10], "float16"], ["TENSOR", [1280, 576, 1, 1], "float16"], [1, 1], [0, 0, 0, 0], [1, 1], "float16"], {}], "config": {"index": 1167831, "code_hash": null, "entity": [["tile_co", "sp", [-1, 8, 16]], ["tile_oh", "sp", [-1, 2, 1]], ["tile_ow", "sp", [-1, 2, 5]], ["reorder_0", "re", [0, 1, 2, 3, 4, 5, 6, 7, 8, 9]], ["ann_reduce", "an", ["none", "unroll"]], ["ann_spatial", "an", ["unroll", "unroll", "vec"]]]}, "result": [[0.0020243542], 0, 8.54733395576477, 1599398196.425607], "version": 0.2, "tvm_version": "0.7.dev1"}
{"input": ["opencl -keys=mali,opencl,gpu -device=mali -max_num_threads=256", "depthwise_conv2d_nchw.mali", [["TENSOR", [1, 1280, 10, 10], "float16"], ["TENSOR", [1280, 1, 3, 3], "float16"], [1, 1], [1, 1, 1, 1], [1, 1], "float16"], {}], "config": {"index": 211286, "code_hash": null, "entity": [["tile_c", "sp", [-1, 80, 1]], ["tile_y", "sp", [-1, 1, 10]], ["tile_x", "sp", [-1, 5, 1]], ["ann_spatial", "an", ["vec", "unroll", "unroll"]]]}, "result": [[0.000371323], 0, 3.9508469104766846, 1599400256.6934059], "version": 0.2, "tvm_version": "0.7.dev1"}
{"input": ["opencl -keys=mali,opencl,gpu -device=mali -max_num_threads=256", "conv2d_nchw_spatial_pack.mali", [["TENSOR", [1, 1280, 10, 10], "float16"], ["TENSOR", [12, 1280, 1, 1], "float16"], [1, 1], [0, 0, 0, 0], [1, 1], "float16"], {}], "config": {"index": 151313, "code_hash": null, "entity": [["tile_co", "sp", [-1, 12, 1]], ["tile_oh", "sp", [-1, 1, 1]], ["tile_ow", "sp", [-1, 2, 5]], ["reorder_0", "re", [0, 1, 2, 3, 4, 5, 6, 9, 7, 8]], ["ann_reduce", "an", ["unroll", "unroll"]], ["ann_spatial", "an", ["unroll", "unroll", "unroll"]]]}, "result": [[0.0013049064000000001], 0, 0.5432429313659668, 1599401734.415246], "version": 0.2, "tvm_version": "0.7.dev1"}
{"input": ["opencl -keys=mali,opencl,gpu -device=mali -max_num_threads=256", "conv2d_nchw_spatial_pack.mali", [["TENSOR", [1, 48, 19, 19], "float16"], ["TENSOR", [144, 48, 1, 1], "float16"], [1, 1], [0, 0, 0, 0], [1, 1], "float16"], {}], "config": {"index": 69012, "code_hash": null, "entity": [["tile_co", "sp", [-1, 3, 16]], ["tile_oh", "sp", [-1, 19, 1]], ["tile_ow", "sp", [-1, 1, 1]], ["reorder_0", "re", [0, 1, 2, 3, 4, 5, 6, 9, 7, 8]], ["ann_reduce", "an", ["unroll", "none"]], ["ann_spatial", "an", ["unroll", "none", "vec"]]]}, "result": [[0.000531], 0, 3.1714468002319336, 1599402991.689331], "version": 0.2, "tvm_version": "0.7.dev1"}
{"input": ["opencl -keys=mali,opencl,gpu -device=mali -max_num_threads=256", "depthwise_conv2d_nchw.mali", [["TENSOR", [1, 144, 19, 19], "float16"], ["TENSOR", [144, 1, 5, 5], "float16"], [1, 1], [2, 2, 2, 2], [1, 1], "float16"], {}], "config": {"index": 13420, "code_hash": null, "entity": [["tile_c", "sp", [-1, 24, 1]], ["tile_y", "sp", [-1, 1, 19]], ["tile_x", "sp", [-1, 19, 1]], ["ann_spatial", "an", ["vec", "none", "none"]]]}, "result": [[0.00029975], 0, 1.0850870609283447, 1599403337.510995], "version": 0.2, "tvm_version": "0.7.dev1"}
{"input": ["opencl -keys=mali,opencl,gpu -device=mali -max_num_threads=256", "dense.mali", [["TENSOR", [1, 144], "float16"], ["TENSOR", [36, 144], "float16"], null, "float16"], {}], "config": {"index": 202, "code_hash": null, "entity": [["tile_y", "sp", [-1, 1, 1]], ["tile_x", "sp", [-1, 3, 4]], ["c_unroll", "sp", [-1, 8]]]}, "result": [[8.6073e-05], 0, 4.420495986938477, 1599403753.833762], "version": 0.2, "tvm_version": "0.7.dev1"}
{"input": ["opencl -keys=mali,opencl,gpu -device=mali -max_num_threads=256", "dense.mali", [["TENSOR", [1, 36], "float16"], ["TENSOR", [144, 36], "float16"], null, "float16"], {}], "config": {"index": 723, "code_hash": null, "entity": [["tile_y", "sp", [-1, 1, 1]], ["tile_x", "sp", [-1, 4, 1]], ["c_unroll", "sp", [-1, 36]]]}, "result": [[5.3958399999999995e-05], 0, 3.366278648376465, 1599403848.7205608], "version": 0.2, "tvm_version": "0.7.dev1"}
{"input": ["opencl -keys=mali,opencl,gpu -device=mali -max_num_threads=256", "conv2d_nchw_spatial_pack.mali", [["TENSOR", [1, 40, 19, 19], "float16"], ["TENSOR", [240, 40, 1, 1], "float16"], [1, 1], [0, 0, 0, 0], [1, 1], "float16"], {}], "config": {"index": 135482, "code_hash": null, "entity": [["tile_co", "sp", [-1, 2, 8]], ["tile_oh", "sp", [-1, 19, 1]], ["tile_ow", "sp", [-1, 19, 1]], ["reorder_0", "re", [0, 1, 2, 3, 4, 5, 6, 9, 7, 8]], ["ann_reduce", "an", ["unroll", "unroll"]], ["ann_spatial", "an", ["unroll", "unroll", "vec"]]]}, "result": [[0.0006379584], 0, 3.272299289703369, 1599405034.2121742], "version": 0.2, "tvm_version": "0.7.dev1"}
{"input": ["opencl -keys=mali,opencl,gpu -device=mali -max_num_threads=256", "depthwise_conv2d_nchw.mali", [["TENSOR", [1, 240, 19, 19], "float16"], ["TENSOR", [240, 1, 5, 5], "float16"], [1, 1], [2, 2, 2, 2], [1, 1], "float16"], {}], "config": {"index": 20129, "code_hash": null, "entity": [["tile_c", "sp", [-1, 40, 1]], ["tile_y", "sp", [-1, 1, 19]], ["tile_x", "sp", [-1, 19, 1]], ["ann_spatial", "an", ["vec", "none", "none"]]]}, "result": [[0.0005558436], 0, 4.6287877559661865, 1599405332.4446049], "version": 0.2, "tvm_version": "0.7.dev1"}
{"input": ["opencl -keys=mali,opencl,gpu -device=mali -max_num_threads=256", "dense.mali", [["TENSOR", [1, 240], "float16"], ["TENSOR", [60, 240], "float16"], null, "float16"], {}], "config": {"index": 868, "code_hash": null, "entity": [["tile_y", "sp", [-1, 1, 1]], ["tile_x", "sp", [-1, 5, 1]], ["c_unroll", "sp", [-1, 60]]]}, "result": [[8.50416e-05], 0, 0.8867359161376953, 1599405594.040252], "version": 0.2, "tvm_version": "0.7.dev1"}
{"input": ["opencl -keys=mali,opencl,gpu -device=mali -max_num_threads=256", "dense.mali", [["TENSOR", [1, 60], "float16"], ["TENSOR", [240, 60], "float16"], null, "float16"], {}], "config": {"index": 1085, "code_hash": null, "entity": [["tile_y", "sp", [-1, 1, 1]], ["tile_x", "sp", [-1, 6, 1]], ["c_unroll", "sp", [-1, 15]]]}, "result": [[8.17812e-05], 0, 0.5435090065002441, 1599406082.937505], "version": 0.2, "tvm_version": "0.7.dev1"}
{"input": ["opencl -keys=mali,opencl,gpu -device=mali -max_num_threads=256", "conv2d_nchw_spatial_pack.mali", [["TENSOR", [1, 24, 38, 38], "float16"], ["TENSOR", [88, 24, 1, 1], "float16"], [1, 1], [0, 0, 0, 0], [1, 1], "float16"], {}], "config": {"index": 305264, "code_hash": null, "entity": [["tile_co", "sp", [-1, 1, 4]], ["tile_oh", "sp", [-1, 19, 2]], ["tile_ow", "sp", [-1, 19, 2]], ["reorder_0", "re", [0, 1, 2, 3, 4, 5, 6, 9, 7, 8]], ["ann_reduce", "an", ["unroll", "none"]], ["ann_spatial", "an", ["unroll", "vec", "unroll"]]]}, "result": [[0.0006436042], 0, 1.3859179019927979, 1599407257.837406], "version": 0.2, "tvm_version": "0.7.dev1"}
{"input": ["opencl -keys=mali,opencl,gpu -device=mali -max_num_threads=256", "depthwise_conv2d_nchw.mali", [["TENSOR", [1, 88, 38, 38], "float16"], ["TENSOR", [88, 1, 3, 3], "float16"], [1, 1], [1, 1, 1, 1], [1, 1], "float16"], {}], "config": {"index": 18486, "code_hash": null, "entity": [["tile_c", "sp", [-1, 44, 1]], ["tile_y", "sp", [-1, 1, 2]], ["tile_x", "sp", [-1, 19, 2]], ["ann_spatial", "an", ["none", "vec", "unroll"]]]}, "result": [[0.0003590626], 0, 2.5468599796295166, 1599407982.8955882], "version": 0.2, "tvm_version": "0.7.dev1"}
{"input": ["opencl -keys=mali,opencl,gpu -device=mali -max_num_threads=256", "conv2d_nchw_spatial_pack.mali", [["TENSOR", [1, 3, 300, 300], "float16"], ["TENSOR", [16, 3, 3, 3], "float16"], [2, 2], [1, 1, 1, 1], [1, 1], "float16"], {}], "config": {"index": 3763708, "code_hash": null, "entity": [["tile_co", "sp", [-1, 2, 8]], ["tile_oh", "sp", [-1, 10, 5]], ["tile_ow", "sp", [-1, 3, 1]], ["reorder_0", "re", [0, 1, 2, 3, 4, 5, 6, 7, 8, 9]], ["ann_reduce", "an", ["unroll", "unroll"]], ["ann_spatial", "an", ["unroll", "none", "vec"]]]}, "result": [[0.002394677], 0, 9.723638772964478, 1599412170.820957], "version": 0.2, "tvm_version": "0.7.dev1"}
{"input": ["opencl -keys=mali,opencl,gpu -device=mali -max_num_threads=256", "conv2d_nchw_spatial_pack.mali", [["TENSOR", [1, 16, 150, 150], "float16"], ["TENSOR", [16, 16, 1, 1], "float16"], [1, 1], [0, 0, 0, 0], [1, 1], "float16"], {}], "config": {"index": 4843888, "code_hash": null, "entity": [["tile_co", "sp", [-1, 2, 8]], ["tile_oh", "sp", [-1, 10, 1]], ["tile_ow", "sp", [-1, 2, 15]], ["reorder_0", "re", [0, 1, 2, 3, 4, 5, 6, 7, 8, 9]], ["ann_reduce", "an", ["unroll", "unroll"]], ["ann_spatial", "an", ["unroll", "unroll", "vec"]]]}, "result": [[0.0017677915999999999], 0, 1.4319257736206055, 1599413577.765753], "version": 0.2, "tvm_version": "0.7.dev1"}
{"input": ["opencl -keys=mali,opencl,gpu -device=mali -max_num_threads=256", "depthwise_conv2d_nchw.mali", [["TENSOR", [1, 16, 150, 150], "float16"], ["TENSOR", [16, 1, 3, 3], "float16"], [2, 2], [1, 1, 1, 1], [1, 1], "float16"], {}], "config": {"index": 88384, "code_hash": null, "entity": [["tile_c", "sp", [-1, 16, 1]], ["tile_y", "sp", [-1, 1, 3]], ["tile_x", "sp", [-1, 15, 1]], ["ann_spatial", "an", ["vec", "unroll", "none"]]]}, "result": [[0.0005395625999999999], 0, 3.9616289138793945, 1599417188.726208], "version": 0.2, "tvm_version": "0.7.dev1"}
{"input": ["opencl -keys=mali,opencl,gpu -device=mali -max_num_threads=256", "dense.mali", [["TENSOR", [1, 16], "float16"], ["TENSOR", [4, 16], "float16"], null, "float16"], {}], "config": {"index": 14, "code_hash": null, "entity": [["tile_y", "sp", [-1, 1, 1]], ["tile_x", "sp", [-1, 4, 1]], ["c_unroll", "sp", [-1, 4]]]}, "result": [[7.681260000000001e-05], 0, 3.558730125427246, 1599417509.026214], "version": 0.2, "tvm_version": "0.7.dev1"}
{"input": ["opencl -keys=mali,opencl,gpu -device=mali -max_num_threads=256", "dense.mali", [["TENSOR", [1, 4], "float16"], ["TENSOR", [16, 4], "float16"], null, "float16"], {}], "config": {"index": 16, "code_hash": null, "entity": [["tile_y", "sp", [-1, 1, 1]], ["tile_x", "sp", [-1, 2, 1]], ["c_unroll", "sp", [-1, 2]]]}, "result": [[8.24896e-05], 0, 3.603085994720459, 1599417549.735478], "version": 0.2, "tvm_version": "0.7.dev1"}
{"input": ["opencl -keys=mali,opencl,gpu -device=mali -max_num_threads=256", "conv2d_nchw_spatial_pack.mali", [["TENSOR", [1, 16, 75, 75], "float16"], ["TENSOR", [16, 16, 1, 1], "float16"], [1, 1], [0, 0, 0, 0], [1, 1], "float16"], {}], "config": {"index": 216296, "code_hash": null, "entity": [["tile_co", "sp", [-1, 4, 4]], ["tile_oh", "sp", [-1, 3, 1]], ["tile_ow", "sp", [-1, 1, 5]], ["reorder_0", "re", [0, 1, 2, 3, 4, 5, 6, 7, 8, 9]], ["ann_reduce", "an", ["unroll", "none"]], ["ann_spatial", "an", ["none", "unroll", "vec"]]]}, "result": [[0.000677573], 0, 2.0211892127990723, 1599418305.0256572], "version": 0.2, "tvm_version": "0.7.dev1"}
{"input": ["opencl -keys=mali,opencl,gpu -device=mali -max_num_threads=256", "conv2d_nchw_spatial_pack.mali", [["TENSOR", [1, 16, 75, 75], "float16"], ["TENSOR", [72, 16, 1, 1], "float16"], [1, 1], [0, 0, 0, 0], [1, 1], "float16"], {}], "config": {"index": 905083, "code_hash": null, "entity": [["tile_co", "sp", [-1, 9, 8]], ["tile_oh", "sp", [-1, 1, 1]], ["tile_ow", "sp", [-1, 3, 5]], ["reorder_0", "re", [0, 1, 2, 3, 4, 5, 6, 7, 8, 9]], ["ann_reduce", "an", ["unroll", "unroll"]], ["ann_spatial", "an", ["none", "unroll", "vec"]]]}, "result": [[0.0010996458], 0, 8.187551259994507, 1599421240.4067042], "version": 0.2, "tvm_version": "0.7.dev1"}
{"input": ["opencl -keys=mali,opencl,gpu -device=mali -max_num_threads=256", "depthwise_conv2d_nchw.mali", [["TENSOR", [1, 72, 75, 75], "float16"], ["TENSOR", [72, 1, 3, 3], "float16"], [2, 2], [1, 1, 1, 1], [1, 1], "float16"], {}], "config": {"index": 79329, "code_hash": null, "entity": [["tile_c", "sp", [-1, 24, 1]], ["tile_y", "sp", [-1, 1, 38]], ["tile_x", "sp", [-1, 19, 1]], ["ann_spatial", "an", ["vec", "none", "none"]]]}, "result": [[0.0005709166], 0, 2.8173649311065674, 1599424633.253029], "version": 0.2, "tvm_version": "0.7.dev1"}
{"input": ["opencl -keys=mali,opencl,gpu -device=mali -max_num_threads=256", "conv2d_nchw_spatial_pack.mali", [["TENSOR", [1, 72, 38, 38], "float16"], ["TENSOR", [24, 72, 1, 1], "float16"], [1, 1], [0, 0, 0, 0], [1, 1], "float16"], {}], "config": {"index": 309861, "code_hash": null, "entity": [["tile_co", "sp", [-1, 6, 4]], ["tile_oh", "sp", [-1, 19, 2]], ["tile_ow", "sp", [-1, 1, 2]], ["reorder_0", "re", [0, 1, 2, 3, 4, 5, 6, 9, 7, 8]], ["ann_reduce", "an", ["unroll", "unroll"]], ["ann_spatial", "an", ["unroll", "vec", "unroll"]]]}, "result": [[0.0008060833999999999], 0, 0.6231439113616943, 1599425911.0905468], "version": 0.2, "tvm_version": "0.7.dev1"}
{"input": ["opencl -keys=mali,opencl,gpu -device=mali -max_num_threads=256", "conv2d_nchw_spatial_pack.mali", [["TENSOR", [1, 88, 38, 38], "float16"], ["TENSOR", [24, 88, 1, 1], "float16"], [1, 1], [0, 0, 0, 0], [1, 1], "float16"], {}], "config": {"index": 256638, "code_hash": null, "entity": [["tile_co", "sp", [-1, 1, 4]], ["tile_oh", "sp", [-1, 1, 2]], ["tile_ow", "sp", [-1, 19, 2]], ["reorder_0", "re", [0, 1, 2, 3, 4, 5, 6, 9, 7, 8]], ["ann_reduce", "an", ["none", "none"]], ["ann_spatial", "an", ["unroll", "unroll", "vec"]]]}, "result": [[0.0009776666], 0, 3.334608793258667, 1599427802.5255628], "version": 0.2, "tvm_version": "0.7.dev1"}
{"input": ["opencl -keys=mali,opencl,gpu -device=mali -max_num_threads=256", "conv2d_nchw_spatial_pack.mali", [["TENSOR", [1, 24, 38, 38], "float16"], ["TENSOR", [96, 24, 1, 1], "float16"], [1, 1], [0, 0, 0, 0], [1, 1], "float16"], {}], "config": {"index": 544049, "code_hash": null, "entity": [["tile_co", "sp", [-1, 4, 8]], ["tile_oh", "sp", [-1, 1, 2]], ["tile_ow", "sp", [-1, 19, 2]], ["reorder_0", "re", [0, 1, 2, 3, 4, 5, 6, 7, 8, 9]], ["ann_reduce", "an", ["none", "unroll"]], ["ann_spatial", "an", ["unroll", "unroll", "vec"]]]}, "result": [[0.0005450728], 0, 3.8489341735839844, 1599431208.724194], "version": 0.2, "tvm_version": "0.7.dev1"}
{"input": ["opencl -keys=mali,opencl,gpu -device=mali -max_num_threads=256", "depthwise_conv2d_nchw.mali", [["TENSOR", [1, 96, 38, 38], "float16"], ["TENSOR", [96, 1, 5, 5], "float16"], [2, 2], [2, 2, 2, 2], [1, 1], "float16"], {}], "config": {"index": 224, "code_hash": null, "entity": [["tile_c", "sp", [-1, 24, 4]], ["tile_y", "sp", [-1, 1, 1]], ["tile_x", "sp", [-1, 19, 1]], ["ann_spatial", "an", ["none", "none", "none"]]]}, "result": [[0.0004053438], 0, 4.5117409229278564, 1599431538.939401], "version": 0.2, "tvm_version": "0.7.dev1"}
{"input": ["opencl -keys=mali,opencl,gpu -device=mali -max_num_threads=256", "dense.mali", [["TENSOR", [1, 96], "float16"], ["TENSOR", [24, 96], "float16"], null, "float16"], {}], "config": {"index": 39, "code_hash": null, "entity": [["tile_y", "sp", [-1, 1, 1]], ["tile_x", "sp", [-1, 2, 2]], ["c_unroll", "sp", [-1, 2]]]}, "result": [[6.960420000000001e-05], 0, 1.871232271194458, 1599431810.464534], "version": 0.2, "tvm_version": "0.7.dev1"}
{"input": ["opencl -keys=mali,opencl,gpu -device=mali -max_num_threads=256", "dense.mali", [["TENSOR", [1, 24], "float16"], ["TENSOR", [96, 24], "float16"], null, "float16"], {}], "config": {"index": 165, "code_hash": null, "entity": [["tile_y", "sp", [-1, 1, 1]], ["tile_x", "sp", [-1, 8, 6]], ["c_unroll", "sp", [-1, 3]]]}, "result": [[6.59062e-05], 0, 1.7169277667999268, 1599432054.1160839], "version": 0.2, "tvm_version": "0.7.dev1"}
{"input": ["opencl -keys=mali,opencl,gpu -device=mali -max_num_threads=256", "conv2d_nchw_spatial_pack.mali", [["TENSOR", [1, 96, 19, 19], "float16"], ["TENSOR", [40, 96, 1, 1], "float16"], [1, 1], [0, 0, 0, 0], [1, 1], "float16"], {}], "config": {"index": 10845, "code_hash": null, "entity": [["tile_co", "sp", [-1, 2, 4]], ["tile_oh", "sp", [-1, 19, 1]], ["tile_ow", "sp", [-1, 1, 1]], ["reorder_0", "re", [0, 1, 2, 3, 4, 5, 6, 7, 8, 9]], ["ann_reduce", "an", ["none", "none"]], ["ann_spatial", "an", ["none", "unroll", "vec"]]]}, "result": [[0.000705427], 0, 2.6680967807769775, 1599432631.538332], "version": 0.2, "tvm_version": "0.7.dev1"}
{"input": ["opencl -keys=mali,opencl,gpu -device=mali -max_num_threads=256", "conv2d_nchw_spatial_pack.mali", [["TENSOR", [1, 240, 19, 19], "float16"], ["TENSOR", [40, 240, 1, 1], "float16"], [1, 1], [0, 0, 0, 0], [1, 1], "float16"], {}], "config": {"index": 22282, "code_hash": null, "entity": [["tile_co", "sp", [-1, 1, 8]], ["tile_oh", "sp", [-1, 19, 1]], ["tile_ow", "sp", [-1, 19, 1]], ["reorder_0", "re", [0, 1, 2, 3, 4, 5, 6, 7, 8, 9]], ["ann_reduce", "an", ["none", "unroll"]], ["ann_spatial", "an", ["unroll", "none", "vec"]]]}, "result": [[0.0014526562], 0, 4.502145051956177, 1599433291.5536928], "version": 0.2, "tvm_version": "0.7.dev1"}
{"input": ["opencl -keys=mali,opencl,gpu -device=mali -max_num_threads=256", "conv2d_nchw_spatial_pack.mali", [["TENSOR", [1, 40, 19, 19], "float16"], ["TENSOR", [120, 40, 1, 1], "float16"], [1, 1], [0, 0, 0, 0], [1, 1], "float16"], {}], "config": {"index": 37393, "code_hash": null, "entity": [["tile_co", "sp", [-1, 30, 4]], ["tile_oh", "sp", [-1, 19, 1]], ["tile_ow", "sp", [-1, 1, 1]], ["reorder_0", "re", [0, 1, 2, 3, 4, 5, 6, 7, 8, 9]], ["ann_reduce", "an", ["unroll", "unroll"]], ["ann_spatial", "an", ["none", "unroll", "vec"]]]}, "result": [[0.0005114792], 0, 2.8037960529327393, 1599434513.864376], "version": 0.2, "tvm_version": "0.7.dev1"}
{"input": ["opencl -keys=mali,opencl,gpu -device=mali -max_num_threads=256", "depthwise_conv2d_nchw.mali", [["TENSOR", [1, 120, 19, 19], "float16"], ["TENSOR", [120, 1, 5, 5], "float16"], [1, 1], [2, 2, 2, 2], [1, 1], "float16"], {}], "config": {"index": 13420, "code_hash": null, "entity": [["tile_c", "sp", [-1, 20, 1]], ["tile_y", "sp", [-1, 1, 19]], ["tile_x", "sp", [-1, 19, 1]], ["ann_spatial", "an", ["vec", "none", "none"]]]}, "result": [[0.000298448], 0, 1.606292486190796, 1599434848.8186398], "version": 0.2, "tvm_version": "0.7.dev1"}
{"input": ["opencl -keys=mali,opencl,gpu -device=mali -max_num_threads=256", "dense.mali", [["TENSOR", [1, 120], "float16"], ["TENSOR", [30, 120], "float16"], null, "float16"], {}], "config": {"index": 300, "code_hash": null, "entity": [["tile_y", "sp", [-1, 1, 1]], ["tile_x", "sp", [-1, 5, 1]], ["c_unroll", "sp", [-1, 24]]]}, "result": [[8.54272e-05], 0, 4.73777174949646, 1599435270.260638], "version": 0.2, "tvm_version": "0.7.dev1"}
{"input": ["opencl -keys=mali,opencl,gpu -device=mali -max_num_threads=256", "dense.mali", [["TENSOR", [1, 30], "float16"], ["TENSOR", [120, 30], "float16"], null, "float16"], {}], "config": {"index": 2, "code_hash": null, "entity": [["tile_y", "sp", [-1, 1, 1]], ["tile_x", "sp", [-1, 3, 1]], ["c_unroll", "sp", [-1, 1]]]}, "result": [[5.6812400000000005e-05], 0, 3.748814821243286, 1599435498.52335], "version": 0.2, "tvm_version": "0.7.dev1"}
{"input": ["opencl -keys=mali,opencl,gpu -device=mali -max_num_threads=256", "conv2d_nchw_spatial_pack.mali", [["TENSOR", [1, 120, 19, 19], "float16"], ["TENSOR", [48, 120, 1, 1], "float16"], [1, 1], [0, 0, 0, 0], [1, 1], "float16"], {}], "config": {"index": 32576, "code_hash": null, "entity": [["tile_co", "sp", [-1, 3, 16]], ["tile_oh", "sp", [-1, 1, 1]], ["tile_ow", "sp", [-1, 19, 1]], ["reorder_0", "re", [0, 1, 2, 3, 4, 5, 6, 7, 8, 9]], ["ann_reduce", "an", ["none", "none"]], ["ann_spatial", "an", ["unroll", "none", "vec"]]]}, "result": [[0.0007802084], 0, 3.749829053878784, 1599436433.6931531], "version": 0.2, "tvm_version": "0.7.dev1"}
{"input": ["opencl -keys=mali,opencl,gpu -device=mali -max_num_threads=256", "conv2d_nchw_spatial_pack.mali", [["TENSOR", [1, 144, 19, 19], "float16"], ["TENSOR", [48, 144, 1, 1], "float16"], [1, 1], [0, 0, 0, 0], [1, 1], "float16"], {}], "config": {"index": 8270, "code_hash": null, "entity": [["tile_co", "sp", [-1, 3, 8]], ["tile_oh", "sp", [-1, 1, 1]], ["tile_ow", "sp", [-1, 19, 1]], ["reorder_0", "re", [0, 1, 2, 3, 4, 5, 6, 7, 8, 9]], ["ann_reduce", "an", ["unroll", "none"]], ["ann_spatial", "an", ["none", "none", "vec"]]]}, "result": [[0.000974271], 0, 3.2591147422790527, 1599437147.150431], "version": 0.2, "tvm_version": "0.7.dev1"}
{"input": ["opencl -keys=mali,opencl,gpu -device=mali -max_num_threads=256", "conv2d_nchw_spatial_pack.mali", [["TENSOR", [1, 48, 19, 19], "float16"], ["TENSOR", [288, 48, 1, 1], "float16"], [1, 1], [0, 0, 0, 0], [1, 1], "float16"], {}], "config": {"index": 120422, "code_hash": null, "entity": [["tile_co", "sp", [-1, 3, 16]], ["tile_oh", "sp", [-1, 19, 1]], ["tile_ow", "sp", [-1, 1, 1]], ["reorder_0", "re", [0, 1, 2, 3, 4, 5, 6, 7, 8, 9]], ["ann_reduce", "an", ["none", "unroll"]], ["ann_spatial", "an", ["unroll", "unroll", "vec"]]]}, "result": [[0.0007096666], 0, 4.342844009399414, 1599437947.41958], "version": 0.2, "tvm_version": "0.7.dev1"}
{"input": ["opencl -keys=mali,opencl,gpu -device=mali -max_num_threads=256", "depthwise_conv2d_nchw.mali", [["TENSOR", [1, 288, 19, 19], "float16"], ["TENSOR", [288, 1, 3, 3], "float16"], [1, 1], [1, 1, 1, 1], [1, 1], "float16"], {}], "config": {"index": 2911, "code_hash": null, "entity": [["tile_c", "sp", [-1, 48, 1]], ["tile_y", "sp", [-1, 1, 19]], ["tile_x", "sp", [-1, 19, 1]], ["ann_spatial", "an", ["none", "none", "vec"]]]}, "result": [[0.0002586978], 0, 0.41808605194091797, 1599438840.972955], "version": 0.2, "tvm_version": "0.7.dev1"}
{"input": ["opencl -keys=mali,opencl,gpu -device=mali -max_num_threads=256", "conv2d_nchw_spatial_pack.mali", [["TENSOR", [1, 288, 19, 19], "float16"], ["TENSOR", [12, 288, 1, 1], "float16"], [1, 1], [0, 0, 0, 0], [1, 1], "float16"], {}], "config": {"index": 13676, "code_hash": null, "entity": [["tile_co", "sp", [-1, 3, 4]], ["tile_oh", "sp", [-1, 1, 1]], ["tile_ow", "sp", [-1, 19, 1]], ["reorder_0", "re", [0, 1, 2, 3, 4, 5, 6, 7, 8, 9]], ["ann_reduce", "an", ["unroll", "none"]], ["ann_spatial", "an", ["unroll", "none", "vec"]]]}, "result": [[0.0015485728], 0, 3.421766757965088, 1599439699.853268], "version": 0.2, "tvm_version": "0.7.dev1"}
