logs/mobilenetv1_gluon_fp32_autotvm_tuning.log
{"input": ["opencl -keys=mali,opencl,gpu -device=mali -max_num_threads=256", "conv2d_nchw_spatial_pack.mali", [["TENSOR", [1, 3, 224, 224], "float32"], ["TENSOR", [32, 3, 3, 3], "float32"], [2, 2], [1, 1, 1, 1], [1, 1], "float32"], {}], "config": {"index": 4654226, "code_hash": null, "entity": [["tile_co", "sp", [-1, 4, 8]], ["tile_oh", "sp", [-1, 8, 1]], ["tile_ow", "sp", [-1, 4, 4]], ["reorder_0", "re", [0, 1, 2, 3, 4, 5, 6, 9, 7, 8]], ["ann_reduce", "an", ["unroll", "none"]], ["ann_spatial", "an", ["unroll", "unroll", "vec"]]]}, "result": [[0.0017693853999999998], 0, 1.7151110172271729, 1595990866.6865659], "version": 0.2, "tvm_version": "0.7.dev1"}
{"input": ["opencl -keys=mali,opencl,gpu -device=mali -max_num_threads=256", "depthwise_conv2d_nchw.mali", [["TENSOR", [1, 32, 112, 112], "float32"], ["TENSOR", [32, 1, 3, 3], "float32"], [1, 1], [1, 1, 1, 1], [1, 1], "float32"], {}], "config": {"index": 344803, "code_hash": null, "entity": [["tile_c", "sp", [-1, 16, 1]], ["tile_y", "sp", [-1, 1, 28]], ["tile_x", "sp", [-1, 8, 1]], ["ann_spatial", "an", ["unroll", "none", "none"]]]}, "result": [[0.0007664480000000001], 0, 1.8791861534118652, 1595992142.996474], "version": 0.2, "tvm_version": "0.7.dev1"}
{"input": ["opencl -keys=mali,opencl,gpu -device=mali -max_num_threads=256", "conv2d_nchw_spatial_pack.mali", [["TENSOR", [1, 32, 112, 112], "float32"], ["TENSOR", [64, 32, 1, 1], "float32"], [1, 1], [0, 0, 0, 0], [1, 1], "float32"], {}], "config": {"index": 2472172, "code_hash": null, "entity": [["tile_co", "sp", [-1, 4, 16]], ["tile_oh", "sp", [-1, 2, 1]], ["tile_ow", "sp", [-1, 8, 7]], ["reorder_0", "re", [0, 1, 2, 3, 4, 5, 6, 9, 7, 8]], ["ann_reduce", "an", ["none", "unroll"]], ["ann_spatial", "an", ["none", "unroll", "vec"]]]}, "result": [[0.0028843022], 0, 1.1215119361877441, 1595995172.366037], "version": 0.2, "tvm_version": "0.7.dev1"}
{"input": ["opencl -keys=mali,opencl,gpu -device=mali -max_num_threads=256", "depthwise_conv2d_nchw.mali", [["TENSOR", [1, 64, 112, 112], "float32"], ["TENSOR", [64, 1, 3, 3], "float32"], [2, 2], [1, 1, 1, 1], [1, 1], "float32"], {}], "config": {"index": 331580, "code_hash": null, "entity": [["tile_c", "sp", [-1, 16, 1]], ["tile_y", "sp", [-1, 1, 8]], ["tile_x", "sp", [-1, 8, 1]], ["ann_spatial", "an", ["unroll", "unroll", "vec"]]]}, "result": [[0.0011008436], 0, 1.5242221355438232, 1595996736.127562], "version": 0.2, "tvm_version": "0.7.dev1"}
{"input": ["opencl -keys=mali,opencl,gpu -device=mali -max_num_threads=256", "conv2d_nchw_spatial_pack.mali", [["TENSOR", [1, 64, 56, 56], "float32"], ["TENSOR", [128, 64, 1, 1], "float32"], [1, 1], [0, 0, 0, 0], [1, 1], "float32"], {}], "config": {"index": 2627093, "code_hash": null, "entity": [["tile_co", "sp", [-1, 8, 16]], ["tile_oh", "sp", [-1, 1, 4]], ["tile_ow", "sp", [-1, 4, 1]], ["reorder_0", "re", [0, 1, 2, 3, 4, 5, 6, 9, 7, 8]], ["ann_reduce", "an", ["none", "none"]], ["ann_spatial", "an", ["unroll", "none", "vec"]]]}, "result": [[0.0016549896000000001], 0, 4.62990403175354, 1595999158.566368], "version": 0.2, "tvm_version": "0.7.dev1"}
{"input": ["opencl -keys=mali,opencl,gpu -device=mali -max_num_threads=256", "depthwise_conv2d_nchw.mali", [["TENSOR", [1, 128, 56, 56], "float32"], ["TENSOR", [128, 1, 3, 3], "float32"], [1, 1], [1, 1, 1, 1], [1, 1], "float32"], {}], "config": {"index": 393773, "code_hash": null, "entity": [["tile_c", "sp", [-1, 32, 1]], ["tile_y", "sp", [-1, 1, 7]], ["tile_x", "sp", [-1, 8, 1]], ["ann_spatial", "an", ["unroll", "unroll", "unroll"]]]}, "result": [[0.000743677], 0, 1.8085060119628906, 1596000103.077474], "version": 0.2, "tvm_version": "0.7.dev1"}
{"input": ["opencl -keys=mali,opencl,gpu -device=mali -max_num_threads=256", "conv2d_nchw_spatial_pack.mali", [["TENSOR", [1, 128, 56, 56], "float32"], ["TENSOR", [128, 128, 1, 1], "float32"], [1, 1], [0, 0, 0, 0], [1, 1], "float32"], {}], "config": {"index": 3476873, "code_hash": null, "entity": [["tile_co", "sp", [-1, 8, 16]], ["tile_oh", "sp", [-1, 2, 2]], ["tile_ow", "sp", [-1, 2, 2]], ["reorder_0", "re", [0, 1, 2, 3, 4, 5, 6, 9, 7, 8]], ["ann_reduce", "an", ["none", "unroll"]], ["ann_spatial", "an", ["unroll", "unroll", "vec"]]]}, "result": [[0.0031578540000000003], 0, 2.653921604156494, 1596002475.9144719], "version": 0.2, "tvm_version": "0.7.dev1"}
{"input": ["opencl -keys=mali,opencl,gpu -device=mali -max_num_threads=256", "depthwise_conv2d_nchw.mali", [["TENSOR", [1, 128, 56, 56], "float32"], ["TENSOR", [128, 1, 3, 3], "float32"], [2, 2], [1, 1, 1, 1], [1, 1], "float32"], {}], "config": {"index": 24853, "code_hash": null, "entity": [["tile_c", "sp", [-1, 32, 2]], ["tile_y", "sp", [-1, 1, 2]], ["tile_x", "sp", [-1, 4, 1]], ["ann_spatial", "an", ["none", "none", "vec"]]]}, "result": [[0.0005631356], 0, 1.3324053287506104, 1596004161.5999172], "version": 0.2, "tvm_version": "0.7.dev1"}
{"input": ["opencl -keys=mali,opencl,gpu -device=mali -max_num_threads=256", "conv2d_nchw_spatial_pack.mali", [["TENSOR", [1, 128, 28, 28], "float32"], ["TENSOR", [256, 128, 1, 1], "float32"], [1, 1], [0, 0, 0, 0], [1, 1], "float32"], {}], "config": {"index": 1270563, "code_hash": null, "entity": [["tile_co", "sp", [-1, 8, 16]], ["tile_oh", "sp", [-1, 1, 4]], ["tile_ow", "sp", [-1, 4, 1]], ["reorder_0", "re", [0, 1, 2, 3, 4, 5, 6, 9, 7, 8]], ["ann_reduce", "an", ["unroll", "unroll"]], ["ann_spatial", "an", ["unroll", "none", "vec"]]]}, "result": [[0.0012212084], 0, 4.434864044189453, 1596005295.600936], "version": 0.2, "tvm_version": "0.7.dev1"}
{"input": ["opencl -keys=mali,opencl,gpu -device=mali -max_num_threads=256", "depthwise_conv2d_nchw.mali", [["TENSOR", [1, 256, 28, 28], "float32"], ["TENSOR", [256, 1, 3, 3], "float32"], [1, 1], [1, 1, 1, 1], [1, 1], "float32"], {}], "config": {"index": 251781, "code_hash": null, "entity": [["tile_c", "sp", [-1, 64, 1]], ["tile_y", "sp", [-1, 1, 14]], ["tile_x", "sp", [-1, 14, 1]], ["ann_spatial", "an", ["vec", "none", "unroll"]]]}, "result": [[0.0004652188], 0, 0.8146758079528809, 1596007569.778933], "version": 0.2, "tvm_version": "0.7.dev1"}
{"input": ["opencl -keys=mali,opencl,gpu -device=mali -max_num_threads=256", "conv2d_nchw_spatial_pack.mali", [["TENSOR", [1, 256, 28, 28], "float32"], ["TENSOR", [256, 256, 1, 1], "float32"], [1, 1], [0, 0, 0, 0], [1, 1], "float32"], {}], "config": {"index": 1626603, "code_hash": null, "entity": [["tile_co", "sp", [-1, 8, 16]], ["tile_oh", "sp", [-1, 4, 1]], ["tile_ow", "sp", [-1, 1, 4]], ["reorder_0", "re", [0, 1, 2, 3, 4, 5, 6, 9, 7, 8]], ["ann_reduce", "an", ["unroll", "unroll"]], ["ann_spatial", "an", ["unroll", "unroll", "vec"]]]}, "result": [[0.0023943022], 0, 3.024617910385132, 1596008591.041125], "version": 0.2, "tvm_version": "0.7.dev1"}
{"input": ["opencl -keys=mali,opencl,gpu -device=mali -max_num_threads=256", "depthwise_conv2d_nchw.mali", [["TENSOR", [1, 256, 28, 28], "float32"], ["TENSOR", [256, 1, 3, 3], "float32"], [2, 2], [1, 1, 1, 1], [1, 1], "float32"], {}], "config": {"index": 12021, "code_hash": null, "entity": [["tile_c", "sp", [-1, 64, 1]], ["tile_y", "sp", [-1, 1, 7]], ["tile_x", "sp", [-1, 7, 1]], ["ann_spatial", "an", ["none", "unroll", "none"]]]}, "result": [[0.0003550416], 0, 6.13735032081604, 1596011319.779407], "version": 0.2, "tvm_version": "0.7.dev1"}
{"input": ["opencl -keys=mali,opencl,gpu -device=mali -max_num_threads=256", "conv2d_nchw_spatial_pack.mali", [["TENSOR", [1, 256, 14, 14], "float32"], ["TENSOR", [512, 256, 1, 1], "float32"], [1, 1], [0, 0, 0, 0], [1, 1], "float32"], {}], "config": {"index": 484636, "code_hash": null, "entity": [["tile_co", "sp", [-1, 16, 8]], ["tile_oh", "sp", [-1, 1, 1]], ["tile_ow", "sp", [-1, 2, 7]], ["reorder_0", "re", [0, 1, 2, 3, 4, 5, 6, 7, 8, 9]], ["ann_reduce", "an", ["unroll", "none"]], ["ann_spatial", "an", ["unroll", "unroll", "vec"]]]}, "result": [[0.0011864376], 0, 1.0033001899719238, 1596011876.048522], "version": 0.2, "tvm_version": "0.7.dev1"}
{"input": ["opencl -keys=mali,opencl,gpu -device=mali -max_num_threads=256", "depthwise_conv2d_nchw.mali", [["TENSOR", [1, 512, 14, 14], "float32"], ["TENSOR", [512, 1, 3, 3], "float32"], [1, 1], [1, 1, 1, 1], [1, 1], "float32"], {}], "config": {"index": 15240, "code_hash": null, "entity": [["tile_c", "sp", [-1, 32, 1]], ["tile_y", "sp", [-1, 2, 7]], ["tile_x", "sp", [-1, 14, 1]], ["ann_spatial", "an", ["none", "unroll", "none"]]]}, "result": [[0.0002541564], 0, 1.0668489933013916, 1596013722.354968], "version": 0.2, "tvm_version": "0.7.dev1"}
{"input": ["opencl -keys=mali,opencl,gpu -device=mali -max_num_threads=256", "conv2d_nchw_spatial_pack.mali", [["TENSOR", [1, 512, 14, 14], "float32"], ["TENSOR", [512, 512, 1, 1], "float32"], [1, 1], [0, 0, 0, 0], [1, 1], "float32"], {}], "config": {"index": 190606, "code_hash": null, "entity": [["tile_co", "sp", [-1, 16, 8]], ["tile_oh", "sp", [-1, 1, 1]], ["tile_ow", "sp", [-1, 2, 7]], ["reorder_0", "re", [0, 1, 2, 3, 4, 5, 6, 7, 8, 9]], ["ann_reduce", "an", ["none", "unroll"]], ["ann_spatial", "an", ["none", "unroll", "vec"]]]}, "result": [[0.0022354792], 0, 5.894600868225098, 1596014457.575219], "version": 0.2, "tvm_version": "0.7.dev1"}
{"input": ["opencl -keys=mali,opencl,gpu -device=mali -max_num_threads=256", "depthwise_conv2d_nchw.mali", [["TENSOR", [1, 512, 14, 14], "float32"], ["TENSOR", [512, 1, 3, 3], "float32"], [2, 2], [1, 1, 1, 1], [1, 1], "float32"], {}], "config": {"index": 4643, "code_hash": null, "entity": [["tile_c", "sp", [-1, 16, 4]], ["tile_y", "sp", [-1, 1, 1]], ["tile_x", "sp", [-1, 7, 1]], ["ann_spatial", "an", ["unroll", "none", "unroll"]]]}, "result": [[0.0002311666], 0, 2.567387104034424, 1596016519.174706], "version": 0.2, "tvm_version": "0.7.dev1"}
{"input": ["opencl -keys=mali,opencl,gpu -device=mali -max_num_threads=256", "conv2d_nchw_spatial_pack.mali", [["TENSOR", [1, 512, 7, 7], "float32"], ["TENSOR", [1024, 512, 1, 1], "float32"], [1, 1], [0, 0, 0, 0], [1, 1], "float32"], {}], "config": {"index": 24786, "code_hash": null, "entity": [["tile_co", "sp", [-1, 64, 8]], ["tile_oh", "sp", [-1, 1, 1]], ["tile_ow", "sp", [-1, 1, 7]], ["reorder_0", "re", [0, 1, 2, 3, 4, 5, 6, 9, 7, 8]], ["ann_reduce", "an", ["none", "none"]], ["ann_spatial", "an", ["none", "unroll", "vec"]]]}, "result": [[0.0013806042], 0, 5.936729192733765, 1596017021.8997152], "version": 0.2, "tvm_version": "0.7.dev1"}
{"input": ["opencl -keys=mali,opencl,gpu -device=mali -max_num_threads=256", "depthwise_conv2d_nchw.mali", [["TENSOR", [1, 1024, 7, 7], "float32"], ["TENSOR", [1024, 1, 3, 3], "float32"], [1, 1], [1, 1, 1, 1], [1, 1], "float32"], {}], "config": {"index": 930, "code_hash": null, "entity": [["tile_c", "sp", [-1, 64, 1]], ["tile_y", "sp", [-1, 1, 7]], ["tile_x", "sp", [-1, 7, 1]], ["ann_spatial", "an", ["none", "none", "unroll"]]]}, "result": [[0.000222948], 0, 2.6368231773376465, 1596018020.391398], "version": 0.2, "tvm_version": "0.7.dev1"}
{"input": ["opencl -keys=mali,opencl,gpu -device=mali -max_num_threads=256", "conv2d_nchw_spatial_pack.mali", [["TENSOR", [1, 1024, 7, 7], "float32"], ["TENSOR", [1024, 1024, 1, 1], "float32"], [1, 1], [0, 0, 0, 0], [1, 1], "float32"], {}], "config": {"index": 61943, "code_hash": null, "entity": [["tile_co", "sp", [-1, 32, 8]], ["tile_oh", "sp", [-1, 1, 7]], ["tile_ow", "sp", [-1, 1, 1]], ["reorder_0", "re", [0, 1, 2, 3, 4, 5, 6, 7, 8, 9]], ["ann_reduce", "an", ["none", "none"]], ["ann_spatial", "an", ["unroll", "unroll", "vec"]]]}, "result": [[0.0027356042], 0, 1.0431442260742188, 1596019088.8727932], "version": 0.2, "tvm_version": "0.7.dev1"}
{"input": ["opencl -keys=mali,opencl,gpu -device=mali -max_num_threads=256", "dense.mali", [["TENSOR", [1, 1024], "float32"], ["TENSOR", [1000, 1024], "float32"], null, "float32"], {}], "config": {"index": 604, "code_hash": null, "entity": [["tile_y", "sp", [-1, 1, 1]], ["tile_x", "sp", [-1, 8, 1]], ["c_unroll", "sp", [-1, 64]]]}, "result": [[0.0006086145999999999], 0, 1.621978998184204, 1596019578.3346071], "version": 0.2, "tvm_version": "0.7.dev1"}
