logs/mxnet_vgg16.texture.float16.acc16.autotvm.log
{"input": ["opencl -keys=adreno,opencl,gpu -device=adreno -max_num_threads=256", "conv2d_nchw_winograd.image2d", [["TENSOR", [1, 3, 224, 224], "float16"], ["TENSOR", [64, 3, 3, 3], "float16"], [1, 1], [1, 1, 1, 1], [1, 1], "float16"], {}], "config": {"index": 159, "code_hash": null, "entity": [["auto_unroll_max_step", "ot", 0], ["tile_y", "sp", [-1, 4, 4]], ["tile_x", "sp", [-1, 8, 14]], ["tile_rc", "sp", [-1, 1]]]}, "result": [[0.0041793520800000004], 0, 11.613495826721191, 1653722661.8790236], "version": 0.2, "tvm_version": "0.8.dev0"}
{"input": ["opencl -keys=adreno,opencl,gpu -device=adreno -max_num_threads=256", "conv2d_nchw_winograd.image2d", [["TENSOR", [1, 64, 224, 224], "float16"], ["TENSOR", [64, 64, 3, 3], "float16"], [1, 1], [1, 1, 1, 1], [1, 1], "float16"], {}], "config": {"index": 1249, "code_hash": null, "entity": [["auto_unroll_max_step", "ot", 4], ["tile_y", "sp", [-1, 1, 16]], ["tile_x", "sp", [-1, 7, 4]], ["tile_rc", "sp", [-1, 4]]]}, "result": [[0.01218280624], 0, 18.260064601898193, 1653725087.855359], "version": 0.2, "tvm_version": "0.8.dev0"}
{"input": ["opencl -keys=adreno,opencl,gpu -device=adreno -max_num_threads=256", "conv2d_nchw_winograd.image2d", [["TENSOR", [1, 64, 112, 112], "float16"], ["TENSOR", [128, 64, 3, 3], "float16"], [1, 1], [1, 1, 1, 1], [1, 1], "float16"], {}], "config": {"index": 1601, "code_hash": null, "entity": [["auto_unroll_max_step", "ot", 16], ["tile_y", "sp", [-1, 1, 32]], ["tile_x", "sp", [-1, 7, 2]], ["tile_rc", "sp", [-1, 8]]]}, "result": [[0.00472422394], 0, 7.353840589523315, 1653728280.6645174], "version": 0.2, "tvm_version": "0.8.dev0"}
{"input": ["opencl -keys=adreno,opencl,gpu -device=adreno -max_num_threads=256", "conv2d_nchw_winograd.image2d", [["TENSOR", [1, 128, 112, 112], "float16"], ["TENSOR", [128, 128, 3, 3], "float16"], [1, 1], [1, 1, 1, 1], [1, 1], "float16"], {}], "config": {"index": 2125, "code_hash": null, "entity": [["auto_unroll_max_step", "ot", 4], ["tile_y", "sp", [-1, 1, 32]], ["tile_x", "sp", [-1, 7, 2]], ["tile_rc", "sp", [-1, 16]]]}, "result": [[0.0070356156199999995], 0, 18.044188022613525, 1653730169.711129], "version": 0.2, "tvm_version": "0.8.dev0"}
{"input": ["opencl -keys=adreno,opencl,gpu -device=adreno -max_num_threads=256", "conv2d_nchw_winograd.image2d", [["TENSOR", [1, 128, 56, 56], "float16"], ["TENSOR", [256, 128, 3, 3], "float16"], [1, 1], [1, 1, 1, 1], [1, 1], "float16"], {}], "config": {"index": 293, "code_hash": null, "entity": [["auto_unroll_max_step", "ot", 16], ["tile_y", "sp", [-1, 1, 64]], ["tile_x", "sp", [-1, 7, 1]], ["tile_rc", "sp", [-1, 2]]]}, "result": [[0.0031059166599999998], 0, 6.523327350616455, 1653734329.9814181], "version": 0.2, "tvm_version": "0.8.dev0"}
{"input": ["opencl -keys=adreno,opencl,gpu -device=adreno -max_num_threads=256", "conv2d_nchw_winograd.image2d", [["TENSOR", [1, 256, 56, 56], "float16"], ["TENSOR", [256, 256, 3, 3], "float16"], [1, 1], [1, 1, 1, 1], [1, 1], "float16"], {}], "config": {"index": 1180, "code_hash": null, "entity": [["auto_unroll_max_step", "ot", 4], ["tile_y", "sp", [-1, 8, 8]], ["tile_x", "sp", [-1, 4, 7]], ["tile_rc", "sp", [-1, 16]]]}, "result": [[0.00511893646], 0, 11.390685081481934, 1653736846.250563], "version": 0.2, "tvm_version": "0.8.dev0"}
{"input": ["opencl -keys=adreno,opencl,gpu -device=adreno -max_num_threads=256", "conv2d_nchw_winograd.image2d", [["TENSOR", [1, 256, 28, 28], "float16"], ["TENSOR", [512, 256, 3, 3], "float16"], [1, 1], [1, 1, 1, 1], [1, 1], "float16"], {}], "config": {"index": 1392, "code_hash": null, "entity": [["auto_unroll_max_step", "ot", 0], ["tile_y", "sp", [-1, 1, 64]], ["tile_x", "sp", [-1, 7, 1]], ["tile_rc", "sp", [-1, 16]]]}, "result": [[0.00360053334], 0, 5.937389612197876, 1653738978.3717701], "version": 0.2, "tvm_version": "0.8.dev0"}
{"input": ["opencl -keys=adreno,opencl,gpu -device=adreno -max_num_threads=256", "conv2d_nchw_winograd.image2d", [["TENSOR", [1, 512, 28, 28], "float16"], ["TENSOR", [512, 512, 3, 3], "float16"], [1, 1], [1, 1, 1, 1], [1, 1], "float16"], {}], "config": {"index": 2447, "code_hash": null, "entity": [["auto_unroll_max_step", "ot", 16], ["tile_y", "sp", [-1, 1, 64]], ["tile_x", "sp", [-1, 7, 2]], ["tile_rc", "sp", [-1, 128]]]}, "result": [[0.00628889168], 0, 8.82021975517273, 1653741369.779014], "version": 0.2, "tvm_version": "0.8.dev0"}
{"input": ["opencl -keys=adreno,opencl,gpu -device=adreno -max_num_threads=256", "conv2d_nchw_winograd.image2d", [["TENSOR", [1, 512, 14, 14], "float16"], ["TENSOR", [512, 512, 3, 3], "float16"], [1, 1], [1, 1, 1, 1], [1, 1], "float16"], {}], "config": {"index": 11, "code_hash": null, "entity": [["auto_unroll_max_step", "ot", 16], ["tile_y", "sp", [-1, 1, 64]], ["tile_x", "sp", [-1, 7, 1]], ["tile_rc", "sp", [-1, 1]]]}, "result": [[0.00215308126], 0, 5.852464914321899, 1653742961.7416945], "version": 0.2, "tvm_version": "0.8.dev0"}
{"input": ["opencl -keys=adreno,opencl,gpu -device=adreno -max_num_threads=256", "dense_small_batch.cuda", [["TENSOR", [1, 4096], "float16"], ["TENSOR", [4096, 4096], "float16"], null, "float16"], {}], "config": {"index": 6, "code_hash": null, "entity": [["tile_k", "sp", [-1, 64]]]}, "result": [[0.0016156812600000002], 0, 11.888248920440674, 1653744869.3840475], "version": 0.2, "tvm_version": "0.8.dev0"}
{"input": ["opencl -keys=adreno,opencl,gpu -device=adreno -max_num_threads=256", "dense_small_batch.cuda", [["TENSOR", [1, 4096], "float16"], ["TENSOR", [1000, 4096], "float16"], null, "float16"], {}], "config": {"index": 6, "code_hash": null, "entity": [["tile_k", "sp", [-1, 64]]]}, "result": [[0.00048826771999999996], 0, 2.9351372718811035, 1653744912.3751776], "version": 0.2, "tvm_version": "0.8.dev0"}
{"input": ["opencl -keys=adreno,opencl,gpu -device=adreno -max_num_threads=256", "conv2d_nchwc.image2d", [["TENSOR", [1, 3, 224, 224], "float16"], ["TENSOR", [64, 3, 3, 3], "float16"], [1, 1], [1, 1, 1, 1], [1, 1], "float16"], {}], "config": {"index": 25269, "code_hash": null, "entity": [["tile_fc", "sp", [-1, 1, 8]], ["tile_y", "sp", [-1, 4, 1]], ["tile_x", "sp", [-1, 2, 16]], ["tile_rcc", "sp", [-1, 1]], ["tile_ry", "sp", [-1, 3]], ["tile_rx", "sp", [-1, 3]], ["auto_unroll_max_step", "ot", 0], ["unroll_explicit", "ot", 0]]}, "result": [[0.00067904792], 0, 2.7798421382904053, 1645465327.0268586], "version": 0.2, "tvm_version": "0.8.dev0"}
{"input": ["opencl -keys=adreno,opencl,gpu -device=adreno -max_num_threads=256", "conv2d_nchwc.image2d", [["TENSOR", [1, 64, 224, 224], "float16"], ["TENSOR", [64, 64, 3, 3], "float16"], [1, 1], [1, 1, 1, 1], [1, 1], "float16"], {}], "config": {"index": 290585, "code_hash": null, "entity": [["tile_fc", "sp", [-1, 2, 8]], ["tile_y", "sp", [-1, 2, 8]], ["tile_x", "sp", [-1, 4, 2]], ["tile_rcc", "sp", [-1, 1]], ["tile_ry", "sp", [-1, 3]], ["tile_rx", "sp", [-1, 1]], ["auto_unroll_max_step", "ot", 1500], ["unroll_explicit", "ot", 0]]}, "result": [[0.007579818760000001], 0, 4.87307333946228, 1645469290.048814], "version": 0.2, "tvm_version": "0.8.dev0"}
{"input": ["opencl -keys=adreno,opencl,gpu -device=adreno -max_num_threads=256", "conv2d_nchwc.image2d", [["TENSOR", [1, 64, 112, 112], "float16"], ["TENSOR", [128, 64, 3, 3], "float16"], [1, 1], [1, 1, 1, 1], [1, 1], "float16"], {}], "config": {"index": 428202, "code_hash": null, "entity": [["tile_fc", "sp", [-1, 2, 8]], ["tile_y", "sp", [-1, 8, 2]], ["tile_x", "sp", [-1, 1, 8]], ["tile_rcc", "sp", [-1, 16]], ["tile_ry", "sp", [-1, 3]], ["tile_rx", "sp", [-1, 3]], ["auto_unroll_max_step", "ot", 1500], ["unroll_explicit", "ot", 0]]}, "result": [[0.0036470791600000003], 0, 6.4646570682525635, 1645474388.247919], "version": 0.2, "tvm_version": "0.8.dev0"}
{"input": ["opencl -keys=adreno,opencl,gpu -device=adreno -max_num_threads=256", "conv2d_nchwc.image2d", [["TENSOR", [1, 128, 112, 112], "float16"], ["TENSOR", [128, 128, 3, 3], "float16"], [1, 1], [1, 1, 1, 1], [1, 1], "float16"], {}], "config": {"index": 388365, "code_hash": null, "entity": [["tile_fc", "sp", [-1, 2, 8]], ["tile_y", "sp", [-1, 1, 16]], ["tile_x", "sp", [-1, 7, 1]], ["tile_rcc", "sp", [-1, 1]], ["tile_ry", "sp", [-1, 3]], ["tile_rx", "sp", [-1, 1]], ["auto_unroll_max_step", "ot", 1500], ["unroll_explicit", "ot", 0]]}, "result": [[0.00660052604], 0, 3.637066125869751, 1645477570.656515], "version": 0.2, "tvm_version": "0.8.dev0"}
{"input": ["opencl -keys=adreno,opencl,gpu -device=adreno -max_num_threads=256", "conv2d_nchwc.image2d", [["TENSOR", [1, 128, 56, 56], "float16"], ["TENSOR", [256, 128, 3, 3], "float16"], [1, 1], [1, 1, 1, 1], [1, 1], "float16"], {}], "config": {"index": 230294, "code_hash": null, "entity": [["tile_fc", "sp", [-1, 1, 16]], ["tile_y", "sp", [-1, 1, 1]], ["tile_x", "sp", [-1, 7, 8]], ["tile_rcc", "sp", [-1, 1]], ["tile_ry", "sp", [-1, 3]], ["tile_rx", "sp", [-1, 3]], ["auto_unroll_max_step", "ot", 512], ["unroll_explicit", "ot", 0]]}, "result": [[0.0040725198], 0, 2.1854090690612793, 1645482041.5433812], "version": 0.2, "tvm_version": "0.8.dev0"}
{"input": ["opencl -keys=adreno,opencl,gpu -device=adreno -max_num_threads=256", "conv2d_nchwc.image2d", [["TENSOR", [1, 256, 56, 56], "float16"], ["TENSOR", [256, 256, 3, 3], "float16"], [1, 1], [1, 1, 1, 1], [1, 1], "float16"], {}], "config": {"index": 39512, "code_hash": null, "entity": [["tile_fc", "sp", [-1, 2, 32]], ["tile_y", "sp", [-1, 1, 8]], ["tile_x", "sp", [-1, 7, 2]], ["tile_rcc", "sp", [-1, 1]], ["tile_ry", "sp", [-1, 3]], ["tile_rx", "sp", [-1, 1]], ["auto_unroll_max_step", "ot", 0], ["unroll_explicit", "ot", 0]]}, "result": [[0.00692729582], 0, 3.48588490486145, 1645486314.8982074], "version": 0.2, "tvm_version": "0.8.dev0"}
{"input": ["opencl -keys=adreno,opencl,gpu -device=adreno -max_num_threads=256", "conv2d_nchwc.image2d", [["TENSOR", [1, 256, 28, 28], "float16"], ["TENSOR", [512, 256, 3, 3], "float16"], [1, 1], [1, 1, 1, 1], [1, 1], "float16"], {}], "config": {"index": 22098, "code_hash": null, "entity": [["tile_fc", "sp", [-1, 2, 4]], ["tile_y", "sp", [-1, 4, 1]], ["tile_x", "sp", [-1, 2, 14]], ["tile_rcc", "sp", [-1, 1]], ["tile_ry", "sp", [-1, 3]], ["tile_rx", "sp", [-1, 1]], ["auto_unroll_max_step", "ot", 0], ["unroll_explicit", "ot", 0]]}, "result": [[0.0044675], 0, 2.644033193588257, 1645488316.942785], "version": 0.2, "tvm_version": "0.8.dev0"}
{"input": ["opencl -keys=adreno,opencl,gpu -device=adreno -max_num_threads=256", "conv2d_nchwc.image2d", [["TENSOR", [1, 512, 28, 28], "float16"], ["TENSOR", [512, 512, 3, 3], "float16"], [1, 1], [1, 1, 1, 1], [1, 1], "float16"], {}], "config": {"index": 136058, "code_hash": null, "entity": [["tile_fc", "sp", [-1, 2, 16]], ["tile_y", "sp", [-1, 7, 1]], ["tile_x", "sp", [-1, 1, 14]], ["tile_rcc", "sp", [-1, 1]], ["tile_ry", "sp", [-1, 1]], ["tile_rx", "sp", [-1, 3]], ["auto_unroll_max_step", "ot", 512], ["unroll_explicit", "ot", 0]]}, "result": [[0.0091007177], 0, 4.027546644210815, 1645490507.180074], "version": 0.2, "tvm_version": "0.8.dev0"}
{"input": ["opencl -keys=adreno,opencl,gpu -device=adreno -max_num_threads=256", "conv2d_nchwc.image2d", [["TENSOR", [1, 512, 14, 14], "float16"], ["TENSOR", [512, 512, 3, 3], "float16"], [1, 1], [1, 1, 1, 1], [1, 1], "float16"], {}], "config": {"index": 48462, "code_hash": null, "entity": [["tile_fc", "sp", [-1, 1, 32]], ["tile_y", "sp", [-1, 8, 2]], ["tile_x", "sp", [-1, 1, 4]], ["tile_rcc", "sp", [-1, 2]], ["tile_ry", "sp", [-1, 1]], ["tile_rx", "sp", [-1, 3]], ["auto_unroll_max_step", "ot", 0], ["unroll_explicit", "ot", 0]]}, "result": [[0.0034431395800000003], 0, 2.573481559753418, 1645495381.8848968], "version": 0.2, "tvm_version": "0.8.dev0"}
