logs/resnet50.float16.autotvm.log
{"input": ["opencl -keys=mali,opencl,gpu -device=mali -max_num_threads=256", "conv2d_nchw_spatial_pack.mali", [["TENSOR", [1, 1024, 14, 14], "float32"], ["TENSOR", [2048, 1024, 1, 1], "float32"], [2, 2], [0, 0, 0, 0], [1, 1], "float32"], {}], "config": {"index": 41148, "code_hash": null, "entity": [["tile_co", "sp", [-1, 1, 16]], ["tile_oh", "sp", [-1, 1, 7]], ["tile_ow", "sp", [-1, 7, 1]], ["reorder_0", "re", [0, 1, 2, 3, 4, 5, 6, 7, 8, 9]], ["ann_reduce", "an", ["none", "unroll"]], ["ann_spatial", "an", ["none", "vec", "unroll"]]]}, "result": [[0.097647125], 0, 2.3377525806427, 1598457430.8419368], "version": 0.2, "tvm_version": "0.7.dev1"}
{"input": ["opencl -keys=mali,opencl,gpu -device=mali -max_num_threads=256", "conv2d_nchw_spatial_pack.mali", [["TENSOR", [1, 1024, 14, 14], "float32"], ["TENSOR", [2048, 1024, 1, 1], "float32"], [2, 2], [0, 0, 0, 0], [1, 1], "float32"], {}], "config": {"index": 105184, "code_hash": null, "entity": [["tile_co", "sp", [-1, 128, 8]], ["tile_oh", "sp", [-1, 7, 1]], ["tile_ow", "sp", [-1, 1, 7]], ["reorder_0", "re", [0, 1, 2, 3, 4, 5, 6, 9, 7, 8]], ["ann_reduce", "an", ["unroll", "none"]], ["ann_spatial", "an", ["vec", "unroll", "none"]]]}, "result": [[0.4337970416], 0, 9.845290184020996, 1598457438.363956], "version": 0.2, "tvm_version": "0.7.dev1"}
{"input": ["opencl -keys=mali,opencl,gpu -device=mali -max_num_threads=256", "conv2d_nchw_spatial_pack.mali", [["TENSOR", [1, 1024, 14, 14], "float32"], ["TENSOR", [2048, 1024, 1, 1], "float32"], [2, 2], [0, 0, 0, 0], [1, 1], "float32"], {}], "config": {"index": 73498, "code_hash": null, "entity": [["tile_co", "sp", [-1, 1024, 2]], ["tile_oh", "sp", [-1, 1, 1]], ["tile_ow", "sp", [-1, 1, 7]], ["reorder_0", "re", [0, 1, 2, 3, 4, 5, 6, 7, 8, 9]], ["ann_reduce", "an", ["none", "none"]], ["ann_spatial", "an", ["unroll", "unroll", "vec"]]]}, "result": [[0.0183658854], 0, 10.681733846664429, 1598457439.202141], "version": 0.2, "tvm_version": "0.7.dev1"}
{"input": ["opencl -keys=mali,opencl,gpu -device=mali -max_num_threads=256", "conv2d_nchw_spatial_pack.mali", [["TENSOR", [1, 1024, 14, 14], "float32"], ["TENSOR", [2048, 1024, 1, 1], "float32"], [2, 2], [0, 0, 0, 0], [1, 1], "float32"], {}], "config": {"index": 81890, "code_hash": null, "entity": [["tile_co", "sp", [-1, 1, 256]], ["tile_oh", "sp", [-1, 1, 7]], ["tile_ow", "sp", [-1, 7, 1]], ["reorder_0", "re", [0, 1, 2, 3, 4, 5, 6, 7, 8, 9]], ["ann_reduce", "an", ["unroll", "none"]], ["ann_spatial", "an", ["unroll", "vec", "none"]]]}, "result": [[0.495457708], 0, 19.18147587776184, 1598457447.700882], "version": 0.2, "tvm_version": "0.7.dev1"}
{"input": ["opencl -keys=mali,opencl,gpu -device=mali -max_num_threads=256", "conv2d_nchw_spatial_pack.mali", [["TENSOR", [1, 1024, 14, 14], "float32"], ["TENSOR", [2048, 1024, 1, 1], "float32"], [2, 2], [0, 0, 0, 0], [1, 1], "float32"], {}], "config": {"index": 91059, "code_hash": null, "entity": [["tile_co", "sp", [-1, 1, 8]], ["tile_oh", "sp", [-1, 1, 1]], ["tile_ow", "sp", [-1, 1, 7]], ["reorder_0", "re", [0, 1, 2, 3, 4, 5, 6, 9, 7, 8]], ["ann_reduce", "an", ["none", "none"]], ["ann_spatial", "an", ["vec", "none", "none"]]]}, "result": [[0.3084686768], 0, 24.728816270828247, 1598457453.262641], "version": 0.2, "tvm_version": "0.7.dev1"}
{"input": ["opencl -keys=mali,opencl,gpu -device=mali -max_num_threads=256", "conv2d_nchw_spatial_pack.mali", [["TENSOR", [1, 1024, 14, 14], "float32"], ["TENSOR", [2048, 1024, 1, 1], "float32"], [2, 2], [0, 0, 0, 0], [1, 1], "float32"], {}], "config": {"index": 43082, "code_hash": null, "entity": [["tile_co", "sp", [-1, 8, 4]], ["tile_oh", "sp", [-1, 1, 1]], ["tile_ow", "sp", [-1, 7, 1]], ["reorder_0", "re", [0, 1, 2, 3, 4, 5, 6, 9, 7, 8]], ["ann_reduce", "an", ["unroll", "none"]], ["ann_spatial", "an", ["none", "vec", "unroll"]]]}, "result": [[0.0176589376], 0, 25.530427932739258, 1598457454.0792031], "version": 0.2, "tvm_version": "0.7.dev1"}
{"input": ["opencl -keys=mali,opencl,gpu -device=mali -max_num_threads=256", "conv2d_nchw_spatial_pack.mali", [["TENSOR", [1, 1024, 14, 14], "float32"], ["TENSOR", [2048, 1024, 1, 1], "float32"], [2, 2], [0, 0, 0, 0], [1, 1], "float32"], {}], "config": {"index": 70626, "code_hash": null, "entity": [["tile_co", "sp", [-1, 8, 8]], ["tile_oh", "sp", [-1, 1, 7]], ["tile_ow", "sp", [-1, 7, 1]], ["reorder_0", "re", [0, 1, 2, 3, 4, 5, 6, 7, 8, 9]], ["ann_reduce", "an", ["unroll", "none"]], ["ann_spatial", "an", ["unroll", "unroll", "unroll"]]]}, "result": [[0.0131614686], 0, 26.365539073944092, 1598457454.904843], "version": 0.2, "tvm_version": "0.7.dev1"}
{"input": ["opencl -keys=mali,opencl,gpu -device=mali -max_num_threads=256", "conv2d_nchw_spatial_pack.mali", [["TENSOR", [1, 1024, 14, 14], "float32"], ["TENSOR", [2048, 1024, 1, 1], "float32"], [2, 2], [0, 0, 0, 0], [1, 1], "float32"], {}], "config": {"index": 66723, "code_hash": null, "entity": [["tile_co", "sp", [-1, 1, 8]], ["tile_oh", "sp", [-1, 1, 1]], ["tile_ow", "sp", [-1, 1, 1]], ["reorder_0", "re", [0, 1, 2, 3, 4, 5, 6, 9, 7, 8]], ["ann_reduce", "an", ["unroll", "unroll"]], ["ann_spatial", "an", ["unroll", "unroll", "none"]]]}, "result": [[0.341877979], 0, 32.39596915245056, 1598457460.945703], "version": 0.2, "tvm_version": "0.7.dev1"}
{"input": ["opencl -keys=mali,opencl,gpu -device=mali -max_num_threads=256", "conv2d_nchw_spatial_pack.mali", [["TENSOR", [1, 1024, 14, 14], "float32"], ["TENSOR", [2048, 1024, 1, 1], "float32"], [2, 2], [0, 0, 0, 0], [1, 1], "float32"], {}], "config": {"index": 30030, "code_hash": null, "entity": [["tile_co", "sp", [-1, 1, 1]], ["tile_oh", "sp", [-1, 7, 1]], ["tile_ow", "sp", [-1, 1, 7]], ["reorder_0", "re", [0, 1, 2, 3, 4, 5, 6, 7, 8, 9]], ["ann_reduce", "an", ["none", "unroll"]], ["ann_spatial", "an", ["none", "unroll", "vec"]]]}, "result": [[0.039438062600000004], 0, 33.55842423439026, 1598457462.111878], "version": 0.2, "tvm_version": "0.7.dev1"}
{"input": ["opencl -keys=mali,opencl,gpu -device=mali -max_num_threads=256", "conv2d_nchw_spatial_pack.mali", [["TENSOR", [1, 1024, 14, 14], "float32"], ["TENSOR", [2048, 1024, 1, 1], "float32"], [2, 2], [0, 0, 0, 0], [1, 1], "float32"], {}], "config": {"index": 18298, "code_hash": null, "entity": [["tile_co", "sp", [-1, 16, 16]], ["tile_oh", "sp", [-1, 1, 1]], ["tile_ow", "sp", [-1, 1, 1]], ["reorder_0", "re", [0, 1, 2, 3, 4, 5, 6, 7, 8, 9]], ["ann_reduce", "an", ["none", "unroll"]], ["ann_spatial", "an", ["none", "unroll", "none"]]]}, "result": [[0.1169011042], 0, 35.961400747299194, 1598457464.52191], "version": 0.2, "tvm_version": "0.7.dev1"}
{"input": ["opencl -keys=mali,opencl,gpu -device=mali -max_num_threads=256", "conv2d_nchw_spatial_pack.mali", [["TENSOR", [1, 1024, 14, 14], "float32"], ["TENSOR", [2048, 1024, 1, 1], "float32"], [2, 2], [0, 0, 0, 0], [1, 1], "float32"], {}], "config": {"index": 97377, "code_hash": null, "entity": [["tile_co", "sp", [-1, 1, 8]], ["tile_oh", "sp", [-1, 1, 1]], ["tile_ow", "sp", [-1, 1, 7]], ["reorder_0", "re", [0, 1, 2, 3, 4, 5, 6, 7, 8, 9]], ["ann_reduce", "an", ["none", "unroll"]], ["ann_spatial", "an", ["vec", "none", "unroll"]]]}, "result": [[0.4604068644], 0, 7.8962929248809814, 1598457472.6670778], "version": 0.2, "tvm_version": "0.7.dev1"}
{"input": ["opencl -keys=mali,opencl,gpu -device=mali -max_num_threads=256", "conv2d_nchw_spatial_pack.mali", [["TENSOR", [1, 1024, 14, 14], "float32"], ["TENSOR", [2048, 1024, 1, 1], "float32"], [2, 2], [0, 0, 0, 0], [1, 1], "float32"], {}], "config": {"index": 103966, "code_hash": null, "entity": [["tile_co", "sp", [-1, 4, 256]], ["tile_oh", "sp", [-1, 1, 1]], ["tile_ow", "sp", [-1, 1, 1]], ["reorder_0", "re", [0, 1, 2, 3, 4, 5, 6, 7, 8, 9]], ["ann_reduce", "an", ["unroll", "none"]], ["ann_spatial", "an", ["vec", "unroll", "none"]]]}, "result": [[0.1957429582], 0, 11.637750387191772, 1598457476.414369], "version": 0.2, "tvm_version": "0.7.dev1"}
{"input": ["opencl -keys=mali,opencl,gpu -device=mali -max_num_threads=256", "conv2d_nchw_spatial_pack.mali", [["TENSOR", [1, 1024, 14, 14], "float32"], ["TENSOR", [2048, 1024, 1, 1], "float32"], [2, 2], [0, 0, 0, 0], [1, 1], "float32"], {}], "config": {"index": 87468, "code_hash": null, "entity": [["tile_co", "sp", [-1, 128, 4]], ["tile_oh", "sp", [-1, 1, 7]], ["tile_ow", "sp", [-1, 7, 1]], ["reorder_0", "re", [0, 1, 2, 3, 4, 5, 6, 7, 8, 9]], ["ann_reduce", "an", ["unroll", "none"]], ["ann_spatial", "an", ["unroll", "vec", "unroll"]]]}, "result": [[0.0193781978], 0, 12.541010618209839, 1598457477.3147619], "version": 0.2, "tvm_version": "0.7.dev1"}
{"input": ["opencl -keys=mali,opencl,gpu -device=mali -max_num_threads=256", "conv2d_nchw_spatial_pack.mali", [["TENSOR", [1, 1024, 14, 14], "float32"], ["TENSOR", [2048, 1024, 1, 1], "float32"], [2, 2], [0, 0, 0, 0], [1, 1], "float32"], {}], "config": {"index": 55188, "code_hash": null, "entity": [["tile_co", "sp", [-1, 1, 16]], ["tile_oh", "sp", [-1, 1, 7]], ["tile_ow", "sp", [-1, 7, 1]], ["reorder_0", "re", [0, 1, 2, 3, 4, 5, 6, 7, 8, 9]], ["ann_reduce", "an", ["unroll", "unroll"]], ["ann_spatial", "an", ["unroll", "none", "unroll"]]]}, "result": [[0.0530795], 0, 14.101470470428467, 1598457478.865865], "version": 0.2, "tvm_version": "0.7.dev1"}
{"input": ["opencl -keys=mali,opencl,gpu -device=mali -max_num_threads=256", "conv2d_nchw_spatial_pack.mali", [["TENSOR", [1, 1024, 14, 14], "float32"], ["TENSOR", [2048, 1024, 1, 1], "float32"], [2, 2], [0, 0, 0, 0], [1, 1], "float32"], {}], "config": {"index": 48040, "code_hash": null, "entity": [["tile_co", "sp", [-1, 4, 256]], ["tile_oh", "sp", [-1, 1, 1]], ["tile_ow", "sp", [-1, 7, 1]], ["reorder_0", "re", [0, 1, 2, 3, 4, 5, 6, 7, 8, 9]], ["ann_reduce", "an", ["unroll", "none"]], ["ann_spatial", "an", ["unroll", "none", "none"]]]}, "result": [[0.1151695], 0, 16.53693389892578, 1598457481.326781], "version": 0.2, "tvm_version": "0.7.dev1"}
{"input": ["opencl -keys=mali,opencl,gpu -device=mali -max_num_threads=256", "conv2d_nchw_spatial_pack.mali", [["TENSOR", [1, 1024, 14, 14], "float32"], ["TENSOR", [2048, 1024, 1, 1], "float32"], [2, 2], [0, 0, 0, 0], [1, 1], "float32"], {}], "config": {"index": 34451, "code_hash": null, "entity": [["tile_co", "sp", [-1, 8, 32]], ["tile_oh", "sp", [-1, 1, 1]], ["tile_ow", "sp", [-1, 1, 1]], ["reorder_0", "re", [0, 1, 2, 3, 4, 5, 6, 9, 7, 8]], ["ann_reduce", "an", ["none", "none"]], ["ann_spatial", "an", ["none", "vec", "none"]]]}, "result": [[0.1760336666], 0, 19.92249894142151, 1598457484.7149398], "version": 0.2, "tvm_version": "0.7.dev1"}
{"input": ["opencl -keys=mali,opencl,gpu -device=mali -max_num_threads=256", "conv2d_nchw_spatial_pack.mali", [["TENSOR", [1, 1024, 14, 14], "float32"], ["TENSOR", [2048, 1024, 1, 1], "float32"], [2, 2], [0, 0, 0, 0], [1, 1], "float32"], {}], "config": {"index": 112192, "code_hash": null, "entity": [["tile_co", "sp", [-1, 32, 4]], ["tile_oh", "sp", [-1, 7, 1]], ["tile_ow", "sp", [-1, 1, 7]], ["reorder_0", "re", [0, 1, 2, 3, 4, 5, 6, 9, 7, 8]], ["ann_reduce", "an", ["unroll", "unroll"]], ["ann_spatial", "an", ["vec", "unroll", "unroll"]]]}, "result": [[0.014228760400000002], 0, 20.71544098854065, 1598457485.5202959], "version": 0.2, "tvm_version": "0.7.dev1"}
{"input": ["opencl -keys=mali,opencl,gpu -device=mali -max_num_threads=256", "conv2d_nchw_spatial_pack.mali", [["TENSOR", [1, 1024, 14, 14], "float32"], ["TENSOR", [2048, 1024, 1, 1], "float32"], [2, 2], [0, 0, 0, 0], [1, 1], "float32"], {}], "config": {"index": 48539, "code_hash": null, "entity": [["tile_co", "sp", [-1, 1, 4]], ["tile_oh", "sp", [-1, 7, 1]], ["tile_ow", "sp", [-1, 1, 1]], ["reorder_0", "re", [0, 1, 2, 3, 4, 5, 6, 9, 7, 8]], ["ann_reduce", "an", ["unroll", "none"]], ["ann_spatial", "an", ["unroll", "none", "none"]]]}, "result": [[0.09823237500000001], 0, 22.793513298034668, 1598457487.6290472], "version": 0.2, "tvm_version": "0.7.dev1"}
{"input": ["opencl -keys=mali,opencl,gpu -device=mali -max_num_threads=256", "conv2d_nchw_spatial_pack.mali", [["TENSOR", [1, 1024, 14, 14], "float32"], ["TENSOR", [2048, 1024, 1, 1], "float32"], [2, 2], [0, 0, 0, 0], [1, 1], "float32"], {}], "config": {"index": 97351, "code_hash": null, "entity": [["tile_co", "sp", [-1, 128, 1]], ["tile_oh", "sp", [-1, 1, 1]], ["tile_ow", "sp", [-1, 1, 7]], ["reorder_0", "re", [0, 1, 2, 3, 4, 5, 6, 7, 8, 9]], ["ann_reduce", "an", ["none", "unroll"]], ["ann_spatial", "an", ["vec", "none", "unroll"]]]}, "result": [[0.1407099272], 0, 2.867144823074341, 1598457490.746667], "version": 0.2, "tvm_version": "0.7.dev1"}
{"input": ["opencl -keys=mali,opencl,gpu -device=mali -max_num_threads=256", "conv2d_nchw_spatial_pack.mali", [["TENSOR", [1, 1024, 14, 14], "float32"], ["TENSOR", [2048, 1024, 1, 1], "float32"], [2, 2], [0, 0, 0, 0], [1, 1], "float32"], {}], "config": {"index": 48117, "code_hash": null, "entity": [["tile_co", "sp", [-1, 2, 256]], ["tile_oh", "sp", [-1, 7, 1]], ["tile_ow", "sp", [-1, 7, 1]], ["reorder_0", "re", [0, 1, 2, 3, 4, 5, 6, 7, 8, 9]], ["ann_reduce", "an", ["unroll", "none"]], ["ann_spatial", "an", ["unroll", "none", "none"]]]}, "result": [[0.1809796352], 0, 6.344048976898193, 1598457494.228269], "version": 0.2, "tvm_version": "0.7.dev1"}
{"input": ["opencl -keys=mali,opencl,gpu -device=mali -max_num_threads=256", "conv2d_nchw_spatial_pack.mali", [["TENSOR", [1, 1024, 14, 14], "float32"], ["TENSOR", [2048, 1024, 1, 1], "float32"], [2, 2], [0, 0, 0, 0], [1, 1], "float32"], {}], "config": {"index": 20305, "code_hash": null, "entity": [["tile_co", "sp", [-1, 4, 4]], ["tile_oh", "sp", [-1, 1, 7]], ["tile_ow", "sp", [-1, 1, 7]], ["reorder_0", "re", [0, 1, 2, 3, 4, 5, 6, 7, 8, 9]], ["ann_reduce", "an", ["unroll", "none"]], ["ann_spatial", "an", ["none", "unroll", "none"]]]}, "result": [[0.25845480200000004], 0, 11.266517877578735, 1598457499.141244], "version": 0.2, "tvm_version": "0.7.dev1"}
{"input": ["opencl -keys=mali,opencl,gpu -device=mali -max_num_threads=256", "conv2d_nchw_spatial_pack.mali", [["TENSOR", [1, 1024, 14, 14], "float32"], ["TENSOR", [2048, 1024, 1, 1], "float32"], [2, 2], [0, 0, 0, 0], [1, 1], "float32"], {}], "config": {"index": 105600, "code_hash": null, "entity": [["tile_co", "sp", [-1, 8, 128]], ["tile_oh", "sp", [-1, 1, 1]], ["tile_ow", "sp", [-1, 7, 1]], ["reorder_0", "re", [0, 1, 2, 3, 4, 5, 6, 7, 8, 9]], ["ann_reduce", "an", ["unroll", "unroll"]], ["ann_spatial", "an", ["vec", "unroll", "none"]]]}, "result": [[0.147923802], 0, 14.219383001327515, 1598457502.112979], "version": 0.2, "tvm_version": "0.7.dev1"}
{"input": ["opencl -keys=mali,opencl,gpu -device=mali -max_num_threads=256", "conv2d_nchw_spatial_pack.mali", [["TENSOR", [1, 1024, 14, 14], "float32"], ["TENSOR", [2048, 1024, 1, 1], "float32"], [2, 2], [0, 0, 0, 0], [1, 1], "float32"], {}], "config": {"index": 33955, "code_hash": null, "entity": [["tile_co", "sp", [-1, 4, 4]], ["tile_oh", "sp", [-1, 1, 1]], ["tile_ow", "sp", [-1, 7, 1]], ["reorder_0", "re", [0, 1, 2, 3, 4, 5, 6, 7, 8, 9]], ["ann_reduce", "an", ["none", "none"]], ["ann_spatial", "an", ["none", "vec", "none"]]]}, "result": [[0.0633447918], 0, 15.809126853942871, 1598457503.712296], "version": 0.2, "tvm_version": "0.7.dev1"}
{"input": ["opencl -keys=mali,opencl,gpu -device=mali -max_num_threads=256", "conv2d_nchw_spatial_pack.mali", [["TENSOR", [1, 1024, 14, 14], "float32"], ["TENSOR", [2048, 1024, 1, 1], "float32"], [2, 2], [0, 0, 0, 0], [1, 1], "float32"], {}], "config": {"index": 76067, "code_hash": null, "entity": [["tile_co", "sp", [-1, 32, 2]], ["tile_oh", "sp", [-1, 1, 1]], ["tile_ow", "sp", [-1, 7, 1]], ["reorder_0", "re", [0, 1, 2, 3, 4, 5, 6, 7, 8, 9]], ["ann_reduce", "an", ["unroll", "none"]], ["ann_spatial", "an", ["unroll", "unroll", "vec"]]]}, "result": [[0.0222265], 0, 16.69486951828003, 1598457504.6100109], "version": 0.2, "tvm_version": "0.7.dev1"}
{"input": ["opencl -keys=mali,opencl,gpu -device=mali -max_num_threads=256", "conv2d_nchw_spatial_pack.mali", [["TENSOR", [1, 1024, 14, 14], "float32"], ["TENSOR", [2048, 1024, 1, 1], "float32"], [2, 2], [0, 0, 0, 0], [1, 1], "float32"], {}], "config": {"index": 96522, "code_hash": null, "entity": [["tile_co", "sp", [-1, 8, 8]], ["tile_oh", "sp", [-1, 7, 1]], ["tile_ow", "sp", [-1, 7, 1]], ["reorder_0", "re", [0, 1, 2, 3, 4, 5, 6, 9, 7, 8]], ["ann_reduce", "an", ["none", "none"]], ["ann_spatial", "an", ["vec", "none", "unroll"]]]}, "result": [[0.0168250834], 0, 17.495993852615356, 1598457505.414204], "version": 0.2, "tvm_version": "0.7.dev1"}
{"input": ["opencl -keys=mali,opencl,gpu -device=mali -max_num_threads=256", "conv2d_nchw_spatial_pack.mali", [["TENSOR", [1, 1024, 14, 14], "float32"], ["TENSOR", [2048, 1024, 1, 1], "float32"], [2, 2], [0, 0, 0, 0], [1, 1], "float32"], {}], "config": {"index": 18214, "code_hash": null, "entity": [["tile_co", "sp", [-1, 128, 8]], ["tile_oh", "sp", [-1, 1, 7]], ["tile_ow", "sp", [-1, 1, 7]], ["reorder_0", "re", [0, 1, 2, 3, 4, 5, 6, 9, 7, 8]], ["ann_reduce", "an", ["none", "none"]], ["ann_spatial", "an", ["none", "unroll", "none"]]]}, "result": [[0.5735670414], 0, 27.33020830154419, 1598457515.2532191], "version": 0.2, "tvm_version": "0.7.dev1"}
{"input": ["opencl -keys=mali,opencl,gpu -device=mali -max_num_threads=256", "conv2d_nchw_spatial_pack.mali", [["TENSOR", [1, 1024, 14, 14], "float32"], ["TENSOR", [2048, 1024, 1, 1], "float32"], [2, 2], [0, 0, 0, 0], [1, 1], "float32"], {}], "config": {"index": 28277, "code_hash": null, "entity": [["tile_co", "sp", [-1, 256, 8]], ["tile_oh", "sp", [-1, 1, 7]], ["tile_ow", "sp", [-1, 1, 1]], ["reorder_0", "re", [0, 1, 2, 3, 4, 5, 6, 7, 8, 9]], ["ann_reduce", "an", ["none", "none"]], ["ann_spatial", "an", ["none", "unroll", "vec"]]]}, "result": [[0.0763303332], 0, 1.8821032047271729, 1598457517.434674], "version": 0.2, "tvm_version": "0.7.dev1"}
{"input": ["opencl -keys=mali,opencl,gpu -device=mali -max_num_threads=256", "conv2d_nchw_spatial_pack.mali", [["TENSOR", [1, 1024, 14, 14], "float32"], ["TENSOR", [2048, 1024, 1, 1], "float32"], [2, 2], [0, 0, 0, 0], [1, 1], "float32"], {}], "config": {"index": 62620, "code_hash": null, "entity": [["tile_co", "sp", [-1, 2, 128]], ["tile_oh", "sp", [-1, 7, 1]], ["tile_ow", "sp", [-1, 1, 1]], ["reorder_0", "re", [0, 1, 2, 3, 4, 5, 6, 9, 7, 8]], ["ann_reduce", "an", ["none", "none"]], ["ann_spatial", "an", ["unroll", "unroll", "none"]]]}, "result": [[0.1349802186], 0, 4.6825621128082275, 1598457520.2483819], "version": 0.2, "tvm_version": "0.7.dev1"}
{"input": ["opencl -keys=mali,opencl,gpu -device=mali -max_num_threads=256", "conv2d_nchw_spatial_pack.mali", [["TENSOR", [1, 1024, 14, 14], "float32"], ["TENSOR", [2048, 1024, 1, 1], "float32"], [2, 2], [0, 0, 0, 0], [1, 1], "float32"], {}], "config": {"index": 49914, "code_hash": null, "entity": [["tile_co", "sp", [-1, 1, 512]], ["tile_oh", "sp", [-1, 1, 1]], ["tile_ow", "sp", [-1, 1, 1]], ["reorder_0", "re", [0, 1, 2, 3, 4, 5, 6, 9, 7, 8]], ["ann_reduce", "an", ["unroll", "unroll"]], ["ann_spatial", "an", ["unroll", "none", "none"]]]}, "result": [[0.5801903018], 0, 14.500036001205444, 1598457530.077028], "version": 0.2, "tvm_version": "0.7.dev1"}
{"input": ["opencl -keys=mali,opencl,gpu -device=mali -max_num_threads=256", "conv2d_nchw_spatial_pack.mali", [["TENSOR", [1, 1024, 14, 14], "float32"], ["TENSOR", [2048, 1024, 1, 1], "float32"], [2, 2], [0, 0, 0, 0], [1, 1], "float32"], {}], "config": {"index": 71328, "code_hash": null, "entity": [["tile_co", "sp", [-1, 8, 8]], ["tile_oh", "sp", [-1, 1, 7]], ["tile_ow", "sp", [-1, 7, 1]], ["reorder_0", "re", [0, 1, 2, 3, 4, 5, 6, 9, 7, 8]], ["ann_reduce", "an", ["unroll", "none"]], ["ann_spatial", "an", ["unroll", "unroll", "unroll"]]]}, "result": [[0.0130081146], 0, 15.405941009521484, 1598457530.99027], "version": 0.2, "tvm_version": "0.7.dev1"}
{"input": ["opencl -keys=mali,opencl,gpu -device=mali -max_num_threads=256", "conv2d_nchw_spatial_pack.mali", [["TENSOR", [1, 1024, 14, 14], "float32"], ["TENSOR", [2048, 1024, 1, 1], "float32"], [2, 2], [0, 0, 0, 0], [1, 1], "float32"], {}], "config": {"index": 110076, "code_hash": null, "entity": [["tile_co", "sp", [-1, 64, 2]], ["tile_oh", "sp", [-1, 7, 1]], ["tile_ow", "sp", [-1, 1, 7]], ["reorder_0", "re", [0, 1, 2, 3, 4, 5, 6, 7, 8, 9]], ["ann_reduce", "an", ["unroll", "none"]], ["ann_spatial", "an", ["vec", "unroll", "unroll"]]]}, "result": [[0.025416822999999998], 0, 16.428958415985107, 1598457532.0149581], "version": 0.2, "tvm_version": "0.7.dev1"}
{"input": ["opencl -keys=mali,opencl,gpu -device=mali -max_num_threads=256", "conv2d_nchw_spatial_pack.mali", [["TENSOR", [1, 1024, 14, 14], "float32"], ["TENSOR", [2048, 1024, 1, 1], "float32"], [2, 2], [0, 0, 0, 0], [1, 1], "float32"], {}], "config": {"index": 68758, "code_hash": null, "entity": [["tile_co", "sp", [-1, 128, 8]], ["tile_oh", "sp", [-1, 1, 7]], ["tile_ow", "sp", [-1, 1, 7]], ["reorder_0", "re", [0, 1, 2, 3, 4, 5, 6, 9, 7, 8]], ["ann_reduce", "an", ["none", "none"]], ["ann_spatial", "an", ["unroll", "unroll", "unroll"]]]}, "result": [[0.2674727082], 0, 22.271075010299683, 1598457537.804459], "version": 0.2, "tvm_version": "0.7.dev1"}
{"input": ["opencl -keys=mali,opencl,gpu -device=mali -max_num_threads=256", "conv2d_nchw_spatial_pack.mali", [["TENSOR", [1, 1024, 14, 14], "float32"], ["TENSOR", [2048, 1024, 1, 1], "float32"], [2, 2], [0, 0, 0, 0], [1, 1], "float32"], {}], "config": {"index": 26460, "code_hash": null, "entity": [["tile_co", "sp", [-1, 64, 2]], ["tile_oh", "sp", [-1, 1, 1]], ["tile_ow", "sp", [-1, 1, 7]], ["reorder_0", "re", [0, 1, 2, 3, 4, 5, 6, 9, 7, 8]], ["ann_reduce", "an", ["unroll", "none"]], ["ann_spatial", "an", ["none", "unroll", "unroll"]]]}, "result": [[0.0141696772], 0, 23.068562030792236, 1598457538.665911], "version": 0.2, "tvm_version": "0.7.dev1"}
{"input": ["opencl -keys=mali,opencl,gpu -device=mali -max_num_threads=256", "conv2d_nchw_spatial_pack.mali", [["TENSOR", [1, 1024, 14, 14], "float32"], ["TENSOR", [2048, 1024, 1, 1], "float32"], [2, 2], [0, 0, 0, 0], [1, 1], "float32"], {}], "config": {"index": 65010, "code_hash": null, "entity": [["tile_co", "sp", [-1, 8, 8]], ["tile_oh", "sp", [-1, 1, 7]], ["tile_ow", "sp", [-1, 7, 1]], ["reorder_0", "re", [0, 1, 2, 3, 4, 5, 6, 7, 8, 9]], ["ann_reduce", "an", ["unroll", "none"]], ["ann_spatial", "an", ["unroll", "unroll", "none"]]]}, "result": [[0.0982507812], 0, 2.2255289554595947, 1598457588.034548], "version": 0.2, "tvm_version": "0.7.dev1"}
{"input": ["opencl -keys=mali,opencl,gpu -device=mali -max_num_threads=256", "conv2d_nchw_spatial_pack.mali", [["TENSOR", [1, 1024, 14, 14], "float32"], ["TENSOR", [2048, 1024, 1, 1], "float32"], [2, 2], [0, 0, 0, 0], [1, 1], "float32"], {}], "config": {"index": 76242, "code_hash": null, "entity": [["tile_co", "sp", [-1, 8, 8]], ["tile_oh", "sp", [-1, 1, 7]], ["tile_ow", "sp", [-1, 7, 1]], ["reorder_0", "re", [0, 1, 2, 3, 4, 5, 6, 7, 8, 9]], ["ann_reduce", "an", ["unroll", "none"]], ["ann_spatial", "an", ["unroll", "unroll", "vec"]]]}, "result": [[0.0072771562], 0, 2.9108798503875732, 1598457588.7407749], "version": 0.2, "tvm_version": "0.7.dev1"}
{"input": ["opencl -keys=mali,opencl,gpu -device=mali -max_num_threads=256", "conv2d_nchw_spatial_pack.mali", [["TENSOR", [1, 1024, 14, 14], "float32"], ["TENSOR", [2048, 1024, 1, 1], "float32"], [2, 2], [0, 0, 0, 0], [1, 1], "float32"], {}], "config": {"index": 87474, "code_hash": null, "entity": [["tile_co", "sp", [-1, 8, 8]], ["tile_oh", "sp", [-1, 1, 7]], ["tile_ow", "sp", [-1, 7, 1]], ["reorder_0", "re", [0, 1, 2, 3, 4, 5, 6, 7, 8, 9]], ["ann_reduce", "an", ["unroll", "none"]], ["ann_spatial", "an", ["unroll", "vec", "unroll"]]]}, "result": [[0.012993322800000002], 0, 3.732451915740967, 1598457589.541302], "version": 0.2, "tvm_version": "0.7.dev1"}
{"input": ["opencl -keys=mali,opencl,gpu -device=mali -max_num_threads=256", "conv2d_nchw_spatial_pack.mali", [["TENSOR", [1, 1024, 14, 14], "float32"], ["TENSOR", [2048, 1024, 1, 1], "float32"], [2, 2], [0, 0, 0, 0], [1, 1], "float32"], {}], "config": {"index": 81858, "code_hash": null, "entity": [["tile_co", "sp", [-1, 8, 8]], ["tile_oh", "sp", [-1, 1, 7]], ["tile_ow", "sp", [-1, 7, 1]], ["reorder_0", "re", [0, 1, 2, 3, 4, 5, 6, 7, 8, 9]], ["ann_reduce", "an", ["unroll", "none"]], ["ann_spatial", "an", ["unroll", "vec", "none"]]]}, "result": [[0.0987947916], 0, 5.875161170959473, 1598457591.703725], "version": 0.2, "tvm_version": "0.7.dev1"}
{"input": ["opencl -keys=mali,opencl,gpu -device=mali -max_num_threads=256", "conv2d_nchw_spatial_pack.mali", [["TENSOR", [1, 1024, 14, 14], "float32"], ["TENSOR", [2048, 1024, 1, 1], "float32"], [2, 2], [0, 0, 0, 0], [1, 1], "float32"], {}], "config": {"index": 53778, "code_hash": null, "entity": [["tile_co", "sp", [-1, 8, 8]], ["tile_oh", "sp", [-1, 1, 7]], ["tile_ow", "sp", [-1, 7, 1]], ["reorder_0", "re", [0, 1, 2, 3, 4, 5, 6, 7, 8, 9]], ["ann_reduce", "an", ["unroll", "none"]], ["ann_spatial", "an", ["unroll", "none", "unroll"]]]}, "result": [[0.0132342396], 0, 6.691678047180176, 1598457592.50719], "version": 0.2, "tvm_version": "0.7.dev1"}
{"input": ["opencl -keys=mali,opencl,gpu -device=mali -max_num_threads=256", "conv2d_nchw_spatial_pack.mali", [["TENSOR", [1, 1024, 14, 14], "float32"], ["TENSOR", [2048, 1024, 1, 1], "float32"], [2, 2], [0, 0, 0, 0], [1, 1], "float32"], {}], "config": {"index": 48162, "code_hash": null, "entity": [["tile_co", "sp", [-1, 8, 8]], ["tile_oh", "sp", [-1, 1, 7]], ["tile_ow", "sp", [-1, 7, 1]], ["reorder_0", "re", [0, 1, 2, 3, 4, 5, 6, 7, 8, 9]], ["ann_reduce", "an", ["unroll", "none"]], ["ann_spatial", "an", ["unroll", "none", "none"]]]}, "result": [[0.1016722708], 0, 8.938591003417969, 1598457594.7860742], "version": 0.2, "tvm_version": "0.7.dev1"}
{"input": ["opencl -keys=mali,opencl,gpu -device=mali -max_num_threads=256", "conv2d_nchw_spatial_pack.mali", [["TENSOR", [1, 1024, 14, 14], "float32"], ["TENSOR", [2048, 1024, 1, 1], "float32"], [2, 2], [0, 0, 0, 0], [1, 1], "float32"], {}], "config": {"index": 59394, "code_hash": null, "entity": [["tile_co", "sp", [-1, 8, 8]], ["tile_oh", "sp", [-1, 1, 7]], ["tile_ow", "sp", [-1, 7, 1]], ["reorder_0", "re", [0, 1, 2, 3, 4, 5, 6, 7, 8, 9]], ["ann_reduce", "an", ["unroll", "none"]], ["ann_spatial", "an", ["unroll", "none", "vec"]]]}, "result": [[0.0074467812], 0, 9.651325225830078, 1598457595.500533], "version": 0.2, "tvm_version": "0.7.dev1"}
{"input": ["opencl -keys=mali,opencl,gpu -device=mali -max_num_threads=256", "conv2d_nchw_spatial_pack.mali", [["TENSOR", [1, 1024, 14, 14], "float32"], ["TENSOR", [2048, 1024, 1, 1], "float32"], [2, 2], [0, 0, 0, 0], [1, 1], "float32"], {}], "config": {"index": 62202, "code_hash": null, "entity": [["tile_co", "sp", [-1, 8, 8]], ["tile_oh", "sp", [-1, 1, 7]], ["tile_ow", "sp", [-1, 7, 1]], ["reorder_0", "re", [0, 1, 2, 3, 4, 5, 6, 7, 8, 9]], ["ann_reduce", "an", ["none", "none"]], ["ann_spatial", "an", ["unroll", "unroll", "none"]]]}, "result": [[0.1029313436], 0, 11.897647380828857, 1598457597.754613], "version": 0.2, "tvm_version": "0.7.dev1"}
{"input": ["opencl -keys=mali,opencl,gpu -device=mali -max_num_threads=256", "conv2d_nchw_spatial_pack.mali", [["TENSOR", [1, 1024, 14, 14], "float32"], ["TENSOR", [2048, 1024, 1, 1], "float32"], [2, 2], [0, 0, 0, 0], [1, 1], "float32"], {}], "config": {"index": 73434, "code_hash": null, "entity": [["tile_co", "sp", [-1, 8, 8]], ["tile_oh", "sp", [-1, 1, 7]], ["tile_ow", "sp", [-1, 7, 1]], ["reorder_0", "re", [0, 1, 2, 3, 4, 5, 6, 7, 8, 9]], ["ann_reduce", "an", ["none", "none"]], ["ann_spatial", "an", ["unroll", "unroll", "vec"]]]}, "result": [[0.0075379584], 0, 12.56725263595581, 1598457598.43974], "version": 0.2, "tvm_version": "0.7.dev1"}
{"input": ["opencl -keys=mali,opencl,gpu -device=mali -max_num_threads=256", "conv2d_nchw_spatial_pack.mali", [["TENSOR", [1, 1024, 14, 14], "float32"], ["TENSOR", [2048, 1024, 1, 1], "float32"], [2, 2], [0, 0, 0, 0], [1, 1], "float32"], {}], "config": {"index": 20082, "code_hash": null, "entity": [["tile_co", "sp", [-1, 8, 8]], ["tile_oh", "sp", [-1, 1, 7]], ["tile_ow", "sp", [-1, 7, 1]], ["reorder_0", "re", [0, 1, 2, 3, 4, 5, 6, 7, 8, 9]], ["ann_reduce", "an", ["unroll", "none"]], ["ann_spatial", "an", ["none", "unroll", "none"]]]}, "result": [[0.2056751146], 0, 16.50152587890625, 1598457602.370501], "version": 0.2, "tvm_version": "0.7.dev1"}
{"input": ["opencl -keys=mali,opencl,gpu -device=mali -max_num_threads=256", "conv2d_nchw_spatial_pack.mali", [["TENSOR", [1, 1024, 14, 14], "float32"], ["TENSOR", [2048, 1024, 1, 1], "float32"], [2, 2], [0, 0, 0, 0], [1, 1], "float32"], {}], "config": {"index": 67818, "code_hash": null, "entity": [["tile_co", "sp", [-1, 8, 8]], ["tile_oh", "sp", [-1, 1, 7]], ["tile_ow", "sp", [-1, 7, 1]], ["reorder_0", "re", [0, 1, 2, 3, 4, 5, 6, 7, 8, 9]], ["ann_reduce", "an", ["none", "none"]], ["ann_spatial", "an", ["unroll", "unroll", "unroll"]]]}, "result": [[0.013183875000000001], 0, 17.277353048324585, 1598457603.136671], "version": 0.2, "tvm_version": "0.7.dev1"}
{"input": ["opencl -keys=mali,opencl,gpu -device=mali -max_num_threads=256", "conv2d_nchw_spatial_pack.mali", [["TENSOR", [1, 1024, 14, 14], "float32"], ["TENSOR", [2048, 1024, 1, 1], "float32"], [2, 2], [0, 0, 0, 0], [1, 1], "float32"], {}], "config": {"index": 31314, "code_hash": null, "entity": [["tile_co", "sp", [-1, 8, 8]], ["tile_oh", "sp", [-1, 1, 7]], ["tile_ow", "sp", [-1, 7, 1]], ["reorder_0", "re", [0, 1, 2, 3, 4, 5, 6, 7, 8, 9]], ["ann_reduce", "an", ["unroll", "none"]], ["ann_spatial", "an", ["none", "unroll", "vec"]]]}, "result": [[0.0607235312], 0, 18.775598764419556, 1598457604.6582909], "version": 0.2, "tvm_version": "0.7.dev1"}
{"input": ["opencl -keys=mali,opencl,gpu -device=mali -max_num_threads=256", "conv2d_nchw_spatial_pack.mali", [["TENSOR", [1, 1024, 14, 14], "float32"], ["TENSOR", [2048, 1024, 1, 1], "float32"], [2, 2], [0, 0, 0, 0], [1, 1], "float32"], {}], "config": {"index": 84666, "code_hash": null, "entity": [["tile_co", "sp", [-1, 8, 8]], ["tile_oh", "sp", [-1, 1, 7]], ["tile_ow", "sp", [-1, 7, 1]], ["reorder_0", "re", [0, 1, 2, 3, 4, 5, 6, 7, 8, 9]], ["ann_reduce", "an", ["none", "none"]], ["ann_spatial", "an", ["unroll", "vec", "unroll"]]]}, "result": [[0.013039041800000001], 0, 19.659526109695435, 1598457605.539176], "version": 0.2, "tvm_version": "0.7.dev1"}
{"input": ["opencl -keys=mali,opencl,gpu -device=mali -max_num_threads=256", "conv2d_nchw_spatial_pack.mali", [["TENSOR", [1, 1024, 14, 14], "float32"], ["TENSOR", [2048, 1024, 1, 1], "float32"], [2, 2], [0, 0, 0, 0], [1, 1], "float32"], {}], "config": {"index": 79050, "code_hash": null, "entity": [["tile_co", "sp", [-1, 8, 8]], ["tile_oh", "sp", [-1, 1, 7]], ["tile_ow", "sp", [-1, 7, 1]], ["reorder_0", "re", [0, 1, 2, 3, 4, 5, 6, 7, 8, 9]], ["ann_reduce", "an", ["none", "none"]], ["ann_spatial", "an", ["unroll", "vec", "none"]]]}, "result": [[0.1008145416], 0, 21.828957080841064, 1598457607.724133], "version": 0.2, "tvm_version": "0.7.dev1"}
{"input": ["opencl -keys=mali,opencl,gpu -device=mali -max_num_threads=256", "conv2d_nchw_spatial_pack.mali", [["TENSOR", [1, 1024, 14, 14], "float32"], ["TENSOR", [2048, 1024, 1, 1], "float32"], [2, 2], [0, 0, 0, 0], [1, 1], "float32"], {}], "config": {"index": 42546, "code_hash": null, "entity": [["tile_co", "sp", [-1, 8, 8]], ["tile_oh", "sp", [-1, 1, 7]], ["tile_ow", "sp", [-1, 7, 1]], ["reorder_0", "re", [0, 1, 2, 3, 4, 5, 6, 7, 8, 9]], ["ann_reduce", "an", ["unroll", "none"]], ["ann_spatial", "an", ["none", "vec", "unroll"]]]}, "result": [[0.3216405416], 0, 27.52117395401001, 1598457613.432362], "version": 0.2, "tvm_version": "0.7.dev1"}
{"input": ["opencl -keys=mali,opencl,gpu -device=mali -max_num_threads=256", "conv2d_nchw_spatial_pack.mali", [["TENSOR", [1, 1024, 14, 14], "float32"], ["TENSOR", [2048, 1024, 1, 1], "float32"], [2, 2], [0, 0, 0, 0], [1, 1], "float32"], {}], "config": {"index": 36930, "code_hash": null, "entity": [["tile_co", "sp", [-1, 8, 8]], ["tile_oh", "sp", [-1, 1, 7]], ["tile_ow", "sp", [-1, 7, 1]], ["reorder_0", "re", [0, 1, 2, 3, 4, 5, 6, 7, 8, 9]], ["ann_reduce", "an", ["unroll", "none"]], ["ann_spatial", "an", ["none", "vec", "none"]]]}, "result": [[0.2216777498], 0, 31.644188165664673, 1598457617.553859], "version": 0.2, "tvm_version": "0.7.dev1"}
{"input": ["opencl -keys=mali,opencl,gpu -device=mali -max_num_threads=256", "conv2d_nchw_spatial_pack.mali", [["TENSOR", [1, 1024, 14, 14], "float32"], ["TENSOR", [2048, 1024, 1, 1], "float32"], [2, 2], [0, 0, 0, 0], [1, 1], "float32"], {}], "config": {"index": 25698, "code_hash": null, "entity": [["tile_co", "sp", [-1, 8, 8]], ["tile_oh", "sp", [-1, 1, 7]], ["tile_ow", "sp", [-1, 7, 1]], ["reorder_0", "re", [0, 1, 2, 3, 4, 5, 6, 7, 8, 9]], ["ann_reduce", "an", ["unroll", "none"]], ["ann_spatial", "an", ["none", "unroll", "unroll"]]]}, "result": [[0.3397408124], 0, 6.139842987060547, 1598457623.966462], "version": 0.2, "tvm_version": "0.7.dev1"}
{"input": ["opencl -keys=mali,opencl,gpu -device=mali -max_num_threads=256", "conv2d_nchw_spatial_pack.mali", [["TENSOR", [1, 1024, 14, 14], "float32"], ["TENSOR", [2048, 1024, 1, 1], "float32"], [2, 2], [0, 0, 0, 0], [1, 1], "float32"], {}], "config": {"index": 8850, "code_hash": null, "entity": [["tile_co", "sp", [-1, 8, 8]], ["tile_oh", "sp", [-1, 1, 7]], ["tile_ow", "sp", [-1, 7, 1]], ["reorder_0", "re", [0, 1, 2, 3, 4, 5, 6, 7, 8, 9]], ["ann_reduce", "an", ["unroll", "none"]], ["ann_spatial", "an", ["none", "none", "unroll"]]]}, "result": [[0.3374036458], 0, 12.103947877883911, 1598457629.935955], "version": 0.2, "tvm_version": "0.7.dev1"}
{"input": ["opencl -keys=mali,opencl,gpu -device=mali -max_num_threads=256", "conv2d_nchw_spatial_pack.mali", [["TENSOR", [1, 1024, 14, 14], "float32"], ["TENSOR", [2048, 1024, 1, 1], "float32"], [2, 2], [0, 0, 0, 0], [1, 1], "float32"], {}], "config": {"index": 3234, "code_hash": null, "entity": [["tile_co", "sp", [-1, 8, 8]], ["tile_oh", "sp", [-1, 1, 7]], ["tile_ow", "sp", [-1, 7, 1]], ["reorder_0", "re", [0, 1, 2, 3, 4, 5, 6, 7, 8, 9]], ["ann_reduce", "an", ["unroll", "none"]], ["ann_spatial", "an", ["none", "none", "none"]]]}, "result": [[0.2173965624], 0, 16.162005186080933, 1598457634.00094], "version": 0.2, "tvm_version": "0.7.dev1"}
{"input": ["opencl -keys=mali,opencl,gpu -device=mali -max_num_threads=256", "conv2d_nchw_spatial_pack.mali", [["TENSOR", [1, 1024, 14, 14], "float32"], ["TENSOR", [2048, 1024, 1, 1], "float32"], [2, 2], [0, 0, 0, 0], [1, 1], "float32"], {}], "config": {"index": 14466, "code_hash": null, "entity": [["tile_co", "sp", [-1, 8, 8]], ["tile_oh", "sp", [-1, 1, 7]], ["tile_ow", "sp", [-1, 7, 1]], ["reorder_0", "re", [0, 1, 2, 3, 4, 5, 6, 7, 8, 9]], ["ann_reduce", "an", ["unroll", "none"]], ["ann_spatial", "an", ["none", "none", "vec"]]]}, "result": [[0.0557752082], 0, 17.840359926223755, 1598457635.681001], "version": 0.2, "tvm_version": "0.7.dev1"}
{"input": ["opencl -keys=mali,opencl,gpu -device=mali -max_num_threads=256", "conv2d_nchw_spatial_pack.mali", [["TENSOR", [1, 1024, 14, 14], "float32"], ["TENSOR", [2048, 1024, 1, 1], "float32"], [2, 2], [0, 0, 0, 0], [1, 1], "float32"], {}], "config": {"index": 50970, "code_hash": null, "entity": [["tile_co", "sp", [-1, 8, 8]], ["tile_oh", "sp", [-1, 1, 7]], ["tile_ow", "sp", [-1, 7, 1]], ["reorder_0", "re", [0, 1, 2, 3, 4, 5, 6, 7, 8, 9]], ["ann_reduce", "an", ["none", "none"]], ["ann_spatial", "an", ["unroll", "none", "unroll"]]]}, "result": [[0.013171020799999999], 0, 19.41546893119812, 1598457637.2493792], "version": 0.2, "tvm_version": "0.7.dev1"}
{"input": ["opencl -keys=mali,opencl,gpu -device=mali -max_num_threads=256", "conv2d_nchw_spatial_pack.mali", [["TENSOR", [1, 1024, 14, 14], "float32"], ["TENSOR", [2048, 1024, 1, 1], "float32"], [2, 2], [0, 0, 0, 0], [1, 1], "float32"], {}], "config": {"index": 45354, "code_hash": null, "entity": [["tile_co", "sp", [-1, 8, 8]], ["tile_oh", "sp", [-1, 1, 7]], ["tile_ow", "sp", [-1, 7, 1]], ["reorder_0", "re", [0, 1, 2, 3, 4, 5, 6, 7, 8, 9]], ["ann_reduce", "an", ["none", "none"]], ["ann_spatial", "an", ["unroll", "none", "none"]]]}, "result": [[0.10434645840000001], 0, 22.374701976776123, 1598457640.21728], "version": 0.2, "tvm_version": "0.7.dev1"}
{"input": ["opencl -keys=mali,opencl,gpu -device=mali -max_num_threads=256", "conv2d_nchw_spatial_pack.mali", [["TENSOR", [1, 1024, 14, 14], "float32"], ["TENSOR", [2048, 1024, 1, 1], "float32"], [2, 2], [0, 0, 0, 0], [1, 1], "float32"], {}], "config": {"index": 56586, "code_hash": null, "entity": [["tile_co", "sp", [-1, 8, 8]], ["tile_oh", "sp", [-1, 1, 7]], ["tile_ow", "sp", [-1, 7, 1]], ["reorder_0", "re", [0, 1, 2, 3, 4, 5, 6, 7, 8, 9]], ["ann_reduce", "an", ["none", "none"]], ["ann_spatial", "an", ["unroll", "none", "vec"]]]}, "result": [[0.007346999999999999], 0, 23.1074161529541, 1598457640.954232], "version": 0.2, "tvm_version": "0.7.dev1"}
{"input": ["opencl -keys=mali,opencl,gpu -device=mali -max_num_threads=256", "conv2d_nchw_spatial_pack.mali", [["TENSOR", [1, 1024, 14, 14], "float32"], ["TENSOR", [2048, 1024, 1, 1], "float32"], [2, 2], [0, 0, 0, 0], [1, 1], "float32"], {}], "config": {"index": 76243, "code_hash": null, "entity": [["tile_co", "sp", [-1, 16, 8]], ["tile_oh", "sp", [-1, 1, 7]], ["tile_ow", "sp", [-1, 7, 1]], ["reorder_0", "re", [0, 1, 2, 3, 4, 5, 6, 7, 8, 9]], ["ann_reduce", "an", ["unroll", "none"]], ["ann_spatial", "an", ["unroll", "unroll", "vec"]]]}, "result": [[0.0073496876], 0, 23.765258073806763, 1598457641.628823], "version": 0.2, "tvm_version": "0.7.dev1"}
{"input": ["opencl -keys=mali,opencl,gpu -device=mali -max_num_threads=256", "conv2d_nchw_spatial_pack.mali", [["TENSOR", [1, 1024, 14, 14], "float32"], ["TENSOR", [2048, 1024, 1, 1], "float32"], [2, 2], [0, 0, 0, 0], [1, 1], "float32"], {}], "config": {"index": 17274, "code_hash": null, "entity": [["tile_co", "sp", [-1, 8, 8]], ["tile_oh", "sp", [-1, 1, 7]], ["tile_ow", "sp", [-1, 7, 1]], ["reorder_0", "re", [0, 1, 2, 3, 4, 5, 6, 7, 8, 9]], ["ann_reduce", "an", ["none", "none"]], ["ann_spatial", "an", ["none", "unroll", "none"]]]}, "result": [[0.233269677], 0, 28.12341046333313, 1598457645.9960692], "version": 0.2, "tvm_version": "0.7.dev1"}
{"input": ["opencl -keys=mali,opencl,gpu -device=mali -max_num_threads=256", "conv2d_nchw_spatial_pack.mali", [["TENSOR", [1, 1024, 14, 14], "float32"], ["TENSOR", [2048, 1024, 1, 1], "float32"], [2, 2], [0, 0, 0, 0], [1, 1], "float32"], {}], "config": {"index": 39738, "code_hash": null, "entity": [["tile_co", "sp", [-1, 8, 8]], ["tile_oh", "sp", [-1, 1, 7]], ["tile_ow", "sp", [-1, 7, 1]], ["reorder_0", "re", [0, 1, 2, 3, 4, 5, 6, 7, 8, 9]], ["ann_reduce", "an", ["none", "none"]], ["ann_spatial", "an", ["none", "vec", "unroll"]]]}, "result": [[0.3130121978], 0, 33.6954562664032, 1598457651.5770922], "version": 0.2, "tvm_version": "0.7.dev1"}
{"input": ["opencl -keys=mali,opencl,gpu -device=mali -max_num_threads=256", "conv2d_nchw_spatial_pack.mali", [["TENSOR", [1, 1024, 14, 14], "float32"], ["TENSOR", [2048, 1024, 1, 1], "float32"], [2, 2], [0, 0, 0, 0], [1, 1], "float32"], {}], "config": {"index": 70627, "code_hash": null, "entity": [["tile_co", "sp", [-1, 16, 8]], ["tile_oh", "sp", [-1, 1, 7]], ["tile_ow", "sp", [-1, 7, 1]], ["reorder_0", "re", [0, 1, 2, 3, 4, 5, 6, 7, 8, 9]], ["ann_reduce", "an", ["unroll", "none"]], ["ann_spatial", "an", ["unroll", "unroll", "unroll"]]]}, "result": [[0.0137778854], 0, 34.56420302391052, 1598457652.43656], "version": 0.2, "tvm_version": "0.7.dev1"}
{"input": ["opencl -keys=mali,opencl,gpu -device=mali -max_num_threads=256", "conv2d_nchw_spatial_pack.mali", [["TENSOR", [1, 1024, 14, 14], "float32"], ["TENSOR", [2048, 1024, 1, 1], "float32"], [2, 2], [0, 0, 0, 0], [1, 1], "float32"], {}], "config": {"index": 34122, "code_hash": null, "entity": [["tile_co", "sp", [-1, 8, 8]], ["tile_oh", "sp", [-1, 1, 7]], ["tile_ow", "sp", [-1, 7, 1]], ["reorder_0", "re", [0, 1, 2, 3, 4, 5, 6, 7, 8, 9]], ["ann_reduce", "an", ["none", "none"]], ["ann_spatial", "an", ["none", "vec", "none"]]]}, "result": [[0.2283076354], 0, 38.85847878456116, 1598457656.746002], "version": 0.2, "tvm_version": "0.7.dev1"}
{"input": ["opencl -keys=mali,opencl,gpu -device=mali -max_num_threads=256", "conv2d_nchw_spatial_pack.mali", [["TENSOR", [1, 1024, 14, 14], "float32"], ["TENSOR", [2048, 1024, 1, 1], "float32"], [2, 2], [0, 0, 0, 0], [1, 1], "float32"], {}], "config": {"index": 28506, "code_hash": null, "entity": [["tile_co", "sp", [-1, 8, 8]], ["tile_oh", "sp", [-1, 1, 7]], ["tile_ow", "sp", [-1, 7, 1]], ["reorder_0", "re", [0, 1, 2, 3, 4, 5, 6, 7, 8, 9]], ["ann_reduce", "an", ["none", "none"]], ["ann_spatial", "an", ["none", "unroll", "vec"]]]}, "result": [[0.062626177], 0, 1.659027338027954, 1598457658.6792881], "version": 0.2, "tvm_version": "0.7.dev1"}
{"input": ["opencl -keys=mali,opencl,gpu -device=mali -max_num_threads=256", "conv2d_nchw_spatial_pack.mali", [["TENSOR", [1, 1024, 14, 14], "float32"], ["TENSOR", [2048, 1024, 1, 1], "float32"], [2, 2], [0, 0, 0, 0], [1, 1], "float32"], {}], "config": {"index": 65011, "code_hash": null, "entity": [["tile_co", "sp", [-1, 16, 8]], ["tile_oh", "sp", [-1, 1, 7]], ["tile_ow", "sp", [-1, 7, 1]], ["reorder_0", "re", [0, 1, 2, 3, 4, 5, 6, 7, 8, 9]], ["ann_reduce", "an", ["unroll", "none"]], ["ann_spatial", "an", ["unroll", "unroll", "none"]]]}, "result": [[0.0940543228], 0, 3.7393620014190674, 1598457660.762697], "version": 0.2, "tvm_version": "0.7.dev1"}
{"input": ["opencl -keys=mali,opencl,gpu -device=mali -max_num_threads=256", "conv2d_nchw_spatial_pack.mali", [["TENSOR", [1, 1024, 14, 14], "float32"], ["TENSOR", [2048, 1024, 1, 1], "float32"], [2, 2], [0, 0, 0, 0], [1, 1], "float32"], {}], "config": {"index": 22890, "code_hash": null, "entity": [["tile_co", "sp", [-1, 8, 8]], ["tile_oh", "sp", [-1, 1, 7]], ["tile_ow", "sp", [-1, 7, 1]], ["reorder_0", "re", [0, 1, 2, 3, 4, 5, 6, 7, 8, 9]], ["ann_reduce", "an", ["none", "none"]], ["ann_spatial", "an", ["none", "unroll", "unroll"]]]}, "result": [[0.293488677], 0, 9.044824123382568, 1598457666.055477], "version": 0.2, "tvm_version": "0.7.dev1"}
{"input": ["opencl -keys=mali,opencl,gpu -device=mali -max_num_threads=256", "conv2d_nchw_spatial_pack.mali", [["TENSOR", [1, 1024, 14, 14], "float32"], ["TENSOR", [2048, 1024, 1, 1], "float32"], [2, 2], [0, 0, 0, 0], [1, 1], "float32"], {}], "config": {"index": 66414, "code_hash": null, "entity": [["tile_co", "sp", [-1, 8, 8]], ["tile_oh", "sp", [-1, 1, 7]], ["tile_ow", "sp", [-1, 7, 1]], ["reorder_0", "re", [0, 1, 2, 3, 4, 5, 6, 7, 8, 9]], ["ann_reduce", "an", ["unroll", "unroll"]], ["ann_spatial", "an", ["unroll", "unroll", "none"]]]}, "result": [[0.10352789579999999], 0, 11.28179407119751, 1598457668.302691], "version": 0.2, "tvm_version": "0.7.dev1"}
{"input": ["opencl -keys=mali,opencl,gpu -device=mali -max_num_threads=256", "conv2d_nchw_spatial_pack.mali", [["TENSOR", [1, 1024, 14, 14], "float32"], ["TENSOR", [2048, 1024, 1, 1], "float32"], [2, 2], [0, 0, 0, 0], [1, 1], "float32"], {}], "config": {"index": 77646, "code_hash": null, "entity": [["tile_co", "sp", [-1, 8, 8]], ["tile_oh", "sp", [-1, 1, 7]], ["tile_ow", "sp", [-1, 7, 1]], ["reorder_0", "re", [0, 1, 2, 3, 4, 5, 6, 7, 8, 9]], ["ann_reduce", "an", ["unroll", "unroll"]], ["ann_spatial", "an", ["unroll", "unroll", "vec"]]]}, "result": [[0.007289677], 0, 12.00846529006958, 1598457669.027513], "version": 0.2, "tvm_version": "0.7.dev1"}
{"input": ["opencl -keys=mali,opencl,gpu -device=mali -max_num_threads=256", "conv2d_nchw_spatial_pack.mali", [["TENSOR", [1, 1024, 14, 14], "float32"], ["TENSOR", [2048, 1024, 1, 1], "float32"], [2, 2], [0, 0, 0, 0], [1, 1], "float32"], {}], "config": {"index": 76233, "code_hash": null, "entity": [["tile_co", "sp", [-1, 16, 4]], ["tile_oh", "sp", [-1, 1, 7]], ["tile_ow", "sp", [-1, 7, 1]], ["reorder_0", "re", [0, 1, 2, 3, 4, 5, 6, 7, 8, 9]], ["ann_reduce", "an", ["unroll", "none"]], ["ann_spatial", "an", ["unroll", "unroll", "vec"]]]}, "result": [[0.0126011042], 0, 12.771157264709473, 1598457669.792757], "version": 0.2, "tvm_version": "0.7.dev1"}
{"input": ["opencl -keys=mali,opencl,gpu -device=mali -max_num_threads=256", "conv2d_nchw_spatial_pack.mali", [["TENSOR", [1, 1024, 14, 14], "float32"], ["TENSOR", [2048, 1024, 1, 1], "float32"], [2, 2], [0, 0, 0, 0], [1, 1], "float32"], {}], "config": {"index": 6042, "code_hash": null, "entity": [["tile_co", "sp", [-1, 8, 8]], ["tile_oh", "sp", [-1, 1, 7]], ["tile_ow", "sp", [-1, 7, 1]], ["reorder_0", "re", [0, 1, 2, 3, 4, 5, 6, 7, 8, 9]], ["ann_reduce", "an", ["none", "none"]], ["ann_spatial", "an", ["none", "none", "unroll"]]]}, "result": [[0.3034536874], 0, 18.205557823181152, 1598457675.229575], "version": 0.2, "tvm_version": "0.7.dev1"}
{"input": ["opencl -keys=mali,opencl,gpu -device=mali -max_num_threads=256", "conv2d_nchw_spatial_pack.mali", [["TENSOR", [1, 1024, 14, 14], "float32"], ["TENSOR", [2048, 1024, 1, 1], "float32"], [2, 2], [0, 0, 0, 0], [1, 1], "float32"], {}], "config": {"index": 65001, "code_hash": null, "entity": [["tile_co", "sp", [-1, 16, 4]], ["tile_oh", "sp", [-1, 1, 7]], ["tile_ow", "sp", [-1, 7, 1]], ["reorder_0", "re", [0, 1, 2, 3, 4, 5, 6, 7, 8, 9]], ["ann_reduce", "an", ["unroll", "none"]], ["ann_spatial", "an", ["unroll", "unroll", "none"]]]}, "result": [[0.22793741660000003], 0, 22.41780114173889, 1598457679.449147], "version": 0.2, "tvm_version": "0.7.dev1"}
{"input": ["opencl -keys=mali,opencl,gpu -device=mali -max_num_threads=256", "conv2d_nchw_spatial_pack.mali", [["TENSOR", [1, 1024, 14, 14], "float32"], ["TENSOR", [2048, 1024, 1, 1], "float32"], [2, 2], [0, 0, 0, 0], [1, 1], "float32"], {}], "config": {"index": 76232, "code_hash": null, "entity": [["tile_co", "sp", [-1, 8, 4]], ["tile_oh", "sp", [-1, 1, 7]], ["tile_ow", "sp", [-1, 7, 1]], ["reorder_0", "re", [0, 1, 2, 3, 4, 5, 6, 7, 8, 9]], ["ann_reduce", "an", ["unroll", "none"]], ["ann_spatial", "an", ["unroll", "unroll", "vec"]]]}, "result": [[0.012459885399999999], 0, 23.16895818710327, 1598457680.210052], "version": 0.2, "tvm_version": "0.7.dev1"}
{"input": ["opencl -keys=mali,opencl,gpu -device=mali -max_num_threads=256", "conv2d_nchw_spatial_pack.mali", [["TENSOR", [1, 1024, 14, 14], "float32"], ["TENSOR", [2048, 1024, 1, 1], "float32"], [2, 2], [0, 0, 0, 0], [1, 1], "float32"], {}], "config": {"index": 426, "code_hash": null, "entity": [["tile_co", "sp", [-1, 8, 8]], ["tile_oh", "sp", [-1, 1, 7]], ["tile_ow", "sp", [-1, 7, 1]], ["reorder_0", "re", [0, 1, 2, 3, 4, 5, 6, 7, 8, 9]], ["ann_reduce", "an", ["none", "none"]], ["ann_spatial", "an", ["none", "none", "none"]]]}, "result": [[0.21682567700000002], 0, 27.17647695541382, 1598457684.2167318], "version": 0.2, "tvm_version": "0.7.dev1"}
{"input": ["opencl -keys=mali,opencl,gpu -device=mali -max_num_threads=256", "conv2d_nchw_spatial_pack.mali", [["TENSOR", [1, 1024, 14, 14], "float32"], ["TENSOR", [2048, 1024, 1, 1], "float32"], [2, 2], [0, 0, 0, 0], [1, 1], "float32"], {}], "config": {"index": 54627, "code_hash": null, "entity": [["tile_co", "sp", [-1, 16, 4]], ["tile_oh", "sp", [-1, 7, 1]], ["tile_ow", "sp", [-1, 1, 7]], ["reorder_0", "re", [0, 1, 2, 3, 4, 5, 6, 9, 7, 8]], ["ann_reduce", "an", ["unroll", "none"]], ["ann_spatial", "an", ["unroll", "none", "unroll"]]]}, "result": [[0.32000553119999997], 0, 32.83625078201294, 1598457689.8878798], "version": 0.2, "tvm_version": "0.7.dev1"}
{"input": ["opencl -keys=mali,opencl,gpu -device=mali -max_num_threads=256", "conv2d_nchw_spatial_pack.mali", [["TENSOR", [1, 1024, 14, 14], "float32"], ["TENSOR", [2048, 1024, 1, 1], "float32"], [2, 2], [0, 0, 0, 0], [1, 1], "float32"], {}], "config": {"index": 11658, "code_hash": null, "entity": [["tile_co", "sp", [-1, 8, 8]], ["tile_oh", "sp", [-1, 1, 7]], ["tile_ow", "sp", [-1, 7, 1]], ["reorder_0", "re", [0, 1, 2, 3, 4, 5, 6, 7, 8, 9]], ["ann_reduce", "an", ["none", "none"]], ["ann_spatial", "an", ["none", "none", "vec"]]]}, "result": [[0.061728823], 0, 34.39042901992798, 1598457691.440646], "version": 0.2, "tvm_version": "0.7.dev1"}
{"input": ["opencl -keys=mali,opencl,gpu -device=mali -max_num_threads=256", "conv2d_nchw_spatial_pack.mali", [["TENSOR", [1, 1024, 14, 14], "float32"], ["TENSOR", [2048, 1024, 1, 1], "float32"], [2, 2], [0, 0, 0, 0], [1, 1], "float32"], {}], "config": {"index": 54626, "code_hash": null, "entity": [["tile_co", "sp", [-1, 8, 4]], ["tile_oh", "sp", [-1, 7, 1]], ["tile_ow", "sp", [-1, 1, 7]], ["reorder_0", "re", [0, 1, 2, 3, 4, 5, 6, 9, 7, 8]], ["ann_reduce", "an", ["unroll", "none"]], ["ann_spatial", "an", ["unroll", "none", "unroll"]]]}, "result": [[0.325180802], 0, 40.15531945228577, 1598457697.2075882], "version": 0.2, "tvm_version": "0.7.dev1"}
{"input": ["opencl -keys=mali,opencl,gpu -device=mali -max_num_threads=256", "conv2d_nchw_spatial_pack.mali", [["TENSOR", [1, 1024, 14, 14], "float32"], ["TENSOR", [2048, 1024, 1, 1], "float32"], [2, 2], [0, 0, 0, 0], [1, 1], "float32"], {}], "config": {"index": 72030, "code_hash": null, "entity": [["tile_co", "sp", [-1, 8, 8]], ["tile_oh", "sp", [-1, 1, 7]], ["tile_ow", "sp", [-1, 7, 1]], ["reorder_0", "re", [0, 1, 2, 3, 4, 5, 6, 7, 8, 9]], ["ann_reduce", "an", ["unroll", "unroll"]], ["ann_spatial", "an", ["unroll", "unroll", "unroll"]]]}, "result": [[0.0133180416], 0, 41.013145208358765, 1598457698.0632582], "version": 0.2, "tvm_version": "0.7.dev1"}
{"input": ["opencl -keys=mali,opencl,gpu -device=mali -max_num_threads=256", "conv2d_nchw_spatial_pack.mali", [["TENSOR", [1, 1024, 14, 14], "float32"], ["TENSOR", [2048, 1024, 1, 1], "float32"], [2, 2], [0, 0, 0, 0], [1, 1], "float32"], {}], "config": {"index": 65000, "code_hash": null, "entity": [["tile_co", "sp", [-1, 8, 4]], ["tile_oh", "sp", [-1, 1, 7]], ["tile_ow", "sp", [-1, 7, 1]], ["reorder_0", "re", [0, 1, 2, 3, 4, 5, 6, 7, 8, 9]], ["ann_reduce", "an", ["unroll", "none"]], ["ann_spatial", "an", ["unroll", "unroll", "none"]]]}, "result": [[0.21216551039999998], 0, 4.061599016189575, 1598457702.382829], "version": 0.2, "tvm_version": "0.7.dev1"}
{"input": ["opencl -keys=mali,opencl,gpu -device=mali -max_num_threads=256", "conv2d_nchw_spatial_pack.mali", [["TENSOR", [1, 1024, 14, 14], "float32"], ["TENSOR", [2048, 1024, 1, 1], "float32"], [2, 2], [0, 0, 0, 0], [1, 1], "float32"], {}], "config": {"index": 87475, "code_hash": null, "entity": [["tile_co", "sp", [-1, 16, 8]], ["tile_oh", "sp", [-1, 1, 7]], ["tile_ow", "sp", [-1, 7, 1]], ["reorder_0", "re", [0, 1, 2, 3, 4, 5, 6, 7, 8, 9]], ["ann_reduce", "an", ["unroll", "none"]], ["ann_spatial", "an", ["unroll", "vec", "unroll"]]]}, "result": [[0.0138836458], 0, 4.8995583057403564, 1598457703.2238212], "version": 0.2, "tvm_version": "0.7.dev1"}
{"input": ["opencl -keys=mali,opencl,gpu -device=mali -max_num_threads=256", "conv2d_nchw_spatial_pack.mali", [["TENSOR", [1, 1024, 14, 14], "float32"], ["TENSOR", [2048, 1024, 1, 1], "float32"], [2, 2], [0, 0, 0, 0], [1, 1], "float32"], {}], "config": {"index": 88878, "code_hash": null, "entity": [["tile_co", "sp", [-1, 8, 8]], ["tile_oh", "sp", [-1, 1, 7]], ["tile_ow", "sp", [-1, 7, 1]], ["reorder_0", "re", [0, 1, 2, 3, 4, 5, 6, 7, 8, 9]], ["ann_reduce", "an", ["unroll", "unroll"]], ["ann_spatial", "an", ["unroll", "vec", "unroll"]]]}, "result": [[0.013403979199999999], 0, 5.827823638916016, 1598457704.154451], "version": 0.2, "tvm_version": "0.7.dev1"}
{"input": ["opencl -keys=mali,opencl,gpu -device=mali -max_num_threads=256", "conv2d_nchw_spatial_pack.mali", [["TENSOR", [1, 1024, 14, 14], "float32"], ["TENSOR", [2048, 1024, 1, 1], "float32"], [2, 2], [0, 0, 0, 0], [1, 1], "float32"], {}], "config": {"index": 70617, "code_hash": null, "entity": [["tile_co", "sp", [-1, 16, 4]], ["tile_oh", "sp", [-1, 1, 7]], ["tile_ow", "sp", [-1, 7, 1]], ["reorder_0", "re", [0, 1, 2, 3, 4, 5, 6, 7, 8, 9]], ["ann_reduce", "an", ["unroll", "none"]], ["ann_spatial", "an", ["unroll", "unroll", "unroll"]]]}, "result": [[0.0140187916], 0, 6.627739667892456, 1598457704.9540448], "version": 0.2, "tvm_version": "0.7.dev1"}
{"input": ["opencl -keys=mali,opencl,gpu -device=mali -max_num_threads=256", "conv2d_nchw_spatial_pack.mali", [["TENSOR", [1, 1024, 14, 14], "float32"], ["TENSOR", [2048, 1024, 1, 1], "float32"], [2, 2], [0, 0, 0, 0], [1, 1], "float32"], {}], "config": {"index": 83262, "code_hash": null, "entity": [["tile_co", "sp", [-1, 8, 8]], ["tile_oh", "sp", [-1, 1, 7]], ["tile_ow", "sp", [-1, 7, 1]], ["reorder_0", "re", [0, 1, 2, 3, 4, 5, 6, 7, 8, 9]], ["ann_reduce", "an", ["unroll", "unroll"]], ["ann_spatial", "an", ["unroll", "vec", "none"]]]}, "result": [[0.0992680312], 0, 8.787906885147095, 1598457707.126535], "version": 0.2, "tvm_version": "0.7.dev1"}
{"input": ["opencl -keys=mali,opencl,gpu -device=mali -max_num_threads=256", "conv2d_nchw_spatial_pack.mali", [["TENSOR", [1, 1024, 14, 14], "float32"], ["TENSOR", [2048, 1024, 1, 1], "float32"], [2, 2], [0, 0, 0, 0], [1, 1], "float32"], {}], "config": {"index": 59395, "code_hash": null, "entity": [["tile_co", "sp", [-1, 16, 8]], ["tile_oh", "sp", [-1, 1, 7]], ["tile_ow", "sp", [-1, 7, 1]], ["reorder_0", "re", [0, 1, 2, 3, 4, 5, 6, 7, 8, 9]], ["ann_reduce", "an", ["unroll", "none"]], ["ann_spatial", "an", ["unroll", "none", "vec"]]]}, "result": [[0.0075743436], 0, 9.464359045028687, 1598457707.814888], "version": 0.2, "tvm_version": "0.7.dev1"}
{"input": ["opencl -keys=mali,opencl,gpu -device=mali -max_num_threads=256", "conv2d_nchw_spatial_pack.mali", [["TENSOR", [1, 1024, 14, 14], "float32"], ["TENSOR", [2048, 1024, 1, 1], "float32"], [2, 2], [0, 0, 0, 0], [1, 1], "float32"], {}], "config": {"index": 59385, "code_hash": null, "entity": [["tile_co", "sp", [-1, 16, 4]], ["tile_oh", "sp", [-1, 1, 7]], ["tile_ow", "sp", [-1, 7, 1]], ["reorder_0", "re", [0, 1, 2, 3, 4, 5, 6, 7, 8, 9]], ["ann_reduce", "an", ["unroll", "none"]], ["ann_spatial", "an", ["unroll", "none", "vec"]]]}, "result": [[0.0125198542], 0, 10.221622943878174, 1598457708.5703502], "version": 0.2, "tvm_version": "0.7.dev1"}
{"input": ["opencl -keys=mali,opencl,gpu -device=mali -max_num_threads=256", "conv2d_nchw_spatial_pack.mali", [["TENSOR", [1, 1024, 14, 14], "float32"], ["TENSOR", [2048, 1024, 1, 1], "float32"], [2, 2], [0, 0, 0, 0], [1, 1], "float32"], {}], "config": {"index": 54636, "code_hash": null, "entity": [["tile_co", "sp", [-1, 8, 8]], ["tile_oh", "sp", [-1, 7, 1]], ["tile_ow", "sp", [-1, 1, 7]], ["reorder_0", "re", [0, 1, 2, 3, 4, 5, 6, 9, 7, 8]], ["ann_reduce", "an", ["unroll", "none"]], ["ann_spatial", "an", ["unroll", "none", "unroll"]]]}, "result": [[0.3076975624], 0, 15.727600336074829, 1598457714.080544], "version": 0.2, "tvm_version": "0.7.dev1"}
{"input": ["opencl -keys=mali,opencl,gpu -device=mali -max_num_threads=256", "conv2d_nchw_spatial_pack.mali", [["TENSOR", [1, 1024, 14, 14], "float32"], ["TENSOR", [2048, 1024, 1, 1], "float32"], [2, 2], [0, 0, 0, 0], [1, 1], "float32"], {}], "config": {"index": 53779, "code_hash": null, "entity": [["tile_co", "sp", [-1, 16, 8]], ["tile_oh", "sp", [-1, 1, 7]], ["tile_ow", "sp", [-1, 7, 1]], ["reorder_0", "re", [0, 1, 2, 3, 4, 5, 6, 7, 8, 9]], ["ann_reduce", "an", ["unroll", "none"]], ["ann_spatial", "an", ["unroll", "none", "unroll"]]]}, "result": [[0.013781010399999998], 0, 16.573859930038452, 1598457714.913549], "version": 0.2, "tvm_version": "0.7.dev1"}
{"input": ["opencl -keys=mali,opencl,gpu -device=mali -max_num_threads=256", "conv2d_nchw_spatial_pack.mali", [["TENSOR", [1, 1024, 14, 14], "float32"], ["TENSOR", [2048, 1024, 1, 1], "float32"], [2, 2], [0, 0, 0, 0], [1, 1], "float32"], {}], "config": {"index": 18529, "code_hash": null, "entity": [["tile_co", "sp", [-1, 2, 16]], ["tile_oh", "sp", [-1, 1, 1]], ["tile_ow", "sp", [-1, 7, 1]], ["reorder_0", "re", [0, 1, 2, 3, 4, 5, 6, 7, 8, 9]], ["ann_reduce", "an", ["none", "unroll"]], ["ann_spatial", "an", ["none", "unroll", "none"]]]}, "result": [[0.0783663542], 0, 18.355530500411987, 1598457716.7220428], "version": 0.2, "tvm_version": "0.7.dev1"}
{"input": ["opencl -keys=mali,opencl,gpu -device=mali -max_num_threads=256", "conv2d_nchw_spatial_pack.mali", [["TENSOR", [1, 1024, 14, 14], "float32"], ["TENSOR", [2048, 1024, 1, 1], "float32"], [2, 2], [0, 0, 0, 0], [1, 1], "float32"], {}], "config": {"index": 77655, "code_hash": null, "entity": [["tile_co", "sp", [-1, 8, 16]], ["tile_oh", "sp", [-1, 1, 7]], ["tile_ow", "sp", [-1, 7, 1]], ["reorder_0", "re", [0, 1, 2, 3, 4, 5, 6, 7, 8, 9]], ["ann_reduce", "an", ["unroll", "unroll"]], ["ann_spatial", "an", ["unroll", "unroll", "vec"]]]}, "result": [[0.005387125], 0, 0.6756167411804199, 1598457754.413614], "version": 0.2, "tvm_version": "0.7.dev1"}
{"input": ["opencl -keys=mali,opencl,gpu -device=mali -max_num_threads=256", "conv2d_nchw_spatial_pack.mali", [["TENSOR", [1, 1024, 14, 14], "float32"], ["TENSOR", [2048, 1024, 1, 1], "float32"], [2, 2], [0, 0, 0, 0], [1, 1], "float32"], {}], "config": {"index": 77647, "code_hash": null, "entity": [["tile_co", "sp", [-1, 16, 8]], ["tile_oh", "sp", [-1, 1, 7]], ["tile_ow", "sp", [-1, 7, 1]], ["reorder_0", "re", [0, 1, 2, 3, 4, 5, 6, 7, 8, 9]], ["ann_reduce", "an", ["unroll", "unroll"]], ["ann_spatial", "an", ["unroll", "unroll", "vec"]]]}, "result": [[0.0074226978], 0, 1.3498499393463135, 1598457755.0905359], "version": 0.2, "tvm_version": "0.7.dev1"}
{"input": ["opencl -keys=mali,opencl,gpu -device=mali -max_num_threads=256", "conv2d_nchw_spatial_pack.mali", [["TENSOR", [1, 1024, 14, 14], "float32"], ["TENSOR", [2048, 1024, 1, 1], "float32"], [2, 2], [0, 0, 0, 0], [1, 1], "float32"], {}], "config": {"index": 74847, "code_hash": null, "entity": [["tile_co", "sp", [-1, 8, 16]], ["tile_oh", "sp", [-1, 1, 7]], ["tile_ow", "sp", [-1, 7, 1]], ["reorder_0", "re", [0, 1, 2, 3, 4, 5, 6, 7, 8, 9]], ["ann_reduce", "an", ["none", "unroll"]], ["ann_spatial", "an", ["unroll", "unroll", "vec"]]]}, "result": [[0.0052830834], 0, 2.0129897594451904, 1598457755.759784], "version": 0.2, "tvm_version": "0.7.dev1"}
{"input": ["opencl -keys=mali,opencl,gpu -device=mali -max_num_threads=256", "conv2d_nchw_spatial_pack.mali", [["TENSOR", [1, 1024, 14, 14], "float32"], ["TENSOR", [2048, 1024, 1, 1], "float32"], [2, 2], [0, 0, 0, 0], [1, 1], "float32"], {}], "config": {"index": 74839, "code_hash": null, "entity": [["tile_co", "sp", [-1, 16, 8]], ["tile_oh", "sp", [-1, 1, 7]], ["tile_ow", "sp", [-1, 7, 1]], ["reorder_0", "re", [0, 1, 2, 3, 4, 5, 6, 7, 8, 9]], ["ann_reduce", "an", ["none", "unroll"]], ["ann_spatial", "an", ["unroll", "unroll", "vec"]]]}, "result": [[0.007392510400000001], 0, 2.7197859287261963, 1598457756.475633], "version": 0.2, "tvm_version": "0.7.dev1"}
{"input": ["opencl -keys=mali,opencl,gpu -device=mali -max_num_threads=256", "conv2d_nchw_spatial_pack.mali", [["TENSOR", [1, 1024, 14, 14], "float32"], ["TENSOR", [2048, 1024, 1, 1], "float32"], [2, 2], [0, 0, 0, 0], [1, 1], "float32"], {}], "config": {"index": 76251, "code_hash": null, "entity": [["tile_co", "sp", [-1, 8, 16]], ["tile_oh", "sp", [-1, 1, 7]], ["tile_ow", "sp", [-1, 7, 1]], ["reorder_0", "re", [0, 1, 2, 3, 4, 5, 6, 7, 8, 9]], ["ann_reduce", "an", ["unroll", "none"]], ["ann_spatial", "an", ["unroll", "unroll", "vec"]]]}, "result": [[0.005147698], 0, 3.3762593269348145, 1598457757.12718], "version": 0.2, "tvm_version": "0.7.dev1"}
{"input": ["opencl -keys=mali,opencl,gpu -device=mali -max_num_threads=256", "conv2d_nchw_spatial_pack.mali", [["TENSOR", [1, 1024, 14, 14], "float32"], ["TENSOR", [2048, 1024, 1, 1], "float32"], [2, 2], [0, 0, 0, 0], [1, 1], "float32"], {}], "config": {"index": 73443, "code_hash": null, "entity": [["tile_co", "sp", [-1, 8, 16]], ["tile_oh", "sp", [-1, 1, 7]], ["tile_ow", "sp", [-1, 7, 1]], ["reorder_0", "re", [0, 1, 2, 3, 4, 5, 6, 7, 8, 9]], ["ann_reduce", "an", ["none", "none"]], ["ann_spatial", "an", ["unroll", "unroll", "vec"]]]}, "result": [[0.005122427000000001], 0, 4.007766008377075, 1598457757.7678232], "version": 0.2, "tvm_version": "0.7.dev1"}
{"input": ["opencl -keys=mali,opencl,gpu -device=mali -max_num_threads=256", "conv2d_nchw_spatial_pack.mali", [["TENSOR", [1, 1024, 14, 14], "float32"], ["TENSOR", [2048, 1024, 1, 1], "float32"], [2, 2], [0, 0, 0, 0], [1, 1], "float32"], {}], "config": {"index": 74686, "code_hash": null, "entity": [["tile_co", "sp", [-1, 128, 8]], ["tile_oh", "sp", [-1, 1, 1]], ["tile_ow", "sp", [-1, 7, 1]], ["reorder_0", "re", [0, 1, 2, 3, 4, 5, 6, 7, 8, 9]], ["ann_reduce", "an", ["none", "unroll"]], ["ann_spatial", "an", ["unroll", "unroll", "vec"]]]}, "result": [[0.0104549064], 0, 4.77081298828125, 1598457758.52416], "version": 0.2, "tvm_version": "0.7.dev1"}
{"input": ["opencl -keys=mali,opencl,gpu -device=mali -max_num_threads=256", "conv2d_nchw_spatial_pack.mali", [["TENSOR", [1, 1024, 14, 14], "float32"], ["TENSOR", [2048, 1024, 1, 1], "float32"], [2, 2], [0, 0, 0, 0], [1, 1], "float32"], {}], "config": {"index": 73435, "code_hash": null, "entity": [["tile_co", "sp", [-1, 16, 8]], ["tile_oh", "sp", [-1, 1, 7]], ["tile_ow", "sp", [-1, 7, 1]], ["reorder_0", "re", [0, 1, 2, 3, 4, 5, 6, 7, 8, 9]], ["ann_reduce", "an", ["none", "none"]], ["ann_spatial", "an", ["unroll", "unroll", "vec"]]]}, "result": [[0.0073997915999999995], 0, 5.435849189758301, 1598457759.193046], "version": 0.2, "tvm_version": "0.7.dev1"}
{"input": ["opencl -keys=mali,opencl,gpu -device=mali -max_num_threads=256", "conv2d_nchw_spatial_pack.mali", [["TENSOR", [1, 1024, 14, 14], "float32"], ["TENSOR", [2048, 1024, 1, 1], "float32"], [2, 2], [0, 0, 0, 0], [1, 1], "float32"], {}], "config": {"index": 57991, "code_hash": null, "entity": [["tile_co", "sp", [-1, 16, 8]], ["tile_oh", "sp", [-1, 1, 7]], ["tile_ow", "sp", [-1, 7, 1]], ["reorder_0", "re", [0, 1, 2, 3, 4, 5, 6, 7, 8, 9]], ["ann_reduce", "an", ["none", "unroll"]], ["ann_spatial", "an", ["unroll", "none", "vec"]]]}, "result": [[0.0075471668], 0, 6.111774921417236, 1598457759.87492], "version": 0.2, "tvm_version": "0.7.dev1"}
{"input": ["opencl -keys=mali,opencl,gpu -device=mali -max_num_threads=256", "conv2d_nchw_spatial_pack.mali", [["TENSOR", [1, 1024, 14, 14], "float32"], ["TENSOR", [2048, 1024, 1, 1], "float32"], [2, 2], [0, 0, 0, 0], [1, 1], "float32"], {}], "config": {"index": 74694, "code_hash": null, "entity": [["tile_co", "sp", [-1, 64, 16]], ["tile_oh", "sp", [-1, 1, 1]], ["tile_ow", "sp", [-1, 7, 1]], ["reorder_0", "re", [0, 1, 2, 3, 4, 5, 6, 7, 8, 9]], ["ann_reduce", "an", ["none", "unroll"]], ["ann_spatial", "an", ["unroll", "unroll", "vec"]]]}, "result": [[0.0072966668], 0, 6.739060878753662, 1598457760.5112839], "version": 0.2, "tvm_version": "0.7.dev1"}
{"input": ["opencl -keys=mali,opencl,gpu -device=mali -max_num_threads=256", "conv2d_nchw_spatial_pack.mali", [["TENSOR", [1, 1024, 14, 14], "float32"], ["TENSOR", [2048, 1024, 1, 1], "float32"], [2, 2], [0, 0, 0, 0], [1, 1], "float32"], {}], "config": {"index": 73282, "code_hash": null, "entity": [["tile_co", "sp", [-1, 128, 8]], ["tile_oh", "sp", [-1, 1, 1]], ["tile_ow", "sp", [-1, 7, 1]], ["reorder_0", "re", [0, 1, 2, 3, 4, 5, 6, 7, 8, 9]], ["ann_reduce", "an", ["none", "none"]], ["ann_spatial", "an", ["unroll", "unroll", "vec"]]]}, "result": [[0.0106169062], 0, 7.441376447677612, 1598457761.2224681], "version": 0.2, "tvm_version": "0.7.dev1"}
{"input": ["opencl -keys=mali,opencl,gpu -device=mali -max_num_threads=256", "conv2d_nchw_spatial_pack.mali", [["TENSOR", [1, 1024, 14, 14], "float32"], ["TENSOR", [2048, 1024, 1, 1], "float32"], [2, 2], [0, 0, 0, 0], [1, 1], "float32"], {}], "config": {"index": 60799, "code_hash": null, "entity": [["tile_co", "sp", [-1, 16, 8]], ["tile_oh", "sp", [-1, 1, 7]], ["tile_ow", "sp", [-1, 7, 1]], ["reorder_0", "re", [0, 1, 2, 3, 4, 5, 6, 7, 8, 9]], ["ann_reduce", "an", ["unroll", "unroll"]], ["ann_spatial", "an", ["unroll", "none", "vec"]]]}, "result": [[0.0074409272], 0, 8.115514993667603, 1598457761.89181], "version": 0.2, "tvm_version": "0.7.dev1"}
