logs_gen1/classifier_nhwc.texture.float16.acc16.autotvm.log
{"input": ["opencl -keys=adreno,opencl,gpu -device=adreno -max_num_threads=256 -texture_spatial_limit=16384 -thread_warp_size=1", "dense_small_batch.gpu", [["TENSOR", [1, 1280], "float16"], ["TENSOR", [560, 1280], "float16"], null, "float16"], {}], "config": {"index": 10, "code_hash": null, "entity": [["tile_k", "sp", [-1, 64]]]}, "result": [[5.591039999999999e-05], 0, 37.616060733795166, 1677559849.7294261], "version": 0.2, "tvm_version": "0.11.dev0"}
{"input": ["opencl -keys=adreno,opencl,gpu -device=adreno -max_num_threads=256 -texture_spatial_limit=16384 -thread_warp_size=1", "dense_small_batch.gpu", [["TENSOR", [1, 1280], "float16"], ["TENSOR", [2507, 1280], "float16"], null, "float16"], {}], "config": {"index": 12, "code_hash": null, "entity": [["tile_k", "sp", [-1, 128]]]}, "result": [[0.00026978304], 0, 11.704958438873291, 1677559948.7872512], "version": 0.2, "tvm_version": "0.11.dev0"}
{"input": ["opencl -keys=adreno,opencl,gpu -device=adreno -max_num_threads=256 -texture_spatial_limit=16384 -thread_warp_size=1", "conv2d_nhwc.image2d", [["TENSOR", [1, 7, 7, 192], "float16"], ["TENSOR", [1, 1, 192, 1280], "float16"], [1, 1], [0, 0, 0, 0], [1, 1], "float16"], {}], "config": {"index": 8185, "code_hash": null, "entity": [["tile_fc", "sp", [-1, 1, 80]], ["tile_y", "sp", [-1, 2, 1]], ["tile_x", "sp", [-1, 2, 4]], ["tile_rcc", "sp", [-1, 2]], ["tile_ry", "sp", [-1, 1]], ["tile_rx", "sp", [-1, 1]], ["auto_unroll_max_step", "ot", 0], ["unroll_explicit", "ot", 0]]}, "result": [[7.058432e-05], 0, 38.95667839050293, 1677563212.029292], "version": 0.2, "tvm_version": "0.11.dev0"}
{"input": ["opencl -keys=adreno,opencl,gpu -device=adreno -max_num_threads=256 -texture_spatial_limit=16384 -thread_warp_size=1", "conv2d_nhwc.image2d", [["TENSOR", [1, 7, 7, 1536], "float16"], ["TENSOR", [1, 1, 1536, 192], "float16"], [1, 1], [0, 0, 0, 0], [1, 1], "float16"], {}], "config": {"index": 294798, "code_hash": null, "entity": [["tile_fc", "sp", [-1, 1, 8]], ["tile_y", "sp", [-1, 1, 8]], ["tile_x", "sp", [-1, 1, 1]], ["tile_rcc", "sp", [-1, 384]], ["tile_ry", "sp", [-1, 1]], ["tile_rx", "sp", [-1, 1]], ["auto_unroll_max_step", "ot", 1500], ["unroll_explicit", "ot", 1]]}, "result": [[0.00016023552], 0, 31.707966566085815, 1677569252.2481058], "version": 0.2, "tvm_version": "0.11.dev0"}
{"input": ["opencl -keys=adreno,opencl,gpu -device=adreno -max_num_threads=256 -texture_spatial_limit=16384 -thread_warp_size=1", "depthwise_conv2d_nhwc.image2d", [["TENSOR", [1, 7, 7, 1536], "float16"], ["TENSOR", [5, 5, 1536, 1], "float16"], [1, 1], [2, 2, 2, 2], [1, 1], "float16"], {}], "config": {"index": 120830, "code_hash": null, "entity": [["tile_fc", "sp", [-1, 1, 32]], ["tile_y", "sp", [-1, 2, 4]], ["tile_x", "sp", [-1, 2, 1]], ["tile_ry", "sp", [-1, 5]], ["tile_rx", "sp", [-1, 5]], ["auto_unroll_max_step", "ot", 1500], ["unroll_explicit", "ot", 0]]}, "result": [[4.3847679999999996e-05], 0, 26.02366018295288, 1677572732.8390105], "version": 0.2, "tvm_version": "0.11.dev0"}
{"input": ["opencl -keys=adreno,opencl,gpu -device=adreno -max_num_threads=256 -texture_spatial_limit=16384 -thread_warp_size=1", "conv2d_nhwc.image2d", [["TENSOR", [1, 7, 7, 192], "float16"], ["TENSOR", [1, 1, 192, 1536], "float16"], [1, 1], [0, 0, 0, 0], [1, 1], "float16"], {}], "config": {"index": 129340, "code_hash": null, "entity": [["tile_fc", "sp", [-1, 1, 32]], ["tile_y", "sp", [-1, 2, 2]], ["tile_x", "sp", [-1, 2, 2]], ["tile_rcc", "sp", [-1, 2]], ["tile_ry", "sp", [-1, 1]], ["tile_rx", "sp", [-1, 1]], ["auto_unroll_max_step", "ot", 1500], ["unroll_explicit", "ot", 0]]}, "result": [[8.11776e-05], 0, 45.10326051712036, 1677577441.9344954], "version": 0.2, "tvm_version": "0.11.dev0"}
{"input": ["opencl -keys=adreno,opencl,gpu -device=adreno -max_num_threads=256 -texture_spatial_limit=16384 -thread_warp_size=1", "conv2d_nhwc.image2d", [["TENSOR", [1, 7, 7, 1152], "float16"], ["TENSOR", [1, 1, 1152, 192], "float16"], [1, 1], [0, 0, 0, 0], [1, 1], "float16"], {}], "config": {"index": 235522, "code_hash": null, "entity": [["tile_fc", "sp", [-1, 1, 6]], ["tile_y", "sp", [-1, 1, 4]], ["tile_x", "sp", [-1, 1, 8]], ["tile_rcc", "sp", [-1, 4]], ["tile_ry", "sp", [-1, 1]], ["tile_rx", "sp", [-1, 1]], ["auto_unroll_max_step", "ot", 512], ["unroll_explicit", "ot", 1]]}, "result": [[0.00013718528], 0, 30.184127807617188, 1677582597.6191652], "version": 0.2, "tvm_version": "0.11.dev0"}
{"input": ["opencl -keys=adreno,opencl,gpu -device=adreno -max_num_threads=256 -texture_spatial_limit=16384 -thread_warp_size=1", "depthwise_conv2d_nhwc.image2d", [["TENSOR", [1, 17, 17, 1152], "float16"], ["TENSOR", [5, 5, 1152, 1], "float16"], [2, 2], [0, 0, 0, 0], [1, 1], "float16"], {}], "config": {"index": 27204, "code_hash": null, "entity": [["tile_fc", "sp", [-1, 1, 48]], ["tile_y", "sp", [-1, 2, 2]], ["tile_x", "sp", [-1, 2, 1]], ["tile_ry", "sp", [-1, 1]], ["tile_rx", "sp", [-1, 5]], ["auto_unroll_max_step", "ot", 0], ["unroll_explicit", "ot", 0]]}, "result": [[6.829568e-05], 0, 44.18314290046692, 1677586028.4278502], "version": 0.2, "tvm_version": "0.11.dev0"}
{"input": ["opencl -keys=adreno,opencl,gpu -device=adreno -max_num_threads=256 -texture_spatial_limit=16384 -thread_warp_size=1", "conv2d_nhwc.image2d", [["TENSOR", [1, 17, 17, 1152], "float16"], ["TENSOR", [1, 1, 1152, 144], "float16"], [1, 1], [0, 0, 0, 0], [1, 1], "float16"], {}], "config": {"index": 169758, "code_hash": null, "entity": [["tile_fc", "sp", [-1, 1, 12]], ["tile_y", "sp", [-1, 4, 1]], ["tile_x", "sp", [-1, 1, 5]], ["tile_rcc", "sp", [-1, 2]], ["tile_ry", "sp", [-1, 1]], ["tile_rx", "sp", [-1, 1]], ["auto_unroll_max_step", "ot", 1500], ["unroll_explicit", "ot", 0]]}, "result": [[0.0002741504], 0, 5.009756565093994, 1677594591.9124033], "version": 0.2, "tvm_version": "0.11.dev0"}
{"input": ["opencl -keys=adreno,opencl,gpu -device=adreno -max_num_threads=256 -texture_spatial_limit=16384 -thread_warp_size=1", "depthwise_conv2d_nhwc.image2d", [["TENSOR", [1, 17, 17, 1152], "float16"], ["TENSOR", [5, 5, 1152, 1], "float16"], [1, 1], [2, 2, 2, 2], [1, 1], "float16"], {}], "config": {"index": 915007, "code_hash": null, "entity": [["tile_fc", "sp", [-1, 1, 96]], ["tile_y", "sp", [-1, 2, 2]], ["tile_x", "sp", [-1, 2, 2]], ["tile_ry", "sp", [-1, 1]], ["tile_rx", "sp", [-1, 5]], ["auto_unroll_max_step", "ot", 1500], ["unroll_explicit", "ot", 1]]}, "result": [[0.00014853632], 0, 39.83118534088135, 1677598271.473008], "version": 0.2, "tvm_version": "0.11.dev0"}
{"input": ["opencl -keys=adreno,opencl,gpu -device=adreno -max_num_threads=256 -texture_spatial_limit=16384 -thread_warp_size=1", "conv2d_nhwc.image2d", [["TENSOR", [1, 17, 17, 144], "float16"], ["TENSOR", [1, 1, 144, 1152], "float16"], [1, 1], [0, 0, 0, 0], [1, 1], "float16"], {}], "config": {"index": 213610, "code_hash": null, "entity": [["tile_fc", "sp", [-1, 2, 36]], ["tile_y", "sp", [-1, 2, 1]], ["tile_x", "sp", [-1, 4, 5]], ["tile_rcc", "sp", [-1, 12]], ["tile_ry", "sp", [-1, 1]], ["tile_rx", "sp", [-1, 1]], ["auto_unroll_max_step", "ot", 512], ["unroll_explicit", "ot", 0]]}, "result": [[0.00017250816], 0, 53.530131578445435, 1677603740.151308], "version": 0.2, "tvm_version": "0.11.dev0"}
{"input": ["opencl -keys=adreno,opencl,gpu -device=adreno -max_num_threads=256 -texture_spatial_limit=16384 -thread_warp_size=1", "conv2d_nhwc.image2d", [["TENSOR", [1, 17, 17, 768], "float16"], ["TENSOR", [1, 1, 768, 144], "float16"], [1, 1], [0, 0, 0, 0], [1, 1], "float16"], {}], "config": {"index": 76417, "code_hash": null, "entity": [["tile_fc", "sp", [-1, 1, 6]], ["tile_y", "sp", [-1, 1, 2]], ["tile_x", "sp", [-1, 2, 10]], ["tile_rcc", "sp", [-1, 3]], ["tile_ry", "sp", [-1, 1]], ["tile_rx", "sp", [-1, 1]], ["auto_unroll_max_step", "ot", 512], ["unroll_explicit", "ot", 0]]}, "result": [[0.00022298111999999998], 0, 26.796847343444824, 1677611076.5369625], "version": 0.2, "tvm_version": "0.11.dev0"}
{"input": ["opencl -keys=adreno,opencl,gpu -device=adreno -max_num_threads=256 -texture_spatial_limit=16384 -thread_warp_size=1", "conv2d_nhwc.image2d", [["TENSOR", [1, 17, 17, 768], "float16"], ["TENSOR", [1, 1, 768, 96], "float16"], [1, 1], [0, 0, 0, 0], [1, 1], "float16"], {}], "config": {"index": 64992, "code_hash": null, "entity": [["tile_fc", "sp", [-1, 1, 12]], ["tile_y", "sp", [-1, 1, 1]], ["tile_x", "sp", [-1, 4, 5]], ["tile_rcc", "sp", [-1, 2]], ["tile_ry", "sp", [-1, 1]], ["tile_rx", "sp", [-1, 1]], ["auto_unroll_max_step", "ot", 512], ["unroll_explicit", "ot", 0]]}, "result": [[0.0001475328], 0, 18.51777696609497, 1677613052.7793264], "version": 0.2, "tvm_version": "0.11.dev0"}
{"input": ["opencl -keys=adreno,opencl,gpu -device=adreno -max_num_threads=256 -texture_spatial_limit=16384 -thread_warp_size=1", "depthwise_conv2d_nhwc.image2d", [["TENSOR", [1, 17, 17, 768], "float16"], ["TENSOR", [5, 5, 768, 1], "float16"], [1, 1], [2, 2, 2, 2], [1, 1], "float16"], {}], "config": {"index": 581275, "code_hash": null, "entity": [["tile_fc", "sp", [-1, 1, 64]], ["tile_y", "sp", [-1, 2, 2]], ["tile_x", "sp", [-1, 1, 2]], ["tile_ry", "sp", [-1, 5]], ["tile_rx", "sp", [-1, 1]], ["auto_unroll_max_step", "ot", 1500], ["unroll_explicit", "ot", 1]]}, "result": [[0.0001045248], 0, 12.602695941925049, 1677621639.8297253], "version": 0.2, "tvm_version": "0.11.dev0"}
{"input": ["opencl -keys=adreno,opencl,gpu -device=adreno -max_num_threads=256 -texture_spatial_limit=16384 -thread_warp_size=1", "conv2d_nhwc.image2d", [["TENSOR", [1, 17, 17, 96], "float16"], ["TENSOR", [1, 1, 96, 768], "float16"], [1, 1], [0, 0, 0, 0], [1, 1], "float16"], {}], "config": {"index": 224242, "code_hash": null, "entity": [["tile_fc", "sp", [-1, 1, 64]], ["tile_y", "sp", [-1, 1, 1]], ["tile_x", "sp", [-1, 5, 2]], ["tile_rcc", "sp", [-1, 12]], ["tile_ry", "sp", [-1, 1]], ["tile_rx", "sp", [-1, 1]], ["auto_unroll_max_step", "ot", 1500], ["unroll_explicit", "ot", 0]]}, "result": [[9.301504e-05], 0, 53.44303345680237, 1677627947.8676147], "version": 0.2, "tvm_version": "0.11.dev0"}
{"input": ["opencl -keys=adreno,opencl,gpu -device=adreno -max_num_threads=256 -texture_spatial_limit=16384 -thread_warp_size=1", "conv2d_nhwc.image2d", [["TENSOR", [1, 17, 17, 384], "float16"], ["TENSOR", [1, 1, 384, 96], "float16"], [1, 1], [0, 0, 0, 0], [1, 1], "float16"], {}], "config": {"index": 210144, "code_hash": null, "entity": [["tile_fc", "sp", [-1, 1, 12]], ["tile_y", "sp", [-1, 2, 5]], ["tile_x", "sp", [-1, 1, 1]], ["tile_rcc", "sp", [-1, 4]], ["tile_ry", "sp", [-1, 1]], ["tile_rx", "sp", [-1, 1]], ["auto_unroll_max_step", "ot", 512], ["unroll_explicit", "ot", 1]]}, "result": [[8.254975999999998e-05], 0, 32.72623586654663, 1677633080.536097], "version": 0.2, "tvm_version": "0.11.dev0"}
{"input": ["opencl -keys=adreno,opencl,gpu -device=adreno -max_num_threads=256 -texture_spatial_limit=16384 -thread_warp_size=1", "depthwise_conv2d_nhwc.image2d", [["TENSOR", [1, 38, 38, 384], "float16"], ["TENSOR", [5, 5, 384, 1], "float16"], [2, 2], [0, 0, 0, 0], [1, 1], "float16"], {}], "config": {"index": 456553, "code_hash": null, "entity": [["tile_fc", "sp", [-1, 1, 24]], ["tile_y", "sp", [-1, 1, 4]], ["tile_x", "sp", [-1, 1, 2]], ["tile_ry", "sp", [-1, 1]], ["tile_rx", "sp", [-1, 5]], ["auto_unroll_max_step", "ot", 1500], ["unroll_explicit", "ot", 1]]}, "result": [[0.00010816000000000001], 0, 11.99312448501587, 1677637506.053104], "version": 0.2, "tvm_version": "0.11.dev0"}
{"input": ["opencl -keys=adreno,opencl,gpu -device=adreno -max_num_threads=256 -texture_spatial_limit=16384 -thread_warp_size=1", "conv2d_nhwc.image2d", [["TENSOR", [1, 38, 38, 48], "float16"], ["TENSOR", [1, 1, 48, 384], "float16"], [1, 1], [0, 0, 0, 0], [1, 1], "float16"], {}], "config": {"index": 313485, "code_hash": null, "entity": [["tile_fc", "sp", [-1, 1, 96]], ["tile_y", "sp", [-1, 2, 1]], ["tile_x", "sp", [-1, 4, 2]], ["tile_rcc", "sp", [-1, 12]], ["tile_ry", "sp", [-1, 1]], ["tile_rx", "sp", [-1, 1]], ["auto_unroll_max_step", "ot", 1500], ["unroll_explicit", "ot", 0]]}, "result": [[8.803328000000001e-05], 0, 12.090771913528442, 1677644364.8829973], "version": 0.2, "tvm_version": "0.11.dev0"}
{"input": ["opencl -keys=adreno,opencl,gpu -device=adreno -max_num_threads=256 -texture_spatial_limit=16384 -thread_warp_size=1", "conv2d_nhwc.image2d", [["TENSOR", [1, 38, 38, 384], "float16"], ["TENSOR", [1, 1, 384, 48], "float16"], [1, 1], [0, 0, 0, 0], [1, 1], "float16"], {}], "config": {"index": 8891, "code_hash": null, "entity": [["tile_fc", "sp", [-1, 1, 12]], ["tile_y", "sp", [-1, 1, 2]], ["tile_x", "sp", [-1, 4, 5]], ["tile_rcc", "sp", [-1, 2]], ["tile_ry", "sp", [-1, 1]], ["tile_rx", "sp", [-1, 1]], ["auto_unroll_max_step", "ot", 0], ["unroll_explicit", "ot", 0]]}, "result": [[0.00013684224], 0, 52.755205392837524, 1677648477.6033525], "version": 0.2, "tvm_version": "0.11.dev0"}
{"input": ["opencl -keys=adreno,opencl,gpu -device=adreno -max_num_threads=256 -texture_spatial_limit=16384 -thread_warp_size=1", "conv2d_nhwc.image2d", [["TENSOR", [1, 38, 38, 48], "float16"], ["TENSOR", [3, 3, 48, 384], "float16"], [1, 1], [1, 1, 1, 1], [1, 1], "float16"], {}], "config": {"index": 1616174, "code_hash": null, "entity": [["tile_fc", "sp", [-1, 1, 32]], ["tile_y", "sp", [-1, 2, 1]], ["tile_x", "sp", [-1, 5, 2]], ["tile_rcc", "sp", [-1, 12]], ["tile_ry", "sp", [-1, 1]], ["tile_rx", "sp", [-1, 3]], ["auto_unroll_max_step", "ot", 0], ["unroll_explicit", "ot", 1]]}, "result": [[0.0005413068799999999], 0, 33.73771405220032, 1677657905.686514], "version": 0.2, "tvm_version": "0.11.dev0"}
{"input": ["opencl -keys=adreno,opencl,gpu -device=adreno -max_num_threads=256 -texture_spatial_limit=16384 -thread_warp_size=1", "conv2d_nhwc_winograd.image2d", [["TENSOR", [1, 38, 38, 48], "float16"], ["TENSOR", [3, 3, 48, 384], "float16"], [1, 1], [1, 1, 1, 1], [1, 1], "float16"], {}], "config": {"index": 311, "code_hash": null, "entity": [["auto_unroll_max_step", "ot", 16], ["tile_y", "sp", [-1, 4, 24]], ["tile_x", "sp", [-1, 1, 19]], ["tile_rc", "sp", [-1, 1]]]}, "result": [[0.00223770624], 0, 11.589397668838501, 1677661783.5071037], "version": 0.2, "tvm_version": "0.11.dev0"}
{"input": ["opencl -keys=adreno,opencl,gpu -device=adreno -max_num_threads=256 -texture_spatial_limit=16384 -thread_warp_size=1", "conv2d_nhwc.image2d", [["TENSOR", [1, 75, 75, 256], "float16"], ["TENSOR", [1, 1, 256, 48], "float16"], [2, 2], [0, 0, 0, 0], [1, 1], "float16"], {}], "config": {"index": 48035, "code_hash": null, "entity": [["tile_fc", "sp", [-1, 1, 12]], ["tile_y", "sp", [-1, 1, 5]], ["tile_x", "sp", [-1, 2, 1]], ["tile_rcc", "sp", [-1, 4]], ["tile_ry", "sp", [-1, 1]], ["tile_rx", "sp", [-1, 1]], ["auto_unroll_max_step", "ot", 512], ["unroll_explicit", "ot", 0]]}, "result": [[0.00023420928], 0, 4.968621253967285, 1677667895.876017], "version": 0.2, "tvm_version": "0.11.dev0"}
{"input": ["opencl -keys=adreno,opencl,gpu -device=adreno -max_num_threads=256 -texture_spatial_limit=16384 -thread_warp_size=1", "conv2d_nhwc.image2d", [["TENSOR", [1, 75, 75, 256], "float16"], ["TENSOR", [1, 1, 256, 32], "float16"], [1, 1], [0, 0, 0, 0], [1, 1], "float16"], {}], "config": {"index": 5177, "code_hash": null, "entity": [["tile_fc", "sp", [-1, 1, 8]], ["tile_y", "sp", [-1, 2, 2]], ["tile_x", "sp", [-1, 1, 4]], ["tile_rcc", "sp", [-1, 4]], ["tile_ry", "sp", [-1, 1]], ["tile_rx", "sp", [-1, 1]], ["auto_unroll_max_step", "ot", 0], ["unroll_explicit", "ot", 1]]}, "result": [[0.00036500991999999997], 0, 12.734487056732178, 1677670412.6182544], "version": 0.2, "tvm_version": "0.11.dev0"}
{"input": ["opencl -keys=adreno,opencl,gpu -device=adreno -max_num_threads=256 -texture_spatial_limit=16384 -thread_warp_size=1", "conv2d_nhwc.image2d", [["TENSOR", [1, 75, 75, 32], "float16"], ["TENSOR", [3, 3, 32, 256], "float16"], [1, 1], [1, 1, 1, 1], [1, 1], "float16"], {}], "config": {"index": 12616, "code_hash": null, "entity": [["tile_fc", "sp", [-1, 2, 32]], ["tile_y", "sp", [-1, 2, 2]], ["tile_x", "sp", [-1, 4, 1]], ["tile_rcc", "sp", [-1, 8]], ["tile_ry", "sp", [-1, 1]], ["tile_rx", "sp", [-1, 1]], ["auto_unroll_max_step", "ot", 512], ["unroll_explicit", "ot", 0]]}, "result": [[0.00083649536], 0, 54.363120555877686, 1677674447.6342368], "version": 0.2, "tvm_version": "0.11.dev0"}
{"input": ["opencl -keys=adreno,opencl,gpu -device=adreno -max_num_threads=256 -texture_spatial_limit=16384 -thread_warp_size=1", "conv2d_nhwc_winograd.image2d", [["TENSOR", [1, 75, 75, 32], "float16"], ["TENSOR", [3, 3, 32, 256], "float16"], [1, 1], [1, 1, 1, 1], [1, 1], "float16"], {}], "config": {"index": 399, "code_hash": null, "entity": [["auto_unroll_max_step", "ot", 0], ["tile_y", "sp", [-1, 8, 2]], ["tile_x", "sp", [-1, 4, 19]], ["tile_rc", "sp", [-1, 4]]]}, "result": [[0.0043805696], 0, 51.72349309921265, 1677675509.632683], "version": 0.2, "tvm_version": "0.11.dev0"}
{"input": ["opencl -keys=adreno,opencl,gpu -device=adreno -max_num_threads=256 -texture_spatial_limit=16384 -thread_warp_size=1", "conv2d_nhwc.image2d", [["TENSOR", [1, 149, 149, 192], "float16"], ["TENSOR", [1, 1, 192, 32], "float16"], [2, 2], [0, 0, 0, 0], [1, 1], "float16"], {}], "config": {"index": 2483, "code_hash": null, "entity": [["tile_fc", "sp", [-1, 1, 8]], ["tile_y", "sp", [-1, 1, 4]], ["tile_x", "sp", [-1, 4, 1]], ["tile_rcc", "sp", [-1, 2]], ["tile_ry", "sp", [-1, 1]], ["tile_rx", "sp", [-1, 1]], ["auto_unroll_max_step", "ot", 512], ["unroll_explicit", "ot", 0]]}, "result": [[0.0005895424], 0, 47.44276309013367, 1677677737.3324068], "version": 0.2, "tvm_version": "0.11.dev0"}
{"input": ["opencl -keys=adreno,opencl,gpu -device=adreno -max_num_threads=256 -texture_spatial_limit=16384 -thread_warp_size=1", "conv2d_nhwc.image2d", [["TENSOR", [1, 149, 149, 24], "float16"], ["TENSOR", [3, 3, 24, 192], "float16"], [1, 1], [1, 1, 1, 1], [1, 1], "float16"], {}], "config": {"index": 60941, "code_hash": null, "entity": [["tile_fc", "sp", [-1, 1, 16]], ["tile_y", "sp", [-1, 2, 2]], ["tile_x", "sp", [-1, 4, 2]], ["tile_rcc", "sp", [-1, 6]], ["tile_ry", "sp", [-1, 1]], ["tile_rx", "sp", [-1, 1]], ["auto_unroll_max_step", "ot", 512], ["unroll_explicit", "ot", 0]]}, "result": [[0.00232702976], 0, 5.837372064590454, 1677682566.7193775], "version": 0.2, "tvm_version": "0.11.dev0"}
{"input": ["opencl -keys=adreno,opencl,gpu -device=adreno -max_num_threads=256 -texture_spatial_limit=16384 -thread_warp_size=1", "conv2d_nhwc_winograd.image2d", [["TENSOR", [1, 149, 149, 24], "float16"], ["TENSOR", [3, 3, 24, 192], "float16"], [1, 1], [1, 1, 1, 1], [1, 1], "float16"], {}], "config": {"index": 6551, "code_hash": null, "entity": [["auto_unroll_max_step", "ot", 16], ["tile_y", "sp", [-1, 1, 48]], ["tile_x", "sp", [-1, 5, 9]], ["tile_rc", "sp", [-1, 3]]]}, "result": [[0.0104709632], 0, 67.24671363830566, 1677685667.2518528], "version": 0.2, "tvm_version": "0.11.dev0"}
{"input": ["opencl -keys=adreno,opencl,gpu -device=adreno -max_num_threads=256 -texture_spatial_limit=16384 -thread_warp_size=1", "conv2d_nhwc.image2d", [["TENSOR", [1, 149, 149, 24], "float16"], ["TENSOR", [3, 3, 24, 96], "float16"], [1, 1], [1, 1, 1, 1], [1, 1], "float16"], {}], "config": {"index": 73222, "code_hash": null, "entity": [["tile_fc", "sp", [-1, 1, 8]], ["tile_y", "sp", [-1, 4, 2]], ["tile_x", "sp", [-1, 2, 4]], ["tile_rcc", "sp", [-1, 3]], ["tile_ry", "sp", [-1, 1]], ["tile_rx", "sp", [-1, 1]], ["auto_unroll_max_step", "ot", 1500], ["unroll_explicit", "ot", 0]]}, "result": [[0.00148347904], 0, 55.18897294998169, 1677692924.566814], "version": 0.2, "tvm_version": "0.11.dev0"}
{"input": ["opencl -keys=adreno,opencl,gpu -device=adreno -max_num_threads=256 -texture_spatial_limit=16384 -thread_warp_size=1", "conv2d_nhwc_winograd.image2d", [["TENSOR", [1, 149, 149, 24], "float16"], ["TENSOR", [3, 3, 24, 96], "float16"], [1, 1], [1, 1, 1, 1], [1, 1], "float16"], {}], "config": {"index": 2605, "code_hash": null, "entity": [["auto_unroll_max_step", "ot", 4], ["tile_y", "sp", [-1, 2, 12]], ["tile_x", "sp", [-1, 9, 5]], ["tile_rc", "sp", [-1, 2]]]}, "result": [[0.00292209664], 0, 27.52428889274597, 1677695189.1139436], "version": 0.2, "tvm_version": "0.11.dev0"}
{"input": ["opencl -keys=adreno,opencl,gpu -device=adreno -max_num_threads=256 -texture_spatial_limit=16384 -thread_warp_size=1", "conv2d_nhwc.image2d", [["TENSOR", [1, 149, 149, 96], "float16"], ["TENSOR", [1, 1, 96, 24], "float16"], [1, 1], [0, 0, 0, 0], [1, 1], "float16"], {}], "config": {"index": 4839, "code_hash": null, "entity": [["tile_fc", "sp", [-1, 1, 6]], ["tile_y", "sp", [-1, 1, 4]], ["tile_x", "sp", [-1, 4, 2]], ["tile_rcc", "sp", [-1, 2]], ["tile_ry", "sp", [-1, 1]], ["tile_rx", "sp", [-1, 1]], ["auto_unroll_max_step", "ot", 512], ["unroll_explicit", "ot", 0]]}, "result": [[0.00053549568], 0, 33.07720446586609, 1677698926.348842], "version": 0.2, "tvm_version": "0.11.dev0"}
{"input": ["opencl -keys=adreno,opencl,gpu -device=adreno -max_num_threads=256 -texture_spatial_limit=16384 -thread_warp_size=1", "conv2d_nhwc.image2d", [["TENSOR", [1, 149, 149, 32], "float16"], ["TENSOR", [3, 3, 32, 96], "float16"], [1, 1], [1, 1, 1, 1], [1, 1], "float16"], {}], "config": {"index": 74296, "code_hash": null, "entity": [["tile_fc", "sp", [-1, 2, 12]], ["tile_y", "sp", [-1, 1, 4]], ["tile_x", "sp", [-1, 8, 1]], ["tile_rcc", "sp", [-1, 8]], ["tile_ry", "sp", [-1, 1]], ["tile_rx", "sp", [-1, 1]], ["auto_unroll_max_step", "ot", 1500], ["unroll_explicit", "ot", 0]]}, "result": [[0.00189047808], 0, 12.913804531097412, 1677703346.9407248], "version": 0.2, "tvm_version": "0.11.dev0"}
{"input": ["opencl -keys=adreno,opencl,gpu -device=adreno -max_num_threads=256 -texture_spatial_limit=16384 -thread_warp_size=1", "conv2d_nhwc_winograd.image2d", [["TENSOR", [1, 149, 149, 32], "float16"], ["TENSOR", [3, 3, 32, 96], "float16"], [1, 1], [1, 1, 1, 1], [1, 1], "float16"], {}], "config": {"index": 6002, "code_hash": null, "entity": [["auto_unroll_max_step", "ot", 16], ["tile_y", "sp", [-1, 1, 24]], ["tile_x", "sp", [-1, 5, 5]], ["tile_rc", "sp", [-1, 8]]]}, "result": [[0.00345730048], 0, 26.60650372505188, 1677704754.1691236], "version": 0.2, "tvm_version": "0.11.dev0"}
{"input": ["opencl -keys=adreno,opencl,gpu -device=adreno -max_num_threads=256 -texture_spatial_limit=16384 -thread_warp_size=1", "conv2d_nhwc.image2d", [["TENSOR", [1, 300, 300, 3], "float16"], ["TENSOR", [3, 3, 3, 32], "float16"], [2, 2], [0, 0, 0, 0], [1, 1], "float16"], {}], "config": {"index": 2921, "code_hash": null, "entity": [["tile_fc", "sp", [-1, 1, 8]], ["tile_y", "sp", [-1, 4, 2]], ["tile_x", "sp", [-1, 2, 4]], ["tile_rcc", "sp", [-1, 1]], ["tile_ry", "sp", [-1, 1]], ["tile_rx", "sp", [-1, 1]], ["auto_unroll_max_step", "ot", 512], ["unroll_explicit", "ot", 0]]}, "result": [[0.00015062528], 0, 39.435248374938965, 1677708191.4578001], "version": 0.2, "tvm_version": "0.11.dev0"}
