logs_gen1/detector_nchw.texture.float16.acc16.autotvm.log
{"input": ["opencl -keys=adreno,opencl,gpu -device=adreno -max_num_threads=256 -texture_spatial_limit=16384 -thread_warp_size=1", "conv2d_nchwc.image2d", [["TENSOR", [1, 88, 5, 5], "float16"], ["TENSOR", [36, 88, 3, 3], "float16"], [1, 1], [1, 1, 1, 1], [1, 1], "float16"], {}], "config": {"index": 34985, "code_hash": null, "entity": [["tile_fc", "sp", [-1, 1, 1]], ["tile_y", "sp", [-1, 1, 4]], ["tile_x", "sp", [-1, 1, 8]], ["tile_rcc", "sp", [-1, 2]], ["tile_ry", "sp", [-1, 3]], ["tile_rx", "sp", [-1, 1]], ["auto_unroll_max_step", "ot", 512], ["unroll_explicit", "ot", 1]]}, "result": [[6.31296e-05], 0, 35.04803776741028, 1677182864.7860885], "version": 0.2, "tvm_version": "0.11.dev0"}
{"input": ["opencl -keys=adreno,opencl,gpu -device=adreno -max_num_threads=256 -texture_spatial_limit=16384 -thread_warp_size=1", "conv2d_nchwc.image2d", [["TENSOR", [1, 88, 10, 10], "float16"], ["TENSOR", [36, 88, 3, 3], "float16"], [1, 1], [1, 1, 1, 1], [1, 1], "float16"], {}], "config": {"index": 91269, "code_hash": null, "entity": [["tile_fc", "sp", [-1, 1, 9]], ["tile_y", "sp", [-1, 1, 4]], ["tile_x", "sp", [-1, 3, 1]], ["tile_rcc", "sp", [-1, 22]], ["tile_ry", "sp", [-1, 3]], ["tile_rx", "sp", [-1, 3]], ["auto_unroll_max_step", "ot", 0], ["unroll_explicit", "ot", 1]]}, "result": [[6.76096e-05], 0, 20.105141162872314, 1677184965.4727485], "version": 0.2, "tvm_version": "0.11.dev0"}
{"input": ["opencl -keys=adreno,opencl,gpu -device=adreno -max_num_threads=256 -texture_spatial_limit=16384 -thread_warp_size=1", "conv2d_nchw_winograd.image2d", [["TENSOR", [1, 88, 10, 10], "float16"], ["TENSOR", [36, 88, 3, 3], "float16"], [1, 1], [1, 1, 1, 1], [1, 1], "float16"], {}], "config": {"index": 53, "code_hash": null, "entity": [["auto_unroll_max_step", "ot", 16], ["tile_y", "sp", [-1, 1, 9]], ["tile_x", "sp", [-1, 1, 5]], ["tile_rc", "sp", [-1, 1]]]}, "result": [[5.146624e-05], 0, 16.192358255386353, 1677188385.6968253], "version": 0.2, "tvm_version": "0.11.dev0"}
{"input": ["opencl -keys=adreno,opencl,gpu -device=adreno -max_num_threads=256 -texture_spatial_limit=16384 -thread_warp_size=1", "conv2d_nchwc.image2d", [["TENSOR", [1, 88, 20, 20], "float16"], ["TENSOR", [36, 88, 3, 3], "float16"], [1, 1], [1, 1, 1, 1], [1, 1], "float16"], {}], "config": {"index": 56119, "code_hash": null, "entity": [["tile_fc", "sp", [-1, 1, 9]], ["tile_y", "sp", [-1, 1, 5]], ["tile_x", "sp", [-1, 5, 1]], ["tile_rcc", "sp", [-1, 2]], ["tile_ry", "sp", [-1, 1]], ["tile_rx", "sp", [-1, 3]], ["auto_unroll_max_step", "ot", 0], ["unroll_explicit", "ot", 1]]}, "result": [[8.796160000000001e-05], 0, 41.3022301197052, 1677192133.8327756], "version": 0.2, "tvm_version": "0.11.dev0"}
{"input": ["opencl -keys=adreno,opencl,gpu -device=adreno -max_num_threads=256 -texture_spatial_limit=16384 -thread_warp_size=1", "conv2d_nchw_winograd.image2d", [["TENSOR", [1, 88, 20, 20], "float16"], ["TENSOR", [36, 88, 3, 3], "float16"], [1, 1], [1, 1, 1, 1], [1, 1], "float16"], {}], "config": {"index": 141, "code_hash": null, "entity": [["auto_unroll_max_step", "ot", 0], ["tile_y", "sp", [-1, 1, 9]], ["tile_x", "sp", [-1, 5, 5]], ["tile_rc", "sp", [-1, 1]]]}, "result": [[8.115712e-05], 0, 24.428571701049805, 1677194064.0679832], "version": 0.2, "tvm_version": "0.11.dev0"}
{"input": ["opencl -keys=adreno,opencl,gpu -device=adreno -max_num_threads=256 -texture_spatial_limit=16384 -thread_warp_size=1", "conv2d_nchwc.image2d", [["TENSOR", [1, 88, 40, 40], "float16"], ["TENSOR", [36, 88, 3, 3], "float16"], [1, 1], [1, 1, 1, 1], [1, 1], "float16"], {}], "config": {"index": 81314, "code_hash": null, "entity": [["tile_fc", "sp", [-1, 1, 9]], ["tile_y", "sp", [-1, 5, 2]], ["tile_x", "sp", [-1, 1, 10]], ["tile_rcc", "sp", [-1, 1]], ["tile_ry", "sp", [-1, 3]], ["tile_rx", "sp", [-1, 1]], ["auto_unroll_max_step", "ot", 1500], ["unroll_explicit", "ot", 0]]}, "result": [[0.00016976895999999998], 0, 12.193768501281738, 1677199021.4812737], "version": 0.2, "tvm_version": "0.11.dev0"}
{"input": ["opencl -keys=adreno,opencl,gpu -device=adreno -max_num_threads=256 -texture_spatial_limit=16384 -thread_warp_size=1", "conv2d_nchwc.image2d", [["TENSOR", [1, 88, 5, 5], "float16"], ["TENSOR", [27, 88, 3, 3], "float16"], [1, 1], [1, 1, 1, 1], [1, 1], "float16"], {}], "config": {"index": 20991, "code_hash": null, "entity": [["tile_fc", "sp", [-1, 1, 1]], ["tile_y", "sp", [-1, 1, 4]], ["tile_x", "sp", [-1, 1, 8]], ["tile_rcc", "sp", [-1, 2]], ["tile_ry", "sp", [-1, 3]], ["tile_rx", "sp", [-1, 1]], ["auto_unroll_max_step", "ot", 512], ["unroll_explicit", "ot", 1]]}, "result": [[5.686784e-05], 0, 13.031978368759155, 1677204159.3974624], "version": 0.2, "tvm_version": "0.11.dev0"}
{"input": ["opencl -keys=adreno,opencl,gpu -device=adreno -max_num_threads=256 -texture_spatial_limit=16384 -thread_warp_size=1", "conv2d_nchwc.image2d", [["TENSOR", [1, 88, 5, 5], "float16"], ["TENSOR", [88, 88, 3, 3], "float16"], [1, 1], [1, 1, 1, 1], [1, 1], "float16"], {}], "config": {"index": 31176, "code_hash": null, "entity": [["tile_fc", "sp", [-1, 1, 2]], ["tile_y", "sp", [-1, 1, 2]], ["tile_x", "sp", [-1, 1, 8]], ["tile_rcc", "sp", [-1, 2]], ["tile_ry", "sp", [-1, 3]], ["tile_rx", "sp", [-1, 3]], ["auto_unroll_max_step", "ot", 512], ["unroll_explicit", "ot", 1]]}, "result": [[7.062528e-05], 0, 23.358386754989624, 1677209200.1678867], "version": 0.2, "tvm_version": "0.11.dev0"}
{"input": ["opencl -keys=adreno,opencl,gpu -device=adreno -max_num_threads=256 -texture_spatial_limit=16384 -thread_warp_size=1", "conv2d_nchw_winograd.image2d", [["TENSOR", [1, 88, 5, 5], "float16"], ["TENSOR", [88, 88, 3, 3], "float16"], [1, 1], [1, 1, 1, 1], [1, 1], "float16"], {}], "config": {"index": 136, "code_hash": null, "entity": [["auto_unroll_max_step", "ot", 4], ["tile_y", "sp", [-1, 1, 11]], ["tile_x", "sp", [-1, 3, 3]], ["tile_rc", "sp", [-1, 2]]]}, "result": [[5.2741120000000004e-05], 0, 52.46763229370117, 1677209873.3159902], "version": 0.2, "tvm_version": "0.11.dev0"}
{"input": ["opencl -keys=adreno,opencl,gpu -device=adreno -max_num_threads=256 -texture_spatial_limit=16384 -thread_warp_size=1", "conv2d_nchwc.image2d", [["TENSOR", [1, 88, 10, 10], "float16"], ["TENSOR", [27, 88, 3, 3], "float16"], [1, 1], [1, 1, 1, 1], [1, 1], "float16"], {}], "config": {"index": 53900, "code_hash": null, "entity": [["tile_fc", "sp", [-1, 1, 7]], ["tile_y", "sp", [-1, 1, 6]], ["tile_x", "sp", [-1, 3, 1]], ["tile_rcc", "sp", [-1, 11]], ["tile_ry", "sp", [-1, 3]], ["tile_rx", "sp", [-1, 3]], ["auto_unroll_max_step", "ot", 0], ["unroll_explicit", "ot", 1]]}, "result": [[6.67136e-05], 0, 40.144885301589966, 1677213645.989057], "version": 0.2, "tvm_version": "0.11.dev0"}
{"input": ["opencl -keys=adreno,opencl,gpu -device=adreno -max_num_threads=256 -texture_spatial_limit=16384 -thread_warp_size=1", "conv2d_nchw_winograd.image2d", [["TENSOR", [1, 88, 10, 10], "float16"], ["TENSOR", [27, 88, 3, 3], "float16"], [1, 1], [1, 1, 1, 1], [1, 1], "float16"], {}], "config": {"index": 71, "code_hash": null, "entity": [["auto_unroll_max_step", "ot", 16], ["tile_y", "sp", [-1, 1, 7]], ["tile_x", "sp", [-1, 1, 5]], ["tile_rc", "sp", [-1, 2]]]}, "result": [[4.939776e-05], 0, 45.22157526016235, 1677214899.898072], "version": 0.2, "tvm_version": "0.11.dev0"}
{"input": ["opencl -keys=adreno,opencl,gpu -device=adreno -max_num_threads=256 -texture_spatial_limit=16384 -thread_warp_size=1", "conv2d_nchwc.image2d", [["TENSOR", [1, 88, 10, 10], "float16"], ["TENSOR", [88, 88, 3, 3], "float16"], [1, 1], [1, 1, 1, 1], [1, 1], "float16"], {}], "config": {"index": 68322, "code_hash": null, "entity": [["tile_fc", "sp", [-1, 2, 11]], ["tile_y", "sp", [-1, 1, 4]], ["tile_x", "sp", [-1, 2, 1]], ["tile_rcc", "sp", [-1, 22]], ["tile_ry", "sp", [-1, 1]], ["tile_rx", "sp", [-1, 3]], ["auto_unroll_max_step", "ot", 0], ["unroll_explicit", "ot", 1]]}, "result": [[9.182208e-05], 0, 49.007554054260254, 1677218219.6839306], "version": 0.2, "tvm_version": "0.11.dev0"}
{"input": ["opencl -keys=adreno,opencl,gpu -device=adreno -max_num_threads=256 -texture_spatial_limit=16384 -thread_warp_size=1", "conv2d_nchw_winograd.image2d", [["TENSOR", [1, 88, 10, 10], "float16"], ["TENSOR", [88, 88, 3, 3], "float16"], [1, 1], [1, 1, 1, 1], [1, 1], "float16"], {}], "config": {"index": 430, "code_hash": null, "entity": [["auto_unroll_max_step", "ot", 4], ["tile_y", "sp", [-1, 1, 22]], ["tile_x", "sp", [-1, 1, 5]], ["tile_rc", "sp", [-1, 22]]]}, "result": [[6.386688000000001e-05], 0, 64.04436802864075, 1677221916.1507776], "version": 0.2, "tvm_version": "0.11.dev0"}
{"input": ["opencl -keys=adreno,opencl,gpu -device=adreno -max_num_threads=256 -texture_spatial_limit=16384 -thread_warp_size=1", "conv2d_nchwc.image2d", [["TENSOR", [1, 88, 20, 20], "float16"], ["TENSOR", [27, 88, 3, 3], "float16"], [1, 1], [1, 1, 1, 1], [1, 1], "float16"], {}], "config": {"index": 46685, "code_hash": null, "entity": [["tile_fc", "sp", [-1, 1, 7]], ["tile_y", "sp", [-1, 1, 4]], ["tile_x", "sp", [-1, 2, 2]], ["tile_rcc", "sp", [-1, 22]], ["tile_ry", "sp", [-1, 3]], ["tile_rx", "sp", [-1, 3]], ["auto_unroll_max_step", "ot", 512], ["unroll_explicit", "ot", 1]]}, "result": [[9.534976000000001e-05], 0, 34.422548055648804, 1677226327.6428583], "version": 0.2, "tvm_version": "0.11.dev0"}
{"input": ["opencl -keys=adreno,opencl,gpu -device=adreno -max_num_threads=256 -texture_spatial_limit=16384 -thread_warp_size=1", "conv2d_nchw_winograd.image2d", [["TENSOR", [1, 88, 20, 20], "float16"], ["TENSOR", [27, 88, 3, 3], "float16"], [1, 1], [1, 1, 1, 1], [1, 1], "float16"], {}], "config": {"index": 420, "code_hash": null, "entity": [["auto_unroll_max_step", "ot", 0], ["tile_y", "sp", [-1, 1, 7]], ["tile_x", "sp", [-1, 5, 5]], ["tile_rc", "sp", [-1, 22]]]}, "result": [[7.671296e-05], 0, 22.896154403686523, 1677227135.4412823], "version": 0.2, "tvm_version": "0.11.dev0"}
{"input": ["opencl -keys=adreno,opencl,gpu -device=adreno -max_num_threads=256 -texture_spatial_limit=16384 -thread_warp_size=1", "conv2d_nchwc.image2d", [["TENSOR", [1, 88, 20, 20], "float16"], ["TENSOR", [88, 88, 3, 3], "float16"], [1, 1], [1, 1, 1, 1], [1, 1], "float16"], {}], "config": {"index": 56349, "code_hash": null, "entity": [["tile_fc", "sp", [-1, 1, 11]], ["tile_y", "sp", [-1, 5, 1]], ["tile_x", "sp", [-1, 1, 10]], ["tile_rcc", "sp", [-1, 22]], ["tile_ry", "sp", [-1, 3]], ["tile_rx", "sp", [-1, 1]], ["auto_unroll_max_step", "ot", 512], ["unroll_explicit", "ot", 1]]}, "result": [[0.00011153919999999999], 0, 20.807494640350342, 1677232052.2349236], "version": 0.2, "tvm_version": "0.11.dev0"}
{"input": ["opencl -keys=adreno,opencl,gpu -device=adreno -max_num_threads=256 -texture_spatial_limit=16384 -thread_warp_size=1", "conv2d_nchw_winograd.image2d", [["TENSOR", [1, 88, 20, 20], "float16"], ["TENSOR", [88, 88, 3, 3], "float16"], [1, 1], [1, 1, 1, 1], [1, 1], "float16"], {}], "config": {"index": 210, "code_hash": null, "entity": [["auto_unroll_max_step", "ot", 0], ["tile_y", "sp", [-1, 2, 11]], ["tile_x", "sp", [-1, 10, 5]], ["tile_rc", "sp", [-1, 1]]]}, "result": [[0.00011663360000000001], 0, 51.885555028915405, 1677233492.9945843], "version": 0.2, "tvm_version": "0.11.dev0"}
{"input": ["opencl -keys=adreno,opencl,gpu -device=adreno -max_num_threads=256 -texture_spatial_limit=16384 -thread_warp_size=1", "conv2d_nchwc.image2d", [["TENSOR", [1, 88, 40, 40], "float16"], ["TENSOR", [27, 88, 3, 3], "float16"], [1, 1], [1, 1, 1, 1], [1, 1], "float16"], {}], "config": {"index": 20954, "code_hash": null, "entity": [["tile_fc", "sp", [-1, 1, 7]], ["tile_y", "sp", [-1, 1, 5]], ["tile_x", "sp", [-1, 5, 8]], ["tile_rcc", "sp", [-1, 22]], ["tile_ry", "sp", [-1, 3]], ["tile_rx", "sp", [-1, 3]], ["auto_unroll_max_step", "ot", 0], ["unroll_explicit", "ot", 0]]}, "result": [[0.00015749632], 0, 12.695502281188965, 1677239473.1699865], "version": 0.2, "tvm_version": "0.11.dev0"}
{"input": ["opencl -keys=adreno,opencl,gpu -device=adreno -max_num_threads=256 -texture_spatial_limit=16384 -thread_warp_size=1", "conv2d_nchwc.image2d", [["TENSOR", [1, 88, 40, 40], "float16"], ["TENSOR", [88, 88, 3, 3], "float16"], [1, 1], [1, 1, 1, 1], [1, 1], "float16"], {}], "config": {"index": 81869, "code_hash": null, "entity": [["tile_fc", "sp", [-1, 1, 11]], ["tile_y", "sp", [-1, 2, 5]], ["tile_x", "sp", [-1, 5, 2]], ["tile_rcc", "sp", [-1, 11]], ["tile_ry", "sp", [-1, 3]], ["tile_rx", "sp", [-1, 3]], ["auto_unroll_max_step", "ot", 1500], ["unroll_explicit", "ot", 0]]}, "result": [[0.00030332928], 0, 8.798912525177002, 1677245186.4118183], "version": 0.2, "tvm_version": "0.11.dev0"}
{"input": ["opencl -keys=adreno,opencl,gpu -device=adreno -max_num_threads=256 -texture_spatial_limit=16384 -thread_warp_size=1", "conv2d_nchwc.image2d", [["TENSOR", [1, 88, 40, 40], "float16"], ["TENSOR", [88, 88, 1, 1], "float16"], [1, 1], [0, 0, 0, 0], [1, 1], "float16"], {}], "config": {"index": 19187, "code_hash": null, "entity": [["tile_fc", "sp", [-1, 1, 22]], ["tile_y", "sp", [-1, 5, 2]], ["tile_x", "sp", [-1, 1, 10]], ["tile_rcc", "sp", [-1, 11]], ["tile_ry", "sp", [-1, 1]], ["tile_rx", "sp", [-1, 1]], ["auto_unroll_max_step", "ot", 1500], ["unroll_explicit", "ot", 0]]}, "result": [[6.055424e-05], 0, 34.289560317993164, 1677253786.7280447], "version": 0.2, "tvm_version": "0.11.dev0"}
{"input": ["opencl -keys=adreno,opencl,gpu -device=adreno -max_num_threads=256 -texture_spatial_limit=16384 -thread_warp_size=1", "conv2d_nchwc.image2d", [["TENSOR", [1, 88, 20, 20], "float16"], ["TENSOR", [88, 88, 1, 1], "float16"], [1, 1], [0, 0, 0, 0], [1, 1], "float16"], {}], "config": {"index": 4573, "code_hash": null, "entity": [["tile_fc", "sp", [-1, 1, 11]], ["tile_y", "sp", [-1, 1, 5]], ["tile_x", "sp", [-1, 4, 5]], ["tile_rcc", "sp", [-1, 2]], ["tile_ry", "sp", [-1, 1]], ["tile_rx", "sp", [-1, 1]], ["auto_unroll_max_step", "ot", 512], ["unroll_explicit", "ot", 0]]}, "result": [[2.462208e-05], 0, 41.52877950668335, 1677255689.9232345], "version": 0.2, "tvm_version": "0.11.dev0"}
{"input": ["opencl -keys=adreno,opencl,gpu -device=adreno -max_num_threads=256 -texture_spatial_limit=16384 -thread_warp_size=1", "conv2d_nchwc.image2d", [["TENSOR", [1, 88, 10, 10], "float16"], ["TENSOR", [88, 88, 1, 1], "float16"], [1, 1], [0, 0, 0, 0], [1, 1], "float16"], {}], "config": {"index": 24000, "code_hash": null, "entity": [["tile_fc", "sp", [-1, 1, 2]], ["tile_y", "sp", [-1, 1, 12]], ["tile_x", "sp", [-1, 1, 4]], ["tile_rcc", "sp", [-1, 1]], ["tile_ry", "sp", [-1, 1]], ["tile_rx", "sp", [-1, 1]], ["auto_unroll_max_step", "ot", 1500], ["unroll_explicit", "ot", 1]]}, "result": [[1.950208e-05], 0, 32.670982837677, 1677260172.2942488], "version": 0.2, "tvm_version": "0.11.dev0"}
{"input": ["opencl -keys=adreno,opencl,gpu -device=adreno -max_num_threads=256 -texture_spatial_limit=16384 -thread_warp_size=1", "conv2d_nchwc.image2d", [["TENSOR", [1, 88, 5, 5], "float16"], ["TENSOR", [88, 88, 1, 1], "float16"], [1, 1], [0, 0, 0, 0], [1, 1], "float16"], {}], "config": {"index": 689, "code_hash": null, "entity": [["tile_fc", "sp", [-1, 1, 11]], ["tile_y", "sp", [-1, 4, 1]], ["tile_x", "sp", [-1, 1, 4]], ["tile_rcc", "sp", [-1, 2]], ["tile_ry", "sp", [-1, 1]], ["tile_rx", "sp", [-1, 1]], ["auto_unroll_max_step", "ot", 0], ["unroll_explicit", "ot", 0]]}, "result": [[1.86368e-05], 0, 36.47188091278076, 1677262701.84413], "version": 0.2, "tvm_version": "0.11.dev0"}
{"input": ["opencl -keys=adreno,opencl,gpu -device=adreno -max_num_threads=256 -texture_spatial_limit=16384 -thread_warp_size=1", "depthwise_conv2d_nchwc.image2d", [["TENSOR", [1, 88, 5, 5], "float16"], ["TENSOR", [88, 1, 3, 3], "float16"], [1, 1], [1, 1, 1, 1], [1, 1], "float16"], {}], "config": {"index": 16568, "code_hash": null, "entity": [["tile_fc", "sp", [-1, 1, 22]], ["tile_y", "sp", [-1, 1, 1]], ["tile_x", "sp", [-1, 1, 2]], ["tile_ry", "sp", [-1, 1]], ["tile_rx", "sp", [-1, 3]], ["auto_unroll_max_step", "ot", 512], ["unroll_explicit", "ot", 1]]}, "result": [[6.50752e-06], 0, 44.40262055397034, 1677264523.5998237], "version": 0.2, "tvm_version": "0.11.dev0"}
{"input": ["opencl -keys=adreno,opencl,gpu -device=adreno -max_num_threads=256 -texture_spatial_limit=16384 -thread_warp_size=1", "depthwise_conv2d_nchwc.image2d", [["TENSOR", [1, 88, 40, 40], "float16"], ["TENSOR", [88, 1, 3, 3], "float16"], [1, 1], [1, 1, 1, 1], [1, 1], "float16"], {}], "config": {"index": 145548, "code_hash": null, "entity": [["tile_fc", "sp", [-1, 1, 1]], ["tile_y", "sp", [-1, 4, 1]], ["tile_x", "sp", [-1, 1, 40]], ["tile_ry", "sp", [-1, 3]], ["tile_rx", "sp", [-1, 1]], ["auto_unroll_max_step", "ot", 512], ["unroll_explicit", "ot", 1]]}, "result": [[3.0284800000000002e-05], 0, 12.502537727355957, 1677268275.9738872], "version": 0.2, "tvm_version": "0.11.dev0"}
{"input": ["opencl -keys=adreno,opencl,gpu -device=adreno -max_num_threads=256 -texture_spatial_limit=16384 -thread_warp_size=1", "conv2d_nchwc.image2d", [["TENSOR", [1, 24, 80, 80], "float16"], ["TENSOR", [88, 24, 3, 3], "float16"], [2, 2], [0, 0, 1, 1], [1, 1], "float16"], {}], "config": {"index": 28069, "code_hash": null, "entity": [["tile_fc", "sp", [-1, 1, 11]], ["tile_y", "sp", [-1, 5, 1]], ["tile_x", "sp", [-1, 2, 10]], ["tile_rcc", "sp", [-1, 6]], ["tile_ry", "sp", [-1, 3]], ["tile_rx", "sp", [-1, 3]], ["auto_unroll_max_step", "ot", 0], ["unroll_explicit", "ot", 0]]}, "result": [[0.00010213375999999999], 0, 19.393463373184204, 1677273451.954244], "version": 0.2, "tvm_version": "0.11.dev0"}
{"input": ["opencl -keys=adreno,opencl,gpu -device=adreno -max_num_threads=256 -texture_spatial_limit=16384 -thread_warp_size=1", "depthwise_conv2d_nchwc.image2d", [["TENSOR", [1, 88, 20, 20], "float16"], ["TENSOR", [88, 1, 3, 3], "float16"], [1, 1], [1, 1, 1, 1], [1, 1], "float16"], {}], "config": {"index": 64012, "code_hash": null, "entity": [["tile_fc", "sp", [-1, 1, 2]], ["tile_y", "sp", [-1, 4, 1]], ["tile_x", "sp", [-1, 1, 20]], ["tile_ry", "sp", [-1, 3]], ["tile_rx", "sp", [-1, 1]], ["auto_unroll_max_step", "ot", 1500], ["unroll_explicit", "ot", 1]]}, "result": [[1.2830719999999999e-05], 0, 5.453826189041138, 1677275892.705442], "version": 0.2, "tvm_version": "0.11.dev0"}
{"input": ["opencl -keys=adreno,opencl,gpu -device=adreno -max_num_threads=256 -texture_spatial_limit=16384 -thread_warp_size=1", "conv2d_nchwc.image2d", [["TENSOR", [1, 40, 40, 40], "float16"], ["TENSOR", [88, 40, 3, 3], "float16"], [2, 2], [0, 0, 1, 1], [1, 1], "float16"], {}], "config": {"index": 31733, "code_hash": null, "entity": [["tile_fc", "sp", [-1, 1, 11]], ["tile_y", "sp", [-1, 1, 5]], ["tile_x", "sp", [-1, 5, 2]], ["tile_rcc", "sp", [-1, 1]], ["tile_ry", "sp", [-1, 1]], ["tile_rx", "sp", [-1, 3]], ["auto_unroll_max_step", "ot", 1500], ["unroll_explicit", "ot", 0]]}, "result": [[6.955008e-05], 0, 38.99586296081543, 1677280703.4809186], "version": 0.2, "tvm_version": "0.11.dev0"}
{"input": ["opencl -keys=adreno,opencl,gpu -device=adreno -max_num_threads=256 -texture_spatial_limit=16384 -thread_warp_size=1", "depthwise_conv2d_nchwc.image2d", [["TENSOR", [1, 88, 10, 10], "float16"], ["TENSOR", [88, 1, 3, 3], "float16"], [1, 1], [1, 1, 1, 1], [1, 1], "float16"], {}], "config": {"index": 66273, "code_hash": null, "entity": [["tile_fc", "sp", [-1, 1, 11]], ["tile_y", "sp", [-1, 2, 1]], ["tile_x", "sp", [-1, 1, 4]], ["tile_ry", "sp", [-1, 1]], ["tile_rx", "sp", [-1, 3]], ["auto_unroll_max_step", "ot", 1500], ["unroll_explicit", "ot", 1]]}, "result": [[8.20736e-06], 0, 39.03992938995361, 1677283169.5376372], "version": 0.2, "tvm_version": "0.11.dev0"}
{"input": ["opencl -keys=adreno,opencl,gpu -device=adreno -max_num_threads=256 -texture_spatial_limit=16384 -thread_warp_size=1", "conv2d_nchwc.image2d", [["TENSOR", [1, 88, 10, 10], "float16"], ["TENSOR", [88, 88, 3, 3], "float16"], [2, 2], [0, 0, 1, 1], [1, 1], "float16"], {}], "config": {"index": 29377, "code_hash": null, "entity": [["tile_fc", "sp", [-1, 1, 11]], ["tile_y", "sp", [-1, 1, 2]], ["tile_x", "sp", [-1, 1, 2]], ["tile_rcc", "sp", [-1, 2]], ["tile_ry", "sp", [-1, 1]], ["tile_rx", "sp", [-1, 3]], ["auto_unroll_max_step", "ot", 512], ["unroll_explicit", "ot", 1]]}, "result": [[7.100927999999999e-05], 0, 13.608093738555908, 1677286261.2136312], "version": 0.2, "tvm_version": "0.11.dev0"}
{"input": ["opencl -keys=adreno,opencl,gpu -device=adreno -max_num_threads=256 -texture_spatial_limit=16384 -thread_warp_size=1", "conv2d_nchwc.image2d", [["TENSOR", [1, 112, 20, 20], "float16"], ["TENSOR", [88, 112, 3, 3], "float16"], [2, 2], [0, 0, 1, 1], [1, 1], "float16"], {}], "config": {"index": 4745, "code_hash": null, "entity": [["tile_fc", "sp", [-1, 1, 11]], ["tile_y", "sp", [-1, 3, 4]], ["tile_x", "sp", [-1, 2, 1]], ["tile_rcc", "sp", [-1, 14]], ["tile_ry", "sp", [-1, 1]], ["tile_rx", "sp", [-1, 1]], ["auto_unroll_max_step", "ot", 0], ["unroll_explicit", "ot", 0]]}, "result": [[0.00015042048], 0, 11.851149082183838, 1677291243.6371372], "version": 0.2, "tvm_version": "0.11.dev0"}
{"input": ["opencl -keys=adreno,opencl,gpu -device=adreno -max_num_threads=256 -texture_spatial_limit=16384 -thread_warp_size=1", "conv2d_nchwc.image2d", [["TENSOR", [1, 672, 20, 20], "float16"], ["TENSOR", [112, 672, 1, 1], "float16"], [1, 1], [0, 0, 0, 0], [1, 1], "float16"], {}], "config": {"index": 38310, "code_hash": null, "entity": [["tile_fc", "sp", [-1, 1, 14]], ["tile_y", "sp", [-1, 2, 5]], ["tile_x", "sp", [-1, 2, 5]], ["tile_rcc", "sp", [-1, 2]], ["tile_ry", "sp", [-1, 1]], ["tile_rx", "sp", [-1, 1]], ["auto_unroll_max_step", "ot", 512], ["unroll_explicit", "ot", 0]]}, "result": [[0.00013400576], 0, 33.901201486587524, 1677296761.1018827], "version": 0.2, "tvm_version": "0.11.dev0"}
{"input": ["opencl -keys=adreno,opencl,gpu -device=adreno -max_num_threads=256 -texture_spatial_limit=16384 -thread_warp_size=1", "conv2d_nchwc.image2d", [["TENSOR", [1, 28, 1, 1], "float16"], ["TENSOR", [672, 28, 1, 1], "float16"], [1, 1], [0, 0, 0, 0], [1, 1], "float16"], {}], "config": {"index": 10982, "code_hash": null, "entity": [["tile_fc", "sp", [-1, 1, 21]], ["tile_y", "sp", [-1, 2, 1]], ["tile_x", "sp", [-1, 1, 2]], ["tile_rcc", "sp", [-1, 7]], ["tile_ry", "sp", [-1, 1]], ["tile_rx", "sp", [-1, 1]], ["auto_unroll_max_step", "ot", 1500], ["unroll_explicit", "ot", 0]]}, "result": [[1.680896e-05], 0, 52.8401939868927, 1677298126.0658927], "version": 0.2, "tvm_version": "0.11.dev0"}
{"input": ["opencl -keys=adreno,opencl,gpu -device=adreno -max_num_threads=256 -texture_spatial_limit=16384 -thread_warp_size=1", "conv2d_nchwc.image2d", [["TENSOR", [1, 672, 1, 1], "float16"], ["TENSOR", [28, 672, 1, 1], "float16"], [1, 1], [0, 0, 0, 0], [1, 1], "float16"], {}], "config": {"index": 7343, "code_hash": null, "entity": [["tile_fc", "sp", [-1, 1, 7]], ["tile_y", "sp", [-1, 1, 4]], ["tile_x", "sp", [-1, 1, 4]], ["tile_rcc", "sp", [-1, 4]], ["tile_ry", "sp", [-1, 1]], ["tile_rx", "sp", [-1, 1]], ["auto_unroll_max_step", "ot", 512], ["unroll_explicit", "ot", 1]]}, "result": [[8.036863999999999e-05], 0, 5.114663362503052, 1677300604.9480455], "version": 0.2, "tvm_version": "0.11.dev0"}
{"input": ["opencl -keys=adreno,opencl,gpu -device=adreno -max_num_threads=256 -texture_spatial_limit=16384 -thread_warp_size=1", "depthwise_conv2d_nchwc.image2d", [["TENSOR", [1, 672, 20, 20], "float16"], ["TENSOR", [672, 1, 5, 5], "float16"], [1, 1], [2, 2, 2, 2], [1, 1], "float16"], {}], "config": {"index": 640096, "code_hash": null, "entity": [["tile_fc", "sp", [-1, 1, 2]], ["tile_y", "sp", [-1, 4, 1]], ["tile_x", "sp", [-1, 1, 20]], ["tile_ry", "sp", [-1, 5]], ["tile_rx", "sp", [-1, 1]], ["auto_unroll_max_step", "ot", 1500], ["unroll_explicit", "ot", 1]]}, "result": [[9.129471999999999e-05], 0, 7.910597562789917, 1677305728.3759632], "version": 0.2, "tvm_version": "0.11.dev0"}
{"input": ["opencl -keys=adreno,opencl,gpu -device=adreno -max_num_threads=256 -texture_spatial_limit=16384 -thread_warp_size=1", "conv2d_nchwc.image2d", [["TENSOR", [1, 112, 20, 20], "float16"], ["TENSOR", [672, 112, 1, 1], "float16"], [1, 1], [0, 0, 0, 0], [1, 1], "float16"], {}], "config": {"index": 144742, "code_hash": null, "entity": [["tile_fc", "sp", [-1, 1, 21]], ["tile_y", "sp", [-1, 2, 10]], ["tile_x", "sp", [-1, 2, 2]], ["tile_rcc", "sp", [-1, 2]], ["tile_ry", "sp", [-1, 1]], ["tile_rx", "sp", [-1, 1]], ["auto_unroll_max_step", "ot", 1500], ["unroll_explicit", "ot", 0]]}, "result": [[0.0001015552], 0, 47.5954532623291, 1677312776.4631224], "version": 0.2, "tvm_version": "0.11.dev0"}
{"input": ["opencl -keys=adreno,opencl,gpu -device=adreno -max_num_threads=256 -texture_spatial_limit=16384 -thread_warp_size=1", "conv2d_nchwc.image2d", [["TENSOR", [1, 480, 20, 20], "float16"], ["TENSOR", [112, 480, 1, 1], "float16"], [1, 1], [0, 0, 0, 0], [1, 1], "float16"], {}], "config": {"index": 72924, "code_hash": null, "entity": [["tile_fc", "sp", [-1, 1, 7]], ["tile_y", "sp", [-1, 1, 4]], ["tile_x", "sp", [-1, 4, 5]], ["tile_rcc", "sp", [-1, 2]], ["tile_ry", "sp", [-1, 1]], ["tile_rx", "sp", [-1, 1]], ["auto_unroll_max_step", "ot", 1500], ["unroll_explicit", "ot", 0]]}, "result": [[0.00013141504], 0, 5.109738349914551, 1677320681.4260724], "version": 0.2, "tvm_version": "0.11.dev0"}
{"input": ["opencl -keys=adreno,opencl,gpu -device=adreno -max_num_threads=256 -texture_spatial_limit=16384 -thread_warp_size=1", "depthwise_conv2d_nchwc.image2d", [["TENSOR", [1, 480, 20, 20], "float16"], ["TENSOR", [480, 1, 5, 5], "float16"], [1, 1], [2, 2, 2, 2], [1, 1], "float16"], {}], "config": {"index": 640116, "code_hash": null, "entity": [["tile_fc", "sp", [-1, 1, 4]], ["tile_y", "sp", [-1, 4, 1]], ["tile_x", "sp", [-1, 1, 20]], ["tile_ry", "sp", [-1, 5]], ["tile_rx", "sp", [-1, 1]], ["auto_unroll_max_step", "ot", 1500], ["unroll_explicit", "ot", 1]]}, "result": [[6.778368e-05], 0, 14.068547010421753, 1677331870.1680906], "version": 0.2, "tvm_version": "0.11.dev0"}
{"input": ["opencl -keys=adreno,opencl,gpu -device=adreno -max_num_threads=256 -texture_spatial_limit=16384 -thread_warp_size=1", "conv2d_nchwc.image2d", [["TENSOR", [1, 480, 20, 20], "float16"], ["TENSOR", [80, 480, 1, 1], "float16"], [1, 1], [0, 0, 0, 0], [1, 1], "float16"], {}], "config": {"index": 38769, "code_hash": null, "entity": [["tile_fc", "sp", [-1, 1, 5]], ["tile_y", "sp", [-1, 2, 5]], ["tile_x", "sp", [-1, 2, 10]], ["tile_rcc", "sp", [-1, 2]], ["tile_ry", "sp", [-1, 1]], ["tile_rx", "sp", [-1, 1]], ["auto_unroll_max_step", "ot", 512], ["unroll_explicit", "ot", 0]]}, "result": [[9.457663999999999e-05], 0, 5.300484895706177, 1677340419.8162837], "version": 0.2, "tvm_version": "0.11.dev0"}
{"input": ["opencl -keys=adreno,opencl,gpu -device=adreno -max_num_threads=256 -texture_spatial_limit=16384 -thread_warp_size=1", "conv2d_nchwc.image2d", [["TENSOR", [1, 20, 1, 1], "float16"], ["TENSOR", [480, 20, 1, 1], "float16"], [1, 1], [0, 0, 0, 0], [1, 1], "float16"], {}], "config": {"index": 14832, "code_hash": null, "entity": [["tile_fc", "sp", [-1, 1, 15]], ["tile_y", "sp", [-1, 1, 4]], ["tile_x", "sp", [-1, 4, 1]], ["tile_rcc", "sp", [-1, 5]], ["tile_ry", "sp", [-1, 1]], ["tile_rx", "sp", [-1, 1]], ["auto_unroll_max_step", "ot", 0], ["unroll_explicit", "ot", 1]]}, "result": [[9.984e-06], 0, 5.604063034057617, 1677342713.8562374], "version": 0.2, "tvm_version": "0.11.dev0"}
{"input": ["opencl -keys=adreno,opencl,gpu -device=adreno -max_num_threads=256 -texture_spatial_limit=16384 -thread_warp_size=1", "conv2d_nchwc.image2d", [["TENSOR", [1, 480, 1, 1], "float16"], ["TENSOR", [20, 480, 1, 1], "float16"], [1, 1], [0, 0, 0, 0], [1, 1], "float16"], {}], "config": {"index": 7340, "code_hash": null, "entity": [["tile_fc", "sp", [-1, 1, 5]], ["tile_y", "sp", [-1, 2, 2]], ["tile_x", "sp", [-1, 1, 4]], ["tile_rcc", "sp", [-1, 4]], ["tile_ry", "sp", [-1, 1]], ["tile_rx", "sp", [-1, 1]], ["auto_unroll_max_step", "ot", 512], ["unroll_explicit", "ot", 1]]}, "result": [[4.3361280000000006e-05], 0, 45.491676807403564, 1677346044.744296], "version": 0.2, "tvm_version": "0.11.dev0"}
{"input": ["opencl -keys=adreno,opencl,gpu -device=adreno -max_num_threads=256 -texture_spatial_limit=16384 -thread_warp_size=1", "depthwise_conv2d_nchwc.image2d", [["TENSOR", [1, 480, 20, 20], "float16"], ["TENSOR", [480, 1, 3, 3], "float16"], [1, 1], [1, 1, 1, 1], [1, 1], "float16"], {}], "config": {"index": 611432, "code_hash": null, "entity": [["tile_fc", "sp", [-1, 1, 10]], ["tile_y", "sp", [-1, 2, 2]], ["tile_x", "sp", [-1, 1, 20]], ["tile_ry", "sp", [-1, 1]], ["tile_rx", "sp", [-1, 1]], ["auto_unroll_max_step", "ot", 1500], ["unroll_explicit", "ot", 1]]}, "result": [[4.755456e-05], 0, 12.577693939208984, 1677352695.834927], "version": 0.2, "tvm_version": "0.11.dev0"}
{"input": ["opencl -keys=adreno,opencl,gpu -device=adreno -max_num_threads=256 -texture_spatial_limit=16384 -thread_warp_size=1", "conv2d_nchwc.image2d", [["TENSOR", [1, 80, 20, 20], "float16"], ["TENSOR", [480, 80, 1, 1], "float16"], [1, 1], [0, 0, 0, 0], [1, 1], "float16"], {}], "config": {"index": 84454, "code_hash": null, "entity": [["tile_fc", "sp", [-1, 1, 10]], ["tile_y", "sp", [-1, 1, 5]], ["tile_x", "sp", [-1, 4, 5]], ["tile_rcc", "sp", [-1, 2]], ["tile_ry", "sp", [-1, 1]], ["tile_rx", "sp", [-1, 1]], ["auto_unroll_max_step", "ot", 512], ["unroll_explicit", "ot", 0]]}, "result": [[6.397952e-05], 0, 60.59973073005676, 1677366071.3954918], "version": 0.2, "tvm_version": "0.11.dev0"}
{"input": ["opencl -keys=adreno,opencl,gpu -device=adreno -max_num_threads=256 -texture_spatial_limit=16384 -thread_warp_size=1", "conv2d_nchwc.image2d", [["TENSOR", [1, 240, 20, 20], "float16"], ["TENSOR", [80, 240, 1, 1], "float16"], [1, 1], [0, 0, 0, 0], [1, 1], "float16"], {}], "config": {"index": 111493, "code_hash": null, "entity": [["tile_fc", "sp", [-1, 1, 10]], ["tile_y", "sp", [-1, 2, 10]], ["tile_x", "sp", [-1, 1, 5]], ["tile_rcc", "sp", [-1, 4]], ["tile_ry", "sp", [-1, 1]], ["tile_rx", "sp", [-1, 1]], ["auto_unroll_max_step", "ot", 512], ["unroll_explicit", "ot", 1]]}, "result": [[5.600768000000001e-05], 0, 45.13860750198364, 1677371373.6427436], "version": 0.2, "tvm_version": "0.11.dev0"}
{"input": ["opencl -keys=adreno,opencl,gpu -device=adreno -max_num_threads=256 -texture_spatial_limit=16384 -thread_warp_size=1", "depthwise_conv2d_nchwc.image2d", [["TENSOR", [1, 240, 40, 40], "float16"], ["TENSOR", [240, 1, 3, 3], "float16"], [2, 2], [0, 0, 1, 1], [1, 1], "float16"], {}], "config": {"index": 366012, "code_hash": null, "entity": [["tile_fc", "sp", [-1, 1, 1]], ["tile_y", "sp", [-1, 1, 4]], ["tile_x", "sp", [-1, 2, 10]], ["tile_ry", "sp", [-1, 1]], ["tile_rx", "sp", [-1, 1]], ["auto_unroll_max_step", "ot", 1500], ["unroll_explicit", "ot", 1]]}, "result": [[6.066688e-05], 0, 38.82579708099365, 1677379902.2072606], "version": 0.2, "tvm_version": "0.11.dev0"}
{"input": ["opencl -keys=adreno,opencl,gpu -device=adreno -max_num_threads=256 -texture_spatial_limit=16384 -thread_warp_size=1", "conv2d_nchwc.image2d", [["TENSOR", [1, 240, 40, 40], "float16"], ["TENSOR", [40, 240, 1, 1], "float16"], [1, 1], [0, 0, 0, 0], [1, 1], "float16"], {}], "config": {"index": 131522, "code_hash": null, "entity": [["tile_fc", "sp", [-1, 1, 5]], ["tile_y", "sp", [-1, 1, 5]], ["tile_x", "sp", [-1, 2, 5]], ["tile_rcc", "sp", [-1, 60]], ["tile_ry", "sp", [-1, 1]], ["tile_rx", "sp", [-1, 1]], ["auto_unroll_max_step", "ot", 512], ["unroll_explicit", "ot", 1]]}, "result": [[9.581056e-05], 0, 54.09758257865906, 1677386428.697103], "version": 0.2, "tvm_version": "0.11.dev0"}
{"input": ["opencl -keys=adreno,opencl,gpu -device=adreno -max_num_threads=256 -texture_spatial_limit=16384 -thread_warp_size=1", "conv2d_nchwc.image2d", [["TENSOR", [1, 10, 1, 1], "float16"], ["TENSOR", [240, 10, 1, 1], "float16"], [1, 1], [0, 0, 0, 0], [1, 1], "float16"], {}], "config": {"index": 12640, "code_hash": null, "entity": [["tile_fc", "sp", [-1, 1, 15]], ["tile_y", "sp", [-1, 1, 4]], ["tile_x", "sp", [-1, 2, 1]], ["tile_rcc", "sp", [-1, 1]], ["tile_ry", "sp", [-1, 1]], ["tile_rx", "sp", [-1, 1]], ["auto_unroll_max_step", "ot", 1500], ["unroll_explicit", "ot", 1]]}, "result": [[7.94112e-06], 0, 52.536715507507324, 1677389657.382116], "version": 0.2, "tvm_version": "0.11.dev0"}
{"input": ["opencl -keys=adreno,opencl,gpu -device=adreno -max_num_threads=256 -texture_spatial_limit=16384 -thread_warp_size=1", "conv2d_nchwc.image2d", [["TENSOR", [1, 240, 1, 1], "float16"], ["TENSOR", [10, 240, 1, 1], "float16"], [1, 1], [0, 0, 0, 0], [1, 1], "float16"], {}], "config": {"index": 4211, "code_hash": null, "entity": [["tile_fc", "sp", [-1, 1, 3]], ["tile_y", "sp", [-1, 1, 4]], ["tile_x", "sp", [-1, 1, 4]], ["tile_rcc", "sp", [-1, 3]], ["tile_ry", "sp", [-1, 1]], ["tile_rx", "sp", [-1, 1]], ["auto_unroll_max_step", "ot", 0], ["unroll_explicit", "ot", 1]]}, "result": [[2.4673280000000005e-05], 0, 5.437204122543335, 1677390086.5351756], "version": 0.2, "tvm_version": "0.11.dev0"}
{"input": ["opencl -keys=adreno,opencl,gpu -device=adreno -max_num_threads=256 -texture_spatial_limit=16384 -thread_warp_size=1", "depthwise_conv2d_nchwc.image2d", [["TENSOR", [1, 240, 40, 40], "float16"], ["TENSOR", [240, 1, 5, 5], "float16"], [1, 1], [2, 2, 2, 2], [1, 1], "float16"], {}], "config": {"index": 873318, "code_hash": null, "entity": [["tile_fc", "sp", [-1, 1, 5]], ["tile_y", "sp", [-1, 4, 1]], ["tile_x", "sp", [-1, 1, 40]], ["tile_ry", "sp", [-1, 5]], ["tile_rx", "sp", [-1, 1]], ["auto_unroll_max_step", "ot", 512], ["unroll_explicit", "ot", 1]]}, "result": [[0.00012448256000000002], 0, 8.241883039474487, 1677398366.3233263], "version": 0.2, "tvm_version": "0.11.dev0"}
{"input": ["opencl -keys=adreno,opencl,gpu -device=adreno -max_num_threads=256 -texture_spatial_limit=16384 -thread_warp_size=1", "conv2d_nchwc.image2d", [["TENSOR", [1, 40, 40, 40], "float16"], ["TENSOR", [240, 40, 1, 1], "float16"], [1, 1], [0, 0, 0, 0], [1, 1], "float16"], {}], "config": {"index": 146632, "code_hash": null, "entity": [["tile_fc", "sp", [-1, 1, 12]], ["tile_y", "sp", [-1, 4, 2]], ["tile_x", "sp", [-1, 1, 8]], ["tile_rcc", "sp", [-1, 2]], ["tile_ry", "sp", [-1, 1]], ["tile_rx", "sp", [-1, 1]], ["auto_unroll_max_step", "ot", 1500], ["unroll_explicit", "ot", 0]]}, "result": [[5.612032e-05], 0, 55.2976279258728, 1677407821.0367944], "version": 0.2, "tvm_version": "0.11.dev0"}
{"input": ["opencl -keys=adreno,opencl,gpu -device=adreno -max_num_threads=256 -texture_spatial_limit=16384 -thread_warp_size=1", "conv2d_nchwc.image2d", [["TENSOR", [1, 144, 40, 40], "float16"], ["TENSOR", [40, 144, 1, 1], "float16"], [1, 1], [0, 0, 0, 0], [1, 1], "float16"], {}], "config": {"index": 118927, "code_hash": null, "entity": [["tile_fc", "sp", [-1, 1, 5]], ["tile_y", "sp", [-1, 2, 5]], ["tile_x", "sp", [-1, 2, 10]], ["tile_rcc", "sp", [-1, 36]], ["tile_ry", "sp", [-1, 1]], ["tile_rx", "sp", [-1, 1]], ["auto_unroll_max_step", "ot", 1500], ["unroll_explicit", "ot", 1]]}, "result": [[5.535744e-05], 0, 56.03691339492798, 1677415254.194911], "version": 0.2, "tvm_version": "0.11.dev0"}
{"input": ["opencl -keys=adreno,opencl,gpu -device=adreno -max_num_threads=256 -texture_spatial_limit=16384 -thread_warp_size=1", "depthwise_conv2d_nchwc.image2d", [["TENSOR", [1, 144, 80, 80], "float16"], ["TENSOR", [144, 1, 5, 5], "float16"], [2, 2], [1, 1, 2, 2], [1, 1], "float16"], {}], "config": {"index": 644841, "code_hash": null, "entity": [["tile_fc", "sp", [-1, 1, 2]], ["tile_y", "sp", [-1, 4, 1]], ["tile_x", "sp", [-1, 1, 20]], ["tile_ry", "sp", [-1, 5]], ["tile_rx", "sp", [-1, 5]], ["auto_unroll_max_step", "ot", 512], ["unroll_explicit", "ot", 1]]}, "result": [[0.00021735935999999997], 0, 54.18442249298096, 1677426606.5135233], "version": 0.2, "tvm_version": "0.11.dev0"}
{"input": ["opencl -keys=adreno,opencl,gpu -device=adreno -max_num_threads=256 -texture_spatial_limit=16384 -thread_warp_size=1", "conv2d_nchwc.image2d", [["TENSOR", [1, 144, 80, 80], "float16"], ["TENSOR", [24, 144, 1, 1], "float16"], [1, 1], [0, 0, 0, 0], [1, 1], "float16"], {}], "config": {"index": 72669, "code_hash": null, "entity": [["tile_fc", "sp", [-1, 1, 6]], ["tile_y", "sp", [-1, 4, 2]], ["tile_x", "sp", [-1, 1, 16]], ["tile_rcc", "sp", [-1, 2]], ["tile_ry", "sp", [-1, 1]], ["tile_rx", "sp", [-1, 1]], ["auto_unroll_max_step", "ot", 1500], ["unroll_explicit", "ot", 0]]}, "result": [[0.00014633472], 0, 12.988187313079834, 1677433071.5777454], "version": 0.2, "tvm_version": "0.11.dev0"}
{"input": ["opencl -keys=adreno,opencl,gpu -device=adreno -max_num_threads=256 -texture_spatial_limit=16384 -thread_warp_size=1", "conv2d_nchwc.image2d", [["TENSOR", [1, 6, 1, 1], "float16"], ["TENSOR", [144, 6, 1, 1], "float16"], [1, 1], [0, 0, 0, 0], [1, 1], "float16"], {}], "config": {"index": 8410, "code_hash": null, "entity": [["tile_fc", "sp", [-1, 1, 9]], ["tile_y", "sp", [-1, 1, 4]], ["tile_x", "sp", [-1, 1, 1]], ["tile_rcc", "sp", [-1, 1]], ["tile_ry", "sp", [-1, 1]], ["tile_rx", "sp", [-1, 1]], ["auto_unroll_max_step", "ot", 1500], ["unroll_explicit", "ot", 1]]}, "result": [[7.66464e-06], 0, 42.1029577255249, 1677437282.7627287], "version": 0.2, "tvm_version": "0.11.dev0"}
{"input": ["opencl -keys=adreno,opencl,gpu -device=adreno -max_num_threads=256 -texture_spatial_limit=16384 -thread_warp_size=1", "conv2d_nchwc.image2d", [["TENSOR", [1, 144, 1, 1], "float16"], ["TENSOR", [6, 144, 1, 1], "float16"], [1, 1], [0, 0, 0, 0], [1, 1], "float16"], {}], "config": {"index": 107, "code_hash": null, "entity": [["tile_fc", "sp", [-1, 1, 2]], ["tile_y", "sp", [-1, 1, 4]], ["tile_x", "sp", [-1, 1, 4]], ["tile_rcc", "sp", [-1, 3]], ["tile_ry", "sp", [-1, 1]], ["tile_rx", "sp", [-1, 1]], ["auto_unroll_max_step", "ot", 0], ["unroll_explicit", "ot", 0]]}, "result": [[1.67424e-05], 0, 32.178130865097046, 1677437837.8003376], "version": 0.2, "tvm_version": "0.11.dev0"}
{"input": ["opencl -keys=adreno,opencl,gpu -device=adreno -max_num_threads=256 -texture_spatial_limit=16384 -thread_warp_size=1", "depthwise_conv2d_nchwc.image2d", [["TENSOR", [1, 144, 80, 80], "float16"], ["TENSOR", [144, 1, 3, 3], "float16"], [1, 1], [1, 1, 1, 1], [1, 1], "float16"], {}], "config": {"index": 1518108, "code_hash": null, "entity": [["tile_fc", "sp", [-1, 1, 6]], ["tile_y", "sp", [-1, 8, 1]], ["tile_x", "sp", [-1, 1, 16]], ["tile_ry", "sp", [-1, 1]], ["tile_rx", "sp", [-1, 1]], ["auto_unroll_max_step", "ot", 1500], ["unroll_explicit", "ot", 1]]}, "result": [[0.00020400639999999999], 0, 47.63952136039734, 1677438314.156247], "version": 0.2, "tvm_version": "0.11.dev0"}
{"input": ["opencl -keys=adreno,opencl,gpu -device=adreno -max_num_threads=256 -texture_spatial_limit=16384 -thread_warp_size=1", "conv2d_nchwc.image2d", [["TENSOR", [1, 24, 80, 80], "float16"], ["TENSOR", [144, 24, 1, 1], "float16"], [1, 1], [0, 0, 0, 0], [1, 1], "float16"], {}], "config": {"index": 91788, "code_hash": null, "entity": [["tile_fc", "sp", [-1, 1, 12]], ["tile_y", "sp", [-1, 1, 10]], ["tile_x", "sp", [-1, 4, 4]], ["tile_rcc", "sp", [-1, 2]], ["tile_ry", "sp", [-1, 1]], ["tile_rx", "sp", [-1, 1]], ["auto_unroll_max_step", "ot", 512], ["unroll_explicit", "ot", 0]]}, "result": [[8.031744e-05], 0, 20.10638928413391, 1677454992.578021], "version": 0.2, "tvm_version": "0.11.dev0"}
{"input": ["opencl -keys=adreno,opencl,gpu -device=adreno -max_num_threads=256 -texture_spatial_limit=16384 -thread_warp_size=1", "conv2d_nchwc.image2d", [["TENSOR", [1, 96, 80, 80], "float16"], ["TENSOR", [24, 96, 1, 1], "float16"], [1, 1], [0, 0, 0, 0], [1, 1], "float16"], {}], "config": {"index": 67048, "code_hash": null, "entity": [["tile_fc", "sp", [-1, 2, 3]], ["tile_y", "sp", [-1, 8, 5]], ["tile_x", "sp", [-1, 1, 4]], ["tile_rcc", "sp", [-1, 3]], ["tile_ry", "sp", [-1, 1]], ["tile_rx", "sp", [-1, 1]], ["auto_unroll_max_step", "ot", 1500], ["unroll_explicit", "ot", 0]]}, "result": [[9.586688000000001e-05], 0, 33.55098628997803, 1677465691.8141592], "version": 0.2, "tvm_version": "0.11.dev0"}
{"input": ["opencl -keys=adreno,opencl,gpu -device=adreno -max_num_threads=256 -texture_spatial_limit=16384 -thread_warp_size=1", "conv2d_nchwc.image2d", [["TENSOR", [1, 4, 1, 1], "float16"], ["TENSOR", [96, 4, 1, 1], "float16"], [1, 1], [0, 0, 0, 0], [1, 1], "float16"], {}], "config": {"index": 3712, "code_hash": null, "entity": [["tile_fc", "sp", [-1, 1, 8]], ["tile_y", "sp", [-1, 4, 1]], ["tile_x", "sp", [-1, 1, 4]], ["tile_rcc", "sp", [-1, 1]], ["tile_ry", "sp", [-1, 1]], ["tile_rx", "sp", [-1, 1]], ["auto_unroll_max_step", "ot", 512], ["unroll_explicit", "ot", 1]]}, "result": [[7.4547200000000005e-06], 0, 25.621947288513184, 1677467436.541891], "version": 0.2, "tvm_version": "0.11.dev0"}
{"input": ["opencl -keys=adreno,opencl,gpu -device=adreno -max_num_threads=256 -texture_spatial_limit=16384 -thread_warp_size=1", "depthwise_conv2d_nchwc.image2d", [["TENSOR", [1, 96, 160, 160], "float16"], ["TENSOR", [96, 1, 3, 3], "float16"], [2, 2], [0, 0, 1, 1], [1, 1], "float16"], {}], "config": {"index": 1143502, "code_hash": null, "entity": [["tile_fc", "sp", [-1, 1, 6]], ["tile_y", "sp", [-1, 2, 1]], ["tile_x", "sp", [-1, 1, 16]], ["tile_ry", "sp", [-1, 1]], ["tile_rx", "sp", [-1, 3]], ["auto_unroll_max_step", "ot", 512], ["unroll_explicit", "ot", 1]]}, "result": [[0.00041769984], 0, 50.51203274726868, 1677470749.8666668], "version": 0.2, "tvm_version": "0.11.dev0"}
{"input": ["opencl -keys=adreno,opencl,gpu -device=adreno -max_num_threads=256 -texture_spatial_limit=16384 -thread_warp_size=1", "conv2d_nchwc.image2d", [["TENSOR", [1, 16, 160, 160], "float16"], ["TENSOR", [96, 16, 1, 1], "float16"], [1, 1], [0, 0, 0, 0], [1, 1], "float16"], {}], "config": {"index": 149473, "code_hash": null, "entity": [["tile_fc", "sp", [-1, 1, 8]], ["tile_y", "sp", [-1, 4, 2]], ["tile_x", "sp", [-1, 1, 16]], ["tile_rcc", "sp", [-1, 2]], ["tile_ry", "sp", [-1, 1]], ["tile_rx", "sp", [-1, 1]], ["auto_unroll_max_step", "ot", 1500], ["unroll_explicit", "ot", 0]]}, "result": [[0.00015721472], 0, 6.523785829544067, 1677487673.6240523], "version": 0.2, "tvm_version": "0.11.dev0"}
{"input": ["opencl -keys=adreno,opencl,gpu -device=adreno -max_num_threads=256 -texture_spatial_limit=16384 -thread_warp_size=1", "conv2d_nchwc.image2d", [["TENSOR", [1, 16, 160, 160], "float16"], ["TENSOR", [16, 16, 1, 1], "float16"], [1, 1], [0, 0, 0, 0], [1, 1], "float16"], {}], "config": {"index": 12548, "code_hash": null, "entity": [["tile_fc", "sp", [-1, 1, 4]], ["tile_y", "sp", [-1, 4, 4]], ["tile_x", "sp", [-1, 1, 8]], ["tile_rcc", "sp", [-1, 2]], ["tile_ry", "sp", [-1, 1]], ["tile_rx", "sp", [-1, 1]], ["auto_unroll_max_step", "ot", 512], ["unroll_explicit", "ot", 0]]}, "result": [[5.5531519999999996e-05], 0, 50.36632943153381, 1677492322.1652603], "version": 0.2, "tvm_version": "0.11.dev0"}
{"input": ["opencl -keys=adreno,opencl,gpu -device=adreno -max_num_threads=256 -texture_spatial_limit=16384 -thread_warp_size=1", "conv2d_nchwc.image2d", [["TENSOR", [1, 4, 1, 1], "float16"], ["TENSOR", [16, 4, 1, 1], "float16"], [1, 1], [0, 0, 0, 0], [1, 1], "float16"], {}], "config": {"index": 212, "code_hash": null, "entity": [["tile_fc", "sp", [-1, 1, 4]], ["tile_y", "sp", [-1, 2, 2]], ["tile_x", "sp", [-1, 1, 4]], ["tile_rcc", "sp", [-1, 1]], ["tile_ry", "sp", [-1, 1]], ["tile_rx", "sp", [-1, 1]], ["auto_unroll_max_step", "ot", 512], ["unroll_explicit", "ot", 0]]}, "result": [[7.439360000000001e-06], 0, 14.90788745880127, 1677493385.804246], "version": 0.2, "tvm_version": "0.11.dev0"}
{"input": ["opencl -keys=adreno,opencl,gpu -device=adreno -max_num_threads=256 -texture_spatial_limit=16384 -thread_warp_size=1", "depthwise_conv2d_nchwc.image2d", [["TENSOR", [1, 16, 160, 160], "float16"], ["TENSOR", [16, 1, 3, 3], "float16"], [1, 1], [1, 1, 1, 1], [1, 1], "float16"], {}], "config": {"index": 466103, "code_hash": null, "entity": [["tile_fc", "sp", [-1, 1, 4]], ["tile_y", "sp", [-1, 8, 1]], ["tile_x", "sp", [-1, 1, 8]], ["tile_ry", "sp", [-1, 3]], ["tile_rx", "sp", [-1, 3]], ["auto_unroll_max_step", "ot", 512], ["unroll_explicit", "ot", 1]]}, "result": [[7.607296e-05], 0, 31.637409210205078, 1677503287.7689734], "version": 0.2, "tvm_version": "0.11.dev0"}
{"input": ["opencl -keys=adreno,opencl,gpu -device=adreno -max_num_threads=256 -texture_spatial_limit=16384 -thread_warp_size=1", "conv2d_nchwc.image2d", [["TENSOR", [1, 32, 160, 160], "float16"], ["TENSOR", [16, 32, 1, 1], "float16"], [1, 1], [0, 0, 0, 0], [1, 1], "float16"], {}], "config": {"index": 26597, "code_hash": null, "entity": [["tile_fc", "sp", [-1, 1, 4]], ["tile_y", "sp", [-1, 1, 5]], ["tile_x", "sp", [-1, 4, 10]], ["tile_rcc", "sp", [-1, 2]], ["tile_ry", "sp", [-1, 1]], ["tile_rx", "sp", [-1, 1]], ["auto_unroll_max_step", "ot", 1500], ["unroll_explicit", "ot", 0]]}, "result": [[0.00011526656], 0, 55.22120451927185, 1677508004.0152383], "version": 0.2, "tvm_version": "0.11.dev0"}
{"input": ["opencl -keys=adreno,opencl,gpu -device=adreno -max_num_threads=256 -texture_spatial_limit=16384 -thread_warp_size=1", "conv2d_nchwc.image2d", [["TENSOR", [1, 8, 1, 1], "float16"], ["TENSOR", [32, 8, 1, 1], "float16"], [1, 1], [0, 0, 0, 0], [1, 1], "float16"], {}], "config": {"index": 1979, "code_hash": null, "entity": [["tile_fc", "sp", [-1, 1, 8]], ["tile_y", "sp", [-1, 1, 4]], ["tile_x", "sp", [-1, 1, 1]], ["tile_rcc", "sp", [-1, 2]], ["tile_ry", "sp", [-1, 1]], ["tile_rx", "sp", [-1, 1]], ["auto_unroll_max_step", "ot", 512], ["unroll_explicit", "ot", 1]]}, "result": [[7.726079999999999e-06], 0, 52.2124707698822, 1677508313.669432], "version": 0.2, "tvm_version": "0.11.dev0"}
{"input": ["opencl -keys=adreno,opencl,gpu -device=adreno -max_num_threads=256 -texture_spatial_limit=16384 -thread_warp_size=1", "conv2d_nchwc.image2d", [["TENSOR", [1, 32, 1, 1], "float16"], ["TENSOR", [8, 32, 1, 1], "float16"], [1, 1], [0, 0, 0, 0], [1, 1], "float16"], {}], "config": {"index": 251, "code_hash": null, "entity": [["tile_fc", "sp", [-1, 1, 2]], ["tile_y", "sp", [-1, 1, 4]], ["tile_x", "sp", [-1, 1, 4]], ["tile_rcc", "sp", [-1, 4]], ["tile_ry", "sp", [-1, 1]], ["tile_rx", "sp", [-1, 1]], ["auto_unroll_max_step", "ot", 512], ["unroll_explicit", "ot", 0]]}, "result": [[8.84224e-06], 0, 33.34718179702759, 1677510410.190107], "version": 0.2, "tvm_version": "0.11.dev0"}
{"input": ["opencl -keys=adreno,opencl,gpu -device=adreno -max_num_threads=256 -texture_spatial_limit=16384 -thread_warp_size=1", "depthwise_conv2d_nchwc.image2d", [["TENSOR", [1, 32, 160, 160], "float16"], ["TENSOR", [32, 1, 3, 3], "float16"], [1, 1], [1, 1, 1, 1], [1, 1], "float16"], {}], "config": {"index": 871314, "code_hash": null, "entity": [["tile_fc", "sp", [-1, 1, 2]], ["tile_y", "sp", [-1, 4, 1]], ["tile_x", "sp", [-1, 1, 80]], ["tile_ry", "sp", [-1, 3]], ["tile_rx", "sp", [-1, 1]], ["auto_unroll_max_step", "ot", 1500], ["unroll_explicit", "ot", 1]]}, "result": [[0.0001600256], 0, 13.502646446228027, 1677518028.4522913], "version": 0.2, "tvm_version": "0.11.dev0"}
{"input": ["opencl -keys=adreno,opencl,gpu -device=adreno -max_num_threads=256 -texture_spatial_limit=16384 -thread_warp_size=1", "conv2d_nchwc.image2d", [["TENSOR", [1, 3, 320, 320], "float16"], ["TENSOR", [32, 3, 3, 3], "float16"], [2, 2], [0, 0, 1, 1], [1, 1], "float16"], {}], "config": {"index": 61811, "code_hash": null, "entity": [["tile_fc", "sp", [-1, 1, 8]], ["tile_y", "sp", [-1, 2, 4]], ["tile_x", "sp", [-1, 5, 4]], ["tile_rcc", "sp", [-1, 1]], ["tile_ry", "sp", [-1, 3]], ["tile_rx", "sp", [-1, 3]], ["auto_unroll_max_step", "ot", 1500], ["unroll_explicit", "ot", 0]]}, "result": [[0.00024968703999999996], 0, 53.1583833694458, 1677522630.3840282], "version": 0.2, "tvm_version": "0.11.dev0"}
