logs_gen1/mace_mobilenetv1_nchw.texture.float16.acc32.autotvm.log
{"input": ["opencl -keys=adreno,opencl,gpu -device=adreno -max_function_args=128 -max_num_threads=256 -max_shared_memory_per_block=16384 -max_threads_per_block=256 -texture_spatial_limit=16384 -thread_warp_size=1", "conv2d_nchwc.image2d", [["TENSOR", [1, 1024, 1, 1], "float16"], ["TENSOR", [1001, 1024, 1, 1], "float16"], [1, 1], [0, 0, 0, 0], [1, 1], "float32"], {}], "config": {"index": 617, "code_hash": null, "entity": [["tile_fc", "sp", [-1, 1, 251]], ["tile_y", "sp", [-1, 4, 1]], ["tile_x", "sp", [-1, 1, 2]], ["tile_rcc", "sp", [-1, 256]], ["tile_ry", "sp", [-1, 1]], ["tile_rx", "sp", [-1, 1]], ["auto_unroll_max_step", "ot", 0], ["unroll_explicit", "ot", 0]]}, "result": [[0.00025433599999999997], 0, 37.77905988693237, 1690201101.3085198], "version": 0.2, "tvm_version": "0.13.dev0"}
{"input": ["opencl -keys=adreno,opencl,gpu -device=adreno -max_function_args=128 -max_num_threads=256 -max_shared_memory_per_block=16384 -max_threads_per_block=256 -texture_spatial_limit=16384 -thread_warp_size=1", "conv2d_nchwc.image2d", [["TENSOR", [1, 512, 7, 7], "float16"], ["TENSOR", [1024, 512, 1, 1], "float16"], [1, 1], [0, 0, 0, 0], [1, 1], "float32"], {}], "config": {"index": 83245, "code_hash": null, "entity": [["tile_fc", "sp", [-1, 1, 64]], ["tile_y", "sp", [-1, 1, 8]], ["tile_x", "sp", [-1, 4, 1]], ["tile_rcc", "sp", [-1, 2]], ["tile_ry", "sp", [-1, 1]], ["tile_rx", "sp", [-1, 1]], ["auto_unroll_max_step", "ot", 512], ["unroll_explicit", "ot", 1]]}, "result": [[0.00016322047999999998], 0, 60.498250007629395, 1690205748.252357], "version": 0.2, "tvm_version": "0.13.dev0"}
{"input": ["opencl -keys=adreno,opencl,gpu -device=adreno -max_function_args=128 -max_num_threads=256 -max_shared_memory_per_block=16384 -max_threads_per_block=256 -texture_spatial_limit=16384 -thread_warp_size=1", "conv2d_nchwc.image2d", [["TENSOR", [1, 256, 28, 28], "float16"], ["TENSOR", [256, 256, 1, 1], "float16"], [1, 1], [0, 0, 0, 0], [1, 1], "float32"], {}], "config": {"index": 24474, "code_hash": null, "entity": [["tile_fc", "sp", [-1, 1, 16]], ["tile_y", "sp", [-1, 2, 1]], ["tile_x", "sp", [-1, 2, 14]], ["tile_rcc", "sp", [-1, 64]], ["tile_ry", "sp", [-1, 1]], ["tile_rx", "sp", [-1, 1]], ["auto_unroll_max_step", "ot", 0], ["unroll_explicit", "ot", 0]]}, "result": [[0.0002092032], 0, 66.23670816421509, 1690215832.678729], "version": 0.2, "tvm_version": "0.13.dev0"}
{"input": ["opencl -keys=adreno,opencl,gpu -device=adreno -max_function_args=128 -max_num_threads=256 -max_shared_memory_per_block=16384 -max_threads_per_block=256 -texture_spatial_limit=16384 -thread_warp_size=1", "depthwise_conv2d_nchwc.image2d", [["TENSOR", [1, 256, 28, 28], "float16"], ["TENSOR", [256, 1, 3, 3], "float16"], [1, 1], [1, 1, 1, 1], [1, 1], "float32"], {}], "config": {"index": 162911, "code_hash": null, "entity": [["tile_fc", "sp", [-1, 1, 2]], ["tile_y", "sp", [-1, 14, 1]], ["tile_x", "sp", [-1, 1, 28]], ["tile_ry", "sp", [-1, 3]], ["tile_rx", "sp", [-1, 1]], ["auto_unroll_max_step", "ot", 512], ["unroll_explicit", "ot", 1]]}, "result": [[5.3058560000000004e-05], 0, 27.967496871948242, 1690217991.421856], "version": 0.2, "tvm_version": "0.13.dev0"}
{"input": ["opencl -keys=adreno,opencl,gpu -device=adreno -max_function_args=128 -max_num_threads=256 -max_shared_memory_per_block=16384 -max_threads_per_block=256 -texture_spatial_limit=16384 -thread_warp_size=1", "conv2d_nchwc.image2d", [["TENSOR", [1, 128, 28, 28], "float16"], ["TENSOR", [256, 128, 1, 1], "float16"], [1, 1], [0, 0, 0, 0], [1, 1], "float32"], {}], "config": {"index": 19149, "code_hash": null, "entity": [["tile_fc", "sp", [-1, 1, 32]], ["tile_y", "sp", [-1, 2, 14]], ["tile_x", "sp", [-1, 2, 2]], ["tile_rcc", "sp", [-1, 32]], ["tile_ry", "sp", [-1, 1]], ["tile_rx", "sp", [-1, 1]], ["auto_unroll_max_step", "ot", 0], ["unroll_explicit", "ot", 0]]}, "result": [[0.00013489664], 0, 126.76065421104431, 1690221002.1943302], "version": 0.2, "tvm_version": "0.13.dev0"}
{"input": ["opencl -keys=adreno,opencl,gpu -device=adreno -max_function_args=128 -max_num_threads=256 -max_shared_memory_per_block=16384 -max_threads_per_block=256 -texture_spatial_limit=16384 -thread_warp_size=1", "depthwise_conv2d_nchwc.image2d", [["TENSOR", [1, 128, 56, 56], "float16"], ["TENSOR", [128, 1, 3, 3], "float16"], [2, 2], [0, 0, 1, 1], [1, 1], "float32"], {}], "config": {"index": 112683, "code_hash": null, "entity": [["tile_fc", "sp", [-1, 1, 16]], ["tile_y", "sp", [-1, 2, 1]], ["tile_x", "sp", [-1, 1, 4]], ["tile_ry", "sp", [-1, 1]], ["tile_rx", "sp", [-1, 1]], ["auto_unroll_max_step", "ot", 512], ["unroll_explicit", "ot", 1]]}, "result": [[6.783488e-05], 0, 29.68869423866272, 1690222668.08924], "version": 0.2, "tvm_version": "0.13.dev0"}
{"input": ["opencl -keys=adreno,opencl,gpu -device=adreno -max_function_args=128 -max_num_threads=256 -max_shared_memory_per_block=16384 -max_threads_per_block=256 -texture_spatial_limit=16384 -thread_warp_size=1", "conv2d_nchwc.image2d", [["TENSOR", [1, 128, 56, 56], "float16"], ["TENSOR", [128, 128, 1, 1], "float16"], [1, 1], [0, 0, 0, 0], [1, 1], "float32"], {}], "config": {"index": 88633, "code_hash": null, "entity": [["tile_fc", "sp", [-1, 1, 32]], ["tile_y", "sp", [-1, 1, 4]], ["tile_x", "sp", [-1, 4, 2]], ["tile_rcc", "sp", [-1, 4]], ["tile_ry", "sp", [-1, 1]], ["tile_rx", "sp", [-1, 1]], ["auto_unroll_max_step", "ot", 1500], ["unroll_explicit", "ot", 0]]}, "result": [[0.00026737664], 0, 132.14299297332764, 1690222903.9215958], "version": 0.2, "tvm_version": "0.13.dev0"}
{"input": ["opencl -keys=adreno,opencl,gpu -device=adreno -max_function_args=128 -max_num_threads=256 -max_shared_memory_per_block=16384 -max_threads_per_block=256 -texture_spatial_limit=16384 -thread_warp_size=1", "depthwise_conv2d_nchwc.image2d", [["TENSOR", [1, 128, 56, 56], "float16"], ["TENSOR", [128, 1, 3, 3], "float16"], [1, 1], [1, 1, 1, 1], [1, 1], "float32"], {}], "config": {"index": 338426, "code_hash": null, "entity": [["tile_fc", "sp", [-1, 1, 4]], ["tile_y", "sp", [-1, 14, 1]], ["tile_x", "sp", [-1, 1, 28]], ["tile_ry", "sp", [-1, 3]], ["tile_rx", "sp", [-1, 1]], ["auto_unroll_max_step", "ot", 512], ["unroll_explicit", "ot", 1]]}, "result": [[9.783296000000001e-05], 0, 120.3577983379364, 1690225430.839255], "version": 0.2, "tvm_version": "0.13.dev0"}
{"input": ["opencl -keys=adreno,opencl,gpu -device=adreno -max_function_args=128 -max_num_threads=256 -max_shared_memory_per_block=16384 -max_threads_per_block=256 -texture_spatial_limit=16384 -thread_warp_size=1", "conv2d_nchwc.image2d", [["TENSOR", [1, 64, 56, 56], "float16"], ["TENSOR", [128, 64, 1, 1], "float16"], [1, 1], [0, 0, 0, 0], [1, 1], "float32"], {}], "config": {"index": 30027, "code_hash": null, "entity": [["tile_fc", "sp", [-1, 1, 16]], ["tile_y", "sp", [-1, 4, 1]], ["tile_x", "sp", [-1, 1, 14]], ["tile_rcc", "sp", [-1, 16]], ["tile_ry", "sp", [-1, 1]], ["tile_rx", "sp", [-1, 1]], ["auto_unroll_max_step", "ot", 0], ["unroll_explicit", "ot", 0]]}, "result": [[0.00014154752], 0, 56.79760217666626, 1690228379.909754], "version": 0.2, "tvm_version": "0.13.dev0"}
{"input": ["opencl -keys=adreno,opencl,gpu -device=adreno -max_function_args=128 -max_num_threads=256 -max_shared_memory_per_block=16384 -max_threads_per_block=256 -texture_spatial_limit=16384 -thread_warp_size=1", "depthwise_conv2d_nchwc.image2d", [["TENSOR", [1, 64, 112, 112], "float16"], ["TENSOR", [64, 1, 3, 3], "float16"], [2, 2], [0, 0, 1, 1], [1, 1], "float32"], {}], "config": {"index": 266412, "code_hash": null, "entity": [["tile_fc", "sp", [-1, 1, 8]], ["tile_y", "sp", [-1, 1, 1]], ["tile_x", "sp", [-1, 1, 8]], ["tile_ry", "sp", [-1, 3]], ["tile_rx", "sp", [-1, 3]], ["auto_unroll_max_step", "ot", 512], ["unroll_explicit", "ot", 1]]}, "result": [[0.0002550016], 0, 14.927030801773071, 1690230412.7594008], "version": 0.2, "tvm_version": "0.13.dev0"}
{"input": ["opencl -keys=adreno,opencl,gpu -device=adreno -max_function_args=128 -max_num_threads=256 -max_shared_memory_per_block=16384 -max_threads_per_block=256 -texture_spatial_limit=16384 -thread_warp_size=1", "conv2d_nchwc.image2d", [["TENSOR", [1, 32, 112, 112], "float16"], ["TENSOR", [64, 32, 1, 1], "float16"], [1, 1], [0, 0, 0, 0], [1, 1], "float32"], {}], "config": {"index": 24994, "code_hash": null, "entity": [["tile_fc", "sp", [-1, 1, 4]], ["tile_y", "sp", [-1, 2, 7]], ["tile_x", "sp", [-1, 2, 4]], ["tile_rcc", "sp", [-1, 8]], ["tile_ry", "sp", [-1, 1]], ["tile_rx", "sp", [-1, 1]], ["auto_unroll_max_step", "ot", 0], ["unroll_explicit", "ot", 0]]}, "result": [[0.00015882239999999998], 0, 15.813950777053833, 1690230448.640028], "version": 0.2, "tvm_version": "0.13.dev0"}
{"input": ["opencl -keys=adreno,opencl,gpu -device=adreno -max_function_args=128 -max_num_threads=256 -max_shared_memory_per_block=16384 -max_threads_per_block=256 -texture_spatial_limit=16384 -thread_warp_size=1", "depthwise_conv2d_nchwc.image2d", [["TENSOR", [1, 32, 112, 112], "float16"], ["TENSOR", [32, 1, 3, 3], "float16"], [1, 1], [1, 1, 1, 1], [1, 1], "float32"], {}], "config": {"index": 465354, "code_hash": null, "entity": [["tile_fc", "sp", [-1, 1, 2]], ["tile_y", "sp", [-1, 14, 1]], ["tile_x", "sp", [-1, 1, 112]], ["tile_ry", "sp", [-1, 1]], ["tile_rx", "sp", [-1, 3]], ["auto_unroll_max_step", "ot", 1500], ["unroll_explicit", "ot", 1]]}, "result": [[8.748032e-05], 0, 9.59682011604309, 1690232206.38158], "version": 0.2, "tvm_version": "0.13.dev0"}
{"input": ["opencl -keys=adreno,opencl,gpu -device=adreno -max_function_args=128 -max_num_threads=256 -max_shared_memory_per_block=16384 -max_threads_per_block=256 -texture_spatial_limit=16384 -thread_warp_size=1", "conv2d_nchwc.image2d", [["TENSOR", [1, 3, 224, 224], "float16"], ["TENSOR", [32, 3, 3, 3], "float16"], [2, 2], [0, 0, 1, 1], [1, 1], "float32"], {}], "config": {"index": 65453, "code_hash": null, "entity": [["tile_fc", "sp", [-1, 1, 8]], ["tile_y", "sp", [-1, 1, 1]], ["tile_x", "sp", [-1, 7, 16]], ["tile_rcc", "sp", [-1, 1]], ["tile_ry", "sp", [-1, 1]], ["tile_rx", "sp", [-1, 3]], ["auto_unroll_max_step", "ot", 0], ["unroll_explicit", "ot", 1]]}, "result": [[8.004096e-05], 0, 15.606405019760132, 1690236241.735573], "version": 0.2, "tvm_version": "0.13.dev0"}
{"input": ["opencl -keys=adreno,opencl,gpu -device=adreno -max_function_args=128 -max_num_threads=256 -max_shared_memory_per_block=16384 -max_threads_per_block=256 -texture_spatial_limit=16384 -thread_warp_size=1", "conv2d_nchwc.image2d", [["TENSOR", [1, 1024, 7, 7], "float16"], ["TENSOR", [1024, 1024, 1, 1], "float16"], [1, 1], [0, 0, 0, 0], [1, 1], "float32"], {}], "config": {"index": 115745, "code_hash": null, "entity": [["tile_fc", "sp", [-1, 1, 64]], ["tile_y", "sp", [-1, 1, 8]], ["tile_x", "sp", [-1, 4, 1]], ["tile_rcc", "sp", [-1, 2]], ["tile_ry", "sp", [-1, 1]], ["tile_rx", "sp", [-1, 1]], ["auto_unroll_max_step", "ot", 1500], ["unroll_explicit", "ot", 1]]}, "result": [[0.00036067328], 0, 20.752806901931763, 1689555183.635235], "version": 0.2, "tvm_version": "0.13.dev0"}
{"input": ["opencl -keys=adreno,opencl,gpu -device=adreno -max_function_args=128 -max_num_threads=256 -max_shared_memory_per_block=16384 -max_threads_per_block=256 -texture_spatial_limit=16384 -thread_warp_size=1", "depthwise_conv2d_nchwc.image2d", [["TENSOR", [1, 1024, 7, 7], "float16"], ["TENSOR", [1024, 1, 3, 3], "float16"], [1, 1], [1, 1, 1, 1], [1, 1], "float32"], {}], "config": {"index": 103175, "code_hash": null, "entity": [["tile_fc", "sp", [-1, 1, 32]], ["tile_y", "sp", [-1, 4, 1]], ["tile_x", "sp", [-1, 1, 8]], ["tile_ry", "sp", [-1, 1]], ["tile_rx", "sp", [-1, 3]], ["auto_unroll_max_step", "ot", 1500], ["unroll_explicit", "ot", 1]]}, "result": [[2.321408e-05], 0, 13.802127838134766, 1689559742.424829], "version": 0.2, "tvm_version": "0.13.dev0"}
{"input": ["opencl -keys=adreno,opencl,gpu -device=adreno -max_function_args=128 -max_num_threads=256 -max_shared_memory_per_block=16384 -max_threads_per_block=256 -texture_spatial_limit=16384 -thread_warp_size=1", "depthwise_conv2d_nchwc.image2d", [["TENSOR", [1, 512, 14, 14], "float16"], ["TENSOR", [512, 1, 3, 3], "float16"], [2, 2], [0, 0, 1, 1], [1, 1], "float32"], {}], "config": {"index": 10455, "code_hash": null, "entity": [["tile_fc", "sp", [-1, 1, 4]], ["tile_y", "sp", [-1, 1, 1]], ["tile_x", "sp", [-1, 1, 8]], ["tile_ry", "sp", [-1, 1]], ["tile_rx", "sp", [-1, 3]], ["auto_unroll_max_step", "ot", 0], ["unroll_explicit", "ot", 0]]}, "result": [[2.276352e-05], 0, 20.269639253616333, 1689566778.137671], "version": 0.2, "tvm_version": "0.13.dev0"}
{"input": ["opencl -keys=adreno,opencl,gpu -device=adreno -max_function_args=128 -max_num_threads=256 -max_shared_memory_per_block=16384 -max_threads_per_block=256 -texture_spatial_limit=16384 -thread_warp_size=1", "conv2d_nchwc.image2d", [["TENSOR", [1, 512, 14, 14], "float16"], ["TENSOR", [512, 512, 1, 1], "float16"], [1, 1], [0, 0, 0, 0], [1, 1], "float32"], {}], "config": {"index": 198094, "code_hash": null, "entity": [["tile_fc", "sp", [-1, 4, 4]], ["tile_y", "sp", [-1, 4, 1]], ["tile_x", "sp", [-1, 1, 16]], ["tile_rcc", "sp", [-1, 32]], ["tile_ry", "sp", [-1, 1]], ["tile_rx", "sp", [-1, 1]], ["auto_unroll_max_step", "ot", 1500], ["unroll_explicit", "ot", 1]]}, "result": [[0.00021798400000000003], 0, 14.260307788848877, 1689572992.9308648], "version": 0.2, "tvm_version": "0.13.dev0"}
{"input": ["opencl -keys=adreno,opencl,gpu -device=adreno -max_function_args=128 -max_num_threads=256 -max_shared_memory_per_block=16384 -max_threads_per_block=256 -texture_spatial_limit=16384 -thread_warp_size=1", "depthwise_conv2d_nchwc.image2d", [["TENSOR", [1, 512, 14, 14], "float16"], ["TENSOR", [512, 1, 3, 3], "float16"], [1, 1], [1, 1, 1, 1], [1, 1], "float32"], {}], "config": {"index": 185408, "code_hash": null, "entity": [["tile_fc", "sp", [-1, 1, 2]], ["tile_y", "sp", [-1, 1, 2]], ["tile_x", "sp", [-1, 2, 8]], ["tile_ry", "sp", [-1, 1]], ["tile_rx", "sp", [-1, 3]], ["auto_unroll_max_step", "ot", 1500], ["unroll_explicit", "ot", 1]]}, "result": [[2.9803519999999998e-05], 0, 50.9880952835083, 1689578843.4154382], "version": 0.2, "tvm_version": "0.13.dev0"}
{"input": ["opencl -keys=adreno,opencl,gpu -device=adreno -max_function_args=128 -max_num_threads=256 -max_shared_memory_per_block=16384 -max_threads_per_block=256 -texture_spatial_limit=16384 -thread_warp_size=1", "conv2d_nchwc.image2d", [["TENSOR", [1, 256, 14, 14], "float16"], ["TENSOR", [512, 256, 1, 1], "float16"], [1, 1], [0, 0, 0, 0], [1, 1], "float32"], {}], "config": {"index": 111854, "code_hash": null, "entity": [["tile_fc", "sp", [-1, 4, 4]], ["tile_y", "sp", [-1, 4, 1]], ["tile_x", "sp", [-1, 1, 16]], ["tile_rcc", "sp", [-1, 16]], ["tile_ry", "sp", [-1, 1]], ["tile_rx", "sp", [-1, 1]], ["auto_unroll_max_step", "ot", 0], ["unroll_explicit", "ot", 1]]}, "result": [[0.00011624447999999999], 0, 56.38399410247803, 1689578998.851135], "version": 0.2, "tvm_version": "0.13.dev0"}
{"input": ["opencl -keys=adreno,opencl,gpu -device=adreno -max_function_args=128 -max_num_threads=256 -max_shared_memory_per_block=16384 -max_threads_per_block=256 -texture_spatial_limit=16384 -thread_warp_size=1", "depthwise_conv2d_nchwc.image2d", [["TENSOR", [1, 256, 28, 28], "float16"], ["TENSOR", [256, 1, 3, 3], "float16"], [2, 2], [0, 0, 1, 1], [1, 1], "float32"], {}], "config": {"index": 131915, "code_hash": null, "entity": [["tile_fc", "sp", [-1, 1, 2]], ["tile_y", "sp", [-1, 2, 1]], ["tile_x", "sp", [-1, 1, 16]], ["tile_ry", "sp", [-1, 1]], ["tile_rx", "sp", [-1, 1]], ["auto_unroll_max_step", "ot", 1500], ["unroll_explicit", "ot", 1]]}, "result": [[3.603968e-05], 0, 80.44711685180664, 1689588491.153769], "version": 0.2, "tvm_version": "0.13.dev0"}
