logs_gen1/mace_mobilenetv1_nchw.texture.float32.autotvm.log
{"input": ["opencl -keys=adreno,opencl,gpu -device=adreno -max_num_threads=256 -texture_spatial_limit=16384 -thread_warp_size=1", "conv2d_nchwc.image2d", [["TENSOR", [1, 1024, 1, 1], "float32"], ["TENSOR", [1001, 1024, 1, 1], "float32"], [1, 1], [0, 0, 0, 0], [1, 1], "float32"], {}], "config": {"index": 2789, "code_hash": null, "entity": [["tile_fc", "sp", [-1, 1, 251]], ["tile_y", "sp", [-1, 4, 1]], ["tile_x", "sp", [-1, 2, 2]], ["tile_rcc", "sp", [-1, 4]], ["tile_ry", "sp", [-1, 1]], ["tile_rx", "sp", [-1, 1]], ["auto_unroll_max_step", "ot", 512], ["unroll_explicit", "ot", 1]]}, "result": [[0.0004139008], 0, 81.17677211761475, 1689546284.272314], "version": 0.2, "tvm_version": "0.13.dev0"}
{"input": ["opencl -keys=adreno,opencl,gpu -device=adreno -max_num_threads=256 -texture_spatial_limit=16384 -thread_warp_size=1", "conv2d_nchwc.image2d", [["TENSOR", [1, 1024, 7, 7], "float32"], ["TENSOR", [1024, 1024, 1, 1], "float32"], [1, 1], [0, 0, 0, 0], [1, 1], "float32"], {}], "config": {"index": 26916, "code_hash": null, "entity": [["tile_fc", "sp", [-1, 1, 32]], ["tile_y", "sp", [-1, 4, 2]], ["tile_x", "sp", [-1, 1, 4]], ["tile_rcc", "sp", [-1, 2]], ["tile_ry", "sp", [-1, 1]], ["tile_rx", "sp", [-1, 1]], ["auto_unroll_max_step", "ot", 512], ["unroll_explicit", "ot", 0]]}, "result": [[0.0005347379200000001], 0, 43.48844909667969, 1689549759.628191], "version": 0.2, "tvm_version": "0.13.dev0"}
{"input": ["opencl -keys=adreno,opencl,gpu -device=adreno -max_num_threads=256 -texture_spatial_limit=16384 -thread_warp_size=1", "depthwise_conv2d_nchwc.image2d", [["TENSOR", [1, 1024, 7, 7], "float32"], ["TENSOR", [1024, 1, 3, 3], "float32"], [1, 1], [1, 1, 1, 1], [1, 1], "float32"], {}], "config": {"index": 76067, "code_hash": null, "entity": [["tile_fc", "sp", [-1, 1, 4]], ["tile_y", "sp", [-1, 1, 1]], ["tile_x", "sp", [-1, 1, 8]], ["tile_ry", "sp", [-1, 1]], ["tile_rx", "sp", [-1, 1]], ["auto_unroll_max_step", "ot", 512], ["unroll_explicit", "ot", 1]]}, "result": [[2.7873279999999998e-05], 0, 64.63296008110046, 1689553451.9385622], "version": 0.2, "tvm_version": "0.13.dev0"}
{"input": ["opencl -keys=adreno,opencl,gpu -device=adreno -max_num_threads=256 -texture_spatial_limit=16384 -thread_warp_size=1", "conv2d_nchwc.image2d", [["TENSOR", [1, 512, 7, 7], "float32"], ["TENSOR", [1024, 512, 1, 1], "float32"], [1, 1], [0, 0, 0, 0], [1, 1], "float32"], {}], "config": {"index": 57334, "code_hash": null, "entity": [["tile_fc", "sp", [-1, 2, 8]], ["tile_y", "sp", [-1, 8, 1]], ["tile_x", "sp", [-1, 1, 8]], ["tile_rcc", "sp", [-1, 64]], ["tile_ry", "sp", [-1, 1]], ["tile_rx", "sp", [-1, 1]], ["auto_unroll_max_step", "ot", 1500], ["unroll_explicit", "ot", 0]]}, "result": [[0.00023387136000000002], 0, 28.523503065109253, 1689556891.549262], "version": 0.2, "tvm_version": "0.13.dev0"}
{"input": ["opencl -keys=adreno,opencl,gpu -device=adreno -max_num_threads=256 -texture_spatial_limit=16384 -thread_warp_size=1", "depthwise_conv2d_nchwc.image2d", [["TENSOR", [1, 512, 14, 14], "float32"], ["TENSOR", [512, 1, 3, 3], "float32"], [2, 2], [0, 0, 1, 1], [1, 1], "float32"], {}], "config": {"index": 85377, "code_hash": null, "entity": [["tile_fc", "sp", [-1, 1, 8]], ["tile_y", "sp", [-1, 2, 1]], ["tile_x", "sp", [-1, 1, 4]], ["tile_ry", "sp", [-1, 3]], ["tile_rx", "sp", [-1, 3]], ["auto_unroll_max_step", "ot", 1500], ["unroll_explicit", "ot", 1]]}, "result": [[3.213312e-05], 0, 88.31667065620422, 1689559752.265406], "version": 0.2, "tvm_version": "0.13.dev0"}
{"input": ["opencl -keys=adreno,opencl,gpu -device=adreno -max_num_threads=256 -texture_spatial_limit=16384 -thread_warp_size=1", "conv2d_nchwc.image2d", [["TENSOR", [1, 512, 14, 14], "float32"], ["TENSOR", [512, 512, 1, 1], "float32"], [1, 1], [0, 0, 0, 0], [1, 1], "float32"], {}], "config": {"index": 28275, "code_hash": null, "entity": [["tile_fc", "sp", [-1, 2, 4]], ["tile_y", "sp", [-1, 1, 8]], ["tile_x", "sp", [-1, 8, 2]], ["tile_rcc", "sp", [-1, 64]], ["tile_ry", "sp", [-1, 1]], ["tile_rx", "sp", [-1, 1]], ["auto_unroll_max_step", "ot", 0], ["unroll_explicit", "ot", 0]]}, "result": [[0.0002113536], 0, 13.017150163650513, 1689562641.852045], "version": 0.2, "tvm_version": "0.13.dev0"}
{"input": ["opencl -keys=adreno,opencl,gpu -device=adreno -max_num_threads=256 -texture_spatial_limit=16384 -thread_warp_size=1", "depthwise_conv2d_nchwc.image2d", [["TENSOR", [1, 512, 14, 14], "float32"], ["TENSOR", [512, 1, 3, 3], "float32"], [1, 1], [1, 1, 1, 1], [1, 1], "float32"], {}], "config": {"index": 136286, "code_hash": null, "entity": [["tile_fc", "sp", [-1, 1, 16]], ["tile_y", "sp", [-1, 1, 2]], ["tile_x", "sp", [-1, 1, 8]], ["tile_ry", "sp", [-1, 1]], ["tile_rx", "sp", [-1, 1]], ["auto_unroll_max_step", "ot", 512], ["unroll_explicit", "ot", 1]]}, "result": [[3.495936e-05], 0, 13.118275880813599, 1689566402.366097], "version": 0.2, "tvm_version": "0.13.dev0"}
{"input": ["opencl -keys=adreno,opencl,gpu -device=adreno -max_num_threads=256 -texture_spatial_limit=16384 -thread_warp_size=1", "conv2d_nchwc.image2d", [["TENSOR", [1, 256, 14, 14], "float32"], ["TENSOR", [512, 256, 1, 1], "float32"], [1, 1], [0, 0, 0, 0], [1, 1], "float32"], {}], "config": {"index": 84331, "code_hash": null, "entity": [["tile_fc", "sp", [-1, 2, 4]], ["tile_y", "sp", [-1, 1, 8]], ["tile_x", "sp", [-1, 8, 2]], ["tile_rcc", "sp", [-1, 32]], ["tile_ry", "sp", [-1, 1]], ["tile_rx", "sp", [-1, 1]], ["auto_unroll_max_step", "ot", 1500], ["unroll_explicit", "ot", 0]]}, "result": [[0.00011180032000000002], 0, 42.820070028305054, 1689567669.886697], "version": 0.2, "tvm_version": "0.13.dev0"}
{"input": ["opencl -keys=adreno,opencl,gpu -device=adreno -max_num_threads=256 -texture_spatial_limit=16384 -thread_warp_size=1", "depthwise_conv2d_nchwc.image2d", [["TENSOR", [1, 256, 28, 28], "float32"], ["TENSOR", [256, 1, 3, 3], "float32"], [2, 2], [0, 0, 1, 1], [1, 1], "float32"], {}], "config": {"index": 144515, "code_hash": null, "entity": [["tile_fc", "sp", [-1, 1, 2]], ["tile_y", "sp", [-1, 2, 1]], ["tile_x", "sp", [-1, 1, 16]], ["tile_ry", "sp", [-1, 1]], ["tile_rx", "sp", [-1, 3]], ["auto_unroll_max_step", "ot", 1500], ["unroll_explicit", "ot", 1]]}, "result": [[5.34016e-05], 0, 72.17056512832642, 1689571094.4743161], "version": 0.2, "tvm_version": "0.13.dev0"}
{"input": ["opencl -keys=adreno,opencl,gpu -device=adreno -max_num_threads=256 -texture_spatial_limit=16384 -thread_warp_size=1", "conv2d_nchwc.image2d", [["TENSOR", [1, 256, 28, 28], "float32"], ["TENSOR", [256, 256, 1, 1], "float32"], [1, 1], [0, 0, 0, 0], [1, 1], "float32"], {}], "config": {"index": 44674, "code_hash": null, "entity": [["tile_fc", "sp", [-1, 2, 32]], ["tile_y", "sp", [-1, 7, 1]], ["tile_x", "sp", [-1, 1, 7]], ["tile_rcc", "sp", [-1, 32]], ["tile_ry", "sp", [-1, 1]], ["tile_rx", "sp", [-1, 1]], ["auto_unroll_max_step", "ot", 512], ["unroll_explicit", "ot", 0]]}, "result": [[0.00019048448], 0, 5.378308296203613, 1689575369.976833], "version": 0.2, "tvm_version": "0.13.dev0"}
{"input": ["opencl -keys=adreno,opencl,gpu -device=adreno -max_num_threads=256 -texture_spatial_limit=16384 -thread_warp_size=1", "depthwise_conv2d_nchwc.image2d", [["TENSOR", [1, 256, 28, 28], "float32"], ["TENSOR", [256, 1, 3, 3], "float32"], [1, 1], [1, 1, 1, 1], [1, 1], "float32"], {}], "config": {"index": 208516, "code_hash": null, "entity": [["tile_fc", "sp", [-1, 1, 1]], ["tile_y", "sp", [-1, 2, 7]], ["tile_x", "sp", [-1, 1, 28]], ["tile_ry", "sp", [-1, 1]], ["tile_rx", "sp", [-1, 3]], ["auto_unroll_max_step", "ot", 1500], ["unroll_explicit", "ot", 1]]}, "result": [[8.513024e-05], 0, 30.414555072784424, 1689578752.137974], "version": 0.2, "tvm_version": "0.13.dev0"}
{"input": ["opencl -keys=adreno,opencl,gpu -device=adreno -max_num_threads=256 -texture_spatial_limit=16384 -thread_warp_size=1", "conv2d_nchwc.image2d", [["TENSOR", [1, 128, 28, 28], "float32"], ["TENSOR", [256, 128, 1, 1], "float32"], [1, 1], [0, 0, 0, 0], [1, 1], "float32"], {}], "config": {"index": 32495, "code_hash": null, "entity": [["tile_fc", "sp", [-1, 2, 4]], ["tile_y", "sp", [-1, 2, 14]], ["tile_x", "sp", [-1, 4, 1]], ["tile_rcc", "sp", [-1, 8]], ["tile_ry", "sp", [-1, 1]], ["tile_rx", "sp", [-1, 1]], ["auto_unroll_max_step", "ot", 512], ["unroll_explicit", "ot", 0]]}, "result": [[0.00014580224], 0, 43.99771595001221, 1689582266.236249], "version": 0.2, "tvm_version": "0.13.dev0"}
{"input": ["opencl -keys=adreno,opencl,gpu -device=adreno -max_num_threads=256 -texture_spatial_limit=16384 -thread_warp_size=1", "depthwise_conv2d_nchwc.image2d", [["TENSOR", [1, 128, 56, 56], "float32"], ["TENSOR", [128, 1, 3, 3], "float32"], [2, 2], [0, 0, 1, 1], [1, 1], "float32"], {}], "config": {"index": 112680, "code_hash": null, "entity": [["tile_fc", "sp", [-1, 1, 8]], ["tile_y", "sp", [-1, 2, 1]], ["tile_x", "sp", [-1, 1, 4]], ["tile_ry", "sp", [-1, 1]], ["tile_rx", "sp", [-1, 1]], ["auto_unroll_max_step", "ot", 512], ["unroll_explicit", "ot", 1]]}, "result": [[0.00011675136], 0, 83.42895293235779, 1689583281.599234], "version": 0.2, "tvm_version": "0.13.dev0"}
{"input": ["opencl -keys=adreno,opencl,gpu -device=adreno -max_num_threads=256 -texture_spatial_limit=16384 -thread_warp_size=1", "conv2d_nchwc.image2d", [["TENSOR", [1, 128, 56, 56], "float32"], ["TENSOR", [128, 128, 1, 1], "float32"], [1, 1], [0, 0, 0, 0], [1, 1], "float32"], {}], "config": {"index": 10666, "code_hash": null, "entity": [["tile_fc", "sp", [-1, 2, 16]], ["tile_y", "sp", [-1, 1, 2]], ["tile_x", "sp", [-1, 8, 7]], ["tile_rcc", "sp", [-1, 2]], ["tile_ry", "sp", [-1, 1]], ["tile_rx", "sp", [-1, 1]], ["auto_unroll_max_step", "ot", 0], ["unroll_explicit", "ot", 0]]}, "result": [[0.00029821439999999996], 0, 13.833039999008179, 1689586287.815665], "version": 0.2, "tvm_version": "0.13.dev0"}
{"input": ["opencl -keys=adreno,opencl,gpu -device=adreno -max_num_threads=256 -texture_spatial_limit=16384 -thread_warp_size=1", "depthwise_conv2d_nchwc.image2d", [["TENSOR", [1, 128, 56, 56], "float32"], ["TENSOR", [128, 1, 3, 3], "float32"], [1, 1], [1, 1, 1, 1], [1, 1], "float32"], {}], "config": {"index": 36315, "code_hash": null, "entity": [["tile_fc", "sp", [-1, 1, 2]], ["tile_y", "sp", [-1, 2, 7]], ["tile_x", "sp", [-1, 1, 28]], ["tile_ry", "sp", [-1, 3]], ["tile_rx", "sp", [-1, 1]], ["auto_unroll_max_step", "ot", 0], ["unroll_explicit", "ot", 0]]}, "result": [[0.00017032704], 0, 29.01236081123352, 1689590745.455039], "version": 0.2, "tvm_version": "0.13.dev0"}
{"input": ["opencl -keys=adreno,opencl,gpu -device=adreno -max_num_threads=256 -texture_spatial_limit=16384 -thread_warp_size=1", "conv2d_nchwc.image2d", [["TENSOR", [1, 64, 56, 56], "float32"], ["TENSOR", [128, 64, 1, 1], "float32"], [1, 1], [0, 0, 0, 0], [1, 1], "float32"], {}], "config": {"index": 24491, "code_hash": null, "entity": [["tile_fc", "sp", [-1, 2, 4]], ["tile_y", "sp", [-1, 2, 2]], ["tile_x", "sp", [-1, 4, 14]], ["tile_rcc", "sp", [-1, 8]], ["tile_ry", "sp", [-1, 1]], ["tile_rx", "sp", [-1, 1]], ["auto_unroll_max_step", "ot", 0], ["unroll_explicit", "ot", 0]]}, "result": [[0.00015765503999999998], 0, 46.39094924926758, 1689595087.138487], "version": 0.2, "tvm_version": "0.13.dev0"}
{"input": ["opencl -keys=adreno,opencl,gpu -device=adreno -max_num_threads=256 -texture_spatial_limit=16384 -thread_warp_size=1", "depthwise_conv2d_nchwc.image2d", [["TENSOR", [1, 64, 112, 112], "float32"], ["TENSOR", [64, 1, 3, 3], "float32"], [2, 2], [0, 0, 1, 1], [1, 1], "float32"], {}], "config": {"index": 246935, "code_hash": null, "entity": [["tile_fc", "sp", [-1, 1, 2]], ["tile_y", "sp", [-1, 1, 8]], ["tile_x", "sp", [-1, 1, 2]], ["tile_ry", "sp", [-1, 1]], ["tile_rx", "sp", [-1, 3]], ["auto_unroll_max_step", "ot", 512], ["unroll_explicit", "ot", 1]]}, "result": [[0.0003044352], 0, 13.345561027526855, 1689598241.1016629], "version": 0.2, "tvm_version": "0.13.dev0"}
{"input": ["opencl -keys=adreno,opencl,gpu -device=adreno -max_num_threads=256 -texture_spatial_limit=16384 -thread_warp_size=1", "conv2d_nchwc.image2d", [["TENSOR", [1, 32, 112, 112], "float32"], ["TENSOR", [64, 32, 1, 1], "float32"], [1, 1], [0, 0, 0, 0], [1, 1], "float32"], {}], "config": {"index": 21068, "code_hash": null, "entity": [["tile_fc", "sp", [-1, 2, 8]], ["tile_y", "sp", [-1, 1, 1]], ["tile_x", "sp", [-1, 8, 14]], ["tile_rcc", "sp", [-1, 4]], ["tile_ry", "sp", [-1, 1]], ["tile_rx", "sp", [-1, 1]], ["auto_unroll_max_step", "ot", 0], ["unroll_explicit", "ot", 0]]}, "result": [[0.00020033024], 0, 5.630897045135498, 1689601418.218729], "version": 0.2, "tvm_version": "0.13.dev0"}
{"input": ["opencl -keys=adreno,opencl,gpu -device=adreno -max_num_threads=256 -texture_spatial_limit=16384 -thread_warp_size=1", "depthwise_conv2d_nchwc.image2d", [["TENSOR", [1, 32, 112, 112], "float32"], ["TENSOR", [32, 1, 3, 3], "float32"], [1, 1], [1, 1, 1, 1], [1, 1], "float32"], {}], "config": {"index": 441924, "code_hash": null, "entity": [["tile_fc", "sp", [-1, 1, 2]], ["tile_y", "sp", [-1, 4, 1]], ["tile_x", "sp", [-1, 1, 16]], ["tile_ry", "sp", [-1, 3]], ["tile_rx", "sp", [-1, 1]], ["auto_unroll_max_step", "ot", 1500], ["unroll_explicit", "ot", 1]]}, "result": [[0.00014290944], 0, 45.958523750305176, 1689603737.2949739], "version": 0.2, "tvm_version": "0.13.dev0"}
{"input": ["opencl -keys=adreno,opencl,gpu -device=adreno -max_num_threads=256 -texture_spatial_limit=16384 -thread_warp_size=1", "conv2d_nchwc.image2d", [["TENSOR", [1, 3, 224, 224], "float32"], ["TENSOR", [32, 3, 3, 3], "float32"], [2, 2], [0, 0, 1, 1], [1, 1], "float32"], {}], "config": {"index": 28385, "code_hash": null, "entity": [["tile_fc", "sp", [-1, 1, 8]], ["tile_y", "sp", [-1, 1, 2]], ["tile_x", "sp", [-1, 7, 4]], ["tile_rcc", "sp", [-1, 1]], ["tile_ry", "sp", [-1, 1]], ["tile_rx", "sp", [-1, 3]], ["auto_unroll_max_step", "ot", 512], ["unroll_explicit", "ot", 0]]}, "result": [[9.180160000000001e-05], 0, 37.755590200424194, 1689607998.269144], "version": 0.2, "tvm_version": "0.13.dev0"}
