logs_gen1/onnx_faster_rcnn.float32.autotvm.log
{"input": ["opencl -keys=adreno,opencl,gpu -device=adreno -max_function_args=128 -max_num_threads=256 -max_shared_memory_per_block=16384 -max_threads_per_block=256 -texture_spatial_limit=16384 -thread_warp_size=1", "conv2d_nchwc.image2d", [["TENSOR", [1, 3, 1200, 1200], "float32"], ["TENSOR", [64, 3, 7, 7], "float32"], [2, 2], [3, 3, 3, 3], [1, 1], "float32"], {}], "config": {"index": 238529, "code_hash": null, "entity": [["tile_fc", "sp", [-1, 1, 16]], ["tile_y", "sp", [-1, 3, 8]], ["tile_x", "sp", [-1, 2, 2]], ["tile_rcc", "sp", [-1, 1]], ["tile_ry", "sp", [-1, 7]], ["tile_rx", "sp", [-1, 1]], ["auto_unroll_max_step", "ot", 1500], ["unroll_explicit", "ot", 0]]}, "result": [[0.0181029376], 0, 8.612814903259277, 1691017280.59039], "version": 0.2, "tvm_version": "0.14.dev0"}
{"input": ["opencl -keys=adreno,opencl,gpu -device=adreno -max_function_args=128 -max_num_threads=256 -max_shared_memory_per_block=16384 -max_threads_per_block=256 -texture_spatial_limit=16384 -thread_warp_size=1", "conv2d_nchwc.image2d", [["TENSOR", [1, 3, 800, 800], "float32"], ["TENSOR", [64, 3, 7, 7], "float32"], [2, 2], [3, 3, 3, 3], [1, 1], "float32"], {}], "config": {"index": 38079, "code_hash": null, "entity": [["tile_fc", "sp", [-1, 1, 16]], ["tile_y", "sp", [-1, 5, 2]], ["tile_x", "sp", [-1, 2, 5]], ["tile_rcc", "sp", [-1, 1]], ["tile_ry", "sp", [-1, 1]], ["tile_rx", "sp", [-1, 1]], ["auto_unroll_max_step", "ot", 512], ["unroll_explicit", "ot", 0]]}, "result": [[0.00710245888], 0, 40.014711141586304, 1691018005.026379], "version": 0.2, "tvm_version": "0.14.dev0"}
{"input": ["opencl -keys=adreno,opencl,gpu -device=adreno -max_function_args=128 -max_num_threads=256 -max_shared_memory_per_block=16384 -max_threads_per_block=256 -texture_spatial_limit=16384 -thread_warp_size=1", "conv2d_nchwc.image2d", [["TENSOR", [1, 64, 200, 200], "float32"], ["TENSOR", [64, 64, 1, 1], "float32"], [1, 1], [0, 0, 0, 0], [1, 1], "float32"], {}], "config": {"index": 107819, "code_hash": null, "entity": [["tile_fc", "sp", [-1, 1, 16]], ["tile_y", "sp", [-1, 1, 8]], ["tile_x", "sp", [-1, 5, 2]], ["tile_rcc", "sp", [-1, 1]], ["tile_ry", "sp", [-1, 1]], ["tile_rx", "sp", [-1, 1]], ["auto_unroll_max_step", "ot", 512], ["unroll_explicit", "ot", 1]]}, "result": [[0.00167333888], 0, 14.625349998474121, 1691018796.02061], "version": 0.2, "tvm_version": "0.14.dev0"}
{"input": ["opencl -keys=adreno,opencl,gpu -device=adreno -max_function_args=128 -max_num_threads=256 -max_shared_memory_per_block=16384 -max_threads_per_block=256 -texture_spatial_limit=16384 -thread_warp_size=1", "conv2d_nchwc.image2d", [["TENSOR", [1, 64, 200, 200], "float32"], ["TENSOR", [64, 64, 3, 3], "float32"], [1, 1], [1, 1, 1, 1], [1, 1], "float32"], {}], "config": {"index": 403537, "code_hash": null, "entity": [["tile_fc", "sp", [-1, 1, 8]], ["tile_y", "sp", [-1, 5, 4]], ["tile_x", "sp", [-1, 2, 2]], ["tile_rcc", "sp", [-1, 2]], ["tile_ry", "sp", [-1, 3]], ["tile_rx", "sp", [-1, 3]], ["auto_unroll_max_step", "ot", 0], ["unroll_explicit", "ot", 1]]}, "result": [[0.00449354752], 0, 16.416648864746094, 1691018947.1699982], "version": 0.2, "tvm_version": "0.14.dev0"}
{"input": ["opencl -keys=adreno,opencl,gpu -device=adreno -max_function_args=128 -max_num_threads=256 -max_shared_memory_per_block=16384 -max_threads_per_block=256 -texture_spatial_limit=16384 -thread_warp_size=1", "conv2d_nchw_winograd.image2d", [["TENSOR", [1, 64, 200, 200], "float32"], ["TENSOR", [64, 64, 3, 3], "float32"], [1, 1], [1, 1, 1, 1], [1, 1], "float32"], {}], "config": {"index": 1299, "code_hash": null, "entity": [["auto_unroll_max_step", "ot", 0], ["tile_y", "sp", [-1, 2, 8]], ["tile_x", "sp", [-1, 5, 20]], ["tile_rc", "sp", [-1, 2]]]}, "result": [[0.010753807360000001], 0, 51.290682315826416, 1691019525.6439302], "version": 0.2, "tvm_version": "0.14.dev0"}
{"input": ["opencl -keys=adreno,opencl,gpu -device=adreno -max_function_args=128 -max_num_threads=256 -max_shared_memory_per_block=16384 -max_threads_per_block=256 -texture_spatial_limit=16384 -thread_warp_size=1", "conv2d_nchwc.image2d", [["TENSOR", [1, 64, 200, 200], "float32"], ["TENSOR", [256, 64, 1, 1], "float32"], [1, 1], [0, 0, 0, 0], [1, 1], "float32"], {}], "config": {"index": 55760, "code_hash": null, "entity": [["tile_fc", "sp", [-1, 4, 16]], ["tile_y", "sp", [-1, 5, 5]], ["tile_x", "sp", [-1, 1, 10]], ["tile_rcc", "sp", [-1, 1]], ["tile_ry", "sp", [-1, 1]], ["tile_rx", "sp", [-1, 1]], ["auto_unroll_max_step", "ot", 512], ["unroll_explicit", "ot", 0]]}, "result": [[0.00415666176], 0, 88.26240682601929, 1691019755.6663418], "version": 0.2, "tvm_version": "0.14.dev0"}
{"input": ["opencl -keys=adreno,opencl,gpu -device=adreno -max_function_args=128 -max_num_threads=256 -max_shared_memory_per_block=16384 -max_threads_per_block=256 -texture_spatial_limit=16384 -thread_warp_size=1", "conv2d_nchwc.image2d", [["TENSOR", [1, 256, 200, 200], "float32"], ["TENSOR", [128, 256, 1, 1], "float32"], [2, 2], [0, 0, 0, 0], [1, 1], "float32"], {}], "config": {"index": 18450, "code_hash": null, "entity": [["tile_fc", "sp", [-1, 2, 16]], ["tile_y", "sp", [-1, 2, 2]], ["tile_x", "sp", [-1, 4, 1]], ["tile_rcc", "sp", [-1, 32]], ["tile_ry", "sp", [-1, 1]], ["tile_rx", "sp", [-1, 1]], ["auto_unroll_max_step", "ot", 0], ["unroll_explicit", "ot", 0]]}, "result": [[0.0045336832], 0, 94.69420313835144, 1691020511.7652612], "version": 0.2, "tvm_version": "0.14.dev0"}
{"input": ["opencl -keys=adreno,opencl,gpu -device=adreno -max_function_args=128 -max_num_threads=256 -max_shared_memory_per_block=16384 -max_threads_per_block=256 -texture_spatial_limit=16384 -thread_warp_size=1", "conv2d_nchwc.image2d", [["TENSOR", [1, 128, 100, 100], "float32"], ["TENSOR", [128, 128, 3, 3], "float32"], [1, 1], [1, 1, 1, 1], [1, 1], "float32"], {}], "config": {"index": 138119, "code_hash": null, "entity": [["tile_fc", "sp", [-1, 2, 8]], ["tile_y", "sp", [-1, 1, 5]], ["tile_x", "sp", [-1, 5, 4]], ["tile_rcc", "sp", [-1, 4]], ["tile_ry", "sp", [-1, 1]], ["tile_rx", "sp", [-1, 3]], ["auto_unroll_max_step", "ot", 512], ["unroll_explicit", "ot", 0]]}, "result": [[0.00506111488], 0, 41.89087986946106, 1691021042.099634], "version": 0.2, "tvm_version": "0.14.dev0"}
{"input": ["opencl -keys=adreno,opencl,gpu -device=adreno -max_function_args=128 -max_num_threads=256 -max_shared_memory_per_block=16384 -max_threads_per_block=256 -texture_spatial_limit=16384 -thread_warp_size=1", "conv2d_nchw_winograd.image2d", [["TENSOR", [1, 128, 100, 100], "float32"], ["TENSOR", [128, 128, 3, 3], "float32"], [1, 1], [1, 1, 1, 1], [1, 1], "float32"], {}], "config": {"index": 2575, "code_hash": null, "entity": [["auto_unroll_max_step", "ot", 4], ["tile_y", "sp", [-1, 2, 16]], ["tile_x", "sp", [-1, 10, 5]], ["tile_rc", "sp", [-1, 4]]]}, "result": [[0.00675864064], 0, 160.75636506080627, 1691021711.8915808], "version": 0.2, "tvm_version": "0.14.dev0"}
{"input": ["opencl -keys=adreno,opencl,gpu -device=adreno -max_function_args=128 -max_num_threads=256 -max_shared_memory_per_block=16384 -max_threads_per_block=256 -texture_spatial_limit=16384 -thread_warp_size=1", "conv2d_nchwc.image2d", [["TENSOR", [1, 128, 100, 100], "float32"], ["TENSOR", [512, 128, 1, 1], "float32"], [1, 1], [0, 0, 0, 0], [1, 1], "float32"], {}], "config": {"index": 32426, "code_hash": null, "entity": [["tile_fc", "sp", [-1, 2, 64]], ["tile_y", "sp", [-1, 2, 1]], ["tile_x", "sp", [-1, 5, 5]], ["tile_rcc", "sp", [-1, 32]], ["tile_ry", "sp", [-1, 1]], ["tile_rx", "sp", [-1, 1]], ["auto_unroll_max_step", "ot", 0], ["unroll_explicit", "ot", 0]]}, "result": [[0.00304223232], 0, 18.281213998794556, 1691022473.286444], "version": 0.2, "tvm_version": "0.14.dev0"}
{"input": ["opencl -keys=adreno,opencl,gpu -device=adreno -max_function_args=128 -max_num_threads=256 -max_shared_memory_per_block=16384 -max_threads_per_block=256 -texture_spatial_limit=16384 -thread_warp_size=1", "conv2d_nchwc.image2d", [["TENSOR", [1, 256, 200, 200], "float32"], ["TENSOR", [512, 256, 1, 1], "float32"], [2, 2], [0, 0, 0, 0], [1, 1], "float32"], {}], "config": {"index": 78535, "code_hash": null, "entity": [["tile_fc", "sp", [-1, 2, 32]], ["tile_y", "sp", [-1, 2, 1]], ["tile_x", "sp", [-1, 5, 10]], ["tile_rcc", "sp", [-1, 64]], ["tile_ry", "sp", [-1, 1]], ["tile_rx", "sp", [-1, 1]], ["auto_unroll_max_step", "ot", 512], ["unroll_explicit", "ot", 0]]}, "result": [[0.00843419648], 0, 8.206665992736816, 1691022666.846027], "version": 0.2, "tvm_version": "0.14.dev0"}
{"input": ["opencl -keys=adreno,opencl,gpu -device=adreno -max_function_args=128 -max_num_threads=256 -max_shared_memory_per_block=16384 -max_threads_per_block=256 -texture_spatial_limit=16384 -thread_warp_size=1", "conv2d_nchwc.image2d", [["TENSOR", [1, 512, 100, 100], "float32"], ["TENSOR", [128, 512, 1, 1], "float32"], [1, 1], [0, 0, 0, 0], [1, 1], "float32"], {}], "config": {"index": 15619, "code_hash": null, "entity": [["tile_fc", "sp", [-1, 2, 8]], ["tile_y", "sp", [-1, 4, 5]], ["tile_x", "sp", [-1, 2, 2]], ["tile_rcc", "sp", [-1, 16]], ["tile_ry", "sp", [-1, 1]], ["tile_rx", "sp", [-1, 1]], ["auto_unroll_max_step", "ot", 0], ["unroll_explicit", "ot", 0]]}, "result": [[0.00457789952], 0, 19.094404697418213, 1691023144.4284859], "version": 0.2, "tvm_version": "0.14.dev0"}
{"input": ["opencl -keys=adreno,opencl,gpu -device=adreno -max_function_args=128 -max_num_threads=256 -max_shared_memory_per_block=16384 -max_threads_per_block=256 -texture_spatial_limit=16384 -thread_warp_size=1", "conv2d_nchwc.image2d", [["TENSOR", [1, 512, 100, 100], "float32"], ["TENSOR", [256, 512, 1, 1], "float32"], [2, 2], [0, 0, 0, 0], [1, 1], "float32"], {}], "config": {"index": 27574, "code_hash": null, "entity": [["tile_fc", "sp", [-1, 2, 32]], ["tile_y", "sp", [-1, 2, 1]], ["tile_x", "sp", [-1, 4, 13]], ["tile_rcc", "sp", [-1, 4]], ["tile_ry", "sp", [-1, 1]], ["tile_rx", "sp", [-1, 1]], ["auto_unroll_max_step", "ot", 1500], ["unroll_explicit", "ot", 0]]}, "result": [[0.00266463232], 0, 6.174362659454346, 1691024037.15248], "version": 0.2, "tvm_version": "0.14.dev0"}
{"input": ["opencl -keys=adreno,opencl,gpu -device=adreno -max_function_args=128 -max_num_threads=256 -max_shared_memory_per_block=16384 -max_threads_per_block=256 -texture_spatial_limit=16384 -thread_warp_size=1", "conv2d_nchwc.image2d", [["TENSOR", [1, 256, 50, 50], "float32"], ["TENSOR", [1024, 256, 1, 1], "float32"], [1, 1], [0, 0, 0, 0], [1, 1], "float32"], {}], "config": {"index": 35396, "code_hash": null, "entity": [["tile_fc", "sp", [-1, 2, 64]], ["tile_y", "sp", [-1, 4, 1]], ["tile_x", "sp", [-1, 2, 2]], ["tile_rcc", "sp", [-1, 8]], ["tile_ry", "sp", [-1, 1]], ["tile_rx", "sp", [-1, 1]], ["auto_unroll_max_step", "ot", 1500], ["unroll_explicit", "ot", 0]]}, "result": [[0.00314026496], 0, 52.23052406311035, 1691025883.592195], "version": 0.2, "tvm_version": "0.14.dev0"}
{"input": ["opencl -keys=adreno,opencl,gpu -device=adreno -max_function_args=128 -max_num_threads=256 -max_shared_memory_per_block=16384 -max_threads_per_block=256 -texture_spatial_limit=16384 -thread_warp_size=1", "conv2d_nchwc.image2d", [["TENSOR", [1, 512, 100, 100], "float32"], ["TENSOR", [1024, 512, 1, 1], "float32"], [2, 2], [0, 0, 0, 0], [1, 1], "float32"], {}], "config": {"index": 94960, "code_hash": null, "entity": [["tile_fc", "sp", [-1, 4, 8]], ["tile_y", "sp", [-1, 1, 1]], ["tile_x", "sp", [-1, 4, 13]], ["tile_rcc", "sp", [-1, 64]], ["tile_ry", "sp", [-1, 1]], ["tile_rx", "sp", [-1, 1]], ["auto_unroll_max_step", "ot", 1500], ["unroll_explicit", "ot", 1]]}, "result": [[0.007631621119999999], 0, 7.497766971588135, 1691026237.766143], "version": 0.2, "tvm_version": "0.14.dev0"}
{"input": ["opencl -keys=adreno,opencl,gpu -device=adreno -max_function_args=128 -max_num_threads=256 -max_shared_memory_per_block=16384 -max_threads_per_block=256 -texture_spatial_limit=16384 -thread_warp_size=1", "conv2d_nchwc.image2d", [["TENSOR", [1, 1024, 50, 50], "float32"], ["TENSOR", [512, 1024, 1, 1], "float32"], [2, 2], [0, 0, 0, 0], [1, 1], "float32"], {}], "config": {"index": 111008, "code_hash": null, "entity": [["tile_fc", "sp", [-1, 4, 32]], ["tile_y", "sp", [-1, 2, 2]], ["tile_x", "sp", [-1, 2, 7]], ["tile_rcc", "sp", [-1, 128]], ["tile_ry", "sp", [-1, 1]], ["tile_rx", "sp", [-1, 1]], ["auto_unroll_max_step", "ot", 1500], ["unroll_explicit", "ot", 0]]}, "result": [[0.0026208409599999998], 0, 41.37124705314636, 1691027145.937999], "version": 0.2, "tvm_version": "0.14.dev0"}
{"input": ["opencl -keys=adreno,opencl,gpu -device=adreno -max_function_args=128 -max_num_threads=256 -max_shared_memory_per_block=16384 -max_threads_per_block=256 -texture_spatial_limit=16384 -thread_warp_size=1", "conv2d_nchwc.image2d", [["TENSOR", [1, 512, 25, 25], "float32"], ["TENSOR", [512, 512, 3, 3], "float32"], [1, 1], [1, 1, 1, 1], [1, 1], "float32"], {}], "config": {"index": 785976, "code_hash": null, "entity": [["tile_fc", "sp", [-1, 1, 4]], ["tile_y", "sp", [-1, 1, 14]], ["tile_x", "sp", [-1, 7, 1]], ["tile_rcc", "sp", [-1, 64]], ["tile_ry", "sp", [-1, 1]], ["tile_rx", "sp", [-1, 3]], ["auto_unroll_max_step", "ot", 1500], ["unroll_explicit", "ot", 1]]}, "result": [[0.00534535168], 0, 168.60257363319397, 1691027621.1223848], "version": 0.2, "tvm_version": "0.14.dev0"}
{"input": ["opencl -keys=adreno,opencl,gpu -device=adreno -max_function_args=128 -max_num_threads=256 -max_shared_memory_per_block=16384 -max_threads_per_block=256 -texture_spatial_limit=16384 -thread_warp_size=1", "conv2d_nchw_winograd.image2d", [["TENSOR", [1, 512, 25, 25], "float32"], ["TENSOR", [512, 512, 3, 3], "float32"], [1, 1], [1, 1, 1, 1], [1, 1], "float32"], {}], "config": {"index": 1017, "code_hash": null, "entity": [["auto_unroll_max_step", "ot", 0], ["tile_y", "sp", [-1, 1, 16]], ["tile_x", "sp", [-1, 13, 13]], ["tile_rc", "sp", [-1, 4]]]}, "result": [[0.00820522496], 0, 58.48860716819763, 1691028321.809385], "version": 0.2, "tvm_version": "0.14.dev0"}
{"input": ["opencl -keys=adreno,opencl,gpu -device=adreno -max_function_args=128 -max_num_threads=256 -max_shared_memory_per_block=16384 -max_threads_per_block=256 -texture_spatial_limit=16384 -thread_warp_size=1", "conv2d_nchwc.image2d", [["TENSOR", [1, 512, 25, 25], "float32"], ["TENSOR", [2048, 512, 1, 1], "float32"], [1, 1], [0, 0, 0, 0], [1, 1], "float32"], {}], "config": {"index": 57092, "code_hash": null, "entity": [["tile_fc", "sp", [-1, 4, 16]], ["tile_y", "sp", [-1, 1, 1]], ["tile_x", "sp", [-1, 4, 7]], ["tile_rcc", "sp", [-1, 4]], ["tile_ry", "sp", [-1, 1]], ["tile_rx", "sp", [-1, 1]], ["auto_unroll_max_step", "ot", 512], ["unroll_explicit", "ot", 0]]}, "result": [[0.0037062144000000003], 0, 7.145092010498047, 1691028828.692234], "version": 0.2, "tvm_version": "0.14.dev0"}
{"input": ["opencl -keys=adreno,opencl,gpu -device=adreno -max_function_args=128 -max_num_threads=256 -max_shared_memory_per_block=16384 -max_threads_per_block=256 -texture_spatial_limit=16384 -thread_warp_size=1", "conv2d_nchwc.image2d", [["TENSOR", [1, 1024, 50, 50], "float32"], ["TENSOR", [2048, 1024, 1, 1], "float32"], [2, 2], [0, 0, 0, 0], [1, 1], "float32"], {}], "config": {"index": 18628, "code_hash": null, "entity": [["tile_fc", "sp", [-1, 2, 128]], ["tile_y", "sp", [-1, 7, 1]], ["tile_x", "sp", [-1, 1, 4]], ["tile_rcc", "sp", [-1, 8]], ["tile_ry", "sp", [-1, 1]], ["tile_rx", "sp", [-1, 1]], ["auto_unroll_max_step", "ot", 0], ["unroll_explicit", "ot", 0]]}, "result": [[0.005494343679999999], 0, 108.42051267623901, 1691029840.984009], "version": 0.2, "tvm_version": "0.14.dev0"}
{"input": ["opencl -keys=adreno,opencl,gpu -device=adreno -max_function_args=128 -max_num_threads=256 -max_shared_memory_per_block=16384 -max_threads_per_block=256 -texture_spatial_limit=16384 -thread_warp_size=1", "conv2d_nchwc.image2d", [["TENSOR", [1, 2048, 25, 25], "float32"], ["TENSOR", [512, 2048, 1, 1], "float32"], [1, 1], [0, 0, 0, 0], [1, 1], "float32"], {}], "config": {"index": 57154, "code_hash": null, "entity": [["tile_fc", "sp", [-1, 2, 64]], ["tile_y", "sp", [-1, 1, 4]], ["tile_x", "sp", [-1, 7, 1]], ["tile_rcc", "sp", [-1, 8]], ["tile_ry", "sp", [-1, 1]], ["tile_rx", "sp", [-1, 1]], ["auto_unroll_max_step", "ot", 512], ["unroll_explicit", "ot", 0]]}, "result": [[0.0030603264], 0, 24.830838918685913, 1691030036.1442418], "version": 0.2, "tvm_version": "0.14.dev0"}
{"input": ["opencl -keys=adreno,opencl,gpu -device=adreno -max_function_args=128 -max_num_threads=256 -max_shared_memory_per_block=16384 -max_threads_per_block=256 -texture_spatial_limit=16384 -thread_warp_size=1", "conv2d_nchwc.image2d", [["TENSOR", [1, 2048, 25, 25], "float32"], ["TENSOR", [256, 2048, 1, 1], "float32"], [1, 1], [0, 0, 0, 0], [1, 1], "float32"], {}], "config": {"index": 65608, "code_hash": null, "entity": [["tile_fc", "sp", [-1, 2, 32]], ["tile_y", "sp", [-1, 1, 2]], ["tile_x", "sp", [-1, 7, 4]], ["tile_rcc", "sp", [-1, 256]], ["tile_ry", "sp", [-1, 1]], ["tile_rx", "sp", [-1, 1]], ["auto_unroll_max_step", "ot", 512], ["unroll_explicit", "ot", 0]]}, "result": [[0.00165297664], 0, 49.24297618865967, 1691030566.556669], "version": 0.2, "tvm_version": "0.14.dev0"}
{"input": ["opencl -keys=adreno,opencl,gpu -device=adreno -max_function_args=128 -max_num_threads=256 -max_shared_memory_per_block=16384 -max_threads_per_block=256 -texture_spatial_limit=16384 -thread_warp_size=1", "conv2d_nchwc.image2d", [["TENSOR", [1, 1024, 50, 50], "float32"], ["TENSOR", [256, 1024, 1, 1], "float32"], [1, 1], [0, 0, 0, 0], [1, 1], "float32"], {}], "config": {"index": 19382, "code_hash": null, "entity": [["tile_fc", "sp", [-1, 4, 16]], ["tile_y", "sp", [-1, 1, 4]], ["tile_x", "sp", [-1, 4, 1]], ["tile_rcc", "sp", [-1, 16]], ["tile_ry", "sp", [-1, 1]], ["tile_rx", "sp", [-1, 1]], ["auto_unroll_max_step", "ot", 512], ["unroll_explicit", "ot", 0]]}, "result": [[0.00390984704], 0, 90.83334493637085, 1691031199.6760168], "version": 0.2, "tvm_version": "0.14.dev0"}
{"input": ["opencl -keys=adreno,opencl,gpu -device=adreno -max_function_args=128 -max_num_threads=256 -max_shared_memory_per_block=16384 -max_threads_per_block=256 -texture_spatial_limit=16384 -thread_warp_size=1", "conv2d_nchwc.image2d", [["TENSOR", [1, 512, 100, 100], "float32"], ["TENSOR", [256, 512, 1, 1], "float32"], [1, 1], [0, 0, 0, 0], [1, 1], "float32"], {}], "config": {"index": 137580, "code_hash": null, "entity": [["tile_fc", "sp", [-1, 4, 4]], ["tile_y", "sp", [-1, 4, 5]], ["tile_x", "sp", [-1, 1, 10]], ["tile_rcc", "sp", [-1, 32]], ["tile_ry", "sp", [-1, 1]], ["tile_rx", "sp", [-1, 1]], ["auto_unroll_max_step", "ot", 0], ["unroll_explicit", "ot", 1]]}, "result": [[0.007841628160000001], 0, 26.2827627658844, 1691031386.998498], "version": 0.2, "tvm_version": "0.14.dev0"}
{"input": ["opencl -keys=adreno,opencl,gpu -device=adreno -max_function_args=128 -max_num_threads=256 -max_shared_memory_per_block=16384 -max_threads_per_block=256 -texture_spatial_limit=16384 -thread_warp_size=1", "conv2d_nchwc.image2d", [["TENSOR", [1, 256, 200, 200], "float32"], ["TENSOR", [256, 256, 1, 1], "float32"], [1, 1], [0, 0, 0, 0], [1, 1], "float32"], {}], "config": {"index": 121066, "code_hash": null, "entity": [["tile_fc", "sp", [-1, 2, 32]], ["tile_y", "sp", [-1, 1, 4]], ["tile_x", "sp", [-1, 8, 5]], ["tile_rcc", "sp", [-1, 32]], ["tile_ry", "sp", [-1, 1]], ["tile_rx", "sp", [-1, 1]], ["auto_unroll_max_step", "ot", 512], ["unroll_explicit", "ot", 0]]}, "result": [[0.01147257344], 0, 59.13226914405823, 1691032037.448246], "version": 0.2, "tvm_version": "0.14.dev0"}
{"input": ["opencl -keys=adreno,opencl,gpu -device=adreno -max_function_args=128 -max_num_threads=256 -max_shared_memory_per_block=16384 -max_threads_per_block=256 -texture_spatial_limit=16384 -thread_warp_size=1", "conv2d_nchw_winograd.image2d", [["TENSOR", [1, 256, 100, 100], "float32"], ["TENSOR", [256, 256, 3, 3], "float32"], [1, 1], [1, 1, 1, 1], [1, 1], "float32"], {}], "config": {"index": 223, "code_hash": null, "entity": [["auto_unroll_max_step", "ot", 4], ["tile_y", "sp", [-1, 1, 64]], ["tile_x", "sp", [-1, 10, 1]], ["tile_rc", "sp", [-1, 1]]]}, "result": [[0.01785199104], 0, 60.52458882331848, 1691033915.697589], "version": 0.2, "tvm_version": "0.14.dev0"}
{"input": ["opencl -keys=adreno,opencl,gpu -device=adreno -max_function_args=128 -max_num_threads=256 -max_shared_memory_per_block=16384 -max_threads_per_block=256 -texture_spatial_limit=16384 -thread_warp_size=1", "conv2d_nchw_winograd.image2d", [["TENSOR", [1, 256, 200, 200], "float32"], ["TENSOR", [256, 256, 3, 3], "float32"], [1, 1], [1, 1, 1, 1], [1, 1], "float32"], {}], "config": {"index": 1572, "code_hash": null, "entity": [["auto_unroll_max_step", "ot", 0], ["tile_y", "sp", [-1, 1, 64]], ["tile_x", "sp", [-1, 5, 2]], ["tile_rc", "sp", [-1, 2]]]}, "result": [[0.05451713536], 0, 34.51575589179993, 1691035707.322423], "version": 0.2, "tvm_version": "0.14.dev0"}
{"input": ["opencl -keys=adreno,opencl,gpu -device=adreno -max_function_args=128 -max_num_threads=256 -max_shared_memory_per_block=16384 -max_threads_per_block=256 -texture_spatial_limit=16384 -thread_warp_size=1", "conv2d_nchwc.image2d", [["TENSOR", [1, 256, 25, 25], "float32"], ["TENSOR", [256, 256, 3, 3], "float32"], [1, 1], [1, 1, 1, 1], [1, 1], "float32"], {}], "config": {"index": 269814, "code_hash": null, "entity": [["tile_fc", "sp", [-1, 1, 16]], ["tile_y", "sp", [-1, 1, 7]], ["tile_x", "sp", [-1, 7, 2]], ["tile_rcc", "sp", [-1, 64]], ["tile_ry", "sp", [-1, 1]], ["tile_rx", "sp", [-1, 3]], ["auto_unroll_max_step", "ot", 1500], ["unroll_explicit", "ot", 0]]}, "result": [[0.0014999398400000002], 0, 44.293389320373535, 1691036366.6908832], "version": 0.2, "tvm_version": "0.14.dev0"}
{"input": ["opencl -keys=adreno,opencl,gpu -device=adreno -max_function_args=128 -max_num_threads=256 -max_shared_memory_per_block=16384 -max_threads_per_block=256 -texture_spatial_limit=16384 -thread_warp_size=1", "conv2d_nchw_winograd.image2d", [["TENSOR", [1, 256, 25, 25], "float32"], ["TENSOR", [256, 256, 3, 3], "float32"], [1, 1], [1, 1, 1, 1], [1, 1], "float32"], {}], "config": {"index": 572, "code_hash": null, "entity": [["auto_unroll_max_step", "ot", 16], ["tile_y", "sp", [-1, 1, 8]], ["tile_x", "sp", [-1, 13, 13]], ["tile_rc", "sp", [-1, 2]]]}, "result": [[0.00233549824], 0, 88.6279718875885, 1691036763.740396], "version": 0.2, "tvm_version": "0.14.dev0"}
{"input": ["opencl -keys=adreno,opencl,gpu -device=adreno -max_function_args=128 -max_num_threads=256 -max_shared_memory_per_block=16384 -max_threads_per_block=256 -texture_spatial_limit=16384 -thread_warp_size=1", "conv2d_nchwc.image2d", [["TENSOR", [1, 256, 13, 13], "float32"], ["TENSOR", [256, 256, 3, 3], "float32"], [1, 1], [1, 1, 1, 1], [1, 1], "float32"], {}], "config": {"index": 179738, "code_hash": null, "entity": [["tile_fc", "sp", [-1, 1, 8]], ["tile_y", "sp", [-1, 8, 1]], ["tile_x", "sp", [-1, 1, 16]], ["tile_rcc", "sp", [-1, 2]], ["tile_ry", "sp", [-1, 3]], ["tile_rx", "sp", [-1, 3]], ["auto_unroll_max_step", "ot", 512], ["unroll_explicit", "ot", 0]]}, "result": [[0.00059533312], 0, 70.57355093955994, 1691037047.9143848], "version": 0.2, "tvm_version": "0.14.dev0"}
{"input": ["opencl -keys=adreno,opencl,gpu -device=adreno -max_function_args=128 -max_num_threads=256 -max_shared_memory_per_block=16384 -max_threads_per_block=256 -texture_spatial_limit=16384 -thread_warp_size=1", "conv2d_nchw_winograd.image2d", [["TENSOR", [1, 256, 13, 13], "float32"], ["TENSOR", [256, 256, 3, 3], "float32"], [1, 1], [1, 1, 1, 1], [1, 1], "float32"], {}], "config": {"index": 1422, "code_hash": null, "entity": [["auto_unroll_max_step", "ot", 0], ["tile_y", "sp", [-1, 1, 64]], ["tile_x", "sp", [-1, 7, 7]], ["tile_rc", "sp", [-1, 8]]]}, "result": [[0.0006224384], 0, 79.41820287704468, 1691037631.86335], "version": 0.2, "tvm_version": "0.14.dev0"}
{"input": ["opencl -keys=adreno,opencl,gpu -device=adreno -max_function_args=128 -max_num_threads=256 -max_shared_memory_per_block=16384 -max_threads_per_block=256 -texture_spatial_limit=16384 -thread_warp_size=1", "conv2d_nchwc.image2d", [["TENSOR", [1, 256, 50, 50], "float32"], ["TENSOR", [256, 256, 3, 3], "float32"], [1, 1], [1, 1, 1, 1], [1, 1], "float32"], {}], "config": {"index": 144253, "code_hash": null, "entity": [["tile_fc", "sp", [-1, 2, 2]], ["tile_y", "sp", [-1, 2, 2]], ["tile_x", "sp", [-1, 4, 13]], ["tile_rcc", "sp", [-1, 1]], ["tile_ry", "sp", [-1, 1]], ["tile_rx", "sp", [-1, 3]], ["auto_unroll_max_step", "ot", 0], ["unroll_explicit", "ot", 1]]}, "result": [[0.00566125568], 0, 45.956424713134766, 1691040648.1856818], "version": 0.2, "tvm_version": "0.14.dev0"}
{"input": ["opencl -keys=adreno,opencl,gpu -device=adreno -max_function_args=128 -max_num_threads=256 -max_shared_memory_per_block=16384 -max_threads_per_block=256 -texture_spatial_limit=16384 -thread_warp_size=1", "conv2d_nchw_winograd.image2d", [["TENSOR", [1, 256, 50, 50], "float32"], ["TENSOR", [256, 256, 3, 3], "float32"], [1, 1], [1, 1, 1, 1], [1, 1], "float32"], {}], "config": {"index": 148, "code_hash": null, "entity": [["auto_unroll_max_step", "ot", 4], ["tile_y", "sp", [-1, 1, 64]], ["tile_x", "sp", [-1, 5, 1]], ["tile_rc", "sp", [-1, 1]]]}, "result": [[0.0049340672], 0, 29.581791877746582, 1691040999.9382021], "version": 0.2, "tvm_version": "0.14.dev0"}
{"input": ["opencl -keys=adreno,opencl,gpu -device=adreno -max_function_args=128 -max_num_threads=256 -max_shared_memory_per_block=16384 -max_threads_per_block=256 -texture_spatial_limit=16384 -thread_warp_size=1", "conv2d_nchwc.image2d", [["TENSOR", [1, 256, 100, 100], "float32"], ["TENSOR", [256, 256, 3, 3], "float32"], [1, 1], [1, 1, 1, 1], [1, 1], "float32"], {}], "config": {"index": 327617, "code_hash": null, "entity": [["tile_fc", "sp", [-1, 1, 64]], ["tile_y", "sp", [-1, 5, 4]], ["tile_x", "sp", [-1, 2, 1]], ["tile_rcc", "sp", [-1, 2]], ["tile_ry", "sp", [-1, 1]], ["tile_rx", "sp", [-1, 3]], ["auto_unroll_max_step", "ot", 1500], ["unroll_explicit", "ot", 0]]}, "result": [[0.01783102976], 0, 66.44053959846497, 1691041906.548956], "version": 0.2, "tvm_version": "0.14.dev0"}
{"input": ["opencl -keys=adreno,opencl,gpu -device=adreno -max_function_args=128 -max_num_threads=256 -max_shared_memory_per_block=16384 -max_threads_per_block=256 -texture_spatial_limit=16384 -thread_warp_size=1", "conv2d_nchwc.image2d", [["TENSOR", [1, 256, 13, 13], "float32"], ["TENSOR", [12, 256, 1, 1], "float32"], [1, 1], [0, 0, 0, 0], [1, 1], "float32"], {}], "config": {"index": 1152, "code_hash": null, "entity": [["tile_fc", "sp", [-1, 1, 1]], ["tile_y", "sp", [-1, 4, 2]], ["tile_x", "sp", [-1, 1, 16]], ["tile_rcc", "sp", [-1, 2]], ["tile_ry", "sp", [-1, 1]], ["tile_rx", "sp", [-1, 1]], ["auto_unroll_max_step", "ot", 0], ["unroll_explicit", "ot", 0]]}, "result": [[4.7180799999999994e-05], 0, 60.12103199958801, 1691045165.3712351], "version": 0.2, "tvm_version": "0.14.dev0"}
{"input": ["opencl -keys=adreno,opencl,gpu -device=adreno -max_function_args=128 -max_num_threads=256 -max_shared_memory_per_block=16384 -max_threads_per_block=256 -texture_spatial_limit=16384 -thread_warp_size=1", "conv2d_nchwc.image2d", [["TENSOR", [1, 256, 25, 25], "float32"], ["TENSOR", [12, 256, 1, 1], "float32"], [1, 1], [0, 0, 0, 0], [1, 1], "float32"], {}], "config": {"index": 8049, "code_hash": null, "entity": [["tile_fc", "sp", [-1, 1, 1]], ["tile_y", "sp", [-1, 1, 7]], ["tile_x", "sp", [-1, 1, 7]], ["tile_rcc", "sp", [-1, 64]], ["tile_ry", "sp", [-1, 1]], ["tile_rx", "sp", [-1, 1]], ["auto_unroll_max_step", "ot", 512], ["unroll_explicit", "ot", 0]]}, "result": [[0.00010471424], 0, 54.13886499404907, 1691045379.952192], "version": 0.2, "tvm_version": "0.14.dev0"}
{"input": ["opencl -keys=adreno,opencl,gpu -device=adreno -max_function_args=128 -max_num_threads=256 -max_shared_memory_per_block=16384 -max_threads_per_block=256 -texture_spatial_limit=16384 -thread_warp_size=1", "conv2d_nchwc.image2d", [["TENSOR", [1, 256, 50, 50], "float32"], ["TENSOR", [12, 256, 1, 1], "float32"], [1, 1], [0, 0, 0, 0], [1, 1], "float32"], {}], "config": {"index": 5577, "code_hash": null, "entity": [["tile_fc", "sp", [-1, 1, 1]], ["tile_y", "sp", [-1, 1, 4]], ["tile_x", "sp", [-1, 4, 13]], ["tile_rcc", "sp", [-1, 2]], ["tile_ry", "sp", [-1, 1]], ["tile_rx", "sp", [-1, 1]], ["auto_unroll_max_step", "ot", 0], ["unroll_explicit", "ot", 1]]}, "result": [[0.00020299264], 0, 5.66385817527771, 1691045882.967814], "version": 0.2, "tvm_version": "0.14.dev0"}
{"input": ["opencl -keys=adreno,opencl,gpu -device=adreno -max_function_args=128 -max_num_threads=256 -max_shared_memory_per_block=16384 -max_threads_per_block=256 -texture_spatial_limit=16384 -thread_warp_size=1", "conv2d_nchwc.image2d", [["TENSOR", [1, 256, 100, 100], "float32"], ["TENSOR", [12, 256, 1, 1], "float32"], [1, 1], [0, 0, 0, 0], [1, 1], "float32"], {}], "config": {"index": 28205, "code_hash": null, "entity": [["tile_fc", "sp", [-1, 1, 3]], ["tile_y", "sp", [-1, 1, 5]], ["tile_x", "sp", [-1, 4, 5]], ["tile_rcc", "sp", [-1, 2]], ["tile_ry", "sp", [-1, 1]], ["tile_rx", "sp", [-1, 1]], ["auto_unroll_max_step", "ot", 1500], ["unroll_explicit", "ot", 1]]}, "result": [[0.00080676864], 0, 9.26768946647644, 1691046301.3343208], "version": 0.2, "tvm_version": "0.14.dev0"}
{"input": ["opencl -keys=adreno,opencl,gpu -device=adreno -max_function_args=128 -max_num_threads=256 -max_shared_memory_per_block=16384 -max_threads_per_block=256 -texture_spatial_limit=16384 -thread_warp_size=1", "conv2d_nchwc.image2d", [["TENSOR", [1, 256, 200, 200], "float32"], ["TENSOR", [12, 256, 1, 1], "float32"], [1, 1], [0, 0, 0, 0], [1, 1], "float32"], {}], "config": {"index": 14165, "code_hash": null, "entity": [["tile_fc", "sp", [-1, 1, 3]], ["tile_y", "sp", [-1, 2, 2]], ["tile_x", "sp", [-1, 4, 10]], ["tile_rcc", "sp", [-1, 2]], ["tile_ry", "sp", [-1, 1]], ["tile_rx", "sp", [-1, 1]], ["auto_unroll_max_step", "ot", 512], ["unroll_explicit", "ot", 0]]}, "result": [[0.0031425024000000003], 0, 83.12269115447998, 1691046516.7970822], "version": 0.2, "tvm_version": "0.14.dev0"}
