logs_gen1/resnet_float32.autotvm.log
{"input": ["opencl -keys=adreno,opencl,gpu -device=adreno -max_function_args=128 -max_num_threads=256 -max_shared_memory_per_block=16384 -max_threads_per_block=256 -texture_spatial_limit=16384 -thread_warp_size=1", "conv2d_nchwc.image2d", [["TENSOR", [1, 128, 150, 150], "float32"], ["TENSOR", [256, 128, 3, 3], "float32"], [1, 1], [1, 1, 1, 1], [1, 1], "float32"], {}], "config": {"index": 85840, "code_hash": null, "entity": [["tile_fc", "sp", [-1, 2, 32]], ["tile_y", "sp", [-1, 2, 4]], ["tile_x", "sp", [-1, 4, 2]], ["tile_rcc", "sp", [-1, 32]], ["tile_ry", "sp", [-1, 3]], ["tile_rx", "sp", [-1, 3]], ["auto_unroll_max_step", "ot", 512], ["unroll_explicit", "ot", 0]]}, "result": [[0.01768662528], 0, 8.310285806655884, 1689515619.246023], "version": 0.2, "tvm_version": "0.13.dev0"}
{"input": ["opencl -keys=adreno,opencl,gpu -device=adreno -max_function_args=128 -max_num_threads=256 -max_shared_memory_per_block=16384 -max_threads_per_block=256 -texture_spatial_limit=16384 -thread_warp_size=1", "conv2d_nchw_winograd.image2d", [["TENSOR", [1, 128, 150, 150], "float32"], ["TENSOR", [256, 128, 3, 3], "float32"], [1, 1], [1, 1, 1, 1], [1, 1], "float32"], {}], "config": {"index": 4722, "code_hash": null, "entity": [["auto_unroll_max_step", "ot", 0], ["tile_y", "sp", [-1, 1, 64]], ["tile_x", "sp", [-1, 9, 1]], ["tile_rc", "sp", [-1, 8]]]}, "result": [[0.021760645119999998], 0, 55.300305128097534, 1689517676.3759391], "version": 0.2, "tvm_version": "0.13.dev0"}
{"input": ["opencl -keys=adreno,opencl,gpu -device=adreno -max_function_args=128 -max_num_threads=256 -max_shared_memory_per_block=16384 -max_threads_per_block=256 -texture_spatial_limit=16384 -thread_warp_size=1", "conv2d_nchw_winograd.image2d", [["TENSOR", [1, 256, 150, 150], "float32"], ["TENSOR", [256, 256, 3, 3], "float32"], [1, 1], [1, 1, 1, 1], [1, 1], "float32"], {}], "config": {"index": 9224, "code_hash": null, "entity": [["auto_unroll_max_step", "ot", 16], ["tile_y", "sp", [-1, 1, 64]], ["tile_x", "sp", [-1, 9, 1]], ["tile_rc", "sp", [-1, 64]]]}, "result": [[0.03994763264], 0, 27.873415231704712, 1689530862.205327], "version": 0.2, "tvm_version": "0.13.dev0"}
{"input": ["opencl -keys=adreno,opencl,gpu -device=adreno -max_function_args=128 -max_num_threads=256 -max_shared_memory_per_block=16384 -max_threads_per_block=256 -texture_spatial_limit=16384 -thread_warp_size=1", "conv2d_nchwc.image2d", [["TENSOR", [1, 256, 150, 150], "float32"], ["TENSOR", [256, 256, 3, 3], "float32"], [1, 1], [1, 1, 1, 1], [1, 1], "float32"], {}], "config": {"index": 151915, "code_hash": null, "entity": [["tile_fc", "sp", [-1, 2, 16]], ["tile_y", "sp", [-1, 1, 8]], ["tile_x", "sp", [-1, 8, 1]], ["tile_rcc", "sp", [-1, 1]], ["tile_ry", "sp", [-1, 1]], ["tile_rx", "sp", [-1, 1]], ["auto_unroll_max_step", "ot", 0], ["unroll_explicit", "ot", 1]]}, "result": [[0.036356357119999995], 0, 11.544915676116943, 1689534972.405212], "version": 0.2, "tvm_version": "0.13.dev0"}
{"input": ["opencl -keys=adreno,opencl,gpu -device=adreno -max_function_args=128 -max_num_threads=256 -max_shared_memory_per_block=16384 -max_threads_per_block=256 -texture_spatial_limit=16384 -thread_warp_size=1", "conv2d_nchwc.image2d", [["TENSOR", [1, 3, 416, 416], "float32"], ["TENSOR", [32, 3, 3, 3], "float32"], [1, 1], [1, 1, 1, 1], [1, 1], "float32"], {}], "config": {"index": 28229, "code_hash": null, "entity": [["tile_fc", "sp", [-1, 1, 8]], ["tile_y", "sp", [-1, 1, 1]], ["tile_x", "sp", [-1, 4, 8]], ["tile_rcc", "sp", [-1, 1]], ["tile_ry", "sp", [-1, 1]], ["tile_rx", "sp", [-1, 3]], ["auto_unroll_max_step", "ot", 1500], ["unroll_explicit", "ot", 0]]}, "result": [[0.0009668044800000001], 0, 7.085740089416504, 1690504424.1229172], "version": 0.2, "tvm_version": "0.13.dev0"}
{"input": ["opencl -keys=adreno,opencl,gpu -device=adreno -max_function_args=128 -max_num_threads=256 -max_shared_memory_per_block=16384 -max_threads_per_block=256 -texture_spatial_limit=16384 -thread_warp_size=1", "conv2d_nchwc.image2d", [["TENSOR", [1, 32, 416, 416], "float32"], ["TENSOR", [64, 32, 3, 3], "float32"], [2, 2], [1, 1, 0, 0], [1, 1], "float32"], {}], "config": {"index": 46708, "code_hash": null, "entity": [["tile_fc", "sp", [-1, 2, 8]], ["tile_y", "sp", [-1, 1, 4]], ["tile_x", "sp", [-1, 8, 2]], ["tile_rcc", "sp", [-1, 4]], ["tile_ry", "sp", [-1, 3]], ["tile_rx", "sp", [-1, 3]], ["auto_unroll_max_step", "ot", 0], ["unroll_explicit", "ot", 0]]}, "result": [[0.00344335872], 0, 67.38153100013733, 1690512105.406295], "version": 0.2, "tvm_version": "0.13.dev0"}
{"input": ["opencl -keys=adreno,opencl,gpu -device=adreno -max_function_args=128 -max_num_threads=256 -max_shared_memory_per_block=16384 -max_threads_per_block=256 -texture_spatial_limit=16384 -thread_warp_size=1", "conv2d_nchwc.image2d", [["TENSOR", [1, 64, 208, 208], "float32"], ["TENSOR", [32, 64, 1, 1], "float32"], [1, 1], [0, 0, 0, 0], [1, 1], "float32"], {}], "config": {"index": 23237, "code_hash": null, "entity": [["tile_fc", "sp", [-1, 1, 8]], ["tile_y", "sp", [-1, 4, 1]], ["tile_x", "sp", [-1, 1, 16]], ["tile_rcc", "sp", [-1, 2]], ["tile_ry", "sp", [-1, 1]], ["tile_rx", "sp", [-1, 1]], ["auto_unroll_max_step", "ot", 1500], ["unroll_explicit", "ot", 0]]}, "result": [[0.0010171392], 0, 69.91663408279419, 1690514187.714591], "version": 0.2, "tvm_version": "0.13.dev0"}
{"input": ["opencl -keys=adreno,opencl,gpu -device=adreno -max_function_args=128 -max_num_threads=256 -max_shared_memory_per_block=16384 -max_threads_per_block=256 -texture_spatial_limit=16384 -thread_warp_size=1", "conv2d_nchwc.image2d", [["TENSOR", [1, 32, 208, 208], "float32"], ["TENSOR", [64, 32, 3, 3], "float32"], [1, 1], [1, 1, 1, 1], [1, 1], "float32"], {}], "config": {"index": 44308, "code_hash": null, "entity": [["tile_fc", "sp", [-1, 2, 8]], ["tile_y", "sp", [-1, 4, 1]], ["tile_x", "sp", [-1, 2, 8]], ["tile_rcc", "sp", [-1, 2]], ["tile_ry", "sp", [-1, 3]], ["tile_rx", "sp", [-1, 3]], ["auto_unroll_max_step", "ot", 0], ["unroll_explicit", "ot", 0]]}, "result": [[0.00238115328], 0, 43.60479211807251, 1690522025.3913522], "version": 0.2, "tvm_version": "0.13.dev0"}
{"input": ["opencl -keys=adreno,opencl,gpu -device=adreno -max_function_args=128 -max_num_threads=256 -max_shared_memory_per_block=16384 -max_threads_per_block=256 -texture_spatial_limit=16384 -thread_warp_size=1", "conv2d_nchwc.image2d", [["TENSOR", [1, 64, 208, 208], "float32"], ["TENSOR", [128, 64, 3, 3], "float32"], [2, 2], [1, 1, 0, 0], [1, 1], "float32"], {}], "config": {"index": 163714, "code_hash": null, "entity": [["tile_fc", "sp", [-1, 2, 16]], ["tile_y", "sp", [-1, 8, 1]], ["tile_x", "sp", [-1, 1, 8]], ["tile_rcc", "sp", [-1, 16]], ["tile_ry", "sp", [-1, 3]], ["tile_rx", "sp", [-1, 3]], ["auto_unroll_max_step", "ot", 1500], ["unroll_explicit", "ot", 0]]}, "result": [[0.00280019968], 0, 66.05893087387085, 1690526809.3885179], "version": 0.2, "tvm_version": "0.13.dev0"}
{"input": ["opencl -keys=adreno,opencl,gpu -device=adreno -max_function_args=128 -max_num_threads=256 -max_shared_memory_per_block=16384 -max_threads_per_block=256 -texture_spatial_limit=16384 -thread_warp_size=1", "conv2d_nchwc.image2d", [["TENSOR", [1, 128, 104, 104], "float32"], ["TENSOR", [64, 128, 1, 1], "float32"], [1, 1], [0, 0, 0, 0], [1, 1], "float32"], {}], "config": {"index": 20788, "code_hash": null, "entity": [["tile_fc", "sp", [-1, 2, 8]], ["tile_y", "sp", [-1, 4, 2]], ["tile_x", "sp", [-1, 2, 4]], ["tile_rcc", "sp", [-1, 16]], ["tile_ry", "sp", [-1, 1]], ["tile_rx", "sp", [-1, 1]], ["auto_unroll_max_step", "ot", 512], ["unroll_explicit", "ot", 0]]}, "result": [[0.0006497791999999999], 0, 14.802577018737793, 1690532721.836989], "version": 0.2, "tvm_version": "0.13.dev0"}
{"input": ["opencl -keys=adreno,opencl,gpu -device=adreno -max_function_args=128 -max_num_threads=256 -max_shared_memory_per_block=16384 -max_threads_per_block=256 -texture_spatial_limit=16384 -thread_warp_size=1", "conv2d_nchwc.image2d", [["TENSOR", [1, 64, 104, 104], "float32"], ["TENSOR", [128, 64, 3, 3], "float32"], [1, 1], [1, 1, 1, 1], [1, 1], "float32"], {}], "config": {"index": 17190, "code_hash": null, "entity": [["tile_fc", "sp", [-1, 2, 16]], ["tile_y", "sp", [-1, 1, 8]], ["tile_x", "sp", [-1, 8, 1]], ["tile_rcc", "sp", [-1, 2]], ["tile_ry", "sp", [-1, 3]], ["tile_rx", "sp", [-1, 1]], ["auto_unroll_max_step", "ot", 0], ["unroll_explicit", "ot", 0]]}, "result": [[0.00230388224], 0, 71.52445602416992, 1690538673.585098], "version": 0.2, "tvm_version": "0.13.dev0"}
{"input": ["opencl -keys=adreno,opencl,gpu -device=adreno -max_function_args=128 -max_num_threads=256 -max_shared_memory_per_block=16384 -max_threads_per_block=256 -texture_spatial_limit=16384 -thread_warp_size=1", "conv2d_nchwc.image2d", [["TENSOR", [1, 128, 104, 104], "float32"], ["TENSOR", [256, 128, 3, 3], "float32"], [2, 2], [1, 1, 0, 0], [1, 1], "float32"], {}], "config": {"index": 53674, "code_hash": null, "entity": [["tile_fc", "sp", [-1, 2, 32]], ["tile_y", "sp", [-1, 4, 1]], ["tile_x", "sp", [-1, 2, 13]], ["tile_rcc", "sp", [-1, 1]], ["tile_ry", "sp", [-1, 1]], ["tile_rx", "sp", [-1, 3]], ["auto_unroll_max_step", "ot", 512], ["unroll_explicit", "ot", 0]]}, "result": [[0.003381248], 0, 72.11251401901245, 1690543420.674318], "version": 0.2, "tvm_version": "0.13.dev0"}
{"input": ["opencl -keys=adreno,opencl,gpu -device=adreno -max_function_args=128 -max_num_threads=256 -max_shared_memory_per_block=16384 -max_threads_per_block=256 -texture_spatial_limit=16384 -thread_warp_size=1", "conv2d_nchwc.image2d", [["TENSOR", [1, 256, 52, 52], "float32"], ["TENSOR", [128, 256, 1, 1], "float32"], [1, 1], [0, 0, 0, 0], [1, 1], "float32"], {}], "config": {"index": 21905, "code_hash": null, "entity": [["tile_fc", "sp", [-1, 2, 8]], ["tile_y", "sp", [-1, 2, 13]], ["tile_x", "sp", [-1, 4, 1]], ["tile_rcc", "sp", [-1, 32]], ["tile_ry", "sp", [-1, 1]], ["tile_rx", "sp", [-1, 1]], ["auto_unroll_max_step", "ot", 1500], ["unroll_explicit", "ot", 0]]}, "result": [[0.0006062336000000001], 0, 14.144606828689575, 1690548321.011746], "version": 0.2, "tvm_version": "0.13.dev0"}
{"input": ["opencl -keys=adreno,opencl,gpu -device=adreno -max_function_args=128 -max_num_threads=256 -max_shared_memory_per_block=16384 -max_threads_per_block=256 -texture_spatial_limit=16384 -thread_warp_size=1", "conv2d_nchwc.image2d", [["TENSOR", [1, 128, 52, 52], "float32"], ["TENSOR", [256, 128, 3, 3], "float32"], [1, 1], [1, 1, 1, 1], [1, 1], "float32"], {}], "config": {"index": 45069, "code_hash": null, "entity": [["tile_fc", "sp", [-1, 1, 32]], ["tile_y", "sp", [-1, 2, 1]], ["tile_x", "sp", [-1, 4, 13]], ["tile_rcc", "sp", [-1, 1]], ["tile_ry", "sp", [-1, 3]], ["tile_rx", "sp", [-1, 1]], ["auto_unroll_max_step", "ot", 512], ["unroll_explicit", "ot", 0]]}, "result": [[0.0026471424000000005], 0, 42.7782723903656, 1690554088.838741], "version": 0.2, "tvm_version": "0.13.dev0"}
{"input": ["opencl -keys=adreno,opencl,gpu -device=adreno -max_function_args=128 -max_num_threads=256 -max_shared_memory_per_block=16384 -max_threads_per_block=256 -texture_spatial_limit=16384 -thread_warp_size=1", "conv2d_nchw_winograd.image2d", [["TENSOR", [1, 128, 52, 52], "float32"], ["TENSOR", [256, 128, 3, 3], "float32"], [1, 1], [1, 1, 1, 1], [1, 1], "float32"], {}], "config": {"index": 3072, "code_hash": null, "entity": [["auto_unroll_max_step", "ot", 0], ["tile_y", "sp", [-1, 1, 64]], ["tile_x", "sp", [-1, 4, 1]], ["tile_rc", "sp", [-1, 32]]]}, "result": [[0.0031269990400000004], 0, 62.18325734138489, 1690557511.017538], "version": 0.2, "tvm_version": "0.13.dev0"}
{"input": ["opencl -keys=adreno,opencl,gpu -device=adreno -max_function_args=128 -max_num_threads=256 -max_shared_memory_per_block=16384 -max_threads_per_block=256 -texture_spatial_limit=16384 -thread_warp_size=1", "conv2d_nchwc.image2d", [["TENSOR", [1, 256, 52, 52], "float32"], ["TENSOR", [512, 256, 3, 3], "float32"], [2, 2], [1, 1, 0, 0], [1, 1], "float32"], {}], "config": {"index": 31389, "code_hash": null, "entity": [["tile_fc", "sp", [-1, 2, 32]], ["tile_y", "sp", [-1, 1, 14]], ["tile_x", "sp", [-1, 7, 1]], ["tile_rcc", "sp", [-1, 1]], ["tile_ry", "sp", [-1, 3]], ["tile_rx", "sp", [-1, 1]], ["auto_unroll_max_step", "ot", 0], ["unroll_explicit", "ot", 0]]}, "result": [[0.00304577536], 0, 7.796635150909424, 1690566035.70511], "version": 0.2, "tvm_version": "0.13.dev0"}
{"input": ["opencl -keys=adreno,opencl,gpu -device=adreno -max_function_args=128 -max_num_threads=256 -max_shared_memory_per_block=16384 -max_threads_per_block=256 -texture_spatial_limit=16384 -thread_warp_size=1", "conv2d_nchwc.image2d", [["TENSOR", [1, 512, 26, 26], "float32"], ["TENSOR", [256, 512, 1, 1], "float32"], [1, 1], [0, 0, 0, 0], [1, 1], "float32"], {}], "config": {"index": 22297, "code_hash": null, "entity": [["tile_fc", "sp", [-1, 2, 16]], ["tile_y", "sp", [-1, 7, 2]], ["tile_x", "sp", [-1, 1, 2]], ["tile_rcc", "sp", [-1, 64]], ["tile_ry", "sp", [-1, 1]], ["tile_rx", "sp", [-1, 1]], ["auto_unroll_max_step", "ot", 0], ["unroll_explicit", "ot", 0]]}, "result": [[0.00039231488], 0, 62.29633164405823, 1690571802.978019], "version": 0.2, "tvm_version": "0.13.dev0"}
{"input": ["opencl -keys=adreno,opencl,gpu -device=adreno -max_function_args=128 -max_num_threads=256 -max_shared_memory_per_block=16384 -max_threads_per_block=256 -texture_spatial_limit=16384 -thread_warp_size=1", "conv2d_nchwc.image2d", [["TENSOR", [1, 256, 26, 26], "float32"], ["TENSOR", [512, 256, 3, 3], "float32"], [1, 1], [1, 1, 1, 1], [1, 1], "float32"], {}], "config": {"index": 62994, "code_hash": null, "entity": [["tile_fc", "sp", [-1, 1, 8]], ["tile_y", "sp", [-1, 1, 4]], ["tile_x", "sp", [-1, 7, 4]], ["tile_rcc", "sp", [-1, 1]], ["tile_ry", "sp", [-1, 1]], ["tile_rx", "sp", [-1, 3]], ["auto_unroll_max_step", "ot", 0], ["unroll_explicit", "ot", 0]]}, "result": [[0.0026364416], 0, 23.647432804107666, 1690575186.73526], "version": 0.2, "tvm_version": "0.13.dev0"}
{"input": ["opencl -keys=adreno,opencl,gpu -device=adreno -max_function_args=128 -max_num_threads=256 -max_shared_memory_per_block=16384 -max_threads_per_block=256 -texture_spatial_limit=16384 -thread_warp_size=1", "conv2d_nchw_winograd.image2d", [["TENSOR", [1, 256, 26, 26], "float32"], ["TENSOR", [512, 256, 3, 3], "float32"], [1, 1], [1, 1, 1, 1], [1, 1], "float32"], {}], "config": {"index": 2257, "code_hash": null, "entity": [["auto_unroll_max_step", "ot", 4], ["tile_y", "sp", [-1, 1, 64]], ["tile_x", "sp", [-1, 13, 1]], ["tile_rc", "sp", [-1, 64]]]}, "result": [[0.00309674496], 0, 52.16355895996094, 1690582450.9915469], "version": 0.2, "tvm_version": "0.13.dev0"}
{"input": ["opencl -keys=adreno,opencl,gpu -device=adreno -max_function_args=128 -max_num_threads=256 -max_shared_memory_per_block=16384 -max_threads_per_block=256 -texture_spatial_limit=16384 -thread_warp_size=1", "conv2d_nchwc.image2d", [["TENSOR", [1, 512, 26, 26], "float32"], ["TENSOR", [1024, 512, 3, 3], "float32"], [2, 2], [1, 1, 0, 0], [1, 1], "float32"], {}], "config": {"index": 355791, "code_hash": null, "entity": [["tile_fc", "sp", [-1, 1, 32]], ["tile_y", "sp", [-1, 8, 2]], ["tile_x", "sp", [-1, 1, 4]], ["tile_rcc", "sp", [-1, 1]], ["tile_ry", "sp", [-1, 3]], ["tile_rx", "sp", [-1, 1]], ["auto_unroll_max_step", "ot", 1500], ["unroll_explicit", "ot", 0]]}, "result": [[0.00325700608], 0, 87.11975407600403, 1690589062.8006861], "version": 0.2, "tvm_version": "0.13.dev0"}
{"input": ["opencl -keys=adreno,opencl,gpu -device=adreno -max_function_args=128 -max_num_threads=256 -max_shared_memory_per_block=16384 -max_threads_per_block=256 -texture_spatial_limit=16384 -thread_warp_size=1", "conv2d_nchwc.image2d", [["TENSOR", [1, 1024, 13, 13], "float32"], ["TENSOR", [512, 1024, 1, 1], "float32"], [1, 1], [0, 0, 0, 0], [1, 1], "float32"], {}], "config": {"index": 72543, "code_hash": null, "entity": [["tile_fc", "sp", [-1, 2, 8]], ["tile_y", "sp", [-1, 8, 2]], ["tile_x", "sp", [-1, 1, 8]], ["tile_rcc", "sp", [-1, 128]], ["tile_ry", "sp", [-1, 1]], ["tile_rx", "sp", [-1, 1]], ["auto_unroll_max_step", "ot", 512], ["unroll_explicit", "ot", 0]]}, "result": [[0.00044862464000000005], 0, 14.508693933486938, 1690598651.426668], "version": 0.2, "tvm_version": "0.13.dev0"}
{"input": ["opencl -keys=adreno,opencl,gpu -device=adreno -max_function_args=128 -max_num_threads=256 -max_shared_memory_per_block=16384 -max_threads_per_block=256 -texture_spatial_limit=16384 -thread_warp_size=1", "conv2d_nchwc.image2d", [["TENSOR", [1, 512, 13, 13], "float32"], ["TENSOR", [1024, 512, 3, 3], "float32"], [1, 1], [1, 1, 1, 1], [1, 1], "float32"], {}], "config": {"index": 610384, "code_hash": null, "entity": [["tile_fc", "sp", [-1, 2, 8]], ["tile_y", "sp", [-1, 1, 16]], ["tile_x", "sp", [-1, 8, 2]], ["tile_rcc", "sp", [-1, 16]], ["tile_ry", "sp", [-1, 3]], ["tile_rx", "sp", [-1, 3]], ["auto_unroll_max_step", "ot", 0], ["unroll_explicit", "ot", 1]]}, "result": [[0.0033044172799999998], 0, 9.12758994102478, 1690608888.185184], "version": 0.2, "tvm_version": "0.13.dev0"}
{"input": ["opencl -keys=adreno,opencl,gpu -device=adreno -max_function_args=128 -max_num_threads=256 -max_shared_memory_per_block=16384 -max_threads_per_block=256 -texture_spatial_limit=16384 -thread_warp_size=1", "conv2d_nchw_winograd.image2d", [["TENSOR", [1, 512, 13, 13], "float32"], ["TENSOR", [1024, 512, 3, 3], "float32"], [1, 1], [1, 1, 1, 1], [1, 1], "float32"], {}], "config": {"index": 1624, "code_hash": null, "entity": [["auto_unroll_max_step", "ot", 4], ["tile_y", "sp", [-1, 1, 64]], ["tile_x", "sp", [-1, 7, 1]], ["tile_rc", "sp", [-1, 8]]]}, "result": [[0.00401268736], 0, 16.535113096237183, 1690610263.636968], "version": 0.2, "tvm_version": "0.13.dev0"}
{"input": ["opencl -keys=adreno,opencl,gpu -device=adreno -max_function_args=128 -max_num_threads=256 -max_shared_memory_per_block=16384 -max_threads_per_block=256 -texture_spatial_limit=16384 -thread_warp_size=1", "conv2d_nchwc.image2d", [["TENSOR", [1, 512, 13, 13], "float32"], ["TENSOR", [256, 512, 1, 1], "float32"], [1, 1], [0, 0, 0, 0], [1, 1], "float32"], {}], "config": {"index": 74227, "code_hash": null, "entity": [["tile_fc", "sp", [-1, 2, 16]], ["tile_y", "sp", [-1, 8, 2]], ["tile_x", "sp", [-1, 1, 1]], ["tile_rcc", "sp", [-1, 32]], ["tile_ry", "sp", [-1, 1]], ["tile_rx", "sp", [-1, 1]], ["auto_unroll_max_step", "ot", 1500], ["unroll_explicit", "ot", 0]]}, "result": [[0.00016873984], 0, 15.364300727844238, 1690615913.6174998], "version": 0.2, "tvm_version": "0.13.dev0"}
{"input": ["opencl -keys=adreno,opencl,gpu -device=adreno -max_function_args=128 -max_num_threads=256 -max_shared_memory_per_block=16384 -max_threads_per_block=256 -texture_spatial_limit=16384 -thread_warp_size=1", "conv2d_nchwc.image2d", [["TENSOR", [1, 768, 26, 26], "float32"], ["TENSOR", [256, 768, 1, 1], "float32"], [1, 1], [0, 0, 0, 0], [1, 1], "float32"], {}], "config": {"index": 36970, "code_hash": null, "entity": [["tile_fc", "sp", [-1, 2, 32]], ["tile_y", "sp", [-1, 1, 7]], ["tile_x", "sp", [-1, 7, 2]], ["tile_rcc", "sp", [-1, 48]], ["tile_ry", "sp", [-1, 1]], ["tile_rx", "sp", [-1, 1]], ["auto_unroll_max_step", "ot", 0], ["unroll_explicit", "ot", 0]]}, "result": [[0.00058591232], 0, 76.40829110145569, 1690621487.1020281], "version": 0.2, "tvm_version": "0.13.dev0"}
{"input": ["opencl -keys=adreno,opencl,gpu -device=adreno -max_function_args=128 -max_num_threads=256 -max_shared_memory_per_block=16384 -max_threads_per_block=256 -texture_spatial_limit=16384 -thread_warp_size=1", "conv2d_nchwc.image2d", [["TENSOR", [1, 256, 26, 26], "float32"], ["TENSOR", [128, 256, 1, 1], "float32"], [1, 1], [0, 0, 0, 0], [1, 1], "float32"], {}], "config": {"index": 35107, "code_hash": null, "entity": [["tile_fc", "sp", [-1, 2, 8]], ["tile_y", "sp", [-1, 2, 1]], ["tile_x", "sp", [-1, 4, 7]], ["tile_rcc", "sp", [-1, 32]], ["tile_ry", "sp", [-1, 1]], ["tile_rx", "sp", [-1, 1]], ["auto_unroll_max_step", "ot", 512], ["unroll_explicit", "ot", 0]]}, "result": [[0.00014014976], 0, 21.095643281936646, 1690628131.7152262], "version": 0.2, "tvm_version": "0.13.dev0"}
{"input": ["opencl -keys=adreno,opencl,gpu -device=adreno -max_function_args=128 -max_num_threads=256 -max_shared_memory_per_block=16384 -max_threads_per_block=256 -texture_spatial_limit=16384 -thread_warp_size=1", "conv2d_nchwc.image2d", [["TENSOR", [1, 384, 52, 52], "float32"], ["TENSOR", [128, 384, 1, 1], "float32"], [1, 1], [0, 0, 0, 0], [1, 1], "float32"], {}], "config": {"index": 22580, "code_hash": null, "entity": [["tile_fc", "sp", [-1, 2, 16]], ["tile_y", "sp", [-1, 2, 1]], ["tile_x", "sp", [-1, 4, 13]], ["tile_rcc", "sp", [-1, 16]], ["tile_ry", "sp", [-1, 1]], ["tile_rx", "sp", [-1, 1]], ["auto_unroll_max_step", "ot", 512], ["unroll_explicit", "ot", 0]]}, "result": [[0.0008935526400000001], 0, 24.156691074371338, 1690631711.464622], "version": 0.2, "tvm_version": "0.13.dev0"}
{"input": ["opencl -keys=adreno,opencl,gpu -device=adreno -max_function_args=128 -max_num_threads=256 -max_shared_memory_per_block=16384 -max_threads_per_block=256 -texture_spatial_limit=16384 -thread_warp_size=1", "conv2d_nchwc.image2d", [["TENSOR", [1, 256, 52, 52], "float32"], ["TENSOR", [255, 256, 3, 3], "float32"], [1, 1], [0, 0, 0, 0], [1, 1], "float32"], {}], "config": {"index": 103389, "code_hash": null, "entity": [["tile_fc", "sp", [-1, 1, 32]], ["tile_y", "sp", [-1, 2, 1]], ["tile_x", "sp", [-1, 4, 13]], ["tile_rcc", "sp", [-1, 1]], ["tile_ry", "sp", [-1, 1]], ["tile_rx", "sp", [-1, 3]], ["auto_unroll_max_step", "ot", 1500], ["unroll_explicit", "ot", 0]]}, "result": [[0.0049573785600000005], 0, 50.42989492416382, 1690635167.561766], "version": 0.2, "tvm_version": "0.13.dev0"}
{"input": ["opencl -keys=adreno,opencl,gpu -device=adreno -max_function_args=128 -max_num_threads=256 -max_shared_memory_per_block=16384 -max_threads_per_block=256 -texture_spatial_limit=16384 -thread_warp_size=1", "conv2d_nchw_winograd.image2d", [["TENSOR", [1, 256, 52, 52], "float32"], ["TENSOR", [255, 256, 3, 3], "float32"], [1, 1], [0, 0, 0, 0], [1, 1], "float32"], {}], "config": {"index": 2984, "code_hash": null, "entity": [["auto_unroll_max_step", "ot", 16], ["tile_y", "sp", [-1, 1, 16]], ["tile_x", "sp", [-1, 5, 5]], ["tile_rc", "sp", [-1, 64]]]}, "result": [[0.0082428928], 0, 37.08215117454529, 1690640190.431162], "version": 0.2, "tvm_version": "0.13.dev0"}
{"input": ["opencl -keys=adreno,opencl,gpu -device=adreno -max_function_args=128 -max_num_threads=256 -max_shared_memory_per_block=16384 -max_threads_per_block=256 -texture_spatial_limit=16384 -thread_warp_size=1", "conv2d_nchwc.image2d", [["TENSOR", [1, 512, 26, 26], "float32"], ["TENSOR", [255, 512, 3, 3], "float32"], [1, 1], [0, 0, 0, 0], [1, 1], "float32"], {}], "config": {"index": 497615, "code_hash": null, "entity": [["tile_fc", "sp", [-1, 2, 4]], ["tile_y", "sp", [-1, 2, 2]], ["tile_x", "sp", [-1, 3, 8]], ["tile_rcc", "sp", [-1, 1]], ["tile_ry", "sp", [-1, 3]], ["tile_rx", "sp", [-1, 1]], ["auto_unroll_max_step", "ot", 512], ["unroll_explicit", "ot", 0]]}, "result": [[0.0018803609599999998], 0, 64.11218452453613, 1690648223.607679], "version": 0.2, "tvm_version": "0.13.dev0"}
{"input": ["opencl -keys=adreno,opencl,gpu -device=adreno -max_function_args=128 -max_num_threads=256 -max_shared_memory_per_block=16384 -max_threads_per_block=256 -texture_spatial_limit=16384 -thread_warp_size=1", "conv2d_nchw_winograd.image2d", [["TENSOR", [1, 512, 26, 26], "float32"], ["TENSOR", [255, 512, 3, 3], "float32"], [1, 1], [0, 0, 0, 0], [1, 1], "float32"], {}], "config": {"index": 17988, "code_hash": null, "entity": [["auto_unroll_max_step", "ot", 0], ["tile_y", "sp", [-1, 4, 16]], ["tile_x", "sp", [-1, 6, 4]], ["tile_rc", "sp", [-1, 64]]]}, "result": [[0.0019487436799999998], 0, 15.87750792503357, 1690656292.635991], "version": 0.2, "tvm_version": "0.13.dev0"}
{"input": ["opencl -keys=adreno,opencl,gpu -device=adreno -max_function_args=128 -max_num_threads=256 -max_shared_memory_per_block=16384 -max_threads_per_block=256 -texture_spatial_limit=16384 -thread_warp_size=1", "conv2d_nchwc.image2d", [["TENSOR", [1, 1024, 13, 13], "float32"], ["TENSOR", [255, 1024, 1, 1], "float32"], [1, 1], [0, 0, 0, 0], [1, 1], "float32"], {}], "config": {"index": 23013, "code_hash": null, "entity": [["tile_fc", "sp", [-1, 2, 8]], ["tile_y", "sp", [-1, 1, 2]], ["tile_x", "sp", [-1, 8, 2]], ["tile_rcc", "sp", [-1, 64]], ["tile_ry", "sp", [-1, 1]], ["tile_rx", "sp", [-1, 1]], ["auto_unroll_max_step", "ot", 0], ["unroll_explicit", "ot", 0]]}, "result": [[0.00032522751999999996], 0, 15.912687063217163, 1690658895.1638908], "version": 0.2, "tvm_version": "0.13.dev0"}
{"input": ["opencl -keys=adreno,opencl,gpu -device=adreno -max_function_args=128 -max_num_threads=256 -max_shared_memory_per_block=16384 -max_threads_per_block=256 -texture_spatial_limit=16384 -thread_warp_size=1", "conv2d_nchwc.image2d", [["TENSOR", [1, 64, 300, 300], "float32"], ["TENSOR", [64, 64, 3, 3], "float32"], [1, 1], [1, 1, 1, 1], [1, 1], "float32"], {}], "config": {"index": 865288, "code_hash": null, "entity": [["tile_fc", "sp", [-1, 2, 8]], ["tile_y", "sp", [-1, 3, 1]], ["tile_x", "sp", [-1, 2, 15]], ["tile_rcc", "sp", [-1, 16]], ["tile_ry", "sp", [-1, 3]], ["tile_rx", "sp", [-1, 3]], ["auto_unroll_max_step", "ot", 1500], ["unroll_explicit", "ot", 0]]}, "result": [[0.00987806208], 0, 5.280776023864746, 1684181830.4700894], "version": 0.2, "tvm_version": "0.13.dev0"}
{"input": ["opencl -keys=adreno,opencl,gpu -device=adreno -max_function_args=128 -max_num_threads=256 -max_shared_memory_per_block=16384 -max_threads_per_block=256 -texture_spatial_limit=16384 -thread_warp_size=1", "conv2d_nchwc.image2d", [["TENSOR", [1, 64, 300, 300], "float32"], ["TENSOR", [128, 64, 3, 3], "float32"], [2, 2], [1, 1, 1, 1], [1, 1], "float32"], {}], "config": {"index": 25758, "code_hash": null, "entity": [["tile_fc", "sp", [-1, 2, 16]], ["tile_y", "sp", [-1, 1, 8]], ["tile_x", "sp", [-1, 8, 1]], ["tile_rcc", "sp", [-1, 8]], ["tile_ry", "sp", [-1, 3]], ["tile_rx", "sp", [-1, 3]], ["auto_unroll_max_step", "ot", 0], ["unroll_explicit", "ot", 0]]}, "result": [[0.00586584064], 0, 1.854830265045166, 1684195468.8979385], "version": 0.2, "tvm_version": "0.13.dev0"}
{"input": ["opencl -keys=adreno,opencl,gpu -device=adreno -max_function_args=128 -max_num_threads=256 -max_shared_memory_per_block=16384 -max_threads_per_block=256 -texture_spatial_limit=16384 -thread_warp_size=1", "conv2d_nchwc.image2d", [["TENSOR", [1, 64, 300, 300], "float32"], ["TENSOR", [128, 64, 1, 1], "float32"], [2, 2], [0, 0, 0, 0], [1, 1], "float32"], {}], "config": {"index": 4114, "code_hash": null, "entity": [["tile_fc", "sp", [-1, 2, 16]], ["tile_y", "sp", [-1, 8, 1]], ["tile_x", "sp", [-1, 1, 8]], ["tile_rcc", "sp", [-1, 4]], ["tile_ry", "sp", [-1, 1]], ["tile_rx", "sp", [-1, 1]], ["auto_unroll_max_step", "ot", 0], ["unroll_explicit", "ot", 0]]}, "result": [[0.0020238643200000002], 0, 2.70393967628479, 1684196171.63003], "version": 0.2, "tvm_version": "0.13.dev0"}
{"input": ["opencl -keys=adreno,opencl,gpu -device=adreno -max_function_args=128 -max_num_threads=256 -max_shared_memory_per_block=16384 -max_threads_per_block=256 -texture_spatial_limit=16384 -thread_warp_size=1", "conv2d_nchwc.image2d", [["TENSOR", [1, 128, 150, 150], "float32"], ["TENSOR", [128, 128, 3, 3], "float32"], [1, 1], [1, 1, 1, 1], [1, 1], "float32"], {}], "config": {"index": 99216, "code_hash": null, "entity": [["tile_fc", "sp", [-1, 2, 16]], ["tile_y", "sp", [-1, 4, 2]], ["tile_x", "sp", [-1, 2, 4]], ["tile_rcc", "sp", [-1, 16]], ["tile_ry", "sp", [-1, 3]], ["tile_rx", "sp", [-1, 3]], ["auto_unroll_max_step", "ot", 1500], ["unroll_explicit", "ot", 0]]}, "result": [[0.01003074048], 0, 5.03373646736145, 1684199365.9550261], "version": 0.2, "tvm_version": "0.13.dev0"}
{"input": ["opencl -keys=adreno,opencl,gpu -device=adreno -max_function_args=128 -max_num_threads=256 -max_shared_memory_per_block=16384 -max_threads_per_block=256 -texture_spatial_limit=16384 -thread_warp_size=1", "conv2d_nchw_winograd.image2d", [["TENSOR", [1, 128, 150, 150], "float32"], ["TENSOR", [128, 128, 3, 3], "float32"], [1, 1], [1, 1, 1, 1], [1, 1], "float32"], {}], "config": {"index": 3955, "code_hash": null, "entity": [["auto_unroll_max_step", "ot", 4], ["tile_y", "sp", [-1, 2, 16]], ["tile_x", "sp", [-1, 5, 3]], ["tile_rc", "sp", [-1, 8]]]}, "result": [[0.01292796928], 0, 6.980728387832642, 1684207617.8325047], "version": 0.2, "tvm_version": "0.13.dev0"}
{"input": ["opencl -keys=adreno,opencl,gpu -device=adreno -max_function_args=128 -max_num_threads=256 -max_shared_memory_per_block=16384 -max_threads_per_block=256 -texture_spatial_limit=16384 -thread_warp_size=1", "conv2d_nchwc.image2d", [["TENSOR", [1, 128, 150, 150], "float32"], ["TENSOR", [256, 128, 1, 1], "float32"], [1, 1], [0, 0, 0, 0], [1, 1], "float32"], {}], "config": {"index": 41161, "code_hash": null, "entity": [["tile_fc", "sp", [-1, 2, 16]], ["tile_y", "sp", [-1, 4, 2]], ["tile_x", "sp", [-1, 2, 4]], ["tile_rcc", "sp", [-1, 16]], ["tile_ry", "sp", [-1, 1]], ["tile_rx", "sp", [-1, 1]], ["auto_unroll_max_step", "ot", 0], ["unroll_explicit", "ot", 1]]}, "result": [[0.0033765888], 0, 1.5980279445648193, 1684217656.8560536], "version": 0.2, "tvm_version": "0.13.dev0"}
{"input": ["opencl -keys=adreno,opencl,gpu -device=adreno -max_function_args=128 -max_num_threads=256 -max_shared_memory_per_block=16384 -max_threads_per_block=256 -texture_spatial_limit=16384 -thread_warp_size=1", "conv2d_nchwc.image2d", [["TENSOR", [1, 256, 150, 150], "float32"], ["TENSOR", [16, 256, 3, 3], "float32"], [3, 3], [1, 1, 1, 1], [1, 1], "float32"], {}], "config": {"index": 18908, "code_hash": null, "entity": [["tile_fc", "sp", [-1, 1, 4]], ["tile_y", "sp", [-1, 4, 1]], ["tile_x", "sp", [-1, 2, 13]], ["tile_rcc", "sp", [-1, 1]], ["tile_ry", "sp", [-1, 3]], ["tile_rx", "sp", [-1, 3]], ["auto_unroll_max_step", "ot", 1500], ["unroll_explicit", "ot", 0]]}, "result": [[0.0019105536000000002], 0, 2.4233062267303467, 1684235577.0330055], "version": 0.2, "tvm_version": "0.13.dev0"}
{"input": ["opencl -keys=adreno,opencl,gpu -device=adreno -max_function_args=128 -max_num_threads=256 -max_shared_memory_per_block=16384 -max_threads_per_block=256 -texture_spatial_limit=16384 -thread_warp_size=1", "conv2d_nchwc.image2d", [["TENSOR", [1, 256, 150, 150], "float32"], ["TENSOR", [256, 256, 1, 1], "float32"], [1, 1], [0, 0, 0, 0], [1, 1], "float32"], {}], "config": {"index": 35440, "code_hash": null, "entity": [["tile_fc", "sp", [-1, 2, 32]], ["tile_y", "sp", [-1, 2, 4]], ["tile_x", "sp", [-1, 4, 2]], ["tile_rcc", "sp", [-1, 32]], ["tile_ry", "sp", [-1, 1]], ["tile_rx", "sp", [-1, 1]], ["auto_unroll_max_step", "ot", 1500], ["unroll_explicit", "ot", 0]]}, "result": [[0.00618051584], 0, 1.8938014507293701, 1684237496.3451462], "version": 0.2, "tvm_version": "0.13.dev0"}
{"input": ["opencl -keys=adreno,opencl,gpu -device=adreno -max_function_args=128 -max_num_threads=256 -max_shared_memory_per_block=16384 -max_threads_per_block=256 -texture_spatial_limit=16384 -thread_warp_size=1", "conv2d_nchwc.image2d", [["TENSOR", [1, 256, 150, 150], "float32"], ["TENSOR", [512, 256, 3, 3], "float32"], [2, 2], [1, 1, 1, 1], [1, 1], "float32"], {}], "config": {"index": 43492, "code_hash": null, "entity": [["tile_fc", "sp", [-1, 2, 64]], ["tile_y", "sp", [-1, 4, 1]], ["tile_x", "sp", [-1, 1, 4]], ["tile_rcc", "sp", [-1, 32]], ["tile_ry", "sp", [-1, 3]], ["tile_rx", "sp", [-1, 3]], ["auto_unroll_max_step", "ot", 512], ["unroll_explicit", "ot", 0]]}, "result": [[0.03088216064], 0, 5.522909641265869, 1684241001.0767434], "version": 0.2, "tvm_version": "0.13.dev0"}
{"input": ["opencl -keys=adreno,opencl,gpu -device=adreno -max_function_args=128 -max_num_threads=256 -max_shared_memory_per_block=16384 -max_threads_per_block=256 -texture_spatial_limit=16384 -thread_warp_size=1", "conv2d_nchwc.image2d", [["TENSOR", [1, 512, 75, 75], "float32"], ["TENSOR", [24, 512, 3, 3], "float32"], [3, 3], [1, 1, 1, 1], [1, 1], "float32"], {}], "config": {"index": 103583, "code_hash": null, "entity": [["tile_fc", "sp", [-1, 2, 3]], ["tile_y", "sp", [-1, 2, 7]], ["tile_x", "sp", [-1, 1, 7]], ["tile_rcc", "sp", [-1, 2]], ["tile_ry", "sp", [-1, 3]], ["tile_rx", "sp", [-1, 1]], ["auto_unroll_max_step", "ot", 0], ["unroll_explicit", "ot", 1]]}, "result": [[0.0014733312], 0, 2.6573996543884277, 1684243191.184764], "version": 0.2, "tvm_version": "0.13.dev0"}
{"input": ["opencl -keys=adreno,opencl,gpu -device=adreno -max_function_args=128 -max_num_threads=256 -max_shared_memory_per_block=16384 -max_threads_per_block=256 -texture_spatial_limit=16384 -thread_warp_size=1", "conv2d_nchwc.image2d", [["TENSOR", [1, 512, 75, 75], "float32"], ["TENSOR", [256, 512, 1, 1], "float32"], [1, 1], [0, 0, 0, 0], [1, 1], "float32"], {}], "config": {"index": 5021, "code_hash": null, "entity": [["tile_fc", "sp", [-1, 1, 64]], ["tile_y", "sp", [-1, 4, 1]], ["tile_x", "sp", [-1, 2, 2]], ["tile_rcc", "sp", [-1, 128]], ["tile_ry", "sp", [-1, 1]], ["tile_rx", "sp", [-1, 1]], ["auto_unroll_max_step", "ot", 0], ["unroll_explicit", "ot", 0]]}, "result": [[0.00424247808], 0, 3.2777531147003174, 1684246959.2365003], "version": 0.2, "tvm_version": "0.13.dev0"}
{"input": ["opencl -keys=adreno,opencl,gpu -device=adreno -max_function_args=128 -max_num_threads=256 -max_shared_memory_per_block=16384 -max_threads_per_block=256 -texture_spatial_limit=16384 -thread_warp_size=1", "conv2d_nchwc.image2d", [["TENSOR", [1, 256, 75, 75], "float32"], ["TENSOR", [512, 256, 3, 3], "float32"], [2, 2], [1, 1, 1, 1], [1, 1], "float32"], {}], "config": {"index": 820195, "code_hash": null, "entity": [["tile_fc", "sp", [-1, 2, 16]], ["tile_y", "sp", [-1, 2, 2]], ["tile_x", "sp", [-1, 5, 4]], ["tile_rcc", "sp", [-1, 1]], ["tile_ry", "sp", [-1, 1]], ["tile_rx", "sp", [-1, 1]], ["auto_unroll_max_step", "ot", 0], ["unroll_explicit", "ot", 1]]}, "result": [[0.005149824], 0, 1.6763737201690674, 1684251741.6734095], "version": 0.2, "tvm_version": "0.13.dev0"}
{"input": ["opencl -keys=adreno,opencl,gpu -device=adreno -max_function_args=128 -max_num_threads=256 -max_shared_memory_per_block=16384 -max_threads_per_block=256 -texture_spatial_limit=16384 -thread_warp_size=1", "conv2d_nchwc.image2d", [["TENSOR", [1, 512, 38, 38], "float32"], ["TENSOR", [24, 512, 3, 3], "float32"], [3, 3], [1, 1, 1, 1], [1, 1], "float32"], {}], "config": {"index": 150730, "code_hash": null, "entity": [["tile_fc", "sp", [-1, 1, 2]], ["tile_y", "sp", [-1, 1, 2]], ["tile_x", "sp", [-1, 1, 8]], ["tile_rcc", "sp", [-1, 2]], ["tile_ry", "sp", [-1, 3]], ["tile_rx", "sp", [-1, 3]], ["auto_unroll_max_step", "ot", 512], ["unroll_explicit", "ot", 1]]}, "result": [[0.00064366592], 0, 1.965207576751709, 1684255689.172328], "version": 0.2, "tvm_version": "0.13.dev0"}
{"input": ["opencl -keys=adreno,opencl,gpu -device=adreno -max_function_args=128 -max_num_threads=256 -max_shared_memory_per_block=16384 -max_threads_per_block=256 -texture_spatial_limit=16384 -thread_warp_size=1", "conv2d_nchwc.image2d", [["TENSOR", [1, 512, 38, 38], "float32"], ["TENSOR", [128, 512, 1, 1], "float32"], [1, 1], [0, 0, 0, 0], [1, 1], "float32"], {}], "config": {"index": 281860, "code_hash": null, "entity": [["tile_fc", "sp", [-1, 2, 16]], ["tile_y", "sp", [-1, 4, 5]], ["tile_x", "sp", [-1, 2, 5]], ["tile_rcc", "sp", [-1, 32]], ["tile_ry", "sp", [-1, 1]], ["tile_rx", "sp", [-1, 1]], ["auto_unroll_max_step", "ot", 1500], ["unroll_explicit", "ot", 1]]}, "result": [[0.00058553344], 0, 1.901287317276001, 1684258446.4607968], "version": 0.2, "tvm_version": "0.13.dev0"}
{"input": ["opencl -keys=adreno,opencl,gpu -device=adreno -max_function_args=128 -max_num_threads=256 -max_shared_memory_per_block=16384 -max_threads_per_block=256 -texture_spatial_limit=16384 -thread_warp_size=1", "conv2d_nchwc.image2d", [["TENSOR", [1, 128, 38, 38], "float32"], ["TENSOR", [256, 128, 3, 3], "float32"], [2, 2], [1, 1, 1, 1], [1, 1], "float32"], {}], "config": {"index": 192216, "code_hash": null, "entity": [["tile_fc", "sp", [-1, 1, 16]], ["tile_y", "sp", [-1, 2, 5]], ["tile_x", "sp", [-1, 5, 2]], ["tile_rcc", "sp", [-1, 1]], ["tile_ry", "sp", [-1, 3]], ["tile_rx", "sp", [-1, 1]], ["auto_unroll_max_step", "ot", 1500], ["unroll_explicit", "ot", 0]]}, "result": [[0.00042054656000000003], 0, 1.7521088123321533, 1684260959.4610672], "version": 0.2, "tvm_version": "0.13.dev0"}
{"input": ["opencl -keys=adreno,opencl,gpu -device=adreno -max_function_args=128 -max_num_threads=256 -max_shared_memory_per_block=16384 -max_threads_per_block=256 -texture_spatial_limit=16384 -thread_warp_size=1", "conv2d_nchwc.image2d", [["TENSOR", [1, 256, 19, 19], "float32"], ["TENSOR", [24, 256, 3, 3], "float32"], [3, 3], [1, 1, 1, 1], [1, 1], "float32"], {}], "config": {"index": 74385, "code_hash": null, "entity": [["tile_fc", "sp", [-1, 1, 2]], ["tile_y", "sp", [-1, 1, 4]], ["tile_x", "sp", [-1, 1, 4]], ["tile_rcc", "sp", [-1, 2]], ["tile_ry", "sp", [-1, 3]], ["tile_rx", "sp", [-1, 1]], ["auto_unroll_max_step", "ot", 1500], ["unroll_explicit", "ot", 1]]}, "result": [[0.00018680319999999997], 0, 0.9106874465942383, 1684263331.8220232], "version": 0.2, "tvm_version": "0.13.dev0"}
{"input": ["opencl -keys=adreno,opencl,gpu -device=adreno -max_function_args=128 -max_num_threads=256 -max_shared_memory_per_block=16384 -max_threads_per_block=256 -texture_spatial_limit=16384 -thread_warp_size=1", "conv2d_nchwc.image2d", [["TENSOR", [1, 256, 19, 19], "float32"], ["TENSOR", [128, 256, 1, 1], "float32"], [1, 1], [0, 0, 0, 0], [1, 1], "float32"], {}], "config": {"index": 43670, "code_hash": null, "entity": [["tile_fc", "sp", [-1, 1, 4]], ["tile_y", "sp", [-1, 4, 5]], ["tile_x", "sp", [-1, 1, 10]], ["tile_rcc", "sp", [-1, 2]], ["tile_ry", "sp", [-1, 1]], ["tile_rx", "sp", [-1, 1]], ["auto_unroll_max_step", "ot", 1500], ["unroll_explicit", "ot", 0]]}, "result": [[0.0001035776], 0, 0.7712736129760742, 1684264988.6513324], "version": 0.2, "tvm_version": "0.13.dev0"}
{"input": ["opencl -keys=adreno,opencl,gpu -device=adreno -max_function_args=128 -max_num_threads=256 -max_shared_memory_per_block=16384 -max_threads_per_block=256 -texture_spatial_limit=16384 -thread_warp_size=1", "conv2d_nchwc.image2d", [["TENSOR", [1, 128, 19, 19], "float32"], ["TENSOR", [256, 128, 3, 3], "float32"], [2, 2], [0, 0, 0, 0], [1, 1], "float32"], {}], "config": {"index": 117116, "code_hash": null, "entity": [["tile_fc", "sp", [-1, 1, 8]], ["tile_y", "sp", [-1, 1, 4]], ["tile_x", "sp", [-1, 6, 2]], ["tile_rcc", "sp", [-1, 16]], ["tile_ry", "sp", [-1, 3]], ["tile_rx", "sp", [-1, 3]], ["auto_unroll_max_step", "ot", 0], ["unroll_explicit", "ot", 0]]}, "result": [[0.00021425664], 0, 1.8675041198730469, 1684268663.7422426], "version": 0.2, "tvm_version": "0.13.dev0"}
{"input": ["opencl -keys=adreno,opencl,gpu -device=adreno -max_function_args=128 -max_num_threads=256 -max_shared_memory_per_block=16384 -max_threads_per_block=256 -texture_spatial_limit=16384 -thread_warp_size=1", "conv2d_nchwc.image2d", [["TENSOR", [1, 256, 9, 9], "float32"], ["TENSOR", [16, 256, 3, 3], "float32"], [3, 3], [1, 1, 1, 1], [1, 1], "float32"], {}], "config": {"index": 13031, "code_hash": null, "entity": [["tile_fc", "sp", [-1, 1, 4]], ["tile_y", "sp", [-1, 1, 4]], ["tile_x", "sp", [-1, 1, 2]], ["tile_rcc", "sp", [-1, 2]], ["tile_ry", "sp", [-1, 3]], ["tile_rx", "sp", [-1, 1]], ["auto_unroll_max_step", "ot", 512], ["unroll_explicit", "ot", 1]]}, "result": [[0.00017091072], 0, 1.678528070449829, 1684269446.6719372], "version": 0.2, "tvm_version": "0.13.dev0"}
{"input": ["opencl -keys=adreno,opencl,gpu -device=adreno -max_function_args=128 -max_num_threads=256 -max_shared_memory_per_block=16384 -max_threads_per_block=256 -texture_spatial_limit=16384 -thread_warp_size=1", "conv2d_nchwc.image2d", [["TENSOR", [1, 256, 9, 9], "float32"], ["TENSOR", [128, 256, 1, 1], "float32"], [1, 1], [0, 0, 0, 0], [1, 1], "float32"], {}], "config": {"index": 64400, "code_hash": null, "entity": [["tile_fc", "sp", [-1, 1, 2]], ["tile_y", "sp", [-1, 2, 3]], ["tile_x", "sp", [-1, 2, 6]], ["tile_rcc", "sp", [-1, 2]], ["tile_ry", "sp", [-1, 1]], ["tile_rx", "sp", [-1, 1]], ["auto_unroll_max_step", "ot", 1500], ["unroll_explicit", "ot", 0]]}, "result": [[6.065152000000001e-05], 0, 0.8119962215423584, 1684271636.4764774], "version": 0.2, "tvm_version": "0.13.dev0"}
{"input": ["opencl -keys=adreno,opencl,gpu -device=adreno -max_function_args=128 -max_num_threads=256 -max_shared_memory_per_block=16384 -max_threads_per_block=256 -texture_spatial_limit=16384 -thread_warp_size=1", "conv2d_nchwc.image2d", [["TENSOR", [1, 128, 9, 9], "float32"], ["TENSOR", [256, 128, 3, 3], "float32"], [1, 1], [0, 0, 0, 0], [1, 1], "float32"], {}], "config": {"index": 46071, "code_hash": null, "entity": [["tile_fc", "sp", [-1, 2, 8]], ["tile_y", "sp", [-1, 1, 8]], ["tile_x", "sp", [-1, 2, 2]], ["tile_rcc", "sp", [-1, 2]], ["tile_ry", "sp", [-1, 1]], ["tile_rx", "sp", [-1, 1]], ["auto_unroll_max_step", "ot", 512], ["unroll_explicit", "ot", 0]]}, "result": [[0.00017041408], 0, 1.587444543838501, 1684274033.5435405], "version": 0.2, "tvm_version": "0.13.dev0"}
{"input": ["opencl -keys=adreno,opencl,gpu -device=adreno -max_function_args=128 -max_num_threads=256 -max_shared_memory_per_block=16384 -max_threads_per_block=256 -texture_spatial_limit=16384 -thread_warp_size=1", "conv2d_nchw_winograd.image2d", [["TENSOR", [1, 128, 9, 9], "float32"], ["TENSOR", [256, 128, 3, 3], "float32"], [1, 1], [0, 0, 0, 0], [1, 1], "float32"], {}], "config": {"index": 2233, "code_hash": null, "entity": [["auto_unroll_max_step", "ot", 4], ["tile_y", "sp", [-1, 1, 16]], ["tile_x", "sp", [-1, 4, 4]], ["tile_rc", "sp", [-1, 16]]]}, "result": [[7.33696e-05], 0, 2.656935930252075, 1684274231.2834234], "version": 0.2, "tvm_version": "0.13.dev0"}
{"input": ["opencl -keys=adreno,opencl,gpu -device=adreno -max_function_args=128 -max_num_threads=256 -max_shared_memory_per_block=16384 -max_threads_per_block=256 -texture_spatial_limit=16384 -thread_warp_size=1", "conv2d_nchwc.image2d", [["TENSOR", [1, 256, 7, 7], "float32"], ["TENSOR", [16, 256, 3, 3], "float32"], [3, 3], [1, 1, 1, 1], [1, 1], "float32"], {}], "config": {"index": 13031, "code_hash": null, "entity": [["tile_fc", "sp", [-1, 1, 4]], ["tile_y", "sp", [-1, 1, 4]], ["tile_x", "sp", [-1, 1, 2]], ["tile_rcc", "sp", [-1, 2]], ["tile_ry", "sp", [-1, 3]], ["tile_rx", "sp", [-1, 1]], ["auto_unroll_max_step", "ot", 512], ["unroll_explicit", "ot", 1]]}, "result": [[0.00017092096], 0, 1.756699800491333, 1684275211.8191712], "version": 0.2, "tvm_version": "0.13.dev0"}
{"input": ["opencl -keys=adreno,opencl,gpu -device=adreno -max_function_args=128 -max_num_threads=256 -max_shared_memory_per_block=16384 -max_threads_per_block=256 -texture_spatial_limit=16384 -thread_warp_size=1", "conv2d_nchwc.image2d", [["TENSOR", [1, 256, 150, 150], "float32"], ["TENSOR", [324, 256, 3, 3], "float32"], [3, 3], [1, 1, 1, 1], [1, 1], "float32"], {}], "config": {"index": 37832, "code_hash": null, "entity": [["tile_fc", "sp", [-1, 3, 9]], ["tile_y", "sp", [-1, 1, 1]], ["tile_x", "sp", [-1, 4, 13]], ["tile_rcc", "sp", [-1, 4]], ["tile_ry", "sp", [-1, 3]], ["tile_rx", "sp", [-1, 3]], ["auto_unroll_max_step", "ot", 512], ["unroll_explicit", "ot", 0]]}, "result": [[0.00995704832], 0, 2.4052271842956543, 1684277124.3220024], "version": 0.2, "tvm_version": "0.13.dev0"}
{"input": ["opencl -keys=adreno,opencl,gpu -device=adreno -max_function_args=128 -max_num_threads=256 -max_shared_memory_per_block=16384 -max_threads_per_block=256 -texture_spatial_limit=16384 -thread_warp_size=1", "conv2d_nchwc.image2d", [["TENSOR", [1, 512, 75, 75], "float32"], ["TENSOR", [486, 512, 3, 3], "float32"], [3, 3], [1, 1, 1, 1], [1, 1], "float32"], {}], "config": {"index": 45838, "code_hash": null, "entity": [["tile_fc", "sp", [-1, 2, 61]], ["tile_y", "sp", [-1, 1, 4]], ["tile_x", "sp", [-1, 7, 2]], ["tile_rcc", "sp", [-1, 4]], ["tile_ry", "sp", [-1, 3]], ["tile_rx", "sp", [-1, 3]], ["auto_unroll_max_step", "ot", 512], ["unroll_explicit", "ot", 0]]}, "result": [[0.007022238720000001], 0, 1.9887185096740723, 1684280334.9764636], "version": 0.2, "tvm_version": "0.13.dev0"}
{"input": ["opencl -keys=adreno,opencl,gpu -device=adreno -max_function_args=128 -max_num_threads=256 -max_shared_memory_per_block=16384 -max_threads_per_block=256 -texture_spatial_limit=16384 -thread_warp_size=1", "conv2d_nchwc.image2d", [["TENSOR", [1, 512, 38, 38], "float32"], ["TENSOR", [486, 512, 3, 3], "float32"], [3, 3], [1, 1, 1, 1], [1, 1], "float32"], {}], "config": {"index": 74158, "code_hash": null, "entity": [["tile_fc", "sp", [-1, 2, 61]], ["tile_y", "sp", [-1, 8, 1]], ["tile_x", "sp", [-1, 1, 4]], ["tile_rcc", "sp", [-1, 64]], ["tile_ry", "sp", [-1, 3]], ["tile_rx", "sp", [-1, 3]], ["auto_unroll_max_step", "ot", 1500], ["unroll_explicit", "ot", 0]]}, "result": [[0.00208607232], 0, 2.52286434173584, 1684283197.3140411], "version": 0.2, "tvm_version": "0.13.dev0"}
{"input": ["opencl -keys=adreno,opencl,gpu -device=adreno -max_function_args=128 -max_num_threads=256 -max_shared_memory_per_block=16384 -max_threads_per_block=256 -texture_spatial_limit=16384 -thread_warp_size=1", "conv2d_nchwc.image2d", [["TENSOR", [1, 256, 19, 19], "float32"], ["TENSOR", [486, 256, 3, 3], "float32"], [3, 3], [1, 1, 1, 1], [1, 1], "float32"], {}], "config": {"index": 25493, "code_hash": null, "entity": [["tile_fc", "sp", [-1, 1, 61]], ["tile_y", "sp", [-1, 8, 1]], ["tile_x", "sp", [-1, 1, 4]], ["tile_rcc", "sp", [-1, 1]], ["tile_ry", "sp", [-1, 3]], ["tile_rx", "sp", [-1, 1]], ["auto_unroll_max_step", "ot", 1500], ["unroll_explicit", "ot", 0]]}, "result": [[0.00068479488], 0, 0.9088425636291504, 1684284950.5778584], "version": 0.2, "tvm_version": "0.13.dev0"}
{"input": ["opencl -keys=adreno,opencl,gpu -device=adreno -max_function_args=128 -max_num_threads=256 -max_shared_memory_per_block=16384 -max_threads_per_block=256 -texture_spatial_limit=16384 -thread_warp_size=1", "conv2d_nchwc.image2d", [["TENSOR", [1, 256, 9, 9], "float32"], ["TENSOR", [324, 256, 3, 3], "float32"], [3, 3], [1, 1, 1, 1], [1, 1], "float32"], {}], "config": {"index": 39197, "code_hash": null, "entity": [["tile_fc", "sp", [-1, 1, 3]], ["tile_y", "sp", [-1, 1, 4]], ["tile_x", "sp", [-1, 1, 4]], ["tile_rcc", "sp", [-1, 2]], ["tile_ry", "sp", [-1, 3]], ["tile_rx", "sp", [-1, 1]], ["auto_unroll_max_step", "ot", 512], ["unroll_explicit", "ot", 1]]}, "result": [[0.00026238464], 0, 1.8926241397857666, 1684285905.8498755], "version": 0.2, "tvm_version": "0.13.dev0"}
{"input": ["opencl -keys=adreno,opencl,gpu -device=adreno -max_function_args=128 -max_num_threads=256 -max_shared_memory_per_block=16384 -max_threads_per_block=256 -texture_spatial_limit=16384 -thread_warp_size=1", "conv2d_nchwc.image2d", [["TENSOR", [1, 256, 7, 7], "float32"], ["TENSOR", [324, 256, 3, 3], "float32"], [3, 3], [1, 1, 1, 1], [1, 1], "float32"], {}], "config": {"index": 38929, "code_hash": null, "entity": [["tile_fc", "sp", [-1, 1, 9]], ["tile_y", "sp", [-1, 1, 4]], ["tile_x", "sp", [-1, 1, 1]], ["tile_rcc", "sp", [-1, 2]], ["tile_ry", "sp", [-1, 3]], ["tile_rx", "sp", [-1, 1]], ["auto_unroll_max_step", "ot", 512], ["unroll_explicit", "ot", 1]]}, "result": [[0.00027062784], 0, 0.9202005863189697, 1684286969.4810672], "version": 0.2, "tvm_version": "0.13.dev0"}
{"input": ["opencl -keys=adreno,opencl,gpu -device=adreno -max_function_args=128 -max_num_threads=256 -max_shared_memory_per_block=16384 -max_threads_per_block=256 -texture_spatial_limit=16384 -thread_warp_size=1", "conv2d_nchwc.image2d", [["TENSOR", [1, 3, 1200, 1200], "float32"], ["TENSOR", [64, 3, 7, 7], "float32"], [2, 2], [3, 3, 3, 3], [1, 1], "float32"], {}], "config": {"index": 88318, "code_hash": null, "entity": [["tile_fc", "sp", [-1, 2, 8]], ["tile_y", "sp", [-1, 2, 2]], ["tile_x", "sp", [-1, 3, 4]], ["tile_rcc", "sp", [-1, 1]], ["tile_ry", "sp", [-1, 7]], ["tile_rx", "sp", [-1, 7]], ["auto_unroll_max_step", "ot", 0], ["unroll_explicit", "ot", 0]]}, "result": [[0.0124229376], 0, 6.609227895736694, 1684437402.2739134], "version": 0.2, "tvm_version": "0.13.dev0"}
{"input": ["opencl -keys=adreno,opencl,gpu -device=adreno -max_function_args=128 -max_num_threads=256 -max_shared_memory_per_block=16384 -max_threads_per_block=256 -texture_spatial_limit=16384 -thread_warp_size=1", "conv2d_nchwc.image2d", [["TENSOR", [1, 3, 800, 800], "float32"], ["TENSOR", [64, 3, 7, 7], "float32"], [2, 2], [3, 3, 3, 3], [1, 1], "float32"], {}], "config": {"index": 113168, "code_hash": null, "entity": [["tile_fc", "sp", [-1, 2, 8]], ["tile_y", "sp", [-1, 2, 2]], ["tile_x", "sp", [-1, 5, 4]], ["tile_rcc", "sp", [-1, 1]], ["tile_ry", "sp", [-1, 7]], ["tile_rx", "sp", [-1, 1]], ["auto_unroll_max_step", "ot", 0], ["unroll_explicit", "ot", 1]]}, "result": [[0.00574153216], 0, 2.0616021156311035, 1684442547.586794], "version": 0.2, "tvm_version": "0.13.dev0"}
{"input": ["opencl -keys=adreno,opencl,gpu -device=adreno -max_function_args=128 -max_num_threads=256 -max_shared_memory_per_block=16384 -max_threads_per_block=256 -texture_spatial_limit=16384 -thread_warp_size=1", "conv2d_nchwc.image2d", [["TENSOR", [1, 64, 200, 200], "float32"], ["TENSOR", [64, 64, 1, 1], "float32"], [1, 1], [0, 0, 0, 0], [1, 1], "float32"], {}], "config": {"index": 61509, "code_hash": null, "entity": [["tile_fc", "sp", [-1, 1, 16]], ["tile_y", "sp", [-1, 1, 4]], ["tile_x", "sp", [-1, 4, 5]], ["tile_rcc", "sp", [-1, 2]], ["tile_ry", "sp", [-1, 1]], ["tile_rx", "sp", [-1, 1]], ["auto_unroll_max_step", "ot", 1500], ["unroll_explicit", "ot", 0]]}, "result": [[0.00134426624], 0, 2.225370168685913, 1684444234.36763], "version": 0.2, "tvm_version": "0.13.dev0"}
{"input": ["opencl -keys=adreno,opencl,gpu -device=adreno -max_function_args=128 -max_num_threads=256 -max_shared_memory_per_block=16384 -max_threads_per_block=256 -texture_spatial_limit=16384 -thread_warp_size=1", "conv2d_nchwc.image2d", [["TENSOR", [1, 64, 200, 200], "float32"], ["TENSOR", [64, 64, 3, 3], "float32"], [1, 1], [1, 1, 1, 1], [1, 1], "float32"], {}], "config": {"index": 240599, "code_hash": null, "entity": [["tile_fc", "sp", [-1, 1, 16]], ["tile_y", "sp", [-1, 2, 1]], ["tile_x", "sp", [-1, 5, 4]], ["tile_rcc", "sp", [-1, 1]], ["tile_ry", "sp", [-1, 3]], ["tile_rx", "sp", [-1, 1]], ["auto_unroll_max_step", "ot", 1500], ["unroll_explicit", "ot", 0]]}, "result": [[0.0044643584], 0, 3.3626816272735596, 1684448630.7402418], "version": 0.2, "tvm_version": "0.13.dev0"}
{"input": ["opencl -keys=adreno,opencl,gpu -device=adreno -max_function_args=128 -max_num_threads=256 -max_shared_memory_per_block=16384 -max_threads_per_block=256 -texture_spatial_limit=16384 -thread_warp_size=1", "conv2d_nchw_winograd.image2d", [["TENSOR", [1, 64, 200, 200], "float32"], ["TENSOR", [64, 64, 3, 3], "float32"], [1, 1], [1, 1, 1, 1], [1, 1], "float32"], {}], "config": {"index": 2559, "code_hash": null, "entity": [["auto_unroll_max_step", "ot", 0], ["tile_y", "sp", [-1, 2, 8]], ["tile_x", "sp", [-1, 5, 4]], ["tile_rc", "sp", [-1, 8]]]}, "result": [[0.0076785152], 0, 6.1778693199157715, 1684450774.805925], "version": 0.2, "tvm_version": "0.13.dev0"}
{"input": ["opencl -keys=adreno,opencl,gpu -device=adreno -max_function_args=128 -max_num_threads=256 -max_shared_memory_per_block=16384 -max_threads_per_block=256 -texture_spatial_limit=16384 -thread_warp_size=1", "conv2d_nchwc.image2d", [["TENSOR", [1, 64, 200, 200], "float32"], ["TENSOR", [256, 64, 1, 1], "float32"], [1, 1], [0, 0, 0, 0], [1, 1], "float32"], {}], "config": {"index": 39977, "code_hash": null, "entity": [["tile_fc", "sp", [-1, 1, 64]], ["tile_y", "sp", [-1, 1, 5]], ["tile_x", "sp", [-1, 8, 1]], ["tile_rcc", "sp", [-1, 16]], ["tile_ry", "sp", [-1, 1]], ["tile_rx", "sp", [-1, 1]], ["auto_unroll_max_step", "ot", 0], ["unroll_explicit", "ot", 0]]}, "result": [[0.00378815488], 0, 1.4842112064361572, 1684455593.7859173], "version": 0.2, "tvm_version": "0.13.dev0"}
{"input": ["opencl -keys=adreno,opencl,gpu -device=adreno -max_function_args=128 -max_num_threads=256 -max_shared_memory_per_block=16384 -max_threads_per_block=256 -texture_spatial_limit=16384 -thread_warp_size=1", "conv2d_nchwc.image2d", [["TENSOR", [1, 256, 200, 200], "float32"], ["TENSOR", [128, 256, 1, 1], "float32"], [2, 2], [0, 0, 0, 0], [1, 1], "float32"], {}], "config": {"index": 146536, "code_hash": null, "entity": [["tile_fc", "sp", [-1, 2, 16]], ["tile_y", "sp", [-1, 4, 1]], ["tile_x", "sp", [-1, 2, 10]], ["tile_rcc", "sp", [-1, 32]], ["tile_ry", "sp", [-1, 1]], ["tile_rx", "sp", [-1, 1]], ["auto_unroll_max_step", "ot", 1500], ["unroll_explicit", "ot", 1]]}, "result": [[0.0037167872], 0, 8.044687032699585, 1684456654.8327854], "version": 0.2, "tvm_version": "0.13.dev0"}
{"input": ["opencl -keys=adreno,opencl,gpu -device=adreno -max_function_args=128 -max_num_threads=256 -max_shared_memory_per_block=16384 -max_threads_per_block=256 -texture_spatial_limit=16384 -thread_warp_size=1", "conv2d_nchwc.image2d", [["TENSOR", [1, 128, 100, 100], "float32"], ["TENSOR", [128, 128, 3, 3], "float32"], [1, 1], [1, 1, 1, 1], [1, 1], "float32"], {}], "config": {"index": 109395, "code_hash": null, "entity": [["tile_fc", "sp", [-1, 1, 32]], ["tile_y", "sp", [-1, 2, 2]], ["tile_x", "sp", [-1, 5, 4]], ["tile_rcc", "sp", [-1, 1]], ["tile_ry", "sp", [-1, 3]], ["tile_rx", "sp", [-1, 1]], ["auto_unroll_max_step", "ot", 512], ["unroll_explicit", "ot", 0]]}, "result": [[0.00423272448], 0, 3.148724317550659, 1684462339.06832], "version": 0.2, "tvm_version": "0.13.dev0"}
{"input": ["opencl -keys=adreno,opencl,gpu -device=adreno -max_function_args=128 -max_num_threads=256 -max_shared_memory_per_block=16384 -max_threads_per_block=256 -texture_spatial_limit=16384 -thread_warp_size=1", "conv2d_nchw_winograd.image2d", [["TENSOR", [1, 128, 100, 100], "float32"], ["TENSOR", [128, 128, 3, 3], "float32"], [1, 1], [1, 1, 1, 1], [1, 1], "float32"], {}], "config": {"index": 1376, "code_hash": null, "entity": [["auto_unroll_max_step", "ot", 16], ["tile_y", "sp", [-1, 2, 16]], ["tile_x", "sp", [-1, 5, 4]], ["tile_rc", "sp", [-1, 2]]]}, "result": [[0.0055172710400000005], 0, 2.385718584060669, 1684463606.0107925], "version": 0.2, "tvm_version": "0.13.dev0"}
{"input": ["opencl -keys=adreno,opencl,gpu -device=adreno -max_function_args=128 -max_num_threads=256 -max_shared_memory_per_block=16384 -max_threads_per_block=256 -texture_spatial_limit=16384 -thread_warp_size=1", "conv2d_nchwc.image2d", [["TENSOR", [1, 128, 100, 100], "float32"], ["TENSOR", [512, 128, 1, 1], "float32"], [1, 1], [0, 0, 0, 0], [1, 1], "float32"], {}], "config": {"index": 14848, "code_hash": null, "entity": [["tile_fc", "sp", [-1, 2, 64]], ["tile_y", "sp", [-1, 4, 1]], ["tile_x", "sp", [-1, 2, 5]], ["tile_rcc", "sp", [-1, 4]], ["tile_ry", "sp", [-1, 1]], ["tile_rx", "sp", [-1, 1]], ["auto_unroll_max_step", "ot", 0], ["unroll_explicit", "ot", 0]]}, "result": [[0.0025356492800000002], 0, 1.3368175029754639, 1684467547.3133702], "version": 0.2, "tvm_version": "0.13.dev0"}
{"input": ["opencl -keys=adreno,opencl,gpu -device=adreno -max_function_args=128 -max_num_threads=256 -max_shared_memory_per_block=16384 -max_threads_per_block=256 -texture_spatial_limit=16384 -thread_warp_size=1", "conv2d_nchwc.image2d", [["TENSOR", [1, 256, 200, 200], "float32"], ["TENSOR", [512, 256, 1, 1], "float32"], [2, 2], [0, 0, 0, 0], [1, 1], "float32"], {}], "config": {"index": 108832, "code_hash": null, "entity": [["tile_fc", "sp", [-1, 2, 64]], ["tile_y", "sp", [-1, 4, 1]], ["tile_x", "sp", [-1, 2, 2]], ["tile_rcc", "sp", [-1, 32]], ["tile_ry", "sp", [-1, 1]], ["tile_rx", "sp", [-1, 1]], ["auto_unroll_max_step", "ot", 1500], ["unroll_explicit", "ot", 0]]}, "result": [[0.00717303808], 0, 4.6126415729522705, 1684470034.9215515], "version": 0.2, "tvm_version": "0.13.dev0"}
{"input": ["opencl -keys=adreno,opencl,gpu -device=adreno -max_function_args=128 -max_num_threads=256 -max_shared_memory_per_block=16384 -max_threads_per_block=256 -texture_spatial_limit=16384 -thread_warp_size=1", "conv2d_nchwc.image2d", [["TENSOR", [1, 512, 100, 100], "float32"], ["TENSOR", [128, 512, 1, 1], "float32"], [1, 1], [0, 0, 0, 0], [1, 1], "float32"], {}], "config": {"index": 130268, "code_hash": null, "entity": [["tile_fc", "sp", [-1, 2, 16]], ["tile_y", "sp", [-1, 5, 4]], ["tile_x", "sp", [-1, 2, 2]], ["tile_rcc", "sp", [-1, 16]], ["tile_ry", "sp", [-1, 1]], ["tile_rx", "sp", [-1, 1]], ["auto_unroll_max_step", "ot", 512], ["unroll_explicit", "ot", 1]]}, "result": [[0.00354840064], 0, 1.5881459712982178, 1684472581.1257217], "version": 0.2, "tvm_version": "0.13.dev0"}
{"input": ["opencl -keys=adreno,opencl,gpu -device=adreno -max_function_args=128 -max_num_threads=256 -max_shared_memory_per_block=16384 -max_threads_per_block=256 -texture_spatial_limit=16384 -thread_warp_size=1", "conv2d_nchwc.image2d", [["TENSOR", [1, 512, 100, 100], "float32"], ["TENSOR", [256, 512, 1, 1], "float32"], [2, 2], [0, 0, 0, 0], [1, 1], "float32"], {}], "config": {"index": 42982, "code_hash": null, "entity": [["tile_fc", "sp", [-1, 2, 32]], ["tile_y", "sp", [-1, 4, 1]], ["tile_x", "sp", [-1, 2, 2]], ["tile_rcc", "sp", [-1, 32]], ["tile_ry", "sp", [-1, 1]], ["tile_rx", "sp", [-1, 1]], ["auto_unroll_max_step", "ot", 0], ["unroll_explicit", "ot", 1]]}, "result": [[0.0025003673599999997], 0, 2.865793228149414, 1684475372.122082], "version": 0.2, "tvm_version": "0.13.dev0"}
{"input": ["opencl -keys=adreno,opencl,gpu -device=adreno -max_function_args=128 -max_num_threads=256 -max_shared_memory_per_block=16384 -max_threads_per_block=256 -texture_spatial_limit=16384 -thread_warp_size=1", "conv2d_nchw_winograd.image2d", [["TENSOR", [1, 256, 50, 50], "float32"], ["TENSOR", [256, 256, 3, 3], "float32"], [1, 1], [1, 1, 1, 1], [1, 1], "float32"], {}], "config": {"index": 2397, "code_hash": null, "entity": [["auto_unroll_max_step", "ot", 0], ["tile_y", "sp", [-1, 1, 64]], ["tile_x", "sp", [-1, 5, 1]], ["tile_rc", "sp", [-1, 32]]]}, "result": [[0.0042039296000000006], 0, 2.1172802448272705, 1684479269.427378], "version": 0.2, "tvm_version": "0.13.dev0"}
{"input": ["opencl -keys=adreno,opencl,gpu -device=adreno -max_function_args=128 -max_num_threads=256 -max_shared_memory_per_block=16384 -max_threads_per_block=256 -texture_spatial_limit=16384 -thread_warp_size=1", "conv2d_nchwc.image2d", [["TENSOR", [1, 256, 50, 50], "float32"], ["TENSOR", [1024, 256, 1, 1], "float32"], [1, 1], [0, 0, 0, 0], [1, 1], "float32"], {}], "config": {"index": 40117, "code_hash": null, "entity": [["tile_fc", "sp", [-1, 2, 32]], ["tile_y", "sp", [-1, 4, 1]], ["tile_x", "sp", [-1, 2, 13]], ["tile_rcc", "sp", [-1, 32]], ["tile_ry", "sp", [-1, 1]], ["tile_rx", "sp", [-1, 1]], ["auto_unroll_max_step", "ot", 1500], ["unroll_explicit", "ot", 0]]}, "result": [[0.0026281932799999998], 0, 2.745265245437622, 1684481281.616033], "version": 0.2, "tvm_version": "0.13.dev0"}
{"input": ["opencl -keys=adreno,opencl,gpu -device=adreno -max_function_args=128 -max_num_threads=256 -max_shared_memory_per_block=16384 -max_threads_per_block=256 -texture_spatial_limit=16384 -thread_warp_size=1", "conv2d_nchwc.image2d", [["TENSOR", [1, 512, 100, 100], "float32"], ["TENSOR", [1024, 512, 1, 1], "float32"], [2, 2], [0, 0, 0, 0], [1, 1], "float32"], {}], "config": {"index": 11771, "code_hash": null, "entity": [["tile_fc", "sp", [-1, 2, 64]], ["tile_y", "sp", [-1, 4, 1]], ["tile_x", "sp", [-1, 2, 13]], ["tile_rcc", "sp", [-1, 32]], ["tile_ry", "sp", [-1, 1]], ["tile_rx", "sp", [-1, 1]], ["auto_unroll_max_step", "ot", 0], ["unroll_explicit", "ot", 0]]}, "result": [[0.0064682444799999995], 0, 4.127723693847656, 1684484484.384872], "version": 0.2, "tvm_version": "0.13.dev0"}
{"input": ["opencl -keys=adreno,opencl,gpu -device=adreno -max_function_args=128 -max_num_threads=256 -max_shared_memory_per_block=16384 -max_threads_per_block=256 -texture_spatial_limit=16384 -thread_warp_size=1", "conv2d_nchwc.image2d", [["TENSOR", [1, 1024, 50, 50], "float32"], ["TENSOR", [256, 1024, 1, 1], "float32"], [1, 1], [0, 0, 0, 0], [1, 1], "float32"], {}], "config": {"index": 61936, "code_hash": null, "entity": [["tile_fc", "sp", [-1, 2, 32]], ["tile_y", "sp", [-1, 4, 1]], ["tile_x", "sp", [-1, 2, 2]], ["tile_rcc", "sp", [-1, 64]], ["tile_ry", "sp", [-1, 1]], ["tile_rx", "sp", [-1, 1]], ["auto_unroll_max_step", "ot", 512], ["unroll_explicit", "ot", 1]]}, "result": [[0.00342020608], 0, 1.3501975536346436, 1684485828.8871238], "version": 0.2, "tvm_version": "0.13.dev0"}
{"input": ["opencl -keys=adreno,opencl,gpu -device=adreno -max_function_args=128 -max_num_threads=256 -max_shared_memory_per_block=16384 -max_threads_per_block=256 -texture_spatial_limit=16384 -thread_warp_size=1", "conv2d_nchwc.image2d", [["TENSOR", [1, 1024, 50, 50], "float32"], ["TENSOR", [512, 1024, 1, 1], "float32"], [2, 2], [0, 0, 0, 0], [1, 1], "float32"], {}], "config": {"index": 71557, "code_hash": null, "entity": [["tile_fc", "sp", [-1, 2, 16]], ["tile_y", "sp", [-1, 1, 2]], ["tile_x", "sp", [-1, 7, 4]], ["tile_rcc", "sp", [-1, 128]], ["tile_ry", "sp", [-1, 1]], ["tile_rx", "sp", [-1, 1]], ["auto_unroll_max_step", "ot", 512], ["unroll_explicit", "ot", 0]]}, "result": [[0.00187222528], 0, 2.4266304969787598, 1684487987.315317], "version": 0.2, "tvm_version": "0.13.dev0"}
{"input": ["opencl -keys=adreno,opencl,gpu -device=adreno -max_function_args=128 -max_num_threads=256 -max_shared_memory_per_block=16384 -max_threads_per_block=256 -texture_spatial_limit=16384 -thread_warp_size=1", "conv2d_nchwc.image2d", [["TENSOR", [1, 512, 25, 25], "float32"], ["TENSOR", [512, 512, 3, 3], "float32"], [1, 1], [1, 1, 1, 1], [1, 1], "float32"], {}], "config": {"index": 209041, "code_hash": null, "entity": [["tile_fc", "sp", [-1, 1, 64]], ["tile_y", "sp", [-1, 1, 7]], ["tile_x", "sp", [-1, 7, 2]], ["tile_rcc", "sp", [-1, 1]], ["tile_ry", "sp", [-1, 1]], ["tile_rx", "sp", [-1, 3]], ["auto_unroll_max_step", "ot", 512], ["unroll_explicit", "ot", 0]]}, "result": [[0.005453009919999999], 0, 1.6283771991729736, 1684494924.4103954], "version": 0.2, "tvm_version": "0.13.dev0"}
{"input": ["opencl -keys=adreno,opencl,gpu -device=adreno -max_function_args=128 -max_num_threads=256 -max_shared_memory_per_block=16384 -max_threads_per_block=256 -texture_spatial_limit=16384 -thread_warp_size=1", "conv2d_nchw_winograd.image2d", [["TENSOR", [1, 512, 25, 25], "float32"], ["TENSOR", [512, 512, 3, 3], "float32"], [1, 1], [1, 1, 1, 1], [1, 1], "float32"], {}], "config": {"index": 1910, "code_hash": null, "entity": [["auto_unroll_max_step", "ot", 16], ["tile_y", "sp", [-1, 1, 64]], ["tile_x", "sp", [-1, 13, 1]], ["tile_rc", "sp", [-1, 32]]]}, "result": [[0.00599510528], 0, 4.729097604751587, 1684495947.6472461], "version": 0.2, "tvm_version": "0.13.dev0"}
{"input": ["opencl -keys=adreno,opencl,gpu -device=adreno -max_function_args=128 -max_num_threads=256 -max_shared_memory_per_block=16384 -max_threads_per_block=256 -texture_spatial_limit=16384 -thread_warp_size=1", "conv2d_nchwc.image2d", [["TENSOR", [1, 512, 25, 25], "float32"], ["TENSOR", [2048, 512, 1, 1], "float32"], [1, 1], [0, 0, 0, 0], [1, 1], "float32"], {}], "config": {"index": 118161, "code_hash": null, "entity": [["tile_fc", "sp", [-1, 2, 8]], ["tile_y", "sp", [-1, 7, 4]], ["tile_x", "sp", [-1, 1, 2]], ["tile_rcc", "sp", [-1, 64]], ["tile_ry", "sp", [-1, 1]], ["tile_rx", "sp", [-1, 1]], ["auto_unroll_max_step", "ot", 1500], ["unroll_explicit", "ot", 0]]}, "result": [[0.0023839539199999996], 0, 2.487464189529419, 1684499681.1952052], "version": 0.2, "tvm_version": "0.13.dev0"}
